title,selftext,created_utc,score,total_awards_received
Student Housing,"I have been online for the first semester, but am considering housing. Is it still possible to apply for student housing for this upcoming spring semester or is it all full?",1639795016,1,0
Grade Bin Shifts,How do grade bin shifts get announced? Are they posted through an announcement typically and when do we get these grade bin shifts announced usually? — right after the final exam results are released or later? In specific I am discussing chem 4A!,1639795006,1,0
How doable is this schedule for next semester?,"CS61A, Chem 1A+1AL, R1B, and EECS16a. Be honest, is this the end for me???",1639793686,1,0
Such a liberating feeling,,1639786945,1,0
"Anyone else enjoy their major, but keep failing exams/finals?","Hope everyone's done with finals and enjoying their break now :D

Just something I wanna get off my chest, I really hope I'm not alone here lol. I'm currently a junior in College of Engineering, and I'm def not doing great if you look at my transcript. So far I've been doing poorly on midterms and finals every semester, but way better on homework and projects.

I love my major and I'm passionate about it, but it's off-putting when I look at my grades at the end of the day and they're consistently below Bs. It doesn't bother me to the point where I would change my major, but it does make me feel like maybe I'm too stupid for the academic rigor at Berkeley. I know it's supposed to be tough here, but it seems like everyone around me is so smart and capable.

Yes, I'm aware that in 10 years, college GPA will be irrelevant, and yes, I'm aware that it would be wrong to abandon my passion solely because I'm not a good test taker, but it really do be demoralizing out here.

Anyone feel the same?",1639785212,1,0
what are you doing over break,"i’m not going home until next week so now i’m just stuck here with nothing to do, but i’m very excited to go home and see my pets

also may or may not be continuously refreshing gradescope and bcourses even though theres no way my finals will be graded that quickly",1639783975,1,0
16b final reaction,"How hard was it

[View Poll](https://www.reddit.com/poll/ritegk)",1639782677,1,0
Summer study abroad experiences?,"Hi! If you have participated in a Berkeley summer study abroad session, I would love to hear your feedback. Let me know if you have any recommendations or regrets about program length! 

I’m hoping to study abroad through UCEAP in Europe this summer, currently considering Berlin, Florence, and Maastricht, among others that offer humanities/social sciences oriented curriculum (not looking for major credit or anything, though).

Thank you &amp; go bears :-)",1639782269,1,0
Why should I go to the gym?,"I’m back for more it seems. I’m feeling honest with myself today and will admit that the way I view the gym, and especially people that go to the gym, is probably not very logical (not every person at the gym is a water jug-lugging muscle dummy; I know it’s dumb). But I feel like there is this weird aura of faulty potential maximization I get from the gym and it’s attendees; “if I get stronger physically then that would boost my self confidence” which, PSA, makes NO sense to me (those of you that read my last post will know how I feel about this). Rather than going on a rant about my one-sided perspective, I’d like to ask if anybody would like to share their perspective on what going to the gym looked like for them and how they got to the point where the thought of “ok, I want to workout” was present in your minds. Thanks y’all :)!",1639782033,1,0
Booster woes,"Was going to get a booster today but my last final is due and I’d really prefer to keep working on that.

I was hoping to get my booster to feel more comfortable visiting family over the holidays (older folks and babies and all) but now not sure…anyone know where I could possibly get a Pfizer booster by next Tuesday?",1639781961,1,0
Fall 2021 commencement tomorrow: where is gate 9 at haas pavilion?,"Is that behind haas pavilion? I’ve only ever entered the building through the main entrance like once during GBO and that was 3.5 years ago so I have no idea where any of the gates are. An email sent out said it’s near evans diamond, so I’m assuming it’s near the back but I just wanted to make sure so I’m not awkwardly wandering around. Thanks!",1639781153,1,0
"How Doable Is This Schedule? CS61C, EECS16B, DATA 100, and COGSCI 131?",I’m trying to graduate early since I’m OOS and tuition is expensive.,1639780396,1,0
Curve prediction for math 1a,"I got a cold before the final which led to a waaaayyyy worse grade on the final that weighted 45% (!!). It is approximately on the 77/78 percentile. Honestly speaking I received full marks on problem sets(20%). Top tenth/even fifth on previous 2 midterms(15% and 20% respectively).

The professor said he will usually assign 25% A. Will my previous performance still be able to be considered a solid A? Or does anyone in this class have any guess about the final curve?

I have no clue about this, which makes me feel really insecure and I believe my other classes' final results will be shitty af.",1639778943,1,0
16a bin shift?,How likely is it considering the final averages and what they've done in the past? Need 2.5 more points for the A :/,1639776658,1,0
Boomed so hard in CS61A final,,1639776614,1,0
16a bin shift lol,"i've heard that in the past they secretly shift the bins afterwards?? does anyone know by how much approx? like if u had a grade that got shifted up how much was it by?

ty

\- a hopeful bear",1639775775,1,0
Most likely Failed 16B (Academic Probation),Hi I am a sophmore (eecs) and I most likely failed 16B because I screwed up majorly on the final. I will most likely be put on academic probabtion because my semester gpa is &lt; 2.0 and my upperdivision gpa is less than 2.0 (I also took an upperdivision eecs class and didn't do well either). I was overloaded and underprepared. My overall and technical gpa is &gt; 2. Will I still be able be able to continue eecs or I am kicked out because I severely misjudged the situation and do so bad?,1639774306,1,0
Fr like?? 🤨🤨🤨,,1639773863,1,0
$$$ cash 💰💰💰 for your 🖨️ printing credits $$$,"Do you have $100+ in unused printing credits?

Want to sell it to me for $20?

Meet me at your department's computer lab, I'll hand you $20, and you print 1000+ pages for me. Once the print job starts you can leave. The whole thing should take less than 5 minutes. Easiest $20 you'll ever make. Text me 5 one zero 5 nine 8 9 2 four nine.",1639773744,1,0
S22 attack on titan class,anyone taking that dcal about attack on titan lol,1639773741,1,0
No room for 4 nights before start of next semester 💀,"I'm a spring exchange student and my flight arrives 4 days before my residence's move-in date. They said they had no problem accommodating early arrivals, but today they sent out an email saying they are unable to do so, leaving me without accommodation for 4 nights in Berkeley. Do you have any suggestions or recommendations about what to do? Thanks!",1639772572,1,0
cs70 final grade,i got -1.4 sd on the midterm and -1.27 on the final and i did the no hw option. do you think i passed the class,1639772298,1,0
Question,So I was lucky enough to get a FAANG internship this summer but I’m worried that there could be a chance that they  might cancel since I’m 99% sure I got an F in 16B. Would failing a class cause me to lose my internship,1639771799,1,0
Chem 3A,Final exam grades have come out and I ended O-chem with a solid B. Of course I was hoping for an A but I am honestly so proud of my self and the work that I put into getting that grade with no curves this semester. There’s a lot of hate that gets spewed at Robak but she honestly is really good at teaching and I’m excited to take on 3b next semester!,1639771367,1,0
16b Anime Comeback Update,"Hello friends,

the 16b final just finished, and I am happy to say that I'm 50/50 between on getting the D- or not. I certainly did better than the midterm which i absolutely bombed with a 20 percent, but I'm not sure if I reached the needed points. 

&amp;#x200B;

The last week i grinded from 9am to 10pm everyday, watched and took notes on every discussion, redid the midterm, did the two finals, and looked at the review sessions. its amazing what the human brain can learn with enough pressure. Went from not even knowing what the words on the test meant to actually having some understanding of what's going on. Good luck everyone on passing this class!",1639770681,1,0
16B COPE THREAD,"GRADE BIN BELIEVERS
ADJUSTMENT FACTOR BELIEVERS
DENOMINATOR CHANGE BELIEVERS
CURVE BELIEVERS
GLOBAL EC BELIEVERS",1639769899,1,0
EE16B FINAL,"Holisheet, I'll suck any D for a D-, starting from now!",1639768902,1,0
Is math 1a curved?,Not ready for this final and even the midterms sucked. Only a curve can save me but idk.,1639768841,1,0
Data 140 final,What did everyone think? I thought it was crazy hard,1639768583,1,0
Just venting because I failed my exam and I'm probably getting dismissed,[removed],1639767586,1,0
Dumpster,Urgently need to dump sizable amount of trash before I leave. Where to do it? I’m in north berkeley,1639766568,1,0
Applying LSCS or EECS with the funding crisis?,"Hi! I’m a high school senior, and Cal is one of my top choices (so I really don’t want to be rejected…:(.

Initially, I was planning to apply LSCS here, which I believe I would have a pretty good shot into. But, I’ve been hearing that LSCS might not even be an option anymore with the funding crisis.

Wondering if there’s been an update on this, and whether if I want to pursue CS/FAANG, would it be better to just apply EECS and potentially get rejected, or apply LSCS and get in?

Thanks, any advice would help.",1637787750,1,0
How Cigarettes Affect Your Health,,1637785643,1,0
Do I need LaTeX for physics?,[removed],1637784709,1,0
Fun MechE Classes,"I'm right now a CS major, but I'm looking for some cool MechE classes to take. I've taken E26, and my interests lay mostly in aerospace and modeling. Does anyone have any recommendations for fun UD ME classes to take? (doesn't necessarily have to be related to interests of mine but also just in general)",1637784679,1,0
How have budget issues affected the admissions into the CS program,"I am a high school student applying to UC Berkeley in the next five days. My intended major is computer science and I am pretty sure that it is what I want to do. 

I just read about the budget cuts that computer science in facing. Would this severly impact admissions into EECS or L&amp;S CS? Would either of these programs be impacted less? 

I was leaning towards applying to L&amp;S CS due to EECS's competitive admissions however I might change my mind if L&amp;S were going to raise there already 3.3 GPA requirement even higher. Should I apply EECS?",1637783008,1,0
Very specific citation question for essay - not sure where else to ask,"I'm an English major with an essay due today. It's done, ofc, but I am running into a wall with a citation problem. I've been to office hours, I've asked around, and I'm still stuck.

I have a quote as a hook at the very beginning of my essay:

Ralph Waldo Emerson once wrote, ""fiction reveals truth that reality obscures"".

It hung in my high school on posters in my English classrooms, it's been in books of famous quotes, and I've found countless results for it on Google listing Emerson as the originator. But nobody seems to be able to tell me where it actually came from. A speech? A book? An essay? Something he shouted to a friend in passing on a random Sunday afternoon? 

The last thing in the world I want to do is accidentally plagiarize, and it's in there that EMERSON, not I, said those words. I just have no idea how to add a citation or footnote with the original source if I cannot find the original source. Do I even need to add anything more? Am I totally overthinking this?

Any fellow English majors (or really, anyone in the Humanities who's dealt with something like this) know what to do here? The whole essay strongly connects to that quote, so I don't want to scrap it, but how the heck do I cite it?",1637782713,1,0
Where have people found good psych/ therapists?,"I have ADHD and anxiety and have been getting meds from a local clinic, where I used to live. It’s been kind of a nightmare trying to establish care with their new doc and besides, they’re a low income clinic designed for their community so, since I don’t live there and have insurance now, I feel like it’s best to find a new provider.

Beyond meds, I also am looking into getting a therapist. 

I spoke with a psych from CAPS and know my options- however, this is my first semester at Berkeley, I have adhd and have not had the bandwidth to make the phone calls and weed through the list. I’m wondering if anyone has any recs? I’m queer and neurodivergent and am seeking a professional familiar with or in these communities.

any advice on getting through this process?

It’s doubly hard NOT having my adhd meds to help with this process.

Any insight or recommendations welcome!",1637779564,1,0
berkeley LOCIs,"does anyone know whether the uc berkeley admissions committee actually reads letters of continued interest? i was waitlisted last year and am reapplying again this year. i'd like to resubmit my letter as part of my application. i know that submitting the same essay twice is taboo, but berkeley waitlists so many people that i wouldn't be surprised if they don't read all (or any) of the LOCIs they get, lol. 

any insight is much appreciated!",1637779095,1,0
"Not so prestigious after all, huh?",,1637776654,1,0
Anyone want to meet up at illenium today?,"Me and two berkeley students are in the mood to make some new friends at the concert. We like to dance (not pros lol), be silly and are guys over 21. Post or dm if you’ll be there and want to meet up! If not, all good, I hope you guys have a wonderful day :)",1637775484,1,0
Got waitlisted for eecs16b,"Title. I'm on position 269 rn and got a bit worried, since I'm already a sophomore. Didn't enroll during phase 1 because I forgot about the unit cap. Anyone knows about how many people will drop this class afterwards so that I can get in? Or will they just accept people on the waitlist? Thanks.",1637774539,1,0
Is it harder for a Berkeley student who is not a US citizen/permanent resident to join ML/AI labs?,"Are there any restrictions on participating in the lab due to one's visa status? I know REUs are only for US citizen/permanent residents but I am not interested in REUs so that's okay but I am wondering if URAP has such restrictions. Also, are there labs that do not accept undergrad international students into their labs? I am interested in ML/AI.",1637773688,1,0
Summer research // First-year Undergraduate/ Electrical Engineering,"Hi, I am a current first-year undergraduate at UCSD studying electrical engineering, and I wanted to participate in research at UCB this summer. 

Could you please advise me what program to look into, or if you could provide contact of any summer research program office/a professor who looks to continue their research over the summer, it would be great.

Thank you in advance",1637773336,1,0
Just finished applying... Wish me luck!,,1637765209,1,0
EECS '19,"Hey guys !
Any EECS '19 students here ? How's life ?",1637762162,1,0
Need help choosing class to best prep me for STAT 140/ PROB 140,[removed],1637760272,1,0
How to make friends when all your interests are pretty asocial?,"There are people I vibe with but I don't feel super duper tight with anyone. I get pretty overwhelmed by large groups of people. When I have free time, I just watch YouTube or read Wikipedia or go on walks alone. I just want hugs lmao. Sigh I'm a junior, I thought I would've figured this out by now... anyone else feel similarly?",1637754804,1,0
Hello from NZ! A Research Query - On Privacy,"Hello everyone.

I'm an undergraduate University student based in Auckland, New Zealand. I'm currently undertaking research in the intersecting areas of Law, Software, Information Security, Privacy, Data, and Digitial Identity management - to discover problems linked to exposure of personal information and personal privacy.

In particular, I'm keen to hear your experiences around controlling your privacy online, as well as the management and protection of your personal information, data, and identities/accounts. I'm eager to look at these problems through a behavioural lens and dive into how we can mitigate privacy exposure via changes in human behaviour (rather than merely tweaking settings across services you use or switching to alternative software platforms).

Ultimately, this may eventuate to the creation of a platform that helps you learn about privacy and security best practices and create a tailored, fine-tuned privacy behaviour framework to meet your privacy goals (i.e. to create privacy-centric habits that endure). However, the format and content of the platform are TBD as this research exercise will quantify the areas of development/curriculum we should prioritise. As a part of this research, I'm keen to hear the perspectives on the following questions from US-based students:

&amp;#x200B;

1. Is your personal privacy (in online and offline life) something you regularly think about ? If so, why?
2. Have you considered the potential risks associated with apathy towards the management of your privacy?
3. What is the biggest problem you've experienced while managing your privacy?
4. Why/why would you not consider yourself a privacy-conscious individual?
5. How do you currently manage your personal privacy risk? (or why aren't you?)
6. Do you regularly check in on the exposure of your personal information online? (or why you don't)
7. Are you aware of the extent of the exposure of your personal information online?
8. What are the highest friction (most difficult) steps you've taken towards the management of your privacy? And, what are the highest friction steps you want to take in the future?
9. What actions do you plan to do in the future to mitigate exposure of your personal information online?
10. Do you feel personally confident to assess and mitigate exposure of your personal information online? Or, would you prefer to be assisted in the assessment and mitigation process?

&amp;#x200B;

If you're keen to chat about this, feel free to connect to tell your experiences. Please reach out via PM, and we can talk; or, feel free to comment on your experiences below. Also, let me know if you know anyone else who may be keen to answer these research questions or help out with the platform's development.

Thank you so much!

\- BecauseCausal",1637754010,1,0
61a bin shifts,Does anyone know if the bins were shifted for cs61a last semester ( spring 2021)? I heard the averages were lower last semester so I wanted to ask if the bins were shifted?,1637753480,1,0
help Intl student!,"So we don't have a visual or performing arts course in my school, so I am unable to satisfy my A-G course requirement. Will this affect my chances?",1637747619,1,0
Haas Interview Questions,Does anyone know what the Haas Interview Questions are for this semester?,1637746063,1,0
Taking MCB 104 and MCB 133L at the same time,"Hi I was wondering if anyone has taken the two classes at the same time and could comment on their experience. If not, which should I take with Physics 8B or in the summer?

&amp;#x200B;

Thank you for any insight you may offer.",1637745323,1,0
4 tix to Sac,"I have 4 amtrak tickets to Sacramento for Wednesday Nov 24th!
Lmk if you're interested",1637744112,1,0
I’m just gonna leave this here. Hope you rejects are having a nice day ;),,1637741297,1,0
public health clubs recs?,,1637737886,1,0
CS61A or CS88 for data science minor?,"I'm taking Data 8 this year (would probably end up getting a middle or low B) and is thinking of doing a data science minor. Would CS61A or CS88 be better for it? What are each's strengths and ""weaknesses""?",1637735735,1,0
Is UC GPA calculated the same way for International students?,I go to an American high school in Malaysia. We are an IB school and our grades are reported on a 1-7 scale rather than an A-F scale. Does our UC GPA calculation include the 9th and 12th grades or are our 1-7 grades from 10-11 converted into the UC GPA?,1637734774,1,0
Should I apply for EECS or L&amp;S as a transfer?,"I'm apply for a Computer Science transfer this week from a California community college. I have nearly a 4.0 GPA as well as most my major prep + IGETC completed. I was originally going to apply for L&amp;S CS (which requires IGETC), but I noticed that it has a lower amount of transfers admitted (only \~50, compared to \~140 for EECS). I was then going to apply for Data Science or Applied Mathematics (because of the fact I would be able to declare CS), but that felt a bit unethical to me, and all my essays/EC's are already about CS.

So now I'm planning to apply for EECS. I noticed that EECS doesn't accept IGETC whereas L&amp;S requires and accepts IGETC. So, would all the GE's I've taken still transfer over, or would all those credits go to waste? 

Should I instead apply for L&amp;S CS (or Data Science / Applied Math) because those majors takes IGETC?",1637734735,1,0
Is anyone here familiar with the MET Application Process- I’m a prospective student who recently received an invitation to complete a video essay.,"I’m not sure what this warrants about my application- does this mean I have advanced to the next round of the application process?

For context, I submitted my application about 10 days ago and submitted my MET supplemental essay about 5 days ago.

Can anyone who has been through the process please help me out?

Thanks so much!",1637731358,1,0
https://discord.gg/UwhZ4kvpxp,[removed],1637730060,1,0
Karen,,1637729935,1,0
How hard is it to get into I-House housing?,"Hi, thinking of applying to live in I-House for the 2022-2023 academic year. I see that you have to apply and it isn't exactly first come first serve, how exactly do they choose people to live there? I'm not an international student and my major isn't exactly unique (CS), is it basically a lottery?",1637728963,1,0
