title,selftext,created_utc,score,total_awards_received
Which is the best lab Stat class and core Stat classes in general,"I'm and MCB/ Stat double major and I was wondering what courses I should take as my Stat core. For I initially had this planned:

Core Stat (non Lab) = 

1) Stat 157 - Seminar in Probability (Forecasting) 

1.1) If 157 wasn't available, Stat 155 - Game theory 

2) Stat 156 - Causal Inference 

Core Stat (Lab)

1) Stat 153 - Intro to Time Series

1.1) If I didn't like 153, then Stat 159 - Collaborative Statistics

1.2) Maybe Stat 151a - Linear Modeling

Now that 157 is full, I have no clue what should fill the gap since I can't take 155 this semester due to reasons. 

Additionally, I have no clue how Stat 153 with Professor Ruoqi Yu is gradewise and I don't know whether I should take that or Stat 151a. Can someone tell me their experiences in these classes I would prefer to get a good grade since my GPA is not too hot right now.

TL;DR: What are the 3 statistics core course requirements I should take/ which classes did y'all like and enjoy the most (and of course did well in) without spending like 20 hours a week on it?",1634594681,1,0
Anthro 2ac or Espm 50ac,"Anthro 2ac:
Pro:
-has a higher average grade
Con:
-9am class

Espm 50ac:
Pro:
-11 am class
-seems like a more popular class
Con:
-i’ve heard the amount of reading is too much

people who have taken the class please give suggestions

[View Poll](https://www.reddit.com/poll/qax3ta)",1634594594,1,0
Flu shot,Are you guys getting the flu shot? Or already did?,1634592575,1,0
DO NOT ENGAGE WITH RANDOM PEOPLE WHO ARE ASKING YOU QUESTIONS,"For context, before reading this post please read [this post ](https://www.reddit.com/r/berkeley/comments/peubnf/unnerving_encounter/) .

It was recently brought to my attention that a TikTok came out and it took the words of other students and I out of context to make us look like Taliban sympathizers and hellbent on seeing America destroyed.[The latter is lowkey true(though I’d prefer seeing it drastically changed) for me but fuck the Taliban lol] Basically what happened was that I was initially under the impression that he was asking for humanitarian aid to be sent to Afghanistan when I said “50 bucks” and it wasn’t until the end of our conversation that he revealed that he would be “funding the Taliban”. Now my face and out-of-context words are up for millions to see including potential employers and my parents are going to fucking kill me when they find out. 

If y’all could spread this , I’d be super grateful",1634592220,1,0
Selling OSL Friday &amp; Sunday Wristbands!,I have 1 Friday and 1 Sunday wristband I'm looking to sell. Message me if you're interested!,1634592056,1,0
EE C128 - Worth it?,Has anyone here taken ee c128 and would you recommend it?,1634591399,1,0
When Should I Take Math 1A (pls help),"Hi!

So I do not know what I am majoring in yet, but the options I want to keep open are Haas, CS, DS, Econ, and EEP (for now). I haven't taken an A series math class here yet, and I can't test out. Since DS and CS require Math 1A (and even the minors if i chose that route) I wanted to take Math 1A in the spring. BUT the professor (Vojta) has terrible reviews and a C+ (WTF?!!!) average on Math 1A. I'm applying to Haas next year, and so I cannot take Math 1A with Vojta. That begs the question, when should I?? Is it offered during the summer (with a good prof)? Should I just take math 16A now and give up on CS / DS majors? Am I okay to be taking Math 1A in Fall Sophomore year WHILE I apply to haas? Or does that look bad on my application? IDKKKK im lost, can anyone help me",1634591072,1,0
what event berkeley,How to check what events going on around and on campus?,1634591056,1,0
Junior Transfer taking EECS16b and CS70 next semester,"I was wondering if there's anything else I should add to my schedule that may be beneficial for myself.

Or, are there any relatively low workload/""easy"" concept upper div electives that I could consider? Thanks!",1634591042,1,0
Anyone going to Alina Baraz concert on sunday,Would love to travel together!!,1634590631,1,0
Failed My Second Chem Midterm,"I failed my second chem midterm and now i’m actually losing hope in everything and i’m really stressed about whether or not i will pass the class. I completed the practice midterms with almost no difficulty, and i still failed.Is it possible to fail 2 midterms and still earn a C? At this point I just want to pass the class.",1634590598,1,0
@ PUBLIC HEALTH MAJORS!!!, I was wondering how many  Public Health elective units can be overlapped with a Minor? Is there a specific amount? I can't seem to find anything online about this. The elective list is so vast so I am unsure since there is a decent overlap with a minor I am considering. Thank you in advance!! :))),1634590249,1,0
Does 61b reuse the same projects every year?,My schedule is light this year and I wanna be prepared.,1634588596,1,0
boy ain’t no way 💀💀,,1634587969,1,0
Lost Wallet,"My name is Jasraj Dhillon, and I can’t find my wallet anywhere. I’m on campus right now, and I only walked from Foothill Parking Lot to the Engineering Library, and to the Hearst Mining Building. If you found my wallet, please either comment on this post or call my number. It has my license and student ID, so it will be easy to identify. Please help me.

Phone: 5108049474",1634587228,1,0
school project,[removed],1634586767,1,0
Missing keychain on AC transit 36,"Hi everyone, I think one of my keychains accidentally came off my lanyard while I was taking my keys out on an AC Transit bus today. I was in the 36 line and got off at Telegraph and realized it was gone. It’s a little Funko POP keychain of King Shark from the newest Suicide Squad movie and it means a lot to me. Please let me know if you find it!",1634585976,1,0
Easy Spring Classes?,Anyone know of easy classes to sign up for a gpa boost?,1634585879,1,0
What are recommended upper div PolSci classes?,I have no idea what to take next semester.,1634585599,1,0
Transfer help and double majoring,Hello! I am currently studying business at a local CC and I am planning to transfer this following school year as a junior. I am interested in double majoring in music as well but I’m unsure of how to go about the process. I have only completed the requirements for the business major. Can I still declare a double major in music and business even if I haven’t met the requirements for music?,1634585069,1,0
Opinions on R4B Classes,[removed],1634584470,1,0
How does EE126 + EE127 + EE120 + CS170 sound ._.,"I know it is an unreasonable workload. I'm thinking about which one I'm letting go to learn the rest better. For my case, I'm a transfer on my 2nd junior semester so I don't have much time left. Should I move some of these classes into my final year? My Fa'22 schedule is looking like EE149, EE106A, breadth, and another undecided elective (likely something related to cloud computing, communication networks/ internet security)  
I'm not mathematically talented, but I heard Ramchandran is the best for 126 so I wish to take it with him. Thomas Courtade seems like a good choice for 127 so it's high on my list. I've also read that 120 with Babak is chill, but I'm thinking of taking CS170 for intern prep. Could anyone give some advice? Really appreciate it.",1634584359,1,0
Trying to find the best campus library for technical issues,hi I'm just trying to figure out which library has working wi-fi and outlets that allow me to actually plug my macbook charger in! thanks!,1634583581,1,0
Hey Bears! Study Abroad Week is Here!,"Wondering what the latest is with study abroad? Join study abroad week starting today! Featuring info sessions, a virtual fair, and the chance to chat with advisers and alumni about all of the amazing abroad opportunities available to Bears. 

More info and a full schedule of events can be found at [studyabroadweek.berkeley.edu](https://studyabroadweek.berkeley.edu).

&amp;#x200B;

https://preview.redd.it/35rmgszn89u71.png?width=1080&amp;format=png&amp;auto=webp&amp;s=c8943e7f4c650630e87a7c6d49979dcdc2277b9b",1634583433,1,0
16B,[deleted],1634583193,1,0
16B,[deleted],1634583161,1,0
Overheard at 16B,,1634583025,1,0
Overseen at 16B,,1634582923,1,0
"Arcimoto Mini-Auto Show today, 11a-1p West Plaza between McLaughlin, O'Brien, and Davis Halls","Founder, CEO, and UC Berkeley Alum Mark Frohnmeyer is visiting, and bringing a half-dozen Arcimoto FUVs. 

check out the vehicles, sit inside them, and talk to Arcimoto employees about Arcimoto, Inc. 

Arcimoto develops and manufactures ultra-efficient and affordable electric vehicles to help the world shift to a sustainable transportation system.",1634581429,1,0
[Free] Riz La Vie Tickets,"For anyone interested, I've got four free tickets to Riz La Vie at the New Parish at 8 TONIGHT if anyone wants them!",1634580564,1,0
Discussing challenges with a course with professors.,"I'm a student at Cal with bipolar disorder, and this semester I've been dealing with a severe depression. The result has been that in one of my classes I've missed four homework assignments, and much of our assigned (but ungraded) readings. Only two of the four homework assignments will be graded, since we get two drops. And, I've been communicating with my professor so far, so they are aware of my DSP status, my academic accommodations (including extended deadlines for homework). 

I've been getting better, thanks to medication changes and a lot of additional therapy, but it's been a slow process, and I might still be impacted by the episode for a few more weeks. 

When I'm not in an episode, I'm able to work just fine: I like the content of the course I'm taking, and have the requisite study skills to keep up in the course. I also believe that, if I get better within the next few weeks, I will be able to catch back up in the content I've missed so far. 

So, I'd like to schedule a meeting with my professor to talk a little bit more in depth about these issues, but I'm not sure exactly what to do / say. 

For one, I don't want to sound like I'm making excuses: I take full responsibility for my illness and don't want any handouts—when I'm feeling better I'm willing to do all the work necessary to catch up. 

Also, I don't want to go too much into depth into the specific nature of what I've been dealing with because (a) there is a potential for stigma, and (b) there are restrictions on what a professor is able to ask students about related to disability, and disclosing disabilities to professors can sometimes put them in uncomfortable situations they don't want to be in.

**If you've found yourself in a similar situation, would you mind sharing what you did, what your experiences where, and what you might do differently in the future?** 

What did you say to your professor? What type of class was it for? How did they react? Have you every tried to request an alternate grading format, such as a project to make up for missed assignments?

This class is a math class, if that matters.",1634580379,1,0
enrolling in graduate level course as an undergrad,"i found a class that i want to take, but in the attributes it says it's a graduate level course.  am i allowed to take the class? it seems theres only 2 seats open for non-masters of social welfare students, will i have to email the professor about joining the class? 

how does this all work?",1634579085,1,0
Vending machines on campus,Where can I find vending machines or free snacks? I forgot to bring my own snack.I would like to eat something healthy before my exam.,1634578358,1,0
"If you took CS 182, may I PM you a few questions about the class/content?",,1634576048,1,0
Is it safe to phase 2 ling 100?,My other classes I'm planning to take are either really popular (econ 100b) or have VERY LITTLE space (Global Studies 102 &amp; 110Q).,1634575993,1,0
Are non-students allowed on Bear Transit shuttles?,"By non-students, I mean my mom who is very obviously on the older side.

Also, if anyone has ideas for things to do in the Berkeley area with visitors, let me know!",1634575863,1,0
Is there a club or group that want to play volleyball for fun?,,1633594795,1,0
Prospective Econ Major: Request for Additional Information,"Haas major and prospective Econ here. I’m in my seventh semester and completed all my Econ prereqs and can reasonably complete my Econ electives and Haas requirements by graduation. However, Berkeley Econ asked me to submit additional information for review since I applied to the major late. Does anybody have experience with this? Help would be super appreciated :)",1633592598,1,0
looking to practice Korean w a native/fluent speaker,"hey! i am a first year taking K1A this fall and would like to practice my mediocre 😭 skills in a conversation with someone. i seem to forget some of the content i’m learning because i don’t have anyone to practice with and because the majority of the content is taught through zoom. if you’re interested, hmu. ty 😁",1633592083,1,0
UCSF &gt; STANFORD MEDICINE,[removed],1633590976,1,0
quinn xcii &amp; chelsea cutler tickets,"got 2 tickets for Quinn XCII &amp; Chelsea Cutler for Thurs (Oct 7) at Sacramento. 

&amp;#x200B;

dm me if interested. sold at a lower price.",1633590909,1,0
"My GSI is really hot and kinda seems like he’s flirting with me, idk what to do",,1633590051,1,0
Cal LGBTQ+ hook up sheet,Someone make this please,1633587433,1,0
"1 GA WRISTBAND FOR SALE! Let me know ASAP, I have the band in hand and I’m looking to get rid of it!",,1633585883,1,0
Im getting tired of all these Nobel prizes...,[removed],1633585442,1,0
BEAR WALK after exam,"On October 18, my midterm ends at 10 pm so will Bear Walk services be available so that they walk with me from Dwinelle Hall to the Downtown Berkeley BART station?",1633585367,1,0
Cambridge or Berkeley?,[removed],1633582791,1,0
IS Uc berkeley a prestigious university?,[removed],1633582709,1,0
Please Read if you are a Student Dorm/Apt. Cook,"If any of you are living in apartments and dorms and cook in your dorm/apartment kitchens, then please fill out this form. This is for a project. Form should take 3-5 minutes. Thank you. [https://docs.google.com/forms/d/11hD8U7V8yQtVGllXQlPO9VUpIjqxorNLGPTCfXE9G14/edit](https://docs.google.com/forms/d/11hD8U7V8yQtVGllXQlPO9VUpIjqxorNLGPTCfXE9G14/edit)",1633582197,0,0
Schedule question,"How doable is CS61C + EECS127 + CS189 + CS161 like?

I am planning to take CS61C, EECS127, CS161, CS162, CS170, CS186, CS188, CS189 in last 2 semesters (maybe including Summer as well). I do not know how to plan out these courses right now. Some of the options are:

Option 1: Spring CS61C + EECS127 + CS189 + CS161, Summer CS162, Fall CS170 + CS186 + CS188

Option 2: Spring CS61C + CS189 + CS161 + CS186, Fall CS162 + CS170 + CS188

How would you plan out the courses? Open to any course/schedule suggestions btw.",1633581523,1,0
100 gecs this Friday,Anyone going wanna meet up before the concert?,1633581333,1,0
missing black kitty southside (clark kerr probably) contact me 😵‍💫,[removed],1633579968,1,0
Euclid Co-Op Residents: WTF is going on?,"I walked by and heard this guy screaming his ass off inside, what's going on?",1633579564,1,0
Can I get research now?,"I am about to use late drop for 3 units class, and my units would go down to 12 units, so I need 1 unit. I want to enroll for 1-2 units for research so I kept cold emailing professors, but I didn’t hear back from them yet. Did anyone get research at this point?",1633579117,1,0
Any clubs that are still recruiting or still available to join?,"Hi! I’m a freshman on the Econ/pre-haas track and I just wanted to know if there were any clubs that were still recruiting for like any type of interests, just looking for ways to be more involved on campus after not making any of the early round clubs. Please let me know if you know any! Thanks in advance!!",1633578156,2,0
NSFW WARNING: Best way to find hookups without using tinder or other phone websites?,"Basically, long story short, my mom checks my phone so I'm tryna get sum female action old school style if y'know what I mean fam. I was wondering if there are clubs or strategies to get chicks in Berkeley that don't require phone use. Also if you're a girl, you can pm me if you're interested. Thanks ;)",1633577530,0,0
Onboarding,"Has anyone been onboarded as a student employee this semester?

I missed an appointment on Tuesday because they didn’t send me a password to join the Zoom meeting. I sent them like two emails and called them on Tuesday, but no one has responded to me yet.

Has anyone else had this problem/know where I can find a password to join the meeting?",1633577062,1,0
Found lost clipper card,"I found a clipper card just outside cafe 3, if you lost one please message me with your name to confirm. :)",1633576688,1,0
Any bioengineering majors open to talking about the major.,"I was considering doing it alongside what I am doing now.

Just some baseline questions first:

How would you describe the variety in the courses? Is it mostly chem, bio, physics, or anything else?

What careers are you looking forward to/expecting to go into?

Do you actually like bioE? If so what do you like? If not, what do you hate?

What kind of person would you recommend bioE to?


Thank you. Feel free to write anything other thoughts beyond the questions if you feel like it.",1633574483,2,0
FUCK DSP AND ADVISING,"y’all have two employees each i swear, appointments not available until months out and we need help with out classes and accommodations sooner than that. like what, is your work week two hours a day i swear to god this is bullshit. i’m doing a program next spring and need to talk to people about putting my registration on hold but no one is available?! same when it comes to my dsp stuff? come on wtf ?!",1633573866,4,0
Tennis partner!,[removed],1633569133,1,0
What questions should I ask at the Research tour?,"I was given an opportunity to get tours of the lab ran by  **Neerja Aggarwal**, one of Professor Laura Waller's graduate researchers, and was wondering what would be an interesting question to ask?",1633565919,0,0
MELC 158AC,guys what is the Middle Eastern Language and Culture and Diaspora midterm like? it’s in a week and my professor hasn’t talked about it. stressing pls help!,1633565768,1,0
💖 So Proud of the Bright Young Minds Berkeley Loves,,1633565050,1,0
Fleet Week trip?,"As it turns out, Fleet week is this week in SF. They're giving free tours of navy ships, and I'm probably going because it seems interesting. Anyone want to join?

&amp;#x200B;

[https://fleetweeksf.org/](https://fleetweeksf.org/)",1633563823,2,0
I've had an off and on throbbing migraine for the past few days 😩,I should probably get it checked out but I'm not quite sure how to access the medical care facilities and resources here and I don't wanna get billed a ton of money. I got SHIP so I'm hoping that won't be the case?,1633563567,6,0
S2 Schedule for CS Major and DS and Physics Minor,"Hey! I am currently taking Math 1B, CS 61A, Physics 7A, and two entrepreneurship courses that are part of the SCET certificate. I am currently breezing through my classes with mostly A-/A. I am undeclared but I want to major in CS and then minor in physics and DS. Is this too heavy for semester 2:

\- CS61B

\- Math 54

\- Physics 7B

\-Data 8

\-Reading and Composition requisite part 1

It would be a total of 20 units I think. I currently have 15 and I'm chilling. 

Would this be too much? Am I too cocky to take a major and two double minors? Should I drop the DS minor?",1633563047,1,0
Schedule Planning Help,"So I'm a freshman planning to double major in Math/Econ, and I'm wondering if anyone has some advice about my planned spring (and possibly summer) schedule. So originally, I was thinking for Spring 2022 to do:

ECON 1 + MATH 54 + STAT 20 + ESPM 50AC (breadth)

but I've heard STAT 20 is tons of work, and I'm not sure if I would be overloading myself. Does anyone have any advice? (like is this schedule doable or too much? I don't wanna tank my GPA since Econ is capped) 

(I also have a job which is about 4hrs/week and extracurriculars which are like 3hrs/week)

OR 

I could split up classes into Spring and Summer:

Spring 2022: ECON 1 + MATH 54 + ESPM 50AC + \[another breadth\]

Summer 2022: STAT W21 + \[some other Web-based class\]

(I will not be in the U.S. next summer so I will need to take Web-based classes)",1633562583,1,0
https://stolen911.com/2013-porsche-carrera-s-911-stolen/,,1633562217,0,0
Which is easier? Math 54 or Stat 2,"Hi I'm trying to figure out which class is easier between these two courses. I'm struggling with Math 1A right now if that gives any context to my math knowledge :)   


P.S. I can't rly take any other math courses bc this is for my psych degree requirements",1633560778,1,0
Switching from 101a to 100a now?,"Intended Econ major, realizing now that 101a is NOT for me. Is there a way to switch from 101a to 100a now thru a swap or do I have to late-drop and take it next semester? Thanks :”)",1633560051,1,0
I can't take Moffitt seriously,"every time i see ""Moffitt"" i read it as ""Bofa"". Petition to rename Moffitt to Bofa Library",1633560009,0,0
Global 45 with Econ 1 or 2,"Hi, I'm a freshman intending Political Econ &amp; need to take Global 45 and either Econ 1 or 2. If I want to take Global 45 in spring, which one would it be more advisable to take? I'd love to take a course with the Romers, but I've heard that Econ 2 is more difficult.

Should I even try to take both Global 45 and Econ 1/2 in the same semester? I'm concerned I might not do well, and since I need a B in both these courses, I'd rather be safe than sorry. I could just take Econ 2 this semester and Global 45 next fall.",1633559711,0,0
DSP office only able to give me late into the semester,"I was recently diagnosed with ADHD and severe anxiety by a specialist in September and notified DSP of these issues I was facing that were severely affecting my ability to cope with the classes. DSP then told me that the next available appointment to be active in the program was 4 WEEKS LATER. I have midterm exams before the next available appointment and have no way to get urgently needed accommodations for my classes before then. I tried emailing the office saying it was urgent, but got no response. In addition, the next available appointment time is past the early enrollment registration period so I won't be able to get that accommodation either. Without these accommodations I don't know how I'm gonna cope with my classes and have no idea what to do. Does anyone have any advice on what to do in this situation?",1633557151,9,0
What do you do when gradescope autograder is running?,^^,1633556658,2,0
Do the takeout options at crossroads change?,"I’ve only been twice, and both times the options were exactly the same. If they do change, is there somewhere I can check beforehand? I can’t seem to find a takeout menu on the cal dining website.

Thanks!",1633556051,2,0
What are you listening to? UC Berkeley edition,,1633555696,15,0
We have pretty fire music taste ngl,[deleted],1633555643,1,0
Macbook charger too tall for main stack outlets,Any recommendations for charging a Macbook in the main stacks? The outlets at the base of the lamps are too close to the table to fit my charging block. Thanks!!,1633554485,2,0
Bio research?,"Anyone who was involved in any kind of bio research before graduation,  what did you do and how did you get it?

I'm an integrative biology major.",1633553788,2,0
take econ 2 if i already have credit?,i took ap micro and macro in high school and got 5s in both without much difficulty and was thinking of going straight to econ 100a in sophomore year; that way i can take math54 next semester instead since i’m thinking of doubling econ and ds. is this an advisable action or should i still consider taking econ 2 since i don’t think i remembers too much from my ap classes?,1633553141,0,0
"I was charged $150 by Tang for getting a rapid covid test :( Don't have SHIP, what can I do to get this waived?",[deleted],1633552531,2,0
Former Cal Professor wins 2021 Nobel Prize in Chemistry,,1633552281,41,0
Physics 7B for EE,I'm l&amp;s CS but want to take most of my upper division coursework in EE. Should I take physics 7b (or is it skippable?),1633549468,2,0
And they said computers were smart…someone needs to train their Neural Network better,[deleted],1633547369,0,0
CS70 Discussion Reccomendations,I was never a fan of my discussion GSI but now that we can go to any discussion I was wondering if anyone had recommendations for a section or GSI they really like?,1633545479,1,0
Are 61a and 61b similar?,61a is not it. I’m hoping this type of material isn’t gonna be my life for the next year or so 😩,1633545406,0,0
How long does it usually take to hear back for a work study application?,I applied to 3 work study positions. its been a week so far and I haven't heard anything? I mean did I just not get the position or is it that competitive that they just haven't had the time to read mines?,1633543556,1,0
office hours,"I want to utilize office hours and get to know my professors, but I have no clue how to start.... 
I don't really need help with the readings or clarification on the assignments so how should I go about trying to get to know them &amp; form this connection?? 😭",1633543255,10,0
When your post-doc is flirting…,"I just started a research position and I’m sitting here for 20 MINUTES while my post-doc is flirting with some egotistical man who won’t shut up, but she’s just standing there, nodding, smiling, awkwardly flirting without telling me what to do, wtf is this normal? I went to ask her but she gave me the go away finger, I’m pissed",1633543115,7,0
