title,selftext,created_utc,score,total_awards_received
Age gap relationships,"Yo, any Cal students (undergrad) currently in a relationship with an age difference of more than 2 years? Is that odd or only in high school? Give me some hope.",1632558952,1,0
ECON Major Declaration,So I recently submitted my econ major declaration application for regular review and they say they will get back to me in mid January. Do they usually get back to some students earlier or do they get back to all students who applied all at once in mid January?,1632557857,1,0
mass email sent to all public health students about the executive associate dean's stolen lunch,"&amp;#x200B;

[apparently we all had to see this email](https://preview.redd.it/9hs9yhs5tlp71.png?width=1708&amp;format=png&amp;auto=webp&amp;s=b398bfbd0a0082b928203dd228757fd8efb9bd7d)

https://preview.redd.it/sij105w3tlp71.png?width=112&amp;format=png&amp;auto=webp&amp;s=baac240ef164698f3026640fcee8feddb5d8dff9

[someone accused homeless people, which provoked other people to reply in typical berkeley fashion](https://preview.redd.it/qd9omx0ktlp71.png?width=1688&amp;format=png&amp;auto=webp&amp;s=9cc7322272e428d6142d2d81eb3221cb4258477f)

&amp;#x200B;

[someone said it for us](https://preview.redd.it/1tb0uiwqtlp71.png?width=1669&amp;format=png&amp;auto=webp&amp;s=23676e79bda5f2cc0cd551a73a88d14b466b6502)

in summary: learn to uncheck reply all",1632556449,1,0
Maths Midterm Anxiousness,"I don’t know how many people on this subreddit have taken Math 55, but I’m horribly anxious for the midterm this coming week. The professor is very kind and the class seems to be fairly okay, but as it goes i’m a horrid test taker and maths has always been my weakest subject. If anyone who has taken the course has any advice on how to take exams/not have constant anxiety in this class, please do leave a comment. Thank you X",1632555574,1,0
mcb 104 midterm,how was it for u,1632554788,1,0
My girlfriend almost broke up with me because of CS61C Project 1,[removed],1632553864,1,0
My girlfriend almost broke up with me because of CS61C Project 1,,1632553456,1,0
Kvass in Berkeley,Does anybody know a place in Berkeley that sells Kvass? Ideally within walking distance from campus but anywhere relatively close will do. Thanks!,1632552814,1,0
Chill bars to go to solo?,"Just finished my math hw and I need a drink lol.

Unfortunately, I don't have anyone to go with as I'm a new transfer student.

What are some chill bars to go to solo?",1632552227,1,0
cs161 proj1,[removed],1632550729,1,0
Anyone know where I can buy a Shiba Inu? Saw one today and I’m completely sold,,1632547877,1,0
CBE 140,Hey any discord or group chats for this class? Any help would be appreciated! Thanks!,1632547739,1,0
Am I screwed for Haas?,"So I took the first module exam for UGBA 10 and I wasn’t prepared at all. I also didn’t realize exactly how big of an impact this test would have on my chances of getting into Haas. If I did poorly on the module 1 exam, are my chances of Haas screwed?",1632547486,1,0
bph spam over stolen food,yo anyone else seeing the spam between sph faculty over some stolen lunch... :/,1632546477,1,0
to the guy that coughed on me at the golden bear cafe,yes we were both wearing masks but how are gonna cough directly at me without covering yourself??? are you three years old or what??? here’s a video if you forgot how to… [how to cover your cough (for kids) ](https://youtu.be/0X0w5C44LOI),1632546425,1,0
Scandinavian 160 Advice,"hey friends, I’m currently taking Scandinavian myths 160 with Prof. Wellendorf. anyone have tips on what to look forward to in terms of exams and the essay? not sure how much mythology i need to retain. thanks!",1632546342,1,0
psych 1 (gade) discord? Group chats? anything?,"its the only class i have where im contact with absolutely nobody else taking the course. im concerned i might miss a deadline, important info, etc. 

anybody out there?",1632543555,1,0
Music 137AC,"Will music 137AC be offered next spring? Last time, I heard there is a daily good chance.",1632543242,1,0
how do I get an A/A- in chem 1aL?,The first two lab grades have come back and I've gotten an 80% on both so far but I'm really not sure how to do better. My gsi isn't the best with explaining things or just running the lab section overall and idk what kind of stuff he wants. any tips/is the lab final exam relatively easy so that I can pull my grade up with that?,1632543031,1,0
I 𝙧𝙚𝙖𝙡𝙡𝙮 wanna die ❣️❤️,Like it so fun y do people make such a big deal out of it? ❤️,1632542226,1,0
When will class schedule come out?,"As title, when will class schedule for Spring 2022 come out? I needa plan my next semester better lol 😂",1632540836,1,0
How do I buy student football tickets?,,1632539431,1,0
Transfer to UC from out of state college?,I'm reading the requirements for transferring into CS from a four year out of state institution and it seems like transfer credits are only accepted on a case by case basis and I'm like how am i supposed to accomplish this. I'd just like a perspective from someone who transferred into CS from a regular college.,1632539158,1,0
My favorite Berkeley talk! View from the Top: Professor David Patterson,,1632537328,1,0
Psych/Cogsci C127 without prerequisites?,"I’m really interested in taking this class as a free elective next semester, but I have not completed the recommended prerequisite (cogsci c100 or c120 or psych c61). Will the class be doable without these? I am a chembio major so I don’t have much experience with psychology. Open to taking it P/NP as well. Thanks!",1632536843,1,0
𝙒𝙝𝙤 𝙩𝙝𝙚 𝙛𝙪𝙘𝙠,Pulled the fire alarm? &gt;(,1632535041,1,0
Transfer Acceptance Chances?,"I’m at a California Community college majoring in Political Science.

- 4.0 gpa
- Currently taking fall courses to meet transfer requirements
- IGETC pathway
- TAP

Extras
- Summer Legal Internship
- Worked at a coffee shop for 1 year
- Volunteered at food drives for 3 years

Currently working on my personal statements.

Do I have a shot at UC Berkeley? Also any advice for essays are greatly appreciated! :)",1632533391,1,0
How to buy football tickets?,"Hi, I'm new to campus and I want to go to one or two football games. I created a student account through Cal bears app, and when I click on buy student tickets, it us showing upcoming homecoming game ticket for $30. It feels too cheap and I am wondering if this is the right price. If I buy this, will I be sitting in the students section?? I don't have any student combo or the seasonal pass.. 

Thank you for your advice!",1632533278,1,0
How to buy football tickets,[removed],1632532869,1,0
help buying football tickets?,,1632532151,1,0
help buying football tickets?,[removed],1632532063,1,0
how to buy football tickets,[removed],1632531691,1,0
need help buying football ticket,[removed],1632531515,1,0
how do I buy football tickets?,[removed],1632531354,1,0
how to buy football tickets?,[removed],1632531147,1,0
Phoebe Bridgers ticket 8/16,anybody tryna sell their ticket dm me!,1632530575,1,0
Spring 2022 enrollment time,Did anyone check their enrollment time yet? What are the two days for sophomores?,1632529811,1,0
How do I explain CogSci major to my Asian parents?,,1632529726,1,0
People wearing light blue scrubs around campus,What program are the people who wear light blue scrubs on campus in and how can I get involved? I’ma pre med so I’m looking for as many opportunities as possible lol,1632529558,1,0
"Those who eat out at restaurants near telegraph ave, were you ever able to get $5 off on your next order?",I see this everytime I order something off the touchpad and I never get $5 off my next order,1632529369,1,0
Spring Enrollment Times,Does any one know if spring enrollment times start later than fall enrollment times?,1632527965,1,0
anyone else notice something weird in ehs 101 lab safety fundamentals?,"i'm completing a training course called ""ehs 101 lab safety fundamentals"" so i can work at a lab in VLSB and there's a part in one of the videos where the narrator says something like ""insidious or occult exposures""...  
am i imagining this??? what is going on?",1632527820,1,0
Poli econ,"What series is easier for poli Econ majors, in regards to the micro and macro upper division requirements. Polecon 106&amp;7 or UGBA101A&amp;B. Also, I would love some insight on what the polecon 100 class is like.",1632527562,1,0
Active spots tonight?,"I’m gonna be in Berkeley tonight and wanted to know if there was anything popping today. Active bars, parties and events",1632527548,1,0
any math tutors?,I’m currently struggling with math 1A because my gsi isn’t that great and office hours clash with my other classes so I was wondering if anyone knows where to find a tutor at berkeley?,1632526918,1,0
Spring 2022 Enrollment Times,"Hey!

So spring 2022 enrollment times just came out, and I have 11:00am on the 27th. It seems like a lot of people have the 26th. I'm looking to take Econ 2, but is that a class that usually fills up too quickly?",1632525995,1,0
To add on to the ASUC complaints: Why are we not allowed into the Eshleman Cubes yet?,"How is this supposed to prevent COVID? Meeting in person at the bottom floor of Eshleman is fine, but for some reason it’s not okay to do this on the 3rd floor?",1632525652,1,0
Hot Take: People who always have their SO’s over need to pay more rent,Berkeley square space is expensive yall and you out here taking it rent free,1632525082,1,0
Looking for Soc5/7 tutor,[removed],1632524441,1,0
Physics 5A,"For the homework due today, what do I do for the problems on topics that we didn’t cover in class?",1632523407,1,0
Jam club,Hey everyone I just transferred to Berkeley and was wondering if anyone wanted to start a jam club with me or if one exists already ? I was thinking just meeting up in an open area of the school ; bring any type of instrument you want. Let me know if anyone interested !!,1632523104,1,0
What happened to all the anime posters on the announcement board,Went by there today and didn't see any. Did someone take them all down or did I just not look hard enough? I was about to hang my own lol,1632522859,1,0
Dropped from class with no warning???,"hey y’all, I checked my bCourses just now to start on my readings for next week when, to my surprise, I see that the class has completely disappeared from Canvas. I check CalCentral, and it shows that I was dropped from the class. What the fuck?? Neither the prof or GSI gave any type of notice, and there was no information that if you missed discussion a certain # of times or something that you’ll be dropped— I’ve been keeping up to date on the HW (I have an A+ in the class for fuck’s sake) but missed the last two discussions (one of them due to a family emergency and the other (literally this morning) because I had a midterm in the middle of it). I know missing two discussions isn’t ideal, but I didn’t anticipate it leading to a drop (that’s literally the only reason I can think for why), especially when neither the GSI or prof gave any warnings about it. I’ve emailed the GSI but am hoping that anyone has any insights on what happened. I’m now under the unit limit, and since the add/drop deadline has passed I’m essentially fucked. My god this is not what I was expecting and I’m freaking out",1632522575,1,0
data102 tutor in need,"is anyone willing to tutor for data102 for like an hour or so a week? willing to pay, please dm me, i’m struggling to stay afloat in this class. 

or if anyone wants to form a study group i am down!",1632521976,1,0
What are your best study tips?,"In high school, I did not study much. Now that it is my first semester in college, I’m not sure how to actually study effectively. When studying I feel like I’m not really absorbing the information from lectures/slides. My mind seems to be everywhere.",1632520938,1,0
Crazy that breakfast ends at 10:00am..,,1632520608,1,0
Anyone wanna buy a Boosted Board Mini S? Used it a lil bit my first semester and haven’t used it much since..,,1632520462,1,0
Does there exist any services that allow students to rent iPad w/ Apple Pencil for a temporary amount of time? Or do you guys know a way to buy this that is within $200-250 budget?,If anyone's selling theirs let me know. I'm taking a lot of classes with problem sets ie CS 189/Data 140 and I only write with pens b/c I hate pencils but now I use a lot of white out and I'd rather just use a tablet.,1632520427,1,0
Mental Health Services for Students of Color,"**Upcoming Group Counseling (Organized by start date)**

* **See all groups here:** [https://uhs.berkeley.edu/counseling/group](https://uhs.berkeley.edu/counseling/group)

**September 27 - Black Womxn's Sister Circle |** Mondays, 3-4:30 pm (Starts Sept 27 and is Ongoing) Facilitated by Amber Jaiza Jones, LCSW. ***Description:*** The weekly group is designed to provide a supportive space for undergraduate and graduate self-identified womxn of African descent to explore the challenges of navigating life at UC Berkeley. It provides a weekly opportunity to engage in cultivating self-care and wellness practices, to build meaningful connections, and create a mutually supportive and inclusive community. This group requires a brief pre-group meeting with the group facilitator(s) before joining.

**September 29 - BIMOC Black, Indigenous Men of Color Healing Circle |** Wednesdays 3:15-4:45 pm (Sept 29 - Dec 8) Facilitated by Adisa Anderson, Ph.D. ***Description:*** This healing circle is offered for self-identified Black, Indigenous, Men of Color who want to build community through shared solidarity, discuss ways to be rooted in resilience, and explore ways to be centered in mind, body, and spirit. We discuss the complexities of navigating life at UC Berkeley including our intersecting identities, microaggressions and “isms”, academics, career, family, relationships, and maintaining holistic well-being. This group requires a brief pre-group meeting with the group facilitator(s) before joining.

**October 5 - Asian &amp; Asian-American Womxn Support |** Tuesdays, 2:15-3:45 pm (Oct 5 - Dec 7) Facilitated by Chiyon Won, PsyD. ***Description:*** This group is for students who self-identify as females of any Asian or Asian-American background and seek a safe space to share experiences about identity, navigating between Asian &amp; American values, racism-related trauma, school stress, and family &amp; relationship issues. This group requires a brief pre-group meeting with the group facilitator(s) before joining.

**Let's Talk Consultations with UHS Counselors**

* See the complete Let's Talk schedule and links to join: [https://uhs.berkeley.edu/counseling/letstalk/schedule](https://uhs.berkeley.edu/counseling/letstalk/schedule)

***Intended for API Students***

* Thursdays, 4-6 pm - Jeff Lee, LCSW

***Intended for Black and African American Students***

* Mondays, 11 am-1 pm - Amber Jaiza Jones, LCSW
* Tuesdays, 4 - 6 pm - Treajané Brown, MA
* Thursdays, 1:15-3 pm - Adisa Anderson, PhD
* Thursdays, 2 - 4 pm - Treajané Brown, MA

***Intended for Native American Students***

* Tuesdays, 2-3 pm - Veronica Orozco, PhD
* Fridays, 11am-12pm - Raquel Castellanos Miller, LCSW

***Intended for SSWANA Students***

* Fridays, 10am-12pm - Kusha Murarka, PsyD

***Intended for Undocumented Students***

* Tuesdays, 2-3 pm - Diana Peña, PhD
* Thursdays, 5-6 pm - Bianca Barrios, PhD

**Resource Pages - Especially for...**

* See more resources for students: [https://uhs.berkeley.edu/students](https://uhs.berkeley.edu/students)

[Asian American Pacific Islanders (API) Students](https://uhs.berkeley.edu/apiconnect)

[Black Community at Berkeley](https://uhs.berkeley.edu/blackhealthmatters)

[Services at UHS for LGBTQIA+ Students](https://uhs.berkeley.edu/pride)

[Students with Disabilities](https://uhs.berkeley.edu/students-disabilities)

[Undocumented Students](https://uhs.berkeley.edu/undocumented-students)",1632520332,1,0
EECS 126 not well taught this semester,[removed],1632520187,1,0
EECS 126 not well taught this semester,[removed],1632520072,1,0
Lost water bottle,"I‘m pretty sure I left my water bottle (Google branded) in Latimer 105 earlier today. I went back a little over an hour later when no one was in class to look for it, yet found nothin. Does latimer have a lost and found by any chance?",1632519783,1,0
computers with a disk drive,i have a CD i need to get some pictures off of and my laptop doesn’t have a disk drive. do the computers in the OSF have disk drives &amp; allow you to download files from CDs?,1632519756,1,0
EECS 126 not well taught this semester,[removed],1632519557,1,0
EECS 126 not well taught this semester,[removed],1632519480,1,0
No laptops in Morrison Library?,Told I can't use my laptop in Morrison library while I was mid-lecture. Is there a good reason for this? Is this a library for luddites? Pretty annoying policy if there is no good reason.,1632519199,1,0
EECS 126,,1632519185,1,0
The EECS 126 course staff this semester is terrible,[removed],1632519063,1,0
EECS 126 not well taught this semester,[removed],1632519005,1,0
EECS 126 not well taught this semester,[removed],1632518945,1,0
EECS 126 not well taught this semester,[removed],1632518915,1,0
EECS 126 not well taught this semester,[removed],1632518855,1,0
EECS 126 not well taught this semester,[removed],1632518819,1,0
EECS 126 not well taught,[removed],1632518681,1,0
EECS126 is not well taught this semester,[removed],1632518593,1,0
EECS 126 this semester is not well taught,[removed],1632518538,1,0
EECS 126 this semester is horrible,[removed],1632518469,1,0
EECS 126 this semester is horrible,[removed],1632518418,1,0
EECS 126 this semester is horrible,[removed],1632518376,1,0
Can we put an end to the hostility over Gabbi Sharp?,"I don't get why this has been overblown for many days or why people keep posting screenshots of what her supporters are saying over Twitter. Why does it matter? Why is it necessary to stoop to their level and be bullies? I would honestly like to recall Gabbi from office and move on from this.

**Gabbi made prejudiced tweets and should be removed from office as she does not properly represent the interests of the student body. However, making hateful comments about her in retaliation is not okay. Both statements can be true at the same time.** As stated in /u/Royal_Estimate_4871's [post](https://www.reddit.com/r/berkeley/comments/pu9rov/maintaining_civility_respect_during_the_recall/
) yesterday, the objective is simply to remove her from office.

There have been posts on this subreddit accusing Gabbi of being a segregationist, making fun of her appearance in racist ways, and using racially charged language towards her. Her supporters are being immature on Twitter, but IMO /r/berkeley is far from innocent.

I have done my part by emailing the chancellor and am going to keep an eye on the progress being made but I am sick of the drama and bullying that is coming out of it. It is unnecessary and unproductive for everyone involved.",1632518134,1,0
Students in scrubs?,"does anyone know where the students in scrubs work at? i see them walk down bacroft - are they heading to UHS? if u know, what positions do they work as? thx homies",1632516585,1,0
Outdoor DeFi Meetup in SF this Sunday,"Some friends and I are hosting an outdoor DeFi meetup with Berkeley/Stanford students, and others building in the DeFi space - this Sunday from 12:00 - 3:00 PM in San Francisco.   

Send me a message if you want to come, I'll email you a calendar invite with the details. Feel free to bring your friends along as well.",1632514272,1,0
Breaking New Scientific Discovery at Berkeley,"Previously, the world’s physicists believed the Planck length to be the smallest possible thing. Now, researchers at Berkeley’s Cafe 3 have developed something even smaller in their burger patties.",1632514221,1,0
"Lmao, all because we rightfully called someone out for their hate and bigotry. these twitter idiots astound me",,1632513682,1,0
Your prof glaring at you as you fall asleep in the first row of the lecture room,,1632513008,1,0
Tips on catching up with lectures,[removed],1632510478,1,0
Please vote NO on the recall. We need to stand up and support our marginalized communities at Berkeley!,,1632510169,1,0
"#WaterMadeThis: Drink Water, Win Prizes!","**What:** \#WaterMadeThis Social Media Contest / Giveaway  
**When:** Between September 20 - October 31  
**Who:** For UC Berkeley students, faculty, and staff

The UC Berkeley [Healthy Beverage Initiative](https://uhs.berkeley.edu/healthybeverageinitiative) is raffling off two $50 gift cards each week between Sept 20-Oct 31!

**To enter:** 

1. Create an Instagram post or story sharing how water helps you be well at Cal.
2. Use hashtag #WaterMadeThis and tag [@BeWellCal.](https://www.instagram.com/bewellcal/?hl=en)

Posts can be of you on campus, in nature, or showing your favorite reusable water bottle and fill station on campus. Each week, we’ll pick one post at random, as well as our favorite post to share. Winners will be notified by direct message.

**Rules:** 

* Must be a UC Berkeley student, staff, or faculty member
* The giveaway ends on October 31 at 11:59 pm
* Winners have 48 hours to respond to claim prize
* No purchase needed to enter

This giveaway is in no way sponsored, endorsed or administered by, or associated with Instagram.",1632509556,1,0
Hardest MCB Upper Divs/Difficulty of MCB Upper Divs?,"I'm a transfer student who's doing MCB. I'm currently taking MCB 102 and its super difficult (the concepts themselves are fine, it's just the sheer volume of content you need to memorize that's been tripping me up). I was wondering if the other upper divs are just as hard or if it gets easier from here on out?",1632507469,1,0
Last night's sunset,,1632506296,1,0
My endorsement of Gabbi Sharp,"Gabbi is the only senator that wants to protect people's park. Even though I'm a white home/house-less man, I live in that park. I spend the holidays at Willard park, which is like my 2nd home, so we need to protect that too. Gabbi if you can read this, I love you. My best bud Harry is Jewish. Do you like Jewish people? He is white, just so you know. Come down to the park. Find the red tent with the blue tarp hanging off the side to say hello. We'll make you a sandwich.",1632506004,1,0
EOP (Educational Opportunity Program) Academic Achievement Award Application Now Open,[removed],1632505153,1,0
Looking for 61c and 170 tutor,"Pay negotiable, if you able to tutor for either or both please dm me.",1632504561,1,0
To the people on this sub Reddit,Calling out people or commenting on them 6 hours after you saw them with a mask below there nose or something is useless and not at all productive. Either deal with it like a normal perosn and directly confront them at the time of the incident or just igonore it. Calling someone out 6 hours later on thsi subreddit doesn’t make you look smart,1632502810,1,0
Available Past Exams for your classes.,"For those who don’t already know, https://tbp.berkeley.edu/courses/ this site gives access to tons of past exams from current and past professors who taught the course. This may be good practice or just  a good reference for people to see what they should expect on their midterms/finals.",1632500928,1,0
Here’s a picture I took recently of the Campanile!,,1632500222,1,0
Is the VLSB Dinosaur made of real bones?,,1632499388,1,0
noah beck ?,why did someone send in a calfession abt noah beck being on campus? is that true? bc lol why would he be HERE,1632485582,1,0
"oh you KNOW i’m white, huh, gabbi’s friend? my parents are immigrants of distinctly non-european countries and i’ve never benefited from white privilege and would never be white-passing but okay.",,1632472526,1,0
Where can I get CNR tshirt?,[removed],1632467642,1,0
I made an iOS Shortcut to automate COVID-19 Daily Screener,[removed],1631514470,1,0
I made an iOS Shortcut to automate COVID-19 Daily Screener,[removed],1631514279,1,0
how i got lucky from the berkeley hookup sheet,"For reference, someone posted a hookup sheet [here](https://www.reddit.com/r/berkeley/comments/pgdpcx/berkeley_hookup_sheet/) which was inspired by UCLA's hookup sheet trend. even though cal's was a lot less popular, i decided to shoot my shot and it ended up paying off. i won't go into too much detail so that i won't end up doxxing me or her, but we met up, had dinner, and came back to my place. i just want to shoutout the OP who made it and hopefully all the other shy bois (you bc you use reddit) will put themselves out there",1631513620,1,0
Theta Tau Rejection,"Got rejected by theta tau the other day. Super upset about it because I felt like I made really good connections with the members there and a bunch of rushers as well, and I was super excited about possibly joining. Their vibe was so sick and It really cuts into me because it’s such a personal choice to be rejected by a frat.

I just don’t know what I could have done better, and I feel so mixed up because of it. I really saw myself being there and having fun, and now it just popped my bubble really hard. Can’t really put into words how much this sucks, and it hurts even more because now that I’ve been exposed to a frat, it makes me even more disappointed that I wasn’t able to join them because I’ve seen how great their community is. Just kind of venting here before I need to work tomorrow at 5:00 am. If any tt members are lurking here, I’d love to hear from you. 

/rant",1631513580,1,0
When mid term is around the corner and you don’t want to face the music,,1631513482,1,0
Suitcase clinic,Does anyone know what percent of suitcase clinic applicants get accepted? Trying to make myself feel better after getting rejected. I wanted to be in it so badly.,1631513205,1,0
