title,selftext,created_utc,score,total_awards_received
Easy and interesting Econ electives,"What are some easy and interesting econ electives? I'm graduating next semester, so I don't want classes that are too hard.",1636583612,1,0
Nintendo switch online in dorm,"I’m trying to connect my switch to the internet, but the eduroam isn’t working and the Ethernet also has issues. Anybody know how to fix this?",1636583089,1,0
Data Science Course Tutor offer,"Has anyone got an offer for a tutor position of Data 8, Data 100, Data 140, etc.? I knew the GSI offers have already been issued. I heard tutor offers usually come out late because they need to wait for the final grades of the students currently taking the classes and also applying to tutor next semester?",1636581270,1,0
Gamer only!!!,[removed],1636580818,1,0
I don't understand the theory behind topics in 16B. Am I screwed?,"Let's say I'm on track for an A- in the class. I know how to mechanically solve problems and I understand the motivation behind topics, but not an ounce of the theory and proofs and linalg computations and all that jazz.

Discussions are good for me, I learn through that.

I can't understand Sahai's lectures and most of the hw problems for my life. I just kind of sit there and understand maybe 10% of it and continue with my day.

Am I screwed for upper divs after 16b? Should I take Math 54 first? Should I be understanding most of the notes/lecture content in terms of what's happening to be successful in EECS upper div classes? I think I'll be fine in 16b but I'm really worried about the future.",1636580244,1,0
What’s up with the helicopters randomly circling campus lately?,,1636580221,1,0
Spring Semester Start Dates,"I'm confused on what day we should return to campus after winter break? The calendar says spring semester starts Jan 11 but classes start Jan 18, so would it be okay to come back from home just before the 18th or are there some other things I should be present for during that 11-18 interval?",1636578395,1,0
Sproul Protest?,Anyone know what the protest is about in Sproul plaza right now?,1636577144,1,0
spring housing offers,,1636575712,1,0
New School of Medicine Building Begins Construction at UCR,,1636575168,1,0
Is it common for undergrads to take a grad level course?,"I’m graduating in fall 2022, my gpa is a 3.5, and I’m really interested in taking a grad level course because it seems super cool. 

I’m a civ eng undergrad, playing around with the idea of going to law school and civ eng 268D (Law for Engineers) seems like a wonderful class to explore law and determine if I like it enough to go to law school. 

But idk if it’s reasonable to expect I’d get in. There are 2 open seats left (in a class of 30) and I need to prof’s permission to enroll. Furthermore, I can only enroll during the second week of lecture (that’s what my advisor said). 

Can I realistically get in? I really want to take this law class cause it counts to my degree (as opposed to another law class that won’t count for anything).",1636574104,1,0
Apartment search,Around when is the ideal time to start searching for apartments for next year ?,1636573510,1,0
no one’s talking about how fast FSM gets your coffee order out and how good it is,I love FSM. take my money,1636573273,1,0
Frats needs,"Hey, I’m 21 and a cute guy looking to be brought in to “take care” of a frats needs. Service the boys and be used. 

DM me :D",1636572731,1,0
Max concert ticket for sale,,1636572295,1,0
Schedule question freshman second semester,"Phase 1 I got into Econ 2, Mcb c61, and math 54. I’m thinking of adding cs61a in phase two

I’m a freshman in ls and I’m having trouble deciding on what I want to study. My schedule looks pretty mixed for next semester, and my concern is would it be too much to handle on top of clubs? And I’m thinking of joining a decal as well. I really don’t know which classes I won’t need though",1636571735,1,0
Strawberry Creek! I love how verdant our campus is :),,1636571320,1,0
CS 61B + EECS 16B + either Astron C10 or Data 100,Trying to declare CS but unsure if taking Data 100 instead of Astron C10 would become too heavy of a workload when combined with 61B and 16B. Thoughts?,1636571266,1,0
I’m a philosophy major. Send help.,,1636568020,1,0
European Junior Searching Frats,"Hello all! 

I am a French/Danish Londoner and incoming Spring/Fall Exchange student at Cal, I will be on campus for 2 semesters and I would love to be part of an adventure and a brotherhood! Is there a kind being who could put me in contact with a frat member? 

Thank you!!!",1636567605,1,0
Part-time job,"How many hours a week is too much? Is 20 hours/week as a full-time student doable, given that a student wants to exceed in all of their classes? (speaking from a premed standpoint)",1636567024,1,0
Covid test tang center timeline?,"how long do they get back results? I thought it was usually less than a day, but i got tested monday and its been 48+ hours",1636565819,1,0
PNP for EECS16A,"Hello. I’m in the College of Natural Resources and I’m taking EECS16A and CS61A now. I’ve heard that I can PNP EECS16A and take MATH54 or an equivalent class later before taking EECS16B. I think I should PNP EECS16A now and use the time to prepare for CS61A. Am I still able to do so? If yes, is it within the “preferences” section on My Academics? Thank you!",1638833485,1,0
eps 7 final,"for those who previously took the class, what's the final like? is it similar to the midterm/homeworks?",1638833301,1,0
Are there any private spaces I can reserve so that I can talk to someone over the phone?,"I looked for a library room to reserve, but they all seem taken for the time I need it for.",1638832065,1,0
Data 8 Questions,"So what's the best way to study for the final. Just doing the final exams from previous years? I want to get atleast a 85 on the exam but didn't do well on the midterm. 

&amp;#x200B;

And also are the in person exams going to be on the small lecture tables that are the size of a piece of paper. Cuz I rather have a full desk to myself than that but that's just what I've heard from others.",1638829533,1,0
TIL that rapper J Cole teaches Computer Science at Harvard University as a part time job. He once also taught rapper Lil Pump for a semester before he dropped out to save the rap game.,,1638827409,1,0
"International students heading home for break, where are you getting tested?",Need a PCR with same day result.,1638827399,1,0
Where can I sell things in Berkeley?,I accidentally bought a backpack which I don't need it. Anyone can tell me where or on which platform I can sell this backpack?,1638827160,1,0
What does the ‘R’ stand for in your RRR week?,Reked,1638827148,1,0
Warmest place in stacks?,"Are certain areas of stacks warmer than others? I am by the entrance and literally freezing, is it worth it to move somewhere or should I just dress warmer tomorrow?",1638823319,1,0
alumni seeking berkeley-based / current student photographer,"any photographers on here located in the Berkeley area?

my wife &amp; I (berkeley 2012) are going to be visiting the campus this week for our ""baby moon"" and are looking for someone to capture some pics in some old haunts. 

drop me a message if you're interested! will venmo for photos",1638822557,1,0
What happens if I signed up for M.E.T. Program and did not submit the essay required?,"I was unaware of the difficulty and additional essays required for M.E.T. 
If I don’t submit anything does my application go directly into the trash can or is it viewed for something else?",1638821243,1,0
symptomatic covid testing time,does anyone know how long it takes for the results to come out?,1638820318,1,0
Is it bad if I am doing well in my non-major classes that I barely put any effort into than the major classes I actually put effort into.,,1638819965,1,0
Surviving Sethian - Math 53,"hi bears, to those who have taken math 53, will I survive?

For context I’ve scored 73/100, 74/100 on the previous two midterms, and sethian said that between 70-85 is a B grade. I’m dead ass terrified I’ll mess things up and fail the class as people have told me the final is hard

Weighting is 30% for M1, 30% for 2, and 30% for the final. I’m just hoping someone from past experience can tell me I won’t die. As a freshie I just want to pass at the bare minimum 

Thank you 🙏",1638819279,1,0
tfw u when u could’ve had an A in one class but u f’d up so many times on small things and now will end with a B in the best scenario,I’ve never had my confidence this low 🙃🙃,1638813653,1,0
**Urgent** Look for a physics(Chem and math) tutor! Please dm for more info!,**Urgent** Look for a physics(Chem and math) tutor! Please dm for more info!,1638812694,1,0
Bruh 🥲,,1638809325,1,0
"Mutation of nucleocapsid, not spike protein, found by Berkeley scientists to be responsible for Delta variant’s increased transmissibility–possibly shifting the focus of scientists searching for culprit mutations in new variants of SARS-CoV-2 away from the spike protein",,1638807635,1,0
Sex therapy/education/help on campus?,"My partner and I wanted some questions answered from a professional, are there any resources on campus?",1638795690,1,0
Petition to replace EECS16A/B,"Sahai can ignore his course evals all he wants, but the dean of the COE can’t ignore the voices of thousands of students.

Let’s take this shit down.

https://chng.it/KCMkm2gh2S",1638786993,1,0
Petition to replace EECS16A/B,[removed],1638786874,1,0
Petition to replace EECS16A/B,[removed],1638786818,1,0
"""A tiny king in his castle today at UC Berkeley Botanical Gardens""",,1638784856,1,0
Math 54 Grade Prediction,"Hi, I'm taking Math 54 this semester with Nadler instead of taking 16A and was wondering what's the usual cutoff to get an A in the class. As of now, based on the curved scores for exams, I got a B on the first midterm (even though I got a 90% rip) and an A on the second midterm. I can clobber the first exam and replace it with my final exam score. Without a curve, my raw score in the class is a 91.25%. How has the class been curved at the end of the semester typically and does it seem plausible for me to expect to get an A after the curve? Thank you!",1638782323,1,0
Fuck CS169A,[removed],1638781878,1,0
Betterbrands’ Press Release #deadbeef,,1638780176,1,0
Why doesn’t anyone go to freehouse?,"The vibe is great, staff is super cool, food is bomb, but every time I go it’s dry af or it’s only law students.",1638780106,1,0
Betterbrands’ Press Release #deadbeef,[removed],1638779230,1,0
Best and easiest H/SS courses?,What are some of the easiest H/SS courses you’ve taken? Or l&amp;s breadth (not counting physical and natural science)?,1638777065,1,0
"Hoes will tell you to ""not compare yourself to others"" and then curve literally every class unfavorably",xD,1638776618,1,0
any PS3 students?,anyone in PS3 that would be down to go over the answers on our last assignment?,1638774803,1,0
Beach Bunny concert,hello! is anyone going to the beach bunny concert on tuesday at the fillmore in SF and would wanna uber together?,1638773950,1,0
"If they don’t get rid of 16B before I graduate, I won’t ever donate.","In 5 years 16B would be the only CS class in the entire department still funded, with the exception of 61C for students who already sign a contract with Apple. Get rid of the 16B major requirement to prevent this from happening.",1638771786,1,0
Selling 2 GA floor tickets Still Woozy 1/13/22,Pm me :),1638767837,1,0
Applicant portals,"Do any of you remember when you got your applicant portals? I applied last week, and I’m just wondering if I should be worried that I haven’t gotten anything, or if the applications take a few weeks to process. Thanks!",1638765472,1,0
Is the cal student store on sproul open during finals week?,"If not, anyone have any other recommendations for where I can get Cal themed holiday gifts during finals week?",1638764851,1,0
SINGER NEEDED,"Hello everyone unfortunately we are back and still in a search for a singer! This is gonna be a bit of a copy and paste from our original post a couple months back. With our past singers being all girls we are leaning more towards a MALE singer but still open to a female singer so don’t let it stop you from “applying” here’s a bit of stuff about us and kinda where we’re at. 

	⁃	we’re 3 22 year old guys and looking for someone around our age (21-25 preferably)
	⁃	We have a bassist drummer and lead guitar (if you could play an instrument that’s a bonus) 
	⁃	We’re based in the Bay Area (CA) and we practice around the Morgan hill area 
	⁃	We practice on Saturday nights but could work on different days (if needed) 
	⁃	We take this pretty seriously and somewhat hoping this could go somewhere so we’re looking for someone who’s similar minded 
	⁃	We have 19 songs 10 with lyrics 
	⁃	We’re looking for consistency unfortunately with our past singer it was pretty difficult 
	⁃	We’re looking for someone with a DECENT singing voice, doesn’t need to be Robert plant or Chris Cornell
	⁃	We’re looking for someone that’s around our skill level we’re beginner/intermediate leaning more on the intermediate side 
	⁃	And lastly someone who enjoys the same music as us (or close to it) we’ve put together a list of our top bands here: ALSO these are NOT in order. 
	⁃	Green Day
	⁃	Led Zeppelin
	⁃	Pink Floyd
	⁃	Rolling Stones
	⁃	Queen
	⁃	Nirvana
	⁃	Red Hot Chili Peppers
	⁃	Gorillaz
	⁃	Van Halen
	⁃	Alice In Chains 
	⁃	Radiohead 
	⁃	Tool
	⁃	Smashing Pumpkins 
	⁃	Sound garden 
	⁃	Rush 
	⁃	Black Sabbath 
	⁃	Stone temple pilots 
	⁃	Dio
	⁃	The doors 
	⁃	Pearl Jam 
	⁃	Deep purple 
	⁃	AC/DC 
	⁃	UFO

Also keep in mind if you don’t meet some of these requests it’s OKAY if you’re at all interested send us a DM on Instagram @officialmonarchyofroses we could set up an in person “audition” or send us a clip of you singing thank you for the read!",1638761871,1,0
Cal Women's Gymnastics twitter account has been hacked. Please report.,,1638759831,1,0
Fuck EE 16B,,1638757221,1,0
CS170 Project,Can anyone from previous semesters comment on what ranking you need to get full credit for the project? I don’t want to waste time improving my project when I could be studying for finals…,1638756697,1,0
Individual Study Rooms,"Do we have any individual study rooms in any of our libraries on campus? I know we have a few study rooms around that you can reserve but they are usually meant for 4-10 people study groups. Although I prefer studying in a smaller environment, I have an important job interview this Wednesday via zoom. Most of the lounges and regular study areas around me are going to be packed this week for RRR week so I'm trying to find a private space for the meeting.",1638756607,1,0
Moffit library hours on Sunday.,Does anyone know when it closes today?,1638754997,1,0
How is CS 70 with Rao?,I am going to take this class with Rao next semester. Just curious about how long does it take to finish the homework assignments and how fair are the exams,1638751150,1,0
61B final difficulty?,"I couldn't finish gitlet in time and got 20/25. Enigma I got 4 points off. 

I have 70 and 61b finals on the same day. How hard is it to pull around 60% for the final and how to study?",1638750631,1,0
Traveling queer couple looking for temp place to crash and fun host in Bay Area for trip,"Hello there, lovely creatures and fellow cosmic monsters of the bay. I hope everyone is having a wonderful day. I'll be traveling to the Bay area and staying there with my wife for a bit. Last year I made a similar post on here, and thanks to said post AND the kindness of a few strangers (we, unfortunately, lost touch with), had one of the loveliest times out in the bay. I am 23 years young, as is my wife.

&amp;#x200B;

My name is Shane (trans ftm) and my fiance (girl) and I are traveling to SF around the end of January for my 24th birthday. We'll probably be landing in Oakland or SF around February or the end of January. We are also looking for a fun place to crash for very cheap, in exchange for us to cook, in exchange for art, share stories, music, or whatever you'd like. We're both flying from Miami and would prefer someone who is LGBT friendly, open to Polyamory, etc. We're both very young artists and hope to meet many like-minded individuals. Housing doesn't have to be for all the days we're here. What we can offer: Our friendship, a wondrous time, some money, the ability to cook some amazing meals and clean, 4/20, cultural exchange, knowledge of Santeria, design your logo, I can teach you how to play guitar, we can do chores, play you music, etc.

&amp;#x200B;

We'd also absolutely love to have someone show us around, preferably someone who is a lot of fun, queer, and also 4/20 friendly. We want to really explore around this time around since everything is a lot more open than it was during our last trip to California. We really want to get down and get to know San Francisco for it's local glory and culture. Maybe explore some of the local venues, queer scene, spiritual scene, local punk and overall local music scene. We also really would love to meet someone kind, and fun that we actually get along with (we had the fortune of doing so last year with a few souls and the experience was beautiful).

&amp;#x200B;

&amp;#x200B;

A little insight: We are both polyamorous, I'm trans (FTM), she's genderqueer but identifies mostly as a cis female. I'm a musician, she works for a movie prop and film company (works on preparing props, helping film music videos, helping film commercials, etc). We are both notorious art pigeons LOL I'm a writer, creator, and we both love anything nature, we're both spiritual (I'm a witch, born into Santeria), we love going to shows, camping, exploring, activism, we're both very adventurous, fun, etc. We also ove to explore. Email us if you'd like to meet while we are down there or get to know us!!!!

&amp;#x200B;

&amp;#x200B;

A little more about us: My name is Shane, I'm 23, Cuban, a musician, a writer, excellent cook, trans (FTM), androgynous, going to local music showsshows, pansexual, love philosophy, food, skating, sightseeing, plants, spirituality, traveling, love music, doodling, playing guitar, reading, couchsurfing, etc.

&amp;#x200B;

Diana is my wife who is also 23, Ecuadorian but born in the US, Pansexual, works for the theater (collaborating sets and whatnot), loves painting with watercolors, planting, Silent Hill, designing, drawing, cheesy horror films, sightseeing, writing, and just having a grand time. This would be her second time in San Francisco.

&amp;#x200B;

P.S WE BOTH SPEAK SPANISH AND ENGLISH

&amp;#x200B;

&amp;#x200B;

MESSAGE US TO KNOW MORE. Please be genuine. Please be queer friendly.",1638750525,1,0
We win! We win! We win! Men’s Water Polo NCAA Champs!! 13-12 v USC,,1638747162,1,0
"Regret every choice I made, advice or sharing your stories is welcome.",[removed],1638746347,1,0
Somebody please me a posture decal - Bad Posture Bear,,1638745064,1,0
do you leave your stuff in the library when u need to use the restroom??,"i need to pee but lazy to bring my stuff if im just gonna be back after but scared of getting my stuff stolen :0

[View Poll](https://www.reddit.com/poll/r9rqzh)",1638744651,1,0
Is there supposed to be office hours during RRR week?,One of my classes is refusing to hold GSI office hours during RRR week... can anyone confirm if this is allowed or not because I've literally never been in a class that hasn't had GSI office hours during dead week. I thought GSIs worked the same hours during dead week?,1638744330,1,0
Fear the tree,Bring it,1638743756,1,0
How many pizzas slices is equivalent to 1 joint?,,1638738974,1,0
"International students, are you travelling home this December break?","

[View Poll](https://www.reddit.com/poll/r9paew)",1638738057,1,0
"Respectfully, fuck EECS 16B","As if people didn't have enough reasons to shit on Sahai's version of the class...

Now we have a 12 page, 15 hour homework assignment due in the middle of dead week.

Hey dipshit, if 90% of the student body is out here doing the minimum 30% on homework assignments and relying on resubmissions, maybe you're not teaching adequately or assigning unreasonably burdensome amounts of boring ass homework. If you have to set up a ""discipline bonus"" for kids to show up and get through all your course materials and most kids STILL can't keep up and give up on the bonus... maybe you're trying to force too much useless content down our throats.

I can assure you most students have more productive things to do with their time dead week than do this fucking homework. Like study for the final. Or study for other finals. Or even just take a moment to breathe, because this school is suffocating and I can't wait to be an alumnus so Berkeley doesn't see a CENT of donations while I'm thriving in my career.

I already have an offer for the summer. I am painfully aware that nothing I ever ""learn"" in this class will be of relevance in my day-to-day in my career. I swear this class is the EECS equivalent of hazing.",1638734794,1,0
"Are you stuck with your essay, research paper or finals? Do you need help completing online classes; Saylor, Sophia, Aleks, Edgenuity, BB or Canvas? If you need help, hmu vawritings36@gmail.com Discord Doesit#3178",,1638734597,1,0
Gotta love the Cal fans!!,,1638734342,1,0
ISF 98 Attack on Titan,[removed],1638732681,1,0
ISF 98 attack on titan class,anyone else taking the class about attack on titan for spring,1638732449,1,0
[Chance Me] California Community College Student applying to UC Berkeley,[removed],1638730220,1,0
Typically how much percentage difference exists between a B+ and a B- for classes like cs 170?,"Like if you consider the raw score out of the max score, usually what is the percentage difference between the two?",1638724877,1,0
Easiest A H/SS courses?,[removed],1638711380,1,0
Sex therapy (cal sexperts),[removed],1638711258,1,0
Where can I find a mental health therapist around here?,,1638710782,1,0
Hardest part about Berkeley?,"Hey ya’ll, what does everyone think is the hardest part about being a student at cal? Curious to see if we relate.",1638698278,1,0
Deadline to submit LORs?,"Applying to a graduate program at UC Berkeley, the deadline for the application is December 8, after sending the invite emails to recommenders, how much time is given to the professors to respond and submit their LOR?",1638695548,1,0
scream,Can we do a collective RRR week scream pls &amp; thank,1638695401,1,0
"Forgot To Get Flu Shot, am I screwed?","I completely forgot to get the flu shot and about the November 19th mandate, I noticed when I was blocked for registration today. If I get the flu shot tomorrow should I be cleared for next semester?",1638692075,1,0
Genuinely disappointed in UC Berkeley.,"I got rejected last year, and this dude who filled his application with blatant lies got in. He mentioned that he participated in the IMO but no one from our school even cleared Regionals. His application is like 200% lies, stuffs he didn’t even have connection with. I don’t want to disclose his name as I’m one of the few people he told and if you’re reading this FUCK YOU. He never gets tired of reiterating to me that it’s fine I didn’t get in even though I stopped giving a shit. He really gets on my nerves sometimes. He is even mentoring our juniors now 😭😭😭 VERY IRONIC. UCB you should really start fact checking. I’m disappointed in UCB because I’ve been emailing about this dude ever since he got in and I haven’t even received an acknowledgment to date. If someone can help me with this please PM me. I know a lot of genuine people from UCB and I dearly think this person doesn’t belong there and should face his karma. Sorry for the rant.",1638690537,1,0
Bear Territory part 2,,1638689303,1,0
Field stormed in the USC game,,1638689097,1,0
CAL BEATS USC 24-14,THE BEARS HAVE DONE IT AGAIN. OSKI IS PLEASED AT OUR TRIUMPH OVER THE SPOILED CHILDREN. THIS IS A SATISFYING END TO THE SEASON.,1638688171,1,0
ROOFTOPS?!???,Yo any nice ass rooftops with a good view to get into at night. Want to stargaze and enjoy a nice view but doe is too crowded. SUGGESTIONS PLS,1638686915,1,0
What's with the green Cal jacket at the USC game? Never seen this lol,,1638686794,1,0
"I need to use a soldering iron and hot glue gun for a personal project of mine, where could I use these?",Are there any places on campus that would let me use just a little bit?,1638686440,1,0
how to join KASA?,wanna join KASA for spring. not korean but i hope that's not a determining factor. what's involvement like also? is there an extensive app process?,1638685659,1,0
DATA C8 course on community college,"I am an aspiring Media Studies major. My CC offers a course, which is UC Transferable for Data C8.

Upon reading the Media Studies department website, it is said that ""students must take the research methodologies course at Cal in order to better guarantee topics, assignments, and readings comparable with those research methodologies courses offered by our program.""

I am confused because it is transferrable for the Data Science major, but I doubt it would be the same for Media Studies.

Will it be ideal to just take the class next semester or just enroll in it once I transfer?

Here is the link for the UCB Media Studies website: [UC Berkeley Media Studies Requirements](https://mediastudies.ugis.berkeley.edu/requirements/)",1638684588,1,0
Xfinity bs,Is anyone else’s xfinity wifi absolute dog shit recently? I can’t even stream HBO and I’m the only one using the wifi ?!?! &lt;I live in south side btw&gt;,1638681919,1,0
