title,selftext,created_utc,score,total_awards_received
Student Health Insurance Plan Update (and Action Items) from Grad SGA,"Email from Lea Harris, Grad SGA President:

I write to you today to inform you of the proposed changes by the University System of Georgia to the Georgia Tech student health insurance plan (SHIP) which over 4000 of us grad students are a part of. The USG is considering a proposal that could **increase** **our** **student health insurance costs by as much as 30% ($660/ year), reduces** **insurance benefits, and take** **the embedded dental and vision coverage** **out of** **the mandatory** **plan.** This is being done at no benefit to Georgia Tech students, but to reduce the insurance costs for students at other institutions within the USG, by combining the Georgia Tech SHIP with the USG SHIP. If implemented, this plan severely threatens the healthcare finances of over 6500 Georgia Tech students and their dependents **f**or the foreseeable future. As your graduate student body president, I have been fiercely advocating against these changes at the university system level. The institute leadership is also advocating on behalf of all Tech students. The proposal is set to be **reviewed by the USG leadership as early** **as the** **week of March 8th.**

**How can you** **make your voices heard?**

* **Sign this** **formal** [**petition**](https://nam12.safelinks.protection.outlook.com/?url=https%3A%2F%2Fgatech.co1.qualtrics.com%2Fjfe%2Fform%2FSV_9HreIA95MEQoWSa&amp;data=04%7C01%7Cgswift6%40gatech.edu%7C45ca8555340f42e320e708d8df4ccd28%7C482198bbae7b4b258b7a6d7f32faa083%7C0%7C0%7C637504868256476732%7CUnknown%7CTWFpbGZsb3d8eyJWIjoiMC4wLjAwMDAiLCJQIjoiV2luMzIiLCJBTiI6Ik1haWwiLCJXVCI6Mn0%3D%7C1000&amp;sdata=6S9WBvE4jOSrfQDAxKg061YJEmIY1qZ5IOhScbvqbTk%3D&amp;reserved=0) **by Sunday March 7th -** directed towards USG Chancellor Wrigley and the Board of Regents: This time the USG leadership needs to hear directly from every single one of us who will be affected by these changes. You can do this by signing this formal petition put together on behalf of our graduate student body by Graduate SGA.
* **Email** **the USG chancellor and call the Board of Regents by tomorrow or first thing Monday, March 8th:** A petition alone may not be enough to convince the USG otherwise. That is why I encourage you to express your concerns directly to the USG Chancellor or any member of the Board of Regents. Here is an [email/call-template](https://nam12.safelinks.protection.outlook.com/?url=https%3A%2F%2Fdocs.google.com%2Fdocument%2Fd%2F1DmsKebxYpl-Ucgn_h9jraklF-H3g6YQfzcHi_AOfUHE%2Fedit%3Fusp%3Dsharing&amp;data=04%7C01%7Cgswift6%40gatech.edu%7C45ca8555340f42e320e708d8df4ccd28%7C482198bbae7b4b258b7a6d7f32faa083%7C0%7C0%7C637504868256476732%7CUnknown%7CTWFpbGZsb3d8eyJWIjoiMC4wLjAwMDAiLCJQIjoiV2luMzIiLCJBTiI6Ik1haWwiLCJXVCI6Mn0%3D%7C1000&amp;sdata=PB8x%2BzUZjFVOoGhJ8g%2FlZWGU8dFeJy8fEFS6wlvQBIU%3D&amp;reserved=0) for graduate students and [contact list](https://nam12.safelinks.protection.outlook.com/?url=https%3A%2F%2Fdocs.google.com%2Fdocument%2Fd%2F1yRm6FvZ-6EWkRKdYsKfyKBCCDxr2Dm3u0CnMOFbQCTA%2Fedit%3Fusp%3Dsharing&amp;data=04%7C01%7Cgswift6%40gatech.edu%7C45ca8555340f42e320e708d8df4ccd28%7C482198bbae7b4b258b7a6d7f32faa083%7C0%7C0%7C637504868256486724%7CUnknown%7CTWFpbGZsb3d8eyJWIjoiMC4wLjAwMDAiLCJQIjoiV2luMzIiLCJBTiI6Ik1haWwiLCJXVCI6Mn0%3D%7C1000&amp;sdata=hZYTdASGR5SCUEcv5JlaXfhCy6BMhvOJM0TbSfLZeys%3D&amp;reserved=0) to use if you need. 
* **Spread the** **word:** Tell your GT friends, colleagues, lab mates, and **faculty advisors** to sign on to the petition and raise the concerns with their bosses or use this [generic call script](https://nam12.safelinks.protection.outlook.com/?url=https%3A%2F%2Fdocs.google.com%2Fdocument%2Fd%2F1hp6FQYmuifsvZID7YZSnPMB4KAKWA3uf-aBaZd2uMj4%2Fedit%3Fusp%3Dsharing&amp;data=04%7C01%7Cgswift6%40gatech.edu%7C45ca8555340f42e320e708d8df4ccd28%7C482198bbae7b4b258b7a6d7f32faa083%7C0%7C0%7C637504868256496852%7CUnknown%7CTWFpbGZsb3d8eyJWIjoiMC4wLjAwMDAiLCJQIjoiV2luMzIiLCJBTiI6Ik1haWwiLCJXVCI6Mn0%3D%7C1000&amp;sdata=iIJ%2F3leEZKNL9R%2Bi3vSILLli7FSlrW51aDq1rfzoDK0%3D&amp;reserved=0) to advocate on your behalf.

**Where can I find more information about the proposed** **increases?**

Currently, the Georgia Tech SHIP is external to the USG SHIP provided to all institutions, specifically negotiated through the advocacy of Graduate Students and the support of GT administration for the campus to reduce costs and increase services. Although this plan has been approved by the USG for many years, the USG is proposing to dissolve the independent Georgia Tech SHIP and consolidate to a single plan available for all institutions in the 2021-2022 year.  The concerns regarding these proposals are wide, but here are some primary points:

* all unified plans **remove Georgia Tech’s included** **dental and vision coverage** and replace it with an optional USG dental plan that costs $360 per year
* all proposed options increase Georgia Tech premiums, deductibles, and out-of-pocket maximums for this **overall** **lower service coverage**.
* worst-case proposals include **increases** **of** **$224** **to the Premium,** **$250** **to Deductible, and $2600** **to** **Out-of-Pocket** **Maximum**

Other repercussions regarding the impacts on the on-campus health centers such as Stamps, DePoe, and Tech Dentistry are possible, but Grad SGA and the Georgia Tech administration have been advocating fervently to the USG stakeholders for Georgia Tech to remain on its own plan. We fear these changes could result in the closure or reduced services at these on-campus providers.The Grad SGA Graduate Student Senate (GSS) passed a resolution on March 2nd in opposition to the proposed SHIP consolidation, which can be seen [here](https://nam12.safelinks.protection.outlook.com/?url=https%3A%2F%2Fcpb-us-w2.wpmucdn.com%2Fsites.gatech.edu%2Fdist%2F9%2F988%2Ffiles%2F2021%2F03%2FResolution_Opposition-Proposed-SHIP-Changes.pdf&amp;data=04%7C01%7Cgswift6%40gatech.edu%7C45ca8555340f42e320e708d8df4ccd28%7C482198bbae7b4b258b7a6d7f32faa083%7C0%7C0%7C637504868256496852%7CUnknown%7CTWFpbGZsb3d8eyJWIjoiMC4wLjAwMDAiLCJQIjoiV2luMzIiLCJBTiI6Ik1haWwiLCJXVCI6Mn0%3D%7C1000&amp;sdata=QMw47Zp%2BR1nMURpxmCNgxBgSZBOrtZsfsub5EzIdVrE%3D&amp;reserved=0), to ensure that the USG understands the magnitude of the impact of changes on Georgia Tech Graduate Students.

Please know that your access to affordable healthcare and financial well-being are top priorities of ours, so I want to thank you for your time and consideration.",1614897454,77,1
Love the social distancing guys 😍,[deleted],1614896030,4,0
How hard is it to internally transfer to Industrial Engineering (Non-freshman and/or transfers) ?,[removed],1614894483,1,0
How hard is it to internally transfer to Industrial Engineering (Non-freshman and/or transfers)?,,1614894248,1,0
Proposed student health insurance changes: update &amp; call to action,"Below is an email that graduate students received today from Lea Harris (grad SGA pres) regarding the proposed SHIP changes. Not sure if undergrads received it one too. Please sign the formal petition and email/call USG representatives about this if you have a second today or tomorrow!

\---------------------------------------------------------------------------

Good Afternoon Fellow Grad Yellow Jackets,

I write to you today to inform you of the proposed changes by the University System of Georgia to the Georgia Tech student health insurance plan (SHIP) which over 4000 of us grad students are a part of. The USG is considering a proposal that could **increase** **our** **student health insurance costs by as much as 30% ($660/ year), reduces** **insurance benefits, and take** **the embedded dental and vision coverage** **out of** **the mandatory** **plan.** This is being done at no benefit to Georgia Tech students, but to reduce the insurance costs for students at other institutions within the USG, by combining the Georgia Tech SHIP with the USG SHIP. If implemented, this plan severely threatens the healthcare finances of over 6500 Georgia Tech students and their dependents **f**or the foreseeable future. As your graduate student body president, I have been fiercely advocating against these changes at the university system level. The institute leadership is also advocating on behalf of all Tech students. The proposal is set to be **reviewed by the USG leadership as early** **as the** **week of March 8th.**

**How can you** **make your voices heard?**

1. **Sign this** **formal** [**petition**](https://nam12.safelinks.protection.outlook.com/?url=https%3A%2F%2Fgatech.co1.qualtrics.com%2Fjfe%2Fform%2FSV_9HreIA95MEQoWSa&amp;data=04%7C01%7Clmoran9%40gatech.edu%7C29697bd97626433ad9e808d8df47e921%7C482198bbae7b4b258b7a6d7f32faa083%7C0%7C0%7C637504847266297815%7CUnknown%7CTWFpbGZsb3d8eyJWIjoiMC4wLjAwMDAiLCJQIjoiV2luMzIiLCJBTiI6Ik1haWwiLCJXVCI6Mn0%3D%7C1000&amp;sdata=8ct%2BcFO%2FglQ2HwcpPLAgAG7Hf12ptFFCTupNeufF13o%3D&amp;reserved=0) **by Sunday March 7th -** directed towards USG Chancellor Wrigley and the Board of Regents\*\*:\*\* This time the USG leadership needs to hear directly from every single one of us who will be affected by these changes. You can do this by signing this formal petition put together on behalf of our graduate student body by Graduate SGA.
2. **Email** **the USG chancellor and call the Board of Regents by tomorrow or first thing Monday, March 8th:** A petition alone may not be enough to convince the USG otherwise. That is why I encourage you to express your concerns directly to the USG Chancellor or any member of the Board of Regents. Here is an [email/call-template](https://nam12.safelinks.protection.outlook.com/?url=https%3A%2F%2Fdocs.google.com%2Fdocument%2Fd%2F1DmsKebxYpl-Ucgn_h9jraklF-H3g6YQfzcHi_AOfUHE%2Fedit%3Fusp%3Dsharing&amp;data=04%7C01%7Clmoran9%40gatech.edu%7C29697bd97626433ad9e808d8df47e921%7C482198bbae7b4b258b7a6d7f32faa083%7C0%7C0%7C637504847266307771%7CUnknown%7CTWFpbGZsb3d8eyJWIjoiMC4wLjAwMDAiLCJQIjoiV2luMzIiLCJBTiI6Ik1haWwiLCJXVCI6Mn0%3D%7C1000&amp;sdata=5GrpTTi7OBLfvt0MvsOhiWHRasGj6oPYjgEUZgM16DI%3D&amp;reserved=0) for graduate students and [contact list](https://nam12.safelinks.protection.outlook.com/?url=https%3A%2F%2Fdocs.google.com%2Fdocument%2Fd%2F1yRm6FvZ-6EWkRKdYsKfyKBCCDxr2Dm3u0CnMOFbQCTA%2Fedit%3Fusp%3Dsharing&amp;data=04%7C01%7Clmoran9%40gatech.edu%7C29697bd97626433ad9e808d8df47e921%7C482198bbae7b4b258b7a6d7f32faa083%7C0%7C0%7C637504847266307771%7CUnknown%7CTWFpbGZsb3d8eyJWIjoiMC4wLjAwMDAiLCJQIjoiV2luMzIiLCJBTiI6Ik1haWwiLCJXVCI6Mn0%3D%7C1000&amp;sdata=jiHlAdeitpxJ9qBxa5z3zPu3VzApuRQuknRyN0axaQE%3D&amp;reserved=0) to use if you need. 
3. **Spread the** **word:** Tell your GT friends, colleagues, lab mates, and **faculty advisors** to sign on to the petition and raise the concerns with their bosses or use this [generic call script](https://nam12.safelinks.protection.outlook.com/?url=https%3A%2F%2Fdocs.google.com%2Fdocument%2Fd%2F1hp6FQYmuifsvZID7YZSnPMB4KAKWA3uf-aBaZd2uMj4%2Fedit%3Fusp%3Dsharing&amp;data=04%7C01%7Clmoran9%40gatech.edu%7C29697bd97626433ad9e808d8df47e921%7C482198bbae7b4b258b7a6d7f32faa083%7C0%7C0%7C637504847266317726%7CUnknown%7CTWFpbGZsb3d8eyJWIjoiMC4wLjAwMDAiLCJQIjoiV2luMzIiLCJBTiI6Ik1haWwiLCJXVCI6Mn0%3D%7C1000&amp;sdata=qqoHgLEnk%2FDb%2BMogWar%2FYVasfcoNuAuHRL3ImSVHibg%3D&amp;reserved=0) to advocate on your behalf.

**Where can I find more information about the proposed** **increases?**

Currently, the Georgia Tech SHIP is external to the USG SHIP provided to all institutions, specifically negotiated through the advocacy of Graduate Students and the support of GT administration for the campus to reduce costs and increase services. Although this plan has been approved by the USG for many years, the USG is proposing to dissolve the independent Georgia Tech SHIP and consolidate to a single plan available for all institutions in the 2021-2022 year.

The concerns regarding these proposals are wide, but here are some primary points:

* all unified plans **remove Georgia Tech’s included** **dental and vision coverage** and replace it with an optional USG dental plan that costs $360 per year
* all proposed options increase Georgia Tech premiums, deductibles, and out-of-pocket maximums for this **overall** **lower service coverage**.  
* worst-case proposals include **increases** **of** **$224** **to the Premium,** **$250** **to Deductible, and $2600** **to** **Out-of-Pocket** **Maximum** 

Other repercussions regarding the impacts on the on-campus health centers such as Stamps, DePoe, and Tech Dentistry are possible, but Grad SGA and the Georgia Tech administration have been advocating fervently to the USG stakeholders for Georgia Tech to remain on its own plan. We fear these changes could result in the closure or reduced services at these on-campus providers. 

The Grad SGA Graduate Student Senate (GSS) passed a resolution on March 2nd in opposition to the proposed SHIP consolidation, which can be seen [here](https://nam12.safelinks.protection.outlook.com/?url=https%3A%2F%2Fcpb-us-w2.wpmucdn.com%2Fsites.gatech.edu%2Fdist%2F9%2F988%2Ffiles%2F2021%2F03%2FResolution_Opposition-Proposed-SHIP-Changes.pdf&amp;data=04%7C01%7Clmoran9%40gatech.edu%7C29697bd97626433ad9e808d8df47e921%7C482198bbae7b4b258b7a6d7f32faa083%7C0%7C0%7C637504847266317726%7CUnknown%7CTWFpbGZsb3d8eyJWIjoiMC4wLjAwMDAiLCJQIjoiV2luMzIiLCJBTiI6Ik1haWwiLCJXVCI6Mn0%3D%7C1000&amp;sdata=jguMt5BHLWekVfTzvSQBIEFHOE94iL8F4RM88LvzsKM%3D&amp;reserved=0), to ensure that the USG understands the magnitude of the impact of changes on Georgia Tech Graduate Students. 

Please know that your access to affordable healthcare and financial well-being are top priorities of ours, so I want to thank you for your time and consideration. 

In Progress and Service, 

Lea Harris 

Graduate Student Body President",1614891950,60,1
"Ever wondered what life is like for a Georgia Tech LMC student? Wonder no more, with this educational AND fun-ducational video!",,1614887400,33,0
I am officially insane,I have gone so long doing only school related work that I am literally doing homework in MY FREAKING DREAMS. When my professor said you will be doing these problems in you sleep this is not what I had in mind,1614882079,187,1
GLC Lost and Found,"I left my belt and headlamp in the GLC laundry room, forgot about it for a day, came back and everything on the counters was gone. I’ve asked around, but nobody seems to know where it could have gone and the housing office lost and found says nobody checked into the lost and found. Did they toss my belt and headlamp?? Anyone have any ideas about who i should contact",1614882047,3,0
Smooth Brain Advertising,,1614876960,30,0
Happens to the best of us,,1614876369,701,3
Single Dorm as Freshman?,[removed],1614873805,0,0
You owe it to yourself to stand up for yourself and your classmates,"Yesterday, we got our homework grades back in one of my classes. I personally, was absolutely crushed. I failed after pouring over 30 hours into what was honestly a rather small assignment, one that was a decent chunk of my grade. I thought I was pretty alone. Checking the class groupchat, I found out I was wrong. I spoke with my classmates, we all shared our grievences and wondered what to do. Couple hours passed, and now there's an open letter on our piazza addressing the Professor and the TAs about harsh grading rubrics, with nearly 30 people chiming in and still growing. The professor is now reviewing grading policies and reassessing the assignment. All because we simply communicated with eachother.

I was overjoyed, but all I can think of is all the bad grades i've tanked in the past that I thought were a bit unfair just because ""the rubric said so"" and didn't communicate. It honestly changed my entire mood yesterday and gave me some hope for the class going forward. If you think a grading scheme is unfair, talk to your classmates people. Go beyond a regrade if it gets to that, **we all need every break we can while we're having to take classes through a screen.** 

It takes some courage, but plant your feet and fight for your grades and *you.* This is a tough semester, fight it as hard as it's fighting you.",1614872869,228,2
Debate Team at GT,"Greetings fellow Yellow Jackets. We at Debate Team have just been officially rechartered as an RSO (registered student organisation).

![img](n2i9r3u551l61 ""We have a groupme:  
https://app.groupme.com/join_group/66587496/zDPlxxY0 "")

[Groupme](https://app.groupme.com/join_group/66587496/zDPlxxY0)

Now before the non-debate people stop reading, Debate Team at Georgia Tech is going to be about much more than competitive debate. We’re aiming to not only facilitate tournaments and competitive debate, but all forms of discourse. Our first event is going to be a round table discussion about mental health at GT. All are welcome, we hope to see you there!

[To learn more and keep updated about our events we encourage you to join our discord at https:\/\/discord.gg\/MzwXFenkfP](https://preview.redd.it/393dgqvh51l61.png?width=1215&amp;format=png&amp;auto=webp&amp;s=272ea53a68ddcea94a5fc1aa30c352145a10ab4f)

[Discord](https://discord.gg/MzwXFenkfP)

[If you’d like to be a member of Debate Team you can find us on engage at https:\/\/gatech.campuslabs.com\/engage\/organization\/debate-team we have no dues this semester.](https://preview.redd.it/xfmi43tb51l61.png?width=702&amp;format=png&amp;auto=webp&amp;s=385f3697eda9b3fd61ed6a8b4a913c0b72edb11d)

[Engage](https://gatech.campuslabs.com/engage/organization/debate-team)

NB - I did some edits to insert hyperlinks",1614871829,7,0
Budget PCR tests for travel,[removed],1614868215,1,0
Online summer classes for transferring credits,[removed],1614864856,1,0
Waiting for the MSCS admission decision,[deleted],1614861914,0,0
how are FE residences different from undergraduate residences?,[deleted],1614847535,3,0
Food Insecurity in Atlanta Survey,"CS 3873 is a UI design class, and this semester every group's focus is on food insecurity in Atlanta. Our group specifically is looking into the ability of Atlanta residents to access resources related to food insecurity. This means that even if you do not experience food insecurity yourself, your responses are still valuable to our team.

It would mean a lot if you could take a couple minutes to complete the survey linked below:

[https://docs.google.com/forms/d/19aE4ikNgWceJp6jMB2SNeweRqvnT7rEI0ZJpPEZ32Lc/prefill](https://docs.google.com/forms/d/19aE4ikNgWceJp6jMB2SNeweRqvnT7rEI0ZJpPEZ32Lc/prefill)

Thank you!",1614837322,9,1
Taking online classes for transfer credit during the summer,[removed],1614836064,1,0
"Does computer science 2ll0 drop a HW, or did they in past semesters?",[removed],1614828273,0,0
"Does CS2110 drop a HW, or did they in the past?",[removed],1614827342,1,0
Feedback Needed : GaTech Mental Health App???,,1614822087,1,0
Storage unit for summer,I was looking online for a place where to leave a bike and some other stuff for the summer. Have you ever used Life Storage? Which company do you recommend? Thanks!,1614821896,3,0
Advisor Scheduling,"I noticed for my advisor, I have to schedule an appointment via the advisor link but whenever I press it, it says there is an issue with the website. Is that just my laptop being dumb or is that link not working and if so should I just email my advisor for an appointment?",1614821089,3,0
Course Withdrawal Questions,"I had a midterm due on Tuesday, but I thought the deadline was Thursday. I emailed my professor about the issue and he’s not being lenient about my mistake. I know I’m not going to be able pass this class/I’ll barely pass this class now because of this, and I’m considering withdrawing from the course. The big thing I need answered is how does withdrawing from a course impact you later (specifically in applying to grad school)? The part that really has me worried is it’s a piss easy class (engl 1102) and my transcript’s going to have a W for it which I have a strong feeling is going to look really bad. 

Thanks in advance.",1614820305,5,0
Is there a megathread or place where GT club GroupMes are linked?,,1614815608,7,0
Honors or Explore LLC,"Hello,

I'm about to apply for Living-Learning communities, and I have the Explore and Honors LLCs as my top choices, but I'm having trouble picking one to put as my first choice.

I'm majoring in Biomedical Engineering (premed) and Explore offers a lot of research and career opportunities. However, the Honors college is more diverse from what I have heard, and has exclusive coursework + better teachers.

Which one should I choose? I'm leaning towards Explore since I'd like to do research as soon as possible. If I get accepted to both, will I still have a choice or will I automatically be enrolled in my first choice?",1614814837,1,0
Help me understand how the environment helps to relieve stress,"Hi all! I am a student in the school of building construction at Georgia Tech! I am recruiting experiment participants. You will spend 6-minutes break seating on a chair, wearing an eye-tracking device. It will take about 30 minutes in total, and there will be $10 compensation. It is IRB-approved. Please reach out to me if you have any questions!

For registration: [https://doodle.com/mm/yujinkim/schedule-experiment](https://nam12.safelinks.protection.outlook.com/?url=https%3A%2F%2Fdoodle.com%2Fmm%2Fyujinkim%2Fschedule-experiment&amp;data=04%7C01%7Cyujin.kim%40gatech.edu%7C7a87448b489d44914aff08d8d9acaa5a%7C482198bbae7b4b258b7a6d7f32faa083%7C0%7C0%7C637498682922682207%7CUnknown%7CTWFpbGZsb3d8eyJWIjoiMC4wLjAwMDAiLCJQIjoiV2luMzIiLCJBTiI6Ik1haWwiLCJXVCI6Mn0%3D%7C1000&amp;sdata=TGmixiHmORCXir8mPjPb3o7CWFFRA%2Bvd4Z4r44H5L5U%3D&amp;reserved=0)

&amp;#x200B;

https://preview.redd.it/onb7slzrdwk61.png?width=687&amp;format=png&amp;auto=webp&amp;s=1d2f36d7eb1e041d36be9576911c0cfd30e10c9a",1614814103,2,0
ISO Math Tutoring Help!,Anyone in here know anyone that would be willing to do some math tutoring? (specifically Calc 1),1614813308,2,0
Help me understand how the environment helps to relieve stress!,[removed],1614813237,1,0
Any tips for being a successful Georgia Tech student?,"Hi, I will transfer to Georgia Tech in the Summer semester, and I don't have much information about it.

My major is ME, and I am an international student. So I have to take 12 credits at least in the summer.

I have a lot of questions listed below.

1. Is the pre-requisite chain absolute? Is it possible to get an exception? I haven't taken Linear Algebra and some courses at my current university, and it looks like it will affect my class choices, graduation a lot.
2. Is it stressful to take 12 credits in the summer?
3. My plan for the summer semester is  
Math1553(Linear algebra, 2credit),   
Me1670( Engineering Graphics&amp;design,3credit),   
ECE3710(Circuits&amp;Electronics,2credit)  
COE2001(Statics,2credit)  
Wellness(2credit)  
IYSE3025(Engineering economics,2credit)  
Are there any tips for taking these classes? Will this be a stressful schedule?
4. Where do students mostly live? How much do you guys pay for the housing?
5. Any other tips?",1614812150,5,0
Based on a true story,,1614809241,397,1
What'd you do to help you improve in a course in which you were struggling?,"Hi everyone, 

I had to drop a course (Diffy EQ) after talking with my professor and learning that I basically needed to get 47/66 remaining points to get a C. I was already at the cusp of C, 71%. Not missing 19 points would've been like trying to avoid stepping on concrete. I averaged less than 70 on quizzes and got exactly 70 on the first exam. For me, the next logic step was to withdraw.

I was struggling pretty badly in the course despite doing the usual: office hours, plus sessions, tutoring, paid tutoring, practicing problems....

I'm trying to figure out why I struggled so much. Have any of you been in this situation at GT? What'd you do that helped? What didn't help?

Thanks for your responses",1614809218,4,0
Petition to extend Georgia Tech Spring break,,1614808705,4,0
Canvas Has Unfortunately Died,Push those deadlines back eh?,1614807220,127,0
Food Insecurity in Atlanta Survey - CS 3873,[removed],1614806500,1,0
Regular online game night?,I'm looking for a group of people to chill out with online maybe once a week - maybe play some codenames? Is there a group like this that exists? :),1614801671,22,0
Waking up the day after beating Dook be like:,,1614798267,126,0
Cops Outside Wesley Foundation,[removed],1614797306,1,0
Q for Tech Students - Is there a temp job postings place to look for web design temp work?,I'm a small law firm who has all but given up trying to design my web page. Its an easy website that anyone who knows this stuff could do with ease - I am sure there are 1000s of students at Tech who could crush this type of thing. Where can I go to advertise to find someone to help me?,1614794086,5,0
I'm really concerned about the mental health of this school right now,"I walk on campus and I see anxiety on peoples faces right now. And even I feel so isolated from everyone else. 

Please reach out to your friends right now. And if your administration or something alike, please help this school. We are struggling right now.",1614780719,360,10
