title,selftext,created_utc,score,total_awards_received
What programming languages used in GT?,"I just got into Georgia tech college of computing and am like 99% likely to attend. However, I have very limited coding experience. How much coding does Tech expect its first year students to have and is there a language that is particularly useful? I’m refreshing on Java by myself for like the last month since the only experience I have is in my sophomore AP CSA class which felt more geared towards passing the test than actually knowing how to code lol.",1615787992,1,0
"Got Waitlisted. What do I write for the ""statement of continued interest""?",[removed],1615785560,1,0
Class sizes for intro classes,"I’m a prospective class of 25 student majoring in civil engineering. I was wondering how many students are typically in the basic engineering classes such as calculus, physics, statics, etc. I can only find average class size overall on the internet. any response is appreciated :)",1615781217,1,0
Opinions on GT for Chemistry?,[removed],1615778802,1,0
tech for chemistry,[removed],1615778584,1,0
Arts and sciences pathway program,[removed],1615778278,1,0
Are we allowed to climb trees on campus?,see title. I was just thinking of climbing a few and the thought of whether or not it's allowed under GT policy or whatever came to mind. Thanks!,1618000333,1,0
TA Interview Preparation,I just got selected to interview to be a TA for a CS class I am taking and I am wondering what the interview process entails. Any advice would be greatly appreciated!,1617993622,1,0
I just want to go home man,,1617992836,1,0
Survey about new Tech Dining for Fall 21,[removed],1617989115,1,0
Living Learning Communities Question,"Hey guys, I just committed to GT for fall 2021, and I also just submitted my LLC application to Grand Challenges and Explorer. How hard is it to get into these two LLCs? Thanks!",1617988791,1,0
Dining Survey For New Dining Operation,[removed],1617988182,1,0
Dodgecoin to the moon?,[removed],1617980679,1,0
How many CORE classes do I need to apply?,"I'm on the final leg of my junior year, and I am trying to figure out what classes to take in my senior year of high school. I have 4 CORE classes, but my counselor says that I need 5, right now, I have discrete math, pre-calc-trig/calc, astronomy, and English contemporary drama. I also have an AP music theory course, would that count as a fifth, and would I still be able to apply?",1617977288,1,0
Will I get rescinded for an A in my regular class and 2 B’s and a C if I’ve been a straight A student and 1st in my class as an OOS?,"Currently got a 95 in my accounting class but a 87 in Spanish, 82 in APUSH, and a 70 in English this mp . Hopefully I can get my Spanish to an A, my APUSH to a mid B, and my English to a 80 by the of the year since my school reports only semester grades 😭. How worried should I be?",1617975249,1,0
UMD Full Ride vs GA Tech OOS for CS,"I'm from PA and I plan on majoring in CS. I got a full ride to UMD so the net cost is $0. GA Tech would be $50k/yr, but my parents will pay half, so my contribution would be $25k/yr. It seems that in some subfields of CS like Computer Vision that I'm interested in, UMD might offer the same or even more academic opportunities than GA Tech. With my AP credits, I should be able to complete UMD in 3 years easily, but graduating early might be more difficult at GA Tech. It also looks like a lot of Computer Vision jobs prefer Masters/PhD holders, so grad school is not off the table right now. I know GA Tech has a 5-year master's program (UMD does too), but I'm not sure if I would want to do that at GA Tech (or even UMD for that matter). I also have some interests in cybersecurity and I got into a smaller living-learning community at UMD that specializes in it, so I should be able to make friends easily. Will GA Tech offer more opportunities in terms of internships and job opportunities than UMD, or will I get the same if I work hard and be proactive at UMD?",1617974716,1,0
Senior year grade concerns for incoming freshman,"I’ve always had straight A’s throughout high school and am currently 1st in my class as an oos student.

However, this mp I have a 95, 85, 82, 75. I could probably get this to a 95, 88,85, 83 for the semester if I grind next mp and my school only reports semester grades.

How much on the border am I of getting rescinded?",1617974643,1,0
Can I get rescinded for lots of Bs after having straight A’s through high school as an oos valedictorian?,[removed],1617973499,1,0
Housing First yr Question,"How do first yr students declare what building they want to live in?
Does it happen after paying the 600 $ deposit?

I have absolutely no idea about which building are good, please help me with what should I choose and what not? I am joining as a Chemical Eng. Major.

Ps - I am an intl student.",1617953167,1,0
some small yet bothersome things that affect my perception of this school,[removed],1617947431,1,0
Describe Tech’s campus life in one word.,"Prospective freshman here looking to gain insight on Georgia Tech, if possible maybe elaborate on the reason why you chose that word?",1617938529,1,0
Hive PI Interview??,"I got an interview to be a PI at the Hive somehow and I have no idea what to expect. I'm a first year CS major and all my interview experience so far has been failing the fuck out of technicals for internships, so anyone got any tips?",1617933597,1,0
Found an eggplant outside of boggs,,1617931737,1,0
BIOS 1107 or 1108?,[removed],1617931484,1,0
Found an eggplant outside boggs,,1617931035,1,0
[Buy/Sell] Commencement Spring 2021 Tickets,"https://commencement.gatech.edu/tickets

#Spring 2021 Ticketing Policy
All spring ceremonies will be ticketed. Students who submitted an RSVP during the designated RSVP period will be issued five guest tickets. 

* This is a reserved seating event. Students will select their seating zone during our ticket distribution period. 
* Children under the age of two who can sit on a parent's lap for the ceremony do not need a ticket.
* Students should not exchange tickets to help maintain physically distanced seating clusters. 
* Tickets are only valid for their listed ceremony; e.g. Friday ceremony tickets cannot be used for the Saturday ceremony.
* Late RSVPs will receive a reduced amount of tickets.
* Students may not register to attend to receive tickets on behalf of another student. 

The Spring 2021 ceremony is a rain or shine event.

#Ticket Zone Selection
The RSVP period for Spring 2021 Commencement has closed.  Those who have RSVP'd must select a ticket zone for their guest tickets.  Ticket zone selection begins on a ceremony basis on April 5.  Distribution goes live for ceremonies according to these dates:

* Monday, April 5 - Ph.D. Ceremony
* Tuesday, April 6 - Master’s Ceremony
* Wednesday, April 7 - Bachelor’s Morning Ceremony (See participating majors on our Schedule page.)
* Thursday, April 8 - Bachelor’s Afternoon Ceremony (See participating majors on our Schedule page.)

Zone selection can be completed at the link below beginning on the dates specified for your ceremony. If you have previously used the Georgia Tech ticketing service for athletic tickets, please log in using those credentials. If you have never used the Georgia Tech ticketing service, select ""Register"" to register an account using your GTID number.

#Additional Tickets
We will not be distributing any additional tickets for our Spring 2021 ceremonies. Students are asked to not exchange tickets to help us keep physically distanced seating clusters.

#Ticket Distribution

To enhance crowd safety, the Spring 2021 ceremony will be reserved seating. Students will be able to select a seating zone on a first-come, first-served basis and will be assigned one five-seat cluster within their selected zone. 

All ticketing for the 2021 ceremony will be mobile tickets. After students select their seats, they will receive an email with a link to receive their ticket.",1617924165,1,0
Does anyone have surplus graduation tickets?,"I'm in the market, thank you!",1617923583,1,0
Why on earth should I pay 210$ for state tax after filing my taxes?,"Hey everyone, sorry if this message is not related to the subreddit. I really didn't know where else I can ask it. 

So I am an international graduate student.  I filed my taxes with Sprintax, I entered the W-2 form information and I ended up owing 210$ for state tax and just getting 30$ for federal tax. Is that correct? I thought every Gatech student gets some refund after filing their taxes, I wonder why it's not true for me. I really appreciate your help.",1617923120,1,0
What to do if you gotta poop during an exam,I had dairy on accident. help,1617920346,1,0
Chants During Games?,"So I went to my first GT baseball game a few days ago and at the end of the game, everyone started clapping and chanting to a song in unison. It seemed like everyone knew what to do/say, and I was just wondering where can I learn these things? I'm a first-year, and I just want to know these things so I don't look stupid at the next game.",1617918543,1,0
Are the rooms on the CULC basement free to use?,I've noticed some of the classrooms on the bottom floor have a green light and don't have anything scheduled. Can anyone use them or do you still have to make a reservation?,1617917853,1,0
"Hello, I have a YouTube channel I edit clips from TV shows and movies, make tech tutorials. Please subscribe, Thank you!! Jordanesque📹",,1617912183,1,0
Shame your colleagues who won’t get the vaccine,Like poop in their beds or something idk,1617912169,1,0
freshman rooming questions,how hard is it to get 3/4 person rooms for freshman?,1617911864,1,0
Anyone Conditional Transfer from KSU?,[removed],1617911398,1,0
That Cafe in Proximity to Exhibition Hall,"Okay so check this out,

While I was looking around at a map since my coworker is finally gonna get vaccinated, I noticed something that says Cafe and it's right across or nearby Exhibition Hall where the vaccines are taking place and the sad eateries are (I'm looking at you, Panda). 

I wanna know, does this place have good food? I might stop by tomorrow for my lunch break and since tomorrow is payday I'm willing to throw down some serious cash on some serious food.",1617910315,1,0
Gilbert outlets not working,"There’s a desk(the really long ones) on the 2nd floor(the one w/ covid testing) of Prince Gilbert for which the outlets don’t work. It’s the one closest to the stairwell- furthest from the testing site, next to the stairs leading up to the terrace floor. I’ve seen so many people struggle today and eventually move lol",1617909455,1,0
Research(MS) at Tech,"Hi y'all! 
This might be a long shot but does anybody have any suggestions how to look for a 'good' PI for a master's thesis (in CS) ? 
I know the process that I look at the prof's research and reach out to them, etc.. But my main concern is how do I actually find a prof who would support me even if I am a bit slow at research initially. 

I had a horrible RA experience during the first year of my grad school and that has left me feeling extremely under-confident at doing any kind of research. I am a bit inexperienced when it comes to research, but i have finished all my coursework now and I am ready to dedicate all the time of the upcoming semesters into my research. I am so traumatized by my last research experience that at this point of time, I am just looking for profs who are supportive in the initial stage even if their research is not my primary field of interest. I am not even trying to look for a funding at this point. All I want to do is some good research before I leave Tech. 

Any inputs (suggestions/supportive labs, etc) are appreciated.",1617909187,1,0
Housing for summer Internship running til late August,"Hey everyone! As the title says my summer internships run until August 20th, and most subleases end on the end of July. Has anyone been through this before? Any short term rentals that you recommend? What can I do?",1617908528,1,0
Eduroam is absolute dogshit and it has me triggered,,1617906030,1,0
cheap/second-hand cycle for campus navigation?,"hi y'all, incoming freshman here. anyone know where i can pick up a second-hand cycle for cheap? 

i've never bought one before and not sure where i can look for a second-hand one.  appreciate any input anyone can provide !

also, do most people use personal transport like cycles, skateboards and the such, or is campus transport sufficient? i've heard horror stories about the buses 😔",1617905693,1,0
So.... 🎉🍹 how’s the social life,How’s the social scene at Tech? y’all get a bad rap for being the not so social but i hope that’s not the case. someone tell me about the social scene (&amp; if it’s possible without greek life/how prominent greek life is) at tech because i’m planning on committing !! thanks xoxo,1617902960,1,0
"No less than 8 of the 2021 Forbes ""30 Under 30"" list are GT grads! Actually nuts, Go Jackets!",,1617901504,1,0
Living Learning Communities question,"Hello, I was admitted to the college of engineering for BME starting fall of 2021. I now have the option to apply to the first-year LLC's. The LLC's that I'm able to apply for are Impact, Explore, Honors Program, Grand Challenges, and Global leadership. As a prospective pre-med/pre-health student, I was hoping the SHaRP learning community for their medical opportunities and guidance, however, there seems to be no option to register for the SHaRP learning community. Has the SHaRP learning community closed down? Or is it not an LLC available for freshmen?

If so, would there be any other LLC's suitable for pre-med/pre-health students?

Thank you",1617897799,1,0
GaTech vs USC for CS,"I’m having trouble deciding between GaTech and USC for CS and have not had the chance to visit the campus cuz of Covid. I’m a decently extroverted person with an interest in CS and Entrepreneurship, and I’m looking to choose a prestigious school with a relaxed but ambitious vibe.",1617896953,1,0
GaTech vs USC for CS,[removed],1617895494,1,0
Interested in mock CS interviews for internships?,"Look no further! Sometime over the next two weeks, **GT CS Careers** will be hosting a mock interview session. We will create a script for the interviewers and choose two LeetCode questions beforehand. Once students join, they will be assigned into pairs where they can take turns interviewing and being interviewed. Afterwards, we will briefly go over the answers to both LeetCode questions as a group.            

If this sounds like something you would be interested in, [join our Discord server](https://discord.gg/aF2S6AzrAP) to help us find a good time to host the event! See the #announcements channel for the LettuceMeet link and invite your friends. Even if you already have an internship for the summer, it never hurts to get in some extra practice: we all know the more competitive internships for Summer 2022 will be opening within 2 months anyways.",1617894191,1,0
Is SAA worth it?,[removed],1617894050,1,0
"Is GT planning to move most/many of their math/CS lectures online and if so, why is this better for the students?",[removed],1617888511,1,0
CS + Robotics Minor vs. ECE: how are everyone’s experiences with each?,[removed],1617888124,1,0
Low Income Root Canal,[removed],1617887508,1,0
"Recently Founded a Trading Club (Equities, Futures, Etc.) here at Georgia Tech - Anyone Interested?",[removed],1617884368,1,0
South American Study Abroad,[removed],1617883341,1,0
"Newly renovated master's bedroom, roommate welcomed.",[removed],1617870205,1,0
Arts and Sciences Transfer Pathway Question,"Hey guys I got offered the Arts and Sciences Transfer Pathway for Fall 2022. I applied for Econ and now want to major in IE (specifically interested in the Economic and Financial Systems concentration since that leads to the job opportunities that I'm looking for). I am aware that my pathway doesn't allow me to apply to the College of Engineering. My question is: What is the best major to do for 1st year, assuming I want to switch to IE after transferring in? Any specific school (College of Sciences, College of Design, or Ivan Allen College of Liberal Arts)?

I understand that the Arts and Sciences Transfer Pathway is designed to restrict me from switching to College of Engineering, CS, etc. but I have heard stories of people transferring to GT (through regular transfer admissions) as psychology majors who were able to switch to CS after they got in. Just curious if I can do a similar thing, but though the Arts and Sciences Pathway. 

Thanks!",1617854299,1,0
Why the 4-year graduation rates?!?!,[removed],1617853150,1,0
Too scared to ride a bicycle,[removed],1617852038,1,0
Worth Out of State Tuition?,"I’m a current high school senior from Indiana who recently got a conditional acceptance from Georgia tech for the Fall of 2022 (major in biomedical science). This means I would need to attend another school for my first year in order to take a three classes  that are considered prerequisites for the biomedical engineering major. However, my family is not exactly well off and we can only really afford my first year at ga tech at the out of state price. I would very much like to attend Georgia tech, but I’m having trouble rationalizing going into 80k+ of debt instead of attending my instate option of Purdue (also accepted for biomedical engineering) at a third of the cost. Any help would be very much appreciated as I must decide where I will attend by the end of the month.",1617851512,1,0
PSA: there are vaccine appointments open for next week,Go get vaccinated jackets!,1617848667,1,0
How is the psychology program?,"Hello guys! I’m trying to transfer into tech next year for a psychology major and I’m wondering if any current/alumni students have any tips or comments on the program? Anything at all would help, whether that be professor recommendations or telling me to run for my life lol.

 I don’t have a concrete plan but I kinda want to try to get into the FBI so I’m hoping this degree would help with that? Any recommendations would be greatly accepted for that side as well, with the FBI or if you have any other job ideas haha.

Thanks for reading! I hope you all have a good day :)",1617848612,1,0
This school is so isolating,[removed],1617847135,1,0
Do nav apartments have individual thermostats for each bedroom,[removed],1617842775,1,0
"Ice Cream Vending Machine, We Lost a Friend Today",[removed],1617841197,1,0
Quick question — should we be continuing to get tested after we have been vaccinated twice?,"Just got my second vaccine this week, wasn’t sure if that would cause any kind of false positive when being tested weekly via Tech’s saliva test. Would love any guidance here!",1617838237,1,0
Y’all I am exhausted,[removed],1617837171,1,0
Y’all I’m exhausted,[removed],1617837123,1,0
Really short travel survey - pls fill it out we would really appreciate it!!!!,[removed],1617833976,1,0
CARE services???,[removed],1617832185,1,0
Is Tech Tower broken?,Or am I going crazy from lack of sleep?,1617832181,1,0
Is the Steam Pipe/Whistle Broken?,The whistle has been going off for 3 mins straight already. Someone care to provide more info?,1617832117,1,0
Dear Steam Whistle.,WHY DO YOU KEEP GOING OFF?!,1617832067,2,0
Acceptance Deadline for Admission Offer,[removed],1617831914,1,0
[OIT Status] WebEx Teams Software Client Registration Issue,[removed],1617830358,1,0
We need more native plants at GT (and to remove invasives),"Hi everyone,

Lately I've really enjoying walking around campus and looking at lots of nice trees/plants like redbuds, dogwoods, azaleas (a mix of native and nonnative), oakleaf hydrangeas, buckeyes, and many others. Walking towards the CRC between ISyE and the Instructional Center I couldn't help but notice a number of non-native invasive species (nandina, mahonia, english ivy, etc.). I know that around new buildings like the Kendeda Building they have planted mostly native but I wish we could make it a priority to get rid of some of the invasives even if there isn't new construction.",1617829986,1,0
How feasible is it to double major in BME and ChBE??,:),1617829121,1,0
Will GT make getting the COVID vaccine mandatory for everyone for next Fall?,I’ve been reading how few colleges have been making it mandatory for all students (except for those who have a strong reaction to the vaccine). It also makes sense for GT to do so since getting vaccinated will keep everyone safer on campus and the COVID testing program is essentially mandatory already.,1617828199,1,0
fintech opportunities at gtech?,"hi!

i recently got admitted to scheller and i am heavily considering tech. i want to do something in fintech- blockchain, digital currency, algorithmic trading, that kind of stuff. i'm worried that none of the scheller concentrations will give me that scope to my education, and none of the minors seem to cover those areas either. can anyone at gtech and/or in scheller give some input on this? i realllly love this school, i just wanna make sure i'll be getting the education i want. 

thanks :)",1617828014,1,0
Remembering Community Members We Lost In 2019/2020,[removed],1617826700,1,0
What percent of students complete their studies in 5 years?,"I've always heard a crazy number of students complete their undergrad in 5 years. Could anyone give me an exact # or data I can look at.

Thanks!",1617826447,1,0
Postgrad GPA reset,"Let's say a GT grad has a low GPA but want's to go into a profession that requires more schooling, think law,med school,accounting. Can that student apply for readmission for a 4 year degree even though they already have a GT degree and would that student be able to get a GPA reset ?

Would a 4.0 be possible or do all previously earned credits apply and would all grades be shown on the transcript even though there were for the previous major.",1617825588,1,0
Remembering Community Members We Lost in 2019/2020,[removed],1617824639,1,0
Chef Boyardee making us NAE residents late for our 3:30 classes,Smh,1617824316,1,0
To the Professor/Staff who bought a bunch of students lunch at Chik Fil A that they didn't even know,"I didn't get your name except that you were really pretty and also pregnant lol. Thank you, it really made my day. You are so appreciated!",1617821633,1,0
Opinion: There should be an Epilepsy warning in front of the Amygdala exhibit,[removed],1617818888,1,0
appreciation post,"i did a [rant](https://www.reddit.com/r/gatech/comments/lfvmz0/rant_about_an_inconsiderate_instructor/) sometime back about one of my professor only fair that we recognize goodness too. he deserves a nobel peace prize regardless tbh.

this is what he did:

Hi all.

A bit more than a year ago Georgia Tech closed campus due to COVID-19. We are about to conclude our second (or third if you did summer) semester of remote instruction. We are all exhausted. A bit more than a year ago when campus closed, I truncated the assignments, making a bunch of regular assignments into extra credit or canceled assignments outright. There are no surprises this year, we knew going into this semester what to expect. But now that we are here, I can sense the tiredness in the class. I can sense the tiredness in myself. So here is what we are going to do about it.

1. I will give you until Friday to complete take-home exam 2

2. I will extend homework 5 until April 23rd.

3. Exam 3 will be canceled.

4. Homework 6 will be shortened and made optional (submit for extra credit). It will be due on April 30, essentially replacing exam 3.

\*\*

the email goes on in logistical details but some highlights:

\- I had not prepared you sufficiently and exam 2 is turning into a major assignment. I have put a lot of my personal focus into answering questions on Piazza. I have found it worthwhile to help you all work through the exercise. The fact that it as turned into a major undertaking for some is my fault and I take responsibility for it. If this exercise is going to become a major assignment, then you all don't need another official homework assignment or another exam.

\- My compromise is to do what I did a year ago, which is make the assignment extra credit. It is really good, and a really practical assignment for anyone who might want to work in AI after graduation. I strongly encourage you to do the extra credit assignment. I would totally understand why you didn't.

\- Why did I cancel the exam 3? Because we are tired.

\- You are doing an admirable job if you are even just getting along. It is not my job to create unnecessary stress. While I think it is essential to pull back on some of the educational goals on this class, the important learning opportunities are still available to those who can partake.",1617817947,1,0
Does anyone want to share a storage unit for this upcoming summer?,"I have some stuff which isn't worth taking back with me, but it seems it isn't worth the price of storage either. So i was wondering if someone wants to share a storage unit too so to make it cheaper?",1617817511,1,0
Which sorority houses are offering housing for summer 2021?,[removed],1617816311,1,0
Never got the memo to RSVP for commencement tickets,"My family is all vaccinated and wants to come down for graduation, but I never got the email to RSVP for commencement and missed the window. Does anyone know if there's a way to get tickets this late/RSVP?  With everything remote and it being a crazy busy semester with school I've felt super out of the loop on all graduating senior stuff, and I don't want my parents to be sad that I totally missed signing up for all graduation ceremony things :/",1617815724,1,0
