title,selftext,created_utc,score,total_awards_received
Vaccine eligibility at GT,"Hey folks, I found out that my old roommate who graduated last semester was able to get a vaccination appointment through mytest at GT, she still comes in to do some volunteer research work with her old lab but isn’t officially taking classes anymore. Do you guys think they’d let her get vaccinated without issue? 

I don’t want her to get in trouble or get turned away, and she technically is still affiliated with the school - has her buzzcard, building access and her mailbox hasn’t expired. 

Thanks!",1616972899,0,0
Is there way to look up class 2022 in advance?,"Hi community,

I'm making course plan for graduation and was wondering if there is an way I can look up what classes will be open for 2022. I saw some class only opening during spring term, so I was concerned about how I should plan.",1616971176,2,0
Waitlist Deadline March 29?,[removed],1616970755,1,0
CS 3251 or CS 3651?,[removed],1616970682,1,0
Request for transistors,"Hi fellow Yellow Jackets,

Does one of you have PN2222 / 2N2222 transistors and is in atlanta ? I have a lab due Tuesday morning and i just realized I haven't got them when ordering the needed components.
Ideally I need 12 of them but I can manage with 4.

Thanks in advance !",1616967528,2,0
PLEASE TELL ME THERE WILL BE A MIDNIGHT BUD THIS SEMESTER,[removed],1616965504,1,0
Helping My Sister Out :),[removed],1616965463,1,0
Should I consider Georgia Tech?,"Should I consider Georgia Tech?

I'm an out of state student who got in for environmental engineering, though I probably will change it to some other engineering major, possibly aerospace.

At the moment, my top two choices are UCLA and Georgia Tech. I'm leaning slightly towards Georgia Tech, though it is still a complete wash between these options. I put this long write up on [r/ucla](https://www.reddit.com/r/ucla/) about my choice between UCLA/Georgia Tech, and want to know from you guys, why should I be considering Tech?

[https://www.reddit.com/r/ucla/comments/mev73b/deciding\_between\_ucla\_georgia\_tech\_and\_other/?utm\_source=share&amp;utm\_medium=web2x&amp;context=3](https://www.reddit.com/r/ucla/comments/mev73b/deciding_between_ucla_georgia_tech_and_other/?utm_source=share&amp;utm_medium=web2x&amp;context=3)",1616965204,1,0
Calling all women in STEM to join the Rewriting The Code community!,[removed],1616964756,1,0
GT or Virginia Tech for CS?,[removed],1616964155,1,0
GT SASE Recruiting for Executive Board and Junior Board Members,,1616963219,1,0
Systems Design for IE (ISYE 4803) Leon McGinnis,[removed],1616962695,1,0
ECE PhD in Electromagnetics at Georgia Tech or UToronto or UMich?,"Hello all, just as the title says I am lucky enough to be offered admission at GaTech, U of T and UMich (probably). All of the three have top notch programs on Electromagnetics and multiple faculties. 

I am leaning towards GT because of the freedom that GT provides by not having qualifying exam and also being able to change your advisor after an year or so. 

Am I correct in my assessment? Any thoughts are welcome. The job/startup scenario, weather, quality of life, visa or it can be any issue.",1616962651,1,0
if someone lost an apple pencil near the culc third floor booths pm me,title,1616961503,1,0
Where should I go to college,[removed],1616959620,1,0
applying for summer research and the coordinator can't even be bothered to copy and paste the rejection into the body of an email 🤡🤡,,1616958964,1,0
Internship + Physics 2 in the Summer,Has anyone had experience taking PHYS 2212 in the summer while interning? How feasible is it?,1616958392,1,0
Internship + PHYS 2212 in the Summer?,[removed],1616958176,1,0
GT SASE Recruiting Executive Board and Junior Board Members,[removed],1616958129,1,0
GTWBB thank you from an amazing and historic season!! Can’t wait for next season!,,1616957164,2,0
Social life in shambles,"This semester has made me realize that I really need to get out more and enjoy college while I am still young. With that being said, I don’t really know how to do that in the middle of the semester. I have friends that I am close with, but I really want to branch out and increase the amount of people I know and who I hang out with. My plan starting next semester is to join more fun clubs, but I really want to know if y’all have any suggestions for right now?",1616956983,1,0
Does anyone ACTUALLY know how GRA/GTA works for newly admits in Aero PhD ?,"There is a huge lack of official information regarding this, and a ton of conflicting info among people on new admits groups (mostly ""I think"" or ""someone told me"" type of stuff).

I'm an international student and have received an offer letter on Monday (22), which said that I'd receive another email regarding any sorts of funding/assistantships. By Wednesday night (24) I wrote to the Office of Graduate Studies and to AE's Grad Office, but no word from either so far.

I know those are challenging times and they must have their mailboxes flooded, that's why I'm recurring to the community. 

&amp;#x200B;

Could anyone that *has actual knowledge on this* advise? What should I expect? Is it safe to assume that I have secured at least a GRA/GTA position? Since I was accepted, there is at least one professor willing to work with me, so should I let my guard down for a moment and let them take their time to contact me?

&amp;#x200B;

Sorry for the implied rant!",1616954728,1,0
Conditional transfer KSU to GT,[removed],1616954709,1,0
Courseoff not working?,Is courseoff down for anyone else?,1616954604,1,0
KSU Conditional Transfers?,[removed],1616953045,1,0
KSU Conditional Transfers?,[removed],1616952754,1,0
Questions about OSI trial?,[removed],1616951736,1,0
Questions about transferring,[removed],1616951211,1,0
Questions about transferring from KSU or UGA,[removed],1616950270,1,0
Loud Boom/Explosion this morning around 7AM in the Homepark area,"Did anyone get waken up this morning to a loud boom in the homepark area? Particularly near Antico’s side? Was a deep quick boom, not like a gunshot.",1616949477,1,0
Questions about transferring,[removed],1616949047,1,0
Questions about being an RA,"Hi I just want to preface that I’m mostly interested in being an RA because of the housing. I’m just don’t really know what the job would really entail.

1. How much responsibility does an RA have? Does the amount of time/effort compare to a work study job?

2. How do other students view RAs? Is there a stigma around the people who become an RA?

3. How competitive is it to apply and become an RA? 

4. Do you have to sacrifice any opportunities if you are an RA? (Internships, coop, study abroad, etc.)

If you can answer any of these questions I would be very grateful. Thanks for the help.",1616945673,1,0
Being a girl at this Institute,"It bothers me. I hate it how guys ""mansplain"" everything to me. I hate it how boys tell me I only got into this college ""because I am a girl"". I hate it how when I try to date, I need to pretend to be dumb. And when I am dating, they only want the informal award of ""I have a girlfriend"" and never treat me with respect. I hate it when I'm not invited to the study session that is all boys. I hate it how guys never ask me how I am, but always flirt with me. I hate it how when I turn on my camera for class, my professor tells me ""you have such a beautiful smile"". I hate it how the janitors and peers staring at my body parts. I hate it when I am in class and look around and see that I am the only girl and feel so alone. I hate walking down fifth street at night and being cat called. I hate how I've been sexually harassed in academic clubs and the administration or leaders doing nothing. I hate how the guys I've talked to about this have told me it is my fault. I hate feeling like I am just a ""thing"". 

I want to start this thread because I can't be alone in this. I know I'm not alone in this. To any guy reading this, please notice how I just want to be treated with the same respect that you are already getting. To any other women on this thread, please feel free to add. This is an important issue. We need to heard.",1616942400,4,0
"Deciding between Georgia Tech, UCLA, and other schools for engineering",[removed],1616942145,1,0
Close your eyes. Imagine it’s graduation day. You did it. You step on the stage to retrieve your diploma. Hundreds of people cheer you on. You’re crying.,"Now open you’re eyes. You have multiple homework deadlines this week and three exams on Friday. You check Canvas and realize you missed a huge project deadline last night. 

You get an email notification on your phone. You just lost Zell. You’re sitting alone in a dark dorm room. *You’re crying.*",1616927245,1,0
Best Twerk Compilations 2021,,1616915606,1,0
What is the best apartment complex off campus??,[removed],1616904101,1,0
Out of state financial aid question.,Anyone who pays out of state tuition who has an income bracket around 70k can you plz tell me how much you pay total per year to attend ?,1616903586,1,0
"A little too liberal with the downvotes, you techies!",[removed],1616901956,1,0
How's taking class while co-oping?,"Hi guys,

How was your experience with taking class while interning? what credit range was doable?

I'm planning to take ECE 4011 (4 credit) while co-op and wanted to hear experience.

Thanks in advance.",1616898818,1,0
is this too hard?,[removed],1616897873,1,0
How is GA Tech when it comes to classes being personal?,[removed],1616891711,1,0
What does the construction of catalyst look like currently?,"For anyone who currently lives at Arium Westside, or just goes over to that area pretty often, what stage of construction do those catalyst apartments on northside look like they're at right now? Do they really look like they would be done by June (as they claim) or August?",1616886018,1,0
What does the construction of Catalyst look like currently?,[removed],1616885800,1,0
How can a graduate student (PhD) from another department transfer into the CS department for a non-thesis master's degree?,[removed],1616885246,1,0
On the search for fellow hoosiers,[removed],1616879647,1,0
ECE Senior Design Question,"Hey mods feel free to remove my post if needed, but I couldn't find any post similar to mine or felt it belonged on a megathread. Honestly feel little stupid right now. I just became aware that 4011 and 4012 no longer exist and now I'm a little confused how Senior Design is set up for ECE seniors now. I see that there are 3871/2 which are essentially 4011/12 in that they're two semesters of senior design. Then I see 3873 which is just one? So does this mean I can just take one Senior Design class in Spring 2022 instead of breaking it up into two semesters? Also apparently we were all told this?  I check my email frequently so I think I missed the memo somehow. I'm just trying to sign up for Senior Design 1 in the fall and I recently met up with my advisor and she kept talking about 4011 as if it was still happening. Googling hasn't helped either. Just a little confused and any insight is much appreciated. Thanks y'all!",1616875196,1,0
Help me - Participate in an eye-tracking experiment and get a $10 gift card!,[removed],1616874932,1,0
Do GA tech give Financial Aid to oos students?,[removed],1616874911,1,0
Join Bits of Good!,"Are you interested in social good and want to make an impact this semester? Join us at Bits of Good to improve your technical abilities and work directly with students and non-profits!

Apply at [bitsofgood.org/join](https://bitsofgood.org/join)!

https://preview.redd.it/8tv9f00zemp61.png?width=631&amp;format=png&amp;auto=webp&amp;s=879342c645f2fbbbe3c4ae81ade5bf056cf30435",1616872690,1,0
CS 4220 Embedded Systems vs CS 4290 Adv Computer Org,[removed],1616001016,1,0
Electrical engineering,[removed],1621309300,1,0
Can I have excused absences for a part time job that is off campus?,"Hi so basically i was wondering if i cant move my schedule around if professors would allow me to miss class for work,,,i dont think they would but i wanted to check lmao thanks!",1621307131,1,0
Epay Login not working,[removed],1621305710,1,0
Not getting charged CRC fee or having access to CRC despite 4+ billable hours? (Summer 2021),"I went to book a CRC appointment and it said I didn't have an active membership. I checked my bursar account and it looks like I wasn't charged for the CRC fee for summer 2021 even though I'm registered for 6 credit hours (according to this site it should be charged if you take 4+ billable hours: https://www.bursar.gatech.edu/voluntary-student-fees), so who messed up here? Do I need to get the bursar to charge me the CRC fees for summer?",1621304507,1,0
"Watch ""Starlink Unboxing + Speed Test + Full Installation"" on YouTube https://youtu.be/BnLXAAWFnTA",[removed],1621301783,1,0
USG: Masks Not Required for Fall,"""The USG has released new guidance for the Fall 2021 semester, stating that fully vaccinated staff and students will not be required to wear a mask while in class or at other activities. Those who have not been vaccinated are strongly encouraged to continue wearing their masks inside.""

https://www.wsbtv.com/news/local/masks-no-longer-required-vaccinated-students-staff-university-system-georgia/4G3U5CFZ6VB23NC4IOHFU6KDJ4/",1621301463,1,0
Showerthought: what GT username has the largest digit?,"It seems when GT usernames are assigned, if the first letter and last name combination has not been used before, they add a 3 to the end. For example George Burdell would be gburdell3. I’m assuming this because I’ve met plenty of people with unique names and they all seem to have a 3 on the end. Now those with common letter and last name combos like jkim or jsmith will have like 257 after it. Like jsmith178 or something. I’m assuming because there have been many many people to go by that letter combo. I was wondering what letter and last name combo has the largest digit after it",1621297077,1,0
Fall Housing / Transfers,"Hi everyone. I hope your summers are going well so far! I’m running into an issue and could use some advice. I’m going to be transferring into Tech in the fall. However, I’m transferring in through a pathway which means that I don’t get my decision until June 15. This means that I won’t get on the housing waitlist until a week or so after that (and I’ve heard it’s long already). I kinda wanted to be on campus in the fall because it’s my first semester here. How screwed am I? Any suggestions? I’m out of state so I’m worried that I might be stuck at home if I’m denied housing.",1621296526,1,0
Why is Georgia Tech hiding admissions data?,[removed],1621295069,1,0
Are there any resources for learning an instrument at GT?,[removed],1621286588,1,0
Laptop Question for a Returning Student,"Hi guys,

I graduated from tech undergrad (AE) back in 2019 and I’ve just been accepted to the ME masters program (and am waiting to hear from AE).  

I’m looking at two laptops for entering the graduate program.  I’m either looking at the new M1 MacBooks (or possibly a refresh of the MacBook pro later this year), or the new design of the Dell XPS 13/15.  Which one would better serve me?  Do I need to opt for the XPS with dedicated GPU?  Thanks in advance.",1621281765,1,0
What is our Major GPA?,[removed],1621280639,1,0
Interested in the MBA Program!,"Hi! 

I'm currently a 4th year MIS (Management Information Systems) major at the University of Georgia, graduating in Spring 2022. I am highly interested in pursing my masters at GA Tech, either the MBA program or the MBA - Master of Technology program. This summer (Summer 2021) I'll be interning at a company, and I hope to get a return offer so I can start work immediately after graduation. But within 2-3 years, after I've saved up enough money I hope to apply to GA Tech and pursue my master's here. How exactly would this process work? 

Thanks!",1621278176,1,0
Summer 21 Groupme??,[removed],1621276873,1,0
CRC time slot question,"Alum here... I was a CRC member for a long time leading up to Covid, but let my membership expire in March 2020 when things were in turmoil. Looking to re-join now, but curious how efficient the whole ""time slot"" thing is. Those of you who have been going and working out lately, is it a good system? Easy to use? Easy to find open slots? I'd probably be looking at going around either 6-7am or 5-7pm-ish most weekdays.",1621275827,1,0
Quick BS/MS CS Question,Hey guys! I have been considering doing the BS/MS program. How does the BSMS degree work? Like when I graduate I get both BS and MS degrees right? Or will it say “BS/MS” on the degree?,1621275821,1,0
when can summer classes be dropped without a (w)?,when can summer classes be dropped without a (w) and when can the grade modes be changed to p/f?,1621274897,1,0
I still can’t believe it!!🥰🥺,[removed],1621273206,1,0
GT Asymptomatic Covid-19 Testing ☀️ Summer Sites and Hours,,1621272580,1,0
Any course that combines ML and statistical analysis of the ML models ?,[removed],1621271081,1,0
Registering Fall 2021 Internship,Has anyone had a Fall 2021 internship registered successfully?,1621268607,1,0
Do I really have to pay $900 in fees to work here as a GRA over the summer?,How is this not a scam?,1621265445,1,0
Transfer transcript questions,"Hey everyone! I got accepted into Gatech, my dream school! I have a question regarding the transcript I send. Can I take summer classes at the University I’m at right now before I transfer in the fall? Also, the Gatech page says to have no in progress work, however the summer classes I’m currently registered show as in progress on my transcript even though I haven’t started them. Would I have to drop these courses? Thank you.",1621264941,1,0
ENGL 1101 and MATH 1553 in IGNITE,[removed],1621264069,1,0
Summer Intramural sports,"I am living on campus this summer, and was wondering if pick up soccer or women's soccer intramurals were happening? I checked IMLeagues but didn't find anything",1621263515,1,0
All of the GTHR people are frustrating,"How is it that I accepted a position for the summer in March and I am still not hired yet. My start date is today. I am already a GT employee so I don't need to go through the whole hiring process. Like do they think I am working a paid job for fun???? Also, they send me conflicting info from different departments saying I should start and get retroactively paid and someone else says not to start. Research is time-sensitive, I can't just wait to start. grrr",1621262307,1,0
"To those who got into med school, know those who have, or are planning to....","Could you please dm me? I just have a couple quick questions, and it will mean so much to me. 

Thank you so much!",1621259592,1,0
To those who know about the CS field - last one,"Hi all, 

I am sorry to keep asking questions...this will be my last post about this, I just really need help. To succeed in CS and make it past that worker bee 80k salary, how much of entrepreneurial and street smart skills do you need? Because I'm not great at that stuff...I am a very hard worker and do my best in every task, but I don't know if I have that networking or street-smart sort of thing. I just like to do my work, and go home...I'm not good at doing extra projects and extra things to market myself or impress people. How likely is it that I will be stuck at a max of 100k for my whole life? 

Moving on from money, how many of you find your job meaningful or fun? Are there enough options out there that I can find something meant for me?

Also, how much stability is really there? Like some people I know in CS are constantly moving around with new jobs, and I would personally just like to stay put in one city that I like and keep working there happily. How realistic is that in this field? 

Also, I wouldn't want to be forced to work from home ALL the time, because I'd prefer some face to face social interaction. But of course with a lot of remote jobs that's how it is. 

These are some of my main concerns, and would SO appreciate any and all insight from you guys on some or all these factors. Thank you SO SO much!!!",1621259487,1,0
Developed a new personal expense management app : Savemon,[removed],1621235954,1,0
Biltmore Apartment in Midtown,[removed],1621224068,1,0
Fall Covid Protocol,I know Tech has announced full occupancy for football games and full tailgating occupancy. They’ve also announced masks are not required indoors. Any word on class capacity or whether the CRC will be back to normal? Assuming since no masks everything is open and in person (no more online hybrid classes) this fall?   Is that right?,1621210971,1,0
Housing Waitlist,I'm number 20 on the waitlist for GT Housing for the 2021-2022 school year. Do y'all think there's any hope for me to get a spot on the waitlist or should I try to make alternate plans? Thanks guys!,1621207639,1,0
Transfer waitlist question,[removed],1621205126,1,0
Want to sublease for the summer? Take a look at this listing in Midtown! (1Bed 1Bath in a 4Bed 4Bath),,1621202757,1,0
How are you guys doing with parking?,"I have only one residential class for summer.
I'm thinking to purchase 1 year parking permit, but it seems a bit wasteful as I will not be in school very often.

Wanna hear ya'lls choice. How are you guys doing with parking?",1621198066,1,0
"Want to sublease this summer? Check out this listing of a great Midtown location! (1Bed, 1Bath)",,1621196027,1,0
Looking to sublease for the summer? Check out this listing of a great Midtown location!,[deleted],1621195991,1,0
Looking to sublease for the summer? Check out this listing!,,1621195877,1,0
Typical Starting Salaries for CE undergrads,"So I have been trying to do some future planning regarding expenses and whatnot and have been trying to predict what a potential starting salary would be for a student with a bachelor's in civil engineering, specifically in project management. 

I know GT reports this data, however, they report it for Civil Engineering as a whole which has a pretty wide distribution, and I'm trying to get as close as possible to a realistic value. I understand that this is just an estimate and there are a million variables that can affect my starting salary, however, I feel like in construction management there isn't a whole lot of variance.

So if you guys are okay with it, would you mind filling out this [form](https://forms.gle/H3hSbMnyRDivm4YZ9) please? Results may be posted depending on amount of responses to help other students with similar questions.",1621192432,1,0
Best Class Suggestions for GT Ignite Program?,"I've been recently accepted my admission into Georgia Tech for mechanical engineering, YAY! Fortunately and unfortunately it's through the Ignite program. As an out-of-state student, I have to take 6-7 credit hours online for 5 weeks in the summer. I've also gone ahead and gotten a job so that I can work 20hrs/week during Ignite (like a dumbass). 

Does anyone have any suggestions for worthwhile classes that won't be extremely difficult to do online? I've spoken to my AICE Math teacher who recommends that I take Linear Algebra and says that it'll be easier than calc and stats. However, including the GT 1000 course, that's only 3 credit hours. My goal is to take 6, not 7 credits. Does anyone have any suggestions for a course that I should take? Is Linear Algebra a good idea? And does anyone think that I could reasonably do Intro to Diff. Calculus and Linear Algebra at the same time? 

Thanks in advance for any responses. I'm really stressed about this decision and am trying to get everything sorted early. :)",1621187877,1,0
Tensorflow classes?,Are there any CS classes that teach tensorflow in depth?,1621185887,1,0
internship/co-op as elective credits,"Can we register our internship/co-op to redeem elective credits? If so, up to how much? I am looking to register one and hopefully fill my elective credits for two semesters, if that's the case.",1621185551,1,0
The typical u(sic)ga fan,,1621182286,1,0
are there any online courses during the fall semester?,"This is a general question - I know GT offers SOUP courses during the summer, but do they have anything similar for the fall/spring semester?",1621182180,1,0
Congratulations Chris Bosh on making the Hall of Fame,"Chris Bosh played one season of basketball for Georgia Tech before declaring for the NBA draft and being picked 4th in the 2003 NBA draft by the Toronto Raptors. He played for the Toronto Raptors from 2003 until 2010 when he switched teams to the Miami Heat where he played until he was forced into an early retirement due to medical issues in 2017.

During his NBA career Bosh was selected to 11 all-star teams and won two championships as part of the Miami Heat in 2012 and 2013. Chris Bosh is one of the all time great Georgia Tech athletes, and now joins the Basketball Hall of Fame class of 2021.",1621179958,1,0
moving in for summer semester,What if you accidentally miss the move-in deadline? Is there any chance that you can check in to get your room keys afterwards?,1621178714,1,0
I think I broke poker. 5 of a Kind and I got out!,,1621167115,1,0
An A would have truly brought this full circle,,1621147742,1,0
