title,selftext,created_utc,score,total_awards_received
EA GANG RISE UP !!,"Amidst all this stress, we had one good thing going on, so we better flex the hell out of it.",1611674342,1,0
Creative writing groups/discord at Tech?,"I was wondering if Tech has any creative writing groups, or even a Discord? I've been poking at it lately seeing as it's been all class from home and work from home for me, was wondering if there was a group to get into/chat with about that. Thanks in advance!

(And if there is, hopefully nobody minds a junior PhD student being around/joining?)",1611674067,1,0
Looking to chat with and get to know people!,[removed],1611671973,1,0
Bad Idea to Skip Core Classes for CS Major?,[removed],1611671057,1,0
Computer Science vs Computer Engineering,[removed],1611671043,1,0
Any other faculty/staff (or students) feel pressured to promote in-person services?,[removed],1611670670,1,0
When did y’all figure out how to study?,[removed],1611669364,1,0
BME major pros and cons/questions,"Hey! I was recently accepted to Georgia Tech for a BS in Biomedical Engineering. I'm not committed yet so I have some general GT questions and some specific to BME at GT:

General questions:

1. Are the professors accommodating and understanding?
2. How competitive is the environment? Are students trying to bring each other down or is everyone doing their own thing?
3. !TW! I'm sorry to be so blunt but are depression and suicide big problems on campus?

BME questions:

1. How rigorous is the BME program? Are the courses extremely overwhelming or will I have time to socialize or at the very least relax?
2. How easy is it to find research/career opportunities?
3. What are some pros and cons of BME at GT that my questions may not have already covered?

I apologize if some of my questions are redundant but I couldn't find much about them on this sub-- especially anything about BME.",1611653672,1,0
Do you use Honey web extension?,"I see so many ads just curious to see if the ad is working.

[View Poll](https://www.reddit.com/poll/l58hdx)",1611644292,1,0
"Had Covid a month ago, recovered, but might still test positive",[removed],1611640651,1,0
Any experience with Careerfair after graduation?,[removed],1611637661,1,0
League of legends club?,Was wondering if tech has any kind of league of legends club?,1611633872,1,0
Any league of legends clubs or things related?,[removed],1611633341,1,0
Parking during class time shouldn't cost so much,"I have one class on campus that meets for 45 minutes once a week at 8PM. I am not going to spend $400 on a parking pass for the semester but I shouldn't also have to spend $5.35 to park for 45 minutes because parking after 8PM is only sold as overnight parking and not hourly. Also, why is there a $0.35 service fee for the privilege of buying overpriced parking? 


I also find it a waste of resources to have PTS trucks patrolling after peak hours to nab people who haven't paid for parking for various reasons including parking app simply sucks ass.",1611630449,1,0
taekwondo/any martial arts practitioners on campus?,[removed],1611629890,1,0
Decision Help Needed Please,"Hi, so just to cut to the chase: I got offered the First Pathway Program for Fall 2022. Georgia Tech is like a dream but i’m an OOS student and the costs are expensive. Is there anyway I can make it work?",1611628508,1,0
Anybody else feel like professors are adopting the “flipped-class” structure only to double the lecture time?,[removed],1611623829,1,0
Question about MS HCI Specializations,[removed],1611615204,1,0
Why do people say dating is so hard at GT? I have totally real girls sliding into my GrabCAD DM's 😏,,1611614822,1,0
Career buzz down,Is career buzz completely down for anyone else? I was in the middle of the career fair and it timed me out. It will not let me log back in.,1611612836,1,0
Spring career fair experience?,"I'm just curious what yalls experience was today in the virtual All-Majors career fair. For me, the platform itself seemed to work pretty well and was smooth, but the exorbitantly long waiting times for some of the major companies was a killer. Waiting times were upwards of 3+ hours in some cases, which was discouraging. I also ran into the problem of waiting for 2+ hours, only to speak with the recruiter to find out they weren't hiring full-time roles or weren't hiring for my given area of interest (seems that companies weren't required to detail what kinds of roles or departments they were hiring for). Overall I feel like I wasted a bunch of time today sitting at my computer waiting or doing company research with nothing really to show for it. 

What was your experience?",1611610289,1,0
Affording Georgia Tech,[removed],1611609620,1,0
How selective is the alumni regional scholarship,thx,1611605323,1,0
Special Problem in CoC,[removed],1611603912,1,0
Is arts and sciences pathway worth it?,"I’m a freshman engineering student right now at UGA and was offered arts and sciences conditional pathway after being put on the waitlist for an eternity. Tech has always been my dream school but I’m recently doubting if transferring would benefit me the most as my pathway excludes engineering majors. I’d have to wait for a semester to change my major, and it would be tedious and hard as most pre req classes are reserved for current engr students. I’m also scared to be thrown at a new environment again and going out of my way to make friends as a transfer student. I do want to apply for grad programs at tech but I’m just unsure if undergrad at tech would be the best choice considering my transfer option and engineering major. I also want to keep my Zell and I’ve seen some people losing their Zell because of the grade deflation at Tech.

TL;DR will transferring to tech from uga be worth it?",1611603691,1,0
Has anyone ever seen a positive number appear under financial aid on Pay Now?,"In short, normally in Pay Now, if I go into the details of the financial aid portion, whatever financial aid I receive usually appears as a negative number (which makes sense). This semester, I see the financial aid I expected to see in its expected form and amount, but then there are two additional line items. The two additional line items are titled the exact same as my grants except their amounts are positive, meaning I now owe the school money for financial aid. Neither of them are a loan.

I checked both grants and I'm pretty certain I'm eligible for both. I've contacted the school several times to see what's going on but haven't heard back from them. I'm really stressed out - the payment deadline is today, and I want to say that this is just a mistake on the school's part. But is it?? Or do I have to scrounge up $1600 today?",1611602079,1,0
How do y’all play instruments/sing in your dorms? The walls are so paper thin,"Like honestly, how? I don’t want to disturb/annoy people, but at the same time, music is pretty much my only hobby these days that I can enjoy, since I can’t really do any of my more outdoor/group hobbies.",1611601234,1,0
Thanks for the construction outside my dorm room window GT,I'm seriously going to go crazy from all this drilling. Anyone have any soundproofing advice 🙃,1611600035,1,0
Can Tech actually fix broken washing machines?,"Rant ahead:

Last week when I went to wash clothes, there were a couple of machines with handwritten post-it notes saying that the machines were broken. Today, when I went to wash clothes, the only machine available was one of those noted machines, but the post-it had been removed. Naively, I assumed that meant that someone had fixed the machine. 

I set my clothes to wash, but when I came back 40 minutes later, my clothes were locked in the machine, and the display said ""IE"". I managed to get my clothes out by unplugging the machine. My clothes were soaking wet because they hadn't been through the spin cycle, so it took 1.5 hours to dry them. 

Tech fix your shit",1611598625,1,0
to cs majors: about hackathons and resumes,"Hey guys, if I went to a hackathon and didn't win anything but just submitted something, should I still put that on my resume? If so, which section (extracurriculars, skills, etc)? 

Also, which skills are most useful to have for internships and/or hackathons? (javascript, HTML, css, react native, python, etc?) If I want to focus on learning one, which should I try?",1611597965,1,0
Anyone's CareerBuzz's Account Been Disabled?,Title.,1611596174,1,0
Spring 2021 Career fair,Did Career buzz suddenly stop working? It was slow for me. It kicked me out and I can't log back in. Anyone else having problems? Thanks!,1611595438,1,0
Paid Psychology Study at Georgia Tech ($200),[removed],1611595199,1,0
Georgia Tech to Award Dr. Anthony S. Fauci the 2021 Ivan Allen Jr. Prize for Social Courage,,1611593311,1,0
"Hypothetically, what should I do if I regret switching my major?",[removed],1611592562,1,0
GT Asymptomatic Covid-19 Test Sites and Hours: January 25-29,,1611585636,1,0
Vaccine Questions Answered,"With the vaccine starting to roll out at Tech, we wanted to answer any questions y'all have about it. Comment below any questions you guys have and I will answer as many as I have answers to! 

Some fast facts from questions we got on Instagram to hopefully preemptively answer some questions:

* General students will be in phase 2 (very good news), and we don't know exactly when this will be because we are at the direction of the Georgia Department of Public Health telling us when to move between phases. 
* GT's goal is to get every student vaccinated by the end of the semester but hopefully GA DPH will let us move more quickly between the phases because we have the infrastructure to get it done sooner
* We are currently in phase 1A+
* Phase 1B will include every person who is employed by GT (including RAs, TAs, researchers, anyone who is in the GT HR system)
* We advocated for unpaid TAs to be included in phase 1B so they will be included as well!!
* Students with preexisting conditions will be in phase 1C (they are still exploring options for validating preexisting conditions)
* International students will face no additional barriers to getting the vaccine
* The vaccine is not required
* The vaccine is free
* If you have already gotten covid and finished your isolation period, you can get the vaccine
* You should still get surveillance tested after you get the vaccine

Hope this helps, and comment below any other questions!",1611584148,1,0
Had time slot at CRC but already full,"I had 1 of the 12 time slots for the rec pool, but when I got there near the beginning of the hour, there were already 12 people swimming, 2 per lane. What's the point of having time slots if they might all be filled anyway, and how were they let in when 1 of them didn't have one?",1611577723,1,0
Can the CRC please fix their booking system,"Time slots all taken by 8 am. Website crashes at midnight for registration 2 days in advance. First floor and fifth floor on the same bookings. This shit is fucking pathetic. I thought having a max of 45 minutes to workout sucked, but atleast we could get into the gym. Either allow us to use the gym or give us our fee back.",1611552820,1,0
The GA General Assembly is back in session. Marijuana reforms are on the table. Tell your legislators to make it a priority this year!,,1611552317,1,0
CRC timeslots are ridiculous,[removed],1611551872,1,0
Microwaves on Campus for Public Use,Couldn't seem to find an updated list of where all the microwaves were on campus since the exhibition hall opened up and all that so was wondering if there are any central to campus?,1611551765,1,0
Need help finding a groupme,I can not attend class during the live time due to work (professor already knows) but I want to see if there is a groupme for the class cause I can not see the chat in the lecture recordings. Is anyone else in me 3017 that can send me the link?,1611549954,1,0
[MegaThread] Spring 2021 Class GroupMe thread,"A much requested megathread. 

Post links to your class groupme (or other) chats to help for study groups. If a chat isn't posted yet, ask for a link or create your own group.",1611549764,1,0
Groupme for ME 3017 - C,[removed],1611549201,1,0
"Career Center: ""CareerBuzz is a state-of-the-art interview and job posting management system."" What a joke...",,1611548487,1,0
Hackathon participation for normal person?,"Hi all, I'm in my last semester and saw some hackathons going on and kind of wanted to go and try something new. I don't know anything about hackathons, and roughly 30 minutes of googling didn't tell me much.

I'm not a genius, I can program but can't name all the parts of the Kernel/haven't written a driver, and only have limited experiences with APIs and...yeah. 

Anyone mind sharing a story? Advice?",1611544251,1,0
How do I apply to summer semester?,"Hi I'm a first year student, currently second semester at Georgia Tech.

I am trying to take course on summer, and I was wondering when and how I register for summer courses. Is the ignite program also including enrolled students?",1611544008,1,0
Dining Hall Oatmeal,Someone pls tell me how to make oatmeal taste good 😭 any suggestions are very much appreciated!,1611543314,1,0
Gatech Coop cover difference in tuition?,"I am planning to apply as a transfer to Gatech for cs for the fall 2021 semester.

I would have to pay 50k per year for 3 years at Gatech(not including coop) compared to

25k per year at stony brook University for 3 years.

Overall the difference would be 75k in total without coop.

I might have to take a loan for 30-40k ,rather than stony brook where I would take no loan.

Would coops and internships cover the difference at Georgia Tech or would most of it go for living costs?",1611541972,1,0
Pass/Fail for certificate courses,[removed],1611540998,1,0
Low-Income Dentist Need,"Hi I was looking if anyone knew a low income dentist I could visit near tech! 
I moved to GA couple of years ago and my tooth started hurting recently :(

Thanks for reading!",1611540085,1,0
Is Georgia Tech worth 75k over State School?,[removed],1611536925,1,0
Are the lectures for Computer Organization and Programming available anywhere?,I'm interested in this course but I'm not enrolled. Just wondering if there are any recorded lectures or anything.,1611535634,1,0
[GT Marksmanship Outing] Chestnut Mountain @ 1/30/21,[removed],1611531008,1,0
Found someone's keys on east campus!,[removed],1611530933,1,0
Anyone get quant positions out of UG from GATech,thx just wondering,1611530688,1,0
did someone lose keys on big patch of grass between moes and kappa alpha theta house (east campus)?,[removed],1611529645,1,0
syllabus week hw due?,"are professors allowed to make things due before friday registration? 

one of my classes already got 3 quizzes and a hw that i missed :/",1611529152,1,0
Are All/Some Subset of GTAs in Georgia's 1b Group for Vaccines?,[removed],1611528874,1,0
Are All/Some Subset of GTAs in Georgia's 1b Group for Vaccines?,[removed],1611528819,1,0
Career Fair Preparation?,"The virtual career fair is tomorrow and I'm wondering if there's anything you all recommend to do to prepare for it. I already have my resume done, but is there anything more specific for this event?",1611526893,1,0
How are the fintech opportunities at GATech?,"I was accepted for CS, I am interested in IB, SWE in Silicon Valley and fintech quant.",1611526841,1,0
Digital Portfolio on MSCS application?,"I'm currently applying to the MSCS program and there's a ""Digital Portfolio"" page. Does anyone know if those applying to the MSCS program need or is recommended to submit a portfolio? (I've tried emailing the program several times, but no response yet)",1611526097,1,0
Do I have to withdraw my other college applications after I paid my enrollment deposit?,"Sorry if this is the wrong place to ask, but I committed to GT for class of 2025 and I’m just wondering if it is necessary to withdraw my other college applications? Is this something I should email the admissions office about?",1611522453,1,0
Is doing IGNITE a good idea/ why did I get put in it?,"Hey, I was accepted into Georgia Tech yesterday, but my acceptance letter said I had to start through the summer program. I'm First Generation and I am out of state so I have very little idea what any of this means?? Was it random selection that put me there? Is it worth doing it? Any advice would be appreciated. :)",1611522157,1,0
Grad Lounge Access in Crosland?,"Does anyone know how access to the graduate student commons in Crosland works?

I started master's this semester through BSMS, and my Buzzcard works fine for everything else, but when I scan it for the graduate student commons, it just beeps and gives me a red light.",1611519919,1,0
Must Watch. Guy ask Tech students 5th grade questions LOL,[removed],1611508366,1,0
Can someone please let me know the career breakdown and salary for Industrial Engineering grads here?,[removed],1611506868,1,0
"Does anybody work at stamps ""health services""",I have been trying to get an appointment for a month. No success,1611505529,1,0
Are the lectures for CS 2110 Computer Organization and Programming available anywhere?,[removed],1611502592,1,0
How does georgia tech pool applicants?,[removed],1611479066,1,0
I sent my resume to the recruiter I met at a conference (for internship). Does this reply mean she's considering my application positively?,,1611468975,1,0
Georgia Tech or UT Austin?,[removed],1611459417,1,0
Georgia Tech UT Austin?,[removed],1611459331,1,0
GTPD Appreciation Post,"GTPD is the fucking best! I’m a POC and honesty, they’re the only form of law enforcement I feel more safe around and not jumpy. They’re great",1611454616,1,0
Transferring to GT,How hard would it be for me to get in if I have a 4.0 GPA and have done all the reqs? I have okay ECs and essays too I think.,1611453015,1,0
When COVID contact tracing isn’t profitable,,1611452477,1,0
I got a Conditional Transfer Pathway to 2022 as a transfer student?,"So as the title said, I got a Conditional Transfer Pathway to 2022 as a transfer student and it said it was due to the competitiveness of this year's applicant pool and the size of our incoming class. I don't understand so did I get in or not, do I have to start university a year later? This is really giving me mixed signals about this.",1611449801,1,0
Applying for Full Time Roles,"How early can seniors usually start applying for full time roles? Have any of you secured a full time role with a year to go with graduation? I graduate in December and wanted to know when I could start looking and applying,",1611448822,1,0
GA Tech Freshman Summer Semester,"I just got accepted into Georgia Tech, but they said that their putting me in the summer semester, and I would start classes in late June instead of the Fall. I read more about it on their website but all I really got from it was that they were putting some of their freshman class in earlier. Does anyone know more about this?",1611444796,1,0
housing application?,[removed],1611444562,1,0
Everyone Alright,Hearing reports of shots fired near Westmar Lofts...y’all good over there?,1611438863,1,0
ME or EE? Know about e-scooters?... I've got a job for you!,[removed],1611438118,1,0
Under the Hood Menu (Gluten free buns available),,1611438098,1,0
Email CRC to Change Booking System,[removed],1611437780,1,0
Question for AOs or anyone that has insight.,What were deferral rates this year like? How much higher were they and how should I treat them? Currently I'm just treating it like a rejection.,1611434249,1,0
Georgia Tech deferral,[removed],1611433574,1,0
Follow up Covid diagnostic testing????,What does it mean if my Covid test comes back that they are going to do diagnostic testing?!?!?!,1611433093,1,0
finding internships,[removed],1611430442,1,0
admission questions,i just got into Georgia tech c/o 2025 but it didn't say what major I got in for... how am I supposed to know what major I'm in??,1611426898,1,0
Can we start a 2025 discord I just got in for CS,Kinda shocked im a shitty applicant tbh,1611425686,1,0
First Generation Pathway Program,[removed],1611423155,1,0
Is it possible to add a minor to one's master's program?,"I'm planning to do a BS/MS in ME and would like to add a cs minor to my degree. Unfortunately, can't fit it into my BS without heavily delaying my graduation (I'm a transfer student) so I was wondering if it would be possible to add it to my MS.",1611422695,1,0
learning from CS6440,[removed],1611380671,1,0
CS6440 lab materials,[removed],1611380608,1,0
Place to put stuff in the CRC?,[removed],1611379856,1,0
Master of Industrial Design (MID) at Georgia Tech review,[removed],1611378196,1,0
Parking on the weekend?,"Hi y'all,

I'm going to be in town on Sunday and I remember there being an old ""rule"" for PTS about weekends being free to park. 

My tag from last year is expired and I don't want to pay for another one for a single days trip. 

Can anyone who works for PTS or knows of the rules confirm this or let me know if I'm wrong? Thank you in advance.",1611365870,1,0
Skydiving Club Info Session,[removed],1611361857,1,0
Parking on campus,"Hello everyone,

I’m wondering if there is any cheap or free parking available for around 3-4 hours on campus. I haven’t been to tech since lockdown started and recently got admitted to grad school and I have to be on campus tomorrow for a lab session. Are the parking prices still the same? Do current students get any discounts?",1612811316,1,0
Pick up soccer groups on campus?,"Hey all, Im a recent transfer to Tech, and was wondering whether anybody knew if there are any pickup soccer groups around campus? Or if it is more of just go and hope people are playing? Thanks.",1612810236,1,0
Can you take a week vacation during an internship?,My parents have a week vacation planned for the summer during my summer internship and I was wondering how people asked for a week off. Is it better to send an email before the internship asking or asking the week of your start date. The vacation would be the third week of my internship. There are also six other people interning with me.,1612809565,1,0
Thank You MS&amp;E Peeps,"When I rolled into the our shop break room for lunch I saw there were boxes of Girl Scout cookies of all different assortments. 

I would just like to say thank you from Area 2 facilities to any of those on here who were involved in this edible gift. 

We'll continue keeping you guys comfortable as best as we could!",1612809159,1,0
Lost Airpods probably around West Campus,"Around a week ago I lost my airpods when I went to the CRC. I had them there, then I went to willage, then walked across couch park / that green field behind the west dorms and then headed to east. I only noticed they were gone a day after so honestly I could've lost them anywhere. I maybe lost them in the parking lot behind Armstrong and Heffner. Hell, at this point they could be in Africa. They're pros and they're in a black silicone case. If you take them out of the case my name (first and last) is engraved (like by Apple, with lasers) on them. Honestly I'm desperate, I've checked the willage lost and found, CRC lost and found, east campus housing center, and west campus housing center. If someone stole them I honestly can't even be mad because they're really good but I haven't even had them for a year bro. Pls dm if you found them, hell I'll even pay you $20",1612808859,1,0
Lost Airpods probably around West Campus,[removed],1612807945,1,0
ISO a Linear Algebra tutor MATH1553,[removed],1612806652,1,0
Challenge or Ignite Summer Program (Prospective freshman),"I was accepted to GT during EA as an in-state student for the fall semester, but I am considering doing Ignite or Challenge in the summer since I have nothing planned.

right now, I am leaning towards Challenge over Ignite because of some reasons:

1. It is cheaper than Ignite, only $500
2. It looks more fun with the different activities like whitewater rafting.
3. I am low income, so the chance to earn a scholarship if I perform well enough is really attractive. How much is the scholarship?

The only pro of Ignite that I am considering is getting ahead with classes. 

Also, if you did Ignite, how much did you have to pay out of pocket as an instate-student with Zell Miller.

I'll love to have some opinions from previous participants in these programs. Thank you",1612805295,1,0
I applied for the MSA program but have not heard yet,"Did anyone hear from the MSA program? I applied on January 1st, but have not been notified yet:(",1612804880,1,0
Besides leetcode how should i prepare my summer to get a 3.9+ GPA in CoC,Thx,1612802570,1,0
Places to do pull-ups on or around campus?,[removed],1612799132,1,0
A GT alumni scored all of kansas city's points in the super bowl,[deleted],1612753944,1,0
GT Alumnus Harrison Butker scores 100% of KC's points in the super bowl!,Greatest player of all time?,1612753848,1,0
CRC sign up website down?,[removed],1612750478,1,0
Admitted student tours?,[removed],1612744158,1,0
Say thank you after lectures,"Disclaimer: I'm not a professor but a TA. Sometimes I wish I could answer the questions students ask in a clearer manner and sometimes I wish I can find a better method to explain my slides, but I'm always pleased to see students type in Thank You in the chat at the end of recitations. And I'm very sure professors feel the same way as well",1612475363,109,2
Dining Halls Charging Dining Dollars instead of Meal Plans,"Hello, sorry if this has been answered before... if a dining location (say Iron Skillet) charges me $12.XX for their meal using $DD instead of a meal swipe when I have a bunch left, is there a way to reclaim my money, or is it lost forever? Thx!",1612470235,7,0
