title,selftext,created_utc,score,total_awards_received
Adobe Creative Cloud,Is anyone getting hit with a “start your free 7-day trial” for Adobe Creative Cloud? I thought we had full access to it and I’ve been using it fine up until just this week,1617060346,1,0
Poli Sci 115 w/ Lohmann Groupme?,"Shot in the dark but is anyone in a groupme for this class?

Sorry to be posting this here but long story short there are somehow no lectures and discussion sections for this class... and the professor somehow removed all the forums from CCLE... and this is possibly the most confusing, least intuitive looking syllabus I've ever seen. Honestly I'm confused how even call this a class. 

If someone else is in this class considered this a cry for help",1617059418,1,0
Grade Dispute - what’s the best route forward?,"Hey guys, I took a class this past quarter and basically I was on the edge of an A- and A. I received my grade which was an A- but saw that I had a few questions on the final where there were some grading mistakes. I usually wouldn’t make a big deal out of this, but as I was on the edge I calculated my grade and found that those grading errors, if corrected, would bring me to an A. 

I reached out to the professor with multiple emails regarding the grading errors, and a detailed explanation of why I felt I was incorrectly graded for each question. The professor’s responses were dismissive, and the last email I just received was him saying he’s now on break till fall so I’d have to wait until then to discuss the questions with him, which feels unreasonable. 

While an A- is still pretty good, it’s just frustrating knowing that I should’ve had an A but didn’t due to minor grading errors, especially when my attempts to discuss it with the professor are being dismissed.

What is my best route moving forward? Should I contact the department or just take the L?",1617059248,1,0
Retaking Math Classes,"So, I failed Math 31A and now I need to retake it to continue the math series. Has anyone been able to retake this class at their local community college or through cross-campus enrollment. I do not have the money to pay for summer sessions at UCLA. Please help :(",1617059120,1,0
French 16 GroupMe,Is there a GroupMe for this class yet? Also does anyone know where the zoom link is?,1617058881,1,0
When you still dont have your winter quarter grades😔....💔,,1617058434,1,0
Huell Howser visits Westwood and the old Stan's Donuts (RIP to both legends),,1617057459,1,0
IYKYK,,1617057366,1,0
Musicology 7 GroupMe,Is there a groupme for musicology 7?,1617056533,1,0
CS 31 Question,"Hi, 

I am a baby bruin who just got accepted into EE (although I am going to try to switch into CS once I go). I was looking at the CS curriculum and it is my understanding that the primary language taught at UCLA is C++ (feel free to correct me if I'm wrong lol). I use primarily Python and so once I got in, I have been practicing a little C++. I was wondering if there was any way I could access past CS 31 (which i believe is the introductory cs class at UCLA) projects and tests to practice? If not, what resources should I use to practice my C++? right now I'm just doing leetcode easy problems. 

Thanks so much",1617056477,1,0
Commute time: Tarzana &lt;-&gt; UCLA,We are considering purchasing a house in Tarzana. My work is close to UCLA. I am wondering how bad would be the commute time before/after the  pandemic.  Thank you so much.,1617055875,1,0
Mental Health Clubs on Campus,Which mental health clubs are available on campus? I am looking for one to join!,1617055437,1,0
"GroupMe for Physics5B (Mehta), Film6A, or Ling 1",I’d really appreciate it if someone can put in the GroupMe for any of those classes! Thank you,1617055264,1,0
For the bruins that haven't set foot on campus,,1617054359,1,0
Whats the difference between Math 3B and Math 31B?,"I know 3 if lifesciences track, while 31 is physical Sciences. But are the Math concepts the same? Or are they teaching you completely different math?",1617054104,1,0
"Soon to be or recent UCLA CS Grads, how is the job search?","Weighing my college options and I enjoy every part of UCLA. The only real concern I have is being able to attain a high-paying job after graduation. Are there many opportunities for employment? How is FAANG recruitment? Where are the locations based usually?

Thank you very much!",1617054091,1,0
"If you could trade away a few A’s on your transcript for lower passing grades and a happier, healthier brain, would you? Why/why not?",Just curious,1617052531,1,0
Is CHEM 14BL offered in the Summer or Fall? I was thinking of just taking it in Summer 2021 or Fall of 2021.,,1617052382,1,0
Mgmt 123,Has anyone taken this course with Gardner during COVID-19? Looking for some feedback on her course since all her reviews on bruinwalk were from in-person. Thanks in advance!,1617052158,1,0
What's up with CAC??????,"Waited the whole day to get an appointment at College Academic Counselling, and several hours later, this message comes up in the waiting room: 

[\\\(\^o\^\)\/](https://preview.redd.it/3s0jdmtt51q61.png?width=574&amp;format=png&amp;auto=webp&amp;s=6fc94ce317a4ed409f3366d5797db084fabc7b41)

How understaffed are they lol, and can we do something about this? I feel like this affects many students, so any ideas to bring this up to the relevant person(s) would be much appreciated. 

\~end of speech\~",1617051540,1,0
Do incoming freshman not realize there’s a designated thread for them to ask questions in,Maybe I’m just in a bad mood because of classes starting today but my god am I sick of seeing all the incoming freshman post about the same couple questions,1617051188,1,0
Still No Grade for Winter Class,Is anyone else surprised to have still not gotten a grade for any of their winter classes? I get that there are so many people enrolled in the course but I think everyone expected an A  in this specific class by now lol.,1617049725,1,0
MyUCLA grade not updating into Official Final Grade?,"I’ve had a grade inputted in the MyUCLA gradebook for 3-4 days now and it still hasn’t updated into the Official Final Grade... should I wait or contact someone, if so, who?",1617049335,1,0
Is 20k in loans a year worth it?,"Hi, I got accepted into the class of 2025. I was admitted for pre business and economics, but I’m probably going to switch to computer science/linguistics. I’m out of state and it would be around $42k a year, so I would need to take out around 20k in loans every year (this number includes fafsa) to afford UCLA. I have enough duel enrollment credits to take off a year of college, but I don’t know if UCLA will accept them yet. I’m debating UCLA over University of Miami, where I would have no student debt or loans. Do you guys think it’s worth it to potentially be in 80k in debt when I graduate?",1617048932,1,0
Summer Session Payment,"I'm currently waitlisted in one class and enrolled in another class as a backup. How does summer session payment work in this instance? Do I have to pay for both classes and when I dropped one of them, do I get a refund?",1617048460,1,0
Pre international development studies -&gt; Psychology,"Hi guys! I’m an incoming freshman who got in for pre international development studies, however, as time passed since completing my application, I’m not really interested in that major anymore and more so interested in psychology 😅 I was wondering if it’s fairly easy to switch over to since psychology is still in the college of Letters and Science? Is psychology an impacted major? When is the earliest I can make the switch? Thank you sooo much💙💛",1617048320,1,0
no spots in 5C - rant,it’s annoying how the department emails back that there won’t be more spots opening on their end and then 2 days later there are more seats filled ? like why you lie &lt;/3 i just want that class so bad. lmk if you are dropping due to sched issues so i can enroll !,1617047960,1,0
Tempted to drop all my classes on Day 1 of Spring Quarter,"Winter quarter was okay, but I'm not ready to get back on track. I woke up late and missed a lecture, and just found out there was gonna be a GROUP PROJECT for that class. Why? A fucking group project in a fucking pandemic when no one ever has any fucking time or motivation to get anything done. 

ALSO, I signed up for (morning) classes that were Online - Recorded, but as it turns out, they're all live lectures where participation is graded. What a fucking scam. FML. 

I hate school. I hate everything. 

Someone please convince me not to unalive myself",1617047798,1,0
Automatic Unit Bump/Increase?,"This might be a dumb question, but does anyone know when the automatic unit bump/increase to 22 units is for the college on letters and sciences? I'm a freshman and was always under the impression that it happened on the first day of instruction but I checked my ucla and it still says that I'm capped at 19 units? (I'm in good standing so my gpa should be fine)",1617047399,1,0
Reminder to Update Bruinwalk!,"I forgot to do it till today oops, but yeah... better late than never lol",1617047313,1,0
Is UCLA worth it?,"Hey Bruins! I'm a prospective student for this school but I'm battling whether this university is really worth it. I know ucla is hella prestigious and whatnot but I need some clarification whether this place is THE place to go. I got two questions. 

I'm trying to become an Imagineer. I heard that UCLA is a great place to network in order to get that job. Is that true?

What's really holding me back from UCLA is the cost. I'm down for academic stress because that's just life at this point. But in the end have you guys been able to pay it off? And if not are you on a good track to?

Sorry if these are stupid questions. Thanks for the help!",1617046422,1,0
Bruin Bill Update,,1617046260,1,0
scared of ls23l 😳,based on the ccle page alone it seems like there’s gonna be a ton of work for this class. i’m taking ls23l along with three other stem classes and i’m concerned that i won’t be able to keep up. should i drop it and take it in person in the fall? if anyone can share their experience taking ls23l online id really appreciate it,1617045837,1,0
"When Jordan Brand officially takes over, should the gold stripe return for the basketball jerseys?",,1617045543,1,0
Unit Cap,"When is unit cap supposed to be lifted automatically? I’m trying to enroll in a class and I meet all the criteria but it won’t let me.

Also I can’t petition for over 19 units since it says “You are currently not enrolled in any classes to change units”....",1617045272,1,0
Psych 85 with Carrigan,Hi if anyone is taking Psych 85 with Carrigan please PM me I have a quick question about the class! Also if anyone happens to have a GroupMe link that would be great too. :),1617043791,1,0
Groupme for 153A,Anyone have it,1617042335,1,0
Working,"Hi, I am an incoming Freshman to UCLA. I plan to major in Poly Sci, and my question is that should I work this fall? Considering I want to join clubs and do well in my academics. 

Thanks.",1617041757,1,0
Lincoln Chayes for math 132 compex analysis,"Math Major here. Is chayes worth taking considering the consistent low reviews on bruinwalk? I am taking him for 132. Should I switch out the class for

 131C (topics in analysis). It is open with Harrop-Griffiths? How easy is the class (I haven’t seen anything on bruinwalk)

111 (Theory of numbers) with Khare

Please let me know in the dm’s or reply under here. Thanks",1617041673,1,0
Financial aid less than 12 units adjustment,How does the financial aid adjust your amount if you enroll less than 12 units? Do they just charge you on Bruinbill?,1617041453,1,0
Easy Scholarship Application For Any Undergrad!,"Hey, here’s a super quick and easy scholarship application that any undergrad can apply for! It takes about 5 minutes and only takes one paragraph of less than 300 words. You can do it easily from your phone! 

https://apply.freshprints.com/scholarship6/?kid=1H7AFC",1617041426,1,0
CHEM14B Zoom Link??,"Can someone send me the zoom link? It’s no on my CCLE page for some reason. I’m in lecture 2 with Scerri. Hmu with a GroupMe too please if there is one, ty!",1617041377,1,0
Physics 1A w/ Gutperle,"If I don't fill the co-req of taking Math 32A, will I be dropped from the class? The 32A professors have garbage BruinWalk ratings so I decided to not take it this quarter.",1617040949,1,0
where is the summer financial aid application?,"I just enrolled in 2 summer session classes for C sesh, but I'm unsure about how to apply for financial aid. I already submitted my FAFSA, but I thought there's a separate application for summer financial aid too? When I go to [https://sa.ucla.edu/fao/summer](https://sa.ucla.edu/fao/summer) there's only an option for summer travel and global internships.",1617040641,1,0
DESMA 9 Groupme/Help,"Hi guys, I just enrolled in Desma 9 this morning, it says there is lecture from 9-1045, but on CCLE i dont get linked to a CCLE site for the class, instead i get linked to this: [http://classes.dma.ucla.edu/Spring21/9/](http://classes.dma.ucla.edu/Spring21/9/)

Did I miss an important email or something? Also, is there a groupme for this course? 

Thank you!",1617038703,1,0
Can someone send me the syllabus for MCDB 138?,Can’t find anything on the professor online,1617038514,1,0
heavy/tough load or nah?,"I’m taking Public Health C150, Musicology 7, LS7A, Public Health 88S and Anthro 1. Are any of these classes a pretty bad workload or relatively manageable? If you’ve taken any of these classes and have any insight I’d appreciate it",1617037342,1,0
Coming on an exchange to UCLA,"Hey everyone! 

I’m a sophomore at McGill University in Montréal, and am applying to UCLA for a winter/spring semester in 2022

I was really wondering what people’s thoughts are on this—how do you think a UCLA experience would be for 5 months as an exchange student???

I love sports, surfing, running, and the beach, so the lifestyle is really attractive to me. I’m also really social and love to meet new people and party. My only concern is, as an exchange student, I wouldn’t maybe have the same opportunities to be thrown into social events like normal incoming students? Is it difficult to find / get invited to parties, functions, etc., if I put myself out there and go looking?

Thanks to anyone who takes the time to read this!!",1617035954,1,0
happy spring quarter from babushka powell cat 🐥🌸🍒,,1617035554,1,0
Psych 85 Notes,"I was wondering if anyone who has taken Psych 85 could share their notes with me? I just read through the syllabus  and I'm feeling very intimidated by the content, despite how interested I am. Anything would be greatly appreciated. Cheers!",1617035440,1,0
Me after I get back Winter grades.,,1617035212,1,0
Dorm by Quarter?,Does UCLA allow students to move out of dorms after a quarter? Do you pay by the year?,1617035134,1,0
Me after I get back Winter grades.,,1617035084,1,0
UCLA vs Dick and Balls International School??,"title
pros: UCLA has prestige 😻 and it’s in the cityyyy 😏
cons: Dick and Balls International School (DBIS for short) is my dream school, they gave me a full ride, priority enrollment, they have a 100% med school placement, and they actually have a facility that is about to find the cure for cancer 
really hard decision plz help!",1617034332,1,0
groupme for stats 13 with Almohalwas?,,1617033680,1,0
groupme for physics 5b with carter?,,1617033652,1,0
groupme for ls23l with pfluegl?,,1617033627,1,0
groupme for ls7c with khankan?,,1617033583,1,0
Just your morning reminder that we’re part of the Elite Eight,,1617033447,1,0
New Bruin bill looks,Really good I give them a pat on the back 😌,1617032556,1,0
Rec center facilities,I’m a future grad student at UCLA with a family. Is access to the Rec center facilities included in tuition or is there a separate cost? How does it work to get my husband access as well - buy a guest pass? Thanks!,1617030963,1,0
Is housing first come first serve?,"basically, if I apply on the 1st of April will I be prioritized over someone who applies later? 

I'm not sure I want to send my SIR yet, but if that's the case I might rush a bit more.

&amp;#x200B;

Thanks in advance",1617027126,1,0
Anyone else not have their final grades published yet? 😀,Happy spring quarter,1617026300,1,0
don’t forget your bruinwalk reviews!,"hey y’all! 

now that we’re getting final grades, don’t forget to add your reviews to bruinwalk! 

i think most of us use them to choose our classes so it’s really helpful when there are more reviews on the website

thanks!!",1617016356,1,0
Totally Forgot!,"I totally forgot to celebrate for the Class of 2025 to UCLA! It was my first acceptance, and I was so thrilled that posting on Reddit just disappeared on my mind lol! Congrats to everyone who received an acceptance to UCLA for 2021 fall semester! I might see you all there if I commit to UCLA!",1617015956,1,0
Housing for a newb,"I was accepted last year (I’m a transfer) and have yet to be on campus like many others, so I am pretty stoked for the fall. Couple questions about housing I wanted to get sorted out in the meantime:

1) Is the housing app that comes out April 1st done on a first come first served basis? 

2) For anyone who had ever had the luck of getting a single: did you feel more isolated from the rest of form socializing/activity or was it worth it? 

3) What do you think are the best dorms and why?

4) Soooo how are they even prioritizing housing this year? I mean, if incoming freshmen don’t even get guaranteed housing, will those of us who got in last year be considered?? Idk if anyone even had this info yet I’m just IMPATIENT ok 

I would really appreciate any input I can get! 😷",1617015092,1,0
Stop asking us what school you should go to,"1. Use the search bar, if you really want our opinions. A million questions like this has been asked before. Go and search. Fine your answers instantly.
2. You’re clogging up the feed. I miss seeing UCLA memes. Now they’re hidden under piles of ‘UCLA or davis???’ and “UCLA or uc Berkeley?’

This is a question you have to ask yourself. People online who hardly know you can’t tell you what school to go to.

&amp;#x200B;

Also, sign the USAC petition to get our money back freshmen.

[https://sa.ucla.edu/Forms/p/ConstitutionalAmendments](https://sa.ucla.edu/Forms/p/ConstitutionalAmendments)",1617013947,1,0
Roommate plans?,"So, before the school's dorms got purged, I had 2 roommates planned to live in Sproul, but with the email announcing that the housing app is opening on April 1st, and I don't know anyone at school anymore minus my webcam for the last year, and idk if I wanna risk getting random roommates again. Basically, does anyone have the slightest hint of a plan for housing next school year in terms of roommate planning or anything?",1617012070,1,0
Ling 20,"I ended up enrolling in the only Linguistics class that fit in my schedule with Moore-Cantwell with no reviews. I was wanting advice on how Ling 20 and Ling 1 compare. Their names are very similar, but Ling 1 filled up way faster, so is it easier? Would anyone who took Ling 20 either in person or online recommend the class or is this a class I should be skeptical about?",1617008362,1,0
watching march madness has made me miss the UCLA community so much,"class of 2020 alum here. My senior year was cut short cuz of the pandemic and I've been missing going on campus ever since. You really take the little things for granted and you don't know what you have until it's gone. 

But as time passed I stopped thinking about it as much. And then ever since I started watching march madness and seeing the school spirit from friends/classmates on social media, damn have I been missing the campus so much. People often make UCLA out to be a really cutthroat, competitive environment and while students can be competitive, almost everyone I've interacted w/ on campus have been so friendly and warm. Also there's just a special vibe when you walk to class and go past the bruin w/ all of those tourists taking their pictures. I really miss all of this 

That kinda all I wanted to say w/ this post I guess. I really just miss being on campus and I hope I can return some day. If you're still a student, make the most of your time at this amazing school!",1617008296,1,0
Found an old textbook in my closet! Giving it away for free! (Retails for $170),,1617008045,1,0
Unable to access the CCLE of a class I'm enrolled in?,"I enrolled in a class last minute, and when I try to access the CCLE page for the class, it just says "" This is the public display of the course site. You need to be associated with the course to view private course materials. "" I've made sure that I'm signed in and everything. Do I just need to wait a while for it to register that I'm in the class?",1617007165,1,0
Kicks in Westwood,Anyone know a place where I can turn in some Jordans I don’t want anymore for some $? Somewhere authentic where they also sell authentic shoes and apparel?,1617006462,1,0
Barreto Poli Sci/CCAS,"Has anyone taken a class with Professor Matthew Barreto? More specifically has anyone taken Latino Politics with him, what was he like and what was the workload?",1617006416,1,0
how to focus in unideal environment?,"//tw  inconsiderate parents

lets go spring quarter!! taking lots of challenging classes that r honestly kind of exciting. problem is my parents have been fighting so much lately, and from the last few weeks of winter quarter my father has been out of pocket. refuses to get any kind of evaluation but my sibs and i are sure he is bipolar. he is verbally abusive and has been physically in the past. during one of my finals they had a fight and i. did not do well on that one oof

so these days i feel like on top of work, school, clubs, internship searches, i have to walk on eggshells at home. recuperate w my mom, console and protect my younger sister, avoid dragging in my older siblings w any arguments. when my fathers home everyone is on edge, and he likes to hang out in the room by our kitchen, so i havent eaten a genuine meal while he is home. just tonight he told us to stop buying food ( we have an extraordinarily complex relationship with money as a family and he is enabled by it )

basically i cant really escape the restlessness and avoidance, and i really want to focus and do well this quarter. obv there probably arent any accommodations from the school itself that would help w our living situation, esp bc my father is paying for my tuition and i am nowhere near financially stable on my own. i cant really leave home for class either bc the pandemic is very... present lol. any suggestions?

// tldr home is not a good place to be rn and i am too disturbed to study comfortably but theres nowhere else to go (also dont wanna rlly abandon my siblings)-- what can i do?",1617003498,1,0
Graduate Housing Help,"Hello! I'm an incoming grad student all the way from the east coast, and I am so lost on graduate housing options. I have a couple questions!

1) Do most people pick UCLA off-campus housing or do they find other renting options? 

2) What are surrounding neighborhoods I should look at if I choose non-UCLA housing? 

3) Which off-campus graduate housing building feels the newest on the inside? I did virtual tours of all the buildings, and I was in shock at how dated most looked 

4) Which UCLA off-campus housing is the ""best"" overall? 

My max budget would be around $1400/month, and I prefer having a roommate over living by myself!",1617001173,1,0
Is business economics worth it?,"I want to go to UCLA because of the prestige and location, but I've only heard bad things about bizecon at UCLA. What are the job prospects and salaries like? Is it better to take business at UCR or Fullerton?  Thank you C:",1617000853,1,0
HELP: UCLA Professor Shown to Sexually Harass and Solicit his Students by Sending Lewd Videos,[removed],1617000408,1,0
HELP: UCLA Professor Shown to Sexually Harass and Solicit his Students by Sending Lewd Videos,[removed],1617000400,1,0
Incoming advice for freshmen?,"Hey y'all,

I am an incoming freshman for UCLA's Class of 2025! I recently applied to UCLA's Regents program, but was ultimately rejected and am feeling hella discouraged. Ngl, this one hurt more than a college rejection, but I want to bounce back from taking this L.

With the Regents Program, you will receive priority course enrollment, which is huge. As a premed student at LA, what are some things that I can do in my freshman year of college to differentiate myself from the pack off the bat and get a head start, speaking generally from a college standpoint and also specifically to UCLA. Thank you!

Also, if y'all got any tips and tricks in general, I would love to hear them hehehe",1617000049,1,0
Why does CHEM14BL have so many extra assignments? I thought it was supposed to be easier than a regular chemistry course.,,1616998529,1,0
What's it like to apply for housing?,"I've heard that plazas and suites are the best types of housing at UCLA but they're more expensive. I've also heard that it's a scramble to apply for housing. I have kind of bad anxiety regarding sleeping around other people, so I'd like to avoid sleeping in a triple but a double would be fine. is that a thing I can control or is it a lottery?",1616996947,1,0
deferring my acceptance,"Does anyone have experience with deferring their acceptance a year? I want to take a gap year and live with my family in Austria and possibly Spain. If I were to apply to defer my acceptance, would I have to fulfill any extra requirements or would I be able to jump right into it?

Follow-up question: I'd probably like to take CSI classes before I'd enroll. What's that like?",1616996075,1,0
