title,selftext,created_utc,score,total_awards_received
CAN'T DECIDE,"I can't decide what major I want to pursue. 

&amp;#x200B;

The current choices for me are Chem and Econ: 

1) I'm pretty good at Chem and have been acing my chem classes so far, but I dread physics and really am having second thoughts about this stream because of future job prospects and how limited it is to chem and delves greatly into physics rather than chemistry in general. 

2) On the other hand, there is Econ, a subject I'm vaguely interested in after reading books and anyways plan on doing the entrepreneurship minor so it seems to have a good overlap with the same, but I've never taken an econ class so have start from 1/2; from what I've heard, they are horrible. 

3) I am taking a gap in spring to do an internship and I can't really do these long stretches of online uni so I was going to do Econ 1 and 2 over the summer but again I'm overthinking and having cold feet about this. If I do econ in the summer I'm also falling behind on chem if I do choose to stick around.

any advice or experience would be greatly appreciated, thanks!",1612445947,1,0
Math 61,"Anyone taken math 61 online? I’m thinking about taking it with ec engr 141, 110/111L, and 113 but unsure of how heavy the workload is for math 61.",1612444049,9,0
Stats 102A: How generous is Guani Wu's curve?,"I'm currently swamped with work (procrastination made it a million times worse), and also horribly stuck with the second homework assignment. I got a 95 on the first assignment, but I might have to end up taking a hard L on this assignment in a category that is worth 45 percent of our grade. 

How much does Guani Wu curve? Are bad scores common in this class?",1612428194,6,0
Head literally empty!!!,"I can barely study these days because my head feels empty and text anxiety has my heart rate literally going off of the charts! Also I am very sleepy even though I get plenty of sleep. I am also working all the time and feel like I am losing myself! Who even am I anymore!

Sometimes I am extremely excited when I think about coming to campus in person, but for now, not even UCLA specifically but online college and the expectation that we function normally if not more autonomously as a pandemic rages through hundreds of thousands, I wonder if anything is truly worth it. I mean it is definitely but any thought of a future where I am once again a functioning human being feels so far away that I may as well sleep until its over with all this fatigue.

Go bruins tho bc sometimes I hate school but then realize it is just school and so far the faculty and people I have met are really very kind and supportive (even if they assign so much work holy) and the community is great. One day I will meet yall irl... idk when tho",1612428100,58,0
"New slate running for USAC this year. The Circle Jerk slate!! 3 simple promises, nothing more!",,1612427202,271,3
Sometime I don’t wear my seatbelt when driving to the grocery store,[deleted],1612423155,0,0
USAC Stop lying,Applied for grants they were giving to see what they’re about and havent heard back. Got one email replied and nothing. Books for bruins closed a while ago. Are y’all keeping it for a catering event i missed?,1612421496,3,0
Does anyone else feel like there's not enough time in a day?,"Like before I start thinking about what to stress about, half the day is already gone and I'll just use the remaining half stressing about how I was thinking about stressing earlier while still not doing any work. Maybe it's just me.

Anyways, Happy mid-mid quarter everyone!!",1612421191,134,3
Stats 101A (50 spots) vs CS 180 (360 spots) – Which should be more competitive to get into?,"I'm a soph. I'm trying to double in Ling&amp;CS and Stats, but I can only have one major on file for now. I absolutely have to take both classes together in Spring 2021. I can declare either of those majors (BUT ONLY ONE) before I try to add the second one.

I'm currently leaning towards adding Stats right now since 101A only has 50 spots. Do you guys think I'll still be able to get CS 180?

Or should I declare Ling&amp;CS, get into 180 easily and take my chances with 101A?",1612420663,6,0
Request: Interview participant,[removed],1612418287,2,0
Chem 14A Midterm.... Any Study Advice/Tips?😢,"I’m really nervous about the midterm, especially with Scerri’s curving. Any advice would be very much appreciated 😖",1612417640,6,0
Anyone in 14bl,[deleted],1612417577,1,0
"What is USAC, exactly?","I’d google it but I’m lazy and trying to avoid finishing an assignment. All I know is people here hate it or are trying to become part of it. I probably should care about it, but I don’t know how much it affects me, if at all.",1612416571,11,0
Stop being annoying,"Really wish you guys weren’t so cynical about USAC. I’m literally trying to help and I have no sort of critical insights to help me make UCLA better. But then ppl get mad when things don’t turn out a way they wanted it to.

LEARN TO ADVOCATE FOR YOURSELVES AND SUPPORT THOSE TRYING TO SUPPORT YOU!!!!",1612416027,0,0
Vote for a USAC candidate that makes repairing our embarrassing restrooms their number one priority.,"I know many of you haven’t had the opportunity to have classes on campus yet (hopefully we’ll be back soon). Campus is beautiful, however, there is huge problem with it that might shock you. The restrooms are disgusting. A disturbing number if stalls don’t have locks, there are too many glory holes, and some are just broken, filthy and need to be torn down and rebuilt. I’m not exaggerating: our restrooms are embarrassing. If USC or UCB hear about this, we’re done for. 


I’ll vote for any candidate that makes fixing or renovating every single restroom on campus that needs it (i.e most) their number one priority. I encourage you to do the same.",1612415286,46,0
What week is it rn?,[deleted],1612413986,1,0
I'll vote for anyone in USAC who will add more jack off spaces on campus or at least consider the idea of doing so.,"I'll never return to campus anyway but do it for the future jerkers, please.

Driving for an hour and a half without spanking it, and then sprinting to the nearest designated jack off area bc you're late while trying not to trip over your boner literally EVERY morning is the worst. The closest bathroom to P7 is like a 3 minute RUN but typically I've been wanting to stroke it for an hour already. I did this for 3 years. We need spaces to jerk off.",1612413704,267,4
Brain and Behavioral Health Minor,"Does anyone have updates on how the minor is going for them? I know it barely started Fall 2020, but I'm genuinely interested and would love to hear more from a student's perspective. Thanks :)",1612413301,15,0
USAC Candidate: I want to hear from you!,"I’m a 3rd year transfer student and I’m really interested in hearing from the student body on how best I can support!! 

My platform is going to be including things like financial transparency in USAC and minority student support, but I am looking for something deeper and bigger in a sense that it steps beyond my thinking of what is possible. 

I want to hear from you all: what do you want? What could make you hate USAC less? How can USAC be more effective? What is something students in USAC lack that needs to be worked on? 

Since I’m running for either Internal Vice-President or President I need to understand this student body better and I simply haven’t had the chance due to COVID and being a transfer. So I am making up for this by representing my Bruins in the best way I know how. 

Please comment below with what you want from USAC in 2021-2022!",1612411722,9,0
LS30A midterm,Our first midterm is coming up and I’m not sure what is the best way to prepare. My plan is to redo all of the PEQs and clickers but would redoing the hw be effective as well? Also is coding going to be tested on?,1612411089,1,0
Chem14BL Learning Assistants?,"I'm thinking about applying to be an LA for Chem 14BL but I don't remember any LAs being in my lecture or lab in the past, so I'm curious to see if anyone knows what their typical role is like even if you personally aren't one yourself.",1612410250,4,0
Psych 100b,"For those who have taken psych 100b, what are some tips to pass this class? I did not do well on the first exam 26/40. Fortunately I've gotten 100 on the past quizzes. And so far am doing well in lab, we just started working on the project. I really am not looking to get an A, I dont even know if its possible at this point. I would not mind getting a C, I just want it to be over. Any tips plz",1612409037,7,0
Carter for Physics 5B Spring,"Does anyone have experience with Carter in a virtual format? Most of his bruinwalk reviews are outdated, thanks!",1612405690,2,0
ece141,am i just a dumdum or is this class *obscenely* hard/fast even compared to other engr upper divs,1612403633,3,0
Need an easy/low workload Upperdiv to add next quarter,Title,1612401289,13,0
MAE 103 Kavehpour,do people who have taken his class in the past know if he curves the exams or anything cause like that first midterm hurt 😔,1612396517,5,0
Buying books in the third week stops working,[deleted],1612395577,14,0
Study abroad question,[deleted],1612392790,2,0
32B and upper-div math classes,"I'm really struggling to understand some 32B concepts, so as a math major, I wanted to ask how much 32b is related to upper-div math classes that list it as a pre req(ie 131A). I am a bit worried and am considering transferring majors.",1612391926,6,0
Has anyone moved abroad after graduating from UCLA?,"I'm a second year, and I'm planning on moving abroad once I graduate (Japan or South Korea). Can anyone refer me to some resources at UCLA that can help guide me in making this plan happen?",1612391228,8,0
ASL8,"hi! has anyone taken asl8 online when covid was first happening. if so, how was the class in terms of class work, workload, layout, tests, quizzes, exams, etc.",1612391124,3,0
I want to apply,I want to apply to ucla and kinda want to talk to an indian student,1612389910,0,0
"Do you or someone you know feel depressed, anxious, or stressed? (UCLA Treatment Study)",[removed],1612389381,1,0
Do you or someone you know fear social situations or have sudden anxiety? (UCLA Treatment study),[removed],1612389310,1,0
Do you think UCPD should be abolished?,,1612389109,0,0
How is the party scene at UCLA? Did you ever meet any celebrities/influencers?,"Just wondering if the school is really that popular for parties and influencers, if so, where?  I saw that Addison Rae and David Dobrik once came to the school to shoot a video, but what about the nightlife?",1612387988,0,0
Transferring to UCLA,[deleted],1612385576,0,0
Neuro 102,[deleted],1612384777,2,0
Some drone shots I took of UCLA,,1612381796,421,3
I'll vote for anyone in USAC who will put a bathroom in the parking lots or at least consider the idea of doing so.,"I'll never return to campus anyway but do it for the future commuters, please.

Driving for an hour and a half and then sprinting to class bc you're late while trying not to piss your pants literally EVERY morning is the worst. The closest bathroom to P7 is like a 3 minute RUN but typically I've been doing the wiggle for an hour already. I did this for 3 years. We need bathrooms.",1612381548,181,2
Some Drone Shots I Took of UCLA,[deleted],1612380457,1,0
Fax,How do I use this ancient form of technology? Is there any place on campus I can do it at?,1612380200,7,0
Aerial view of UCLA,[deleted],1612379505,2,0
Is there any way to gain access to your original admissions letter?,Currently a second year,1612379172,12,0
Psychology versus Cog Sci major?,"Basically I’m a physics major but I really like to learn about how people think and behave from a causal standpoint and looking at groups of behavior (I’ve read plenty of scientific papers/done lab research on this - and ofc good ol youtube).

So I’m planning to get a second major in psychology to be more rigorously knowledgeable about this field. I saw there was a Cog Sci option too that has some parts I like.

I’m wondering what your thoughts are on the two majors. (Which one you think have classes that are more interesting, more practical/relevant,...?)",1612377582,4,0
recreational classes,"i missed like all my recreastional classes lol, they wont show up on my transcript right?",1612376011,2,0
Anyone know of any good and active UCLA football fan pages?,I’ve been trying to find a fan page to get updates on players transferring or going to the draft and that kind of thing but I can’t find one.,1612375732,5,0
"Research opportunity for students who do Uber, Postmates, Lyft, UberEats, Doordash, Amazon Flex, Instacart...",,1612360017,1,0
Why am I only productive from 12 AM to 5 AM,please i want to be normal and work and sleep at a normal human time..... how do you guys do it,1612357093,186,0
Currently having a pre-med panic attack and need reassurance/advice,"I’m quite literally losing sleep over this and I just need to hear people’s thoughts on my thoughts. I’m a 3rd year pre-med student and I truly believe that I’ve been wasting my time these past 3 years in regards to being a part of programs or labs and that I haven’t done anything truly relevant towards reaching my goals of getting into the medical field. On the academic side of things, I’ve been doing relatively okay but could use some room for improvement, however this isn’t my main concern. To sum it up, I’m freaking out because I don’t feel like I have the time or the experience to make myself a good candidate for med school. The programs I’m in right now are great in my opinion, but I don’t feel like they really contribute to my pre-med resume if that makes any sense. I’ve spent all my efforts trying to get into competitive programs to no real avail, and as a result I didn’t explore many other opportunities. 

There are a few theories I have for this, ranging from me being a first-gen student that went into a school like this not knowing how to navigate the pre-med environment to feeling too overwhelmed with classes to explore and put time into extracurriculars. I wish I could go back 3 years and be smarter about all this, but that’s just not possible. With me nearing my 3rd year, I only have so much time to get my shit together and have a chance at the career I want and I just don’t know if that’s possible at this point. I know that none of this defines me as a person, but I just feel like I dropped the ball and now I’m stressing out as a result. If any pre-meds both past and present have advice to give, please do so. 

tl;dr: 3rd year pre-med is currently freaking out because he feels like he wasted the last 3 years and doesn’t have the time to make up for it.",1612353121,34,1
ARCHEOL 30 with Prof Hans Barnard,"Hi, has anyone taken Archeology 30 with Professor Barnard during online or even in-person? I'm a freshman trying to fulfill my physical science GE req and was wanting to know if this is an easy GE to fulfill it with Spring quarter? (I also don't know anything about Archeology) If it's not, are there any other recommendations you all have for an easy Scientific Inquiry Physical science GE? Thank you!!",1612349054,2,0
Roommate Studying Abroad,"So the person I was planning on rooming with next year applied to study abroad during next year's Fall quarter, but both of us would still prefer to live on the Hill. Is there any way we can get a housing contract together where they could live on campus for only two quarters? Or do we need to find an apartment? Sorry if this is an obvious question, and of course this is assuming housing for next Fall works as normal",1612345887,3,0
Let’s make a petition to request a longer leave of absence?,From what I know ucla only allows one quarter for a leave of absence unless it’s for the military or another extreme excuse. I want to get the most out of ucla and I feel like it’s unfair to limit it to one quarter and not even change the rules from any previous year.,1612343107,3,0
Scared to report to Title IX,"I recently had an extremely bad experience which definitely warrants a Title IX complaint but I’m scared that it might get beyond my control somewhere down the investigation, because I’ve had that happen to me with CAPS. 
I just want to know people’s experiences with Title IX investigations and how they go. 
Let me know if anyone has any bad experience or anything I should know about before going forward with this.",1612342860,62,2
Change of Major Architecture BA AUD... and anxieties,"Ok so I applied to the Architectural Major as a current 2nd year. I did the 3 prerequisites, have a GPA above 3.5, have finished my GEs, have a backup Major in Art History, and submitted my portfolios and everything. I know that the Change of Majors to Arts and Architecture is competitive, however I have never get to read specifically on AUD stats. Am freaking out, because I feel like my portfolio won’t meet the same caliber of students with enough resources and high school/cc architectural background. And well am kinda having a little anxiety attacks in thinking I won’t be able to do the Major I really want and have been passionate about. Am down bad, I feel like it’s taking a toll of my self esteem. I don’t even have joy in creating stuff after my application, because I feel like I’ll be told straight up NO. I’ve read in the Arts and Architecture website that there are higher chances of getting in by being a ucla student already, but that’s document is kinda old. So idk, just been freaking out a lot. This is what I want to do ,and I went all in my personal insight statements and application. But until March, am freaking out, a lot ........ 🄰 🄻🄾🅃",1612342251,3,0
is this spring schedule doable?,"ls7c, math31b and chem14a. will that be too much? or should i just wait to take chem 14a during the summer or fall 2021? but will starting the chem 14 series next school year will have me fall behind? i kinda feel like i will be behind since it's a long series and people usually start at the beginning of  freshman year.",1612341670,3,0
Week 5 already?,Jesus fucking christ where is that pause button from click god damn,1612338335,211,0
Upper div L&amp;S diversity requirement,What is the easiest upper div class and prof to take for the L&amp;S diversity requirement?,1612337898,4,0
global health minor prep courses,I have to take one more prep course before declaring a global health minor (i already took stats 13) and i was wondering if anyone recommends a specific course (enjoyable or easy lol)? I am gonna try to knock it out in the summer so does anyone also know if these prep courses fill fast for summer enrollment? Any general advice would be appreciated thank uuuu,1612336028,4,0
Global Health minor and competitive minors??,"Im interested in two minors: global health and S&amp;G. I am planning on applying to the S&amp;G minor in the fall but I know it is a bit competitive. Since I am also interested in global health  (which is less competitive), and b/c i still need to fulfill a prep course for declaring a global heath minor, should i  take the global health course before the fall? Would you consider this being safe or potentially wasting my time? Also this may be a dumb Q but could i declare a global health minor winter/spring of junior year if i get rejected from the S&amp;G minor and decide to fulfill the 2nd global health prep course in winter/spring next year? Hopefully this made some sense. Lmk if i can better explain something :) tysm",1612335650,1,0
"Recently joined a lab, honestly don't know what i'm doing.","I'm almost 5 weeks in after joining a lab, and I was tasked with writing a literature review. I've been reading, attending the PI's office hours, asking as many questions as I can and overall trying to stay proactive (despite everything being remote). I still feel lost and cannot bring myself to write a decent lit review. No matter how much I read and look stuff up, I can't wrap my head around seemingly simple techniques/concepts. I feel like I get the general gist of my lit review topic, but not enough to write a whole report... 

Any advice on how I can go forward, especially with everything being remote and the undergrad research experience being severely limited these days? Is this something I should be communicating with the professor or other grad students?",1612334112,16,0
tips on bouncing back from average midterm score,"scored the class mean on the first midterm for a weeder course (pre-bizecon) and would love to hear tips/success stories from those who have bounced back from an average/below average midterm score. reading some success stories would be great, as i feel pretty lost in terms of the sea of groupme polls and messages that make me feel like i'll only ever score the class mean. i trust myself to put in the work to study effectively for the next exams, but i'm not sure if it will be enough to score above the mean (hopefully top 30% to land somewhere in the A range). thank you!!!",1612331410,7,0
I am not so great,[deleted],1612330903,3,0
Any hiking spots near UCLA?,school is giving me mental illness. anyone know any good hiking trails nearby?,1612330866,16,0
Should I take math 32A over the summer?,[deleted],1612330769,1,0
Why don’t the new delivery robots have little faces,Berkeley’s kiwibots are so cute &gt;:(,1612327776,17,0
Checking in to see if all profs are still alive,,1612325273,97,1
Anyone else feel like their writing has gone to complete shit,"I used to be so methodical on my essay writing, I had a whole system down to get out good ideas quickly and efficiently and I have just lost my touch completely. I’m so worried about doing poorly this quarter because I just cannot retain or write for my LIFE.",1612325222,72,0
UCLA Enrollment for Fall,"Hi, I am a Poli Sci major at Ucla.

Are we able to look at the UCLA classes and what teachers are teaching that course before enrollment starts? 

I was thinking maybe if i were to do my research in bruinwalk before the enrollment starts, i can smoothly pick my classes. Thanks",1620247640,1,0
Kombucha Survey (and a $25 Amazon gift card!!!),[removed],1620245485,1,0
Undergrad Research,Procrastinate for SCIENCE! Looking for US-Based College undergrads to take 15 min to participate in research intended to help us understand how demographics might impact academic success during the pandemic.  Approved by the USU IRB (#11169) https://usu.co1.qualtrics.com/jfe/form/SV\_do3oZBCiODT57IV,1620244524,1,0
Religious studies,"Hello, I was just trying to figure out how to connect with others in my major. There’s so much information and stuff my head is spinning.",1620244253,1,0
Discord Servers?,[removed],1620243496,1,0
Self-isolation for visitors,"Hey guys, I know that it’s mandatory to self-isolate after arrival in California, but is it strictly regulated and checked?",1620242931,1,0
Big Hero 6 San Fransokyo Institute of Tech partially modeled after UCLA?,,1620242620,1,0
Petition for in person graduation for class of 2021,"If you're class of 2021 and want to have an in person graduation like most other schools in LA, or if you're sympathetic to our plight, please sign this petition: [http://chng.it/z8gpMtmBYM](http://chng.it/z8gpMtmBYM)

  


UCLA still maintains that we'll have an in person ceremony for graduates only, even though LA is now in yellow tier. I want my parents to be able to come!

Thank you",1620242448,1,0
Scheduling,"Hi i am going to be a Freshman at ucla

i was curious if it possible to schedule ur classes between Tuesday and thursday? If so, how common is it?",1620240730,1,0
Moisés Letter of Solidarity and Support,,1620239583,1,0
Thank you UCPD for keeping us safe,https://youtu.be/TRVr2syCemI,1620237976,1,0
Psych 100B Summer Session Switch from A to C,I have a spot in Psych 100B Summer Session A right now and hope to switch to Summer Session C. Is there anyone who wants to switch from C to A and is willing to exchange?,1620237945,1,0
Questions about Math course outline from an incoming CS major,[removed],1620235740,1,0
UCLA Laptop Reimbursements/Financial Help,"Does anyone know of any UCLA resources that help you pay for buying a laptop? I’ve heard from a couple students that financial aid can reimburse you for a laptop but that sounds too good to be true. Does anyone have any information about that?

My current laptop is on its last leg and I come from a very low-income household, so I wanted to ask here before I start finding a way to pay for one on my own.",1620231694,1,0
lectures,i am behind on them,1620230165,1,0
Psych Upper Divs?,Are there psych upper divs i can start taking after finishing psych 100a or i have to finish psych 100b first too?,1620229391,1,0
Cinco de mayo,"What *fun* things are y’all doing today lol
And if you can recommend a bar or two in Westwood/downtown LA that’s also appreciated :)",1620228257,1,0
I’m literally 2 weeks behind in lectures,I have an exam friday. What have I done,1620227993,1,0
Satisfying Spanish FL Req Over Summer,"I'm planning on graduating this summer but still need to fulfill the foreign language requirement. I've been told that I can complete it by taking classes at a CC, but most CC's only offer Spanish 1 over the summer and don't let students jump to Spanish 2 directly. Does anyone know of a program or school that offers an intensive course that covers both Spanish 1 and 2, or knows of a way to fulfill the requirement some other way? Thank you!",1620226286,1,0
Failed econ 41 midterm,"failed my econ 41 midterm, anyone taken Danis's class has tips on how I can better prepare for the final? What if I failed the class, will it go on my transcript?",1620225014,1,0
