title,selftext,created_utc,score,total_awards_received
"hey guys can I get some help with this poll it's for my class, it's about 'Streaming Services vs. Cable'. I would greatly appreciate it.",,1615942433,1,0
may this get you through this week,[https://www.facebook.com/100002124014751/videos/1656363031111148/](https://www.facebook.com/100002124014751/videos/1656363031111148/),1615941923,1,0
If anybody is feeling badly this quarter,"at least your final isn’t in hieroglyphs. 

Jokes aside though y’all are sleeping on Middle Egyptian as a foreign language. It’s offered every two years I think? Even though Middle Egyptian is hard, it’s still a fun class and our professor is amazing. So yeah - if you’re looking for a dead language, don’t let Latin tempt you. Middle Egyptian is the way to go, and a really cool way to fulfill your FLR.",1615941128,1,0
Last time to apply to transfer into engineering?,"Sophomore in LS here, I want to transfer into engineering. I'm taking my last requisites this spring qtr. 

Will I still be allowed to apply by the time the quarter is over if I meet the gpa requirements and stuff? 

Would I still be allowed to apply in the future if I don't get in? 

Thanks",1615941103,1,0
"Didn’t get into UCSB, should I not expect anything from UCLA?","Don’t really know what to expect at all, hoping at least a few people who’ve been accepted into UCLA have found themselves in similar situations",1615940726,1,0
intellectual despair,pain. i’m in pain. finals week makes my anxiety go 📈📈📈📈📈,1615940006,1,0
MGMT 1B with Prof. Elizabeth Woo?,Has anyone taken 1B with Woo in general or online? I've heard it's a hard class just want to know what I'm getting myself into.,1615937799,1,0
Do you or someone you know fear social situations or have sudden anxiety? (UCLA Treatment Study),"The Anxiety and Depression Research Center at UCLA invites you to participate in an ongoing psychological treatment study. The Optimizing Exposure Therapy (OptEx) Study is designed to examine the effectiveness of two different types of therapy for individuals with panic disorder or social anxiety disorder. Both treatments involve repeatedly confronting feared sensations and situations, known as exposure therapy. One treatment focuses on methods to enhance the learning that occurs during exposure therapy, while the other emphasizes reducing fear during exposure therapy. Each of these therapies includes components and therapeutic strategies that have been demonstrated to be effective. 

Payment and Fees 

Participants will be offered 9 weeks of free treatment and a $25 E-Gift Card at the end of the study! 

Treatment Procedures

Treatment is conducted one on one, over 9 weekly sessions via Zoom. 

Remote assessments are conducted prior to beginning treatment, mid-treatment, at the completion of treatment, and 3 months later. These assessments include diagnostic evaluations and a battery of self-report questionnaires. 

Screening Procedures If you are interested, please follow the link below to learn more information about the study and to determine your current eligibility: [https://uclapsych.qualtrics.com/jfe/form/SV\_bDgQvtz5hx6NzbT](https://uclapsych.qualtrics.com/jfe/form/SV_bDgQvtz5hx6NzbT) 

We will contact you regarding your eligibility within the next few business days after you submit the form. 

Note you must be between the ages of 18-65 in order to be eligible to participate. 

Study Personnel Contact 

For further information about this project, contact: Wendy Huerta [optex.study@gmail.com](mailto:optex.study@gmail.com) 

Protocol ID: IRB#15-000156 UCLA IRB Approved Approval Date: 6/12/2019 Through: 6/10/2021 Committee: Medical IRB 3",1615937450,1,0
Question,Anyone waitlisted at UCSB get into UCLA ?,1615937224,1,0
should i transfer UC to UC? or go from UC to CSU?, Ive already been to community college and only choose UCLA cause it was close to home. I wish I could have done my research before coming here. Nice school cool people and professors just not for me for the type of job I want to do in life. Im thinking of droping out and going to community college and going to UCSB or cal state poly or long beach.,1615936127,1,0
Mcdb 60,Please pm me if you’re in this class,1615935357,1,0
"""Safe spaces"" on campus?","I have been asked to talk to French students about issues relating to free speech at American universities, using UCLA as an example. I was specifically asked about safe spaces, but it's been a while since I was a student, and so far I haven't found much from googling. I'd appreciate any information more recent students might be able to provide about designated safe spaces available to students in recent years!",1615933745,1,0
"I think I reported my grades wrong on the UC application. If I get accepted, are these grounds for getting rescinded?","My school gives us semester 1 and 2 grades and also a final year grade. I assumed that if your school provides a final year grade this is what should be reported since it is the ultimate grade you earned. So, I only reported my final year grade, despite my transcript having S1 and S2 as well. I emailed admissions a couple weeks ago and they didn't ask for my S1 and S2 grades... but I keep reading that I could get rescinded because of this. Will it help that I contacted admissions before decisions were released? I did everything I could to fix it, but they didn't ask for the grades. Help!",1615933488,1,0
Shout out to the trumpet guy on Landfair/Gayley,You played the fight song and had people clapping the song when I was having a depression nap in bed and it lifted my spirits.,1615932894,1,0
Who is SnooRoar,Does anyone have any clue who this dude u/SnooRoar is? He should not be attending this college. Dude is not okay in the head and I fear he may harm someone in this school.,1615932864,1,0
what do i do...,"my grandfather passed away last thursday right before finals and i tried to power through the work. i don't know what i should do for one of my classes. i literally had zero time to study for the final due to grieving and being there with my family, what is the best course of action. he was someone that i grew up with and maintained contact when he moved out of the country on facetime and he just left so unexpectedly. i have had family and friends coming over for the past week and his funeral arrangements are still up in the air as i may end up leaving the country during the pandemic and i just don't know how that is going to be either. i have a final tomorrow but i feel as if asking for an  incomplete is a bit ill timed because i should have contacted him much earlier. should i at least contact him and let professor know whats happening. how would i even structure something like this. i just am stressed out because i have so much on my plate right now and this class is my lowest grade and i fear i may not pass the class. i think i am able to deal with my other classes because i had studied ahead and far more before this happened, but this class in particular i was banking on studying for the last week and now it is essentially past and gone with no progress.",1615932101,1,0
Misery loves company,,1615931043,1,0
Will Chem 14A be good enough prep to take upper division Engineering classes?,"I'm switching into Engineering and just found out that I can take 14A and B instead of 20A and B and petitition for them to count as prep courses. Chem 20A and 20B are only offered certain times, so it would push my switch to Winter quarter of next year. I just want to know if I would be able to handle BioE upper divs with Chem 14 series knowledge. I plan to take the 30 series after 14B though.",1615929818,1,0
Filing on campus,Anyone know what movie is filming on campus right now? I saw some WB and FOX logos as I walked by this morning but that doesn't really tell you much lol.,1615928158,1,0
Econ Grading,"Taking Econ 5 as a GE right now and am confused on what is usually the cut off for an A, A- etc. it’s not the syllabus so are A’s usually on a curve or is it like 93+?",1615928151,1,0
Econ Department Curve,"Are all professors in the Econ department obligated to stick by a set curve (30% A’s, 30% B’s, etc.)? I’m curious, since it seems like for some professors like Rojas for Econ 41, he tends to stick by this curve every time he teaches the class, but then there are some classes like Goncalves for Econ 11 whose Bruinwalk grade distribution shows 60% A’s. 

I’m taking Econ 11 with Goncalves next quarter and am hoping his grading distribution will not suddenly adjust to a set curve",1615926620,1,0
Wait List for Econ Courses,"How likely is it to get into a class if on wait list?

Do UCLA professors offer Add Codes to students who show up the first day? 

Do they strictly go off the total # of students on the roster? (i.e. if 'full' means 40 students, they won't accept more no matter what)",1615926583,1,0
Anyone taken COMM 1 with Hurwitz?,[removed],1615926253,1,0
is the bruinlife yearbook worth it?,"apparently it's like 200 dollars which is a fat stack of money

but then again, it'd be nice to look at people's senior grad portraits and other campus life photos if i'm eventually leaving california/socal.",1615925411,1,0
question about cal grant,didn’t do too well this quarter and was wondering if my cal grant would get taken away? i’ll most likely have a gpa higher than a 2.0 so would they just give me cal grant b instead ? don’t know how any of this works tbh. :/,1615924966,1,0
Can math profs PLEASE stop making exams that actually take a painful 24 hours to complete?,(kinda hurts in a good way tho ngl),1615923103,1,0
What's campus like right now?,I know it's opening up a bit and all - what's currently open? What facilities can students use?,1615921609,1,0
CS32 spring enrollment info,"Has anyone who submitted the CS32 interest form received an email with an update about enrolling? If so, what info did they provide? Thanks!",1615921397,1,0
Can we bring back polls for God's sake,,1615919933,1,0
CCLE super slow to load,Is this happening for anyone else right now? I can barely load anything 😞,1615915474,1,0
Voluntary UCSHIP?,Does anyone know how to enroll in voluntary UCSHIP for spring? I’m graduating this quarter. Trying to do it online but confused what options to select.,1615914468,1,0
is CCLE down?,Idk if it’s just me. I really need to study for my final in 2 hours :(,1615913001,1,0
Lost love.,"Just a sad rant. I recently chatted a guy from r/bruindating but I don't think he's active on reddit anymore considering that there was very little post/comment history to begin with and all of it was from 3 months ago. Maybe he wasn't expecting to get any bites on his post but I bit 3 months late and I think I lost him because of that. I don't even know if he goes here. I think he goes to UCB based on his post history. Anyways, he sounds so awesome and I'd love to meet him but I don't think it'll happen because he'll never see my chat.

Guess I'll go study for finals instead.",1615912539,1,0
I will pay for your Econ 41 notes,"I’m planning on taking Econ 41 Summer Session C, and seeing as it’s a miserably hard class want to have material to familiarize myself with the content. I’ll pay someone who’s taken the class online or in person for their notes (and preferably a textbook) pm me if interested.",1615911011,1,0
Second eFAN for OOS?,"Any oos students receive a SECOND financial aid offer after accepting the one with the new grant that was released a few days ago, that looks exactly the same as the first one? And does anyone know what it is?",1615909278,1,0
Subleasing over the summer,"Hey all, student from Canada here. I'll be moving down to the U.S for an internship this summer and am looking for a place to sublease. I've been trying to get something for a while now and I'm getting stressed out because I can't seem to get anything. I joined the Facebook group but no luck so far, do you guys know when peak subletting time is? Also, is ULoop/Bungalow reliable? I'd appreciate any help!",1615906162,1,0
Any tips to study for the Physics 1A Final with Kusenko?,I really need this to go well since I'm doing booty in Math. Any tips for studying?,1615882889,1,0
Is everyone struggling with finals right now behind on work or just have a heavy workload?,I am a self-admitted procrastinator who never fails to start falling behind around week 4. I tell myself every quarter I’ll stay on track but then never do. What is your reason behind hating finals week right now? I’m always surprised to find a lot of students in my group me chats waiting until the last minute to finish too and I feel less bad about myself.,1615881914,1,0
physics 5c,"Is there anything specific we need for physics 5c? the labs specifically? 

I am hoping someone drops out the first two weeks so I don't have the syllabus, but I am out of the country and if I need to order something it takes time to arrive.",1615880740,1,0
How would you guys recommend students asking professors to participate in their research? Is it easy to get into a lab as a freshman?,,1615880577,1,0
Any Mathematics majors NOT qualify for AIME during high school?,Damn.,1615880190,1,0
RIPS VS REU program,"For those who have applied or participated in either of these two applied math programs, would you mind sharing your experience a little bit? Got accepted to both programs but being very indecisive rn cuz I know both of them will be really great experience. Would appreciate any recommendations/suggestions. Thanks in advance.",1615878569,1,0
Nearly 500 signatures strong! There's still a long way to go but USAC and UCLA admin thought we would never even get 50 signatures! Link in comments,,1615878388,1,0
Anyone here work as a Fedex Express courier?,I saw a post here about it and just wanted to know your experience and how manageable/rewarding it is.,1615877630,1,0
PIC10B Discussion mandatory?? Cai,"Hello , I'm taking 10b with cai and was curious if discussion was mandatory?? I have a time conflict pero I need this classsss",1615876546,1,0
The UCLA Peace Guy!!! (start at 5:17) Any of you remember him from like 8 years ago?,,1615874942,1,0
Are ucla butts too stinky?!?!,"After seeing all of the USAC applications being put on this subreddit, it has become apparent that this organization has lost all connections to the general student body and our real concerns. This is why I have begun my official 21-22 bid for a position on the council; preferably at the helm. I will run on one single issue: installing a bidet on every other toilet on campus. In order to fund this project without raising tuitions, I will be personally cleaning butts for 1-3$ depending on the individual’s PPI. This will be a source of funding as well as a good alternative until the fleet of bidets can be installed. I think we can all agree agree that this is an issue of immediate importance. So come on, join me in keeping ucla the number one public university and not the NUMBER TWO public university",1615874908,1,0
:(,it’s my birthday and i have to take 2 finals but i have no motivation and this quarter has been an absolute train wreck for me,1615872423,1,0
Is UCLA a party school?,,1615871393,1,0
University apartment Housing,How hard is it to get housing in the university apartments? And do upperclassmen get priority? Asking because I will be an incoming sophomore and don’t know if I should start looking for private apartments now or if I have a good chance of getting one next year.,1613872967,3,0
Math170E professior Nguyen and Needell which one is better,,1613872878,3,0
Looking to switch from Physics 5B to 5C,"I am currently enrolled in Mehta's Physics 5B lecture (Lec 2, Dis 2A, Lab G11) but I really need Physics 5C. I am okay with any professor so if anyone is interested in switching please let me know!",1613871279,1,0
doggos,Hi hello what’s up I need pictures of Bruin doggos to keep me motivated to study for my chem midterm please and thank you,1613871100,2,0
Does GradeScope track IP Address?,,1613865929,1,0
Environmental Science Publishing?,Hey y'all. Anyone know if theres anything at UCLA that publishes environmental science related research? Ive got a data science project im sitting on about the all the horrible shit fracking does to human health with some interesting results and if theres somewhere I could send it I'd love to put out the findings.,1613865092,1,0
why do we have to pay for coursicle every quarter,"it's lowkey bs that we have to pay $5 a quarter to track a class. and the ""referral"" thing is bs bc ive literally already referred every person i know. can someone make an app for free we r legit college students who are getting finessed #makecoursiclefree",1613863376,0,0
Best apartments in Westwood?,"Looking for apartments for next year, just curious about people's experiences with Westwood apartments this year.

For reference, I have 4 people in my group looking for 2bed/2bath",1613862103,2,0
How does waitlist work?,"If there are 5 waitlist spots for each 5 sections, does it mean I am more likely to get into the class if I take spot 2/5 in section 1 than take 4/5 spot in section 2? Or do they enroll first come first serve regardless of which section?",1613859254,1,0
"What can I do with this: communications and some bio science major, entrepreneurship and public health minor","Trying to figure out some combo of things I wanna get into at ucla as a PREMED, wondering if the combo of those things I listed give me a good outlook in terms of future entrepreneurship healthcare management side job/ECs after I become a doctor... as in while I’m a doctor I can also be involved in healthcare management... would I need a MBA and MPH or are my undergrad education and experiences enough... idk plz help lol",1613858607,1,0
Places to go on a date that are open right now,"I'm thinking of asking one of my friends out for dinner, I was wondering if there are any good date places open in westwood right now. Both of us are underage (we're tiny freshmen) so drinking is out. We live next to Trader Joe's, so something within a 15 minute walk from there is ideal. Thank you!",1613857628,2,0
Free Virtual Barre Class With Master Barre Instructor,"Hi everyone! There is a virtual barre class coming up in April! It’s hosted by ultra endurance athlete Katie Spotz and master barre instructor Emily Sferra. 

They are hoping to raise $1,670 for a clean water initiative at a children’s school in Honduras. A donation big or small will help provide clean water for a child in Honduras. Donations are encouraged but not required for this event. 

If you’re interested here is the link: [RSVP ](https://www.eventbrite.com/e/raising-the-barre-for-clean-water-tickets-106118553450)

*** Can’t make the event but want to donate? Here’s the link: [Donation Link](https://www.h2oforlifeschools.org/projects/874)",1613856484,1,0
Riding a bike,"Hi ya, does anyone have experience riding a bike to school ? I’m getting an apartment 3 miles away. If so, would you recommend it &amp; what’s the locker situation like ? Thanks !",1613853467,2,0
PLF (Peer Learning Facilitator) Job,"Can anyone that’s been a PLF vouch for their experience? I am interested in applying. What do you do, how is it, what’s the pay like, etc?",1613853257,1,0
Should I drop Cog Sci minor and take up a History minor instead?,"Okay so I’m a transfer DESMA major and I’m currently trying to double minor in both Cog Sci and Digital Humanities. I’m currently taking Psych 85 to fulfill the Cog Sci minor requirement before I can declare it but I just recently took the midterm for Psych 85 last week and I feel that I did really bad. I haven’t gotten my grade back yet so I’m not 100% I did horrible but I’m already considering taking it P/NP to save my GPA if I do end up doing bad. So my question is, if I end up doing alright and passing the class, should I even continue pursuing the Cog Sci minor? I do find the material very interesting and the reason why I chose this minor is because I’m interested in potentially pursuing UI/UX design. However, I don’t exactly need the minor and I’m unsure if I want to ruin my GPA over it. I’m confident I can keep my grades up for my major but Cog Sci is completely different and is for the most part unrelated to it. Plus I’m low-key kind of anal about not getting straight A’s. 

I talked to my best friend about this issue as well and he said that if I’m interested in the material than I should stick with it. Basically he said C’s get degrees and that I should get used to not getting A’s in University all the time. A part of me thinks he’s right and that I should just settle for not getting straights A’s all the time but also apart of me wants to graduate with a high GPA and with Latin honors. I also want to pursue Grad school as well so I’m conflicted on what I should do. Should I chicken out and drop it and pursue an easier minor like history? (I’m a good writer and I love history as well so I believe I would excel in this minor). I don’t know what to do. Any advice is welcome, including some tough love.

Also if I do stick with the Cog Sci minor and end up declaring it, how do I get into the upper division classes? Most of the classes I’ve seen require pre-requisites but my major is completely unrelated so I won’t be taking those pre-requisites.",1613851611,1,0
Research In statistics/data science,Helpppp. Where do I start. How do I approach this. Do I email PI’s or grad students? Thanks friends,1613850451,1,0
Physics 5B,"I got below 20% on my physics 5B midterm because I completely freaked out and blanked. do I have any hopes of passing this class. 
Feeling like a failure",1613850116,1,0
"Ah shit, here we go again.",,1613848611,1,0
Last Minute Research?,Hi! I'm a graduating senior in spring and wanted to know if there was a way to see what social science professors are currently doing research? I'm a transfer and really sad that my individual research project didn't worked out but if I can't do my own project I'd like to at least be a research assistant for the experience. I really don't want to graduate without being apart of research at UCLA but why are social science professors so hard to get a response from :(,1613847928,1,0
Can you become a software engineer w/o majoring in COMP SCI?,I’m interested in getting into coding but I don’t want to do the actual comp sci major as I’m already 2 years into my economics degree. Are there any programs that teach you how to code? I have zero experience so far but I’d want to start by actually coding rather than starting in a bunch of Science/Math Pre Reqs.,1613847287,1,0
What are my chances of getting into UCLA as a transfer student from a CC?,"I originally applied to UCLA as a freshman out of high school and was rejected, but being my dream school, I am trying again from a community college. My GPA from my college coursework is 3.78, I have finished a lot of coursework for my intended major of Psychology, and have passed 7 out of 9 AP tests from my high school education. I am also in Alpha Gamma Sigma at my community college which is for academic honors and have an internship at a physiology department, and plenty of employment experience throughout college and high school (averaging 30 hrs a week from freshman year to present), but based on the statistics of getting into UCLA and the increase in the number of applicants this year (from 26,000 transfer applicants to 29,000 transfer applicants and 139,000 freshmen applicants) I am constantly stressing as to whether this is even enough, as I never participated in any organized EC's, I mainly just discussed my passion for skateboarding in one of my prompt essays. A few questions I had were; will be requesting financial aid deter my ability to be accepted versus someone who can pay upfront, and also will a YMCA internship from freshman year of high school still count as applicable for my application, or is that too far in the past to account for anything? If any feedback could be suggested it would be greatly appreciated.",1613846844,1,0
LS7C 2nd midterm,i read on here that the second midterm is way harder than the first 😦 apparently we get tested on something called a bohr shift? that’s literally never been mentioned during lecture or launchpad so i’m hella scared now. if anyone who’s taken LS7C can tell me about their experience taking the second midterm i’d really appreciate it,1613843423,1,0
math 31b resources,"hey all so i got a midterm for math 31b on monday and honestly i haven’t watched any of the lectures since week 2 and im freaking out!!!!! ;( 
i know i screwed myself over but does anyone know any good resources (youtube etc) where i can learn the material quickly bc the professor doesn’t even teach in the lectures. thank you! 🙏",1613842356,1,0
English 4W,Has anyone taken this class online? How is it? Is it also 2 hours or do most professors not take that much time? Thank you :),1613841947,1,0
Where can I sell my old UCLA textbooks?,"I've already tried selling at the UCLA bookstore, but it tells me I am not able to. Is there a website or some facebook page?",1613840770,1,0
What is it like being an LA for the LS 30A/B series?,"Hi guys, I applied to be an LA for the LS 30 series among other courses and I was wondering what the interview with Dr Shevtsov and just being an LA for these classes is like. Do the profs require a lot of programming knowledge in order to be an LA? I performed really well when I took the classes even though I'm not great (read: bad) at coding but I feel like I can help other students who are struggling with labs. BUT, Idk how well I'd do at looking at other people's code if they write it in a way different than I would.

One other course I also applied for is Chem 14BL, any input on being an LA for that is appreciated as well!",1613840279,1,0
