title,selftext,created_utc,score,total_awards_received
Freshman Connection to UCLA,"yo freshman here. ive been feeling realllly down lately. i look at this subreddit. I look at the UCLA barstool. I see the memes about north campus south campus. I dive down countless youtube recs of “ucla dorm tours.” I watch people hyper-invested in UCLA bball or fball. and i just feel absolutely no connection to this school. I’ve grown up in LA. Going to school in the valley, UCLA is constantly revered as the ultimate goal and when i got in last year I felt like i had won the lottery. But 10 months later i have yet to even step foot on campus. I try to manufacture some kind of connection btwn myself and this university but the classes i’m taking just feel like more of HS senior year zoom. I’m just wondering if any other freshman feel the same way. this shit has been so rough for so long and I feel like all of these pivotal moments in my life (hs graduation, prom, freshman yr of college, etc.) keep passing me by and all i can do is watch. just tryna see if i’m alone in this or if it’s a feeling shared by other freshman. 
if you’re reading this and I sound like a whiney baby ur prbly right but I’m j looking for support 

tldr: any fellow freshman feel a lack of connection to this school due to covid?",1611659485,1,0
What happens when you get caught talking badly about TA?,worried for a Bruin,1611658352,1,0
taking a class i dropped last quarter b/c scheduling issues. comparison of how my last TA graded vs how my current TA grades (this is the same exact question for the same assignment). how is this allowed bro,,1611658227,1,0
I can’t wait to anonymously expose people on GroupMe because it’s trending,I’ll make sure to censor your name and pictures though ;),1611655861,1,0
Chem 14B with Lavelle,"I forgot to purchase eText, and recently purchased it today, but the order said it will take a couple days to process, so I haven’t received the access code. Does anyone have the eText downloaded as a pdf and could send it to me? Also does anyone have the GroupMe?",1611655405,1,0
Nia Dennis. VID,,1611653993,1,0
People should continue posting groupme screenshots,"It’s not fair to anyone outside the groupme who cannot see it, neither does it do anyone anyone any bad. If you really care about your fellow Bruins, you should be “exposing” others for other peoples’ enjoyment.

It's the cool thing to do. Also, our mental health is already deteriorating because of this pandemic, you don’t know what people are going through right now. Maybe the person who won't get to see the “exposure” is close to killing themselves. Imagine if what you did was a cause of their death and suffering by not sharing the screenshot.",1611652213,1,0
People should stop posting groupme screenshots,"It’s not fair to anyone in the groupme who does not know about it neither does it do anyone any good. If you really care about your fellow Bruins, you shouldn’t be “exposing” them for other peoples’ enjoyment. 

Not cool. Also, our mental health is already deteriorating because of this pandemic, you don’t know what people are going through right now. Maybe the person you “exposed” is close to killing themselves. Imagine if what you did was a cause of their death and suffering.",1611650163,1,0
why stroke team/force gotta send their rejections right as i start my ochem midterm man,how do you even get in at this point is it just a lottery,1611649270,1,0
My dumb ass after losing like 20% of a quiz because I forgot electrons have negative charge,,1611647517,1,0
"Advisory to Female Bruins: Foot Fetishist on Campus Asking Students to Record Feet, Disingenuous","Hey all,

&amp;#x200B;

I wanted to post a friendly advisory here about a foot fetishist who has been frequenting campus and asking women to film their feet. 

&amp;#x200B;

His channel on YouTube is ""Scouting Sessions,"" and features him championing the benefits of ""dialectal behavioral therapy"" and ""exposure therapy"" to unsuspecting students—before asking them to film their feet. He frames the interaction as a mental health exercise he has personally used to overcome unfounded anxiety in his own life. He then pressures his ""interview"" participants to allow his playing with and smelling of their feet, countering students' objections with a formulaic line 

""Is this posing a threat to your life or health? Well, then you should embrace the experience. Sometimes we hold irrational fear towards new experiences, but you might find that beyond your fear is a great time waiting for you, if you let go of your inhibitions."" He has already made dozens of videos on campus (in a couple-month time span), and seems intent on making more.

&amp;#x200B;

I just want to make a few points with this post:

&amp;#x200B;

1) This person, ""Scouting Sessions"" is well within his rights to film on campus. I do not intend to shame foot fetishists with this post, nor do I mean to suggest that he should not continue doing what he has been doing. I wish more power to him if he introduces more transparency to his interactions. 

&amp;#x200B;

However, for an interaction to be just, both parties must be informed about the nature of their interaction. In this case, about the nature of their **transaction**. He sells the process primarily as a mental health exercise, and this is **patently untrue.** This is fetish content, plain and simple. If you peruse the comment sections of his videos, they are populated entirely by foot fetishists, who make plenty of comments about the feet of the students featured, but who couldn't care less about the ""therapy"" aspects of his videos, unless they are trying to adopt his methods wholesale in their own quest for fetish models. 

&amp;#x200B;

So his framing of the interaction is deeply disingenuous. He pretends as if both him and the participant are growing as individuals in lowering their mental defenses and trying this new thing. **But the student is the only one that is letting their guard down.** **He is following a script, a formula, that he has rinsed and repeated hundreds of times, and the sole aim of his formula is to produce fetish content with students' feet.** 

&amp;#x200B;

2) Should you encounter him on campus, you should feel free to say **NO** to his requests. I am not a psychologist, and I am sure that dialectal behavioral therapy is a great therapeutic tool. But the logic of that system can be abused by individuals using it for personal gain. Keith Raniere and the NXIVM cult used CBT and other legitimate therapeutic tools to program their victims for the leader's gain.

&amp;#x200B;

3) If you are a woman Bruin on campus **(he is not interested in opening the mind using exposure therapy with male bruins for some reason)** you too are well within your rights to grant him an interview. I should not need to say this. No one should be shamed for participating in the interview, because there is nothing wrong with making informed and consensual fetish content. For this reason, I was hesitant to even make this post. But I truly believe that the majority of students he stops on campus are being misled, and deserve this notice before they are uploaded to a fetishist YouTube channel. Please consider letting friends who are on campus know.",1611646512,1,0
any roommate horror stories?,"kinda worried for next year, I always either see that roommates end up being best friends or like they're literally the most incompatible people ever lol. But just curious to hear some of the worse cases",1611646169,1,0
Pre Health One Year of English requirement,"Hey guys! 

&amp;#x200B;

I currently have satisfied the Writing 1 requirement through AP credit, and completed the writing 2 requirements with Eng 4W. I'm on a pre-health track and most schools require one year of English. Would the writing 1 placement exam count towards anything? Also can anyone recommend some upper div english classes that will fulfill this requirement? 

I cant see classes anymore on my DARS since I completed the college requirement. 

Thanks!",1611643792,1,0
Is there a way to audit a different degree?,I'm trying to see the differences between CE and EE,1611643363,1,0
Chem 14D Midterm,How did y’all feel about it?,1611642440,1,0
I almost had it...,"Ok so I have a 3.7 GPA with an intent to major in Economics at UCLA. I go to CC and I'm in my school's Honors program. I've done all the honors classes and I have gotten 1 B, 1 C, and 10 A's. Aced all Honors classes. The B I deserved but the C was a fluke that may be my most impressive L I have ever taken in my life (I slept in for a test worth 20% of my grade, and it wasn't the final, cuz my phone ran out of battery in the middle of the night and I had somehow unplugged it in my sleep so my alarm never went off. I had a 95% excluding that one test. It was a math class, Calc 2. Would have had a 3.95 if an A in the calc class.) I did a research project, joined my student government, am the Inter-club council rep for a club, and am an officer for my honors program research organization. Every position I had stated I have had for one year. I don't want that one C to taint everything that I had worked hard for but deep down I am certain I will get rejected because of the competition. Please be honest, I just need to get over this more than anything. Thank you.",1611641461,1,0
Gimme some thoughts on this potential schedule,"Math 3C
Physics 5C
Chem 153A
Possible Major Elective (Psychbio Elective)

The first two are the last classes I need to declare my major (deadline by end of summer), but I also need to take 153A for the MCAT. I’m also thinking about an elective for Psychbio, potentially 120A or 120B",1611641156,1,0
Degenerates and Gamblers Anonymous,"If you feel the need to lose money, have a crippling gambling addiction or just want to talk to people, join my discord.

[https://discord.gg/uVTG97gkwd](https://discord.gg/uVTG97gkwd)",1611641006,1,0
HOW TO STOP GLITCHES ON ZOOM (NOT CLICKBAIT I PROMISE :) ),"hi ZUCLAers! 

If the rest of your internet works but Zoom glitches, the ports that Zoom uses might be blocked on your individual modems/routers. After spending 1-2 hours trying to pursue a wannabe career in IT, here is a list of steps so you don't have to do the same: 

1) find your IP address. a good guide on how to do that for devices: [https://www.purevpn.com/what-is-my-ip/router-ip](https://www.purevpn.com/what-is-my-ip/router-ip)

2) you'll need to forward ports -- basically unblocking the firewall so Zoom can connect efficiently to your WiFi network.  this is a good general guideline I read:  [https://www.noip.com/support/knowledgebase/general-port-forwarding-guide/](https://www.noip.com/support/knowledgebase/general-port-forwarding-guide/)

3)  find your modem's maker. then go to their specific website for guidance! 

4) here are the ports you'll need to unblock: [https://support.zoom.us/hc/en-us/articles/202342006-Network-Firewall-Settings-for-Meeting-Connector](https://support.zoom.us/hc/en-us/articles/202342006-Network-Firewall-Settings-for-Meeting-Connector)

a fancier article: [https://support.zoom.us/hc/en-us/articles/201362683](https://support.zoom.us/hc/en-us/articles/201362683)

TIP: utilize the chat help desk! 

hope this saves 30 min-2 hours of your time! stay strong bruins :)",1611637830,1,0
I miss diddy riese brownies 😭😭😭😭😭😭,😢,1611636108,1,0
Celebs,I want to know everyone celebrity encounter living in LA??,1611636059,1,0
Ucla students per state,Being someone who doesn’t live remotely close to California but wants to go to UCLA i’ve always wondered how many students come from each state. I’ve look everywhere and the only thing i could find was a percentage chart but wasn’t specific on how many students and what states they are from. If anyone knows of a study or chart could you please comment a link to it. Thank you.,1611636044,1,0
Thoughts On My Spring Classes,"I’m planning to take these classes:

Chem 30A
Math 32B
Physics 1B
Physics 4AL

For those who have taken these classes, how was the workload for these classes in general? Which one should I prioritize for my first pass?",1611635796,1,0
Celeb appearance,I’m kinda new to LA what are the hot spots to celebs,1611635771,1,0
SPRING PLANNER,Does anyone know around when does myucla allow for seeing the classes offered in the spring? I don't like the future planner thing and just prefer the actual planner.,1611635650,1,0
Has anybody heard from the Financial Aid Office about student relief from the latest stimulus/covid-relief bill?,"The COVID-relief and stimulus bill signed into law on December 27, 2020 allocated another round of the Higher Education Emergency Relief Fund  (HEERF II). When CARES was passed in March, there were universal and need-based grants given out because of the first round of HEERF. 

The financial aid office website states only:
&gt; The UC and UCLA are still waiting on guidance on the Coronavirus Response and Relief Supplemental Appropriations Act (HEERF II) signed into law on December 27, 2020. We will post additional information on our home page as more information becomes available to us.

See [this post for some details about last time](https://www.reddit.com/r/ucla/comments/gcg4m5/cares_act_update/)... UCLA was super slow with disbursement last time too. It's now been almost a month since that law was passed and the Department of Education guidance for institutions is already out. 

According to [this PDF from the U.S. Department of Education](https://www2.ed.gov/about/offices/list/ope/314a1allocationtableheerfii.pdf) it looks like the latest round of HEERF resulted in $52.6 million being allocated to UCLA, with at least $17.9 million of that going towards student aid. (Page 7)

My question is: **has anybody contacted the financial aid office about when we will receive the student aid allocated from the latest COVID relief package?**",1611632743,1,0
i hate resonance structures,that is all,1611632694,1,0
To anyone who has taken Astro 3 with Treu before,"How were the exams? He said that it would all be multiple choice, so I was wondering if anyone took his class during COVID or before, and how they thought the multiple choice was. If anyone has any insight, it would be greatly appreciated!",1611631310,1,0
The CHEM14C midterm was actually fair,"Especially with the reputation organic chemistry has, my expectations were low. I still curse you Scerri for making us do over 25 problems in an hour and half in 14B 🧙🏼

THIS is how your teach chemistry and write a midterm. Reilly is the best.

Happy midterm season everyone 📚",1611631146,1,0
Easy philosophical linguistics analysis GE,Anyone know of an easy one to take?,1611631045,1,0
UCLA gymnast Nia Dennis celebrates 'Black Excellence' in near-perfect floor routine,,1611629233,1,0
"UCLA gymnast Nia Dennis celebrates ""Black Excellence"" in floor routine that went viral",,1611629200,1,0
"Gov. Newsom lifts stay-at-home order, LA County still in high-risk tier",,1611629004,1,0
Revisions to Westwood Village Specific Plan would ease business restrictions,,1611628973,1,0
Q-ANON PROJECT,Hi guys! I'm a UCLA student looking to interview Bruins who are learning to cope with and handle family members/friends who are Q-ANON supporters. I've seen a couple of posts about this on the UCLA Secrets Page so I thought it would be an interesting project to do. You would be **ANONYMOUS.** It'll be a short interview and we can stick with topics you are comfortable with! I know this is a vulnerable position to be in so I will work closely with you to make sure you are comfortable! Thank you!,1611627841,1,0
To those of you who had covid during an academic quarter,"Did you email all of your professors / ask for any accommodations? 

Were your professors helpful / accommodating? 

I’m panicking a bit as I just got diagnosed with covid and am definitely feeling the symptoms but this week is the start of my midterms and I have not been able to prepare much for them because I’ve been so fatigued. But I also understand that many professors have already gone above and beyond to accommodate for so many of the struggles were facing these days. 

Anything y’all recommend?",1611627570,1,0
How similar are the PEQs to the actual tests for ls7b?,"I can understand clickers and learning targets but I’m not sure why I struggle so much on these practice exam questions. I’m getting extremely
frustrated with these Launchpad PEQs and was wondering if anyone had any advice on how they studied for the PEQs and how similar they were to the actual midterms for 7b. Thank you!",1611625390,1,0
Taking summer quarter at UCLA vs community college,"I'm a transfer student that still has some GE's to finish, does anyone have experience finishing GE requirements at a CC or college different than UCLA? I'm thinking about it since it would definitely be cheaper and a little easier. Any advice?",1611624731,1,0
Why are stem classes typically 4 units &amp; a lot of humanities GE's are 5?,"I know not all stem classes are 4 units (like the LS series &amp; physics) but I just find it funny how most chem &amp; math classes are 4 units (so they're expected to take up 12 hours/week of your time), and a lot of humanities GE's I've taken are 5 units (so 15 hours/week). I suppose humanities classes tend to have a lot of reading which takes up time, so I understand that. But math &amp; chem can be HARD and can take a lot of time to fully understand the concepts, so my question is: like who decided the amount of units per class? &amp; who was like ""oh yeah chem &amp; math? not that bad"" cause sometimes it's BAD",1611624420,1,0
Survey on US health and COVID-19 response,,1611621720,1,0
Disgusted,"Was excited to move into university apartments because I wanted independence... now I can't walk through the kitchen without gagging. My roommates are nice but so nasty. Stove and microwave has food splatter, trash cans overflowing, fridge full of rotting produce and leftovers, week old dishes unwashed, crumbs on the sofa, stains on the tables, dirty paper towels left all over the common area. Somehow they are not bothered by this at all and it is all my thankless job to clean up mess that isn't mine. I feel like a housekeeper or a mother",1611621675,1,0
Survey on US health and COVID-19 response,[removed],1611621630,1,0
Survey on US health and COVID-19 response + chance to win $10 gift card,,1611621539,1,0
"TW: Mental Illness, SA // Are there any students who struggle with severe depression, anxiety, and PTSD that can offer any insight or advice?","I’ve had severe depression, anxiety, and PTSD since I was a kid, and it’s improved a lot since 2020 when I found spirituality and stoicism, but I’m struggling a lot with school. I practice gratitude and mindfulness in attempts to keep some peace in my life, but everything still seems so stressful all the time. I also have been going to therapy for a year. 

I used to experience constant graphic suicidal ideation in grades 9-11 during class, and it’s been occurring again since the start of the quarter :( I’m always crying, and I hate it. My brain is also extremely foggy and forgetful because of the depression. School has just made me so angry and sad for some reason, especially in my stem classes. 

Everyone I’ve met so far absolutely loves UCLA and isn’t struggling in their classes at all, they’re first years like me too. I feel so stupid, and I know I’m behind in my classes. 

I think this week has been especially rough since my aunt has just passed away two days ago. And in therapy last week, I realized that I was groomed and raped by one of my (ex)best friends and I’m learning how to recover from it, and midterms are this week. It isn’t the first time I’ve grieved the loss of a loved one, nor is it the first time I’ve had to recover from SA, but I know it will take me some to finally be “okay” again. I feel like it’s going to be impossible for me to get through school when I’m so weak LOL, but I was wondering if anyone else shares a similar experience.",1611620553,1,0
"When you get a 87 on a midterm, but the average is 90 ://",😢😢,1611620043,1,0
"CS32, Phys 1B, and Math 33B?","Thoughts on this? Will my grades suffer?

I have heard 33B is one of the easier lower div math classes but CS32 is a lot of work.

Would I be able to add 4AL?",1611618616,1,0
Losing motivation as a transfer student :(,"I’ll get over it but just need a good cry/a rant.
(and yeah I know other people have it worse than me)

I’ve been in my childhood home since I graduated high school and I’m starting to lose hope that we’ll even be going back in Fall. I feel like I’ve been limited
in my ability to grow as a person and have new experiences and make new friends. And I can’t relate to any of the posts about missing things on campus. I feel like a “fake” ucla student. Im tired of zoom. I wanna throw my laptop out a window. I was so excited to go to orientation and stay in the transfer dorms and eat in the dining halls and meet cool people and go to exciting lectures and work in the library and go to the games. Even if we do go back it probably won’t be the same. And I hate that it doesn’t even matter that I’ve sat in my room for nearly a year trying to be responsible because of all the people that aren’t. 

I was okay until I saw some guy who said he graduated in ‘82 that he’ll always remember those 4 years. I feel like I lost a good part of my life. 

This sucks :((",1611617775,1,0
Doing research for a department outside of your major department,"How common is it to be accepted into a research lab if your major isn’t within the research lab department? 

For reference, I want to work in a Psychology research lab but am a Bio major. I also haven’t taken Psych 10 and not really planning to either but I did take AP Psych in high school (didn’t take AP test though). Would this make me an undesirable candidate for a Psych lab?

Thanks!",1611616139,1,0
why do people think its okay to talk about TAs like this...,,1611615189,1,0
EPS 1 Material Swap,"Ho everyone! If anyone has any of their old EPS 1 material (taken with Coffey), I would love to see if I could have it! In return I can provide material from any of the Physics 5 Series Classes, Chem 153A, or I can try to find anything else of interest. Thank you!",1611614506,1,0
Is it possible to be a public affairs major on the pre-health path?,"Title^ If anyone is currently doing this I’d love to know your experience - I already spoke to a representative at Luskin who said it was possible and that there’s just a couple classes I have to catch up on, but if anyone has personal insight/experience I’d love to hear about it! Thank you!",1611613807,1,0
Liquid k2 on paper | k2 spray on paper | k2 spray for sale | liquid k2,,1611613527,1,0
UCLA Research,"Hi! I am interested in doing research with these professors and I am wondering if anyone knows any of them or heard of them and could speak to them being good mentors and their labs.

I listed them all below, thank you so much!

Carmen Bertoni – Neurology 

Fabrizio Billi – Orthopedic Surgery  

Catherine Clarke – Chemistry &amp; Biochemistry 

Robert T Clubb – Chemistry &amp; Biochemistry 

Yoram Cohen – Chemical &amp; Bimolecular Engineering 

S. Thomas Carmichael – Neuroscience 

Brent Fogel – Neurology 

Feng Guo – Biological Chemistry 

Miguel Garcia-Garibay – Chemistry &amp; Biochemistry 

David Krantz – Psychiatry &amp; Biobehavioral Sciences 

Chong Liu – Chemistry &amp; Biochemistry 

Karen Lyons – Molecular, Cell, &amp; Developmental Biology 

Nigel Maidment – Psychiatry &amp; Biobehavioral Science 

Matteo Pellegrini – Molecular, Cell, &amp; Developmental Biology 

Margot Quinlan – Chemistry &amp; Biochemistry 

Karen Reue – Human Genetics 

Jose Rodriguez – Chemistry &amp; Biochemistry 

Jacob Schmidt – Bioengineering 

Ellen Sletten – Chemistry &amp; Biochemistry 

Alex Spokoyny – Chemistry &amp; Biochemistry 

James Tidball – Integrative Biology &amp; Physiology 

Yibin Wang – Anesthesiology, Physiology &amp; Medicine 

Paul S. Weiss – Chemistry &amp; Biochemistry 

James Wohlschlegel – Biological Chemistry 

Gerard Wong – Bioengineering",1611612007,1,0
If you are taking Math 33a this quarter……,"Free Midterm 1 Review Session tonight… Join us on Discord to get more free study materials: [https://discord.gg/4J84UnWxQS](https://discord.gg/4J84UnWxQS)

*Processing img k69tkxhhtjd61...*",1611611107,1,0
Best Writing 2 class for Summer Session A?,"I’d rather just take it over the summer, so would like some recommendations on what to take, preferably something easy. Right now, I’m thinking either AS AM 50W, Disability Studies 101W, or Food Studies 133W. I can’t take SCAND 50W because I already took SCAND 50 lol thanks in advance!!",1611610459,1,0
when is the final spring schedule of classes released?,also how do i find this info for the future 😣,1611609793,1,0
This is why covid won't go away,,1611608946,1,0
tips for studying 14D,Idk why but I just think it always takes more time for me to process the reaction and come up with the reactant and product.... what are some tips for studying ochem I really wanna do well in this class. Do u think doing more practice problems help?,1611606673,1,0
Question about enrolling for Summer Session,"would i be able to enroll in a class (specifically ls 7B) for summer session if i haven’t taken ls 7A yet? I’m planning on taking 7a in the spring, but i was wondering if enrolling for 7b for the summer would be an issue since i technically don’t have the pre reqs completed yet.",1611606544,1,0
