title,selftext,created_utc,score,total_awards_received
Downward Mental Spiral. Please judge or help me.,"TL;DR: College should be easier than my high school years but I am too lazy to do it and I feel terrible because of that. I want help.

Acknowledgement: I know lots of people here have been through actual hard time, so please feel free to judge me for how little my troubles are. But I am weak and want to be heard.

Context: I am so lazy right now that I cause trouble to my classmates and think about my sins in bed often.

In my high school years, I was lucky enough to be busy with AP, college class, Japanese supplementary school, and club. They helped me push myself despite my laziness, and learn something that I appreciate and have passion in education.

Then, in 2020, I became a freshman in my dream Uni, right in the middle of the pandemic. As an introvert, taking a great course from comfort of the home was the perfect formula. In addition, I don't need to worry about my AP or my supplementary school. 

The problem is, the senioritis stuck with me. My passion in education has been declining since I became high school senior, and it didn't recover. Today I rarely do my coursework and use up my energy thinking about why I didn't do it.

I feel guilty that I've failed everyone that guided me into college, yet I can't help but be even lazier. Even worse, I am actively looking for an excuse for my laziness, such as the pandemic, quarantine, depression, not seeing friends (although I'm an introvert), or the golden parachute of transferred credit. I am scared to admit that I am failing myself, scared to acknowledge the damage I caused, and scared to work hard and stop being lazy.

So I want to know, are these experience common among us? Did anyone overcome these troubles? Or am I just being a wannabe-depressed, attention-seeking crybaby? I appreciate any comment. Thank you.",1615947660,1,0
Why are there so many different files of slides per lecture in bio 1a,,1615947405,1,0
Geography Major,How is the geography department at Berkeley? Is it quite popular?,1615946623,1,0
Why is Crossroads Cafe door pressurized?,"Hard to open, wind goes vroom. what’s up w that",1615946568,1,0
Paid (online) research opportunity on college student sleep and substance use.,"Researchers at the University of Wyoming are seeking college student participants from around the country for an online study regarding sleep, substance use, and cognitive and academic performance. See [flyer](https://drive.google.com/file/d/1xuRCMALGWFWGsoR8qdx5vBJdXWF6PpsS/view?usp=sharing) for eligibility criteria, IRB approval, and more info. Questions may be directed to the email address listed on the [flyer](https://drive.google.com/file/d/1xuRCMALGWFWGsoR8qdx5vBJdXWF6PpsS/view?usp=sharing). To find out if you are eligible to participate, please complete the [prescreening survey on Qualtrics!](https://uwyopsych.co1.qualtrics.com/jfe/form/SV_77gL6tdsc1krSQZ)",1615945531,1,0
Shameless crosspost,,1615944213,1,0
Rochdale:,"I got a 4-bedroom apartment at Rochdale. First time in a coop. A few questions:

1. How clean is rochdale?
2. Is it quiet?
3. Are the facilities okay/is there someone to ask if something gets broken?
4. How is the kitchen? I love to cook :) 
5. Would you recommend it overall?

Would someone be willing to send me pictures of Rochdale if they have it?",1615939866,1,0
"I'm graduating Fall 2021, so does this mean I need to start looking for housing?","I saw the email from Christ this morning, and it seems like they really are moving forward with making mostly everyone return.

I haven't looked for anything, and I only need a lease from June-December or August-December. I imagine that complicates things as people want people who can stay for a year. The dorms are not an option for me, as they're too expensive. 

Does this mean I need to start hitting the pavement and messaging people for places to live? In Fall 2021, I'll be a senior economics major with one more upper division class to take and possibly other classes. 

I mostly want to stay for recruiting - I'm a junior with no internship lined up yet and so I'd want to stay one more semester for new grad opportunities and FT OCR stuff but sadly it's looking like it makes more sense to graduate over the summer :/",1615939166,1,0
Question ahh,Anyone waitlisted at UCSB get into Berkeley?,1615938868,1,0
How check class cs61b fall ?,How check class cs61b who teach semester fall 2021,1615937570,1,0
"If Berkeley is in-person for fall 2021, will you return to campus?","

[View Poll](https://www.reddit.com/poll/m6mii1)",1615937467,1,0
New haas admits: haas sent an email saying that we can pnp prereqs and upper div haas courses this semester right?,i cant find the email but i do remember reading it definitely.,1615937236,1,0
"Need a good grade in a class to declare. If I do worst that I expect, what can I do? I heard the professor doesn’t round anyone’s grade up..",,1615934027,1,0
Good luck to all my chem 1a buddies,Go bears 🐻,1615933681,1,0
Do you want Fall 2021 to be in-person with 200+ class size classes being remote or be fully remote?,"

[View Poll](https://www.reddit.com/poll/m6l7hd)",1615933676,1,0
Lease Length,"Looking at apartments, I see most places lease for 12 months. Do most students actually lease for this time and sublease or stay over the summer? Or are y’all finding academic year leases?",1615932661,1,0
Housing Offers??,when will they send out housing offers? I thought we would receive something early this week around the 15th? Has anyone got anything?,1615932325,1,0
CS 70 Summer reader/tutor application,"On the summer reader/tutor application, it says to ""please contact course instructor for further details"" to complete the application. Does this mean that I should go to the academic guide, filter out summer classes, and email the three instructors who are going to be teaching CS 70 this summer?",1615932010,1,0
Transferring from Stebbins to Kidd (Berkeley Co-Op),"Hello, I currently have a space in Stebbins for Fall 2021 and Spring 2022 but would like to swap with someone in Kidd. Please comment or dm me if you or someone you know someone who would like to transfer.

Also, does anyone know how likely it is to transfer into another co-op? Thank you!",1615931354,1,0
be me during midterms,"- have shit health due to cool funky genetics
- wait to finish my midterm project until last day
- fuck it’s deadline day
- experience sudden life threatening symptoms
- rush my ass to urgent care
- can’t finish midterm worth most my grade
- i am not getting into medical school
- my pain is now both physical and psychological 

help",1615930834,1,0
Roommate needed for 2 bed/apartment,"Sorry admin if this is considered advertising :(

My name is Mark and I’m a Junior studying Political Science. Given the recent news of a highly probable return to in-person instruction, I was hoping to coordinate with another person about securing a 2 bed/1+ or 2bd/2ba apartment in Berkeley (so we may each have our own single).

I am currently situated north of Sacramento and work part-time at a legal services company while I’m a student. I qualify for vaccination as I am technically an essential worker and intend on getting vaccinated within the next two months. I would like to move back to Berkeley and keep my individual portion of the rent at or below $1400/month including utilities (and WiFi).

I will be bringing my car down so I would prefer a location that offers on-site parking. I am a clean person and would prefer a housemate who is similarly raised and tends towards their own space. I’m happy to go more in detail if you’d like to coordinate or see if our personalities make a good match.

TLDR; Would like to have a housemate to share a 2 bedroom apartment for this upcoming year, max $1400/mo per person or $2800/mo total including utilities and WiFi. Reach out on Facebook (below).

Facebook: https://www.facebook.com/mark.mikityuk.3",1615930393,1,0
be me during midterms season,"&gt; have shit health bc genetics said fuck you
&gt; procrastinate midterm project
&gt; it’s okay i’ll finish it the last day it’s due
&gt; morning of deadline
&gt; have deadly symptoms
&gt; have to go to urgent care
&gt; can’t finish project worth most of my grade
&gt; it’s my fault for procrastinating but still
&gt; why
&gt; still in immense pain
&gt; pain is now both physical and psychological bc my grade is about to tank

gob ears",1615930361,1,0
NST 11 exam,Did anyone find the exam to have some errors? Some things that the prof put in the slides showed up as incorrect in the exam after I submitted it. For example: the slides says sugar is a major food preservative but the exam said it Is not a correct statement. Anyone else confused af,1615929165,1,0
I-House Residents 2021-222,"Anyone planning on staying at I-house for the next academic year? In these isolated times, I thought it may be cool to connect here!",1615929097,1,0
Is there a walmart/target near campus?,,1615927692,1,0
Fuck you spectrum,"Stop bugging the fuck out when I need to study or do my quizzes. 

Better not fuck up my chem midterm today.",1615927372,1,0
can I really not apply as a transfer to eecs bcoz of a 3 in ap lang from high school,"Basically, for L&amp;S I can still apply since they use IGETC but apparently, I needed to have the AP Credit of a 4 or my community college's intro English course for English 1A and EECS. I already finished the second English course for composition and critical thinking at my CC so am I basically fucked?",1615926242,1,0
If you guys ever feel stupid...,just read the comments on Youtube videos about vaccines. You'll feel a lot better about yourselves &lt;3,1615926107,1,0
Any highly recommended course of Cal? Any major!,"Hey! I'm an MBA student at Haas. The school allows us to take classes outside Haas for credits. I wanted to explore different kinds of great courses outside the domain of business (which I'm currently enrolled in) and software engineering (which I studied in the past). I'm looking for recommendations of classes that you feel amazed! Any major is fine. I know that Steve Jobs audited a calligraphy class in college and that experience turned out to be valuable when he designed Apple products. I have a similar incentive.

Thank you!",1615925925,1,0
Online Interview for Internship?,"I was notified that I’ve moved onto the interview stage for an internship. Does anyone have tips for how to do these? I won’t be interviewing with a person, it’s through hireview where I basically have to record responses. It also says I have 2 written responses and 2 multiple choice questions in addition to the five video questions. Very nervous! Any tips or experiences?",1615925854,1,0
"UC Merced to guarantee freshman admission to eligible local students, a first for the system",,1615924267,1,0
"I watched porn immediately after cs 170 exam finished, but forgot to turn off recording for an hour. What should I do ?",title.,1615921975,1,0
Minimum Units,I don't understand why the minimum amount of units for L&amp;S is 13 units when most classes are 4 units. Either I have to take a 1 unit class to get 13 or take 16 units? Or am I missing something?,1615919890,1,0
only 170 kids will understand,,1615919676,1,0
For anyone who’s taken Econ 100a: What was your experience? What grade did you get (if you don’t mind answering)?,"I’m trying to get at least an A- in this class since I need at least a B+ to be able to declare. Currently, I’ve gotten perfect scores on the reading responses but have performed poorly on both of the quizzes :( Do I still have a chance to get an A- (or at least a B+)? Thanks in advance for any responses!",1615918859,1,0
"Fall 2021: Classes with 200+ students will be remote &amp; discussion sections, labs, other classes will be offered in-person",,1615918307,1,0
Etang non responsive?,I have been contacting them since last Friday and they still haven’t gotten to me yet. It is about counseling/therapy. I’m kind of in an urgent needing it now.,1615918267,1,0
Exchange housing help,"I have been accepted into Berkeley for an exchange semester in fall 2021, and I'm currently looking through the housing options. 

I was wondering if any of you had any recommendations for what housing options are best. The exchange applicants are referred to this website for help in choosing: [https://extension.berkeley.edu/international/berkeley-life/housing/](https://extension.berkeley.edu/international/berkeley-life/housing/)

Go bears (I think?)",1615917692,1,0
Question about being below minimum units for L&amp;S,"I got an email warning me about being below 13 units in L&amp;S this semester (I late dropped two classes, leaving me at 9 units). It said that if I did this again I would have a hold placed on my account.

However, I was under the impression that late drops this semester didn’t count. Is what I did technically considered a late drop, or is late dropping unrelated to the number of units you’re taking? I ask because my future plans are contingent on taking another semester below the unit minimum.",1615916312,1,0
I'm sure these necklaces will make you look beautiful!,"To celebrate our 1.000th order our Necklaces are now free for the next 10 customers!

This gorgeous **zodiac necklace** is just what you need to feel like the true beautiful human you are, naturally giving and kind to others, it's time to give back to yourself with this stunning zodiac necklace

Available in either silver or gold, feel free to comment or dm me if you have any questions.

Here you can check them out: [zodilaces.com](https://zodilaces.com)

&amp;#x200B;

https://preview.redd.it/4plqx9nu9fn61.jpg?width=490&amp;format=pjpg&amp;auto=webp&amp;s=7c7b28c29ccf5c524bd42ee39d2e7408609f0212",1615914500,1,0
advice for freshman: kissing ass texting style,"For eecs/met/haas freshmen, this is how you text when asking people for help to step over others in your classes, getting the best partners for calhacks, and getting those faaang internships!

https://preview.redd.it/e9n7krqa9fn61.png?width=150&amp;format=png&amp;auto=webp&amp;s=f0210f6f8ba0d608a06c06d7fda1b62983242905",1615914440,1,0
CNR Late Drop?,Will doing a late drop affect the late drop limit I have?,1615913967,1,0
"HELP! I have misplaced my art, I live at 2428 ellsworth and left these in the gated area if my apartment, any information would be greatly appreciated",,1615913623,1,0
Should 1st world countries prevent the global south from vaccine technology?,This has been weighing heavily on me. It seems this will just stir up more xenophobia later on.,1615910980,1,0
Just watched Moxie on Netflix,Lol we’re in the movie go bears,1615902358,1,0
can I drop a decal class now?,I couldn't find the button to drop classes right now. Can I still drop?,1615893420,1,0
cares act check spring 2021???,"soOOO I heard that UC Berkeley had received more funding from the government. I also heard that other schools across the U.S (and California maybe????) have been giving students a refund check for spring 2021. BERKEKEY!!? where is ours???? does anyone know if we get one again???? what did carol christ do with our money???  Does anyone know?????

https://www2.ed.gov/about/offices/list/ope/314a1allocationtableheerfii.pdf",1615884757,1,0
61b midterm,I am nervous about the upcoming midterm. How should I study? Past exams look challenging,1615883293,1,0
Will all/most dorms still be singles next semester? I applied for doubles and triples but I heard these past couple semesters the dorms have been converted into singles,Thanks in advance :D,1615881067,1,0
Remember that thread on....,"COVID and tons of people were calling the UC systems dumb for canceling in-person for Fall 2020.

How does it feel now after 300,000+ people have died?

Still dumb?

https://reddit.com/r/berkeley/comments/gik829/csus_will_offer_fall_2020_classes_online_only/",1615880669,1,0
Public Health Major Question,I'm scared since I have to apply the end of this semester. I know the acceptance rate has gotten lower. Has anybody gotten rejected from this major and mind sharing why you think you got rejected? For those who got accepted what do you think got you in?,1615877050,1,0
Has anyone here taken the Mensa Norway?,Did you score high?,1615876801,1,0
"Tomorrow (Tues), the only sunny day this week! -- Smoke and walk through Berkeley, want some company","Hey all! I'm a researcher here who's recently single and looking to meet people, get out of my bubble some more with these new changes. Also, I love to smoke the weeds.

Anyone down to go for a walk and smoke around the city/campus? The joints will be my treat. I could just use some company.

PS- I posted this earlier on another subreddit (sfr4r) and met some really nice people, but then it rained all last week. Thought to repost here where I'd love to meet some people from the uni, esp if we can geek out.

Stay toasty!",1615876772,1,0
"Should I take CS169A next Fall and CS169L the following Spring, or just take CS169 next Spring?","For context, I will be a junior next Fall, and I want to spend a lot of time recruiting. I will also be taking CS61C next sem (RIP). This is why I'm considering taking CS169 next Spring. But what do people generally think about CS169 vs CS19A+L?",1615874615,1,0
"If next school year happens, the majority of undergrads will basically be freshmen... 😳",,1615873730,1,0
California Senate Bill SB82 Theft Is Not Robbery,"Origional Post from: r/bayarea u/KingoftheWeirdos

 I don't use reddit often, but I made an account just to post this here seeing how there's recently been a large spike of crime in the Bay Area and around the university. I know that safety and crime has always been a concern for me when attending Berkeley so I wanted to share this with everyone.

&amp;#x200B;

&gt;We need to quickly address the California Senate Bill SB82 Theft Is Not Robbery.  
&gt;  
&gt;California State Senator Nancy Skinner has introduced a bill to change existing law so that a “Strong Armed Robbery” committed without a deadly weapon, and without causing serious injury would no longer be charged as a felony.  
&gt;  
&gt;The text of the bill can be found here.  
&gt;  
&gt;[https://sd09.senate.ca.gov/2021-legislation](https://sd09.senate.ca.gov/2021-legislation)  
&gt;  
&gt;Under the proposed changes you or someone you know can be robbed through overwhelming physical force, by threats of violence to you or someone else, by the assailant using a non-deadly weapon like pepper spray or stun gun. You can be injured during the commission of this crime but if you do not have a “Serious Injury” you assailant would only be charged with a misdemeanor if they do not steal property worth more than $950.  
&gt;  
&gt;“Serious Injury” is not described in the text of the proposed law. It could be a black eye or a broken back. It would be up to the prosecuting DA, not you, to decide if you had a serious injury.  
&gt;  
&gt;Who would be the likely victims of this kind of Robbery? Anyone who would have a reduced capacity to defend themselves physically. The elderly, the physically disabled, the mentally disabled, and children.  
&gt;  
&gt;This is just a stupid proposal. It will lead to an increase in this type of robbery.  
&gt;  
&gt;It offers a high reward with little chance of meaningful punishment.  
&gt;  
&gt;I ask that you contact your state Assembly Rep and Senator and ask them to vote against SB82.  
&gt;  
&gt;If you do not know your representatives. They can be found here.  
&gt;  
&gt;[http://findyourrep.legislature.ca.gov/](http://findyourrep.legislature.ca.gov/)

&amp;#x200B;

Please share this on social media.

Please share this with the press.

Please share this with anyone who is at risk.

Please share this with anyone who works with anyone at risk.",1615871066,1,0
how does one do well on 162 exams?,"I fucked up on mt1 because I was super behind on lectures so just learned as much as I could from the review session (was not nearly enough..... I got -2 SD on mt1 oof. not that I expected any better)

this time around, I'm caught up on lecture and have gone through most of the weekly material (studied the lecture slides and almost done going through discussions) and I have a bunch of conceptual questions that I'm going to post and get clarification for. but I still see so many people asking questions on piazza and I don't even understand the questions that they're asking and I feel super overwhelmed and upset, I'm really scared that even after staying caught up with things I'm still going to end up really far below average. there's less content this time so maybe the questions will be harder too.

given that 18% of my entire grade is already sitting in the trash, about what scores do I need to shoot for to get a B-? I think that's the highest I can realistically hope for at this point. would -1.5 SD become a C+? my assignment scores are average, maybe slightly below (always end up unable to finish the hw completely, and it seems that most people do. I don't understand what I'm missing and I'm sad) can someone who's doing well rn or in the past give advice on how to figure out what to focus on? there's just so much content and im really worried so any advice would be amazing.",1615870666,1,0
Scared about NPing CS170,"I scored horribly on MT1 (-1.4 STD), and am not feeling much more confident about MT2. I've been studying for a while now, but I find myself struggling to get problems correct on any of the practice exams that I'm taking. I do think I understand the intuition reasonably well, but I'm scared about performing so poorly that I get an NP. What exactly is the threshold of passing this class? I actually do reasonably well on the HWs because I spend a lot of time on them, but I'm most likely going to score poorly on both midterms. Is there any hope left for me to at least get a P?",1615870593,1,0
eecs16b midterm,pretty sure i only got 4 points and they were for 2ab 🥲👍 go bears,1615869998,1,0
"I just want to have some friends to talk to. I’m a sophomore in my major and in some really cool clubs, but I’m still so lonely. Help...","I really want to just listen to music with someone, like we don’t even have to talk or anything. I just want to vibe out to some jams.",1615869787,1,0
Economic Seminars,Is there anyone knows how to join those events? Do I really have to email the coordinators one by one? Thanks!,1615869254,1,0
When to look for off campus housing,I’m a sophomore looking to find housing for myself for the next school year. Never rented off campus before any tips on when to start and what websites I should look at?,1615867774,1,0
Most interesting upperdiv math electives?,"At the end of this semester, I'll have 110, 113 and 104 out of the way, and I'll be able to start taking the really cool elective and semi-elective classes for the pure math major. I'll definitely be taking 142 this Fall, as topology seems really awesome. I have no real preference between analysis and algebra so far, and I don't think I'll want to take on something like 202a or 250a. What upperdiv math classes have you found fun and/or exciting?",1615867311,1,0
Is Berkeley a party school?,,1615863501,1,0
P/NP CS61A?,"Sorry for another CS post.

Background info: not an intended CS major, but may consider minoring in data science

Did not do too hot on MT1, below 20/40. Two questions, 1) Should I take a B instead of a P? 2) How hard is it to dig myself out of the hole after a very poor MT1 score?

Thank you for your time and advice!",1615863448,1,0
Gal in CS,"Hey everyone!! I’m currently a freshman planning to major computer science, and was wondering if there was any girls out there who would be willing to share their experience :))) (as a girl lol in cs lol)",1615861299,1,0
How to declare major in handshake?,I declared my major a little while ago but handshake still shows me as undeclared and I don’t know how to change it. Any ideas?,1615860663,1,0
How to afford Standard Slack?,"I'm in a student club that uses the free version of slack (so no search history, etc). 

Was wondering how other clubs without $$$ pay for Standard slack - is the education discount enough usually?",1615858966,1,0
UCSF salaries?,"For those who have a bachelors degree and work in research at UCSF, how much do you make an hour or annually?",1615858089,1,0
"Students who work 10+ hours a week in addition to taking classes, how many hours of sleep do you typically get?","

[View Poll](https://www.reddit.com/poll/m5wjzz)",1615854884,1,0
What are some alternatives for econ whose prereqs are fulfilled by those similar to econ? (Preferably something with a lower gpa requirement) Thanks in advance! :),,1615854704,0,0
Stressed with Gitlet,I’m so stressed. Ive been spending ton of time but I feel like Im not making any progress. My add and commit dont even work at all and I have no idea why. Im worried that I cant finish it on time even after spending so much time.,1615854630,1,0
Dress shopping around berkeley?,calling all folks who wear dresses: where yall shopping for your graduation dress? any stores around campus you'd recommend?,1615854030,1,0
anyone receive housing offers yet?,,1615853101,0,0
Summer 2021 in person?,Is there any chance that summer 2021 classes will be in person? Specifically CS 70.,1615852911,0,0
