body,created_utc,score,total_awards_received
The homework’s that I saw for sahai’s 70 class weren’t harder than Rao’s at all just longer (like 10 questions long on each hw). His 70 exams are much easier than other professors so it’ll likely be a high workload class that grades very generously—you could probs bs the homework and still get a decent grade if it’s anything like his 70 class,1613862823,1,0
"That is cuz they promised that the budget cuts wouldn’t stop anyone’s graduation plans, I wouldn’t count on this being the case again",1613862510,1,0
"I'll add a square: 

""Yo fuck CS61C""",1613861568,1,0
With Sahai I doubt that option will be there (wasn't there for 70 when he taught that).,1613861424,1,0
"If you're not a real Latino for supporting Palantir, neither must the approximate 10,000 Latinos working for US Border Patrol, who make up half of the USBP workforce...",1613861224,1,0
No I don't you asshole. I simply understand the laws in the United States far better than you ever will.,1613860958,1,0
I think there's been a screw-up on the finances tab or something. I'm in a similar situation and plan to talk to SAO and CalCentral on Monday.,1613860867,1,0
Yeah we needed a square for u/tplgigo defends child sex traffickers and pedophiles,1613860822,1,0
Not funny. No one has 60k lying around to pay.,1613860241,1,0
C'mon. John Yoo teaches as CAL. Doesn't get more evil than that.,1613860163,1,0
"Sir, there are tears of hope in my eyes. Thank you.",1613859865,1,0
I’ve never heard of it but just by the name I’d estimate it’s a scam,1613859778,1,0
"&gt;Credentials: I’m fuckin 30 years old.

Beautiful",1613859601,1,0
This is the way,1613859393,1,0
True,1613857927,1,0
"Too busy studying and feeling depressed, aren't we",1613857912,1,0
"LOLLL. 2 days ago I saw that I somehow missed the deadline for my homework AGAIN, and I told myself no I can’t do this anymore. 

I proceeded to Pnp",1613857741,1,0
Covid,1613857015,1,0
The relief I felt with “This is the way. -A grad student “ !!!! Thank you for the co-sign oh wise one.,1613856835,1,0
Shut up,1613856707,1,0
What does MTU mean? The only MTU I know is a computer networking term.,1613856363,1,0
"Yeah this is very true. I took a poll of redditors recently, and the vast majority of people who responded spent at least 7 hours(and I think abt half said they spent over 10). Sure it’s not the ideal methodology for surveying, but it does seem pretty accurate, from everyone I’ve talked to, and that alone puts people over the 12 hours, cuz we’ve got 3 hours of lecture/2 hours of discussion/I’m thinking minimum 2 hours/week reading the course notes.  So like if you do the homework more quickly than most people, you’re still spending like minimum 14 hours a week on the class.",1613855790,1,0
"the opposite is true for me— i love night exams because i still have the rest of the day to prime myself and do a few practice questions and review some definitions/things that arent conceptually important. And then, after I’m finally confident that I can pass, I have time to take a 4 hour nap so I really am fresh at 7p ish. 

For an exam at any other time of the day, I find that I have to stay up later the previous night because I don’t have that morning review time and lose that power nap. That said, it was a little hard to adjust at first.

most CS classes have late afternoon, if not night exams— trust me, in few exam iterations, you’ll have your strategy worked out! For now, make sure to rest, eat well, and lay off on the studying right before!",1613855087,1,0
"\&gt; Hold GME

Ah yes a fellow autist",1613855040,1,0
I love night exams as it gives me time to prepare and not be running between classes and worrying about stuff. So to each their own,1613854858,1,0
You have no way of knowing if it will get better for this person.  Life is unfair.,1613854650,1,0
Berkeley is full of neoliberals.,1613854383,1,0
"This is the way. — A grad student

Also, don’t take lame shortcuts like copy/pasting from Wikipedia. Developing strategies like OP’s to quickly review course material + asking teaching staff for guidance is wayyyy better than plagiarism. No one thinks you’re dumb for asking for help. You look really dumb when you poorly paraphrase irrelevant “facts” from ThoughtCo or whatever.",1613854361,1,0
Fullproof tbh,1613854321,1,0
"Oh holy shit, that’s next level",1613854177,1,0
I’ll contact CalCentral Monday,1613854139,1,0
"Nah, they meant there was a HW where one question had 25 parts alone",1613854012,1,0
"you're far from the only one. i've basically stuck to my good high school friends and maybe 2-3 people from my classes. in-person will be much better for socialization, don't worry.",1613853898,1,0
"My recipe to ace a test:

1. Get more answers right
2. Stop getting answers wrong",1613853754,1,0
"I think this most recent one had more than that. 7 parts for num 2, 3 parts for 3 and 4, 4 parts for 5, 9 parts for 6, and 6 parts for 7 is: 7+3+3+4+9+6=32",1613853703,1,0
yeah it was pretty easy. they contacted the financial aid office and then showed the necessary documentations. i don't know if it's the same though bcuz she was a pre-frosh. the funny thing was that uc berkeley was the only uc school to fuck up their bill. it's probz just an error for you. show them your documents and you should be good,1613853318,1,0
"Everyone in the dorms is in a single. We are not allowed to gather in large groups to eat, etc. All common spaces are closed (lounges, dining hall, etc.). They are not ""denser."" People living off campus can have roommates, cook and eat together, don't have to get tested for covid, and were never under any sort of lockdown restrictions with the surge in cases. There's literally no way for it to be true that ""dorms are much riskier than off-campus housing.""",1613853103,1,0
"Great, thank you!",1613853101,1,0
"The housing contract is completely off-topic from what I'm saying. Please don't group me with the other people making posts saying that dorm restrictions = imprisonment and civil rights violations. That's not at all what I'm saying: all I'm saying is that it's unfair to act like people living in the dorms are a higher risk for getting covid than people living off campus, when dorm residents are required to get tested twice a week and people living off campus are subjected to much fewer rules.",1613852792,1,0
This made me laugh!🐻,1613852605,1,0
Not true. Y’all deserve it 100%,1613852389,1,0
"Do you know what happens south of the border ? 100k+ cartel related murders in the past 3 years with every following year breaking an all time high. Documented evidence of children being passed through by coyotes and used for illegal child labor. Sex trafficking at the border. All time highs in fentanyl use/production. Why do you think families started being separated in the first place? It’s been horribly mismanaged(not justifying ice facilities) but the use of DNA testing for family ties is necessary. The world is not all sunshine and rainbows outside of the U.S. 

It’s a two way street, 70%+ of illegal firearms in mexico alone come from the U.S. fueling the cartel wars. 

ICE is necessary to maintain the safety of both sides. If palantir can help track down the people who cause this violence then so be it. If you don’t like what they do, don’t work for them !",1613851394,1,0
"well first of all on its face, I think Biden's ending this policy, so unless you consider Biden a fascist (which you actually might lol) they're not currently cooperating with one.

second, I think it's worth isolating evil. intelligence software is not inherently evil; you need a way of tracking legitimate threats to the country. ICE using the software itself is not inherently evil, as you need some way of monitoring who's coming into the country. What is evil is the actions ICE took with this information. 

It's very likely that the family separation policy did not exist when Palantir first entered into its contracts with ICE. I suppose in an ideal world, Palantir would immediately cease providing services whenever they were being used for evil, but that doesn't seem pragmatic of any business.",1613851219,1,0
CS61C should unironically be 12,1613850816,1,0
"You should take issues with private corporations that assist fascists. We didn't with the companies that did so in nazi germany, and that turned out to be a terrible thing for history.",1613850589,1,0
Hey I mean you still have your 16a lab partner,1613850540,1,0
"Yeah same but oh no they have contracts with ICE so they should automatically get blacklisted. Worse, I get told im not a real latino for supporting palantir(last yr) by white liberals at this school. This university is something else smh.",1613850523,1,0
Uh who? I took 61c over the summer and I only really disliked one of the student instructors though I’m not sure if they’re on course staff still,1613850403,1,0
Of course Berkeley students don’t get a freakin free space.,1613850396,1,0
"meh do I wanna work for palantir, not really, but someone has to develop intelligence software for the US. their product is used for some shady shit but it does need to exist some capacity.

if you don't wanna join, you do you. I have no issue with them advertising here.",1613849933,1,0
Don’t y’all have enough 2D girls already,1613849879,1,0
"Yeah I think the majority of my cs classes, including upper div courses, have held exams late in the evening when we were in person. I'm assuming the reasons are finding enough lecture hall space and ensuring the TAs are available to proctor.",1613849834,1,0
gob ears,1613848906,1,0
"Yesssss!! Facts. Easier to keep up than to catch up, but if you gotta catch up then do only half the readings 😂",1613848902,1,0
thanks for the advice everyone! is there somewhere where all the exam walkthrough videos are posted? I don't see it under resources (there's a few dispersed around the course calendar but was hoping to just put on a playlist while eating or something),1615998006,1,0
I didn't feel like pooping before,1615997386,1,0
Why didn’t you go before your walk?,1615997121,2,0
I’m scared I won’t get it lol just what ppl write on CC,1615997098,1,0
Grind past midterms - can’t solve it? Look at the answer - figure out why it works - move on to the next question. Do that 12 hours a day.,1615997062,1,0
Why does it matter (im genuinely curious),1615996982,1,0
CS 70 is good,1615996072,1,0
"Data tracking technology for criminal undocumented immigrants. Aka the worst offenders make it to ICE’s top priority and they use military grade tech to track them down, these are mainly the drug traffickers in NY/Chicago, not your regular undocumented immigrant who is trying to work(although the media reports will try to tell you otherwise).",1615995980,1,0
Was 16b in person as bad as what people are complaining about now?,1615995715,1,0
true but there’s also an element of stockholm syndrome that has made me enjoy the content. also 61c lol,1615995690,1,0
"For UC Berkeley, you can only put one major down on the application. If you get accepted to the College of Letters and Sciences, you come in undeclared and have to declare your major(s) by taking certain classes and sometimes meeting GPA requirements. If you get accepted to one of the other colleges (Engineering, Chemistry, etc), you will be declared in the major that you applied for. Then you could declare a second major later on after you actually start attending the university. 

I believe for most other UCs it’s similar. You get to put down a primary and secondary major on the application, but you are only accepted for one major. Then you can add a second major later on. The process for declaring the second major will differ depending on the UC though.",1615995324,1,0
"I had Econ lectures in VLSB, Dwinelle, Evans, Cory.  They’re all over the place, I lived on Southside and it was fine",1615995246,1,0
"Woah now, CS70 and 16b would like a word",1615995199,1,0
"same I have 3 midterms the week after break and then  a presentation and a lab report due that same week,the grind just never stops :(((",1615994499,1,0
Kidd is the smallest coop with only 17 people so it’s very unlikely you’ll find someone from there in the subreddit. Good luck!,1615994438,1,0
[deleted],1615994064,1,0
"Only wear the mask if you are sick, or if you are seeing unvaccinated people.",1615993428,1,0
"The same thing goes for clubs or any on-campus communities. Considering that a club is pretty much defined by the people in it, it's going to be so weird since all the old members would have graduated or are less-active seniors and most of the active members would be people who've never met any of the old members in person.",1615991271,1,0
"After break, I've got one week back then 3 midterms in a week. In the 5 weeks before break, I've had exactly 1 without a midterm. I'm just going with the endless barrage never stops in general.",1615990629,1,0
Yep,1615988148,1,0
same. don’t even want to attend 53 lectures this week. panicking for the 61a midterm now.,1615987795,1,0
April 26,1615985957,1,0
Don’t you dare smoke on street,1615984293,1,0
Tbh yall gonna be in quarantine for the majority of the time on campus. Remember what happened in frat parties? I doubt they’ll stop partying like shit,1615984162,1,0
"Yeah I did not mind the cs188 one last week, but I did feel like the cs162 policy of having a midterm (covering up to the lecture of TODAY), and also a major hard hw due on friday is a lot to have on the plate. (The class is kinda just like that though lol what can you do)  


In a sense I guess it's nice to have a more relaxed start after break but tbh I really just wish there was less panic shit going on rn this specific week",1615983979,1,0
I got fucked by enrollment twice this year alone. All I’m taking are basically breaths and some boring-as-f classes. Hope what you’re saying is right 😩,1615983911,1,0
I didn’t even work that hard to get here and it’s still shitty so I can understand that amigo,1615983803,1,0
Generally I've found that I either have a bunch of exams in the two weeks before break or I have some exams on the week before break and some on the week after (this also is not fun).  This is in the math dept.  Just how it goes for everyone.  I always appreciate when a prof chooses an unorthodox time for that exam instead of just putting it in the week before break.,1615983676,1,0
America isn’t the only country in the world and there are still people arriving by thousands every day (e.g. Rio Grande). Do you think they are vaccinated too? Masks are a way of life for at least a decade. Deal with it.,1615983674,1,0
Are they coming out on Ivy day this year as well?,1615983549,1,0
"I meant more from the mindset of a struggling student. I think many. many CS stuidents are able to work-life balance in a healthy manner. But it is also a major that especially punishes laziness on keeping up or starting assignments early, to where I think it is one of the most ""grueling"" in the sense of falling a lot behind.

Definitely true this varies for everyone but my personal experience has been that people struggling (or even doing median ish with good effort as myself) often find a lot of intensity and energy in getting through stuff.

I'm worse some class choice programs of pure math, physics in general, and ChemE, plus most PhD tech programs blow the difficulty of Berkeley CS out of the water though.",1615983537,1,0
eh i wouldn't say cs is grueling but i get your point,1615983161,1,0
Fuck,1615982783,1,0
In any uc???,1615982589,1,0
Withdraw this semester. Profit.,1615982457,1,0
"In 61a with Denero last sem we got to run code on an online editor, which probably made the exams a whole lot more easier compared to in person exams.",1615982115,1,0
"**wave and smile, just.** 

 *-IamYodaBot*",1615981411,1,0
"Thank you, pterodactylfan, for voting on IamYodaBot.

This bot wants to find the best and worst bots on Reddit. [You can view results here](https://botrank.pastimes.eu/).

***

^(Even if I don't reply to your comment, I'm still listening for votes. Check the webpage to see if your vote registered!)",1615981399,1,0
Good bot,1615981384,1,0
42 upvotes. All your problems will be solved.,1615981292,1,0
hang in there :(,1615980879,1,0
I own 100 shares of palantir. They r doing this country a great service. Who doesn’t like Alex Karp.,1615980694,1,0
"yeah i agree. Knowing some material and taking the test tired is better than not knowing anything, but it’s a bad habit to form",1615980676,1,0
3 midterms in 3 days :(,1615979560,1,0
"I would try to look for places on Oxford St. but towards the gourmet ghetto. 
I walk by and there used to be a lot of for Trent signs and it seems safer than Telegraph.",1615978388,1,0
You can do that already! You can move anywhere with remote.,1615977572,1,0
"How much programming background do you have? How did you do on the last midterm? If you feel candid enough answering these two questions, I can offer more specific advise, as I have known what works for me (who struggled a bit) and what worked for people who have struggled on a deeply serious level.",1615977182,1,0
Yup exactly,1615976112,1,0
"No please... don’t do that, not in BERKELEY... /s 
I agree with your point and you’re totally right. Also consider though, that it already happened. Theres a reason property prices are so expensive. If you don’t believe me, look at the hills. I’m here at Cal through the funnel from Berkeley high, and it’s night and day segregated by both wealth and race. I’m familiar with several other Berkeley high grads as well that go to Cal. The whole thing is already in play already",1615975903,1,0
"Excellent points, both of you",1615975636,1,0
Whats going on with palantir?,1615975483,1,0
"I think a lot of people either end up in lazy or depressive patterns that are more human issues than a lack of care in the subject and then at that point it really makes all of college so hard to navigate.

100% in agreement that just not liking a subject (especially one as grueling as CS) is a rough path for the long term if there’s just no passion there or genuine interest or fascination to either study the concepts or build things.",1615975376,1,0
Idk I could only access it from this google form someone sent me,1615975180,1,0
"Not a dumb question at all!

Seriously apparently would be turning off your phone, ideally being in a locked room with close to zero distractions if possible (I use a noise machine), watching all the lectures you haven’t seen at 1.25x and taking notes on what seems important, going back to lectures especially those between mt1 and MT2 and getting some notes on big stuff there, then if you have time after all that doing discussions in order of least comfortable with the topic to most comfortable with the topic (don’t be afraid to check sols if you’re stuck for 5m on a question since you’re under time) and then doing as many practice questions and reading some solns in a similar pattern to the discussions.

FYI I often only get through “finishing the lectures” and “skimming a couple discussions I was the most sketchy on” and taking notes, and I’ve felt these have brought me up the most to where I basically never have to skip a question outright and I at least have some general ideas of the principles from seeing the lecture big points and some example problems.

Also HKN reviews if available I found better than official ones almost nearly and you could put that as high priority.

Hope this helps! Also getting distracted doesn’t mean you’re screwed, or if your setup isn’t totally pristine, I’d just shoot for as much focused work without panicking as possible in your shoes

Good luck!",1615974773,1,0
"Honestly just the comments on any COVID-related topic, bonus points if it's science-related. Plenty of delusional QAnon neckbeards just flood to those comments the moment the videos come out as if they're making some great demonstration.",1615974169,1,0
I found 169A really frustrating because it didn’t teach me stuff that fit my learning style and there were a ton of bugs in all the assignments. I’d be wary for that reason but I agree the content can mean a lot especially without an internship. Just be mentally prepared for the worst logistics and most random scrambling and breaking of assignments you’ve experienced in your entire life if you sign up,1615974115,1,0
"&gt;SERIOUSLY applying myself hardcore

This might seem like a stupid question, but do you mind elaborating on how you apply yourself hardcore, specifically during the final hours before a CS exam? 

Aside from a lack of motivation, I think another issue I have is that I genuinely do not know how to study. 

Thanks for the detailed reply btw, I really enjoyed the read.",1615973982,1,0
"I never found the classes to stop being like ultra detailed, strenuous, insane workload, or good for mental health, but I do think that being on campus and making social benefits (don’t need to be in a frat or sorority or even a club, just meeting people hopefully naturally) makes the whole process balanced by a lot of really good memories.

It’s my hope that all of you who have yet to experience campus life, or have barely been there, get a chance to make great social connections and do more than survive purely out of pain afterwards",1615973877,1,0
"Definitely also important to learn from these moments and make them lessons against being stuck in a corner of desperation, and motivation to space work out, catch up at all times, and ask every friend and TA for help one can",1615973483,1,0
nah i mean i read it and it makes sense. never taken a stimulant but i'd agree cramming if you have 0 knowledge is better than nothing,1615973216,1,0
depends who teaches it.,1615973101,1,0
i have to say learning about sleep has made sleeping much more difficult for me. just one anecdote tho.,1615973013,1,0
Yeah I can’t disagree this is some crazy shit lmao oops,1615972990,1,0
"**you bruh, i feel.** 

*-DiuLeiLouMou3000*

***



^(Commands: 'opt out', 'delete')",1615972983,1,0
"&gt;FIA

what's the course number. can't find it",1615972961,1,0
I feel you bruh,1615972955,1,0
not next semester. hilfinger is teaching it,1615972847,1,0
"Yes, but makes me wonder why they are taking 61B if they show no interest in it. It's literally one of the most fun lectures to watch since Hug is teaching it. And it's the bedrock of almost everything in SWE.",1615972755,1,0
100% wired writing this,1615972667,1,0
"There are people who do benefit, namely people who lose attention easily. Being in a confined space where you're stuck with having to listen to lecture helps. Just cause you don't think it makes a difference for you doesn't mean it doesn't for others who live differently than you.",1615972331,1,0
"Yep, it’s apparently not a done deal but “seriously being considered”",1615972181,1,0
"Honestly covid has made it easier as a CS major. Close to no one went to lecture anyways pre covid, and few people would want to walk to discussion pre covid. Now everything (including discussions and review sessions) is recorded and I don’t even need to leave my bed if I want to attend live.",1615972177,1,0
Classes are supposed to be in person in the fall so hopefully that helps.,1615971695,1,0
"Generally, it’s good to be well rested for exams that require thinking. However, if you actually know nothing then staying up and taking a nap ain’t a bad plan. Being at 100% condition but having 0 knowledge ain’t gonna get you far.",1615971461,1,0
"Oh, that would be a bit of a dealbreaker... Did you hear about this from someone within the I-house community?",1615971411,1,0
"IMO I think when people have actually seen all the lectures before at the very least, and just feel they are struggling with the practice exams or some discussion problems or class concepts, pulling an all nighter or a big cram session has diminished returns and may overall be a negative with the sleep loss.

It sincerely can help a lot more if you are, say, 8 lectures behind, done 0 discussion sections or exam prep, and don't have a lot of prior knowledge. Even then it's risky health wise, but I think the real distinction of making this move is if you ""are worried you don't know enough but are caught up"" vs ""feeling like you have such a small grasp on stuff, in a way beyond beating yourself up, and need to put in those hours to even TRY the exam problems""",1615971073,1,0
"so where is all the money going that we are saving on maintenance, electricity, etc?? lol

answer: the bloated corrupt admin’s pockets. 

welcome to berkeley ya maggots.",1615970936,1,0
