body,created_utc,score,total_awards_received
"I did the same thing 40 years ago, although it had nothing to do with yield rate or comparing the schools.  It had to do with not being able to afford Stanford (which was just as ridiculously overpriced then as now and offered far short of a reasonable amount of financial aid, even though I was dead broke) and knowing a bargain when I saw it (in Cal, which was much more reasonable then than now).  Either way, I enjoy the fact that got to turn down Stanford in favor of Cal.  

Since then I've gotten to know the culture of both schools.  There are many wonderful kids at Stanford, but as an observer, my take is that the overall culture there is a bad fit for anyone who doesn't come from a certain background.  I think Cal's diverse population is a big plus for anyone who wasn't born with a silver spoon in their mouth.  Stanford is notorious for grade inflation, and an unwritten policy of carrying students along who probably shouldn't be there.  Employers know that, or find that out.  There are plenty of Stanford graduates who live up to the promise that admission to that school implies, no doubt (some of them work at Cal) but I don't know that the ""prestige"" where it counts (when you're trying to get a job) is any better, than what surviving the rigors of Cal gets you.",1617985451,3,0
berkeleyrejects.com,1617985390,2,0
"If you tasked CS dept staff to setup a wifi network for a university campus, 9/10 would have no idea what to do, 1/10 would have experience setting up a mesh network for their home and then promptly fail when faced with the much more complicated situation here.

There's no intersection between CS and wifi networks lol, other than that CS staff are mildly more likely to be tech savy, and at least know the general idea of what they're supposed to do; but that's little more than layman knowledge.",1617984928,1,0
"You seem like the kind of person that I would not want to know at Cal.  You're petty and rude.

And you're not going to accomplish what you want anyway -- Stanford admissions will just laugh at your letter as the ramblings of a stupid child who will regret their choice in years to come.

If you really wanted to affect change, you'd go to Stanford and try to spread your message amongst the people who really need to hear it.",1617984672,-8,0
If your the kind of person that would turn down Stanford for Cal... then Cal is perfect for you,1617984457,3,0
💙💛,1617984301,4,0
Real bear shit,1617984254,5,0
This is the pettiest shit I have read in a long time.,1617984201,2,0
"This exact problem happened to my gf, she called Experian and they couldn’t help her. The representative seemed kinda new/incompetent, so she’s planning to call again later and see what they can do. This is a mess for sure.",1617984150,3,0
Oskipilled,1617983841,4,0
"I would check the security questions on your accounts. Things like ""What is my hometown city""? Or ""What's my mother's maiden name?"" can be easily figured out when your personal details were leaked as they were in this case.",1617983769,1,0
[deleted],1619185529,1,0
"No, it's for a year.",1619184891,2,0
Will they accept religious exemption?,1619184513,-1,0
"Forgot to add, there’s a second hiking club I believe. I don’t remember what they’re called though. Anyone else, please chime in!",1619183646,1,0
"Chaos stands for cal hiking and outdoors society. I’m technically in it (I think) but I haven’t yet gone on a trip with them. I’ll try for this summer. One of the things they offer is free (well a sauva le $20 per year) equipment rental for things such as tents, climbing gear, etc.
As far as I know, they don’t do much plan massive trips since they have hundreds of members, but rather offer a platform to join a small group or something like that.",1619183582,2,0
[removed],1619181292,1,0
[removed],1619181274,1,0
[removed],1619181204,1,0
[removed],1619181199,1,0
[removed],1619181175,1,0
[removed],1619181168,1,0
[removed],1619181160,1,0
[removed],1619181138,1,0
[removed],1619181122,1,0
[removed],1619181116,1,0
"No, you just unfreeze it whenever you take out a loan to buy a house/car, or start a new credit card — which honestly shouldn’t happen too often — then you refreeze it again.

Honestly with how many data leaks happen on a regular basis, this is a good idea regardless of what happened with the UC’s",1619179659,2,0
"This is world class bullshit, built on the a priori assumption that the instructors are incapable of helping exceptionally bright students master the material. These assholes are three standard deviations below the mean as humans",1619178860,3,0
It's becoming harder and harder to leave bed 😔,1619177962,4,0
following,1619176580,1,0
"hAaS School of ""Business""",1619176299,1,0
this is so romantic,1619175873,3,0
"I’m from SJ! downtown San Jose is great and beautiful. Lots of cool places to visit and amazing food too. I’m from east side and that’s usually the place you might want to avoid at night alongside south side. I highly recommend checking out the Rose Garden, San Pablo square, Vietnam town, la Tropicana. Best wishes !",1619174910,1,0
"My hw5, which was due in Feb, is still ungraded :(",1619173965,1,0
"But it also depends on the major you applied to, I applied to CS at Davis and Irvine with a 3.94 and some strong PIQs and I got waitlisted, but also my major is SUPER IMPACTED at those schools. However, for Berkeley, I applied to Letter and Sciences. Also, keep in mind that Berkeley doesn’t do TAG, so you have more of a chance to get in since everyone will be competing against each other, unlike with TAG, which it basically determines how many people that didn’t do TAG get in.",1619173763,1,0
imo 188 is getting way harder— written hw sp 20 took me the entire week to complete and the exams were brutal. i say 170+61c because its a consistent amt of work every week so its really easy to balance and schedule other commitments around it.,1619172851,1,0
"I was at Foothill my freshman year. I enjoyed my time there— yes, it was quite and I didn’t really get to know any of my flatmates let alone suitemates, but I was a part of a few clubs from which I think I gained lifelong (hopefully) friends.  I think this can go both ways though!

It is a little far so that meant extra walking for humanity classes but hey, I was part of Freshman minus-15 squad hehe. On a serious note, when starting my freshman year, I had never been anywhere alone, so walking to and fro the dorms at night was really scary, especially because no public transport except the 52 or night safety shuttle go remotely near. I usually made sure to have someone walk most of the way with me and I left many gatherings early because I knew I needed to get home. Of course, as I got to know the place, I got more confident with the routes I took (always walk through campus), but I think this fear is drastically less on Southside because so many people live near you. 

I’ve visited blackwell and to me, it feels like a long narrow cell, especially because inly one roommate gets a window whereas at foothill, I had so so so much space- a huge double, a living room for entertaining my friends/studying, a mostly private bathroom, etc. On top of that, Foothill felt like a log cabin in the middle of the woods away from the business of the universityc whereas Blackwell really feels like a college dorm made as an efficient use of space. I did have to live with a mouse for a week though, so you might not have to do that in Blackwell.

tldr: foothill is a great place to live with a few inconveniences that you’ll learn to work around!",1619172530,1,0
"It is sometimes open to undergrads though the requirements are terse. As in EECS 126,127, 189 are required. They had an entrance testing linalg, probability and ML.",1619172199,1,0
"I lived in foothill and I wrote this explaining my opinions a while back:

https://www.reddit.com/r/berkeley/comments/mgaxpd/_/gssapwx

Foothill is quiet but I don't know about there being an ""engineering atmosphere."" You'll find engineers in any dorm, so I wouldn't worry about that. As for the quiet, it depends on you how much you value it; my post above has more details about the other pros/cons.",1619172046,1,0
"Yeah if it’s a breadth and it’s below an A-, it’s not worth taking graded. Major classes on the other hand should be graded, unless you’re about to fail",1619171172,1,0
don’t worry about it.,1619171064,0,0
"when it asks for bank account and financial stuff, do we put our personal accounts? i’m wondering if we have to put our parents bank accounts too if they pay for our tuition...?",1619171010,1,0
take data 8,1619170338,1,0
"yup, i think this is pretty common during summers actually",1619169921,1,0
"the triathlon club is v inclusive and great folk. you could only show up for running practices if you want, but let me tell you when they run they run far and long and uphill and downhill and all over berkeley.",1619169103,1,0
I’m also taking Chem 3A/L over the summer during session C and Sasian R5B is in session A. Do you think that is doable?,1619168463,1,0
No it's not doable. trust me,1619168364,1,0
thank you for that perspective too,1619168085,1,0
"No idea, my kid doesn’t receive FinAid anymore so not sure of timing on things.  But IIRC you should have gotten some sort of indication as to what your Finaid would be.

I doubt if you / your parents will get anything from FAFSA other than acknowledgement that the form was filled out.",1619168047,1,0
hey fellow co2025 bear 👋 this is really helpful thanks!,1619168046,1,0
Hey. You addressed so many important points; I really appreciate your time. This it eases a lot of worries :) See ya at Cal!,1619167982,1,0
"I entirely agree with you that the financially optimal move is to use the stolen data as quickly as possible. But right now a few gigabytes of compressed data is sitting at a `.onion` address (i.e. on the ""DarkWeb""). Criminal hackers don't have any economic incentive to share the data for free quickly, and that free public data is what Experian is issuing all the warnings about.

Perhaps the data published is just the stuff they decided they can't monetize and they have other info that will be used later. The insane thing is UCOP OUGHT TO KNOW BY NOW whether that data is the complete data from the breach AND THEY AREN'T TELLING US WHICH IS BATSHIT.",1619167981,1,0
"Beautiful picture! Thanks for sharing, wonderful answer.",1619167895,1,0
You’re right. Thank you.,1619167853,1,0
Haha,1619167829,1,0
Thank you so much for sharing!,1619167808,1,0
"That's part of what UCOP is screwing up so hard. They must know what banking info is accessible. Candidates include: Direct Deposit, EFT, tuition, all of the above, or others I can't think of. HOWEVER THEY REFUSE TO TELL US WHAT THEY KNOW, so we're just left guessing.",1619167306,0,0
Oakland track club!  If you're a student UC Berkeley has a running club as well (during non-pandemic times ofc),1619167199,1,0
"you had to wait? when I withdrew, the process was complete so quickly that I couldn't believe it. Like I was still a student at 8 and but after I pressed 'confirm', they already sent an email at 8:01 notifying me that I was no longer a student :))",1619166733,1,0
"God, don’t remind me 😭",1619166462,1,0
Summer classes transfered from a CC only transfers the credit and not the grade so it doesn't affect your GPA if that's something you're considering. You only need to pass the class.,1619166389,0,0
Yep thanks! Will do!,1619166125,1,0
nobody here knows. it could also be from direct deposit. it depends if the university saves full bank details as part of transaction records.,1619166115,1,0
"your enrollment time is prolly some time during the summer so just relax, use your time to research a bit and plan your next two semesters for now",1619166096,1,0
"Beep. Boop. I'm a robot.
Here's a copy of 

###[The Bible](https://snewd.com/ebooks/the-king-james-bible/)

Was I a good bot? | [info](https://www.reddit.com/user/Reddit-Book-Bot/) | [More Books](https://old.reddit.com/user/Reddit-Book-Bot/comments/i15x1d/full_list_of_books_and_commands/)",1619166072,1,0
not really related but if competitive stress culture scares you then maybe dreaming to pursue the successful business path might not be ideal...,1619166019,1,0
"&gt;The time till the stolen data becomes public, may be longer and may be spread out over time.

that doesn't make sense. if you release (sell) the information slowly, then the victims would already have been notified of the breach and taken security precautions like fraud alerts, changing card/account information, making the information ""stale.""  it is better for them to strike quickly and empty accounts and credit limits before victims realize they need to take precautions.

that's not to say someone physically can't release it slowly, just that it's irrational and counterproductive for them.",1619165999,2,0
What does this have to do with Berkeley?,1619165570,1,0
Can someone explain the meaning of the meme?,1619165557,1,0
"There's 3 important things exposed: bank account, credit/debit card, SSN/ITIN. Email, phone, and street address are all somewhat public.

Bank account: open a new one, transfer funds, close old one.

Credit/debit card: get a new one.

SSN: freeze credit. If problems plague you for a long time, go to SSA and ask for number change. That is one of the allowed reasons. You will probably have to submit proof, but you'll have plenty of that. So there is no such thing as ""my SSN will be out there for the rest of my life"" unless you refuse to do something about it.

As you can see, everything boils down to ""get a new one."" Governments and banks aren't going to say ""screw you, i don't want to deal with identity theft.""

go here [https://www.identitytheft.gov/](https://www.identitytheft.gov/) if you need more help.

also lifetime is unrealistic, if your identity is still getting stolen after 20 years without new data breaches, it's nobody's fault but your own for not changing bank/card/SSN information.",1619165548,4,0
check!,1619165533,1,0
i don't wanna check lmaooo,1619165505,1,0
what did it say when you clicked withdraw?!,1619165424,1,0
"I'm not sure if this upcoming semester offers courses in the Big Ideas Courses, but for eg I took Elections 2020 last semester and it was an easy A+. A lot of the courses similar to those on Big Ideas Courses are very easy with low work commitment  - I pretty much just had to create a brochure, a group presentation with 4 other people and contribute to weekly discussion boards. I think these courses are always promoted as ones with awesome content so yea! Check them out!",1619165367,1,0
"I took a SASIAN R5A class with him Fall 2020. I really did like him and the class, but there was definitely a lot of reading and video lectures that took quite a bit of time. But if you're interested in the class, it's worth it!",1619164890,2,0
"thank you ! this is my first time taking calc, I’ll probably reconsider taking 1B over the summer since I’ll want to comprehend the material at a somewhat slower pace!",1619164879,2,0
I feel you!,1619164669,1,0
"Something is clearly going on with her though. You don't just end up homeless for longer than \~1 month via bad luck, despite what everyone on this subreddit will tell you. Either drugs, mental illness, or criminal record are at play here. Perhaps multiple at the same time.",1619164574,-1,0
"the way I found my next living space was that I just looked on zillow. I found some guys thru a group chat and we were super chill with one another. After looking quite intensively on Zillow, we signed a lease and boom",1619164266,1,0
"Didn’t take 1B but did take 1A over summer - i will assume that similar to 1A, you’ll have class almost everyday since it’s condensed. (Material might be harder to grasp bc its covered so quickly!) I don’t think 1B was particularly too hard, but I took up both calc and AP Calc AB so at that point it was like reviewing the same textbook for the 3rd time haha",1619164138,3,0
"I'm a student in the J100 series currently although from what I've heard, there usually isn't much demand for the X series of Japanese classes. I visited a J10X class once and there were barely any students compared to other Japanese classes which are already very small. Perhaps you could email Takata-sensei who taught it last semester since she might have an idea?",1619164113,1,0
"Especially after an incredibly long, difficult essay. What a euphoric feeling.",1619163904,1,0
"thank you! also is your finaid package finalized even if you haven’t committed? i haven’t signed the sir yet and while i don’t expect anything from berkeley, i haven’t received anything from fafsa. is that normal? i need to commit first and then complete some finaid verification but i’m not sure if that’ll determine fafsa or if i really did receive nothing",1619163690,1,0
Wow what ? Really I didn’t know that 😭,1619163545,2,0
"not sure if it is outdated, but as of fall 2018 only the most competitive uc's like berkeley, ucla, ucsd, and davis (?) read transfer piq's. the rest of the uc's only look at the additional comments and your grades of course, but i'm not sure how true it is!",1619163500,1,0
"No clue either, they are not revealing anything substantive.

For anyone curious, our midterm was March 11, last week (approx. April 14) we were told that we would have our scores by the end of the week (that was following over a month of no explanation), but was inaccurate and there has been no update.",1619163359,1,0
Does the bank account information come from paying tuition?,1619163284,2,0
Wait what do you mean they don’t read transfer essays? Aren’t they all supposed to? I am so scared too haha,1619163277,1,0
also maybe it is valid for your friend who has been rejected from uci &amp; ucsb bc apparently they don't read transfer essays! berkeley has a different approach but goodluck!!! i'm so nervous lol,1619163206,1,0
"You're right. I was a bit misleading with my Yelp review, but what you're doing is more extreme. My Yelp review contains true stories, but they are framed in a way that is misleading. I understand that you thought what you thought, and so there are no hard feelings from my side, but nevertheless, you went on Reddit, accused someone who you don't know of being a liar, a stalker, a predator, and a manipulator. Then instead of admitting you made a mistake, you decided to double down and then spread even more false stories. What you did was way worse and I hope you can just acknowledge the mistake. I didn't start these Reddits. Just because I am friends with leavegracepoint and he got connected to leather-run doesn't mean I had anything to do with this. I talk to people who reach out and listen to their stories and then redirect them to support groups or churches. It was just a misunderstanding, so yeah, let's move on.",1619163126,1,0
Try to withdraw your application on Berkeley portal and see what it says,1619162947,1,0
what is the withdrawal trick omg 😭,1619162917,1,0
I totally agree :// Maybe you could try looking at crosslisted econ classes or those offered by different departments (although you can only take 2 total to count towards your major).,1619162864,2,0
REST IN HEAVEN,1619162713,1,0
Forever?,1619162692,1,0
Tepper seems like it’s clowned on for actually being the butt of CMU rather than Hass which is just called snakey,1619162240,1,0
yo mama,1619162228,1,0
Yeah interested in knowing about Yosemite as well,1619162125,2,0
No,1619162073,0,0
"There is absolutely no reason to believe it is ongoing. The time till the stolen data becomes public, may be longer and may be spread out over time.",1619161810,3,0
The best person to contact. Trust me,1619161768,1,0
a high gpa doesn't help in industry as much as ppl think tbh,1619161627,2,0
"not for sure! but, i heard 3 pm 🤞🏻",1619161626,1,0
Yea ikr! Feels like forever! Do you know what time it is for sure coming out tmrw?,1619161529,1,0
at least it's the day of! not much more waiting left 🙃,1619161487,1,0
who'd you steal it from?,1619161459,2,0
Ok update me too! So scared rn lol,1619161440,1,0
let me know when you get your decision!,1619161329,1,0
I mean there’s still hope I guess😭😭😭,1619161290,1,0
"man, it sucks. i'm writing off berkeley now, just because of the past thread you are referring to. i read it, and everyone confirmed it 🤧",1619161258,1,0
Thxx ! 😭,1619161166,1,0
Nah. This is great lin. alg. review for me personally.,1614904537,12,0
&gt;No correlation,1614904350,7,0
sahai 189,1614903627,10,0
It might also be helpful to contact student legal services. [https://sls.berkeley.edu/](https://sls.berkeley.edu/),1614903006,2,0
Try contacting mutual aid at berkeley (they have an IG) - they give donations to low income students to cover bills,1614902904,3,0
OP said it was an accident,1614902830,5,0
have you heard about predatory towing companies? they do it because they can charge ridiculous prices for it.,1614902690,2,0
Yes. Yes they are,1614902653,1,0
Yes. You'll make some very cool friends from all over the world.,1614902624,8,0
"Okay great! I thiiiink typically my classes consist of either one or two medium or big research papers or a bunch of smaller discussion memos, and sometimes midterms/finals in the typical test format. Also almost always lots of readings, a rough estimate would be like 50-100 pgs per week depending on the class? For better specifics, I'd suggest looking through PS classes in [classes.berkeley.edu](https://classes.berkeley.edu) and then search google for the syllabus :)",1614902549,2,0
"Almost all upper div physics courses, any advanced mechanics courses offered by the ME dept",1614902533,5,0
CE 93,1614902310,1,0
Tbh if I was a gsi and saw that I would die from laughing so much. Just email the head gsi and yours asap and let them know cause this isn’t like a insanely weird situation I know plenty of people who just chill naked at home. They’ll understand.,1614901139,2,0
Do you think this squeeze will extend to the graduate school and research funding?,1614901057,3,0
"That's the nice thing about the folks the piece focuses on--they get that the problem is multi-faceted and that you have to address all the problems at once.  Are foreign investors an issue?  Absolutely.  But they're just another symptom of the overall problem--one that includes racial injustice, income inequality, and homelessness.  We're finally getting leaders who can see the structural problem and are willing to try and solve it.",1614900876,6,0
"This is the closest beach that is beginner friendly: [https://www.google.com/maps/place/Pacifica+State+Beach/@37.5988931,-122.5041331,17z/data=!3m1!4b1!4m5!3m4!1s0x808f7a84fd8f6945:0x80eded7cc04844c0!8m2!3d37.5988889!4d-122.5019444](https://www.google.com/maps/place/Pacifica+State+Beach/@37.5988931,-122.5041331,17z/data=!3m1!4b1!4m5!3m4!1s0x808f7a84fd8f6945:0x80eded7cc04844c0!8m2!3d37.5988889!4d-122.5019444)

This time of year you probably want to be just south of the taco bell. Waves get larger as move north. If it's a small day ([http://www.stormsurf.com/page2/forecast/shortcast/ncal.html](http://www.stormsurf.com/page2/forecast/shortcast/ncal.html) says a surf height of \~3 feet or less), then you can go wherever on the beach and be fine. Just south of Taco Bell is best unless its really big.

Rent here [https://sonlightsurfshop.com/](https://sonlightsurfshop.com/) or here [https://norcalsurfshop.com/](https://norcalsurfshop.com/) 

Sonlight folks are very nice and I recommend them, but they're located near the north (unbeginner friendly) end of the beach, so you'll need to drive the board down to the south side of the beach if you rent from them. Norcal you can carry a board straight to the ocean.",1614900233,11,0
I don’t believe being poor or on government benefits excludes you from general traffic rules. I saw someone recommend an emergency loan through CalCentral so that’s most likely your best bet. Good luck with it! 🤞,1614900164,4,0
"Please stop taking things I say out of context.  I apologize if I'm not articulating them precisely.  It is not cutthroat to apply to internships and further yourself.  This is not the same as continuously spinning the narrative that every single student is getting tons of opportunities besides the ""terrible"" ones.  That is not productive and it is part of the intimidation that exists in the Berkeley community.  It's not someone's fault if they are in that headspace and need to talk to someone, but there are healthy ways to talk about it and there are ways which spread that misconception to others.

It's great and very rewarding to work hard and get a strong CV/transcript out of your time at Berkeley.  That is what my focus was and I feel very satisfied from it.  It's not my role to make a value judgement of the people who didn't get as strong a CV out of Berkeley.  That can be your role if you want, I'm just gonna ask you to take it to another community and to come here with more supportive rhetoric.",1614899995,3,0
"If you haven’t looked into cross campus enrollment it might be worth doing so. Not sure what’s open for the summer, but there’s a lot of awesome classes available through other UCs that tend to be extremely easy",1614899984,2,0
