body,created_utc,score,total_awards_received
[removed],1631514505,1,0
[removed],1631514505,1,0
This isn’t really true. The Hilfinger averages are lower and he writes his tests in a pretty different way,1631514231,1,0
We all know you 🤥 lying,1631514226,5,0
Cheese n stuff,1631514220,18,0
"same, feeling really bad.",1631514159,4,0
"1.  That may be true, but it's hard to believe that Michigan spends almost $3 billion on research annually and ""accomplishes nothing""
2. Sports do matter. University is about development; social, personal, academic, professional, and athletic (for student-athletes) development. If Cal is going to field sports teams, at least develop them. 
3. None of that matters for US News National Rankings. UCLA has 270 Olympic medals, Cal has 223 despite being 50 years older and with more sports. 26 elements? 16 and if u wanna count the livermore elements, thats 22. 
4. Bruh, Olympic Village is gonna be in UCLA's dorms. All the Olympians will witness UCLA's campus, which will definitely have a HUGE impact on not only recruiting athletes, but coaches, and will bring even more publicity to an already popular campus. You dont think this will benefit Ucla in terms of applications and donations and shit? The last time the Olympics was in LA ( 1984), UCLA athletes won 37 medals!!!! Something Cal could never do. 
5. Rankings dont lie
6. Berkeley is the public version of UChicago... small endowment, trash sports, research oriented.",1631513887,-6,0
i should've signed up but i forgor 💀,1631513719,1,0
Thanks! You too :D,1631513661,5,0
He took some German in CC. I thought he just stared but I just double checked. He says he really likes his GSI. And says it is going well.,1631513600,2,0
"Skydeck startups are often looking for ppl, but they may not pay much or at all. You could look for some kind of skydeck startup fair or an event to that effect.

Otherwise, there are more typical companies in the Bay Area you can find on handshake/google. There's not nearly as many that hire in the school year though, so you may not find many of interest to you.",1631513585,2,0
man idk i just got rejected too. i just wanted to volunteer w the homeless smh,1631513573,7,0
where can we find pottery classes? :o,1631513562,2,0
First thing I did was send that Forbes article to my most boisterous UCLA friends.  And one works at Cal!  She wonders why someone broke her UCLA alum plate off her car 🤦🏻‍♀️,1631513537,-9,0
[removed],1631513532,1,0
c sesh ended and school hasn't started yet so I have some free time,1631513526,1,0
"If 't be true thee wend to oh with an exam question tas holp thee with the answers

***



^(I am a bot and I swapp'd some of thy words with Shakespeare words.)

Commands: `!ShakespeareInsult`, `!fordo`, `!optout`",1631513508,-4,0
Handshake,1631513497,6,0
If you go to OH with an exam question TAs help you with the answers,1631513492,2,0
idk if this is true but I've heard people say that hug's exams are a bit trickier so u can practice on those instead,1631513469,5,0
"Actually Forbes just ranked cal #1.  Take that, USNews!",1631513463,5,0
I just tell them that I'd rather die than join. Seems to do the trick.,1631513319,5,0
[https://hkn.eecs.berkeley.edu/exams/course/cs/61b](https://sp21.datastructur.es/resources.html) this is from the HKN website,1631513254,3,0
did any of the rankings change from last year?,1631513240,2,0
i'll do it 💈👍,1631513139,1,0
Don’t be triggered ucla kid. What are you doing lurking around on here anyways…,1631513071,1,0
That’s awesome does he have any prior experience?,1631513001,1,0
Bro jstris groups any time????,1631512983,1,0
"I’m not exactly sure. I’ve only been there for dinner, so sorry. I 100% recommend the short ribs though, regardless of what time of day you’re going.",1631512966,4,0
Ah thank you so much for this response!! Japanese is the main language that I was asking about so your experiences are super helpful for me. Good luck in your studies!,1631512846,1,0
I second this. I withdrew back in 2017 and this is my first semester back. You grow so much in the time you spend away and if you aren’t feeling in it and up to what you’ve signed up for there’s no shame in bowing out. UC Berkeley isn’t going anywhere. You’re gonna do alright :),1631512837,30,0
What are the items for that Kbbq special?,1631512801,2,0
Because they want to know and no one's answering them,1631512792,9,0
"CS and bio interface pretty well. Bioinformatics is one of the mothers of what we now call data science. If you want to support this kind of shit go for it, it's a very exciting time for bio (though historically underpaid due to glut of PhDs.)",1631512515,3,0
"Bro, no one is arguing that the focus shouldn’t be on men’s behavior and targeting them in battling rape culture. Again, I never fucking disagreed with that. But you acting like there is no benefit in educating women because you are think we are going to fix this problem in a semester is just stupid. Assuming that all women know what I said above. Uh did you not get the warnme’s where two drunk freshman girls almost got kidnapped outside unit 1 because they walked home themselves at 2 am, do you not hear about woman accepting drinks from people they consider friends and getting roofied, just because something is common knowledge to you doesn’t mean it is to everyone. Wholeheartedly agree, have the conversation with men to combat slut-shaming, victim-blaming, etc. but to just let women be naive in the meantime is wrong. Maybe an analogy you’ll understand is people shouldn’t steal, we should teach and focus on criminals to not steal, but we still teach new drivers to lock our cars the second we get out, to not leave items in the back seat, etc. u get it",1631512408,2,0
Yeah for me cs61b was a serious struggle. I got a B- in 61a and then in 61b gitlet came and I just couldn’t do it (luckily that semester had a late drop). So I late dropped that class and did it all over again with cs61bl (which had gitlet again) and managed an A in that class. Something about the increased labs and group projects finally helped me click into gear. Not saying that should be what you do OP but it is to say that there are other options and in my case late dropping and redoing over summer worked out nicely.,1631512353,1,0
cope lol,1631512325,-1,0
Don't tell them about the engineering library 🤢,1631511927,5,0
"Cal Community Music!

Also for people interested in bio: BMES, iGEM (it has an application but if you're new you can get on the training team and get on an experimental team the following semester), TMSCA",1631511818,4,0
With scissors.,1631511774,3,0
Just a friendly reminder that meal prepping is a thing,1631511602,30,0
slivers is a little further down telegraph but if you can grab it to go i’d def recommend! $3 for a decent slice + sliver of pizza,1631511468,13,0
"Again: Women are told this shit. No one needs to launch a campaign to tell them this shit. They're told this shit through and through, to the point that if they are assaulted they're asked why they didn't ""avoid"" rape well enough.

You know what isn't done? Telling men that assault is unacceptable. There isn't enough social pressure on the tiny minority of rapists to not rape anyone in the first place. The more socially unacceptable assaultive behavior becomes, the more rare it becomes and the less likely that it goes uncorrected. This isn't my opinion — tons of research backs that up.

Instead of focusing on telling women shit they've already heard over and over again, start focusing on asking frat boys why they don't police their own members more. Start condemning people who assault others — start insisting to the schools, the frats, the employers, the community that rapists are convicted. 

Rape avoidance isn't rape prevention. Talk to potential victims all you want, but until you start talking to potential abusers and the people who enable them, you're not preventing rape.

All that crap you repeated? You repeated it because you've learned it by heart. That's great, now you know it. Now go further. Start learning how to talk to men about what \*they\* should be doing. Should \*they\* be drinking that much? Should they be creating unsafe conditions in their own homes? Should they be ignoring/enabling rapists? Be a little more radical.

I hesitate to even say men/women because I think men are the victims of rape far more than we're yet aware of. And women can be abusers, too. But right now, in most cases we know of, men rape women. It's a tiny minority of men, though, and the vast majority of men can do an awful lot to change the culture. We just need to start talking about it as their responsibility, too.

That's all I'm going to say about this. Instead of endlessly defending yourself against some non-existent accusations, just consider what I'm saying and start thinking about this issue in a new way. How you talk about this matters. You've offered multiple strategies for avoiding becoming a victim. Now start offering strategies for preventing assault from even happening in the first place. If you stop assuming that that part of the equation is hopeless and unsolvable, you'll start realizing that solutions are all around us.",1631511404,0,0
"&gt;go on outdoor adventures, hike

may i point you to [CHAOS](https://www.chaosberkeley.org/)?",1631511391,2,0
"Hahahahahahahahaha…..

1. Even if what you’re saying is true higher expenditure does not imply better research. You can spend a lot of money and accomplish nothing. 

2. Elite sports? Really? Bro you’re going to school for a degree so you can get a job. You are not in college to drink beer and tailgate. Good sports teams are great but have nothing to do with the quality of your education….

3. No one is going to catch ucla? Really. They have less Nobel laureates, Fields Medalists, Turing Award recipients, Wolf Prize Winners, Fulbright Scholars, Guggenheim fellows, Rhodes scholars etc… Berkeley retains academic prestige over just about every college in America save for Stanford, MIT, Harvard, and Princeton. Ucla even has less Olympic medals. Berkeley alums discovered 26 elements, started 2/5 largest companies by revenue in history, invented most of the internet protocols, invented flu vaccines, crispr cas9 etc… in what way are we behind 

4. “The Olympics in La will lead to more money and national championships for ucla”  - bro wtf are you smoking Los Angeles is not the same thing as UCLA 

5. UCLA hospital (ie David Geffen) &lt; UCSF &lt; Stanford &lt; Cedars Sinai &lt; The Cleveland clinic &lt; The Mayo Clinic 

6. UCLA will be the public version of Stanford… then I guess Berkeley is the public version of MIT + Harvard",1631511139,1,0
"Great, thank you so much for the detailed answer!",1631510937,1,0
Depends on appetite I guess :),1631510882,7,0
oh i see - for me id need at least 3 lol,1631510858,11,0
Idk for me a $4 meal is pretty good,1631510828,7,0
four dollar hot dogs ain’t cheap mannn,1631510791,12,0
Top Dog,1631510051,0,0
"Everyone shit-talks Hufflepuff, but we're here when you need us and we take anyone.",1631509956,4,0
"If you like to draw, illustrate, panel, or write comics in any fashion, try the Comics Studio Club! We just had a small in person meet up and plan to hold another one where we actually put our pens to paper (or tablet). I also brought mooncakes to enjoy. 

This invite to our discord expires in a week. https://discord.gg/fJmV2cXT",1631509659,14,0
"In case you don't know, Evergreen Valley College offers a course named ""COMSC 78 : Structure and Interpretation of Computer Programs"" and Laney College offers ""CIS 61"" They both are fully articulated (check [assist.org](https://assist.org)) meaning after you finish the course there, you can transfer the credit here and you don't have to take CS61A in order to declare CS. Same thing with CS61B. But for CS70, as far as I know, there isn't articulated course for CS70 at California Community College.",1631509647,6,0
"No one ever said moral high ground. I don’t think I’m better than someone who drinks, I do however, think I’m better than someone who pressures others to drink or uses alcohol to manipulate those more naive. 

“Just because some people take advantage of women.” Taken advantage is a polite way of referencing the brutal physical and mental abuse of a women through an act of violation that causes life-long trauma usually. Taken advantage has led women to take their own lives, afraid to ever form relationships or intimacy and can led to life-long consequences like a child. So if you and some people need to stop partying until you change the drinking culture so it doesn’t lead to the violation of women then you can put your fucking drink down.

Edit: also I totally agree with your second paragraph. Your comments suggest that you like to party and drink and I’d like to know how you participate in the events you listed in the second paragraph. Are you a part of these organizations? Do you confront guys that prey on inebriated girls?",1631509523,1,0
"Steve’s KBBQ lunch special

Berkeley Student Food Collective

Food Pantry (will need to meal prep)",1631509521,23,0
Chipotle bowl + 3 tortillas is easily 3 meals,1631509510,14,0
"Pappys has a student meal for 8. Chipotles expensive but the food can last a few meals if you plan it right. Steves BBQ, cheap lunch special. Some boba places, they have snacks that can be filling. Berkeley food pantrys got free food. If you qualify, Calfresh!",1631509503,50,0
"http://thegreekberkeley.com/wp-content/uploads/sites/2/2021/07/GAMap_MASTER_2021-01.png

They uploaded a pic of GA",1631509295,1,0
Gypsy’s has good portions for cheap,1631509265,13,0
Im down,1631508973,1,0
Are we sure that the GA tickets are truly GA? Are there gonna be seats or is it just one big open dance floor?,1631508935,1,0
"Good luck, all the best! You can come back whenever youre ready, and dont feel pressure to if life takes you somewhere else. I came back 2 years later and am about to graduate, one of my friends didnt and theyre doing great at the new school they love. Take care",1631508908,19,0
"i found 4 designs here for cal engineering, maybe theres from other colleges/majors as well? https://shopcollegewear.com/pages/search-results-page?q=engineering",1631508547,4,0
Lets go! Ill pm,1631508499,1,0
"I don’t know if you edited your post afterwords but I missed your second paragraph. People are allowed to have fun. Is everyone just supposed to stop hosting parties now because some people might take advantage of young women? 

You deal with that by fostering a culture of consent, calling out bad behavior when you see it, punishing those that cross the line, punishing organizations that systemically enable rape and sexual assault, etc.

If it’s not your scene that’s completely fine. Find people who are like you. But you don’t have any moral high ground on those who do like to drink and party.",1631508277,0,0
I’m majoring in philosophy as a double major and it’s pretty doable. afaik you don’t have to major in anything specific for med school as long as you follow a certain track and take required classes. Do consider double majoring or minoring in philosophy it’s really enlightening,1631508157,1,0
Anyone who applied for cs for fall 2020 admission got an email for a free shirt/coaster set,1631508076,10,0
"check your emails, sometimes they do free shirt giveaways, or maybe prizes for attending specific department events",1631507967,7,0
"the game has campanile and sather, and then it's a bunch of randomness inbetween",1631507864,8,0
"I would be super down. I love Louis the Child! FYI, I'm a 23 y/o transfer student",1631507835,1,0
"Damn, 90-100%? How? Need tips, for real. Have no idea how to approach coding questions.",1631507301,2,0
"You can go mostly 10 points or less on every exam and still get a pass in the class. Id say if you go pretty low on one midterm you can still get a good grade, getting all points on everything else and any extra credit offered makes it hard to fail and theres always the next exams to improve to get that CS gpa. Also, partial points on tests can get you further than you expect. Dont give up now!",1631507042,7,0
"I feel you, bro. I don't even know if CS is my path.",1631506978,11,0
"why exactly do you spam ""what is consulting""?",1631506957,0,0
"Taking these practice MTs has revealed that I do not belong in CS classes at Berkeley. Averaging a 20-40% on MTs. Seem more like an IQ test / Math olympiad contest than an actual evaluation of our coding abilities. 

Will be dropping regardless of my score as all of my friends have told me it only gets worse from here.",1631506895,25,0
"lotta ppl here going on about forbes and ucla being #1.

ill let you in on a secret enlightening tip; all of these rankings are arbitrary and make no sense, so they're all worthless.

you know what, quantitatively, we are number 1 in? nobel laureates.",1631506655,110,0
Boo US news. Bruins fucking suck!,1631506210,11,0
I’ve seen berkeley engineering at Fall Rush! And other majors,1631506203,14,0
Hey what's  consulting?,1631505969,2,0
"The dilation was terrible. A student dilated me, then shined bright lights into my eyes, then called their attending to come over and shine more bright lights in my eyes, then the attending called a bunch of other students and there was more shining bright lights in my eyes. It was almost painful and I started to tear up. Other parts of the comprehensive exam were routine. If you go to Berkeley Optometry, voice your discomfort if you find their actions unnecessary. Ask the attending to take a look at your dilated eyes again if needed, and that you do not consent to further use of you as an example to their students.",1631505904,1,0
"26 back after a withdrawal, balding doesn't  help me feel any younger",1631505793,1,0
"I completely agree. CS clubs have a pretty toxic selection process and you should not judge your worth based on this. For reference, I have gotten TA positions, research at bair, faang offers, etc. but have gotten rejected from every club I had to apply to. To find a good community, all you have to do is find a passion and pursue it and you will be able to find people of similar interests willing to support you along the way.",1631505780,1,0
What are consulting clubs?,1631505703,1,0
"Fuck the clubs here, they were too exclusive my first pass through 2013-2016 and it no better today.",1631505609,1,0
"Is it? Oh well, good thing I only get cuts every 6 years! My hair is super duper thick though, so it takes a looong time to cut. (And bleach, which I most definitely only do at home now.)",1631505586,1,0
[deleted],1631505509,1,0
"It’s a comparison, you heard of it? Not a literal 40 year old. Just to show that just because something is legal it’s not ethically ok. It’s not even fucking legal because 21 but that’s insignificant here. 

Worry about myself. Yeah I am but as a person with fucking emotions and a voice, I worry for the safety of my peers. This post isn’t even about parties per say but clubs but if you want to talk about toxic party culture that’s fine too.

Also no ones “judging” freshman girls for getting roped into drinking and party culture. I’m judging the two three four year older frat guys that literally throw frat parties during GBO to pray on freshman girls tf.

And are you not going to acknowledge the connection between rape and party culture? The fact that you can’t even talk about it shows your lack of understanding.",1631505446,1,0
That plaza people skate at below mlk has outlets  scattered  everywhere. The terrace outside evans has some outlets. There are some nice outlets at some of the benches outside of the terrible brutalist  concrete building that has a mini dining hall at the bottom.,1631505414,1,0
"someone's been to AFX/ski club.

but anyway, if it's a club i dont think you need to drink. just say you dont want to.",1631505319,1,0
Wat. $60?! That’s insane. I pay $35-45 for a professional cut for rather very long hair!,1631505287,0,0
Ugh I’m so sorry friend! I hate how they blast your dead name to everyone… talk to registrar about it and they’ll fix your name everywhere. Being trans is hard. I’m here for you!,1631505258,3,0
"Congratulations! Withdrawl was an excellent decision for me. Take time to work on yourself and your health. After 4.5 years I'm  happy to be back on campus, you don't  have to be anywhere at anypoint.",1631505225,66,0
What kind of 40 year old is hanging out at college parties? Sure they haven’t completely matured but it’s just part of the process of growing up and finding out your place in the world. Worry about yourself instead of judging others for having fun.,1631505224,1,0
That’s why you sign up for ATT,1631505187,1,0
"It actually pretty much is fake news. Check out Malcolm Gladwell’s recent takedown of US News. It was glorious. 

https://podcasts.apple.com/us/podcast/revisionist-history/id1119389968?i=1000527176172",1631505183,13,0
Fuck eduroam it never worked for me,1631505171,2,0
Bruh I want an engineering shirt and a CS shirt.,1631505168,2,0
"Go beaaaaaarzzzzzzz

Also I like UCI",1631505144,4,0
What is consulting?,1631505143,1,0
That was literally the only thing I edited,1636743240,26,0
I love the U in sun,1636743200,13,0
Physics building,1636743169,19,0
In my mind.,1636742678,109,0
"If it'll help you and your future goals, then I think you should do it. If you find the math classes fun, all the better!",1636742656,1,0
I spent way too long editing this photo,1636742588,43,1
The most unrealistic part about this is that the free hot chocolate had no line,1636742196,25,0
Go bears,1636741709,2,0
[deleted],1636741214,1,0
10 points above the average,1636740923,2,0
Old Kan in Jack London,1636740850,1,0
your friendly local sports bar?,1636739947,1,0
moffit is open until 10 right?,1636739806,1,0
"Other than VLSB, which other libraries are open late?",1636739741,1,0
"I heard Elon Musk personally came to campus and shook people's hands saying ""You're Hired!"".",1636739738,33,0
I honestly think that this is your fault. You should have contacted the professor/TA before you have missed the classes. You knew that you will miss the classes in advance and there is an assignment due. You should have made arrangements before the HW deadline.,1636739648,1,0
Yeah I had a terrible &amp; TERRIFYING experience in the Doe Bathroom but I would give you something Sweet &amp; Sour there : ),1636738951,1,0
"Devon?!  
This be amp  
: )",1636738893,0,0
"The SAT is actually a great experience. The score you get is not a ranking that reflects your Strong-or-weak mental intelligence, but rather a Number that has meaning specific to your Personality.",1636738868,1,0
"s \*morale  
See my comment on Carol Christ's post at the top. Love you",1636738797,1,0
Melissa? This Amp,1636738766,0,0
"I would Discipline you babe! See my post to Carol Christ at the top of the thread.  
I live in Oakland, CA, near Lake Merritt.

Send me your name and number.",1636738656,1,0
"Hey lady see my post to Carol Christ above and give me a text, call or email. : )",1636738367,0,0
[removed],1636738337,1,0
It doesn't help you now but it helps the classes be larger to begin with since they can have more seats by hiring more staff,1636738323,1,0
"Seats open up at adjustment time, generally speaking.  However, as mentioned above, it depends on the department/major and the class.  Some open up earlier, some don’t open up at all. Classes where Enrollment Permission is required, those seats generally do not open up.  The Enrollment Coordinators for each major have control of all of this.",1636737458,3,0
Also after the concert they just gave everyone a job for after graduation.,1636736654,46,0
Zone or ZZZZ's?,1636736644,4,0
"I might have mentioned this story before, but here goes:  January 2019, my kid (a freshman at the time) and I are in Las Vegas for the Consumer Electronics Show.  Two days prior, the Chicago Bears lost a heartbreaking playoff game where the kicker hit not one but two goalposts on the final play of the game. We’re walking down the aisle and someone approaches us and says “Go Bears!”.  The first thought in my mind was that this guy was rubbing it in and I wasn’t too happy about that and kinda muttered to him to go fuck off.  Then I realized my kid was wearing a Cal sweatshirt. Oops.",1636736305,3,0
Heck yes. Go Bears!,1636734321,2,0
I got mine at Safeway and it was free. I have SHIP.,1636731902,5,0
Ok thanks!,1636731475,1,0
"they’re saying that they’re not declared in the particular major. The seats are currently reserved for declared majors, but they don’t qualify for a reserved seat, so they want to know when they could be eligible to get off the waitlist",1636730098,1,0
"Are you allowed to cheer for your kid (who is a bear)?  Yeah, as an alum AND the parent of an alum, I say YES",1636730063,2,0
Was on a hike wearing a cal shirt and some dude walks by and says “Go Berkeley!”  I did not respond.,1636730026,5,0
"You’ve been playing that new Forza too, haven’t you?",1636729728,15,0
"The course's title is due to [this textbook](https://web.mit.edu/alexmv/6.037/sicp.pdf) which has widely been considered one of the best intro CS textbooks for the past 20 years. John DeNero himself was actually responsible for switching it over to python, and there was [some](https://news.ycombinator.com/item?id=14627137) [debate](https://people.eecs.berkeley.edu/~bh/proglang.html) about this change within the department which I believe lead to the creation of CS61AS, which is still taught in Lisp. Kind of interesting historical tidbit.",1636729001,1,0
