title,selftext,created_utc,score,total_awards_received
Does anybody read the campus emails?,"The ones from the office of the vice chancellor, or Carol, or other ones along those lines. I get one like every day it seems, and I never read them. At this point, I just straight delete them.",1613762522,1,0
English R1A&amp;B,I plan on completing R1A at my local cc over the summer. Am I still allowed to enroll for R1B for next semester?,1613762273,1,0
CS61B Help!!!,"Okay so I made a REALLY BIG conceptual error on my Project 1 but I passed all the doctests on gradescope. If we did that, do we get full credit or are they gonna go back and look through my code. Like I’m not sure how I managed to pass all the tests given that my code was not correct 💀💀",1613759057,1,0
When do we start picking classes for fall 2020?,I’m a rising sophomore and I’m starting to plan ahead.,1613757601,1,0
[Poll] how long do you study per week?,"

[View Poll](https://www.reddit.com/poll/lnhzkb)",1613747107,1,0
Fried Chicken in Berkeley?,Does anyone know where to get good fried chicken in Berkeley? (near southside or the downtown area),1613731024,1,0
Study Guides and Strategies,,1613727193,1,0
whats ur avg workload? stressed (maybe double) major + minor student:(,"sorry for kinda long post: im a freshman, declared music major and intended math minor, thinking of adding art major. 

before considering the art major, i was planning out my schedule and saw i could graduate a semester early even with the added minor given i do a bit of summer courses which is fine (i think). this is pretty good for me since im going to be paying for my tuition housing etc. by myself and dont really get aid, so getting out of paying $9k would still help me out. my avg workload would be around 16-20 units per sem, maybe 4-8 during summers.

adding the art major, and if i started literally right now, id still be able to graduate a semester early with closer to 20+ units (5-6 classes) every sem and 8-12 units during summers. 

i just wanted to know if i’m going to die or at least how this workload compares to alot of you guys? i know music and art aren’t “as hard” as stem majors so it would seem doable but theres still a ton of classes to take; i recently considered adding a second major to get a little more job opportunities, i know music alone realistically wont get me much and i figured if i have the time to add art (which i like! not taking just because) i should go for it. thoughts?",1613725814,1,0
I am looking for help with a videography project on campus. Can someone help me?,Does anyone have any great clips of the campus? or can someone help me shoot a video on campus?,1613725726,1,0
Replacement for EE16A/EE16B,I’m really not tryna take these classes. Is there any cc class I can take instead in california (or online) to waive these requirements? If not is there any chance EE16A will be offered this summer? I’ve checked the academic guide and it doesn’t seem hopeful.,1613724528,1,0
whats the dorming experience like for sophomores?,curious to know what it wud be like for freshman who didnt get to dorm this yr to dorm next yr? any recommended buildings/room types?,1613720248,1,0
whats the dorming experience like sophomores?,curious to know what it wud be like for freshman who didnt get to dorm this yr to dorm next yr? any recommended buildings/room types?,1613719894,1,0
me throughout my entire academic career,,1613718686,1,0
dreading the thought of moving back to campus,"ik its too early to tell, but i'm so anxious about having to move back to campus in the fall. Or even worse: summer. I'm scared that when I go back I'll revert to being unhappy and isolated again. And I want to say with certainty that this is going to happen.

I'll be a senior next year. All of my previous roommates have already graduated. And my dumbass has made no other friends in the 1 3/4 years of pre-covid college. i've done this to my self, but just thinking about the isolation, the silent walk to and from class, and the thought of me huddled up in my room with no one to talk to for 12+ hours has been making me cry for the past few days. This is how it was during my first year here and I'm so scared its going to happen again.  

I hate myself for feeling upset when the covid cases are coming down. But, i really cannot see how i'll not be a depressed pile of shit if i go back to campus. Ig its easier to be miserable at home, cause at least there's food and people around me. 

And I don't have a choice either, if campus open, I'd have to go for ECs/ research and stuff. sadly, its a lost case.",1613717137,1,0
Summer Classes,"Hey! I’m a first year EECS major. I took 61a, math53 and r1a in the first semester and i’m taking 61b eecs16a and r1b right now. I need to take 6 units during the summer. Is there any recommendations for which classes I should choose cause I have no idea.",1613716710,1,0
Any bioengineering Transfers willing to chat in dms?,"\^ Please respond if you know someone or are someone who is a bioengineering transfer, I just have a few questions as an applicant. Thanks",1613715018,1,0
It should be unconstitutional for professors to use presentation slides for lectures,"Bros be speedrunning thru these slides faster than you can take notes cos all they gotta do is speak it, the profs that write as they lecture are blessed",1613714189,1,0
Confused about declaring for econ.. I will be completing my requirements for admission this semester. By when should I apply? (Specifics below),"- I currently have an accumulation of less than 80 units
- Entered Berkeley as a freshman

.. I read the guidelines and requirements on the Econ/Berkeley website but im still a little confused.. Thanks in advance for any help! I’ll include link below for the guidelines 

https://www.econ.berkeley.edu/undergrad/prospective",1613714100,1,0
Changing CalID,"So I made my cal ID something that doesn't have my name in it and I think that after I graduate, I would want a berkeley email that has my name, so should I attempt to change my Cal ID while I am a student? I heard that they give you one shot to change your cal ID, but will it mess up classes that I am in right now?",1613711399,1,0
how to watch 10 lectures in one night?,:(,1613709357,1,0
Should this school allow trans to compete with women in sports and steal their records?,"

[View Poll](https://www.reddit.com/poll/ln61wt)",1613706992,1,0
Looking for a tutor who can help with CS61b project tonight.,"Well paid! Save my friend's life, please! DM me if you are available.",1613704656,1,0
CS 61a meme,"&amp;#x200B;

*Processing img luf8at6roci61...*",1613703943,1,0
"TIL: There are more declared computer science L&amp;S students than students who put ""intending CS"" on the application",Makes you wonder what the % success rate of declaring is for the students who were intending CS from HS,1613703905,1,0
162 midterm,"

[View Poll](https://www.reddit.com/poll/ln4xg1)",1613703617,1,0
Does the UC Berkeley title help post graduation? Question for alumni,,1613703285,1,0
F's for 162 Midterm,So long and no time. Can I get a P/NP?,1613702259,1,0
"I’m fucking lonely, down, and straight up feeling like shit",^^^,1613700401,1,0
Cal is treating students living in residence halls as second-class citizens,"Even now that the lockdown is over in the dorms, the administration is still viewing dorm residents with suspicion and not allowing them access to the same on-campus facilities as people living off campus. The entire rhetoric about the situation these past weeks is that the dorms have been the epicenter of the covid outbreak—this is completely untrue and covid absolutely spread within the people living off campus just as much or more than on campus. In fact, in a way living in the dorms provides more reassurance that you're not infected because everyone is required to get tested twice a week, whereas if you're off campus there's no such requirement. It's insulting that the university is continuing to view living in the dorms as riskier than living off campus when everyone in the dorms has had to get multiple negative covid tests and stop all social interactions and parties for two weeks.",1613697542,1,0
Does $0 EFC help in the housing lottery for continuing students?,"I know it helped last year, but does it still help this year?",1617059352,1,0
Feasibility of a finance pathway as a declared Math major?,"CONTEXT:

I got accepted for 25' into L&amp;S. I've been to Berkeley a couple times amd in campus once, but I swear my mind has been there for like 5 years (I feel so special to be able to attend your school :])

INTRO AND REASONS:

So, I've always loved math. Hence, I declared a math major in my UC app. However, I want to prepare myself for a the labor fields which I could be exposed to. I am especially interested in finance, since many of my close friends are really into trading, investing and hedging, and I find it awfully interested to. Right now (and I am more than aware this is likely to change) the career I'm aiming for is quantitative finance.

I also love getting involved in school affairs. It feels amazing when I feel like I am part of what makes my school a great one, and having been head of finance for my highschool's student association, I aspire to get involved with the ASUC CFO Office, headed by the CFO of course. 

QUESTIONS REGARDING ASUC:

I've read the bylaws regarding the duties and election of the CFO, and I got the idea that they get appointed for their merits within the ASUC CFO Office. I read Chief David Wang's brief intro on the ASUC website, so (question number 1) would involvement in business and entrepreneurship clubs be enough to prepare me for work within the ASUC CFO Office? (question number 2) If not, then what would make me stand out when applying for, say, an internship in the CFO Office?And finally (question number 3), assuming I'll learn a lot in the CFO Office, will it be ""useful"" (at least loosely related) to the field of quantitative finance? 

I did notice im the bylaws that the CFO is responsible for overseeing investments, which is the closest thing I found to that area of study.

I'm not saying I aspire to become CFO one day, as that would be very presumptuous, but I certainly want to get involved in something finance related and in ASUC. Having said that (question number 4), when is the optimum time to get involved with ASUC in order to maximize the amount of things I learn and the impact I can have in the organization? And if the answer is ""ASAP"", then should I prepare my cover letter, CV and LinkedIn right now so I can waltz down to the ASUC office and apply as soon as classes start? 

And finally, is there anything else I can do to prepare myself for such a position? 

QUESTIONS REGARDING MY MAJOR:

As I said, I am a declared Math major. These questions are simpler.

(1) Is there any program that is a better fit for the field of quantitative finance, considering how much I love math (to the point where I was seriously considering going into academia for pure mathematics)? 

(2) What is the process of changing majors, or where can I find information about it?

(3) How does the credit system work for classes (don't judge me lol, I'm seriously lost here)?

(4) Is it feasible to, say, get a bachelor's in math and a master's in finance? 

(4.1) If so, how would it work with the ""credit system"", would I have so many overlapping classws that I'd only need to study one more year or are the required classes completely non-overlapping? 

(4.2) Am I underestimating the field of finance (even if I only need enough knowledge to become a quant?

THANKS LOL:

Thank you so much, and feel free to correct me on any false assumptions I made. I only know this info from online research, but I'd love to know more about the inner workings at Cal :)",1617057647,1,0
Is there a preferred entrance to UCB campus?,"I'm looking for off-campus apartments and I'm wondering which entrance to campus is generally preferred by students. Obviously it depends on where your classes are, but I've noticed that most of the on-campus apartments and dorms are closest to the Southside of campus. Is this the most common entrance?",1617057284,1,0
Physics 8A over the summer,"Has anyone here taken Physics 8A over the summer and could possibly comment on its difficult/time commitment? I was looking at the schedule planner, and the class seems like a LOT more than I expected.",1617056904,1,0
What is graduation regalia?,What is a stole? Does your major have a specific one? Do they provide it? Does everyone get one? Do I order my own? What other custom things do you like to wear?,1617056461,1,0
Didn’t get Housing Offer 21-22,"I was hoping to get an on campus housing offer, but today got emailed saying I haven’t been offered housing through the first round. Should I be worried that I won’t get an offer at all. I’m a second year student, haven’t been on campus at all. What would be other options for housing?",1617056250,1,0
Housing,"I was hoping to get an on campus housing offer, but today got emailed saying I haven’t been offered housing through the first round. Should I be worried that I won’t get an offer at all. I’m a second year student, haven’t been on campus at all. What would be other options for housing?",1617056190,1,0
When Professor Asks you if you are exicted to starting learning again this week...,"&amp;#x200B;

https://preview.redd.it/3cgfusmck1q61.png?width=298&amp;format=png&amp;auto=webp&amp;s=8ba1040b7faae3789e1a0e1bad5c90c1b984d041",1617056056,1,0
When Professor Asks you if you are exicted to starting learning again this week...,"&amp;#x200B;

https://preview.redd.it/w4gmghz0k1q61.png?width=296&amp;format=png&amp;auto=webp&amp;s=aa3d1da74012b8abc32f54b2b5f4606b01e4522b",1617055987,1,0
What computers do you guys use?,,1617055164,1,0
Didn’t get an housing offer gang,,1617054784,1,0
Recently Admitted and I want to speak to someone in the research department,I’m not sure if UCB actually has a research department but a while ago I finished my research paper which I want to continue and elaborate during my undergrad. Is it hard to get a stipend or funding for research? I heard UCB is incredibly competitive in the terms of research but can anyone advise me in this area? Or show me who to contact?,1617054758,1,0
BASE for Economics Students?,"Hello,

&amp;#x200B;

Is anyone here familiar with the Hass program BASE, can someone tell me more about it, and whether or not it would be worth it for an Econ major?",1617054342,1,0
Tang Services Available to Students not on SHIP,Does anyone know what Tang services are available to students not on SHIP? I know tang can set you up with an online doctor appointment which then connects you to a provider. As a student not on SHIP can I get an online appointment and get connected to a provider that is on my insurance? Thanks for any info!,1617052966,1,0
Can someone help me with my appeal to UCB for bioengineering?,"Hi! I got rejected from UCB for bioengineering and I really want to go to Cal. My GPA at the time was 4.43 which I know is low for engineering but I was very limited in the amount of APs I could take during my freshman, sophomore, and junior year. I didn't have any outstanding ECs like winning any competitions or anything but I explained myself by saying  I have 3 younger siblings to take care of with two working parents that are away from home 80% of the time.so I was pretty limited to what I could do. I had to drop some activities as my responsibilities increased. In my appeal I was going to talk about this 3-month mentorship program I did with 2 OBGYN from Cedars Sinai (hospital in Socal) and my increased familial responsibilities that now include taking care of my 98-year-old great aunt because we can not find a caretaker for her during the pandemic. I was wondering if anyone who was successful with their appeals could help me out. Thanks for reading!",1617052390,1,0
First Round of Housing Released 2021-22,I didn’t get a housing offer in the first round. Does anyone know the probability of me receiving housing in the next round/any more information about future housing releases?,1617050384,1,0
L&amp;S &gt; CNR for an incoming freshman,"Hey guys!

I was just accepted to UC Berkeley, which has been my dream school my whole life! Totally over the moon. So, I just had a quick question and was wondering if anyone could give any advice or has had a similar experience and could help me navigate.

I was accepted into the College of Letters &amp; Sciences and was planning on majoring in Environmental Economics and Policy or in Political Science. But, since I applied and have done a bit more research, I have found that I am more interested in the environmental side of policy and have decided that I want to transfer to the College of Natural Resources to major in Society &amp; Environment.

Does anyone know how feasible/doable it is to switch from L&amp;S over to CNR? Is there anything I should know before I attempt to transfer? Have any of you guys done this?

Please let me know! Appreciate it :)

Go bears!",1617048962,1,0
Covid passports are unconstitutional,,1617048240,1,0
I have the attention span of a rock,"Every time I try to catch up on lectures, I instead end up watching YouTube blooper videos of Patrick Dempsey and Ellen Pompeo on Grey’s Anatomy. FML.

At this rate I’m never gonna be an actual doctor LOL. Guess I’ll have to be content with watching Grey’s Anatomy (especially since it’ll never end).",1617047168,1,0
Chem 3A and L over summer,"I wanted to know how taking chem 3a and L over the summer was, like the difficulty and the workload.  I know it was kind of challenging last summer because it was not fully adapted to the remote settings but would this summer be better for the class, or is it still really fast and hard?",1617046620,1,0
Racism on campus,"https://vm.tiktok.com/ZMeyA8gLy/

I saw this tiktok on my for you page and it really caught me off guard. Growing up in northern california i always have seen Berkeley praised at liberal and accepting. I was really considering attending Berkeley this upcoming year but from the looks of this video and all the comments agreeing, I’m very unsure if I want to put myself in that environment. Are there any black students who have experienced something similar or completely different? Please let me know your experiences",1617045440,1,0
Appreciation post for this sub 💙💛,"Recently admitted bear here, I just wanted to say thank you to everyone on here for helping us new admits so much by answering questions and providing resources! I feel so welcome here, honestly such a positive vibe! Can't wait to start the upcoming school year and officially join you all on campus (:",1617044877,1,0
A lot of my friends are telling me to choose UCSB and UCLA over Berkeley.,"Many of my friends said it’s way too competitive and that the environment is toxic and that people will sabotage others. But on the other hand, people who actually attend Berkeley have told me they love it there. What is your opinion?",1617044541,1,0
"Missing Deadlines :&gt; Can anyone relate? Also, 61C makes me sad.","I recently found out one of my 61C projects never went through on Gradescope. I committed and pushed to GitHub on time. There's a timestamp along with my code on GitHub which serves as evidence that I finished the assignment before the deadline. However, Gradescope must have crashed or my wifi went out, it just never got submitted?? Between a few psets, 3 midterms, and another project due, I didn't check Gradescope to see if it went through properly and went on to study for my other classes. It took me until Spring Break to have the time to notice what had happened.  Because it never got submitted on Gradescope, the head TA is disregarding my code on GitHub and giving me a 0. Has anyone else experienced something like this or had a different outcome? How do other classes handle missing major assignments and deadlines or even midterms or finals? I would like to hear other experiences and feel less sad about this.",1617043517,1,0
Financial Aid Appeal,"Hi everyone!

I was recently admitted to Berkeley and will most likely attend. I was wondering if anybody had gone through the financial aid appeal process and if they could share any insights into the process. My family's income went down around $40,000 from what's on my FAFSA since my dad is an electrician and he was out of work for a good part of the year due to COVID. In the required documentation for appeals though, it asks for a letter of termination from an employer, which I cannot provide since he was not terminated and is self-employed. 

Obviously I plan on contacting the financial aid office but just wanted to see if anyone here could provide me with their experience. Thank you!",1617041739,1,0
$1220 SINGLE ROOM IN BERKELEY,"hey y’all!! my name is Sam (she/they) and me and two other individuals are looking for a fourth roommate for a house we are looking to rent! Room would be a single, with rent being about $1220 a month. Deposit is two months of rent. 

Prioritizing BIPOC &amp; Queer individuals!

Feel free to message me if you have any questions ⭐️❤️",1617038980,1,0
I am so SICK and TIRED of trying to connect with people on Zoom just for people to completely ignore me and to look like a complete goober,"I know, I’m tired too, but how much effort does it take?",1617038464,1,0
2021 Graduation News!,,1617038208,1,0
CS 61B vs. 61BL?,"Hey guys, how is the lab format different? Is it worth taking it as the lab format or waiting until the Fall to take it? Thank you!",1617038063,1,0
Is Cal going to be PNP in Fall 2021?,,1617036931,1,0
Graduate School,"I am a junior thinking about graduate school (MEng in CS).   
I had some questions about it.  


1. What's a good gpa for the top programs? (Berkeley, CMU, Cornell, etc) 
2. What all do they look for in your resume? For example, when you apply to the industry, they wish to see previous internships and independent projects in your resume. Similarly, what do Grad Schools look for in the resume?
3. Does being an undergrad at Berkeley help your application to other schools?",1617036340,1,0
waking up to realize you have class today,,1617035709,1,0
Does Berkeley have a good art program?,,1617028068,1,0
2021 Fall Solution for International Students,"Hi, everyone!

The campus has announced that the primary mode of instruction will be in-person. As an international student with several problems to get back on campus this fall semester (like visa and other issues), I wish I could gather others like me to discuss some solutions here. 

So, what is your plan to take the course which will probably be delivered in-person?

What is your plan if you can't get back on campus on time?",1617025132,1,0
Are computer science classes in Berkeley overcrowded?,"How many students are there in classes in the upper-division like ""CS 188. Introduction to Artificial Intelligence""?",1617022557,1,0
Berkeley Waitlist,"Hi guys,

I noticed that many applicants have been waitlisted this year and I was wondering if anyone has an idea of how many applicants were waitlisted by Berkeley this year. It seems this year in general schools are waitlisting more students.",1617020522,1,0
How to lessen student debt?,"I really really would like to commit to Cal but I’m from oos and I’d have around $170k in debt before financial aid and parent contribution (so more like around $80-$100k for me). Does anyone have any advice to lessen the amount of debt after graduation? I plan on getting a job asap and I have around $10k of my own money saved up, but are there any tips/life hacks to save money while in college + not be in as much debt once I graduate? I heard a few people were able to graduate  from cal oos with only $20-$30k in debt and I’m desperate for the secret lol",1617017197,1,0
The hellyeah guy,,1617014577,1,0
Accidentally unsubscribed from UCB WarnMe,How do I get myself subscribed again? I’d like to continue receiving police warnings from the UCPD. Thanks.,1617013896,1,0
is it difficult to change majors within CoE?,"Hi guys, I'm an intl. student from scandinavia, and im very happy to have been accepted to UCB. I'd just like to ask, I got admitted with Civil engineering as my chosen major; however, I'm hesitant to choose between it or mech eng. If I plan to change major to Mech eng, is it very difficult. By difficult, meaning many requirements or only gpa (but difficult to achieve high gpa)?",1617013827,1,0
is there a way to test out of a class?,i learn best if i self-study at my own pace. is there a way to receive credit for a class by just taking a single placement exam? like AP testing?,1617013114,1,0
Day 3 of receiving UCPD email,Idk what to say.,1617012430,1,0
mandatory attendance is the dumbest shit ever,"WHY must professors force their students into THEIR recommended study habits??
i do significantly better when i set time aside to do chunks of work. and sometimes i cant attend class because im simply not feeling well.
i cant come to your daily classes where we learn half of a topic and spend most of the time in silence in breakout rooms. 
what is the point in forcing us to go to class if we can learn the entire weeks content in an hour through recorded lectures?
if my work routine is literally better than the one you are forcing us into and im able to do well on assignments and tests, why should I not pass the class? 

-angry math 53 student",1617011720,1,0
