body,created_utc,score,total_awards_received
Do you think 126 takes the most time compared to 61c and 170? I am also in 61c and 170 rn so it would be nice to have a standard to compare to,1605166500,1,0
"I'm taking EECS 126 + CS61C + CS170 + a breadth this semester. CS186 is probably less work than CS61C and CS188 I know is a bit lighter than CS170, but R1B likely compensates the difference. I'd say it is doable if you are efficient with your time and don't have much other commitments besides those classes, but I'd definitely say I spent the vast majority of my waking hours on classes",1605165753,1,0
[box.berkeley.edu](https://box.berkeley.edu) \--&gt; 50gb cloud storage,1605165749,1,0
"Hang in there, we’re almost done. I’m struggling too. A lot. :)",1605165331,1,0
"Is it good? I saw it, but wasn't sure if it was worth my time.",1605165264,1,0
"Yeah, I loved his lectures.",1605164154,1,0
Yes.,1605164099,1,0
How many hrs/wk were most of your peers (and you) spending on class material a week outside of class? Thanks for the help! I greatly appreciate it,1605163986,1,0
"I took Math 53 with Sethian in Spring of 2015. I spent WAY TOO much time looking at the grade distributions from previous years.

Upside is that he believes in ""redemption"" and if you do better in the final than in the rest of your class you earned the grade you got in the final.",1605163918,1,0
I agree and I apologize if it seems like I was trying to be deceptive. I think maybe better a better example would be how he delayed the first midterm (on a whim) because we hadn’t covered enough content despite us already being a chapter ahead of Canic’s section. Stuff like that makes it very hard to balance our time and effectively prepare for midterms.,1605163789,1,0
wut,1602070155,1,0
So deserved :) Go Bears!,1602069839,1,0
"Yeah, this is a no-brainer if you follow biology at all.",1602069555,1,0
Stonks,1602069352,1,0
That's not how patents work!,1602069097,1,0
Really depends what you define as pioneer. Surely the dozens of scientists who were working on CRISPR before Doudna and Charpentier had ever heard of it (nevermind published on it) should also be called pioneers?,1602069064,1,0
"Oh and coincidentally immediately after the Twitter-sponsored metoo 'movement' got in full swing. Pinning CRISPR down to two people, regardless of their sex, is a disgace.",1602068921,1,0
Glad to see Feng Zhang wasn't included. The true pioneers of this work were Doudna and Charpentier and including Zhang would have been inappropiate,1602068127,1,0
Apparently this is the first time two women have shared a Nobel Prize. Absolutely incredible,1602067563,1,0
Amazing! And they left out Feng Zhang from MIT/ Broad so that battle is finally over. Big win for Berkeley!,1602067535,1,0
"Jennifer ""the gene editing gad"" Doudna",1602067519,1,0
"Holy moly, very well deserved! Amazing we have such brilliant faculty here and we're able to learn from true pioneers of the field",1602067429,1,0
"oh shit i honestly did not realize that was the case, thank you for letting me know!",1602066234,1,0
What gpa would you need ideally for the fifth year masters? I’m a transfer student and I got B- already in one of my cs classes in the summer I’m still trying to transition and adjust to the Berkeley rigor :(.,1602066047,1,0
"Berkeley prestige is not a bar to compare yourself against. Berkeley prestige is a shell that you grow into over the course of 4+ years.

You belong here by putting in the effort for that growth. It's not about what you are, it's about what you do.",1602064545,1,0
it looks so out of place in the middle of a field lol,1602064499,1,0
"One option I've read about is to shift your sleep schedule such that you are awake when no one else in your house is. Either wake later, take care of your parents during the day, and then focus on school at night, OR wake earlier (like 4AM), focus hardcore on school, and then take care of your parents and sleep very early.

This way, you can create the time block needed where the ONLY concern and your ONLY focus should be school.",1602064418,1,0
"&gt;I hope you are getting the love and support you need.

To those in the back of the class who don't know how to be on the giving side of this, here's a brief primer:

1. Give this to whoever you know and care about, regardless if you feel like they're a suicide risk. Very rarely does your assessment of others line up with what they're actually experiencing, especially something so hidden as this.

2. Give this CONSISTENTLY and PERSISTENTLY. Messages will be ignored, and it's personally socially convenient to give up and stop putting in effort to nonreciprocating individuals (**I am calling out all of you on this right now. I guarantee you've done this in the past 7 months.**). And your singular messages are up against a sea of internal thoughts pulling them down - increased volume is important to cut through the noise.

This is the shit that helps, not linking the Suicide Hotline at the last minute. It's an exact comparison to using masks vs ventilators to stop COVID-19.",1602064122,1,0
"&gt; I know it feels like a cop-out, but help yourself because this school won't.

Man, this all the way. Watch out for yourself, because in these times, no one else will.",1602063568,1,0
"to start: EAT MOTHERFUCKER EAT

physical health is the FOUNDATION to everything, no joke, full stop. 

Here is a way to conceptualize depression. 

Most people start the day with a full tank of gas. Depression is like starting every day with like, a water-bottle's worth of gasoline in the tank. In other words, to be able to make it, we are talking about energy management. This is true for everyone, but **especially important** for those of us with small energy tanks.

On a daily basis, you want to do the following:


- DO things that increase the energy in the tank (short term - this includes physical movement, seeing friends, staying hydrated)
- DON'T do things that decrease energy in the tank (poor sleep, poor hygiene, not eating)
- And with whatever energy is in the tank, *spend it on fewer things*. 

And this last point is pretty important. In your last line, you mentioned:
""I feel myself falling behind on all aspects at Berkeley. schoolwork, extracurriculars, and socializing.""

This is where you have to make a decision - what is the ONE thing you would choose to focus on and spend your limited energy to strive to be good at? Of course, you will be sacrificing opportunities with this decision, and it will suck, and it will feel like you'll regret it down the line. But having been through this hullaballoo, the worst regret of all is not achieving ANYTHING due to trying to achieve EVERYTHING by spending my limited energy in too many places. (Too many, being, like 3 things. Reduction to a single thing is important).",1602063403,1,0
Yep this is the same for 127,1602062715,1,0
"are you me 

---

Here is one perspective to try. Send an email to professors/GSIs at least to start the conversation and let them know what's happening - because down the line, when it's the end of the semester and it's time to talk to professors to ask for partial credit or otherwise to help you pass, you'll have a paper trail dating all the way back to October that you have been struggling and trying different solutions the entire time. 

One unfortunate reality is that you either need to be a mean green Terminator machine mowing down everything you need to do with power and sheer fucking will (unrealistic), or that there are simply no good solutions to solving the current situation. I have a list of things that I know work for me to help me improve, and COVID-19 causes me to toss out pretty much the entire list, replaced with shitty substituted compromises like ""work in the living room instead of your bedroom"" or ""call your friends (who are also too depressed to call back) in order to stay socially healthy"".",1602062254,1,0
I dont know what you're talking about lol. The last 4 semesters on BerkeleyTime shows that its \~3.3 average which is a B+. The overall average grade you see there includes from like 2013.,1602062166,1,0
"Yeah? I’m worried about the going home for spring break and coming back since it could possibly spread covid, so it seems like an understandable to shorten spring break and release us earlier/start us later to prevent that spread. But not everyone lives on campus. Not everyone will go out. Im sure the administration will choose what they feel is best.",1602062121,1,0
You’re not alone! Even my Professor admitted that she messed up a response to a student’s comment on BCourses with the wrong information from another class. She says that the horrible week with politics etc. had made her too distracted.,1602061551,1,0
😍,1602061508,1,0
Looked better before tbf,1602061299,1,0
"Yeah, we need to work on reclaiming the space for cars with greenery!  
Love this building, and was one of the best places to have a desk as a grad student.",1602061229,1,0
"It would be major dependent.  For example, EECS doesn’t have an official concentration AFAIK.  You just choose classes you want to focus in on.  Data Science has Domain Emphases, of which you have to choose one, although unofficially you can have more, for resume purposes.",1602060159,1,0
"I'm a freshman ChemE in Physics 7A rn. I took AP Physics my senior year of HS, and so far the class for me has been easy (but not the 1st midterm whatsoever), but I think that for others learning it for the first time, the pace is actually kinda fast (new topic per week essentially). Just be sure to really utilize GSIs is my main advice!",1602059750,1,0
Thank you!,1602059659,1,0
"So if you’re at -1 on MT1, a B is roughly -0.5, so assuming that MT2 has the same weight as MT1, you need the mean (0.0) to go back to -0.5.  So sure, B or B+ is definitely doable.",1602059137,1,0
that's what I assumed but then why does cs 170 specifically have a B average when virtually every other EECS upper div has a B+ average?,1602059074,1,0
msg me op! im down to virtually hang out,1602058520,1,0
I think most EECS upperdivs is curved to a 3.3. So the mean in an exam is a B+. So it sounds like you're about half a standard deviation below the mean which is maybe a low B or a high B- depending on the curve. The general rule of thumb is +1 s.d. on the mean is almost always an A and you just kinda eyeball from there.,1602058402,1,0
what’s your major?,1602058341,1,0
"I CAN'T HELP BUT NOTICE YOUR PAIN! 

MY PAIN?

IT RUNS DEEP. SHARE IT WITH ME!",1602057633,1,0
This is really important because CAPS doesn't cover international students!,1602057563,1,0
it honestly kind of breaks my heart that everybody is hating on r1b since I loved mine. Look through them all and find one on a topic your care about/can get behind. They're all difficult but if you like the readings you'll have a good time.,1602057422,1,0
how did u learn to learn. real q,1602057247,1,0
dang she really glowed up,1602057063,1,0
yeah agreed. And the resources are just worse. Like online OH is just objectively worse than being in person,1602056708,1,0
take it at cc saves you loads of time,1602056408,1,0
I took music R1B two Falls ago and I phase 2 it. Basically it's looking at musical aspects within Shakespeare. No music background required. Decent amount of reading but the instructor then (Margaret Jones) made the class really fun to go to. No final. Just two short papers and a final paper.,1602055898,1,0
"You're not alone my guy. I used to run XC back in the day too...

I have, and do feel the same way about everything you've said. Is dropping a class an option for you? I know it feels like a cop-out, but help yourself because this school won't.

Whatever you do, hang in there.",1602055574,1,0
"Hey, I was one of those freshman year kids that nearly slipped through the cracks (forgetting to eat, my desk was such a mess my roommate had to yell at me to clean it before I realized how bad it had gotten, isolating myself in my room even before corona, on track for low GPA first sem, just wanting to sleep all the time to ""skip"" to the next thing). And honestly, I really did nearly slip through the cracks - I'm not here to tell you that it will get better because it genuinely could end up that you need to take a gap semester or that you end up with a ""bad"" freshman year first sem GPA. It won't necessarily get easier soon and there is a real danger of slipping through the cracks in Berkeley, especially as a first sem freshman without a solid community yet. I'll also confirm from personal experience that I had a measurably tougher time getting access to certain resources (certain internships, clubs etc.) because of a poor first sem GPA compared to some of my better performing peers. (The lesson here is to not compare but easier said than done. Obviously comparing yourself to people who are doing relatively better means you are doing relatively worse, which only marginally helps you motivate yourself in the short run but damages your self esteem in the long run). 

I will say I had a far better second semester once I started making friends with my floormates and joining some chill clubs. As for GPA, bluntly it matters a lot for for a lot of post undergrad opportunities.  I'm not sure what you're interested in, but I would definitely start browsing around to see if there's an online forum for the industry/grad school you at least want to have the option of pursuing later on. The anxiety of commiting myself to something I had no idea if I would be able to do, let alone enjoy was real, but finding out I'd missed the boat on pursuing some of them because I didn't even know about them was even more stressful.

I've basically struggled with poor focus and study habits for 3 years straight until I started therapy and got diagnosed with ADHD this summer. Things have improved drastically since I got medicated, but even (especially) now I get stretches of weeks where I don't feel like doing anything, especially studying. A sense of apathy to the future, that there isn't anything to look forward to even if I studied really hard. What I do then is force myself to sit in a chair until I'm ready to start whatever is due. Sometimes I sit in a chair doing nothing for 30+ minutes before I even start working on a single question on a pset. The boredom of doing nothing will always eventually surpass the anxiety of starting school work even if you think it's impossible to do. Sometimes I medidate but mostly I just sit and wait (no phone, no distractions). For me, the feeling of literally wasting time - not even procrastinating but literally doing nothing is more anxiety inducing than starting the work itself.

My advice for finding accountability buddies for classes is to message 2-3 people you see/hear actively participating in sections/lectures and ask if they're down to grind out a pset or study for a test remotely.

It seems like you have a different blocker than I have so I'm not sure how relevant this advice could be, but this is what works for me when I absolutely can't get started on something. This post just reminded me a lot of stuff I felt freshman year first sem.",1602055015,1,0
In front of Yali's Stanley Hall Café! It’s where Hearst Mining Field is. It looks something like this: https://images.app.goo.gl/J1AhxTZKbpSbh9EG7,1602054359,1,0
"Yeah, tbh I was really annoyed when I posted it, but I just feel like the lack of information makes it a lot less stressful than it could be

In general, I've just been feeling lost this semester, especially since a lot of classes still have the same workload of a normal semester but nowhere near as much resources to get help.",1602053666,1,0
🎵Who am I but a guy with two eyes on the prize🎵,1602053603,1,0
"The trees in the 1912 images appear to be behind the building, but the current trees are directly to the left of the building. Some of the trees on the right, however, could maybe be the same.",1602053576,1,0
[deleted],1602053096,1,0
"hot take it’s not that deep. If you’re doing really poorly in the class make a private piazza post, but for most people there’s really no use stressing about grades. Just focus on learning the material.",1602052964,1,0
"Have you taken Efros's CS194? Getting a good grade in that class is one of the prereqs for 280 I think. Here is part of the syllabus from last semester's 280:

Enrollment

1. EECS graduate students have the top priority, for CS280 is a graduate level course in EECS.

2. Non-EECS graduate students and undergraduate students: We will take you if and only if

• You have taken CS194-26/294-26 and got an A or A+, or

• You have published at any of these vision, graphics, robotics, and learning conferences: CVPR,

ICCV, ECCV, Siggraph, Siggraph Asia, ICRA, RSS, NeurIPS, ICML, ICLR.

In order for you to be considered, please fill an online form via your u/berkeley.edu account at

[https://forms.gle/iFgNwrjmiyc4oRBX6](https://forms.gle/iFgNwrjmiyc4oRBX6).

3. Concurrent enrollment students: We won’t be able to take any.

4. For those who cannot get into CS280: We recommend this coordinated entry-level course

CS194-26/294-26: Image Manipulation, Computer Vision and Computational Photography.

It is concurrently offered on TU TH 5-6:30pm in Hearst Field Annex A1. Please add yourselves

to the waitlists and show up for the first class. The class capacity is expected to expand.",1602052689,1,0
"This weeb pic basically summarizes Berkeley. We have to be happy, but we really can't so instead we suffer",1602052634,2,0
"Wait...there’s been this post circulating on insta about a cal student that was last seen near the Golden Gate Bridge on sept 30....  I really hope this isn’t OP. 

Please, please, please OP, get home safe. Things get better",1602052387,3,0
man you nailed this vibe and skyline. Instant nostalgia. I checked out your IG and followed - loved “dreaming in the pit” also. Can’t wait for more Bay Area/Berkeley pieces!,1602052386,2,0
this was also really helpful!! getting the full scope of things is definitely what I'm after. thank you so much!!,1602052370,1,0
"I personally do not enjoy that class. A lot of assigned readings are not interesting, unnecessarily complex, and pretty irrelevant. One of the professors gives very unorganized and hard-to-follow lectures — just recall the feelings you get when reading the most pretentious research paper where one sentence spans a paragraph, and now imagine hearing that paper being read out loud for an hour. We have to submit reading notes every week, and it gets tedious pretty fast. Grading really depends on your GSI. For example, my GSI asks us to fill out the optional section to receive full credit, which IMO actually helps with digesting the readings, but it is definitely more work. I guess my main issue is that this class is made so convoluted that the ideas they are trying to convey become elusive. It also often feels as if they are just constantly throwing out big words with no real purpose. Obviously everyone has their own opinion, so take whatever I say with a grain of salt, and if you end up liking the class, that is awesome because I do think data ethics is an important topic to wrestle with.",1602052271,1,0
"I personally do not enjoy that class. A lot of assigned readings are not interesting, unnecessarily complex, and pretty irrelevant. One of the professors gives very unorganized and hard-to-follow lectures — just recall the feelings you get when reading the most pretentious research paper where one sentence spans a paragraph, and now imagine hearing that paper being read out loud for an hour. We have to submit reading notes every week, and it gets tedious pretty fast. Grading really depends on your GSI. For example, my GSI asks us to fill out the optional section to receive full credit, which IMO actually helps with digesting the readings, but it is definitely more work. I guess my main issue is that this class is made so convoluted that the ideas they are trying to convey become elusive. It also often feels as if they are just constantly throwing out big words with no real purpose. Obviously everyone has their own opinion, so take whatever I say with a grain of salt, and if you end up liking the class, that is awesome because I do think data ethics is an important topic to wrestle with.",1602052263,1,0
"A lot of your anxiety seems to be coming from your living situation and your perception that everyone around you is excelling and that that’s just the way things should be. Well let me tell you it’s not. Only the most exceptional students can come here and thrive straight outta the gate, but don’t let that discourage you; instead, try shifting your perspective to see this as an opportunity to grow. You can become one of the exceptional students that knows how to balance coursework, social life, personal health and whatever else gives you purpose and makes you happy. But you gotta spend some time in the meat grinder and break things down into one simple task at a time. Forget about all of the schoolwork your behind on, just focus on that one problem set you need to do. Actually fuck that, just focus on the ONE problem you’re doing, the one lecture you need to watch.

Like I said before, and most importantly, keep in mind that many more people than you think are feeling the same way as you. I’ve had a fucking doozy of a semester, and was also recently prescribed antidepressants after a few years of depression &amp; anxiety. I’m not saying that to invalidate what you’re feeling, but to show that you’re not alone &amp; you’re definitely not falling behind in the grand scheme of things. There are plenty of others out there like us. I know it’s hard to see or feel it now, but what you’re going through is going to make you grow a fuckton as a person, so long as you’re able to stay in the moment, buckle down and pick up some healthy habits along the way. But, there are inevitably going to be days where you don’t feel like you have it in you to get out of bed, and that’s ok. You’ll learn how to get better at snapping out of that mindset, or taking measures to reduce the odds that you wake up feeling that way. You still have plenty of time to catch up both in terms of the semester and your time here at Cal, you got thissss! Hate to be cheesy, but just keep putting one foot in front of the other :)",1602051684,2,0
good job,1602051483,1,0
I've never liked those rings. The pool is nicer even if people fall in once and a while.,1602051441,0,0
"Yep. Of course L&amp;S and what have you all have their own stipulations, but that warning is from financial aid.",1602051326,1,0
"Yeah, I wasn't really interested in cs theory (probably hate it more now LOL), so your comment is pretty reassuring :) Thanks!",1602051236,1,0
Do I have any hope of raising it up to earn a B in the class if I get around average on the next midterm and final?,1602051122,1,0
Btw that test was wack. I think the format might change so you might have better luck in the future!,1602051044,2,0
"you’re welcome! you can DM me if you have anymore questions, there’s not a lot of soc help on here",1602050846,1,0
"ahaha thanks, too bad there aren't many cnr/ib people on reddit :'( it feels like everyone is cs here",1602050814,1,0
"to be honest I have multiple drafts of this post lol. halfway through writing, I just go ""what's the point?"" and delete it. but I recommend writing it out. kind of therapeutic",1602050259,3,0
"For research, I would think that it would depend on your grades in the classes relevant to the research. So if you want to go into CS theory research it might have a larger impact than some other type of research. As for grad school, I don't think one class would sink you. It would probably depend a lot more on your GPA in general and grades in other classes.",1602050213,3,0
i was about to post something similar :’(,1602049994,2,0
I feel exactly the same,1602049339,2,0
[deleted],1602049136,1,0
French R1B with Koerner,1602049008,1,0
"To be fair, I also improved by the second midterm and got an 80 on it. So it’s not so generous.",1602048748,1,0
good robot,1602048385,1,0
Yeah there are a bunch of firetrucks and ambulances being dispatched now. From where I am it sounds like it's near Dwight and Ellsworth?,1602048107,2,0
"awesome!! The plan is to take it for fun, so I'm just trying to get an idea for the workload",1602048082,1,0
"Nope. It's just a major requirement. Only three classes need for declaring are 70, 61a/b.",1602048032,1,0
thanks for the heads up ill check those out,1602047497,1,0
seriously?? I have heard of no such generous curve. thanks for the info!!,1602047249,1,0
Whatever u can get into imo,1602047120,1,0
Kk don’t worry too much; I took 53 with Sethian in fall 2018 and he is a generous curver. Think I got like a 60% on the first midterm and ended with an A-,1602047026,1,0
jr smith should win. he is a positive role model for alcohol usage,1602046901,1,0
Tick stands for incorrect in Japan. Circle means correct.,1602046703,1,0
[deleted],1602046555,0,0
"Also, remember that you have at least 7 semesters ahead of you, so there's plenty of time to make up for a bad first year. Obviously, do your best and drop classes if you have to, but you will be fine in the long run! It's not how you start, it's how you finish!",1602046445,1,0
Dude Im not a bot lmao,1602046399,2,0
Im taking 182 and 189 next sem. I was willing to settle for 194 but sadly its not offered in the Spring :(,1602045856,1,0
you probably need an A in 189 and 188 and you email the professor after grad enrollment for an enrollment code. You can take 182 or CS 194 computational photography if you're looking for an undergrad CV class,1602045741,1,0
"When people chat that they are confused af, it rly makes me feel better about me being also confused af",1602045352,1,0
the warriors player?,1602045339,1,0
