body,created_utc,score,total_awards_received
"Hey, you just gotta hang in there. I struggled a lot too because I was completely new to coding, and the projects were sometimes very difficult to me. It helps to talk through concepts with friends or staff and don’t be afraid to ask on Piazza. I think I spent a whole day just rewatching lectures and reading over the slides for tree recursion until I got it. If you are not directly copying from online and you are taking techniques and tricks from online solutions to better your own understanding, then you will be just fine. :) But definitely hang in there I failed the first midterm and I ended up with a good grade because I improved",1614899937,1,0
Depends on the major but most L&amp;S major will admit you as long as you meet the prereqs. You don't need to be in your sophomore year to do that. I know some people who declared math as a freshman.,1614899914,2,0
"You need to sequester right away so you wont spread it around and make the problem worse. If you have severe covid symptoms like pneumonia, you need to go to the ER. Though this is rare for young healthy students.",1614899754,1,0
"there's freedom of speech and there's freedom of reach. they are welcome to speak freely to a therapist or a professional/friend/family member that could help them overcome their issues. they should not, however, hijack the reach that this sub provides. it poses huge risks to suicidal people.",1614899326,1,0
I actually don't think OP is taking it personally. He's just looking out for the at-risk students who might all the sudden develop a warped sense of reality. He's making these comments from a point of maturity.,1614899179,3,0
"meanwhile students are sleeping on the streets. 

but Go Bears amirite?",1614899173,-19,0
"I can tell you that departments not CS/EECS will be suffering for a while. Even psych, a huge ass and extremely popular department, has had to cut dozens of classes. Departments that have been trying to grow for the past years (ie disability studies) have been pushed even smaller. Feeling the squeeze :/",1614899114,9,0
depends on the lecture. I can't watch math related classes faster than 1x because they already go so damn fast but humanities? crank that shit up to 2x,1614898906,1,0
philosophy logic classes,1614898612,4,0
"For sure, also thanks for the new word, didn't know what kvetch meant. Congrats on being so close to graduating, hope you enjoy the rest of your time! :)",1614898460,2,0
That’s dope.  And I agree the best way to solve the housing crisis is to build more houses,1614898202,2,0
"We're a golf school, a swimming school, and a rugby school! Go Bears!

~~Wilcox pls I still want to go to the Rose Bowl~~",1614898091,16,0
All the CS 17x classes are theory classes.,1614897945,4,0
"CS 170, 270",1614897887,6,0
"Sure. The Housing Advocacy group I'm a member of [Eastbay For Everyone](https://eastbayforeveryone.org/) helped get a vacancy tax passed in Oakland. But there really aren't that many long-term vacant properties out there. The vast majority of ""vacant"" property is just empty for a month or two between tenants. It's unfortunate that lots of people believe the myth that we have tons of vacancies. It makes it harder to fix the real problem of housing scarcity.",1614897766,3,0
And honestly implementing a vacancy tax seems to be a better method to make sure houses are actually being used than stopping construction.,1614897443,1,0
"Yeah I can’t wait for the GSI to report this for sexual harassment. I hope their GSI is aware of resources because quite honestly it’s going to be shitty to open a document with a dick in it when they’re just trying to do a job. GSIs are people too, I wish people would have common decency when submitting work. Like have some fucking respect OP",1614897191,3,0
"Still waiting on the Senate Weeb Caucus :'(

[https://twitter.com/ossoff/status/337974129460408323?lang=en](https://twitter.com/ossoff/status/337974129460408323?lang=en)",1614897090,3,0
"As someone who has been a GSI - it is a really draining job, especially during a pandemic. Grad students are underpaid and overworked. I like getting dick pics from my partner, but when I am working a JOB there is no circumstance where I want to see a student’s dick. It’s not that hard to check over your work before you submit, much less just make sure you’re covered when taking photos. If you’re using cam scanner (which you should anyways, as it’s easier to read) you would not make this mistake. This seems like a perverted act, and quite honestly I would report it as sexual harassment. It’s inappropriate conduct and should not be tolerated, and it isn’t even a funny thing to joke about?",1614897024,0,0
"170, 127, 126, some iterations of 189, and ee120 I believe.",1614896959,9,0
mine is a multiplier based on the number of adderalls i’ve taken,1614896718,2,0
but but but! Something something foreign investors something something money laundering.,1614896587,4,0
"they wouldn't tow someone for not paying a parking meter or parking in a place with 3 contradictory signs. It's way too much effort when they can slap a ticket for $50-100 (I would know since I've gotten a few).

not saying I don't have empathy for OP but everyone who drives at berkeley knows exactly what they're getting into.",1614896470,4,0
Data 140 (Need to know Python though),1614896339,5,0
"Sure, when you go up to Piedmont with a megaphone and tell the frats to stop partying.",1614896334,2,0
Physics 89,1614896322,4,0
EECS 127,1614896294,13,0
STAT 150 and 155,1614896098,6,0
Oh fr I just assumed it was in Gtown. Yeah I’d say Berkeley is the safer of the two,1614896021,1,0
Which school if you dont mind me asking,1614895816,1,0
Things are looking brighter,1614895804,5,0
"You can definitely check out some engineering classes as long as you meet the minimum requirements usually just physics or math although they aren't enforced, but usually, engineering courses have reserved seats for those in that major, so you will get the lowest priority for these classes so it might take multiple semesters to finally get into engineering classes you want or it might just not be high in demand so you'll have a spot.",1614895720,1,0
[deleted],1614895555,5,0
"I’m offering tutoring for 16b, pm me if interested",1614895340,1,0
"Started off premed, ended up in banking. Lots of things change in those 4 years.",1614894495,1,0
Do you know if it’ll be hard if I wanted to try out some engineering classes as well,1614894386,1,0
"I think you missed the point. OP isn't against ranting, they're against being toxic about it.",1614894307,0,0
"&gt; BUT THE FACT YOU IGNORE IS THAT THERE ARE PEOPLE ON THIS SUB THAT ARE SUPPORTIVE OF PEOPLE GOING THROUGH THIS EMOTIONAL PHASE!!!


That part.

I get what the OP is going after but I feel like they’re not reading past the title of many of these posts. The comments are usually full of very supportive people. Why remove that emotional safety net for people?",1614894001,2,0
bruh ur charging ppl for smth ppls friends will do for free,1614893765,15,0
"Sure, I came in wanting to do biology, then switched to math after a year, then switched to statistics after another year. If I had another year I might've switched to CS too! L&amp;S is flexible as long as you can check all the boxes for the major you want to study.",1614893183,1,0
"Because people who have no idea how the housing market works think that the lots will all be bought by luxury developers who will build expensive apartments and actually increase the price of housing.

Which is ridiculous, because a) prices are not contagious like coronavirus and b) in case you haven't realized, capitalist enjoy *making money*. If the hypothetical luxury apartments are full of tenants, then you're taking away demand, lowering prices elsewhere. If they're empty, then clearly the developers are losing fucktons of money.",1614893144,15,0
Now if only our revenue sports could be as successful as the Olympic ones,1614892846,31,0
Ocean Beach in SF is probably the closest spot.,1614892720,1,0
[deleted],1614892702,1,0
"&gt; I do not waste time looking at Reddit posts.

Lmao the fact you responded multiple times to the top 3 comments in this thread proves otherwise. I am genuinely wondering just how much time you waste by being a toxic asshole to fellow students",1614892621,1,0
too true,1614892557,5,0
"&gt; baby boomers who bought their house for a *song* in the 70's

Made me literally lol

My FIL bought his first house for roughly 90% of his yearly salary back in the 70's, so what you said isn't as much of an exaggeration as one would expect.",1614892247,12,0
Yes. I am a freshman taking distribution requirements as well as math and science classes that mean I will have a few options.,1614891702,1,0
"I was CO’ 2020, everyone accepted into L&amp;S is undecided IIRC.",1614891108,1,0
"Well, if we build densely, some baby boomers who bought their house for a song in the 70's might have to put up with a slightly different view out their window.

&amp;#x200B;

So you know, there are two sides to every issue. /s",1614891101,23,0
[Here ](https://www.reddit.com/r/berkeley/comments/lsmzrr/who_are_some_of_the_smartest_crazy_accomplished/?utm_source=share&amp;utm_medium=ios_app&amp;utm_name=iossmf) is the post you are referring to.,1614890400,4,0
Go Bears!,1614890325,5,0
"Clubs are honestly your best best. Making friends through class is pretty difficult these days, but with clubs, you're consistently seeing the same people with the same passion for the subject matter. If the club is run well, you should be getting chances to meet people in breakout rooms.",1614889921,14,0
"How do you make friends, period?",1614889754,14,0
virgin lol,1614889666,1,0
nah I think he's talking about the dude who made his own 16b notes for spring '19. there was a comment about it a few days ago.,1614889601,7,0
[deleted],1614889584,3,0
I think it is 3 units but ESPM6 is hella easy,1614889355,8,0
"They put a watermark on them. I’m sure if you have a friend who can photoshop/diy it should come off, but I’m not savvy enough for those things.",1614889283,1,0
Nah optional,1614889225,1,0
Thanks Dr. Fauci,1614889216,3,0
Can i just take screenshots of the pics or do they put a filter/tag on them,1614889215,1,0
Yes !I love that glam!,1614888996,1,0
"the comments are so cynical omg 

have hope comrade",1614888874,2,0
[deleted],1614888784,5,0
What's happening with the vaccine? Should students be  expecting info from UHS to schedule an appointment to be vaccinated? Or should I look for resources outside of Tang? Thanks.,1614888706,1,0
u think ur better than everyone lol,1614888691,1,0
Pls pls pls Fall 2021 in person 🙌,1614888404,2,0
I did it for like $15 and the pics came out great! It’s just.... to buy the packages of photos for your family is like $150-$500 which is super steep ah,1614888357,2,0
"Summed it up perfectly. When I do it, I feel like a dick, but sometimes assignments take longer than usual or I’m straight up just like half dead lmao.",1614888142,2,0
"I understand where OP is coming from with this. I think the use of “I feel...” statements would help mitigate this instead of generalizing/absolute statements like “everyone else has an internship and I don’t so I don’t deserve to be here” or “my peers always...”, “my peers never...” etc. but I also understand that when you’re venting you’re in a pretty raw emotional state, so we can’t expect perfection from the people posting their rants, but I get how these generalizing statements can also harm others. I think a flair/warning would be appropriate. There’s no real easy solution to this. Students deserve to vent just as much as other students don’t deserve to feel negatively impacted by those vents.",1614887697,2,0
yeah like texas huh,1614887297,8,0
This economy and being international is a double RIP for me,1614887055,2,0
thanks man very helpful. how would you rank the workload and overall pain for 184 161 188 100 186?,1614886993,1,0
I couldnt finish my igetc but instead I got to use essential skills and it worked just like IGETC (which has a lot less courses than IGETC). I went to a private school tho so maybe you can try asking if your admission advisor if this option applies to CC students?,1614886987,1,0
[deleted],1614886857,1,0
"For a non English native speaker like me, watching a lecture on 2x exhausts more brain cells than the lecture itself",1614886466,1,0
"And how do you know this to be the case? Are you an epidemiologist that can see the future? And your point is we aren’t ready to go back to campus because we still need masks, but you’re saying that when we go back to campus, we’ll need to wear masks. So you’re contradicting yourself",1614886444,1,0
fucking snowflake..if an anonymous post is enough to make you feel small and cripples your own self worth then u have way bigger problems in life that you should probably go and fix first,1614886207,-8,0
I think he would come here with a vengeance. Man some people here,1614885668,2,0
"Average GPA being the same is a statement about CS students who got past the GPA cap.  Yes, people who get high grades get high grades.  How about those who are excluded because they didn't get high enough grades, but can still do passing work?

I dispute that 80-85% success statistic, but in any case it's only true of students who completed all three courses.  What of the ones who didn't do all three because it was no longer possible to get up to the three-course GPA?  

The statistics I see: Of the L&amp;S cohort who entered and took CS 61A in Fall 2017 (the last pre-COVID two-year lower division cohort), just over half (51%) of those CS61A students took all three courses; just over a third (38%; 74% of those that took all three) met the cap. \_Nobody\_ who got a B- or lower in that CS 61A was able to reach 3.3 and declare. Only 6 students who got a B were able to do it. Students who come in with weak preparation and struggle in that first course are at a huge disadvantage.

Somewhere around 450-500 students who set out to study CS ended up being unable; if you look at a typical Spring you'll find about 300-350 more.

Finally, as to money as a solution:  It seems that people are arguing two ways here.  As you point out, this isn't going to save the University money.  And it doesn't ""save"" EECS money; they're not spending money they don't have.  

Should EECS get additional funds to hire GSIs and therefore raise the size of courses?  That's not the only question:  EECS upper division classes are typically over 500 students.  Is that the right learning environment?  Fixing that requires additional faculty, which requires additional space and research resources, which requires more graduate students, which requires ...  Making a part of the University  several times larger is \_hard\_.  People who argue that serving this huge growth of CS students well just requires some money in a teaching account are not looking at the issue in serious depth.",1614885331,1,0
"Research is what most of the professors are here for. It is where they work on cutting edge stuff and there's tons of it in EECS. You can apply through URAP or reach out to specific labs or grad students if you've taken the right classes or have the right experience to be able to contribute. Since you probably haven't taken a lot of upper divs yet you're best bet is probably URAP

[https://eecs.berkeley.edu/research](https://eecs.berkeley.edu/research)",1621310281,5,0
[deleted],1621310202,1,0
thanks! would you be able to tell me what the difference is between 16a and 1a? i'm not very good at math so should i take 16a instead?,1621310139,1,0
"Out of curiosity, is there some compelling reason that people can't switch to free open source applications like Libre Office for MS Office, Octave or Julia for MATLAB, Lightworks for Premiere, etc.? MATLAB might be the big issue if you have to submit code as opposed to just results, but everything else is probably far more negotiable.",1621310101,1,0
thanks! so should i just try to take 1 or 2 other breadth classes?,1621310091,1,0
"Sorry, Spring 2020, just edited it",1621310079,1,0
and the episode where he ripped his pants,1621310074,1,0
thanks! i was thinking of taking 16a instead but heard that it doesn't apply to as many majors?,1621310055,1,0
Northside is nice,1621310054,1,0
What happened in sp19,1621310031,2,0
"Macbook pro 13 inch (2019). I like it, but I think if you want to do ML, it might be better if you get a pc with a gpu. That being said, I'm not a big ml expert",1621309877,2,0
I had to get a drug test for a private company's internship. But they'll usually tell you when you sign the offer letter or soon after. You'd get a heads up.,1621309830,2,0
I can’t link it publicly sry,1621309787,1,0
Walrand,1621309755,0,0
Which textbook? Ramchandran’s?,1621309700,1,0
"(who, who, who, who)",1621309700,4,0
"OMG, link plz!!",1621309498,2,0
Is modern JS the type of stuff React encourages using? Specifically using a bunch of arrow functions?,1621309464,1,0
Can you link the gdrive?,1621309453,3,0
"How do you do kids, 33 year alum here. Have you ever turned in a 15 page paper, when the minimum was 20 pages. It was a day late because you forgot it was even due because you never went to class, so you wrote it that nigher after seeing everyone was turning theirs in, and still got an A?",1621309152,3,0
You’re going to be studying full time with chem 1A/L and Math 1A I’d def take easier classes with those without anymore technicals or else you might not have free time. I took chem 1A with math 16a so it wasn’t too bad.,1621309082,1,0
"I think it really depends. For example. If you gonna work anything government based (ie state, federal, or even city), a lot of the things I looked at requires drug tests. 

but for the most part, I haven’t heard anyone saying that they had to",1621308745,8,0
"Happens all the time. I’m a data science major but my family treats me as basically the handy man for anything technology related and so whenever I legitimately don’t know something, I get that same response of “you go to Berkeley though”. I just got used to it because I don’t expect them to ever fully understand what I do in school.",1621308641,11,0
"For sure. I'm definitely not in the demographic to be offended so no need to apologize. I don't know if it's Berkeley or just the times we live in now, but becoming hyper aware is just like a byproduct or something.",1621308636,-2,0
"Oh yeah you’re totally right. Sorry if this offended you, it’s just something I’ve heard all my life. I’ll edit it. Thank you!",1621308381,3,0
You’re Academic Progress Report...... it’s on your CalCentral,1621308379,1,0
"Not trying to be *that* person and try to be overly PC and I personally don't really care, but I would say saying ""blonde moment"" in reference to doing something really stupid is probably not the best way to phrase it.",1621308229,-6,0
Lmfaoo,1621307761,4,0
That’s a pretty standard first semester workload. You may be able to take math 16A instead which is supposed to be easier but id double check,1621307511,3,0
"Thank you for this, will look into it",1621307439,1,0
I don’t do business or premed but yep sounds reasonable. Basic rule of thumb is max 3 technicals in a semester and try to aim for 4 or fewer classes total until you know what you’re doing.,1621307425,1,0
Har-VARD,1621307406,5,0
"\-0.08 MT, +0.01 Final, 100% HW. Am in in B+ territory?",1621307263,1,0
Just FYI for Last yr the cutoff for A+ was a 96%,1621307093,3,0
Hi did the withdrawal page say you would like to not attend UC Berkeley or you would like to not be considered anymore?,1621307068,1,0
U got this OP! I’m also PNPing the class so good luck!,1621306955,1,0
I think eliminating the requirement does more good than harm. Students experience so much unnecessary stress from the SAT.,1621306873,1,0
"\-0.86 MT and -1 Final (post clobber), what's my grade?",1621306811,1,0
Your SAT score will not determine your performance at Berkeley whatsoever,1621306513,1,0
We need to leave Data Science alone and let it do its thing and not disturb it,1621306148,6,0
Hey!!! Congrats on your admission!! I’m a rising senior double majoring in EMF (nat res) and MEB. I am also a peer advisor in CNR so I am happy to answer any questions! feel free to pm me!,1621306096,2,0
also [https://www.spotify.com/us/student/](https://www.spotify.com/us/student/) Hulu Spotify Showtime $5/month,1621305848,1,0
You have a really good taste in music.,1621305786,2,0
Professor Fox is amazing! Really enjoyed your lectures this semester :),1621305605,7,0
Wasting money,1621305429,24,0
[deleted],1621305305,1,0
"Worst case scenario, they say no. I was in a similar situation last semester and I asked and was told no. I did get lucky though and we all got a bonus 15 points on the final",1621305300,2,0
"I'm in a similar position as you. Unfortunately, the chemistry department chose to eliminate the UGSI program for the intro courses for this year. So your only option out of all those classes is Bio 1B, but idk how the process works exactly. There might be some relatively smaller classes that offer UGSI-like positions. One of the upper divs I took last semester offers something like that.",1621304976,1,0
"To be fair though, there were about 150 likes on this one Piazza post about people being worried about not passing, so that’s around 10% of the class who are distressed enough to complain to TAs. I am worried about getting below a B- and I didn’t even like the post. 16B is very tough. The people who would have actually done well are the ones who’ve done the linear algebra stuff before.",1621304926,3,0
i don’t think anyone got a 20/20,1621304913,1,0
Sophie. Not sure if I’m supposed to email the gsi or professor about grades,1621304758,1,0
What is a good GPA?,1621304608,1,0
there is no way nothing happens right? without MATLAB wtf is going to happen to e7 and all the mechE/civE/etc. courses,1621304534,20,0
Not POSIX compliant.,1621304436,2,0
Bro a 3.5 (probs ur total gpa now) is perfectly fine. You will have lots of chances to raise it,1621304372,7,0
damn where’d you get this meme from?,1621303910,1,0
This is straight up my schedule this semester. It's super doable !! A in CS61B and probably A CS70 given my final score. Heaviest load was probably 61B because of the projects. As long as you start early and work on it consistently you'd be fine.,1621303466,1,0
who was ur gsi?,1621303108,1,0
Me too!!,1621302700,1,0
[deleted],1621302671,1,0
What is APR?,1621302612,1,0
"MBP 15 - Quad Core i7 and 16 GB RAM, it sucks tbh I wanna get the M1",1621302559,1,0
"It's a great class and those Prereqs will be more than enough. The teacher goes through all the circuit stuff and Biology you need in class, although eecs 16a likely helps. It has a final design project rather than a final exam so you can take it whatever direction you want to.",1621302516,2,0
"Bro, you're fine",1621302040,4,0
"You might consider CS10 instead of CS61A. It's a great prep for 61A for students with less coding experience, and is also available during the summer. Learn more about it here: https://cs61a.org/articles/about/#prerequisites",1621301847,4,0
Fistbump?,1621301794,23,0
"I'm the co-instructor for CS61A next year. I don't know a ton about IB CS, but generally, if you don't feel very comfortable with programming yet, I recommend first taking CS10. You can read more about it in the syllabus here:

[https://cs61a.org/articles/about/#prerequisites](https://cs61a.org/articles/about/#prerequisites)

(Another approach is to start in 61A and then switch to 10 if it's feeling too fast, but then you may have to do some catch-up in 10. Certainly a thing that happens a lot though!)",1621301789,8,0
"This is such a minor issue. Don’t worry about it, you’ll be alright!",1621301757,1,0
It’s already on Google drive for free,1621301662,9,0
Nice! I know some teachers like to give exams during the discussion section time.  I’m glad they made those rules clear.,1621301650,2,0
No. Take 189 too,1621301636,13,0
[deleted],1621301360,2,0
Microsoft steals your data and windows updates keep on breaking. That’s why whenever I need to use windows I have it virtualized on top of Linux so if it breaks I just yeet the instance and get a fresh one,1621301274,2,0
Don't do anything. No one cares.,1621301151,2,0
What’s wrong with Windows? Im used to it and so far see no reason to spend time figuring out Linux or to buy an expensive Mac.,1621301088,0,0
[removed],1621301072,1,0
"I got an A- in both 61A/B, making the A- cutoffs by a very small margin. I would say that a B+ is very much possible, I got a B on the class but I took it along 61A so it was a little rough, was just below average in both midterm and final.

If you are going to do it my only suggestion is to not take other heavy classes along with it, do every homework and go very carefully through the exams when you take them.",1621301057,1,0
"The question is, will there be online discussion sections?  You also want to make sure that exams are online as well.",1621300986,4,0
Hope this fund is going torwards STEP rather than random proprietary software licences that people would pirate anyway.,1621300919,-22,0
"No you don't have to come here. If you could dodge 5-10k of rent, why not?",1621300746,7,0
"Sorry I know I'm late to this, but is your major is L&amp;S?",1621300708,1,0
I got 18/20 :/,1621300530,1,0
"data 8 isn't too bad, so I would recommend you make sure your grade for that one stays pretty solid, and then drop 61a if you don't do well on the first mt1. I don't know how it works in the summer, but in normal semesters they try to get mt1 back to you before the drop deadline.",1621300327,1,0
