title,selftext,created_utc,score,total_awards_received
working-on-depression-data-science major now ready to get back to work,"I posted here a while ago in an depresso spiral.

I spent all day today and applied to jobs on Handshake and I am so proud of myself for that progress. I had such crippling anxiety just thinking about internships that I could barely bring myself to log in Handshake before crying. 

Thanks for your help. I took a mental health break - working on catching up on all my classes at the moment. 

I know that was a very poorly timed mental break especially towards the end of recruiting season, but I think it was needed.

I honestly would really like an internship in anything - data analyst, business analyst, anything even tangentially technically related! (I am not really a strong coder, so I don't think I will pass swe interviews I was a B level student in 61 a and b and that was with a lot of time spent in office hours). I was suggested some fields like supply chain etc. I have applied to a handful of those roles today! What are other roles that want anyone that can deal with numbers? I also got told to look at government internships and would really like some help as to where. 

Is it possible for me to get any sort of internship at this point? Anything remotely and tangentially technically related? I know that was one of the advice that someone commented on my last post, but what are some specific role titles and websites to go to? 

An advisor told me to take a 5th year, but idk... It's a great weight off my chest mentally, yes. Financially yikes.

P.S. If anyone had no internship experience and got a full time STEM ish job after graduation lmk bc that's actually a huge weight off of my chest that it is not the end of the world so pls dm me.",1617927060,1,0
PNP Haas Prerequisite this sem?,Im a freshman in ugba 10 rn not doing good might get a B-. I don't want this affecting my gpa but i'll be applying to haas in the fall. can i PNP it? I saw the pdf on the haas page but i just wanted to confirm. will it hurt my chances of getting in,1617925698,1,0
How difficult is a UC to UC transfer?,"I got into UCSB and UCSD for econ, but I got rejected from Berkeley. I know that it's a lot easier to transfer from CC to Berkeley, but I want to experience the college life. 

Have any of you guys ever done a UC to UC transfer? How difficult is it? Would the transfer be easier if I did L&amp;S Econ than Haas.",1617924784,1,0
Can any newly committed incoming freshman check their Berkeley.edu email to see if they’re being sent anything?,"I logged into the email account but haven’t received anything. I’m a bit worried because my cal net id was actually created a few years ago for a summer program at cal, and just being reactivated now.",1617921960,1,0
how is stat88 a 3 unit class,i know it used to be two units but. even three units doesnt make sense idk workload wise it feels like four units,1617920815,1,0
EECS Course Advice,"Ion Stoica is teaching a special grad course Distributed Systems &amp; ML in Spring 2022 and I really want to take it. I've only taken all the lower div courses and 170 so far though. 

So does the following schedule make sense:

Fall 2021:

* CS 162, EECS 127, CS 195, Breadth

Spring 2022:

* CS 294, CS 186, CS 161, Engin 120 (basically a breadth)

Is this schedule manageable and/or get me ready for Distributed Systems &amp; ML?",1617920736,1,0
quick q about getting to know other people :),"when y'all were entering your freshman year at ucb, did you guys use groupme chats/facebook groups/insta groups over the summer? getting to know the class of '25 online is pretty overwhelming and i was wondering if any of you guys didn't really engage in any of this and fared well when school started.",1617920388,1,0
Data Science Major Wannabees that changed their minds?,"I liked DATA8 a lot, was ok with 61a and b, and am planning DATA 100/STAT 89 in the fall for a data science major.... even though I'm not as strong as others in math (sophomore with flat Bs in 61a &amp; b, Math 1 &amp; 2).

Has anyone taken a similar journey and changed their mind? If so, would you share why? Was it a particular class? When did you lose the love? Is DATA 8 a teaser class when the reality of the other data science major classes is grimmer?",1617919908,1,0
"For alums who missed the Two-Factor Berkeley Gmail authentication program, is there an alternative?","I think the two factor authentication was offered only a few years ago, and for previous alums there’s not a way to sign up for it. But on my account I don’t even see the default Google two-factor authentication options. Is there a way to get two-factor authentication still?",1617919637,1,0
CS 61C Tutor needed ASAP,"Title\^ Please dm me asap if you are serious, I desperately need help in the course.",1617919333,1,0
I don't see any information about when I'm signing up for fall 2021 classes?,"\- I don't see anything on my calcentral about a date when I sign up for courses or an email saying when i do. 

\- Does anybody know how I can find when and how I sign up etc?",1617917782,1,0
Kinda of sad how DeNero keeps saying grades don’t matter when they end up determine whether you get into a lab and graduate school...,,1617916667,1,0
Why are there so many people here diagnosed with narcissism and imposter syndrome ...,,1617916522,1,0
Late response about Gap year prove to UC admission,"I just found an e-mail from the Uc admissions office asking me to submit a document proving my gap year on March 7th... But I've checked it now, and it won't meet the five days they've asked for...It’s been already 1 month since The email was sent. Is it okay to answer now..? Am I going to be eliminated on the list from all the uc univs I applied for? Where should I say this? I'm really scared right now......",1617915734,1,0
Math 104 over summer,How is the pace/workload of math 104 over summer? Assuming it's the only class I take.,1617914673,1,0
questions for pursuing an MBA,"Hi, 

I am a prospective cs major with the end goal of trying to get an MBA after college. I'll admit, I'm not really sure what the process is to apply for an MBA but I was wondering if choosing Berkeley would give me a leg up in getting into a good program. Does Berkeley have any resources to help students who are looking to pursue an MBA? I am a little hesitant to choose Berkeley because of how hard it is to get a good GPA which is something that is needed to apply. Is that something should be worried about? 

&amp;#x200B;

Thanks

P.S. the other school I'm considering is UCLA",1617913769,1,0
major switch incoming 25',"So I am an incoming freshman to UCB and my intended major was music (l&amp;s). I was told by another student that I cannot switch majors after I get in. I might want to major/double major in English Lit or Economics something alongside music (not like cs, ds, engineering), is this possible as long as I do the right pre/courses?

&amp;#x200B;

Thanks!",1617913369,1,0
What to bring as a incoming freshmen?,"Based on your experience, is there things that you would definitely recommend bringing for a dorm room or for classes?",1617913218,1,0
EECS Meng admission status,"Hi,

I applied for Masters's at EECS Meng. The website stated that all admission results would be out by March. It's already April and I still haven't heard anything. There was a wave of admissions on April 1st, but a lot of other people like myself did not hear anything.

I sent an email to both graduate admission and EECS Meng admission but did not receive any replies. I tried to call the offices but only reached voice mail.

Is there any way to find out what's going on?",1617912973,1,0
Rescinding acceptance,"I was just admitted to Berkeley as a prospective freshman. Unfortunately, I made a mistake and decided to cheat on a recent test and was caught, and my grade dropped from a 89.7 to a 79.7. This was my first integrity violation, so I was left with a warning (and of course a zero on the test). Given that I am currently a second semester senior and that this an AP class (Physics C), if by circumstances I do finish with a C- or D+, will there be a high chance that Berkeley will rescind my application? I’m assuming previous grades also determine this decision, so I will let you know that I have a 4.0 WGPA and 3.7 UW. Thanks.",1617912688,1,0
Casa Zimbabwe,I got into the co-op Casa Zimbabwe and I'm a little nervous because I've heard some negative things about it. Can anyone describe what it's like and if it's worth doing? Should I try transferring to a different one and if so how would I even go about doing it?,1617911742,1,0
Should I submit AP scores?,"I’m going to be a freshman at Berkeley next year, and I want to go into Haas. I know it’s a competitive major to get into and I need a high GPA. I’m wondering if submitting my ap scores (7) would screw me over by loosing that easy intro class that would otherwise raise my GPA. If I get pushed right into harder classes my GPA will likely suffer, and although I’d be saving money, it’s might be harder to get into Haas. 

Anyone have advice on what I should do?",1617911309,1,0
help deciding between cal english/journalism and medill @ northwestern,"hi guys! i was admitted to cal l&amp;s and i'm super excited about it. i'm 90% sure i want to become a journalist in the future and ik cal has top ranked english and that their journalism grad school is incredible. however i was also admitted to northwestern's medill school of journalism which is the best in the country and i'm pretty torn, so any advice from cal students who are studying english/have completed the journalism minor would be v much appreciated :))

here are some pros and cons i've compiled for each school: 

**northwestern**

pros

* highest ranked journalism school in the country
* very easy to double major with political science/english/etc
* also very easy to switch majors if i change my mind about journalism
* opportunities at medill are unmatched in terms of internships and their journalism residency (where u get to work alongside professional journalists on capitol hill for a quarter. students covered the first impeachment trial and the 2016 election to give u some examples)
* i wouldn't have to go to grad school for journalism afterwards because of the clout/experience (saves money in the long run)

cons

* more expensive by 15k/yr
* smaller than i'd prefer
* not a huge fan of chicago weather or suburbs
* even though i'm 90% sure i want to do journalism, i don't think northwestern would be worth the price if i end up switching majors
* pre-professional culture at medill worries me

**cal**

pros

* highly ranked english major and journalism grad school (that i can take classes at as an undergrad)
* cheaper
* better weather and i like the urban environment/culture more
* would allow me to get a more general undergrad before hard committing to journalism
* close to family who live in berkeley
* plenty of internship/networking opportunities

cons

* if i want to go into journalism after undergrad, i'd probably have to go to grad school which will make it more expensive than 4 years at medill
* competitive culture makes me nervous tbh even if it's mostly concentrated in stem fields
* it's not medill for journalism if that's what i decide to do

basically it boils down to whether or not i want to do journalism. like i said, i'm 90% sure, and a degree from medill sets u up for success in a field where it's notoriously hard to make a living. i'm just not sure if i can get that level of industry clout at cal, which is why i feel like i should take advantage of medill. but i'm also worried that i'll have nothing to fall back on at northwestern if journalism doesn't pan out, and cal checks every other box for me.

tysm again!!",1617910454,1,0
Transfer from college of engineering to l and s?,"I applied to Berkeley as a civil engineering major. If I do get in, I was wondering if it’s possible to transfer to the college of Letters and Science because I’ve been thinking about majoring in like applied mathematics or data science instead. Any info would help, thanks in advance.",1617909938,1,0
"Some of UC's most diverse campuses get the least funding, sparking debate over equity and racism",,1617909718,1,0
Thoughts?,[deleted],1617909638,1,0
"Got sick today, but don’t feel like I can stop working on my semester-long projects due next week","Today I have thrown up multiple times and spent a good amount of the day in bed, but still got up to go to my office hours appointment and ask questions about my final project. Don’t worry I already had covid at the beginning of the year and am fully vaccinated. It’s just a nasty stomach bug.
This feels like the one week where I can’t get sick. I don’t think professors can extend due dates when it’s already the end of the semester.

Riparoni to me. Don’t get sick guys.",1620246088,1,0
Older Students or Grad Students Looking for Housing?,"I know this is a long-shot. 

I'm a female returning senior history major who is 25 and feels super old coming back! Any other returning students or grad students looking for a roommate coming in August? Or looking to find someone to go apartment hunting with them? Any gender identities. 

I'm down to live with a chill younger student who is cool with a super lame millennial. DM me. Thanks!",1620243759,1,0
PSR off-campus housing?,Hello everyone! I’m an incoming transfer looking for off-campus housing. I found a place at the Pacific School of Religion open to Berkeley students. It looks pretty affordable compared to what’s offered on-campus and on Facebook groups. Does anyone have any experience living there? I’m looking to sign a lease with them soon.,1620243146,1,0
"Make money with paid surveys, Register now in the Link Below!",,1620241570,1,0
Last few days of physics and math,"Just a week and a half babyyyyyy!!!! Then it’s just BioE from here on out❤️❤️❤️❤️❤️

I swear, if I have to look at another induced electromagnetic current problem, I will have an aneurysm. Stay strong homies!",1620241209,1,0
"I got accepted in the College of Letters and science for Spring 2022, should I wait until the last week to commit or should I commit asap","I heard that their may be a benefit to enroll ASAP, but my parents are telling me otherwise since I am going to school in the spring",1620238358,1,0
Was anyone able to get saturday second sky tickets?,"was only able to get sunday 😭

and anyone know who's performing on what days?",1620236389,1,0
sad - dead week,"who else feels like giving up

&amp;#x200B;

any advice on how to study",1620235789,1,0
EECS 127 vs Math 170?,Who should take what?,1620235103,1,0
Data8 passing grade,"Does anyone know roughly how many overall points do you need to pass on data 8? I've done all labs and pretty much all hws/projects, but I got a pretty bad grade on the midterm! I am pnp, so i just need a C-",1620233215,1,0
College Expenses Survey pls take its a survey for class thx,,1620225830,1,0
EECS TA Priority Deadline,"I submitted today (+3 days after priority deadline)

What does mean, like am I a non-contender, since its pretty close to the deadline is the penalty not-as-bad, etc?

 RIP",1620223554,1,0
Which UCs should be back up?,"I will apply for UCs as a business major student. I know that Berkeley has the best programs, but it's also highly competitive. 

So, which UCs should be my second choice? I heard only UCI and UCB have traditional business majors. But, what about others?",1620221978,1,0
Is the nuclear engineering program easy to get into in Berkeley?,"I know CoE is the most competitive, but does the acceptance rate change a lot within majors? What about nuclear?",1620217188,1,0
When will final grades update on calcentral?,What's the deadline for profs to submit grades this semester? If I pnp should I get my grades faster?,1620217152,1,0
CS61C AI Summer 2021,"I really enjoyed CS61C content (took it in fall 2020) and I generally like helping people and explaining concepts, so I am thinking about applying to be an AI for CS61C in the summer. I really don't know much about how the AI/tutor/TA system works though. It would be my first time as an AI and I'm kind of intimidated.

Is there any requirement to be enrolled in a summer class to be an AI (I don't have any plans to enroll in summer classes, I just want to be an AI for CS61C)? Also, can you get units for AI work, and what are the requirements for that? If there is a website that explains all this, please post the link. Additionally, if anyone has experience with being an AI, I would appreciate any advice you have!",1620205023,1,0
"Feeling down because I'm feeling very behind compared to my peers, who are graduating this semester and can't even bring myself to study for my finals as a result.","Hi. I hope everyone’s dead week is going well. I don’t really know where I’m going with this but I guess I’m posting here for some support? 

I’m feeling a bit down because I’m graduating in Fall 2021 and I am very concerned about my job prospects. I am a junior Economics major with some background in data analytics (R mainly) and am mostly looking at jobs in economic consulting, market research, marketing and strategy consulting. However, I am not even sure if I want to do business, honestly.

The reason I am not sure about business is because I never even envisioned myself as a business professional. I did NOT enter wanting to pursue economics at all. 

I am extremely shy and awkward and I have terrible people skills. I am very reserved until I get to know someone, and even then I’m awkward because it’s just who I am. I just don’t think bad people skills will help in a field that is so oriented towards client-facing work, but I don’t really know of any other fields I can explore or am qualified for. My resume isn’t the problem; it’s definitely my interview skills. I’ve gotten final round interviews for some of the positions I’ve applied to but I don’t get offers. I’ve tried to improve my interview skills but I see only small improvement. 

Additionally, what I believe makes me feel even worse about my zero career prospects is the fact that I was actually supposed to graduate this semester. I came in during August 2017 so many of my peers are graduating now. The reason I am staying behind is because I withdrew during the Fall 2018 semester and didn’t come back until Summer 2019. 

The peers that I entered with...many of them have plans for pharmacy school, grad school, medical school, or have really great job offers and I’m just sitting here empty handed and clueless about what to do with my future. I had 2 internship interviews recently at well known firms, and I guess I’m waiting on the results for those but I just don’t feel really hopeful. 

I know I have to solve my own problems and think hard about what I can do to change my situation, but the feelings are just really overwhelming me. I have a final in 5 days that’s worth 40% of my grade, and although I’m taking it P/NP, I just can’t even bring myself to study for it. I might try calling Tang tomorrow but other than that, IDK what else I can do about the emotional stuff.",1620203284,1,0
Nutritional Sciences Major,"Hi! I’m tryna declare into nutritional sciences right now and am deciding between the physio/metab and toxicology pathway. Both seem very interesting to me so I was wondering if there were any current majors in either one that could tell me about their experiences, research opportunities, classes? Thanks!",1620202283,1,0
Ugba 106 with fanning,Anyone took ugba 106 marketing with fanning in Fall 2020? How are his exams what to expect ?,1620201956,1,0
Why are CS61C projects same all the time??,"I dropped CS61C a while ago and registered to take it this summer, and I was collecting lecture slides and discussion worksheets of this semester to preview them later. 

Aaand I found one weird thing about this course.

While collecting the materials I checked the projects to see if I remember anything. I had a strange feeling that I have seen the projects of this semester before. I found out that the projects have never really changed from when I dropped this class. I dug in more and realized that only project 1 changes and the rest of the projects are literally the same. Seems like it has been like this since 2019.

What happened to this course for last 2 years? Is this the effect of budget cut or something? Or is this because TAs and professors don't really have time to come up with new projects? Just curious about what is happening behind the scenes.",1620201766,1,0
MATH115 vs MATH126 over the summer?,"Hi people, I’m graduating this summer as an applied math major and looking to doing some stats/data science in grad school. 
I’m now thinking about taking either MATH115 or MATH126 alongside cs61b. Personally I don’t really enjoy analysis stuff and I don’t thin pde will be very useful in my future career; meanwhile based on past Reddit posts about math115, I’m worried it won’t be reasonably challenging (maybe I can just pick it up later by teaching myself). So I’m not sure which one to take now. (Btw,I alr took pretty much all other math classes available during the summer term since most are major requirements)

I will really appreciate it if anyone can give some insights on the course materials or provide some comments on the instructors during the summer.",1620199868,1,0
Does Berkeley allow a dual degree from Haas and College of Engineering ? (Non MET),.,1620199453,1,0
Tired of emotions,\*vent post incoming\* does anyone ever get tired of having emotions? i have a lot of studying to do for finals and I would really like to do well. however my stupid-ass emotions are getting in the way and trying to convince me to lay in bed and watch youtube for 4 hours instead. it's so counterproductive. i know I will be happier in the end if I study and secure those A's rather than watching youtube and getting B's or C's. but in the moment my emotions are making that shit real difficult. ugh,1620197031,1,0
Worried about being rescinded for transfer,"Hello everyone!

I was accepted into UC Berkeley as a spring transfer admit for cognitive science. I stated on my UC app that I’d be taking PSYC 24 (a major requirement) but I was unable to enroll in it this quarter at my school. I was wondering if anyone had or heard of similar experiences as mine.",1620195339,1,0
UC Berkeley Undergraduate Scholarship,Incoming sophomore here. I got the Berkeley scholarship for my freshman year but I don’t see it listed under my awards for next year. Does it appear later when the spring semester is over?,1620195209,1,0
CalNet Mobile: Does this happen to anyone else when prompted for 2FA?,,1620194428,1,0
Second Sky @ Marina in Sept (Looking for afterparty venues and such),"Hello fine people in Berkeley!

Where are some good afterparty venues for after the show in the area?",1620194165,1,0
Cal Naked Run this Thursday,Here are the details.,1620193868,1,0
How do we find out who the admissions officer assigned to our file is?,"A while ago I contacted the admissions office through the update form after I was admitted and they told me to connect with my AO once one was assigned to my file. As of now, the only way I can contact the AO is through the form.",1620193742,1,0
intended cs major: what are my options for 3rd semester classes?,"hi, I'm an incoming sophomore &amp; intended cs major. I'm having trouble finalizing my schedule for this fall. 

for some background, I've taken: cs 61a, 61b, eecs 16a, math 1b. I've gotten an A in 61a &amp; 1b, PNP 16a, and am on track to get an A/A- in 61b

I want to declare cs and it seems like my options for classes next semester are either cs 70 &amp; eecs 16b or cs 70 &amp; cs 61c. 

my issue is that both schedules sound absolutely terrible. both are very high workloads and the first option is entirely math heavy. 

this fall will be my first semester in berkeley, so I kinda want to take a lighter course load so I can have time to adjust + explore the city. however, I don't want to take only one technical class since I've finished most of my breadth &amp; other requirements already and dont want to get behind. 

what are my options? is there an ""easier"" technical i can pair cs70 and stay on track? maybe even take 70 in the summer? pick up a double major/minor?? or am I stuck with the two options I mentioned?",1620191518,1,0
"EE16b curved, historically?","Is your final grade in EE16b curved, historically? Currently kinda panicking over the final, and threw together a sheet to get a sense of what I need on the final to get various grades. Since they haven't released any midterm or homework distributions, it's kinda hard to tell how I'm doing comparatively. For those who have taken the class in the past couple semesters, are the final grade bins typically shifted, or is that not really a thing anymore because of covid and pnp?",1620190468,1,0
"Any way to set up an automatic ""Swap Class"" if I don't get off waitlist?","Can't seem to find this option in the enrollment center, does it exist? Help!",1620190462,1,0
Armed suspect apprehended in the South Campus after police pursuit,,1620189937,1,0
Anyone lived in the Stebbins co-op (or any other co-op)?,"I got a spot in Stebbins and I'm trying to decide if I should take it. Haven't been able to find a house tour video for Stebbins and I'm wondering how big the rooms are, if the food is good, how messy it gets, and if there's a nice study area inside. If anyone could share their overall experience that would be super helpful!",1620189291,1,0
