body,created_utc,score,total_awards_received
"yeah.

I don't see what advice you would have to offer in pms other than a cup of anti-loneliness (maybe for you) and a bunch of personal preferences that are unscientific + only work because of the placebo effect. Hmph.

Like I said, my live lectures span from 8:30 pm to 7:30 am, with recorded ones in between. I'm taking 29 units this semester.",1604140663,1,0
"guessing from the timezone you're in asia (india? i'm indian, so I have the same dilemma). my advice would be to pretend as if all your deadlines are 12 hours earlier than they actually are. also, try and skip as many lectures as possible if (and only if) recordings are available and watch them asap but at a more sane time for you.",1604140256,1,0
"This opinion is popular, we just don't say it out loud, lest Oski hear us...",1604139535,1,0
Go fuck yourself faggot,1604139532,1,0
shut the fuck up,1604139512,1,0
if you make a decision on where you go to uni based off its subreddit then you're probably not good enough a critical thinker to do well here,1604139261,1,0
"And what are you doing with your life, trolling on Reddit? Get a fucking grip and go get some help.",1604138771,1,0
yes you need to do 5 at least per semester or denero will come and t-bag you,1604138712,1,0
"Don't really know why you're getting downvoted. It's a good school don't get me wrong, it's just that this is the first real semester of online teaching so a lot of professors are overstepping workloads and students are still adjusting to the format. Me personally, I hate online learning but it's my last semester so I'm willing to bear with it for a few more weeks. As instructors learn how much their students can handle and online classes become more of a norm things should settle down. Hopefully by then the university will show more of an interest in the well-being of their constituents",1604136949,1,0
"To be fair this subreddit isn’t a really accurate representation of the student population. There are actually a shit ton of conservative students at Berkeley, but they all tend to keep more quiet and reserved about it.",1604136687,1,0
chop em up like the saudis do,1604136630,1,0
Lmao I’ve seen a bunch of your comments you’ve really had enough of all this huh?,1604136602,1,0
Oops forgot to tell you but these neighbors tested positive after the party :),1604136430,1,0
People like you are the reason why everyone chooses to be left wing.,1604136426,1,0
"Ignore this dude, his acc is super new and already has massive negative comment karma because all he does is comment stupid shit. I was brought by his comment on my post, saying '[my] people brought it [covid] here'",1604136066,1,0
This subreddit is full of a bunch of snowflake entitled assholes who think their life is so hard.,1604135758,1,0
Wrong. Reporting people for parties/no masks is a liberal thing.,1604135655,1,0
On the other hand an A in data structures is very doable imo much less tricky and straightforward than CS61A,1604135601,1,0
Haha you got me there. Too funny of a joke.,1604135596,1,0
destroyed with facts and logic,1604135582,1,0
"what bill burr sounds like without an ounce of humor or ""facts and logic""",1604135525,1,0
The vast majority of people on this subreddit are lonely incel nerds who play league of legends all day and then complain how their life is terrible. boo hoo.,1604135493,1,0
"You mean the posts about reporting parties where people aren't wearing masks, right? Ok, if you deem snitching to be a negative quality that's chill, but no need to hate, and being a snitch doesn't correlate with being left leaning. What you brought up has nothing to do with politics.",1604135377,1,0
I really don't care.,1604135306,1,0
Everyone on this subreddit is an incel pussy who hasn't left their apartment in three months,1604135134,1,0
The numerous posts about snitching on people getting hundreds of votes. Like those incel pussies just play fucking league of legends all day never leaving their apartment for 2 months. Of course they don't give a shit about talking with people.,1604135104,1,0
Call the police!,1604134259,1,0
Outside Campbell hall when it’s not too windy:),1604134223,1,0
Maybe try teen line? Also maybe trying to take up some new hobbies might help; I know doing new things helps me sometimes :),1604134123,1,0
"Idk man, I'm admittedly center-left but I don't think this subreddit is very political at all. Politics isn't really a topic frequently discussed here, it's mainly for Cal students to vent or get advice on school-related topics. Do you have specific threads that you can point to which you feel are ""SJW-left garbage""?",1604134053,1,0
"I definitely learned how to study after freshman year.  I came in stressed out and unprepared and ended up barely passing one if my classes first semester, and have had 4.0s almost every semester since (I'm now a senior).  A big part of that is just learning to use your resources – the SLC offers tutoring for most intro math and econ classes, and office hours with you GSI or professor can be insanely helpful, even if you just come to group office hours to listen in and learn from the conversation.  It sounds like you aren't doing too badly to begin with, but trust me, you'll figure it out as you go.",1604133578,1,0
It really isn't. The only people who still think that are idiots like you who watch Tucker Carlson all day.,1604133457,1,0
B),1604133199,1,0
its bc we have some of the smartest minds on the planet,1604133104,1,0
Who hurt you,1604133080,1,0
Pretty ironic considering your people brought the disease here,1604132850,1,0
How do we find the enrollment manager information for a particular class?,1604132102,1,0
"I feel like being lonely during this pandemic feels hard to get through at times, especially for those who have never felt this lonely before. It's been hard with Covid and the pace of life feeling slow, pointless, and isolating. Just today I just wished I could study in the library on campus or do something fun for Friday that involves people. But also, I've always felt a bit lonely at school even before covid so I feel like I've built a bit of tolerance of not minding being lonely. 

The way I am dealing with my feelings is to either take a break by sleeping, eating, hydrating, talking to a family member I trust, exercising, watching tv, etc. Anything to get me to stop thinking in a sad cycle. This helps me take a step back and analyze my feelings. By kind of journaling or interviewing myself about why I feel what I feel, it feels kind of better. If I feel like I am lonely while studying I will reach out to someone I know is struggling too. If I don't have friends in the class, I might send a message to everyone if people want to join a group chat. I hope you stay strong OP. We can get through this together :)",1604132055,1,0
Shut up liberal. Go cry because Biden will lose.,1604131920,1,0
"Nothing in particular, was just curious if anyone knew about when they’d drop",1604131845,1,0
Whaaaat that’s awesome. Do you have one you recommend?,1604131322,1,0
Too young :(,1604130158,1,0
The semester is almost over and I haven't done shit,1604129653,1,0
"Thanks for answering. It's gonna be a tough decision for sure, but I'm not very confident in getting a B+ in CS70, although I will try to start doing some discrete math and probability questions from AOPS or something like that.",1604129496,1,0
"hi! I was diagnosed with adhd two years ago in my sophomore year of college and had similar experiences, and I have also tried many different types of medications for it. Feel free to PM me :)",1604129202,1,0
"imo i dont think you should drop. retaking a class seems like such a hassle, and even if you get a B you just need an A- in 61B and a B+ in 70, which is basically around the average",1604129114,1,0
"Lol sure, the cops just busted one of the parties.",1604128941,1,0
Ya but they are having fun,1604128828,1,0
:(,1604128777,1,0
"As unpopular as this is, if you know them report them. I can’t because these were a bunch a randos wandering around. And I’m so sorry, I care I wish more did.",1604128752,1,0
"Yeah, but if it makes you feel any better, everyone is going through the sucky loneliness in their own way. It is a share experience globally and an experience uniquely American. 

It will get better one day, and when we slough off this wretched moment we will be better and want better and make better our lives and other's. 

Remember you are doing more than learning; you are surviving. Give yourself grace, and know you're not alone.",1604128728,1,0
Following this,1603113432,1,0
what a perfect class lmao,1603108993,1,0
93,1603108492,1,0
"Dear Chancellor Christ,

I'm writing to ask about the campus' response to animal agriculture and UC Berkeley's current support of animal related products throughout campus. Does UC Berkeley plan to or have any comments about divesting from inhumane practices such as slaughterhouse suppliers for meat in campus eateries (Cal Dining, Bear Market, etc.), transfer to software based lab experiments instead of using live animals (rats, etc.) to test on, and so forth? Animal welfare concerns me greatly, and I know it does to many other students too, so I'm hoping to hear how UC Berkeley addresses this growing issue inside our campus.

Thank you",1603106782,1,0
"I am, and they're right. Your raw score by itself really doesn't say much about your grade in most EECS classes. 

I believe the semester I took 61C the average on the final was 30 something percent. Does that mean everyone failed the course? Of course not.",1603105720,1,0
"A lot of people already mentioned this on the post but I just wanted to reiterate this -- a 70 DOES NOT MEAN YOU HAVE A C. Y'all will know when you see the distribution. 

Regardless, you can't even comment on the grade just based on the exam because this is just a small part of your overall score which is what really determines your grade at the end of the semester.",1603104341,1,0
this might help me sleep tonight. thank you so much,1603104037,1,0
[deleted],1603104001,1,0
"Course staff here.

This was a hard midterm. The averages were lower than usual (most semesters anyway). Professor Sahai is gonna talk about the distribution tomorrow, so you'll know soon enough. Remember that the professors take all this into account while assigning the grades bins at the end of the semester. So if the semester was an exceptionally hard one for all students causing a drop in the total raw score then the final grade bins are likely going to reflect that too. If you really didn't do too hot, just remember that the midterm is only 15% of your grade. Don't stress about this!

Legend says Wagner made the midterm much harder at the last minute after seeing the ""Bring it on Wagner"" comment on Piazza",1603103872,1,0
Are CRS minors welcome 🥺,1603103444,1,0
Are CRS minors welcome 🥺,1603103394,1,0
"61a and 70 aren't really related at all content wise so it should be fine. 70 is more of a math class than anything else, there's no coding in it at all. Just keep in mind that 70 is a hard class and make sure that you give yourself enough time to study it.",1603102879,1,0
"Thanks for writing about her. I’m glad you met her even if briefly. Now I know why she took a sudden interest in CS last year. It makes me really happy to hear. I’m sure she would be happy to hear too.

I almost forgot that I made that post. I had the password scribbled down on a piece of paper but forgot what it was for and didn’t check this subreddit since then. Thankfully my old RA sent me your post. I hope you heard the soy milk story. It still makes me laugh and smile to think back on.",1603102497,1,0
"From my roommate who doesn't have a Reddit account but took the class over summer: ""Physics is very chill over zoom, especially lab. Partially depends on how chill your GSI is, but the labs are all answering questions based on video recordings, and they end up taking less than the allotted time (based on summer session). Everything besides lab is probably the same.""",1603102181,1,0
Can I ask what you think about CS61A and 70 at the same time ?,1603102126,1,0
Cool!! I’ll definitely look into this. Is there a lot of writing/ composition in the class?,1603101811,1,0
Oo okay ill check this out!,1603101771,1,0
ok Thank You!,1603101760,1,0
"Only took 7B and Math 54 before and took 7C concurrently (basically useless because the quantum stuff is covered at the very end), and while the first few weeks were a bit rocky getting used to the workload, it's definitely manageable.",1603101455,1,0
why would you put yourself through the 16 series if you can just take 54?,1603101189,1,0
"imo cs61b doesn't directly depend too much on the content from 61a but the coding experience from 61a is almost necessary for 61b, especially if your only prior experience is data 8. CS61b assumes that you already have a decent amount of coding experience (is 61a) so I would definitely recommend against this schedule",1603101150,1,0
Tried looking through my inbox / gradescope but can’t find it... I think mean was around 70 though? SD probably around 12-15,1603100909,1,0
"Nice

I'm a bot. Join my community at r/nicebot2 - [Leaderboard](https://redd.it/jdj6xc) - [Opt-out](https://redd.it/jdrs8u)",1603100842,1,0
"I got 69, anyone else?",1603100830,1,0
do you remember the distribution at all? :((,1603100493,1,0
"P/NP was designed to allow students to explore different curriculum for the reasons you listed, but it gets a little fuzzy when you factor in law school. different grad programs treat P/NP courses differently, to my knowledge many of them consider them to be a low GPA/failing grade, while very few just ignore them. be sure to fact check that point, because if that's not the case, then P/NP will be your friend.

among stem classes, while there are a lot of difficult ""weeder"" courses, you can still explore using the foundational curriculum set up to prepare people for those weeder courses like CS10 preps for CS61A, Data 8 preps for literally everything data, and \[insert third example here from a department that i have no knowledge about because lists are better in threes\]. 

you can use [berkeleytime.com](https://berkeleytime.com) to view classes via grade distribution and go for ones that are both interesting and relatively ""easier,"" just know that those tend to be popular ones (people like their GPA boosters) and so you gotta phase 1 just to get on the waitlist when they have reserved seats. 

if you're having a hard time selecting a major you can consider auditing classes and just sitting in on a few lectures to get a feel for some of the content. i'd also recommend talking to an advisor about course planning because assuming you're a sophomore in L&amp;S now, you should have plans to declare something by the end of this academic year to stay on track with their general guidelines. even if you have a major all set, if you're considering multiple majors you gotta plan that stuff out with a proper 4 year plan so you know what reqs to fulfill when.",1603100345,1,0
"If it helps anyone feel better I got around a 60 on my MT for the class spring of 2019 and ended with a B ! Keep your head up, go to OH, make study groups, be proactive and always review material day of or day after lectures. Y’all got this",1603100100,1,0
98,1603099838,1,0
"I'm enrolled in both 5C and 137A. Honestly, knowing Math 110 well will probably put you ahead of a good portion of the class. 5C is definitely not needed. In fact, I've found that 137A has helped me understand 5C much more than the other way around.",1603099631,1,0
"Do not take it while it's online. The cheaters fuck the curve. I took it for ""fun"" and I prob will have to late drop it due to the exam being insanely hard to compensate for cheating. For context: I'm currently acing 61a and 61b. I'm not a slacker by any means.",1603099406,1,0
"to my knowledge, effectively all technical courses in CS+EECS+DS are binned to previous semesters' grade distributions. it's basically accepted as common knowledge at some point, no need to be a course staff to verify it. when i took data 8 it was certainly binned, and it would be exceptionally strange for them to change that policy imo. 

your raw score is almost never a good indicator of your grade on the exam. they'll post a distribution on piazza or something and you can then identify your standing via how many standard deviations (sd) you are away from the mean. I've had exams in classes where 50/100 is the mean, and they curved to a B - i.e. if you got a 50/100 your grade would be a B, not an F.",1603098780,1,0
"Alumni here. Hey OP, I’m pretty sure I know the K you met because of the date. The story of how you met her sounds very much like her character. I think she was around the same age as you last year when I first met her. I’m guessing you’re a second year now based on your post. I was her and her best friend’s RA when they were first years.

Did she share the soy milk story? It’s probably my favorite memory as an RA.",1603098569,1,0
"They haven't released the distribution yet, and none of us know the final grade bins. Your raw score on this midterm means literally nothing. A 70 isn't a C; that's not how grading here works.",1603098257,1,0
"i think the value of ds is that it's inherently interdisciplinary; in the major itself, it requires you to select a domain emphasis, kind of like a mini-minor or concentration. given that (certain parts of?) economics works with historical data, trends, and the like, i think it would be useful to be able to analyze that information through all the various ds tools that are available. it may demonstrate a level of proficiency that certain technical roles may ask for, but at the same time economics is kinda broad, i dunno much about the subfields or what you're interested in. 

if your alternative to ds is to take ""interesting classes,"" then it may not be worth spending that time on non-interesting ds classes. i think (if you have the luxury to do so) if you don't like it, don't prepare to work in it.",1603098181,1,0
"i'm not sure how the recent changes to class sizes has affected data 8 but you may find it to be increasingly difficult to get into the course, as it was already pretty popular before covid. data 8 is meant to be an introductory course to programming+statistics, so my guess is that they changed something in the exams recently compared to before; that being said i still think it'd be worth trying to get into if you have the room to spare in your schedule, and you're not already signed up for a difficult spring. worst case after getting in you just drop before the add/drop deadline.",1603097884,1,0
tuiton is per semester in spring and fall. summer semester is only one where you pay per unit,1603097651,1,0
"My favorite English professors were Falci and Lavery, I would highly recommend either. Both are great lecturers and made me excited to go to class.",1603097567,1,0
Thank you so much for the insight!!,1603097539,1,0
Right! Thank you so much for this. I shall go with Shimizu then. Thanks :),1603097514,1,0
"No reason not to take it fall if it’s not a requirement! Might as well take an easier course load to focus your time and energy on reps imo. 

But if you think the class sounds fun and are interested in a data science minor, might as well give it a shot and drop it before the deadline if you think it will be unmanageable.",1603097420,1,0
two sides of the same coin,1603097232,1,0
"drawing with mouse only is pretty hard. of course I assume that this was drawn with mouse. As learned in elementary school, this picture needs a caption/explanation.",1603097154,1,0
"The missing homework’s are painful. You get a couple of drops tho so focus up and work hard, you should be able to pull a decent grade out.",1603096906,1,0
"Here's a sneak peek of /r/nicebot2 using the [top posts](https://np.reddit.com/r/nicebot2/top/?sort=top&amp;t=all) of all time!

\#1: [Roses are red Grover is dead](https://i.redd.it/mqncigh4t9t51.jpg) | [5 comments](https://np.reddit.com/r/nicebot2/comments/jbosvn/roses_are_red_grover_is_dead/)  
\#2: [Nice](https://i.redd.it/6br6wjn4bgt51.png) | [8 comments](https://np.reddit.com/r/nicebot2/comments/jc8yha/nice/)  
\#3: [About u/nicebot2](https://np.reddit.com/r/nicebot2/comments/jazajw/about_unicebot2/)

----
^^I'm ^^a ^^bot, ^^beep ^^boop ^^| ^^Downvote ^^to ^^remove ^^| [^^Contact ^^me](https://www.reddit.com/message/compose/?to=sneakpeekbot) ^^| [^^Info](https://np.reddit.com/r/sneakpeekbot/) ^^| [^^Opt-out](https://np.reddit.com/r/sneakpeekbot/comments/fpi5i6/blacklist_vii/)",1603096784,1,0
"Nice

I'm a bot. Join my community at r/nicebot2 - [Leaderboard](https://redd.it/jdj6xc) - [Opt-out](https://redd.it/jdrs8u)",1603096763,1,0
Does anybody know spring 2019 distributions? Apparently our midterm had the same distribution as spring 2019,1603096754,1,0
"I got 69.14, would that be rounded to a 70? If not, what grade do you think it'll be with curving?",1603096752,1,0
"[This website](https://ucannualwage.ucop.edu/wage/) says ~140k, not sure how accurate this is though.",1603096655,1,0
C- gang where you at?,1603096519,1,0
Yes but don't take data 8 until it's in person. Best to avoid curved classes altogether.,1603096420,1,0
Thank you! Appreciate it.,1603096285,1,0
Thank you! Appreciate it.,1603096281,1,0
Will do! Thanks so much! This past week has been the worst week of schooling I’ve ever had. I have to study harder and I’m sure I’ll clutch it out towards the end of the semester.,1603096249,1,0
Thank you for not making me feel along lol,1603096236,1,0
I'm missing 4 Hw's and I got a 50%. Do u think I can clutch a B-/C+ if I complete every assignment and do reasonably well on the final,1603096193,1,0
"This^^ also, it’s college, no one cares if you guys get a couple of b’s",1603096118,1,0
"I think that it's useful to list as part of your ""Relevant Coursework"" to demonstrate how you continued your interest in finance at school. I believe that you also learn DCF later on in the semester, but I took it when COVID turned everything to shit and didn't pay attention to that part. All-in-all, the course is 70% accounting and 30% finance, so the class is definitely useful, but I can't honestly recommend it as ""you definitely gotta take this class.""

To be honest, if I were in your shoes, I would take an easy 2-3 unit course like UGBA 123 and spend my time doing a finance internship while memorizing WSO and Vault's technical guide.",1603096113,1,0
"music 128 with prof. Nicholas Matthew! the professor really brings the class to life and is one of my favorite at Cal; no prior music knowledge/experience needed, class is intended for non-majors.",1603096095,1,0
"Who are you taking 110 with? If it’s Wallis, I’d suggest that as long as it’s online, take it now. Open notes + recorded lectures are really helpful",1603095908,1,0
\+10000 for Kleege!,1603095836,1,0
Trust me you shouldn't stress about this. I remember my first semester at cal I found out I failed my first midterm and called my mom crying at night. I was used to doing great in high school so that made me feel like I wasn't meant to be here. But I grinded for the rest of my exams and passed that class with a B+. If this is one of your first set backs then it'll definitely hit you hard but my biggest recommendation is to take this as a learning experience and try to do something to cheer you up a bit. You got this!,1603095775,1,0
"Oh that makes a lot of sense, thank you! I",1603095749,1,0
"I have a book club! We're reading ""I'm thinking of ending things"" then ""Pachinko"" this semester. English Undergraduate Association also has one. There's quite a few...",1603095617,1,0
"Not course staff, but in every class I’ve been in there’s been bin shifts, especially when the exams are harder than normal.",1603095605,1,0
F,1603095518,1,0
how can you say this for certain? are you course staff?,1603095488,1,0
Mad props to Professor Wagner for being understanding about the outcome and open to criticism.,1603095447,1,0
"It means that they decide like 85-100 is a range 70-85 is b range 55-70 is c range or something like that. Basically just not standard 90+ 80+ 70+ bins. Depending on how bad the average was the bins will be more generous. 

On a side note, don’t stress. Even if there’s no bin shift and you got a 50% you’re still at a 93%! Work hard for the final and you can easy clutch it out! I believe in you!",1603095428,1,0
RIP my dude,1603095313,1,0
I got a 50 lol,1603095311,1,0
What does a bin shift mean sorry can you explain? I failed this midterm and am considering withdrawing from cal :( I’m not in a good space right now,1603095143,1,0
Why doesn’t the university emphasize sports more? 38 NCAA titles compared to Stanford’s 126 is disgusting.,1603095082,1,0
I think all 189 hw's are done solo and last semester schewchuk didn't have any projects but it could be new,1603094630,1,0
"An 80.04, may go up bc a few of my answers were graded wrong.",1603094500,1,0
"80.75
honestly I thought it would be higher bc i thought i got the questions right🙃i actually tried looking into the answer key to find somewhere they graded me wrong",1603094238,1,0
Lower div music department classes have easy grading and tend to be chill,1603094122,1,0
I believe the artist also attended UC Berkeley,1603094036,1,0
"&gt; *'Its absence will be felt': 46-year-old Berkeley cafe Au Coquelet permanently closes*

Decluttered version of this SFGate's article archived on October 18, 2020 can be viewed on https://outline.com/e4gYaH",1603094027,1,0
"My bad I looked at the Piazza post and it had 2 editors, my app wasn't showing Wagner as the poster",1603093812,1,0
wagner said he did. so he lying now??,1603093715,1,0
