body,created_utc,score,total_awards_received
"https://lsadvising.berkeley.edu/sites/default/files/sim_degree_packet_september_2020_update_fill.pdf

Should give you more info",1637771281,1,0
Thank you!,1637771053,1,0
Karen is a sexist term that I'm thoroughly sick of.,1637770875,-18,0
[deleted],1637770567,2,0
best of luck to you and all the applicants. may you be accepted to your best fit.,1637770428,55,1
"Just curious, have you tried the one on Harrison St? I see people of all ages out there during the day and it looks like fun (I don’t know, I’m not a skater).",1637769547,1,0
"If you’re applying as a transfer, your HS grades are not taken into account - only your college grades are looked at.",1637768890,1,0
Those are the same schools i applied on the last application. Good luck!,1637768414,9,0
[deleted],1637768290,1,0
Anyone “surprised” this isn’t in the media at all?,1637768034,1,0
what’s LIS? and Cayley Hamilton is a super cool theorem,1637766573,1,0
It’s not me,1637766442,1,0
"Hey, if you ever want someone to talk to in person, or just a friendly face, let me know. I’ve gone through similar transitions and grad school is insanely difficult for me too, so I’m here to support you.",1634649786,4,0
"Constantin Teleman’s Math 54, Fall ‘19. I have always believed people were good in the face of adversity and evil. But Teleman taught me that people like him are truly soulless and heartless in this world. It was an eye-opener that popped my bubble - a stark contrast to my idealistic view of this world. 

I would recommend taking his class if you want to truly mature and grow in this world, being able to stand back up after being beaten up by a bully who steals your soul.",1634648198,4,0
You're going through a major life transition after 18 or so years with strong support and friends. You'll go through several more throughout your life. It's a skill you'll train throughout your life and now is a good time to start,1634646204,2,0
"It's been a recent change I think. A lot of seniors would hold off on taking this class until their final two semesters, and the department did not like that, so they enforced this new rule change to counteract that.",1634638137,2,0
The best thing to do is to expose this PoS and make it viral.,1634637564,5,0
Also don’t forget L&amp;S has a late drop or two available!,1634636806,1,0
"16x, 186",1634636051,1,0
Fr lol,1634636041,1,0
Yes! The recoding is [here](https://www.youtube.com/watch?v=TGNCwiZ5IKY),1634635183,1,0
study abroad also may be good? pretty sure it doesnt cost even 10k to study abroad in some east asian countries for a semester,1634634994,2,0
damn,1634634934,-2,0
i watch all the video modules and do the assignments; havent done the readings tho,1634634364,1,0
Ah yea I heard about that. Do you know if this is a recent change? Or has it always been like this,1634633753,2,0
long asf but none of the problems were super hard at least,1634633464,7,0
Thank god swe doesn't need ee,1634633249,6,0
That's some amazing low light camera performance,1634633049,2,0
"I find it cool that there are so many smart people here, to me it feels like an honor to be a part of that prestige",1634633030,4,0
Noted! Thanks!,1634632507,1,0
omg thank you!!,1634632499,2,0
[deleted],1634632437,1,0
"Definitely Phase 1 EECS16B, especially if you're a sophomore this year. Juniors and seniors get no priority for that class anymore.",1634632185,2,0
Freshman programs are your best bet unless you have lots of experience. You can aim for small startups as they are less competitive,1634632146,2,0
"It definitely is possible, but unlikely. Don't beat yourself up if you don't end up getting an internship for this summer. Apply on places like Handshake and Indeed. Get your resume reviewed by UPE. Here's a helpful list of 2022 Summer internships (it's also constantly updated to include new listings). Good luck!

[https://github.com/pittcsc/Summer2022-Internships](https://github.com/pittcsc/Summer2022-Internships)",1634632091,5,0
"I took both of them last spring!

It’s historically pretty easy to get an A in NST 11. No science background required! Three professors teach it. The first one gives you the answer key for his midterm in his final lecture. The second was iffy, not very specific and wouldn’t offer a study guide. The third gave “exam keys,” which were basically the exam concepts/questions.

For UGBA 135, skim the readings and watch the videos/use the transcripts when completing assignments/quizzes.",1634632044,1,0
"For me, I haven't found the people I mentioned my comment above, aside from my roommates. A lot of friendships seem to be rooted in the common things between people, like if they're in the same classes and major, as an example. This is not always the case, but in my experience it has been like this. I need better luck in finding more friends for sure.",1634631648,2,0
"I mostly agree, except that I actually enjoyed Legends Season 1 and 2, and thought Arrow Season 4 and Flash Season 3 were bad. Savitar was revealed way to late in Season 3 and Arrow Season 4 was just poor writing all around. I agree that it all declined significantly around that time though, which was truly a shame. It seems like CW shows have a lifespan of about 2 years until they start sucking.",1634631508,1,0
"For some people college was the best time
of their time. For some it wasn’t.",1634631260,4,0
Flash S1-3 and Arrow S1-4 were the peak and then it fell to shit. Imo legends of tomorrow was never ever at peak,1634631134,2,0
"I think you need to take a mental journey, take a walk, look at nature, and then you'll find yourself and live.If necessary, a [spiritual sustenance](https://www.vapeciga.com/products/eleaf-iore-1600-disposable-vape-kit-1600-puffs-850mah-4ml) is also essential.",1634630976,0,0
"we are in the same school because we each have our own strengths, that's what I tell myself. I recommend reflecting on all the things you have done to get here and you'll see that you are a very accomplished individual. Plus estimating you are in the age range of 18-26 (since I think the average is somewhere there) you have about 50 to 60 more years before you expire (according to google). So you have time to learn so much more",1634630829,7,0
"Yeah, I hate college (two years in so definitiely not a ""transition"" thing) but I also hated high school. Figure I'm gonna hate life after college too lol.",1634630767,8,0
2. Some parts may be boring but keep up with lectures/videos and you'll be fine,1634630598,1,0
"Those happy people you see might be on meds. You wouldn’t know. Try schedule those free talk therapy sessions at the TANG center. They were legit. Helped me out a lot. Best of luck.

Edit. Typo",1634630588,10,0
&lt;3,1634630567,2,0
"As a depressed, borderline alcoholic I'm gonna second this. Human connection, more than vague, self-help platitudes or tired cliches like journaling, has done me wonders. The perspective you get helping people who need even more material support than you combined with the genuine gratitude, camaraderie, and sense of worthwhile accomplishment that helping others provides have done more for me than any therapist has managed to. Systemic isolation and alienation, I think, are seriously overooked when assessing the cause of ever-more-common mental health issues like depression, anxiety, and loneliness. I volunteer regularly at the People's Park kitchen, but just start somewhere. Worst case scenario, you're right where you started, but a few people who needed help and wouldn't have gotten it otherwise did because of you. Seems at least worth a shot.",1634630454,1,0
"&gt;'hairy theory' 

why is this so funny??",1634630429,4,0
"PragerU is a very scary kind of disinformation org, it preyed on a lot of blue collar people and people who are weak at critically thinking for themselves.",1634630337,2,0
"skip ugba 10, complete waste of time, also orms kinda sus, i used to be orms, suggest you talk to orms grads and see what they are doing now.",1634630262,1,0
I agree definitely seek legal counsel,1634630171,2,0
Queery Theory DeCal,1634630127,1,0
"I was in ur shoes back in 2019. What i did was withdraw (for a semester) which gave me room to breathe and think clearly. Then i was able to figure out a strategy to pivot from my prev major to my current one. And i gotta say changing my major was probably the best thing i could’ve done for myself here at Berkeley. 
Either way giving yourself a break always helps, good luck.

Edit: However, if you’re a freshman it could just be the transition (which aren’t always the easiest).",1634630054,7,0
"Trust me when I say this, you're not alone. In fact, I have many of the same feelings about not just college, but life and the society we live in. Everything is rooted in superficiality and impressing your peers, especially at this school. There is a lot of glorification about the number of units people take, the majors they are in, and the jobs they get afterwards. It's all fucking bullshit, and fuck the people that are like that. We are all still humans at the end of the day, all living on this Earth, which is just a tiny, tiny object in the grander scheme of things. 

I have zero fucks left to give nowadays. I don't give a fuck about your cool jobs, how smart you are, and how you're a part of so many clubs while maintaining high grades. My goal is to graduate, get a good job near my family (one that will pay just well enough, I'm not looking for a 200K job out of school like some brainless idiots speaking from their ivory towers), and live out the rest of my days.",1634629909,1,0
You get the hang of it and it gets much better. I don’t know anyone who goes around saying that freshman year is the best time of your life.,1634629753,6,0
Sounds like you just dont like college,1634629653,2,0
Lol why would you think any of the eateries in this city are not full of mice/rats? Are you kidding me this is probably the cleanest place in Berkeley by comparison lol,1634629552,-15,0
"i took it during the pandemic

there are suggested trails but you essentially go by yourself

I've done fire trails, strawberry canyon, redwoods regional park...",1634629479,3,0
"I used to be a huge fan of Arrow Seasons 1-2, the first half of Season 3, and Season 5, as well as the Flash Seasons 1 and 2. I watched some Constantine but not a lot of it since it didn't really appeal to me. This was a nice trip down memory lane, since the Arrowverse sucks now.",1634629472,4,0
I love how you two beautifully phrased it! It's such a positive mindset to have! Super awesome!!,1634629464,4,0
Prompt: listen to this speech while having a drink at Free House and taking in the photos crowning the room and reflect on how the culture of Cal has evolved since these events took place. What relevance do Davis and Marcuse's arguments hold for UC Berkeley in 2021? Have we addressed their concerns or sunk further into the morass they paint?,1634629436,1,0
"ib 157f, paul fine.",1634629432,3,0
"Thank you so much for your reply! Math 110 sounds cool! I still don't see CS C191 listed, but probably wouldn't be able to take it bc it lists Physics 7C as a pre-req. Thank you again for sharing some nice suggestions!",1634629363,2,0
All the fucking time. How am I even at cal,1634629236,9,0
Is this a marriage proposal?,1634629187,3,0
[deleted],1634628973,1,0
"DSP was so important for me, and I highly recommend it dude. You should first find either a Berkeley psychiatrist if you have SHIP or CAPS approved psychiatrists in the area who accept other insurance (there's a link to a database on the CAPS website). I got my psychiatrist through the later option, straight up asked him about Berkeley DSP during our initial intake appointment, and a few days after diagnosis he filled out a form for me and I applied for DSP online using his letter.

Downside is that this process is really slow, especially if you need the accomodations ASAP. Not only do you have to get diagnosed, for some reason DSP is slow as shit this semester and responds to emails in like 2 weeks 😒 I recommend talking to your professors this semester if you feel like you need it and explaining your situation, a lot of them are pretty understanding.",1634628928,1,0
I believe you get connected to a counselor immediately - not like the daytime CAPS where they schedule you. It’s good for when you’re in an acute crisis,1634628744,5,0
"cs 70 should be safe to phase 2.

i would definitely phase 1 the last 3 classes if these 4 are your choices",1634628502,2,0
"""Maybe""? Palantir is _above_ $200k, according to my friend who got an offer from them — and quant firms like Jane Street can go up to $370k first year including the starting bonus.",1634628126,1,0
"Man, That guy interviewed me too! While I am not in that video, but he asked me what I felt about 9/11, whether the US deserved it or not. I told him that ""nobody deserves that"" and amongst bunch of other things that apparently did not make the cut as I am not in that video, but this feels sketchy as f. He told me that he was making a video for 9/11 survivors and vets, wanted to say a few nice words... damn",1634628121,11,0
"Lecture is just stuff from the book/homework but with examples.
But tests are just based on the book/homework, without examples.
So you should be fine. Just review the homeworks again.",1634627846,1,0
"he actually supports the Taliban and wanted this video to gain more views for more money, oof. He should be placed on the FBI terrorist list.",1634627839,1,0
Is 16B + 170 in spring a good combination？ I saw people suggest taking 170 as 1st upper-level class.,1634627757,1,0
"Yeah, they were nice and all but I had never felt so worthless in my life for the duration of the time I talked to the person in question.",1634627622,9,0
"Used to hike to soda hall

Soda hall is on a hill. The people who decided to put the building there there made sure everyone in the engineering department got their daily exercise",1634627574,7,0
"That was a hard exam, you should cut yourself some slack! My recommendation is to do lots of practice problems. Chem is learnt not by reading a textbook! And if you can’t figure out a problem, go to office hours!",1634627381,3,0
"Oh nice, thanks!!",1634627322,1,0
where can I find this view?,1634627288,2,0
[removed],1634627273,1,0
"gitlet would belike beest did reuse if 't be true i hadst to wager a guess

***



^(I am a bot and I swapp'd some of thy words with Shakespeare words.)

Commands: `!ShakespeareInsult`, `!fordo`, `!optout`",1634627259,-1,0
gitlet would probably be reused if i had to wager a guess,1634627245,3,0
"Your two kids are wonderful, and you are an awesome dad.",1634627193,1,0
z=(x-mean)/stdev,1634627172,1,0
You have all the prereqs so you could. I doubt you’d get off the 189 waitlist  as it normally fills up extremely fast,1634627110,6,0
It is! Maybe you should look into it!,1634627105,8,0
you get two of them?? :o,1634626961,2,0
"Took that class a loooong time ago, so keep that in mind here, but I remember it not being that bad in terms of course load. A bit of reading but interesting reads that it wasnt a chore to read them",1634626710,3,0
me after a friend tells me the big brain insight i missed on an exam :((,1634626460,1,0
The entire first floor of Evans is so disorienting. Every room feels much smaller than necessary with weirdly tall ceilings. It feels like everything was minized to make room for some element that simply doesn't exist. I hate this building and hope I live to see it torn down.,1634626456,1,0
Nope these are just regular [Chilli Bomba ](https://www.chillibomba.com),1634626454,1,0
"thank you, i really do appreciate it. the meetup idea sounds really interesting, i would really like to meet more people at cal who have bipolar but to be completely honest i still feel a little uneasy divulging this stuff to people in real life.",1634626437,1,0
"The thing is, most big company internships go only into Data Structures, no one delves into algorithms since that’s a class you usually take as a junior at most strong CS schools. And if you take 170 too early, you might run the risk of forgetting about things for when you do need it for full time interviewing circa Fall of senior year.",1634626249,4,0
Wtf - is queer theory an actual thing lmao?,1634626102,1,0
Did you put weed in it?,1634626009,2,0
"The smart move would probably be to save Data C104 for Phase 2.  Only because that’s a class where you probably can find other substitutes in case it is full.  70 is sufficiently large this time, so you may be ok for Phase 2, but if you really need the class this semester I wouldn’t mess around with this one.",1634625975,2,0
"internships, knowing the knowledge earlier gives it time to accumulate and be built upon (i.e. take future classes) and some classes are just more interesting than doing 50 page sahai homeworks/exams every week on stuff you don't care about",1634625964,5,0
in a similar place as you. hang in there friend; we got this.,1634625959,17,0
"Imo that's not really too bad, it could be way worse. They're all pretty different styles of classes, though, which could be a benefit for some and a detriment for others. I, for example, would be ok with this schedule, but not ok with 3 problem set classes.",1634625913,5,0
get married,1634625786,3,0
"The most important thing is that you have to cast a net very far and wide. You should apply to a minimum of 100 places.  If you sent them out say at the end of August, you should have heard back from some of them by now.",1634625718,3,0
[deleted],1634625704,1,0
"Can everyone here come to how this video is bullshit and taken out of context, there is way to much support for this video",1634625652,3,0
"Be sure to reach out to TA's and tutors for help as well, DSP accommodations will give you more time per assignment/exams, but if you don't know the content you can't remember it with that extra time. Easier said than done, especially on those ""all day in bed"" kind of days, but unfortunately it is a necessary part of catching up when behind on CS content.

Look to office hours and maybe additional tutoring options if that's not enough, but CS10 should have pretty good support from what I remember hearing from my friends on staff.",1634625467,1,0
"This may sound cliche, but I’ve honestly found volunteering at places like homeless shelters and food kitchens can pick me up when I’m low. I think compassion is one of the best ways to express gratitude, which can really help. I’m sorry you feel this way - there are resources to help at CAPS, but my DMs are open as well.",1634625333,1,0
Yeah for sure a key indicator that a learning environment is good is if there are a lot of people smarter than you around.,1634625253,20,0
My back hurts,1634625244,17,0
"Very much not alone, you're in [""dumb""](https://www.google.com/search?q=site%3Areddit.com%2Fr%2Fberkeley+imposter&amp;rlz=1C1CHBF_enUS831US831&amp;sxsrf=AOaemvL_2ne4gDUjeBWK40COTGJSnpOXbQ%3A1634624671832&amp;ei=n2RuYaX8MZuxytMPhOeqiAw&amp;ved=0ahUKEwjlx56369XzAhWbmHIEHYSzCsEQ4dUDCA4&amp;uact=5&amp;oq=site%3Areddit.com%2Fr%2Fberkeley+imposter&amp;gs_lcp=Cgdnd3Mtd2l6EAM6BwgAEEcQsANKBAhBGABQ805YgFpggltoA3ACeACAAUGIAZoDkgEBOJgBAKABAcgBA8ABAQ&amp;sclient=gws-wiz), [sad](https://www.google.com/search?q=site%3Areddit.com%2Fr%2Fberkeley+sad&amp;rlz=1C1CHBF_enUS831US831&amp;sxsrf=AOaemvKEe7rgolA3pgBge5F1Iys1rfloAQ%3A1634624684222&amp;ei=rGRuYeGHDZbWytMP4t66qAs&amp;ved=0ahUKEwjhjZO969XzAhUWq3IEHWKvDrUQ4dUDCA4&amp;uact=5&amp;oq=site%3Areddit.com%2Fr%2Fberkeley+sad&amp;gs_lcp=Cgdnd3Mtd2l6EAM6BwgAEEcQsANKBAhBGABQ6IkBWJ2LAWC8jAFoAnACeACAATeIAZ8BkgEBM5gBAKABAcgBBMABAQ&amp;sclient=gws-wiz), [stressed](https://www.google.com/search?q=site%3Areddit.com%2Fr%2Fberkeley+stressed&amp;rlz=1C1CHBF_enUS831US831&amp;sxsrf=AOaemvKpQaxNEv689cm6I4TZuAQLtuCHJg%3A1634624702907&amp;ei=vmRuYYjhNrKFytMPq5aNyAM&amp;ved=0ahUKEwiIuIfG69XzAhWygnIEHStLAzkQ4dUDCA4&amp;uact=5&amp;oq=site%3Areddit.com%2Fr%2Fberkeley+stressed&amp;gs_lcp=Cgdnd3Mtd2l6EAM6BwgAEEcQsANKBAhBGABQyV1Y_WNgm2VoAnACeACAAUWIAb4DkgEBOJgBAKABAcgBBMABAQ&amp;sclient=gws-wiz), and [depressed](https://www.google.com/search?q=site%3Areddit.com%2Fr%2Fberkeley+depressed&amp;rlz=1C1CHBF_enUS831US831&amp;oq=site%3Areddit.com%2Fr%2Fberkeley+depressed&amp;aqs=chrome..69i57j69i58.8138j0j4&amp;sourceid=chrome&amp;ie=UTF-8) company in this wonderful berkeley community. None of us really know how we're gonna get through it, but just holding on for dear life seems to do the trick. 

I knew of four or so people during college that seemed to intend to drop out from Cal indefinitely -- I searched em up recently out of curiosity and they all made it, graduating soon, already graduated, working, etc. Shit was hard for them, mental health issues being unaddressed, unsympathetic administration, unsustainable lifestyle choices/expectations, and the like.

Shit's not over til you say it's over, even if you can't face it with a smile or make progress on these issues regularly, holding on in these situations is enough. 

[Talk to a CAPS counselor](https://uhs.berkeley.edu/counseling/individual), they've streamlined the process in recent semesters so it's more straightforward to get help now.",1634625235,38,0
"brotha, as someone whose in grad school right now, I've been going through your exact motions for the past 6 years of my life. Undergrad at the top university in the world can be difficult but you have sooo much support ready to help ya. Whether its on campus support groups, random encounters, or whatever else you can find, there are so many other undergrads in your exact position. I believe in you, and I as an alum am hundred percent confident you have everything it takes to easily surpass your current challenges. Don't let meaningless self expectations of one self ruin your own perception of your self. Keep your head high. Seek hobbies, such as gym or running, look for new and different environments around the campus that could possibly make you a little more happy. I hope that you know you can always count on strangers around you, because this is Berkeley and We're all here for you no matter the situation!",1634625170,80,0
"You do get better admissions odds as a transfer from a CCC as opposed to a OOS CC, or any other 4-year college for that matter.  From the standpoint that CCCs do get priority as a high percentage of transfer students are mandated to come from CCCs.  So I think the the second option, all other things being equal, would serve you better.

Obviously you have to have high grades and all the other stuff too, that admissions folks look at.",1634625090,2,0
"Get dsp if you feel you need it, it will help! 

Basically, the process is you get a medical professional to fill out a form documenting disability, then you're scheduled with a dsp specialist to get an interview where they go over your documentation and figure out where to give accommodations. Then you go through the dsp website and email accommodation letters to the professors. If you want accommodations for this semester, youll need to get this done asap because retroactive accommodations arent allowed. 

No downsides on employment, theres no way an employer would know",1634624931,1,0
"Shakespeare-Bot, thou hast been voted most annoying bot on Reddit. I am exhorting all mods to ban thee and thy useless rhetoric so that we shall not be blotted with thy presence any longer.",1634624631,14,0
"Wurster is often really cool and usually quiet, check it out",1633603161,1,0
IM volleyball is a thing,1633602889,2,0
I used to just walk around my college town and walk in wherever I heard loud music. Worked for me.,1633602560,5,0
"eps c20 with rademacher, interesting lectures and single 1-2hr assignment per week",1633598655,2,0
Yeah not everyone at Berkeley is an incel,1633597799,1,0
Is that a place?,1633597327,0,0
"I'm surprised to see Wet Leg (band of Chaise Longue"") on here (at 0:50). They seem to be super new. Wet Dream is a bop, though!",1633596831,1,0
Gracepoint,1633596549,2,0
But maybe I should just wait until I’m done with this class. His section is useful and I don’t wanna lose that resource 😂,1633596272,18,0
That seems like a better approach,1633596231,9,0
CS is one of the most science and tech related fields but also relies on faith and rituals,1633596171,5,0
compliment his ass next time you see him,1633595994,20,0
I think that might be jumping the gun a bit 😂,1633595838,13,0
Can C106B be taken without C106A?,1633595702,1,0
"Since you are a dude I have to admit you might be right about this, shoot your load bro",1633595596,28,0
"Yeah, that’s what I was wondering. Like does this sort of thing happen in real life? Or just porn? Also I’m a dude btw.",1633595392,44,0
You’ll have to use your late add,1633595389,1,0
LMFAOOOOO,1633595326,24,0
Totally possible he’s just being nice. Also a big reason why is that people are rarely openly complimentary to guys (especially other guys) because of how the patriarchy frames gender relations (I can explain further if you want). But basically guys can’t tell the difference between platonic kindness and flirting.,1633595311,23,0
"The Songwriting club meets every Wednesday, if you like to jam out or write music, people are welcome to join anytime :)",1633594632,3,0
[deleted],1633594562,2,0
i do you're mom 😏,1633594468,1,0
trueeee,1633594372,2,0
We out here but also that anti bierasure email lol all bi ppl be like is this for me 👉👈,1633594269,9,0
