body,created_utc,score,total_awards_received
"**Beautiful, you are.** 

 *-YodaOnReddit-Bot*",1611488832,13,0
"Thank you, spacemanultra, for voting on YodaOnReddit-Bot.

This bot wants to find the best and worst bots on Reddit. [You can view results here](https://botrank.pastimes.eu/).

***

^(Even if I don't reply to your comment, I'm still listening for votes. Check the webpage to see if your vote registered!)",1611488824,1,0
Good bot,1611488813,11,0
"Is protesting worth your degree? If it is then go, if not then don't go.",1611487443,-37,0
what do you want people to do instead,1611486644,1,0
"Да, безусловно, университет понимает такие неловкие ситуации. Я думаю, что получение неполных оценок в этом случае не является идеальным вариантом. Ты можешь заранее отправить письмо описывая  твою ситуацию и попросить исключение из университета если тебя арестуют. Затем можешь повторно подать заявление, когда тебя выпустят. А это будет несложно, они признают, что у тебя неловкое положение. Удачи!",1611486514,13,0
"I took both in the same semester and got a C for EE127 and an A- for CS170. EE127 is a lot of complex math (linear algebra x.x) and was really challenging for me. CS170 felt a lot more intuitive and became really useful in my SWE career.

(whatever I'm saying from here on is based on Fall '19)workload wise, I would say on paper EE127 seems to have lesser work (since it doesn't have a project), but I spent so long on all the homework. The slides are less useful, hence I read a lot of the textbook which was way more time-consuming. CS170's project didn't take much time, and the readings they provided were not as long. CS170 has great materials and great TA support too.

127 is definitely more difficult. I'm really weak at math so I completely flopped at 127, I would say its a lot harder to get an A. It's actually a miracle I got a C because if you ask me to tell you what I learnt from 127, I can't even give you an answer. A few years after I took these courses I realized that data science isn't really for me, so I'm completely biased. Take my opinions with a pinch of salt!",1611485442,1,0
"I think you have to order a transcript, with a $1-2 processing fee.",1611484738,1,0
"Durant Taco Bell wasn't a place, it was a state of mind :(",1611484300,10,0
"Too bad you didn’t get the Hilfinger proj0, the so-called “finger exerciser”.",1611484005,27,0
Ah ok that makes sense then.,1611483720,2,0
"**Probably get incomplete, you could.** 

 *-Winstonp00*",1611483526,35,0
You could probably get incomplete.,1611483508,76,0
I thought this was gonna be another “cs70 too fuckin hard and no one wants to help me and now I won’t be able to declare” but instead this guys just mad he might not make as much money as other people lol,1611483287,1,0
Sending prayers comrade 🙏,1611482995,40,0
[deleted],1611482886,1,0
"I am trying to process this rant and here are my thoughts. I don't know why you would feel way ""poor and useless and stupid without getting a CS degree"", but I am sorry for what you went through. However, you don't need to be in conventional major to succeed in life or make money, there are countless examples of this in the workforce. I'm glad you go to therapy because it's a great resource. Personally, I've rarely met anyone toxic as a CS major and most of my interactions with EECS staff and other CS majors have been positive and extremely welcoming. I seriously hope you don't really ""hope everyone in the Bay Area dies of suicide"". Yes, there are toxic environments and needlessly competitive culture and the pay disparity between other jobs are big, which in itself is a problem with society not just Silicon Valley/Bay Area. Aspects like the recruiting process is extremely stressful on applicants and it sucks because it's actually toxic, but you don't give up. If you're in toxic environment, you can persevere or just get the fuck out of there. I don't think Berkeley CS culture is toxic, please meet the right people. :)",1611482785,2,0
[deleted],1611482687,1,0
"Here's a sneak peek of /r/recruitinghell using the [top posts](https://np.reddit.com/r/recruitinghell/top/?sort=top&amp;t=year) of the year!

\#1: [Gold](https://i.redd.it/5v8l4mvww1q51.jpg) | [210 comments](https://np.reddit.com/r/recruitinghell/comments/j1vm8j/gold/)  
\#2: [Anyone relate to this?](https://i.redd.it/kouc26ubiz761.jpg) | [518 comments](https://np.reddit.com/r/recruitinghell/comments/klxtso/anyone_relate_to_this/)  
\#3: [We don’t count internships as experience here, so let’s just forget all of that](https://i.redd.it/4bzgh0kfb2h41.jpg) | [397 comments](https://np.reddit.com/r/recruitinghell/comments/f47kxe/we_dont_count_internships_as_experience_here_so/)

----
^^I'm ^^a ^^bot, ^^beep ^^boop ^^| ^^Downvote ^^to ^^remove ^^| [^^Contact ^^me](https://www.reddit.com/message/compose/?to=sneakpeekbot) ^^| [^^Info](https://np.reddit.com/r/sneakpeekbot/) ^^| [^^Opt-out](https://np.reddit.com/r/sneakpeekbot/comments/joo7mb/blacklist_viii/)",1611482404,1,0
Yeah and that dude literally wished back in r/recruitinghell that I lost my internship pepeBRUH.,1611482386,2,0
OP needs to leetcode DP hard more,1611482290,1,0
lmao buddy dont be mad just because ur not smart enough for cs/eecs. at the end of the day we get 6 figures out of college while ur still broke. bum,1611482169,1,0
Headed to Bongo Burger!,1611482057,3,0
"\&gt;  complains about mental health crises  

\&gt; ""I hope everyone in the Bay Area dies of suicide"" 

omegalul",1611482033,2,0
Yep I need a gpa booster. I’m also an out-of-state student so it wouldn’t even necessarily be cheaper and overall not worth the hassle since I want a gpa booster.,1611481785,2,0
Congrats!,1611481647,6,0
I miss living in the COOPs of so much! You won't regret it,1611479192,2,0
"If you’re only going to take an English class in the summer, why not just take it at a CC and save the $$?  Unless you need a potential gPA booster.",1611477975,2,0
\#gatekeepventing /s,1611477916,-11,0
Thank you for sharing this,1611477187,3,0
[deleted],1611476306,1,0
"Dude, there's nothing wrong with having mental health issues. But there are proper outlets for it. Filling a sub with depressive thoughts is not going to help anyone involved. Nobody here is professionally capable to handle these tough topics. 99% of the rant posts don't even reply to comments—nothing productive comes out of it.",1611476237,14,0
More like English major,1611476198,1,0
What do you expect to hear on r/berkeley?,1611476058,1,0
When you didn’t even have friends in high school...,1611475991,2,0
Sharma?,1611475910,2,0
I'm so sad since I didn't turn 21 till after COVID so I never got to try a boozy freeze from that Taco Bell :/,1611475841,6,0
"I was thinking about withdrawing this week after already being burned out, but graduating is quite important I guess unless you want to work part-time jobs forever or make your own company. But the part about being able to get a decent job needs more background to be more convincing. I personally don’t know how a person who didn’t graduate can get a decent job after a few years of trials and errors. You had your BA alright, but what if you withdraw from college completely and try to land on some decently-paying job. It’s hard in normal times, and even harder at a time like this.

I’m gonna force myself to stay in college regardless of how well I do. Having a college degree is so different from just a high school degree from the perspective of almost any employers. It’s not the most ideal, but it’s the reality for now. I’m not even gonna go into how much you need to pay to get that degree, which like OP said, is quite worthless a few years after graduating.

Tl;dr College is a scam but I’m here bc I wasn’t educated enough on the alternative routes I could have taken instead of spending a quarter of a million bucks.",1611475543,2,0
"Idk, it seems that there's a lot of support for mental health issues, especially during the semester and *especially* even more so compared to other subreddits. Though in the beginning getting -1 on your post because two trolls decided to downvote can be pretty discouraging",1611475333,7,0
I did mine last week and spoke to a counselor. You fill out the Expected Graduation Term Change Request and then you email it to lspetitions@berkeley.edu,1611475282,1,0
apparently it comes back in 3 days.,1611474995,4,0
Was this the same streetcar that went out to Solano through the tunnel?,1611474922,2,0
And here I was thinking I was the only one taking way too long to finish a single homework assignment. I literally took my last calculus class more than two years ago and I was dying. Took me the good part of today to finish it.,1611474436,3,0
"The new course should pop up shortly on bCourses with class links, etc. Making up stuff varies by class/professor/GSI. Best to email/go to office hours and confirm.",1611474405,2,0
+1 on this one *sigh*,1611474401,1,0
"i took espm 15 last spring and it was interesting. we covered a ton of different topics in environmental science which i thought was cool, it sorta felt like a survey of all the different sub-fields of environmental science. pretty chill class too",1611474156,2,0
[deleted],1611474138,1,0
[deleted],1611473701,5,0
"depends on the class and prof tbh, i added a class late once and was forced to use a drop on the lecture quiz i missed :(",1611473609,1,0
"As a fellow old currently working on my first degree, I agree with you.  However, at a school full of brilliant, driven high-achievers, you might not find your ideal audience with this message.  

High undergrad grades aren’t everything, no, but its a gateway to grad school more the majority of the students at Cal.  I admire their dedication and hard work ethic and I do wish they were able to channel more perspective, but I also understand the stress of needing a minimum GPA to maintain their ends.

That said, taking deep breaths, remaining focused on your goals and celebrating every single little victory sure as hell helps when your grades don’t reflect your perceived efforts.  

More so than I blame those aspiring to higher educational goals, I blame the system that creates such narrow and rigid paths to grad school.",1611472779,2,0
"all those times I walked through that intersection, never knowing...

https://i.imgur.com/PIJzkSA.jpg",1611472732,9,0
im so used to fake history memes that I was genuinely confused for a sec lol,1611472665,3,0
this comment deserves gold,1611472355,3,0
"Well there's 2 parts to this:

Issue 1: Majors/classes will gradually get harder over time. Like classes overtime are just gonna have to learn more/do more, especially considering Data science is a newer major. Like in the first year d100 was offered it was maybe half the difficulty it is now. 

Issue 2: This has less to do with the class and more with EECS budget cuts. We've seen eecs lose funding and seats and currently lots of cs students who couldn't make the 3.3 gpa cut are taking data science and we see lots of econ/haas students double majoring in data science. There's been lots of talks about even raising the GPA requirement from 3.3 to like 3.5 or 3.7. However if data science is available there's still gonna be issues with seats being available. This is gonna sound really bad and honestly probably isn't even right but if everyone sees data science as an easy major and the current pre reqs are just a 2.0 GPA then that will put a lot of pressure on cs classes. Especially just due to the overlap between the 2 majors(and I'm one of those people basically just doing this as a cs major with a dash of statistics and ML). So there's 2 ways to maybe lessen that strain and it's either make the pre req gpa higher or make the data science courses harder to maybe discourage people from just adding it on as a second major. I have a bunch of cs/econ friends who just add data sciene as a second major just cause there's a lot of overlap between the 2 majors but there's only so much funding for these classes and something needs to be done.

Now again these are my own opinions and I could be completely wrong so take it with a grain of salt.",1611472277,2,0
"yeah i commented on this issue earlier on a post that is one of the top in this sub, people come to troll on this sub since Cal has a reputation of being particularly liberal (which is ironic considering how Cal has one of the biggest Conservative clubs across any university), i doubt many Cal students are waiting on reddit to instantly downvote posts during the 1st week of classes lol",1611472204,4,0
"what the hell are you saying? This person gave you a rational response as to why it happens. You’re coming to reddit and posting for a bunch of unlicensed strangers to respond and get annoyed when they default to the most neutral action which is boosting the help bots. What is it you want? Help that only a redditor can give? Attention? Or people who have at least some training in dealing with people who are at an incredibly low point? I’m sorry if I’m sounding mean, but your redirecting your annoyance with the actions of redditors who are well intentioned and saying they’d pretty much incite your suicide. Not everyone here is a high level empath or trained in dealing with suicidal individuals, so that bot is the often the best they can do.",1611471199,10,0
Feel like shit just want him back,1611470393,34,0
"Okay I highly recommend UC Santa Barbara. It's your stereotypical socal town with a vibrant downtown, pretty diverse population and even better weather than Berkeley. It's only about 90 mins north of LA and UCSB is right on the beach.",1611470153,2,0
Credit to this amazingly cool website: [https://sfstreetcars.co/#](https://sfstreetcars.co/#),1611469010,20,0
https://forms.gle/UJEGND2NaWCqNRoS7,1611467398,20,0
Use p/np to ur advantage,1611467116,3,0
Ah yes suicide by cop,1611466924,-5,0
"I just checked my etang portal again, and my results are finally up! (It wasn't there earlier today) Thanks for the reply!",1611466104,3,0
"I went Wednesday morning too but at memorial and could see my results in my etang portal on Friday morning. You can log in to your portal and click ""lab results"" to see if they've been posted. I wouldn't panic too much though, I've heard they usually call you within 48 hours if it comes back positive to tell you to isolate.",1611465647,2,0
"Totally second this. 30 year old senior here and I see the same in my classes. I wish these 18-early-twenties kids would realize they’re already miles ahead of the majority of kids their age. They’re at Cal, they care about their future and they’re working towards something. That alone puts them at a great advantage. When they get into the professional world they’ll realize most people are flat out lazy as shit and do the absolute minimum to get by. When I was their age I didn’t care about anything but partying, and I’ve been able to turn that around in just 5 years. These kids are already starting on the right track and the sky is the limit!",1611464653,4,0
Well idk if one should prescribe another’s career path over a single class’ grade but yes 127 assumes you have mastery of 16B/110.,1611464547,4,0
Would you be opposed to not doing anything as an alternative?,1611464120,-7,0
ye but it's the best most of us can do. at least they have a few hours of training lol,1611463757,7,0
"Firstly, don't worry too much about the diff eqs in this class. On the exam typically you will have memorized solutions to diff eqs as there are only two fundamental types of diff eqs used in this class, first order separable and first order inhomogeneous. The second one is a little trickier to derive but the first should be familiar from calc 2. Secondly, I'm sorry to hear that the lecture didn't sit well with you. Thirdly, please attend discussion on Monday because I feel that would likely help ease your troubles",1611463541,1,0
"DRAW the problems out! I’m a visual learner and the only way I passed the class was by drawing the problems out. I’m choosing x things— I’m going to draw x blanks, how many choices/what’s the probability for each? 

For me, discussion was probably the most important resource because we practiced how to actually do the problems and my TA was a godsend.

In lecture, if its live, write down what she says, but review it later so that you understand where everything came from. 

Don’t be afraid to ask Piazza for detailed help wherever something confuses you. Yes, this is really scary, but do it anyway— your fellow students will help you out, and don’t forget to find a study group to do homework together!",1611462895,3,0
[deleted],1611462629,1,0
"As an academic intern for d100/someone who's taken the class before for there might be a couple reasons it seems so hard. 1. To make sure u have some understanding of prereqs, 2. there's more ppl taking the class and they're making it harder. But just based on personal experience from the past 2 semesters I don't think the first hw was super hard by cs upper div standards",1611462448,3,0
You can either use your Cal GPA or recalculate with Cal and CC (recalculate don’t average). My understanding is either choice is acceptable. It’s dishonest to include the 4.0 from one community college while leaving off a lower grade from another. Another option I’ve see is listing your GPA from your associates degree next to where you have your info about your community college.,1611462380,4,0
"I took this course last semester. It wasn’t too bad, there were some weeks were the hw was super short and then there were some that were long, but overall it shouldn’t be too time consuming. I recommend going to office hours if you have any questions about certain homework questions. The staff was extremely helpful last semester!!!",1611461680,1,0
UCBMUN or BMUN depending what your interests are,1611461297,2,0
Lmao best description I’ve ever seen,1611461148,6,0
"170 is hands down my fave class in Berkeley! I haven’t taken 127 yet, and I’m definitely more of a software person than data science (I’ve taken classes for both). I think if you can only take one, try 127 because it is more relevant, but I think 170 is easier if you concerned about struggling. Nothing from 70 really carries over, just the intuition which you can develop in the class itself. Hope this helps!",1611460976,3,0
nooo just cal gpa,1611460792,2,0
"Lecture #2 was really, really bad. Like awful. I'm not sure what this professor's reputation is, but that was terrible.  
  
Dude basically gave an entire lecture assuming the entire class knew DiffEQs (something that this class will teach later). No explanations, no saying ""Don't worry if you don't understand this just yet"", literally just talking over 99% of the classes heads for one hour. Didn't help that the dude didn't take a single pause until the very end, and his handwriting on screen is completely illegible.  
  
Overall just a godawful lecture that left people feeling like they missed a pre-req or some shit.",1611460321,2,0
Lab - I did mostly on my own + a few questions on Piazza. HW - I'm struggling through it w/a group. Wanna do die on hw with me lol?,1611460224,1,0
If 16B was hard 127 will be killer since last semesters 16b math was very basic in the grand scheme of linear algebra. You can still do data science just not the mathematical side so I would try to go more in software since that’s where you lose the need of math,1611459753,2,0
Oh right. I am doing the lab rn and it seems pretty chill. Btw did you do it on your on or with someone?,1611459373,1,0
"In the long run I want to have a career in data science, or maybe do some light research in the field. Which is why I think 127 would be beneficial, but of course algorithms is important across the board.",1611459092,2,0
"yeah you can just use hs clubs as like experience, jobs you did, maybe a transcript if they require one. And yeah you can put your gpa, but I don’t think they care what classes you’re not taking 61a cuz no one gets into cs classes",1611458204,2,0
That sounds awesome,1611457103,1,0
"""Co-author of simulation framework for reactive agents in zero sum stochastic environment using functional programming""",1611457070,31,1
these 2 are widely different in terms of material. What interests you? If you're not good at math and are not interested in it 127 would be a poor option. 170 is good for interviews so I would go off that since 127 is much harder than 16B,1611456907,2,0
I still need advice.,1611456754,4,0
Thanks ☺️ definitely going to get a gaming laptop soon.,1611455262,1,0
I can't even really tell the difference between 22 and 30 anymore.,1611455082,3,0
undergraduate legal honors society! having info sessions soon so find them at calapalooza tabling so they can tell u the info on times/dates. a smaller club so you can take advantage of the opportunities more,1611454517,1,0
[deleted],1611454229,1,0
"I have this exact question, I'm thinking of switching out of one of my classes into this one but I'm curious on other ppl's experiences with him as a professor.",1611454226,1,0
Yeah,1611454216,2,0
"Yup, me too, there's 2 drops",1611453876,4,0
Is this data 100? I also think the hw is really hard :(,1611453800,9,0
"Thanks for the tip lol

Might as well take the L with a HW drop",1611453592,3,0
"It's always super hard to scare people into needing the prereqs. I did this last year and dropped one week in, and my friends told me the rest of the hws were a breeze.",1611453549,16,0
"just trolls, dw. its a good q!",1611453540,3,0
"I would just list your Cal GPA.

I know a transfer who averaged them when their Cal GPA was much (like a full GPA point) lower than their CC GPA. that seems a bit dishonest.",1611453453,11,0
"Definitely let people know! Get some advice on whether to withdraw, that will depend on your courses and what accommodations are available and your recovery time. If you're expecting to be recovered in 10 or so days, great! If it's a multi month thing, maybe withdraw makes sense. 

If you are in a study abroad program let the coordinator know, too, that's super important. They can probably then advise further.",1612811504,2,0
There’s apparently a secrete courtyard too but my memory may be off about that,1612811359,1,0
"Fall numc had a fair bit added from the previous spring &amp; summer versions, we've regressed those changes back to the spring/summer version.",1612811030,2,0
These university cops are in good shape man,1612811003,1,0
"Covid isn’t spreading through piss my bro. Why you so angry mayne, I mostly wrote this all for entertainment, antagonizing you is also entertaining, just don’t tell people “fuck you” especially if that’s not who you are in real life 
:( it hurt my feelings. I’m a sensitive artist. Also I wasn’t drunk just a lil saucy. Try it sometime might release the stick out of your ass a little",1612810920,1,0
I gotta piss again what cafe do you work at?,1612810646,1,0
"After the first time I found it, It took me like 4 more times to find this cafe again.",1612810537,2,0
"Do you know where it is? I love Dwinelle and feel like such an outcast. I've never struggled navigating Dwinelle, in fact I usually have to help me GSIs find their rooms lol. But anyway my first thought about the cafe you mention is the one on the top floor of Dwinelle. I could be wrong as I'm a Fall '19 transfer and I haven't had the opportunity to fully mentally map out Dwinelle so I'm curious if there's another ""secret"" cafe I don't know about",1612809946,1,0
"I mean. It’s not uncommon. You can totally look for internships if you want. But you have tons of time to worry about that later. Usually 2nd, 3rd, and 4th look for internships. But it’s totally cool if you want one.",1612809454,1,0
You do.,1612808578,1,0
"it's been hard to meet people remotely, so I guess dorms are my best bet? I just don't wanna be the only sophomore amongst a bunch of freshmen",1612808270,1,0
because I was wrong about one of the things in it. was right about one thing: FUCK YOU.,1612808109,1,0
"The difference is ML@B and similar clubs put you onto projects, so every member is either on an education track or an industry/research project. IEEE/CSUA doesn’t give you any responsibility unless you look for it",1612807711,1,0
I still miss them. Spring 21 16B TAs aren’t very good,1612807495,1,0
whatttt where at??,1612807359,1,0
"I currently live in Garden Village in a 2bed apartment. Lucky for me I don't have a flatmate so I have the entire place to myself. The rooms are not small but not too big either, but the apartment is fairly new and move-in ready.",1612807127,2,0
"Not that I'm on some sort of moral high ground, but I don't enjoy the idea of working for corporate. My ultimate goal is to do quantitative social science at something like a think tank or research hub.",1612806989,1,0
I'm paying $600 for a single room shared kitchen.,1612806824,1,0
I'm paying $600 for a single room shared kitchen.,1612806786,1,0
"Im an alum. I got pretty down about this in my first year and early second year. Honestly, the clubs dont mean shit. The more selective ones usually have these super self righteous folks that are not chill and often annoyingly type a. The more open ones have a larger variety of people and youll have more chance of finding someone that youll vibe with. If u are thinking In terms of professional opportunities, focus on internships/research/any professional experience. All those networking events they tout are not going to help.",1612806316,1,0
\^\^\^ :(,1612805898,3,0
