title,selftext,created_utc,score,total_awards_received
I just took the Haas interview,i just took the haas interview and it wasn’t bad at all haha!! dont be nervous for the ppl who are!,1611676584,1,0
Nusctx 10s - thoughts?,Has anyone taking Nusctx 10s? How did you like it? Is it hard to get an A?,1611676488,1,0
This place has stolen all of my self esteem and self worth.,,1611667565,1,0
Semester just started and I am already so tired and overwhelmed,"Literally only taking the bare minimum of units required to be a full-time student but I already feel burnt. I was excited for the semester to start and felt really motivated but now im just a mix of kinda panicking and freaking out but also extremely despondent and essentially dead inside.

I'm also feeling a bit lonely despite being with my family everyday, but being with them feels kind of suffocating even though I love them. Just kinda hurts when they belittle me as a joke when they have nothing else to talk about and I'm with them all the time. Most of my friends have drifted away once college started and im way too camera-shy to make new friends. Plus, I feel really intimidated by everyone here 👀

Did poorly on a quiz for one of my classes yesterday and now im at a really low B. I know I have the rest of the semester to bring it up and it's literally just the first quiz, but man it would be great if it wasn't dangerously close to a C.

Sorry for making another rant post. I know this subreddit has a lot of them but I just want to know if anyone else can relate. I would also appreciate some tips on studying since I'm a freshman. I went to a somewhat ghetto school but was a sort of mediocre student. Now that Im at berkeley, the culture here is a bit of a shock for me. Some of the students here treat an A- like a death sentence or something.

I hope that most of my struggle is just due to the effects of the pandemic and maybe it'll get better once in-person classes start :(",1611657658,1,0
Fulfilling R&amp;C Requirement at a community college?,"I enrolled in a ENGLISH R1A course this semester and find very time consuming and quite difficult. I also realized today that my instructor gave out an average grade of B compared to the course average of B+ the last time he taught this course. 

English is one of my weakest subjects, so I want to get the R&amp;C requirements (both courses) done ASAP. Is there any ways I can do it more cheaply and less time-consuming at a CC? (has to be online since I live abroad rn) If so, does Berkeley accept the course work and give the same number of credits? Tysm and go bEars?!",1611656475,1,0
how to focus on classes when I DO NOT CARE ABOUT THEM AND ONLY CARE ABOUT RECRUITING,"I have extreme self-hate and self-esteem issues which are compounded by currently not having any summer internship offers while my friends have worked at FAANG, and as a result I DO NOT CARE about my schoolwork.

I CANNOT bring myself to care or do anything and withdrawal is NOT an option.

I could do a reduced course load, but my parents would probably give me hell about it. I had to go behind their backs to get DSP for assignment extensions and quiz extensions.

My parents do NOT care about mental health and DO NOT see the importance of internships, though they have always judged people by their career and salary and so reasoning with them is a lost cause.",1611655334,1,0
how to focus on classes when i do NOT GIVE A FUCK ABOUT THEM and only want to focus on recruiting,[removed],1611654407,1,0
Are some UGBA classes only restricted for Haas students?,"Asking because I wanted to take a class and there is open space, but the professor said that the class is only for Haas students so I can’t take it unless I’m Haas. This is strange because I took UGBA 106 just fine without being in Haas... is this really the case?",1611650024,1,0
CS 61B waitlist,Im currently 54 on the waitlist (added the class last Wednesday) and I finished proj0. Should i start looking for new classes?,1611649036,1,0
Looking for Musicians,"I’m a looking to form a band! I play guitar, so I’m looking for a keyboardist, bassist, singer, and singer/guitarists. Very open to any music style, but my vision is to form an RnB/Rock group. Only looking for people who are serious about jamming!",1611648479,1,0
"Looking for a tutor who knows how to do financial analysis (projections/forecasting, budgeting, and some accounting)","Have a project I need to complete (not for school), but I don't have the financial analysis background to complete it. I'm really stuck and not sure how to move forward. I'm willing to pay per hour. Please let me know if anyone can help! Please dm me.",1611647217,1,0
Recommended fraternity/sorority?,Are there any that people can actually get into? Are there any “easy” ones?,1611643943,1,0
Anyone (undeclared LNS) get their units extended yet?,Idk how much longer to wait :(,1611638631,1,0
Found cat in building near Fulton and Channing. Anyone recognize them?,,1611637510,1,0
Is this semester over yet 😔,It hasn’t even been a full two weeks and I’m drained,1611636962,1,0
Did anyone get a response for CS 61A CSM?,,1611636830,1,0
CS Class projects instead of personal projects on resume?,"Has anyone used CS class projects in place of personal projects on their resume and landed any internships/jobs? Which classes do you recommend for project heavy experience that could be of value on a resume?

Asked by an EECS freshman who took 61A, 61B, Math 53 and 16A (taking 61C this sem)

Thank you!",1611634840,1,0
Berkeley alum on front page of Reddit today,,1611633784,1,0
Accidentally dropped class I need to graduate,"I was trying to drop a different class, and somehow I carelessly dropped the wrong class which is full. I immediately re-enrolled but now I'm on the waitlist (position 4). I've emailed my department's advisors, what else can I do to fix this? kind of panicking lol",1611633241,1,0
CS61A without taking CS10,"I took CS principles in high school and passed with a score of three. I know that it’s a pretty low score, but should I still take CS10? Has anyone not taken a pre-coding course before CS61A ?",1611631933,1,0
Why do people even watch Hilfinger’s 61a lectures,,1611631324,1,0
A class disappeared from my CalCentral. Has this happened to anyone else before?,"Yeah so today a class literally disappeared from my ""My Academics"" page. A few minutes before it went, I saw a big dash next to the class (instead of Sociology 4.0 GRD, I had Sociology ---). Now it's like I never enrolled in the class.

&amp;#x200B;

I opened a case and apparently on the backend, I'm still enrolled. I tried seeing if I was still on the professor's roster but we have sent back and forth emails and she doesn't know what I'm talking about and thinks I'm trying to get into the class when I literally just want her to check the damn roster. I stopped replying cause I don't wanna get on her bad side and get my grade fucked.

&amp;#x200B;

Anyways has anyone had this happen before and what happened cause I wanna graduate on time :(",1611631277,1,0
Get to know your professors,"Please get to know your professors as early as possible. Find your mentor/PI and spend a few semesters with them. I got this advice in my freshman year from an alumni and being an idiot I was I didn't take it. I struggled a lot finding internships and it wasn't until I worked in a lab that I got an offer because my PI published lots of research and my new mentor happens to be familiar with his research. The academic lineage tree is real. You go to one of the most prestigious university in the world, so take advantage of it.",1611628586,1,0
Why is /u/Rykuto getting awards for absolutely nothing?,The state of this sub I swear. I’m leaving if that dude somehow gets gold for posting NOTHING. So it takes zero effort to get awards in posts now? This is quite appalling and we’re better than this.,1611626988,1,0
How to get into UCBMUN 😭,"Okay this is so embarrassing, but I’ve applied to UCBMUN a couple of times and I never make it past the interview 😭😭 does anybody have any tips at all to help me do better in the interview? I really want to join this club so bad, but I think if I get rejected again, I’m going to stop trying because clearly I suck.",1611626647,1,0
Shout out to Berkeley deciding to pull SURF math team funding after most REU deadlines have passed 🤪,Looks like my summer plans just got torched,1611626447,1,0
L&amp;S Drop Policy for Spring 2021,anyone know if L&amp;S is doing the same thing as last sem when they allowed us to just drop a class without it counting technically?,1611625962,1,0
"Social bubbles and outdoor dining can resume in Berkeley, effective immediately",,1611625378,1,0
Berkeley Safeway on Shattuck Pl. has liquor license suspended,,1611625343,1,0
Do you believe the claims that Fall 2021 will be primarily in-person instruction?,"

[View Poll](https://www.reddit.com/poll/l52teu)",1611624196,1,0
Hello,"Ignore this, testing a theory real quick",1611623674,1,0
~Dorm Choosing Help~,Hi i am gonna transfer to UC Berkeley after 2 year of community and been having trouble choosing which dorm to live in. I want to be living in a single since i never had my own room before (price wont be an issue)and preferred an all gender hall (im a girl)  im gonna be majoring in computer science i prefer to be near where my future classes are but distance wont matter i guess i could get my steps in lol. i dont mind having a social area but i dont want it where theres a lot of drunks near my room.  i prefer to have nice dorm where there isnt a lot issues i heard some dorms had roaches before some have laundry area issues and everything is broken. Hope you can recommend me some dorms and some pros and cons of them.,1611623228,1,0
data 8 AI experience?,"I'm honestly scared I'm not qualified enough to be an AI for data 8. i have no teaching experience and am not the best at explaining things, and honestly some of the statistics concepts in that class still confuse me to this day. i'd probably end up confusing people even more. i genuinely feel like i only did well in the class because i got lucky. is there a lot of support to help AI's? i don't want to unknowingly fuck someone over because i'm bad at explaining and then get called out for it :( 

but this is also a good chance for me to get teaching experience and see if i enjoy it??? and the time commitment seems really chill. i'm so conflicted",1611622545,1,0
How to stop hating myself over recruiting?,"I've been applying to internships. Got some interviews and some final rounds but no offers yet. Waiting to hear back on 2 interviews and have 2 more this week. 

The entire process has made me hate myself very much. I contemplate self-harm whenever I scroll on Linkedin, especially when I see other Berkeley students get an internship I wanted. 

I have always been socially anxious and awkward and bad at interviews and I've tried really hard to get better through mocks with friends and the career center. 

I'm now at a point where I can give an okay answer even under pressure, but a career counselor told me today that I still need to work on confidence and passion when it seems like all the Haas snakes are just born with charisma and confidence. 

I've contemplated suicide over this too. I've always felt inferior to other people in many aspects since I was in middle school or early high school and Berkeley has worsened it. 

I've not done a single thing for school other than easy first week stuff because I am so angry and jealous and full of self-hatred. I've talked to a counselor at the Tang Center over it but I don't tell them everything.",1611622534,1,0
12 units in L&amp;S affects financial aid?,has anyone heard from financial aid in this new semester whether financial aid will be affected if you go to 12 units (1 unit under required minimum) ? i already was at 12 last semester and they said my financial aid wouldn’t be affected. but i’m just wondering if doing that again will affect it or not.,1611622235,1,0
Survey on US health and COVID-19 response + chance to win $10 gift card,[https://forms.gle/kaPXgMSi5Y44K2ao7](https://forms.gle/kaPXgMSi5Y44K2ao7),1611621900,1,0
Biology scholars program,Would someone be willing to explain a bit more about the Biology Scholars Program and its benefits/what it entails? I just got my acceptance email and would like to learn more from a bear's perspective!,1611621433,1,0
Is there a discord or a group chat for Physics 141A?,"Or if anyone's taking 141A, please let me know! I'm not sure I can survive this class alone.",1611620732,1,0
Physics Majors and Mental Health,,1611620452,1,0
What's the rudest thing a professor has ever said to you?,"I accidentally missed an assignment, so my prof messaged me and now I feel like shit. Can you guys share rude things that your professors have said/done to you so I feel less alone/stupid lol",1611620115,1,0
Calhacks Cubstart,Has anyone heard back about whether they've been accepted to cubstart?,1611619685,1,0
I want to quit a club (rant),"Welp.

This is a throwaway because the home boys know my actual Reddit account.

&amp;#x200B;

I joined a project earlier last year and it's been completely tits up for the greater part of a month now. From scheduling meetings during break and on weekends, there's been zero considerations as to how we as members feel. This doesn't include the (to be frank) ""work first"" environment where we only meet to plan tasks, throwing aside actual community bonding in a god damn pandemic and functioning as tools at will. 

&amp;#x200B;

I spoke to my ""manager"" and solicited feedback from my team regarding this, as all conflicts should be handled, but his behavior has spoken for itself. He has only become more of an asshole and you know what, I'm tired of dealing with this bullshit because I know my self worth.

&amp;#x200B;

There are positives, namely the great cause that we are working for. At the same time, this project has become increasingly toxic over time and it doesn't feel like we're changing course anytime soon. 

&amp;#x200B;

**TLDR: Project became toxic and I've tried everything in my power to turn things around. Part of me wants to leave, but the other half is smoking that sweet sunk cost fallacy.**",1611619115,1,0
urgent!!! how to find an advisor???,"I just got offered an amazing internship, but can only pursue it if I am able to receive credit. To do that, I need to find a faculty advisor -- only issue is I am a freshman and bc of online haven't been able to cultivate relationships with professors or take a ton of classes in the field my internship relates to. Anyone have any tips for cold emailing profs or trying to find an advisor? thank you so much in advance for your help!",1611618909,1,0
Anyone else in the Stat 24 Freshman seminar class?,"Aren't we supposed to have class on Mondays at 4? Haven't gotten a single word or anything about this class, no bcourses or anything",1611618829,1,0
CAPS,fuckin love myself after 45 minutes of crying what a feeling.,1611617492,1,0
EE 16B Lectures,"For those of you who took EE 16B spring 2020 why are there so many dislikes on the first few videos? Was it because it wasn't taught well? I heard that professor was good

Also does anyone have a link to the fall 2020 EE 16B lectures?",1611616711,1,0
URAP website said it was due Tuesday 9 am?,Is it just me or did the URAP website say that apps were due Tuesday at 9 am? Well anyways I missed it and unsure of next steps...,1611616049,1,0
Can we please stop doing breakout rooms!,"I don't know about everyone else's experience but they're just awkward and a waste of time. During every breakout room I've had, people immediately turn their camera off and stay silent.",1611615188,1,0
How do Grad Schools consider Major-related courses which are PNP-only (Seminar and AI work),"Hi, y'all. Hope you are having a great day! I'm an intended CS freshman who has a (maybe dumb) question regarding how grad schools look at the major-related courses that are offered on only a PNP basis (seminar, group study, field study, etc.) as the title says.

This semester, thankfully, I've been accepted as an AI for both Data 8 and CS 61A. Since I'm interested in teaching and also really enjoyed both courses last semester, I'm planning to accept both positions. The one thing I'm worried about, however, is how grad school will consider PNP-only courses. Basically, AI's should enroll in 1-unit CS/DS197 field study course which is offered on a pnp-basis. Also, as a part of the CS scholars program, I'm also participating in on 2-unit cs scholars group study for 61B which is also PNP-based. I'm also taking another STEM seminar, a 2-unit pnp one.

Considering that I'm likely PNP my R&amp;C Part B (I'm not a strong writer lol), 10 out of 19 units-- 2 AI units + 2 CS Scholars seminar + 2 STEM seminar + 4 R&amp;C--I'm taking this semester would be PNP even though I''m not planning to PNP any of major-related courses. Also, 6 out of those 10 units will be the ones related to my major (AI, CS, and STEM seminar).

I'm planning to apply for grad school. I heard that PNP-ing too many courses (especially major-related ones) are considered a bad sign. Would it be ok to have more than half of my current units as PNP like the above? Are there anyways grad schools can find whether the course I took has both GRD and PNP options or is only offered on PNP-basis.

Thank you! Any help would be greatly appreciated :)",1611614520,1,0
how to collect on Rent Board judgement against landlord?,"tldr; sued my pos Berkeley landlord through the rent board and won. The deadline passed 2 weeks ago for him to appeal, he hasn't contacted me or indicated he will pay it. How do I collect against him? 

The rent board hasn't answered my calls or emails for days. Any help welcome!",1611613534,1,0
UGBA 135?,"Does anyone know how to attend lecture, and whether the class has even started yet? I’m trying to attend lecture and have been unsuccessful; it just puts me in a waiting room",1611613384,1,0
ㅤ,,1611613190,1,0
Rejection Rate from UPE,Is it common to be rejected after completing the application for UPE?,1611613175,1,0
ugba 135,is ugba135 happening today?,1611612834,1,0
Flipped Classes Yay or Nay?,"Flipped Classes:

Classes where you watch the lecture on your own time and come to main lecture for either review of materials or questions

[View Poll](https://www.reddit.com/poll/l4yop3)",1611611875,1,0
Why are some waitlists so big?,why do some courses have really long waitlists (100+) then profs tell us we have little chance of adding the class if we are on the waitlist,1611611615,1,0
Is taking five classes too much,"This semester I'm planning on taking five classes for my major, they're all upper division classes and I'm already panicking right now...",1611611253,1,0
1a in spring semester?,I tested out of math 1a and now I'm taking math 1b but I'm realizing I don't have nearly the foundation that I should have. I'm just shooting for a P but I'm worried I might not even be able to get that. Is it smarter to enroll in 1a and set myself back or just try to pass the class? I'm a cs major and I'm worried I'll be too far behind if I'm taking 1a my spring semester.,1611611190,1,0
For anyone who took IEOR 166: How should I learn the concepts?,"I'm currently enrolled in the course and was wondering how to prepare/study the material. There's a lot of reading that isn't necessarily assigned, but used as a ""reference"" to the material she's teaching. Is it necessary to read what she (Professor Righter) has used as a reference, or is taking notes on lecture good enough? It just seems like a lot of the reading is overkill and doesn't have much to do with completing the problem set.",1611609843,1,0
UC Path W2,Has anyone here who worked as a reader/tutor/ whatever that uses Caltime and UC path for time sheets have any idea when W2 will get released? Did we need to submit anything prior?,1611607927,1,0
premed mcat resources from a happy 525 scorer,"hi everyone! i just graduated this fall majoring in MCB and today i got into my dream medical school, so i thought i'd give back! my gpa was kind of absolutely trashed by ucb (less than a 3.5) so it was kind of imperative i kill the mcat, and i'm happy to say that I think i did! i tested earlier this year and got a 525 (i'll imgur proof in comments if anyone wants it LOL)

at any rate, i've compiled all the resources i used online like helpful video series, free flash card/anki sets, cool infographics i found on reddit and elsewhere. if you want them ill compile them and send them out this week! [https://forms.gle/rPu2kKGwDQUwxB6c8](https://forms.gle/rPu2kKGwDQUwxB6c8)

also, i'd be happy to use this post for a mini-AMA about the mcat or premed at berkeley for those curious!",1611606144,1,0
[Megathread] Do you have a club or Decal that you want to advertise? Looking for a club or Decal to join? Post about it here!,"Make sure to specify the time (hours/week), money, and/or application requirements (resume, cover letter) your club or Decal requires of new applicants. If you're looking to join a club or Decal, answer the same questions.",1611605878,1,0
Who thought Gather for discussion was a good idea?,"To Data 100 - if it ain't broke don't fix it, not sure why there are so many changes in the course compared to Fall 2020 which was universally heralded as fantastically ran",1611605697,1,0
Haas interviewees: did you get in after?,"Sorry for posting this. So anxious I don’t know what to expect

[View Poll](https://www.reddit.com/poll/l4wcw7)",1611605512,1,0
I just won’t do a good job then,,1611604757,1,0
Newsom cancels California’s COVID-19 stay-at-home orders,,1611603817,1,0
CS 70,,1611602675,1,0
Power outages: housing application still open?,"I had planned on staying home this semester, but my power's been out for the past week, and I've had to bounce between places to do classes/assignments. I live in an area that recently became very prone to these prolonged outages, and at this point I'm ready to bite the bullet and move to Berkeley, where I can at least expect steady power and wifi. 

I noticed that the on-campus housing application is still open, despite the spring housing deadline having passed some time ago. If I submit it now, is there any chance I can move into a dorm this semester? Or is an apartment off-campus my only option?",1611602154,1,0
Are junior CS/DS transfers just screwed when it comes to internships?,"We have to condense all of our major coursework into two years, and by the time we’re even slightly qualified for an internship (let alone a FAANG-level internship), much of the recruiting has ended, so the only summer we have is kinda useless, aside from doing personal projects. Even then, the projects probably won’t even be impressive since we still don’t have much experience. And then we have to take our algorithms class in our third semester, further holding us back from many internships! Even if I tack on a fifth semester to qualify as an undergrad for summer 2022 internships, I still don’t see myself being able to get the kind of internships I wanted (i.e. FAANG). Am I just being a doomer her, or are these legitimate concerns?

Rant over LOL",1611601823,1,0
Bio 1A/1AL Rant,"It's so frustrating that they just prerecord the lectures and expect you to watch it before class even starts and then expect you to attend live lecture on top of that. That's double the lecture, double the time.  


Feels like they think we don't have any other class to study for, I'm so sick of this sh\*t.",1611601583,1,0
Best ISP in Southwest Berkeley,"Hello, I am looking for the best/cheapest ISP in Southwest Berkeley. Last thread I saw was from 6 years ago.",1611598684,1,0
Haas Undergraduate Interviews,Has anyone who applied to Haas this year heard back regarding interviews. I know some people have had audits but I was curious about any interviewees?,1611598236,1,0
Unsure of which class to drop :(,"I am a bit lost on what class to drop and would really appreciate some guidance from wise Bears. This semester I am taking chem1a/1al, bio1b, and a social welfare Berkeley connect. I am also taking mcb 38 (stem cell biology, ethics, and societal impact) and ph 116 (Social, Ethical, and Political Issues in Public Health). 

I want to drop either ph116 or mcb 38. 

* mcb 38 is pretty science-heavy considering I am also taking chem and bio. Average grade on berkeleytime is A- though, and the content is interesting to me. This class does nothing for me in terms of breadths or major stuff etc. More of a filler interest class. It already seems intense in terms of content, but not much workload like hw and all that. 
* Ph116 is a p/f 3 unit seminar. Thinking of applying for PH major (only a frosh rn btw) and this class would help me decide, also it would even count as upper div electives. 

I am thinking about pre-med and idk if my schedule may be looked down upon if i took ph116 which is a 3 un p/f class. Bio and Chem are already pretty intense, and ph116 would be a nice balance. Just nervous about my schedule looking easy or something lol. Also would this kinda mess up my gpa if i don't do well in chem, chem lab and bio or something as those would be my only graded classes? IDK pls help fellow bear for i am lost and would appreciate some seasoned perspective. Thank you!

&amp;#x200B;

TLDR: Do I drop mcb38 (graded, 3 units) or ph115 (p/f, 3 units) if i am already taking chem1a/1al, bio1b.",1611596923,1,0
When should we expect to hear back from URAP?,"I know I’m being impatient, I’m just anxious lol",1611594691,1,0
bCourses looks different?,Does anyone else see the default gray and red Canvas design when they log into bCourses? All of the blue and gold and the bCourses logo on the side have disappeared for me for some reason,1611593497,1,0
Microsoft Research Intern Opportunity,,1611591443,1,0
