body,created_utc,score,total_awards_received
"So long as our society refuses to ignore race, our schools cannot afford to ignore it. 

Race issues are often more damaging to the individual and hold the individual back more than those issues of low SES.",1600982434,0,0
I don't think she ever has. Reminder that she flew (and replaced several times) the Confederate flag in front of SF City Hall when she was mayor.,1600982284,17,0
"What? Addiction does exist. Anyone can be addicted to anything. Whether that be candy, pizza, icecream, or even healthy things like working out. Marketing is not evil. Marketing has existed since humans first started trading with eachother and has benefited society for as long as it has been around. Candy only being for children? You’re kidding right? Where in my paragraph did I mention that huh? 😂",1600982208,1,0
Cool,1600982198,2,0
On campus? ON...CAMPUS? Bruh I ain't see no parties on memorial glade or in Sproul plaza...?,1600982079,1,0
"First of all, from personal experience: People are very well spaced out on campus and there should really be no concern about spread. It's easy to social distance on a beautiful, mostly quiet campus with endless different paths and trails. **However**: Where it gets really crowded is on the sidewalks off-campus. The other day I was on College Ave and there were a ton of people close together, waiting in line to get food, walking on the sidewalk, running, etc. You won't see that on campus. Campus is a significant chunk of the Berkeley area and closing it to the public will force people into a smaller geographic area.

Second, prepare for a hOt tAkE:

This reminds me of COVID restrictions in general; it becomes an illogical game of whack-a-mole. By implementing draconian restrictions on whatever they can, local governments can look like they're really dedicated to *taking action* and stopping the spread. In reality, they are only inconveniencing and hurting people by preventing them from doing beneficial, low-risk outdoor activities--while much riskier activities are impossible to regulate. Why are those riskier activities impossible to regulate? Because you can yell at anyone who dares to go outside during this endless quarantine, but you can't make people care when it comes to socializing in their own lives. 

Note that I don't at all blame public health experts--they have been saying for a while that the chances of catching corona from other masked and distanced people outdoors are slim to none, and that it's important to allow people to safely get fresh air. But somehow, that gets lost in translation, and all too often we hear from non-experts that we must ""Stay indoors! Shelter in place!"" which is completely illogical.",1600981971,2,0
"yeah, there's an entire college at berkeley for it...

Easy pEasy Curve Science",1600981959,1,0
"I see - so you do believe that addiction doesn't exist and that marketing is not ap ly.

&amp;#x200B;

What about candy being only for children?",1600981793,0,0
I think mine autocorrected after I tried to put it as “pazzazz”,1600981495,1,0
[deleted],1600981445,1,0
That is your personal opinion. Your assessment of capability is immensely flawed in my own opinion.,1600981405,1,0
Lol I know I’m such a goof!,1600981365,1,0
I interviewed her before. This was not the conclusion that I nor the people who were watching came to. She talked like any other politician.,1600981307,1,0
Disgrace to all Golden Bears who struggled in the trenches to earn our place,1600980924,13,0
Both of them,1600980872,6,0
"When the exam starts, do you feel like everything you studied and prepared for goes out the window? And then you sort of panic and can’t focus because you’re too busy worrying about the fact that you don’t remember how to do everything?",1600980637,1,0
"&gt; Totally different.

My argument was that the state of CA doesn't get to claim a moral high ground for paying for the UC system when it contributes a pittance.

&gt;But you all should quit bitching about having to pay more, that was your choice.

And CA residents should quit complaining about in-state tuition increases and increasing enrollment of out of state students, while not giving the UC system the funding to actually solve these problems. ""[T]hat was your choice.""

Edit: here's some stuff I saw that I don't agree with:

&gt;Federal dollars received by the university are for specific research, grants, infrastructure improvements, etc.

Grants always have an allowance for ""overhead"", siphoned off by the University to pay for other things.

&gt;Californians make up a disproportionate amount of federal tax dollars

They don't, six states plus DC pay more per capita.",1600980608,1,0
"Perhaps this is going too far, but I wonder if obesity should be one of the few “pre-existing” conditions that nationalized and private health insurance companies could discriminate against. Much of the burgeoning costs of healthcare in this country are due to the outsized risk associated with populations who are obese and/or smokers.


This does obviously put perhaps an undue burden on those who are obese through the fault of the big sugar industry and potentially their own personal poverty which drives them towards consuming fast food, etc. I think we really do need to hold everyone here accountable. That includes the industry as well as those making risky health decisions. And that being said it’s also clear that we need to enact some solution that makes a healthy lifestyle more affordable to the general public.",1600980473,1,0
"Agreed, fellow member of the UC Berkeley community!

\-From NotCarolChrist",1600980405,13,0
"Her husband even went to Berkeley! Fuck that guy, we should rescind his diploma",1600980250,14,0
🥴,1600980008,2,0
I spelled it wrong on the exam lol,1600979995,2,0
Nothing? how can anyone find out,1600979976,-2,0
That’s what I put!,1600979900,1,0
Looks like we'll have to fly. Bring the jetpacks out boys.,1600979878,2,0
"Probably sue and they’d probably stand a decent chance of winning I’m guessing (they got a lot of money, and Berkeley is a relatively small city). 

This has good intentions but it does feel like a bit of an overreach. There are probably other ways to accomplish a similar effect that would be more palatable for most folk",1600979849,2,0
Can we fricken vote Diane Feinstein out of office. She has stopped representing California.,1600979668,35,0
To be fair it’ll have to cost something to enforce it.,1600979485,1,0
Awesome idea. What could go wrong with that?,1600979424,3,0
I mean try to secure one for next semester. Definitely don't pay for months you won't be in there if you can.,1600979101,2,0
Fuck DiFi and especially fuck her husband.,1600978961,32,0
Who,1600978954,3,0
Pos,1600978889,9,0
"Look right now. Housing situation is screwed, but it should be pretty relaxed right now",1600978635,1,0
IF UC BERKELEY doesn’t go FULL online till 2022 PEOPLE COULD DIE,1600978581,-3,0
"They have lower admissions because they are less qualified, that's it.",1600978550,1,0
I can't help you study but if you DM during the exam I can help you with a question,1600978502,-5,0
You should stop your thumbs from eating so much candy - the change in product display marketing should facilitate this goal and reduce such errors in the future.,1600978483,2,0
There isn't even Sproul tabling...Sproul plaza basically looks like a plaza in the great america mall on a Tuesday at 8am with like 10 people walking around...the only dense places I've seen are the waiting line at Cream or at a boba place,1600978421,2,0
"It is quite simple. If you don’t want to get fat, don’t take the candy. If you want to save money, don’t take the candy. The store’s job is to sell you stuff, and as a customer u buy stuff. You have the freedom to choose what to buy. It is not rocket science",1600978378,0,0
"Well I'd say this is along the same line of reasoning as the ban on large soda containers: if you really *want* something, by all means you can get it, it's just that these laws filter the ""eh why not"" buyers from the ""Oh I need this for a party/other reason"" buyers. And if this reduces the consumption of an unhealthy good by the ""eh why not"" buyers, I'd say it's a net positive.

To this point, do you see cigarettes in a checkout aisle? No, they're always behind a counter. Imagine how many people would see cigs while waiting in a checkout line and impulsively buy them if they were there. Sugar's not as deadly as tobacco, but it's nowhere near healthy.",1600978366,3,0
"You do realize that most gum is made from vinyl, right?",1600978307,0,0
Reasons for the policy are irrelevant if the policy not only doesn't target the problem but is grossly out of touch with the reality of the situation,1600978300,2,0
Are you implying that addiction doesn't exist? That people aren't susceptible to marketing ploys?  That candy is only for immature people?  So much to unpack here - please state your assumptions for clarity.,1600978270,1,0
"Yes? But with masks...

You seem to be under the assumption that campus is packed to the gills...at the moment the most people I've ever seen on campus is about 100 spread through the whole campus. This policy is completely useless.",1600978243,3,0
"&gt;  presumably wearing masks

Ah, the key. There's a good chance that is they don't give a shit at parties, that follows through to other areas of their life.",1600978088,-2,0
Don’t you understand you were owned with “facts and logic”,1600978009,3,0
Do you mean early as in try to get a lease like right now if possible or just try to secure one for next semester ASAP?,1600977931,1,0
"Doesn't seem to make a lot of sense. People walking/biking/running outside are basically as low risk as it gets. Outdoors, easily distanced, presumably wearing masks, and not in sustained proximity. I get that they're trying to enforce the bubble but this doesn't seem effective.

That's before you get into how this is *completely* unenforceable. There must be dozens of ways to get onto the campus, so there's no effective way to block access. There's also no easy way to identify who is and who is not a student on the broader campus. The idea of UCPD and security stopping people ""randomly"" around campus and demanding to see student/staff IDs would prooobbbably not go over well.",1600977924,5,0
"Thank you! Just out of curiosity, what type of music did/do you play?",1600977851,1,0
"But those people in turn ARE walking, biking and running through campus.",1600977771,1,0
"Here's his (not that often updated) website http://jongarner.com/, but the contact form should work.",1600977771,2,0
I think they’re saying that regardless of the price people still buy it.,1600977740,3,0
"Honestly, as early as possible. The demand and therefore price of housing goes up dramatically as you get closer to the beginning of each semester.",1600977672,2,0
"I take walks on/around campus multiple times a day, the number of alcohol bottles I see littered around and overflowing trash cans indicates that there is quite a bit of partying going on on campus.  Not saying I agree with this policy but the number of people who don't care about the pandemic may be more than you think.",1600977618,0,0
"That sounds great actually! My main reason was just if I could find someone in the Bay, I’d still be able to take lessons there when school eventually resumes in person. But if there’s a good teacher elsewhere that does Skype lessons I’d love to check them out too",1600977516,1,0
"No...nobody is partying on campus this policy is completely useless. The partying is happening in frat houses and in private houses...the policies should target those people. I've been on campus since before the semester started and it's rare to see someone without a mask/not social distancing, and even then I've seen people get yelled at for not wearing one",1600977418,2,0
"Is there any reason you're looking for Berkeley or Oakland based? My former guitar teacher of 12 years does Skype lessons and is based in San Diego. He's been doing Skype lessons for years, rather then just during the pandemic, so I'd consider him quite good at the virtual format.",1600977138,2,0
😭😭😭😭 it was so easy,1600977127,2,0
"It’s definitely a hard class, so you’re not alone. I’m always of the opinion to just take the midterm, and if you do badly, try to figure out what went wrong and how you can improve for the second half of the course. 

One tip I have: when I took the course, I didn’t do the recommended practice problems at all - I justified myself with “I don’t have time for this and the homework”. But I didn’t realize that with a topic such as probability, it’s really hard to go from lecture to the homework - it’s too big of a jump. You need some intermediate practice in there. After a poor performance on the midterm, I MADE time for those practice problems, and then was able to streamline into the homework easier.",1600976902,3,0
"Wow, are there 2 MTs for this class now?  Traditionally it has always been 3 quizzes, 1 MT and a Final, with the MT in mid-October.",1600976455,1,0
"No matter who did the recommending, Carol Christ still could have improperly instructed the admissions office to take this into account. I would give her the benefit of the doubt though. If you have ever interacted with her you can tell that she really cares about both the students and the idea of an excellent and open Berkeley.

If there's anything we should take from this is that the government is really a bunch of corrupt idiots who are weighing Berkeley and the rest of UC down.",1600976245,19,0
Try chegg or coursehero. It worked well for me and the professor was too naïve to look into it.,1600975983,-2,0
Are you fucking kidding me 😑 I live in Northside and having medical appointments every month south of Southside smh it already takes 30+ minutes of walking when cutting through campus,1600975962,3,0
"Never interacted with her but I heard alot of good things about her. Tbh I don't think the letter crossed her desk, probably went to some secretary.",1600975762,2,0
Yeah I deleted the others,1600975709,1,0
"Try studying more and complaining less, loser",1600975376,-1,0
"No matter who did the recommending, Carol Christ still could have improperly instructed the admissions office to take this into account. I would give her the benefit of the doubt though. If you have ever interacted with her you can tell that she really cares about both the students and the idea of an excellent and open Berkeley.

If there's anything we should take from this is that the government is really a bunch of corrupt idiots who are weighing Berkeley and the rest of UC down.",1600974990,2,0
I guess UCPD will be busy now.......for once.,1600974765,0,0
I don't. But the reasons for this policy are pretty self evident even if it is only a small group.,1600974602,1,0
[deleted],1600974567,1,0
How does this help and how can they enforce it? Are they going to check everyone for carrying the sheriff's paper now?,1600974505,3,0
When else would they do it? Most employers aren’t going to ask their employees to talk to undergrads on a weekend or at night. Just skip the class lol,1600974278,6,0
Don't lump us all into one group op,1600974253,0,0
"*UC’s draft document does not outline a robust enforcement of the proposed ban. UC Berkeley police officers won’t enforce it, nor will they ask people to leave campus, according to the draft document. That responsibility would be given to specially designated employees. “On campus grounds outside of campus buildings, this temporary policy may only be enforced by campus employees who are specifically authorized and specifically instructed to do so by their supervisor as part of their employment responsibilities,” according to the draft policy.*

*Gilmore did not specify how many Cal employees would be told to enforce the ban.*

In other words, a waste of effing time. Awesome.",1600973068,4,0
"on october 1st (next thursday) there is a uc-wide day of action aiming to defund ucpd and divest university resources from ICE. the berkeley rally will happen from 3-6 at MLK civic center park. masks on, social distancing observed. see @/uc_ftp on instagram for more info",1600973004,0,0
"*""UC’s draft document does not outline a robust enforcement of the proposed ban. UC Berkeley police officers won’t enforce it, nor will they ask people to leave campus, according to the draft document. That responsibility would be given to specially designated employees.*

*“On campus grounds outside of campus buildings, this temporary policy may only be enforced by campus employees who are specifically authorized and specifically instructed to do so by their supervisor as part of their employment responsibilities,” according to the draft policy.*

*Gilmore did not specify how many Cal employees would be told to enforce the ban.""*

In other words, a waste of effing time. Awesome.",1600972941,1,0
"I plan on going back as well. It’s my senior year and I just want to be in Berkeley, even if theres no irl classes.",1600972881,1,0
"They are a troll, they do not even go to Cal lmao.",1600972565,1,0
"Yeah stat140 is a hard class and is probably harder with remote learning. That said, it is an also very rewarding class and is tough for the majority of people. Good luck for whatever you decide to do!",1600972471,1,0
"Low quality meme. USC is memed because of this among several other scandals (re: medical school, etc). Cal isn't as memeable... at least for the time being.",1600972330,5,0
"“All campus grounds outdoors (including without limitation informal recreational uses of campus grounds for purposes such as, but not limited to, bicycle riding, running or jogging, walking and sunbathing);”

This would be awful wth? How does this help at all",1600972139,3,0
"FYI, Prop 16 isn't just about universities, it also allows for diversity in govt. contracts (which overwhelmingly go to white-owned businesses) and other government positions",1600972100,1,0
"[https://www.nytimes.com/2020/08/21/upshot/00up-affirmative-action-california-study.html](https://www.nytimes.com/2020/08/21/upshot/00up-affirmative-action-california-study.html)

""In other words, the measure in California seems to have set back a generation of Black and Hispanic students, pushing them down and out of the University of California system and helping to widen the racial wealth gap, with seemingly little offsetting benefits for other students.""

I encourage you to try doing some research on the prop and reading on Prop 209's effects before making your decisions about it.",1600972058,1,0
"It stops being a ""you"" problem when society starts paying for your mistakes e.g. smoking.",1600971976,3,0
"I'm not absolving advertisers/marketers of wrongdoing, but how much is it a ""you"" problem if you are easily manipulated by advertisers or are an impulse buyer?

I wish we lived in a world where everyone had integrity, but the reality is that we can't trust everyone or expect to be hand held.",1600971787,2,0
"Same, couldn't do the comparators question",1600971787,1,0
Yes: by suggesting junk food not be sold at the front of a grocery store I am actively voicing my opposition to all freedom of choice. You got me. /s,1600971727,1,0
"I appreciate the sentiment but seems a little micro managing and big brother to me. And this is coming from a person that supported Bloomberg's proposal to get rid of super large soda containers.

Also, when I see things like this I wish the govt would just focus on the economy and covid until all this passes. How much time did they spend putting this together I wonder?",1600971697,3,0
"JW Player 7.8.7 when I right click it (the course got archived but everything is still there), no dropdown menu. Bottom bar settings are closed captions, full screen, volume, rewind 10 seconds, pause/play. On JW Player's site it has x2 speed, but it's a newer version 8.17.5. 

Needless to say, I tried watching the first 3 videos of 5 minutes each and gave up.",1600971592,1,0
"just take a semester off, nbd man go take a walk and grab some tacos then reevaluate",1600971364,1,0
Why would profs do this lol? It's just more work for them,1600971209,1,0
"Stanford's effectively done this, as well. Stanford campus is now split into several ""zones"", each one with specific rules of what kind of Stanford affiliates can be in them.",1600971082,1,0
literally no.... but ok,1600971080,-1,0
"Lmao, you think you have freedom of choice? Advertisers absolutely know how to influence human decision making. It's why they are called impulse buys. 

Some other things include, more expensive items at eye level, while cheaper items that are basically the same are located on the bottom or very up top. 

They also put basic necessities all over the story making you walk more which increases your chances of eyeing something and buying something you didn't intend to buy.",1600971038,3,0
"Relevant XKCD:
https://xkcd.com/2130/",1600970825,2,0
"There’s a saying that goes “ it’s really hard to prove a genius wrong, but it’s impossible to prove an idiot wrong.” I’ll let that sink in for you.....if it ever does.",1600970151,1,0
From the horse's mouth... This account has also been banned.,1600970051,3,0
"So perhaps this is an unpopular opinion, but I believe a government should help reduce peoples' use of products that we know are harmful, even if it doesn't affect anyone else directly. So this includes the ban on trans fats, because we know they cause heart disease. This would also include illegal drugs, such as opioids and amphetamines.

Now the adverse health effects of sugar, and its addictivity, are at this point very well-known. So I would say that a government in principle should try to minimize peoples' dependency on it.

Now this particular piece of legislation is orders of magnitude weaker than this principle. It's not even impinging on choice at all. Anyone who walks into the store who wants to buy a candy bar can still do so (and pay the same amount of money). There's 0 limitation on that. As u/Ekotar mentioned, it's solely a limit on *marketing*, namely you can no longer use this one particular trick to peddle this unhealthy food. In the same way, this is along the same lines as the requirement to put Surgeon General warnings on packages of cigarettes, ""Please drink responsibly"" in alcoholic beverage advertisements, and calorie counts in restaurant chain menus. So if anything, I'm curious about why you (or anyone else can jump in here) believes this is a *bad* idea.",1600970013,4,0
"When did you hear that different talk? Sahai's opinion on the matter has definitely changed over time. That year was the year when Sahai realized a lot of his expectations about students were completely out of sync with reality. There's another lecture where he skips over multivariable calculus because ""Everyone's taken multivariable calculus in high school."". That led to another hubbub on Piazza (including Sahai thinking that all students at Berkeley come in with a lot of college credit) which led to Sahai covering the basics of multivariable calculus in the next lecture.",1600969810,1,0
yes! 2hrs to take the exam + at least 1 hour to go over everything,1599978561,1,0
I’d say 5. I would start seeing improvements around the 3rd one. And then 5th-6th one would usually be the same,1599978539,1,0
There’s definently a good chance considering 15% of all UC student population per school must be transfer students,1599978510,8,0
Ah I see...are they a fake club like this,1599977768,1,0
:D,1599977732,1,0
"&gt;CV

Thank you! ;)",1599977671,1,0
i'm in,1599976795,1,0
"Hi there, as was mentioned in another reply, it's really tough to decipher the arcane arts of Cal's admission process as a lowly student. I just wanted to say as a fellow CCC transfer, I wish you luck applying to Cal or anywhere else! With a CV like yours I'm sure you'll get into top tier schools. Only advice would be not to procrastinate on the personal insight essays. :D Good luck!",1599976683,1,0
I think consulting for the education sector. seems pretty niche like phoenix.,1599976265,1,0
"All City of Berkeley drone laws are meaningless in terms of merely flying a UAS, because the FAA has the *sole* authority to regulate navigable airspace. If you start buzzing someone though, that's different.

See, e.g., [Taylor v. FAA](https://www.lexology.com/library/detail.aspx?g=c0f81e6f-b7bd-408b-884a-0313f46582c8)

Flying a UAS over the UC Berkeley campus is going to be troublesome from the FAA side for a few reasons: you need to avoid flying over people (good luck) and you need to notify any airports within a 5 mile radius before you fly. IIRC there's a helipad in Oakland that's within 5 miles of the UC Berkeley campus so you would need to get a hold of them before flying.

I suggest starting and ending your flight outside of campus.",1599975873,1,0
same here 🥰gotta love berkeley,1599975641,1,0
Same. If one of them goes thru Imma have a person who I would really prefer not to run into on campus hahahah,1599975174,3,0
"One post mentioned the student advocates office - website is [here](https://advocate.berkeley.edu). Another group that might be a good resource at some point for housing, food, financial counseling, etc. is the [Basic Needs Center](https://basicneeds.berkeley.edu).",1599975097,3,0
An absolute beast for going through the process for all of those tho wow,1599975027,62,0
"Np, best of luck! :)",1599974828,0,0
really? What do they do?,1599974821,1,0
"I was under the impression that it would only tell the other person if they also put in your name, but fuck if that's not the case I'm unfortunately gonna have to take a hard pass on this.",1599974459,6,0
