body,created_utc,score,total_awards_received
The best thing I can suggest is to join a Cal study discord and work on what you can with others doing the same. It’s like study hall but cyberpunk 2020.,1607294359,1,0
"These are all made up numbers except the weighting. Final's 40%. Let's say there are 10 questions, each question is worth 4% of your overall grade.

HW's 20%. Now let's say there are 10 graded HWs excluding the free drops. Each HW is worth 2% of your overall grade, or missing half a question on the final. 

When end of semester grading happens, they look at the overall distribution of points, not the distribution of individual final/midterm/etc. unless it's a really small class. 

I have no idea what CS70 finals look like nor how many HWs there are, so plug in the numbers yourself to see if it's worth it.",1607293151,1,0
Dude why are you here?,1607292865,1,0
You’re a very talented artist. What’s the name of the style you’re doing on your cards?,1607292590,5,0
Do not summon him,1607292381,3,0
yes it is!! wasn't sure people would recognize that one haha,1607292327,5,0
Looks great! Is bottom right the south hall bear? 🐻,1607291571,5,0
[For those absolutely confused by this:](https://www.youtube.com/watch?v=4f08dmeQUso),1607291438,1,0
"been feeling this way since last month too OP - I hope we can hold it together til the end of this semester. Grad schools can and will see the fact going to school in a virtual sem isnt easy, dont lose all hope. proud of you and keep it going &lt;3 much love",1607291326,3,0
Sasageyo.,1607290902,4,0
"I’ll definitely give them a call then, thanks!",1607290115,1,0
"I'm pretty sure that's not why we don't get enough state funding, since funding for public universities has been going down nationwide for decades, and especially after the 08 recession",1607290081,1,0
[removed],1607289988,1,0
"There should be no effect of P/NP on L&amp;S CS (or EECS) major upper division courses. The only caveat for CS is that the department will still use the underlying letter grade achieved in CS61A, CS61B, and CS70 for determining admissions to L&amp;S CS, even if one of those courses was taken P/NP in fall 2020 or spring 2021.",1607289976,1,0
new starting QB and poo poo defense,1607289961,4,0
Yes.,1607289886,1,0
I’m someone who hasn’t gotten housing but has been getting those emails. Try calling housing? They responded to me within the day and answered my stupid questions nicely.,1607289366,1,0
"No, you need to be an essential worker to have access to buildings. I only have access to 2 buildings and if I need to go into a new building, there’s a whole process of getting approved.

The Optometry clinic is open though and allowing the public in, but you might need an appointment.",1607288915,3,0
Thank you for the encouragement! I’m happy to hear other banana slugs have made it :),1607288604,2,0
Lol they lost to OSU too! What is happening?,1607288256,6,0
Did you get into cal?,1607287891,2,0
C's dont go to grad school though 😓,1607287888,4,0
"Congrats! I was also a Banana Slug in undergrad who never thought they'd make it to Cal, but got accepted to a grad program ranked #1 in the country for that field. Keep working hard academically, and hope to see you there!",1607287722,4,0
Around adjustment time last spring the class mega expanded to fit everyone.,1607287247,1,0
"1) No, not accessible.   
2) Not a lot of indoor spaces are accessible....particularly after midnight tonight.",1607286486,5,0
"Typically there's 2 rooms per apartment suite. One room was built for 2 people. The other was built for 3 people. Both rooms share a common area that has a kitchen and a bathroom. Regardless of the capacity, currently 2 people are placed in each room. It's complete luck of the draw which one you'll get placed in.

For the size?  I'm kind of surprised that 5 people lived in these apartments pre-Covid but then I remember people probably only used the place to sleep and were on campus the majority of the time (not anymore though). Fridge space is small, storage space is alright. If you come, pack light to start with. You can always order more stuff later after you see how much space you're working with.

As for flex dollars, the apartments have a kitchen so you don't need to get them if you don't want to, but you can. You'll have to buy a meal plan though since it isn't included. The dining area (The Crossroads) is pretty close by so you don't gotta worry about that.

As to whether it's worth going there are some points to consider.

* Classes are online, so you're going to likely spend a significant chunk of time in the apartment studying/taking tests/doing homework/attending Zoom lectures. Would you prefer your room at home or your shared room at the apartment? As far as I know, all the libraries and traditonal study areas are closed. So your other options for places to study would be outdoor areas on campus and cafes with outdoor seating.
* If you come to campus you'll have to schedule Covid tests twice a week.
* You'll have the opportunity to interact with/befriend other students if you come to campus.
* You can explore campus and the city if you want.
* It seems some freshmen don't care about Covid regulations so make of that what you will.

I hope this is helpful!",1607286351,2,0
Yeah that’s plenty,1607285470,1,0
Cal Poly Pomona is just horses!,1607285007,1,0
"If you are a Cal grad, you can log in and search by major and year in Cal Alumni Network, [cal.berkeley.edu](https://cal.berkeley.edu). You can also claim your student [berkeley.edu](https://berkeley.edu) email address and use it as an alum. Log in with your CalNet username and passphrase.",1607284983,1,0
"Yes he can, anyone can. Some bitch with a 19 on the ACT got in.",1607284731,-2,0
Typical “can’t get into..” attacks lmao. Average ACT = 29 mind you,1607284599,0,0
u/GoldenBear2023,1607284121,4,0
I PM'd you.,1607282173,1,0
"Yes, and hopefully soon!",1607277710,1,0
They're about to break ground on the newest housing units for CAL soon.,1607273665,1,0
"Per the summer sessions website: “Due to the COVID-19 pandemic, most Summer 2021 face-to-face courses are being offered via remote instruction”. The schedule comes out on December 10.",1607273188,1,0
"C' s get degrees! Just try and remember the main points and important stuff, that's all that matters.  You can always go back and fine tune the info later to really solidify it if you need to.",1607272775,1,0
I’m sorry but I’m offended at the use of “UCB” 🤬😡🤬😡😠😤😤,1607267444,1,0
You can’t even get into Cal. lol,1607266397,1,0
"What is the point? Why not use the built in COVID tracking in iOS/Android, which already is privacy preserving? Isn’t it dangerous to be fragmenting the ecosystem like this?",1607266155,1,0
"Unlikely probably, check EECS 101, they are unlikely to expand again.",1607262636,1,0
"If they’re not gonna acknowledge The Play, I don’t have to acknowledge them having the Axe",1607258782,1,0
Gracias,1607258702,1,0
Riverside's there. SB isn't thought.,1607257375,1,0
"I don't care, I had fun and that's all that matters :)

They might not be the best, but life's never perfect and the little victories make it all worthwhile",1607256857,1,0
"I will be messaging you in 1 day on [**2020-12-07 11:11:01 UTC**](http://www.wolframalpha.com/input/?i=2020-12-07%2011:11:01%20UTC%20To%20Local%20Time) to remind you of [**this link**](https://np.reddit.com/r/berkeley/comments/k7reaz/will_i_pass_cs_170/getbud2/?context=3)

[**CLICK THIS LINK**](https://np.reddit.com/message/compose/?to=RemindMeBot&amp;subject=Reminder&amp;message=%5Bhttps%3A%2F%2Fwww.reddit.com%2Fr%2Fberkeley%2Fcomments%2Fk7reaz%2Fwill_i_pass_cs_170%2Fgetbud2%2F%5D%0A%0ARemindMe%21%202020-12-07%2011%3A11%3A01%20UTC) to send a PM to also be reminded and to reduce spam.

^(Parent commenter can ) [^(delete this message to hide from others.)](https://np.reddit.com/message/compose/?to=RemindMeBot&amp;subject=Delete%20Comment&amp;message=Delete%21%20k7reaz)

*****

|[^(Info)](https://np.reddit.com/r/RemindMeBot/comments/e1bko7/remindmebot_info_v21/)|[^(Custom)](https://np.reddit.com/message/compose/?to=RemindMeBot&amp;subject=Reminder&amp;message=%5BLink%20or%20message%20inside%20square%20brackets%5D%0A%0ARemindMe%21%20Time%20period%20here)|[^(Your Reminders)](https://np.reddit.com/message/compose/?to=RemindMeBot&amp;subject=List%20Of%20Reminders&amp;message=MyReminders%21)|[^(Feedback)](https://np.reddit.com/message/compose/?to=Watchful1&amp;subject=RemindMeBot%20Feedback)|
|-|-|-|-|",1607253103,1,0
!remindme 1 day,1607253061,1,0
"Yes it's enough! My therapist wrote me a letter saying the accommodations I need and DSP helped me out. I believe you don't even need your therapist to say a diagnosis or anything like that. The office is on your side and just wants to help you out. I'm sure they've met many others in the same boat.

My favorite DSP accommodation has been the 150% time on tests and more liberal hw extensions :)",1607252761,1,0
Same lol. Zoom University rly is not it.,1607252428,1,0
Desperately trying to balance research projects for the grad school app and playing 5D chess with courses so I get to 12 units and still get finaid.,1607252066,1,0
Is German 1 synchronous? How do I know if there will be an accommodation for international students? There’s no instructor available on the website.,1607249219,1,0
@ r/UCSD,1607248027,1,0
"For me, personally, this has been the shittiest semester. Even worse than Spring. Hang in there, OP!",1607247315,1,0
"Nothing about this school is a stress-free experience. ;)

(Sorry...)",1607246257,1,0
"Yup, it's likely. There are some buildings that might have singles that would be 60-70% the size of doubles/triples. But regardless, it would be a rather comfortable space since you don't have the clusters of other furnitures.",1607245975,1,0
"Ahhh the only reason why ANYONE is talking about Vandy is because of Sarah Fuller... Vandy is that nerdy incel that everyone feels bad for. 
You, simpleton, are Vandy.",1607244379,1,0
"Same here regarding the classes. There are so many courses within and outside my major where the content seemed really interesting, but the academia aspect made me disinterested most of the time. This was especially bad in the history department, and I had a terrible experience with a very stuck-up GSI in one of my discussion sessions.",1607243934,1,0
"I'm lucky enough that I only need one more requirement to graduate, and almost none of the courses I wanted to take are being offered next sem. Because of that, I'm taking that last requirement through UC Berkeley Extension, which saves me a lot of money especially since I'm out of state. I'm using the rest of my time off to pursue some independent projects in music composition, which I've wanted to do more of for a long time",1607243750,1,0
I'm fucked either way. I still have a few 0's after the drops.,1607243471,1,0
Cal beat Oregon for the first time in forever and didn’t even make ESPNs front page. Vanderbilt went 0-9 and made the front page of ESPN fox and bleacher report for a 30 yard shitty kick... humble yourself,1607243451,1,0
"Lol no they don’t. Nice try though. I am glad you’re trolling all the schools you have no chance of getting into, simp.",1607243132,1,0
And yet they get more media coverage then Cal :( Cal- last in the Pac 12 North and last in student wellness.,1607242545,1,0
T R U E,1607242118,1,0
Cal always 1 point behind Stanford on and off the field.,1607241646,1,0
Woohoo!  We blew up the Pac-12. Again.,1607241585,1,0
"Speaking of which, I feel bad for Sarah Fuller, Vandy's offense was so bad she didn't even get a chance to kick a FG :(",1607241570,1,0
Yeah I just checked it out... looks like he has been active in 0-8 Vandy’s subreddit,1607241256,1,0
"If fall is online then it’s highly likely that study abroad would end up being canceled. I initially applied to study abroad for this semester and it was canceled back in may which was way before our fully online semester was announced. 
Therefore, I wouldn’t depend on study abroad being a backup for if the fall semester is online. However, you could still apply for fall and I think you have to cancel a month or two before the program starts to get a complete refund. But I think studying abroad would be a great experience and I think you should go if you have the chance",1607241221,1,0
"we always were a good team this year, we just got fucked by covid a lot harder than others, even with so few actual cases",1607241084,1,0
"first off, wait till you get into college before you start talking smack

second off, if you actually knew the circumstances behind our loss to UCLA you'd understand. besides, they're pretty good this year and are over .500",1607240991,1,0
"Looked at their profile, they're not even in college yet.",1607240915,1,0
And what school do you attend?,1607240687,1,0
Tp tea if it wasn’t so expensive :(,1607240661,1,0
Yes and we don’t lose every other game,1607240227,1,0
"There is of course priority for COE EECS majors for all the lower division CS courses, since they are direct admits and thus already declared.  But yes, all undeclared L&amp;S students have priority since they would need these classes in order to declare in the first place.  (Conversely, CS and DS majors already declared obviously would have taken these classes already, so no need for priority.)

Data 8 is an intro stats and computing class, so relatively speaking it should be an easy class.  But given all the complaints about Data 8 this semester in this subreddit, hmm maybe it got harder, not sure if the majority of people find it hard or just some people.",1607240151,1,0
[deleted],1607240060,1,0
Does your school even have football?,1607239986,1,0
no me,1607239704,1,0
acceptance rates have more to do about how many apply and the size of the college and less of how smart people are but agreed to the general msg,1607239696,1,0
Wtf is wrong with you? OP ur an awesome smart lady and I hope you know that.  Just ignore this arrogant idiot who doesn’t go even here.,1607239552,1,0
"Yes, Berkeleyside recently mentioned it's closure in an article - pretty brief but confirms the closure.

[https://www.berkeleyside.com/2020/11/30/east-bay-restaurant-openings-and-closings-in-november](https://www.berkeleyside.com/2020/11/30/east-bay-restaurant-openings-and-closings-in-november)",1607239220,1,0
You can’t even beat UCLA. lol,1607239164,1,0
Stanford’s knocking,1607239120,1,0
"oh i misread, thought it wasn't there. wow, good luck!",1609390777,1,0
Arriba la raza. Congrats on your accomplishments thus far. Keep going.,1609390710,1,0
Oh yeah but the instructor says they didn’t ever receive the email. And the only proof I can give that I sent it is a screenshot from the sent tab,1609390098,2,0
This is crazy!  How do the police expect us to trust them when this is how they act.,1609390017,1,0
"&gt; I can see my email in my “sent” tab

what do you mean? all sent emails should appear there i thought?",1609389988,1,0
I hope nothing happens to you.  I recommend as others have said leave nothing in your car.,1609389916,2,0
"It's tragic because there are so many wonderful things about California and Berkeley but, at the same time it seems as though the whole world is sort of headed to shit.  We need to watch out for our neighbors and not fight amongst each other.",1609389733,1,0
"No chance for in-person instruction for Spring '21, unfortunately. &amp; don't be surprised if Fall '21 is remote, too.",1609389260,2,0
following,1609389216,1,0
"idk i doubt anything will be in-person in the spring. even though vaccines have been approved, they’re mainly for healthcare workers and the elderly right now, so it’ll take some time for the US to get enough supply to start vaccinating young adults (probably by april/may). also, the new, more contagious covid variant that was detected in the uk was discovered in san diego county today",1609388624,1,0
To be fair,1609388004,2,0
"I'm going to have to disagree. It depends on who you room with and how much you can trust them. Don't room with people you don't trust. Also, set up concrete rules at the start of the semester so it's easy to say, hey, you done fucked up these rules, wtf is going on. Have some backbone and don't be afraid to confront people.",1609387880,3,0
I’ll make you one if you pay for shipping and materials.,1609387341,1,0
Will the bells play out-of-tune Bach pieces every Sunday?,1609386954,3,0
Nope. Everyone took the exam at once,1609386456,1,0
"No reason really. Adhikari just said that reading the textbook gave the same info as the lectures so there was no point in recording them. I don’t get the logic, but she said that",1609386439,1,0
"It’s not really a think in Berkeley. Case and point, my car was parked in between two other cars, and the two cars were broken into and things were stolen (that were left in plain sight). My car wasn’t broken into most likely because I had nothing in view.

One guy had his back window smashed on his SUV and the other had his passenger side window smashed in, so they were definitely checking cars",1609386245,1,0
One time I took my saxophone to a math and chem lecture and started to blast careless whisper. Needless to say the profs were super confused to why a person was playing careless whisper in halloween lmaooo.,1609386052,2,0
"It’s not really covered in the syllabus... I had an assignment due Wednesday, I emailed asking for an extension until Sat bc I had the flu. The instructor agreed to the extension, I emailed them the assignment on Friday, and then a week later the instructor told me they’d never received the email. I’ve been having a weird time w my email, sometimes the emails don’t go through? But I can see my email in my “sent” tab so I sent them screenshots and forwarded the original email w the attachment, and after all that, the instructor is saying that they’re still counting it as late. I’m not really sure if it’s worth pursuing but the late penalty resulted in a whole letter grade drop :/",1609385437,1,0
"Ah, thank you!",1609385265,1,0
Randomly busting windows is very common in SF but I don't know whether Berkeley is susceptible to the same thing.,1609385119,1,0
"Not in Berkeley (in Oakland) someone broke into my mom's car to steal a bag of popcorn.  To be fair, it was kettle corn.",1609385043,3,0
https://drive.google.com/drive/u/1/folders/1_lE0v-bhTE5Iwd0PuVr3M67aHKi6vkBa,1609384824,2,0
"Awesome, thanks!",1609384729,1,0
I once got hit by a car and they wouldn’t let me file a report. No major injuries but my bike took massive damage.,1609384595,2,0
Where can I find the open-sourced files? This is amazing!,1609384502,2,0
"Congrats on declaring!

If you want to explore a bit into the different possible topics of CS, taking Data 100 is one of the best ways to bridge between lower-division and upper-division. The first third of the class is Tables, mini-probability, and programming. Then the last two-thirds is linear algebra theory, which will dip your toes into EECS 127 Optimization and CS 189 Intro to ML. Then there's a small sliver into Parallelism and Data Management in the form of Spark and Big Data.

If you like the Tables and Programming, feel free to try courses like CS 186 Databases and CS 160 UI Design.

If you like the linear algebra theory, go for EECS 127 and CS 189

If you like probability, CS 188 is a good bridge class into Machine Learning IMO (even though some say it's not needed for industry, but dips your toes in it). EECS 126 is very difficult, but it's an option

&amp;#x200B;

You can also find the different research areas listed here that may get you started: [https://www2.eecs.berkeley.edu/Research/Areas/](https://www2.eecs.berkeley.edu/Research/Areas/)

List of CS classes here as well: [https://www2.eecs.berkeley.edu/Scheduling/CS/schedule-draft.html](https://www2.eecs.berkeley.edu/Scheduling/CS/schedule-draft.html)

&amp;#x200B;

In my opinion, don't fall for the overhyped train of classes like CS 170 and CS 162. There is a lot of mix of people that say these classes are important for industry and interviews, but I only hear it as word of mouth. I don't hear industry saying ""You MUST take these classes"", unless of course, you are pursuing the theory and security route, respectively. If you have a genuine interest in these classes, go for it! If not, don't force yourself.

&amp;#x200B;

&amp;#x200B;

TLDR: Data 100 is a good bridging point. Look at the links above to see where your interest lies. And don't fall for the overhype train of taking CS 170 or CS 162, unless you like theory or security, respectively.",1609384365,1,0
I’m gonna look into some sort of raffle charity type deal later. I open sourced all the files so you could print it yourself or at Jacobs if/when it’s open. It takes something like 6 continuous days of printing to make this one so I don’t want to make a lot or deal with shipping and stuff.,1609384237,3,0
"Sounds a bit too complicated, I’m hoping I can find existing raspberry pi code for an alarm clock or worse case just write it myself. The only thing stopping me from doing it is if there were any kind of circuitry involved (had a bad time in ee16a hahaha).",1609384077,1,0
"Ha is a decent prof, but good lord are his tests hard.",1609383993,1,0
Do you have any dinosaur bones inside?,1609382692,2,0
"Seriously seek help. This is literally the second post you’ve made about this (under throwaway accounts). You’re either a troll or you need a reality check. Either way, I suggest you seek help immediately",1609382591,2,0
"Not sure what you mean by “unfairly applied a late penalty,” was it applied in the way it is outlined in the syllabus?",1609382389,3,0
[deleted],1609382355,-1,0
There is a formal process for contesting grades; the [academic division](https://advocate.berkeley.edu/academic/) of the Student Advocate's office will be able to help you. Good luck!,1609382336,2,0
[deleted],1609382225,-1,0
Not going to Harvard or Stanford med doesn’t mean that someone will lose the ability to become an incredible doctor lol. The best surgeons I know all graduated from med schools that I haven’t heard of and they’re doing perfectly fine. There’s nothing wrong with your grades? You’re at a competitive level and some premed students would kill to have those kind of stats in our given circumstances.,1609382167,2,0
Would you be willing to sell any of these? :),1609382025,4,0
[deleted],1609381729,-3,0
"These grades are fine....GPA isn’t everything when it comes to med school applications. If you’re implying that individuals with similar GPA don’t have a good chance to move onto med school, your views are severely warped. We’re talking about Berkeley here. 😐

The way this post is phrased sounds like bait lmfao",1609381698,4,0
"It's supposed to teach you the coding skills necessary for Math 128A. It does not go into the theory of 128A. When I took Math 98, the instructor (who was a GSI for 128A) occasionally gave tips on some of the homework and coding projects.",1609381567,1,0
"I’m pre-med and sure, you may not get into Harvard or UCSF, but you’re still a competitive applicant for a ton of other great medical schools. Tufts and Emory medical schools have an average gpa of 3.65-3.70. I’d just focus on doing well on the MCAT and making sure you have sufficient research and clinical experience. GPA is just a number- there are numerous other ways to show your strengths in becoming a physician. Best of luck!!",1609381366,4,0
biking or hiking.. biking with music playing is the most relaxing stuff,1609381149,2,0
"Yeah. In my opinion, the lectures in the class are fine, tbh. It was the policy that failed my trust for the class.",1609381046,1,0
"I thought the adjunct Math 98 was only to teach basics of Matlab, does it also go over material in 128A?",1609381022,1,0
"I'm not that great at studying either, but based on what you wrote, don't push yourself for more than 2 hours at a time if you can't. I guess what might work better for you is starting early and spreading out your studying or maybe dedicating a 2 hour period in the morning and a 2 hour period in the night. 

Otherwise, what has helped me personally stay on top of my work is trying to pack my schedule as much as I can with actual commitments. I find that when I'm busy with real commitments (meaning clubs/jobs/classes etc instead of a ""commitment"" to myself to study) I have more pressure to get work done since I have less free time. If I have a lot of free time, I find myself procrastinating a lot because my sense of time is warped - like ""I have a whole week, I'll start later.""",1609380737,1,0
"+1 for SAAS! Like the other person said, you get what you put in. Doing the Career Exploration committee made Data 100 a walk in the park and transitioning to Data Consulting from there gives you an easy way to apply your new Data Science skills to problems that companies present you! I used a lot of the skills I learned during my first internship and Data Consulting gives you really great stuff to talk about during interviews, even if you haven't done an internship yet. Data Consulting is super welcoming to people with less experience!

Highly recommend to anyone interested!",1609380640,2,0
You need some help. These aren’t bad grades at all. I would kill for grades like these.,1609380554,8,0
It's mentioned on the flyer haha - I added it to the post if that helps :) I didn't want to put it on the post originally in case people thought you have to be Christian to attend,1609380362,1,0
