body,created_utc,score,total_awards_received
"Yea unfortunately we didn't have anything like that this semester.

As for the professors, it seems like they're unaware/pretty removed from what's happening in Ed - that's the impression I get at least. When the checkpoint 2 rubric was released, many students argued that the coverage requirement wasn't clear.

As a response to these concerns, the prof answered ""I apologize, we did not realize it would be surprising"" and ""Okay, that's fair, I re-read the task 4 description and can see how it's confusing with the CodeCov mention"", which makes it seem like they haven't seen any of the student questions about code coverage thus far, even though many, many posts have been made about it.

The professors have been understanding about revising due dates/rubric items after these complaints, but it shouldn't have been an issue in the first place.",1638819204,6,0
can you elaborate on that? taking it next semester and worried about this,1638818685,0,0
"So sad to hear that the class is in such a dismal state this time around. 

I took it last fall and while it was a buggy experimental mess, but there were two TAs that truly went far above and beyond to rectify as many mistakes and oversights as possible so far as to spend their holiday break recording video tutorials on how to get through some buggy interactions with Codio and the like. I was fortunate to get to work under one of those TAs in 169L, but it was pretty clear to me that they were doing a disproportionate amount of work out of a passion for teaching and that once they graduate (SP21) the class would be left with the other TAs whose names I barely ever saw crop up in Ed because they almost never responded to questions. 

Unlucky, those two spent so much time overhauling the course content, it was really too messy for two people to solve in the course of a semester I suppose. I wonder where MBall and Fox are in all this, they were very reasonable and empathetic last year when it came to high-stress environments caused by poor planning/the global pandemic raging on outside; as messy as the class was you could tell they cared, just couldn't quite execute on that well enough.",1638818229,6,0
[deleted],1638816428,-19,0
[deleted],1638816064,4,0
Nice ad?,1638815819,12,0
"The actual content of the project isn't that difficult, it's the way that it's assigned. Most of the group work was assigned over Thanksgiving break, the rubric was only released 3.5 hours before the checkpoint is due, and new things were added to the spec 2 days before the deadline.

If the logistics were made clear well ahead of time, everything in the project is doable and reasonable. But staff keep ignoring questions and changing things last minute.",1638815301,8,0
"Almost me in stat2. I got a couple of B's on assignments and even if I get a 100 on the final, I'll never make it out the A- zone. Sucks cuz I took AP Stats in HS which is embarrassing lol.",1638815226,17,0
"This is something else that's pissing me off, the fact that they're also ignoring questions about the final.

This question was asked 4 days ago, still no response: [https://edstem.org/us/courses/8667/discussion/916542](https://edstem.org/us/courses/8667/discussion/916542)",1638815181,10,0
That’s like me but between a D and an F,1638814912,59,0
"Have even they posted about the final? I'm looking through Ed and can't find any info about it on there.

Also shout out to the CHIPS on Cucumber that had an autograder that didn't even tell you which tests were passing or failing",1638814716,12,0
The class has changed pretty much completely. The current reincarnation of the class really only has been in effect since Fall 2020 more or less.,1638814505,5,0
"Just to give my 2 cents, when I took the class in Fall 2020, we had a lot of issues with the new technologies and communication, but the staff did a lot in the second half of the class to address and correct the issues.  Especially the one where spacing out of projects and quizzes and stuff, that was an issue for sure for much of the class.  But by the end of the semester, I thought issues were addressed for the most part and that it was actually a good class by the very end, with a very comprehensive but fair Final exam.  To that point, I’m very surprised that some of these issues are cropping up again. 

I never thought that the workload was that bad, but then again I’m not sure if the content has changed much for this year’s version.",1638814083,3,0
The bright side: your suffering in this class will make all other classes feel like a walk in the park,1638813577,7,0
"I will say that people usually don't take Hilfinger exams super seriously, and that his 61B exams I personally think are quite a bit easier compared to denero 61A exams. No curveballs or anything, just a bit of rigor.",1638813039,1,0
Looked more like a Bruin actually.,1638812989,26,0
"Rao is pretty standard. His exams are super formulaic lol, just do his past exams and you should be fine.",1638812944,2,0
"I feel like they’re going to curve the class heavily to compensate but an education isn’t about grades. This class has singlehandedly convinced me I won’t make as a software engineer. I’m not a CS major so that isn’t the end of the world, but I feel like if your (non-weeder) class just sucks the hope out of students there’s a serious issue. I got low A’s in CS61A and CS61B but this is ridiculous",1638811661,13,0
Tbf Oski looks kinda sus sometimes,1638811587,5,0
"
I remember taking this over the summer a few years back and it was always misran but they curved the class heavily(70% -&gt; A). Honestly the class wasn’t that bad even tho some of the content is outdated",1638810628,2,0
[What you should be doing during your day according to Sahai](https://i.imgur.com/O4ShtpG.png).,1638809248,3,0
Use Google lol,1638808226,-9,0
Same. Worst required class by far.,1638807472,20,0
Beautiful,1638806806,1,0
data140,1638804646,1,0
[deleted],1638798050,0,0
"Yep, paid $30.

Codio is a really scuffed site too, like if you mark a project as completed, then you can't go back to edit it. If you accidentally mark it as complete before you actually complete it, then you need to ask staff to reset it.

Hopefully they'll fix the class, I do think the content is good. They just need to teach it better.",1638790971,17,0
It’s the average distance of any score from the mean,1635697651,3,0
"Yogurt park is literally the best froyo I've ever had.  Chocolate vanilla twist with cheesecake bites.  It's the move.

I'm not missing too many places in Berkeley here in NYC, but I'm DEFINITELY missing Yogurt Park.",1635697630,1,0
"See this post: https://www.reddit.com/r/berkeley/comments/qh8ok0/gorilla_is_on_campus/

TLDR: Berkeley alum founded startup putting Harambe everywhere",1635697464,4,0
"There was a school close to where the Wesley House is currently situated at during the 80’s and 90’s.  Are you talking about this place, or somewhere else?  I don’t recall it being a preschool though.",1635696454,2,0
Graduating,1635696421,4,0
"I loved the people in my major (math).  People were so supportive, kind, and helpful at every step.  No one put each other down, I didn't feel any sort of a competitive vibe, and even though classes were super hard others were always open to working together which made coursework a lot of fun.

Usually I wouldn't want my social group to overlap too too much with my academics, but I just couldn't help it at Cal.  The math community was so positive and uplifting, it was probably the healthiest possible social group for me.

I also loved a lot of my professors.  Many of them were really fun to get to know, had great stories and advice.",1635696309,3,0
No… it’s a measure of spread or variance or distribution around the mean assuming a normal distribution. And there is no definition normal score 1 SD from mean? What you describe is the middle 68% of people assuming a normal distribution.,1635695630,1,0
"Wow, this is ridiculous. Theft in Berkeley is getting much, much worse than it has been for decades, and this issue isn't being addressed whatsoever by the campus or by the local police. I hope you find your car OP.",1635694311,1,0
"For me, coming from community college:

Ten ish years later, Berkeley on my resume is still there. People notice.

My classroom experience was so much less important than my social experience living in the coops. I learned a ton there.",1635693213,7,0
"Waiting for someone to post the meme, "" you guys are getting paid ! 0.o""",1635687604,2,0
yeah it's only in 10s,1635686158,1,0
Also can anyone get 2348…? I thought it’s graduated to the nearest ten.,1635685663,2,0
"Quite acidic, actually.",1635685648,1,0
"Go to faculty office hours.  We may be lecturing to a small intimate class of 1000, but in office hours we are often very bored with nobody showing up.  My office hours in particular turn into a small group conversation on whatever, relevant to the class usually or sometimes not.",1635683940,12,0
"I suspect we won’t expand by much if at all.  For the past several years the $/student has stayed flat or even declined, while the $/TA has increased.

Starting a few years ago I instituted a policy where I will never expand a class unless there is also an equal expansion in the TA budget.",1635683774,3,0
"Simple answer: it's a measure of variance or spread, how far values tend to fall from the mean.

Detailed intuitive answer: you take each value and subtract the mean. This gets you the distance of that value from the mean. That's what we want to know, but we want to summarize it as a single value representing the whole data set, so we need to combine them and find a useful summary number. To combine, you square each value, making it a positive value (because keeping negatives in the mix could just cancel each other out in the next summing step). You sum all of those, which gets us closer to our single summary number, but an inflated total is not useful. So we divide by n-1, which is similar to why you divide an average by n (but in this case it's n-1 for technical reasons, too detailed to get into here). Last, because you squared the observations earlier to make them positive and avoid canceling each other out, you take the square root to transform it back to the original scale so it represents a magnitude that makes sense for your data set. Bingo, now you've got a single summary number that represents the spread around the mean of your data set.",1635681917,38,0
[deleted],1635681881,1,0
"Sounds like you needed the time pressure to get the motivation &gt; dopamine. Adhd bells are ringing from what I can see. Perhaps you were able to cope but know if one day you can’t, there is likely a reason your brain functions best this way and there are alternatives.",1635678581,1,0
"omg soup season :D

\- Steve's Korean BBQ in Asian Ghetto on Southside has a rly hearty kimchi stew (big portions! it comes w/ rice too)

\- Thai Basil right next door to Steve's has rly nice Tom Yum noodle soup :)

\- TC Garden on Northside (Hearst Food Court) has a delicious beef noodle soup! rly hearty portion for 12 dollars :))",1635676168,6,0
ok vampire,1635675552,4,0
Checking the personal website url really highlights how legit this resume is,1635675326,1,0
i went to cz tn so yea?,1635675313,1,0
if you're joking the worst thing i can say about you is that you are not funny. if you aren't joking.....,1635673926,6,0
Or it means they are dumber than a BUSINESS student,1635671944,11,0
felt,1635671606,2,0
least based berkeley grad,1635671463,7,0
Read the resume closely.,1635671333,6,0
No still PNP a class to save my GPA… UGHhh,1635671290,1,0
"It’s just how far from the mean on average people scored, that means something like for a sd of 11 and a mean of 28, “normal” score is between 17 and 39",1635670794,15,0
"I transferred and graduated long time ago. I joined a social club that isn’t competitive at all. It was easy. Met a few people to hang out with. It was a social club for social’s sake… so it was kind of… full of drama. None of those people I hung out with still hangs out. 

BUT! The research Lab that interned at made me some friends I am still in contact with. Got a job thru one of them too. 

Friends happen at the most unexpected time and place. 

I hope good surprises happen to you too. (Made those lab friends during my VERY last semester at cal.) 

Also, social life doesn’t end after college. I met some friends on meet up after I am done with all my schooling too. Meet up is kinda like clubs in college… haha.",1635668400,1,0
"Oh I’m totally expecting a loss, Arizona played USC close today, we’re historically terrible in the desert and it’d be a classic Cal letdown after a big win. I’m just saying it’s possible we win",1635667934,8,0
"This post has been removed because our Automoderator detected it as spam, or your account is too new to post here.

If this post is **not** spam, please contact the moderators for assistance.

Check out the megathread for frequently-asked questions: https://old.reddit.com/r/berkeley/comments/pad3m1/29_welcome_to_campus_for_the_first_time_freshmen/

*I am a bot, and this action was performed automatically. Please [contact the moderators of this subreddit](/message/compose/?to=/r/berkeley) if you have any questions or concerns.*",1635667465,0,0
[removed],1635667464,1,0
UCs are not known for small class sizes and individualized attention,1635667428,1,0
My pleasure!,1635667398,9,0
Thank you for this. I was born in Berkeley and was getting depressed reading posts from UC students who …I guess are all miserable? This is a nice break from that &amp; reminds me what it’s all about.,1635667101,27,0
A lot of companies like SpaceX actually asks for SAT or ACT scores..no idea why,1635666903,11,0
You underestimate Cal's ability to play down to anyone.,1635666877,10,0
[deleted],1635666734,1,0
Getting mugged 🏃🏻,1635666086,3,0
"Yes. God. I remember saying that all the time my first semester after transferring. My other college called it midterms cause there was one test. There’s always 2-3 tests here, those aren’t midterms. Drives me nuts.",1635665288,9,0
Ooh thanks!,1635665175,1,0
zach’s snacks lentil soup is quite good,1635664829,3,0
Please tell me your phone number on there and email is fake for the purpose of this post. Otherwise why would you post your personal information out in public,1635664392,-13,0
[removed],1635663964,1,0
"This post has been removed because our Automoderator detected it as spam, or your account is too new to post here.

If this post is **not** spam, please contact the moderators for assistance.

Check out the megathread for frequently-asked questions: https://old.reddit.com/r/berkeley/comments/pad3m1/29_welcome_to_campus_for_the_first_time_freshmen/

*I am a bot, and this action was performed automatically. Please [contact the moderators of this subreddit](/message/compose/?to=/r/berkeley) if you have any questions or concerns.*",1635663560,0,0
[removed],1635663559,1,0
Alphabet bot lick my nuts,1635662695,4,0
You’re going to experience a mode of ur brain u have never experienced before in these next few days. It’s gonna go into overdrive and get all that shit done. Let’s gooo!!!! Post back when the nightmare’s over u got this,1635662566,8,0
I can't think of anything special there besides the Great Mall.,1635662346,1,0
[deleted],1635662125,1,0
saturday morning,1635662102,1,0
good soup,1635662043,4,0
"You’re right, all the good architects design buildings with the attitude of “ It won’t *necessarily* be a problem “",1635661781,0,0
"If business students can figure out what a standard deviation is, you can too. Youtube is your friend.",1635661183,85,0
South side,1635661070,6,0
[removed],1635661009,1,0
You realize that’s not necessarily the case right?,1635660962,1,0
I did the opposite and was also successful. Stopped caring about enjoying the ride and focused instead on career/resume building and networking only. Have not made any friends but hopefully I’ll meet them in grad school.,1635660929,2,0
"Would you look at that, all of the words in your comment are in alphabetical order.

I have checked 331,600,298 comments, and only 73,278 of them were in alphabetical order.",1635660916,9,0
Ahhhh I need them too,1635660905,2,0
"Shhhh, it’s going to be okay",1635660858,19,0
"also get off reddit and go outside, touch some grass instead of commenting on every damn post u see",1635660690,-16,0
Suuuure,1635660447,11,0
Depression ❤️,1635660322,11,0
Do not get soup from andronicos. I did that mistake and got food poisoning!,1635660289,8,0
"stfu u asshole, i’ll literally take a test and send it to u",1635660250,-17,0
"Really too bad the students missed out on such an awesome game today. In the alumni section where I was, it was pretty darn empty too. It was an awesome game and it would have been lots of fun for more students to see live. I hope the students turn out big time for the next (and final) home game.",1635660129,20,0
That was a great game!!  I am really hopeful for the rest of the season now!,1635660029,5,0
Exercise and fresh air always helped me out. Maybe go on a long hike on the fire trails tomorrow and then try to buckle down.  Or jog or play tennis - anything to get the heart rate up. Good luck!,1635659973,4,0
[deleted],1635659777,1,0
"Thank you so much for the response, I know that being a transfer anywhere is a pain when it comes to clubs and trying to get your foot in the door what otherwise would not be as much of an issue but getting left out of a competitive environment when I've lived and breathed it my entire life is not a price I'm willing to pay. Again thank you so much.",1635659626,2,0
"The only way I know Cal wins a game is through Reddit. 

It was so quiet today.",1635659496,7,0
"I'm not here for research thankfully, I'm only here for the career-clout degree and to make connections and friends as it's the last place to do so for adults basically.",1635659108,3,0
"Wow thank you so much for the great advice, definitely makes me feel better. Good luck with your last year and whatever happens after :)",1635659060,7,0
This has to be a joke right,1635659003,30,0
Nothing 🌟,1635658843,1,0
"I am honestly thinking about studying abroad and making close friends there tbh. It's the one factor I could never experience in CC. To be honest since most freshman had Zoom uni due to covid, it isn't as bad as it other transfers have described it, a lot of people here are still finding their bearings.",1635658654,1,0
You could spend a few minutes watching a Khan Academy video :),1635658506,16,0
"“I don’t have stds”

Thank goodness no one lies, especially on the internet",1635658143,34,0
Bruh,1635658021,44,0
LFG,1635657530,7,0
I imagine these might be harder to find than the gummies I suspect OP is looking for.,1635657102,3,0
theyre open at 7 am?,1635655849,-9,0
"Oh, this is wonderful news (and I should check before just relying on my crud memory). Thank you for this reminder.",1635655683,1,0
the people playing piano on lower sproul when youre walking back from the library really late at night,1635655649,24,0
My bad 7am lol,1635655419,1,0
lol the only gummies i have nowadays,1635655065,5,0
Shame how empty the stadium looked for that big W,1635654852,27,0
Melatonin gummies? 😉,1635654752,11,0
Does this class have a retake for each midterm?,1635654607,1,0
theyre open at 6 am?,1635654539,1,0
I like how that's the part you focused on :),1635654488,17,0
"Yeah I guess you're right, that Stanford's prestige is perhaps regional. Pacific area Stanford may be on that level, but outside of the country and elsewhere in US, Stanford isn't on that level.",1635654403,1,0
[removed],1635654138,4,0
What psycho puts their SAT score on their resume,1635654132,49,0
Can someone explain how it wasn't a score at the end? https://youtu.be/ZlGeTzSrjhc?t=153,1635654105,11,0
oh wtf weren't they better before? I don't remember them being that bad,1635654044,-5,0
The Wildcats are 0-8 this season. I think we’ve got a good chance,1635653874,23,0
not to be that person but that ain't happening ... rip,1635653667,-24,0
"I especially wanna emphasize 1 and 2. 

Handwriting stuff forces you to develop a sort of “muscle memory” whereby you learn through physical action. 

As for number 2, it is sooo easy to get wrapped up in the specific details and forget the big picture, so making outlines as well as review sheets helps immensely with consolidating information in your brain!!!",1632560284,2,0
"I'm old and have been on the internet for most of that life. A social media platform getting ruined by the users is nothing new or even rare.

You matter even less than Digg.",1632559863,0,0
"good call. 10/10 recommend staying friends (?) and seeing where it goes from there. though i personally don’t regret my last relationship, i don’t recommend it for most people bc i think, especially as a frosh, college is your time to explore and the world really is your oyster. just have fun tbh",1632559741,3,0
"Huh yeah that’s what I thought. Do you mind sharing how you met, and why did you choose to date someone so much older? You don’t have to I’m just in the exact same situation as a freshman who really likes a senior and it’s nothing that I’ve ever felt so idk how to handle ti",1632559698,6,0
Got it. Thanks. I won’t go for it because I like him way too much and I know he doesn’t like me and I know berkeley googles are strong but this shit will hurt so I’m just going to brood from a distance,1632559602,4,0
"As a freshman (18M), I dated another guy well older (22M). Ended up not working out because we were in very different places in our lives and couldn't emotionally or physically accomodate each other.",1632559563,36,0
"started dating towards the end of my senior year of HS, broke up like last year (soph year). uhhh we’re platonic soulmates but i don’t think most people are that lucky. i’d say, if your feelings are strong *and* you’re very mature and patient, go for it!",1632559459,4,0
"Btw I’m a freshman and the guys a senior graduating this year, is that not too different?",1632559448,8,0
Most people objectively arent A students. Telling those who just dont have what it takes to excel in STEM that they can doesnt help them,1632559437,-2,0
Stackoverflow is a good couple counselor,1632559408,15,0
I get adulthood doesn’t matter but as an undergrad r u still not in two different parts of your life?,1632559408,7,0
"This post has been removed because our Automoderator detected it as spam, or your account is too new to post here.

If this post is **not** spam, please contact the moderators for assistance.

Check out the megathread for frequently-asked questions: https://old.reddit.com/r/berkeley/comments/pad3m1/29_welcome_to_campus_for_the_first_time_freshmen/

*I am a bot, and this action was performed automatically. Please [contact the moderators of this subreddit](/message/compose/?to=/r/berkeley) if you have any questions or concerns.*",1632559391,0,0
[removed],1632559391,1,0
Like freshman dating a senior type right? Do you recommend?,1632559368,3,0
Would you say the age difference matters? Did you feel insecure compared to others who were in the same stage of life as your partner at the time? Also did you break up after they graduated since you said for only freshman and sophomore?,1632559335,5,0
lmao 2 year age difference was only relevant in high school. welcome to adulthood,1632559308,101,0
dated someone 3.5 years older than me for a few years then almost dated someone 4 years younger,1632559219,2,0
"i was, during my freshman and sophomore years.",1632559163,10,0
"also like... NOT TO SOUND LIKE AN ANTIVAXXER OR ANTIMASKER! but, at this point in the pandemic, between social distancing, outside activities, n95 masks, testing, and vaccines, whether or not you are immuno-impaired in any way you can prettytyyyy much protect yourself regardless of orher people's actions. no use getting angry, just accept other peoples' actions as what they are and protect yourself if that's what you care about",1632558813,3,0
I think it’s our optometry school kids,1632558798,1,0
"there’s no nursing school 
It’s Berkeley optometry school students",1632558766,2,0
[deleted],1632558635,-1,0
"Oh wow if they are giving you that much time that should work in you favor. I think I only got an hour and grade-scope crashed on me lol. My midterm was nearly identical to my practice midterm in that class. But my final was wayyyyy different that the practice final. You can definitely expect some stuff from the practice so i would master that first, you got this!",1632558615,1,0
"thank you so much for responding, truly this has calmed me a bit. i’m taking it with nikhil srivastavan, he’s a really great lecturer but we were only given two 1 page practice handout exams. i don’t know if that’s the format of the exams, just one page, but i reckon if we have 24 hours to take it it’s gonna be a load of work",1632558457,2,0
"This is super inconsiderate and so wrong. You ARE a STEM A student, don’t listen to what this individual says as they obviously don’t understand.
I’m not chem, but I am sure you will improve!!! School is tough and sometimes it takes a second to adjust!!! You got it :)",1632558446,1,0
thank you I’m actually having a recent Berkeley graduate look over my essays!😁,1632558395,1,0
For Berkeley I think it all comes down to the personal statements. You clearly have the grades but so do a lot of people. Try to connect your passion in school to your personal life and don’t be afraid to get deep and be vulnerable. Also working with someone at the community college level that knows you can be very helpful. My professor/mentor at my CC really helped me figure out what I wanted to say. Goodluck!,1632557925,3,0
