body,created_utc,score,total_awards_received
"Hey DSP user here. From other posts, I've gathered that dsp is just overworked and underfunded rn. It's a shitty situation for everyone. But DSP has been tabling for a while now. They're tabling tomorrow and Friday from 9 to noon at the front door of the DSP office (just go to where the tables are on the left of golden bear cafe). I'd go see them and ask if they can help you out. Immpretty sure they have drop in hours too. Good luck!",1633594259,6,0
"where are the bis at, i can't find them anywhere",1633594156,7,0
"I was diagnosed with ADHD in FA21- pure online school was obviously disastrous. 

I resisted medication every time it was recommended, but it was obviously the right choice. I take my ADHD medication to cure my monkey brain for 4 hours during exams and back-to-back lectures. (maybe 1-2x / week).",1633593938,1,0
Does 186 get hard at some point? I'm in 162 and 186 among others right now and 186 seems way less time consuming than 162.,1633593752,2,0
can you carry me in val pretty please,1633593687,0,0
"61C, 189 and 162 are hard/ time consuming

189 varies by teacher (don't know how much, this is the only class in the list I don't have experience with)

127 is can be hard depending on teacher

So try to take at most 2 of these per semester + 2 non-heavy techs.

I would argue that if you are thinking of doing schedules like these you probably don't need 61c for 161

Maybe ask around what people think about whether doing 61c and 162 concurrently is doable to make this work

Are you absolutely sure you can't do any of these this year?

If you end up doing 2 hard cs classes + 2 non heavy, you are likely not going to have much free time

If you intend to do no extracurriculars, 3+1 may also be doable.

If you aren't going for A's it's easier. U can dm me for more details of my short but kinda relevant experience.",1633593495,1,0
Lol join AFX or if you’re tall and white you can join a frat,1633593284,3,0
Just ask if they are dating anyone if you’re interested,1633593047,-18,0
:( hope someone can find it,1633592894,3,0
Lol dm me for a queer girls group chat I’ll make one,1633592855,1,0
this is such an eecs answer,1633592828,29,0
"**How would you describe the variety in the courses? Is it mostly chem, bio, physics, or anything else?**

  
There's a decent variety of courses, but due to the broad nature of BioE you're probably gonna have to take some courses a little outside of your area of interest. I mostly took classes focused on medical devices (105 - Designing Medical Devices, C106A/B - Robotics, 101 - Biomedical Instrumentation, C165 - Medical Imaging Signals and Systems) and computational    (131 - Intro to Comp Bio, 145 - Machine Learning for BioE, 134 - Genetic Design Automation).

**What careers are you looking forward to/expecting to go into?**

I did EECS as well, so I'll probably be going into software or hardware for biotech (ideally). If you wanna do actual development (research, designing devices, etc.) you will probably need a Masters or PhD. Can't really speak on the other concentrations though. Job prospects are kinda limited if you do JUST BioE but I figure most people in the major want to pursue a graduate degree or are premed anyways.  
  
**Do you actually like bioE? If so what do you like? If not, what do you hate?**

I really enjoyed the BioE department and classes, it's pretty small and close-knit. The courses are interesting and the professors are solid.  
  
**What kind of person would you recommend bioE to?**

Honestly if you are interested in the field then you can't really go wrong, but just know that if you want to go to industry direct after undergrad it could be a bit tough if you pursue only a BioE degree (no other minor/major).",1633592810,1,0
"When in doubt, Squid games can come in clutch",1633592707,19,0
Angyonghaseyo!,1633592512,8,0
"i onboarded this semester and they also didn’t give me a password. luckily, they noticed and emailed me the link to the google meet the day of and was able to verify my info. i suggest you keep emailing them and maybe tell your boss about it. good luck l!",1633592441,2,0
"Come join Berkeley Legends! It's a gaming club for Riot games such as Valorant and LoL. You don't even have to play the games, you can just come chat or watch the streams as well! We also do tournaments for all ranks too! Come check out the discord: https://discord.gg/GDJW6SR2",1633591916,1,0
"Not sure how much this helps, but you could check [https://berkeleytime.com/enrollment/](https://berkeleytime.com/enrollment/) to see how fast these classes filled up in past semesters. Just make sure to check multiple semesters, because there's not always a strict trend.",1633591379,2,0
Why do so many people confuse simply being kind and nice with flirting Jesus fuck,1633591266,88,0
"This post has been removed because our Automoderator detected it as spam, or your account is too new to post here.

If this post is **not** spam, please contact the moderators for assistance.

Check out the megathread for frequently-asked questions: https://old.reddit.com/r/berkeley/comments/pad3m1/29_welcome_to_campus_for_the_first_time_freshmen/

*I am a bot, and this action was performed automatically. Please [contact the moderators of this subreddit](/message/compose/?to=/r/berkeley) if you have any questions or concerns.*",1633590977,1,0
Nothing. This is not wattpad girl,1633590415,270,0
omg tysm!! :)),1633590409,1,0
Assert dominance,1633590343,17,0
Where are the lesbians at,1633590308,16,0
You can’t just post this without a further explanation,1633590209,58,0
Would you be down to make one? I can help,1633590103,4,0
[removed],1633590103,1,0
"Walketh hence and desire i cometh back to full points

***



^(I am a bot and I swapp'd some of thy words with Shakespeare words.)

Commands: `!ShakespeareInsult`, `!fordo`, `!optout`",1633590089,5,0
Walk away and hope I come back to full points,1633590074,3,0
Someone made a hookup sheet not too long ago and it included lgbt,1633589768,5,0
where r all the queer women,1633589752,34,0
"Yeah we totally need this. But I’m not very tech savvy. There’s a lot of CS majors on here though, right?",1633588989,6,0
"I wrote a bit seperately (below), but if you're interested in day-to-day life in my experience in the biomedical device industry, let me know if there are specific questions you have or if you feel I can elaborate more on anything at all.",1633588889,2,0
If you got SHIP Tang is very cheap to use. Doctors appointments are $15 each in copay. If you get a prescription there's usually no copay for your medication as far as you pick it up at Tang pharmacy. You can book an appointment on etang there are usually appointments available same day -- it can be by phone or in person.,1633588704,1,0
Take 61c before 161 and you’re gonna have to either get another semester or take at least 2 over the summer since 4 high intensity techs is hard in the body mind and soul,1633588573,1,0
Grindr,1633588525,3,0
I don’t even like walking there in the day man,1633588056,1,0
cold emailing works the best IMO,1633587998,1,0
I know I am destined to be a serf. But what do you mean why?,1633587778,1,0
F,1633587437,3,0
"Yes, if you only listen to pop/rap radio charts.",1633587393,-9,0
"Sorry if I'm not a bioE person. Full disclosure, I studied Mat sci/eng at Berkeley. I currently work for a biomedical device company (industry) and am currently a biocompatibility expert, not much to do with BioE. However, I have a lot of experience working with BioE people because early in my career I was mostly working doing medical device verification testing and failure analysis. 

The work I did with the BioE people was mostly biomechanical engineering. We make spinal cord stimulators so to give a concrete example, we were verifying that percutaneous leads met the requirments we set for them. 

Think of the leads as conductors that are inserted into the epidural space. We had to come up with theoretical stresses that the lead could be exposed to (think of the sterilization, transport, sitting on a shelf, the patient bending over/twisting around, etc.) how many times it would be exposed to it, and the intensity of that exposure. Then we had to design and build different test jigs to apply those stresses. Finally we performed testing on statistically significant numbers of devices. 

I'm happy to discuss industry and what to expect in terms of work much more in depth if you would like, but I chose this one example just to give an idea of what sort of work was the norm at least in my industry. 

The type of person that would enjoy this are:

\--someone who wants to work with biological systems because it interests them

\-- someone who would want to drift their career to something like a field clinical engineer to have contact with patients and work with patients and/or doctors. You can, with proper motivation and planning, steer your carrer in all sorts of directions. 

\-- someone who eventually wants to design systems/devices. You probably won't get to do this early in your career but design is something that I see a lot of the more senior people do. And I imagine that having your device that you designed implanted into people and helping them must be pretty cool!

The type of person that would NOT enjoy this work are:

\-- people who hate red tape. Medical devices and pharma is SUPER regulated. FDA and other regulatory bodies can be extremely pedantic and everything you do has to be rigorously reviewed and approved. I could tell you horror stories....haha

&amp;#x200B;

Please keep in mind this is my own experience and is not representative of all of the biomed industry. I encourage you to get more stories and anecdotes, and please don't hesitate to ask any questions of me if you have them!",1633587368,1,0
There’s also night safety shuttle buses that run all night until 2:30am and they go from campus (moffit is the first stop) to downtown berkeley to southside. Here’s more info on it: https://nightsafety.berkeley.edu/nightsafety/nightshuttles,1633586855,18,0
"You’ll have a bad time trying to make all those classes fit. If you feel like you like all those classes equally, the first one I’d drop off is CS188 if you are planning to do CS189, followed by picking one between CS162 and CS186; 162 will be higher workload than 186 but also higher value overall especially in the parts they overlap. That should give some more space to move classes while not dying from workload.",1633586780,3,0
[deleted],1633586775,1,0
Head to your nearest red light district?,1633586244,6,0
"post a pic of yourself, then the dms will flood in",1633586226,6,0
There was a study done and found lpeople tended to get As in 61b who got bs in 61a or something like that,1633586215,4,0
Great! Feel free to PM your contact info.,1633586124,1,0
61c alone can kill. Same with 189. Them combined with 2 other techs even if u don’t sleep a single second may be killer,1633586117,5,0
im getting tired of all these nobel prizes. can we start winning national championships instead please?,1633585945,-3,0
Go bears!,1633585679,4,0
Bruuuh no dont,1633585630,3,0
OP should post about how they either never study for 5 technicals but somehow get great grades or how fucked their life will be forever after getting a C on their 61A midterm and then maybe make a missed connections post or two.,1633585580,28,0
"They should be, but I’m not entirely sure.
Worst case find a trustworthy friend who can accompany you for that.
Usually if my friends need I offer to help them with it.",1633585579,10,0
"This post has been removed because our Automoderator detected it as spam, or your account is too new to post here.

If this post is **not** spam, please contact the moderators for assistance.

Check out the megathread for frequently-asked questions: https://old.reddit.com/r/berkeley/comments/pad3m1/29_welcome_to_campus_for_the_first_time_freshmen/

*I am a bot, and this action was performed automatically. Please [contact the moderators of this subreddit](/message/compose/?to=/r/berkeley) if you have any questions or concerns.*",1633585443,1,0
I’m well aware of these social gatherings that people call functions. Only problem is I have no idea how to get invited to one.,1633585081,13,0
"Nah, he won’t get one technically since he’s not a faculty currently at CAL.",1633584743,5,0
"This reminds me of me. 

Sounds doable",1633584645,2,0
oh good idea,1633584374,1,0
"Ask the person at the desk at dsp for the walk-in schedule, they usually have printed copies of it that you can keep. Then just… walk in. Lol.",1633584352,13,0
Go to a party,1633584349,8,0
Why is she your post doc? You are but a serf.,1633584251,10,0
"Don't worry, Berkeley would find a way to ruin this",1633584211,1,0
Maybe try running an android emulator on your pc?,1633583945,1,0
Ah I see that makes sense. Thanks!,1633583679,1,0
bofa deez nuts,1633583230,2,0
You alll need to get a fucking life,1633583170,1,0
I’ve had staff in other departments give me that “that sucks. I can’t do anything but I can email you some documentation that says why I can’t do anything.” Like how in the fuck does that help me? Sometimes this school appalls me at how absolutely uncaring it is towards their students in need whilst also claiming to be all for inclusion and diversity.,1633583160,7,0
You can contact CalNet and they can unlock your ID so you can change it again :),1633582976,2,0
"This post has been removed because our Automoderator detected it as spam, or your account is too new to post here.

If this post is **not** spam, please contact the moderators for assistance.

Check out the megathread for frequently-asked questions: https://old.reddit.com/r/berkeley/comments/pad3m1/29_welcome_to_campus_for_the_first_time_freshmen/

*I am a bot, and this action was performed automatically. Please [contact the moderators of this subreddit](/message/compose/?to=/r/berkeley) if you have any questions or concerns.*",1633582791,1,0
"This post has been removed because our Automoderator detected it as spam, or your account is too new to post here.

If this post is **not** spam, please contact the moderators for assistance.

Check out the megathread for frequently-asked questions: https://old.reddit.com/r/berkeley/comments/pad3m1/29_welcome_to_campus_for_the_first_time_freshmen/

*I am a bot, and this action was performed automatically. Please [contact the moderators of this subreddit](/message/compose/?to=/r/berkeley) if you have any questions or concerns.*",1633582710,1,0
Ah makes sense,1633582617,1,0
Agree,1633582572,0,0
We are deeply sorry for the disturbance. I want to respect the persons right to privacy so I won't share details other than it being a mental health emergency.,1633582270,52,0
Post pics,1633582244,18,0
"Yes, it's similar to the midterm and homework. A lot of the homework questions are re-used in fact.",1638835192,2,0
rake re rome,1638834456,20,0
Tang center.,1638834312,2,0
"You can schedule a 45-minute [Healthy Sexuality Coaching](https://uhs.berkeley.edu/healthcoaching) appointment with our Health Educator Robin Mills, MA, through the [eTang portal](https://uhs.berkeley.edu/access-etang-portal). You can discuss any sexual health concerns questions/concerns and partners are welcome.

You can also talk to a peer education through the [Sexual Health Education Program](https://uhs.berkeley.edu/shep) (SHEP). To meet with a Sexpert and have your questions answered, schedule your Sexpert Education Clinic Appointment via the eTang portal.",1638834304,1,0
OfferUp or Facebook market place,1638833691,1,0
if my grandmother had wheels she would have a bike,1638833497,1,0
When the low grade of 1 or 2 quizzes I was too lazy to study for ended up costing me the A.,1638832964,16,0
"In the sense that it might be bullshit or in the sense that you still have things to learn?

\-Someone who surely knows less about biology than you do",1638832322,2,0
You sound like this guy: https://www.reddit.com/r/GradSchool/comments/ra9p9o/wrote_down_the_wrong_date_in_my_planner_and_went/,1638831319,2,0
Same. I understand the struggles :(. Sprint to the finish line this sem,1638831184,8,0
"It’s mostly MBAs, law, and CED grad students. It’s a great spot though, we end there a lot.",1638830726,4,0
offerup is cool,1638830592,2,0
"I hate to say it but it is your responsibility to, you know, fill out the application in its entirety. Your application will almost certainly be dismissed automatically and not even get reviewed.",1638830548,13,0
"His work on streaming algorithms led to his insane streaming numbers on spotify

A legend",1638830380,10,0
i have an A in the class,1638830077,-5,0
Are you actually a parent with a child? I'd be damn embarrassed if my parent wrote some shit like this on Reddit to a classmate. Act your age man.,1638830071,8,0
^^^ fr bruh u fucked up,1638829942,2,0
Stand on telegraph and start yelling the price you want for it,1638829657,13,0
i just got my application portal today ! i'm guess yours will be within the next few days or so :),1638829627,1,0
Sheesh,1638829613,3,0
Me rn,1638829562,1,0
Damn Prof Nelson looks so different with long hair lol,1638829509,10,0
"Casual way of saying ""Hot chicks, please come through!""",1638828993,2,0
RendRmeRnow,1638828935,46,0
down in the depths where my fellow stack rats dwell is the warmest.,1638828780,11,0
[deleted],1638828632,1,0
What? Lil pump never went to Harvard I thought.,1638828514,4,0
~~cRy~~ relax,1638828393,2,0
"Thanks for all the feedback! There have been a number of confusing situations/policies, since we’ve had to come up with them this semester to handle new situations and are still figuring out the details ourselves. We just made an update re 10.5 and are looking into other pending issues. If there any other remaining points of confusion, please post here or on Ed. I now get every Ed post straight to my inbox.",1638828360,13,0
"Got it, I posted a reply elsewhere, but there was a fairly easy workaround the staff could have used. This may have been our fault for not having it more prominently marketed.",1638828336,1,0
"Interesting... I know this is not your fault but for future reference, Codecov removes that restriction as part of our collaboration with the [GitHub Student Developer Pack](https://about.codecov.io/for/education/).",1638828246,2,0
Can someone clarify OP's msg? Kinda confused,1638828213,9,0
"The issue with Codecov is that for private Repos, the org could only have five users ""Activated"" at any given time. Rather than find a workaround, the staff just said ""nevermind, we won't use Codecov"".",1638828053,2,0
"Alum here that took it in 2018. This course is the closest to software engineering — the problem I had with it was that it was taught as a 2xx course with the assumption that 61A and B are the 1xx course for it.

In reality, it should be a 1xx course with the understanding that this material diverges completely from traditional CS academia. If this course is taught correctly it could be the single most valuable course at Berkeley for preparing students for industry. Instead, it’s a cluster fuck because everyone thinks it should be an easy credit filler, from students to TAs, and no one puts any effort into it, course staff included. I recall my TA didn’t give a shit, and half my team didn’t either.",1638827964,12,0
"when it opens with ""wow, not to make you feel bad but"" 
you already know",1638827964,14,0
Make*,1638827508,1,0
[deleted],1638827486,1,0
A lot of people post things on the UC Berkeley free &amp; for sale on Facebook or Facebook marketplace!,1638827358,5,0
Go bears!,1638826890,2,0
"I took 53 with Sethian in Fall 18. Ended with an A-. Exam was very difficult, but I survived. Lowkey his exam is gonna be hard. But the curve will be generous.",1638826524,4,0
stacks is normally the warmest library just move away from the entrance,1638826242,19,0
"No hw option was great. Exams not too bad, tho still it’s CS70. Probs the least painful professor for it",1638825467,1,0
Goooooo Bears!!!!!!,1638825250,3,0
i don’t remember specifically but everything ended up working out so don’t worry too much about it,1638824473,1,0
could I ask what curve/grading bins sethian used for when you took the course?,1638824182,2,0
oof,1638824107,3,0
Hi can you tell me what happened because I did the same thing and I'm freaking out thanks,1638823959,1,0
"I did the same thing too right now, can u guys please tell me what happened thx",1638823822,1,0
[deleted],1638823769,1,0
it will not be taken seriously - this is just common sense,1638823757,23,0
Main Stacks study rooms tend to be less popular (tho that could change during dead week) so you can try booking those. And they're p nice now that campus kinda fixed wifi.,1638823718,1,0
[deleted],1638823663,2,0
"sucks to hear that :(

hopefully future students will see this post and decide not to take 169, wish I had known what a clusterfuck this class is so I can take something more productive and useful",1638822697,3,0
"If ADHD patients are attempting a task that is poorly motivated, poorly presented, and poorly organized (like all the content in 16B), it will be like slamming your head against a brick wall.",1638822679,5,0
[deleted],1638822624,-2,0
The only thing worse than a Sahai in a Sahai wannabe.,1638822439,4,0
"The curve on the final is generous. There is a clobber on the final too. If you want to just pass, it is doable.",1638822159,7,0
Looks like nothing changed from last semester. SMH I wrote all the feedback in course evaluation for nothing,1638821862,3,0
Keep in mind that your non major classes don't really count towards your graduation GPA. 🤷‍♂️,1638821851,-4,0
"Tom from Codecov here. I'm guessing that this is probably too late, but I'd be happy to help anyone struggling with Codecov. If you make a post in our [community boards](https://community.codecov.io) and tag `CS169A` I'll prioritize it.

Again, it might be too late, but I'd love to be connected with the staff here so that future classes don't run into Codecov setup issues. Would anyone be willing to forward my email to them? tom@codecov.io",1638821804,8,0
I'm guessing their password is something like GoBears2021 or that was the answer to one of the account recovery questions.,1638821688,3,0
L&amp;S25 covers art (tho I’m forever bitter that he changed the rubric last minute and cost me an A),1638821685,1,0
"Is there a common theme among your non-major classes? If so, maybe switch majors?",1638821615,19,0
Me,1638821462,3,0
3-4 hours,1638821351,4,0
"Nice bar, but the crowd is usually insufferable (sorry law/business bros). Decent enough place to stop in when it's empty.",1638820751,6,0
You are the people's champion,1638820687,5,0
Nice name,1638820550,3,0
"If you have both Medi-Cal and UCSHIP, do you still need to pay UCSHIP's co-payments and deductible when you visit UHS facility? Or will they go bill Medi-Cal for it? As I mentioned earlier, I have no co-pays or deductible with Medi-Cal.",1638820517,1,0
"couldn't agree more with everything you said. Glad I am not the only one who feels this way and I really believe you should voice this to the instructors. For example, we don't even know what this final is going to look like and they have made 0 announcements on it.",1638820383,6,0
"you know, i'm an mcb major and none of those words make sense to me",1638819861,21,0
"Definitely, 61C/70/170 are difficult, but staff provide the resources to help you succeed. For projects, the spec is detailed carefully and you know what you need to do, even though you might struggle to achieve it.

In 169A, students are struggling because they're not sure what they need to do. The spec makes no sense, and staff don't provide the resources to help you succeed.

Tbh this class would be easier if we just had to teach ourselves everything. Assign us the final project at the beginning of the semester and have us teach ourselves.",1638819669,7,0
"The craziest part for me is that the content itself isn't altogether that intense. Like it's not like 61C or 170 where the content has a bunch of stuff to remember or a bunch of math theorems to wrap your head around. This is the least theoretical class possible, and the the amount of information it encompasses in one semester is, in my opinion, less than the amount that a course like 61C or 70 or 170 encompasses. And yet, because of how the class is run, it still manages to be difficult, not out of necessity but out of how it is run.

For example, other classes that are difficult (like the ones I already mentioned, 70 170 61c, etc.) are difficult, yes, but really it's because you need to spend more time learning the material. Like I don't get annoyed when I don't understand something in 170 because I know that the class is fair overall, resources exist for help, and even if it might be difficult to understand I could potentially understand in the future. That's how learning works, after all. But in 169 it feels like the class is not difficult because of content, but because of how it is run.",1638819424,11,0
