body,created_utc,score,total_awards_received
"That makes sense - but it's not just Cornell - I've been following a CC thread. Last year a perfect/perfect girl gets into a few schools but ends up picking btw CMU ECE (full pay) vs Stevens Tech (full ride) ... deliberates for a while ... chases prestige goes to CMU. FFwd 7 months - she worked her ASS off, burns herself out barely gets a 3.0 now looking to transfer - asking around if some schools would cut her some slack for her 3.0 ""because it's CMU"".

Is it not similar to what you're describing?  Isn't the same at UChicago, CMU, Columbia. It's probably worse at Michigan and GT where the in-state students are a-priori weaker but have to compete with the OOS beasts?",1639876206,1,0
"I actually attended my first two years on campus before the pandemic started. A number of things. A lot of the bureaucratic policies are incredibly frustrating. Unfairly applied grading and some professors that only care about their research. There is also a lot of entitlement on campus and a large portion of people have no desire to start a relationship with you, not necessarily out of malice but out of concern for themselves. The opposition to any sort of discourse that sways from the Cornell norm. The outrageous cost of not only attending the university but day-to-day life on campus. The lack of mental health services. Many things.",1639876201,1,0
the college experience is more than just classes bestie. and classes don’t dictate ur caliber either,1639876194,1,0
"I agree that people should behave according to their own risk tolerance.

For better or worse most people are social creatures and that have people close to us of various age groups. This virus may not kill me directly, but if I have it, give it to my parents, and they die this would still hurt me immeasurably. Hence, this virus can still hurt me even if not from direct hospitalization and it is absolutely still worthy of being tracked in some capacity.

The point however never goes away that using hospitalizations in the low-age groups (which is also true for covid) is not very meaningful and case counts are a lot more indicative of anything worthwhile. 

At the very least, you are arguing how neither hospitalizations nor case counts would be important for such an age group. But if either would be important, case counts would be the one to use.",1639876159,1,0
i hate the new CORNELL… spaz in the news CORNELL,1639876059,1,0
Yes,1639876042,1,0
This is too good,1639875993,1,0
"Ah, I believe is this where we are going to disagree at a fundamental level. I believe that people should behave according to their own risk tolerance. 

So in this case, the under 50s wouldn’t change their behavior because there is literally zero risk to them. The over 50s would probably take extreme precaution if their death rate was actually 100%.",1639875897,1,0
"I really feel it for the kids who are enduring the 2 years of covid smack in the middle of what was supposed to be 4 best years of their lives. 

In what way was Cornell different from what you expected ex-ante?",1639875827,1,0
"Not saying that I’ll transfer or that transferring is preferable, but if you don’t do too well at cornell mid undergrad, how would you go to another school of the same quality? It’s cornell now or never",1639875781,1,0
Nah just a soph tryna help some people be a little less nervous,1639875768,1,0
"Hello! Do you still need a ride? 

I know an extremely nice lady from Uber that took me one morning at 5 am. I can give her your number if need be. 

If so, please send me a PM.",1639875755,1,0
You’re definitely the kid in class who answers questions directed at the professor.,1639875739,1,0
lol now write a folksy song about him that we can all sing by the canpfire on spooky nights.  i am very high.,1639875724,1,0
"Definitely could have. Was going to at the beginning of junior year, but by then I had already spent so much money to attend Cornell and my career plans were such that it made sense to stay.",1639875671,1,0
"I see, so you are saying that if every person under 50 had it, or if nobody under 50 did, we should not change our behavior at all?

Despite the fact that we would be meeting professors in person if nobody had it? And if we all had our professors would, in this example, almost all die from meeting with us?

Do you not see how, despite having 0 hospitalizations in this group, the counts it has justifiably change our collective behavior? And if it should affect our behavior, then it is absolutely worthy of tracking/quantifying. Hospitalizations in this group, however, would be meaningless.",1639875605,1,0
Of course she has final say over what the culture of Cornell is.,1639875604,1,0
Could you have transferred before?,1639875597,1,0
are you male,1639875527,1,0
"I miss the old CORNELL, straight from the go CORNELL",1639875523,1,0
Nope. I only have one semester left so I’m going to finish here.,1639875506,1,0
Lolz,1639875493,1,0
so you'll transfer?,1639875471,1,0
"Nah, Cornell is Vonnegut and Nabokov. Lovecraft is more Brown. (Just kidding)",1639875469,1,0
Trouble,1639875424,1,0
Whatcha brewing,1639875384,1,0
"Hospitalization. Which would be zero. And if we knew that it would always be zero, then we would stop keeping track of cases all together.",1639875379,1,0
I have been there before,1639875362,1,0
shut the fuck up tammy,1639875340,1,0
I had been but planning on gifting it this year but welp...,1639875322,1,0
"Yes!! This is what happened to me, shows how much of a lag there is between Cayuga running the tests and Cornell notifying people.",1639875265,1,0
"Offering a different perspective: I’ve hated my experience here and know many other people that have as well. Cornell has some good things to offer, but it’s not all it’s cracked up to be. Not saying that people don’t have great experiences here, or that you won’t if you decide to attend, but make sure to put the time into researching the school before you make a decision to matriculate and see if the school truly seems like a good fit for you.",1639875237,1,0
love it.,1639875211,1,0
Noche de Paz,1639875188,1,0
I don't disagree with this at all. I just think that all the sports programs should be given proper commitment and resources by the admin to compete and do well in their respective leagues. The football program clearly hasn't (last season with a winning record was 2005! We were 6-4).,1637789356,1,0
Foopball… barely any feeet involved. Seems legit,1637789229,-1,0
what,1637788738,1,0
Being competitive in the Ivy League will not draw crowds. Only reason Hockey is popular is because they’re competitive nationally.,1637788719,19,0
https://youtu.be/QZf1M1usPkc,1637788700,1,0
"You don't have to shell out outrageous amounts of money to compete in your own league. We're not asking to be Alabama, we just want to be competitive in the Ivy League. The fact that we haven't been in recent decades is a lack of commitment at the university level.",1637788499,1,0
Single digits isn't too cold to exercise outside!! People cross country ski in much colder :),1637788381,1,0
yup I took a cc writing class over the winter and got W credit. there is a transfer equivalence database you can find classes that will be accepted; try searching DUST transfer equivalence,1637788358,1,0
"University of the Greatest Good, abbreviated as UGG.",1637788327,4,0
"Limits? Lynah is rarely packed to the brim. A very small fraction of the student body attends—not because of capacity, but because of how busy they are.",1637788171,-8,0
CORNY College,1637788133,2,0
"The vast majority of students would rather not have Cornell shell out insane amounts of money for football. No amount of reasonable money will fix the lack of talent in the program/the Ivy League, nor will it bring students out given how busy this student body normally is. Hell, I almost never went to a hockey game and now, after graduating, I’m following it religiously. 

This isn’t really an admin problem at all. I know admin bashing is fun but it’s just a cop out reason here.",1637788117,29,0
"Part of what makes Lynah great is also what limits it, the relatively small capacity. Football is the only sport that could host literally the entire student body. Would be really cool if we had that type of experience.",1637787745,13,0
"I've always been embarrassed by the admin's lack of care about the football program. Bringing up passion for football on campus usually gets an eyeroll from students. It's such a shame because sports can bring a student body together to cheer, boo, and experience joy for a common cause unlike anything else. Many of you know what this is like from the hockey games, now think if it was &gt;80% of students all together in Schoelkopf.

We could have that to some extent if the admin really cared about the football program.",1637787592,19,1
"It’s hockey or nothin. 

Seriously though, hockey is 100x better in every respect.",1637786603,32,0
2021 and premeds still failing gen chem… hold that L losers,1637786056,-1,0
2021 and engineers still failing 1920… hold that L losers,1637786030,-11,0
Marthlandia,1637786000,3,0
An Ivy League,1637785713,6,0
[deleted],1637785694,1,0
i will do as i’m told,1637784490,12,0
Hutchinson Community College,1637784144,2,0
"Does Cornell have a new coach this year?

Will watch on ESPN2.",1637783893,1,0
Good Luck.  Hope all works out.,1637783708,1,0
[deleted],1637783424,1,0
[deleted],1637783116,1,0
[deleted],1637782324,1,0
[deleted],1637782184,1,0
You stay away from my man you hear??!,1637781543,9,0
TC3 STAND UP,1637781341,10,0
Ahhhh smol innocent Babey!!!!!!!!,1637780851,5,0
Damn...,1637779644,3,0
Colonel university?,1637779638,6,0
Middle pic is the Sunday afternoon/evening snow or ice storm to snarl return travel to Ithaca,1637779594,5,0
"I think the VPN is to stop your internet provider from sending threatening letters when you stream. That’s never happened to me, and I stream the NFL every week with no VPN.",1637779465,3,0
Better Than Ezra,1637779176,6,0
"“My name is Martha with a bee”
“Where’s the b?”
“Martha 🅱️ollack”",1637778375,21,0
SUNY Enzo’s,1637778294,8,0
Hogwarts,1637778269,3,0
"Murphys Law University, where the motto is ""We just can't get anything right.""",1637777779,7,0
"White University, named for founder A. D. White.",1637777327,20,0
Hogwarts,1637775767,4,0
DON’T SETTLE FOR THAT +5% and NET -15% GRADE DROP PLEASE KEEP FIGHTING,1637775451,5,0
"Alpa Chino : No, I always wanted to. I guess I just never had the courage to ask. It's complicated.

Kirk Lazarus : Nah! It's simple as pie man: you plant your feet on the ground, you look her square in the eyes you say ""Hey! baby, you and me's goin' on a date, that's the end of the story"".


In a scenario where you dont ask, you'll always lose. You'll never get the girl out to the date, and you'll never know the answer. It's like a cost benefit analysis. If you atleast ask, the worst she can say is ""no"". And you know...""no"" isn't that scary. You can always try again, or to the least have the comfort of mind to move on. Good luck buddy!",1637775315,4,0
Harvard,1637775310,4,0
"""Stanford of the East""",1637774893,23,0
"Having had a stint at a large public institution, I actually found it much more difficult than Cornell not in terms of the intensity, but moreso due to the severe lacking of resources. Large state / public institutions are mostly research based, they aren't known for their undergraduate experience as much. Now it also depends which state school you are considering, if it's UMich, Cals, GA Tech etc...those schools are just as rigorous but have less individual resources to spare, so they might actually lower your GPA....if it's like Michigan State of Washington State then yea they will be a breeze.",1637774823,1,0
hey did u ever find out?,1637774730,1,0
A Univeristy in New York you wouldn’t know it,1637774160,13,0
"It’s true. Martha is really just 10,000 bees in a trenchcoat.",1637774029,46,0
Государственное общеобразовательное учреждение средняя школа номер 84,1637773868,10,0
"Cornell, except it’s pronounced Colonel and it’s the highest rank in the military",1637772671,26,0
Dammit you beat me too it,1637772445,6,0
TC3,1637772344,5,0
[deleted],1637772260,1,0
Cornell college,1637772240,5,0
MBA is basically just a circlejerk networking session you pay 200k for,1637772226,5,0
Notre Shame,1637772194,32,0
“University of Cornell” - Lori Greiner on Shark Tank,1637772165,50,0
Finger Lakes School of Massage,1637771840,45,0
I did pretty bad too. I genuinely don't know how did well because this is not the means and medians i expected of this class,1637771624,6,0
Hornell University.,1637771576,10,0
Sameee. Wtaf is this class. Like they cut off points for ridiculous shit.,1637771552,3,0
Hechos,1637770379,6,0
SUNY Collegetown,1637770168,15,0
Tompkins County Community College,1637770050,27,0
Cayuga Community College,1637769928,10,0
ITT Tech.,1637769362,12,0
Balch University,1637768994,8,0
precious,1637768920,5,0
Gorge University,1637768901,9,0
Stanford,1637768329,15,0
Springfield Heights Institute of Technology,1637767050,7,0
Prelim University,1637766984,67,0
"Do not run around Beebee lake when it's icy &amp; snowy on the path. There are parts of Ithaca that are much better plowed to run in the winter. Here are some paths to safely run in the winter: 

* through campus, 
* north on Stewart Ave/Cayuga Heights Road (make sure to take a detour to Sunset park for the beautiful view!), 
* Triphammer Road to Hanshaw and then down Hanshaw
* East Ithaca trail is salted in the winter",1637766922,11,0
Stony Brook University,1637766632,8,0
"Technically speaking, SUNY Ithaca does exist because of the contract colleges :/",1637766578,-44,0
[removed],1637766573,1,0
Scranton U...from the Office,1637766552,16,0
SUNY Ithaca,1637766542,91,0
SUNY Ithaca,1637766316,4,0
Uh…you’ve never heard of it? It’s only the best university around…surely better than those weirdos over at Dartmouth,1637765537,17,0
Ganedago,1637765062,10,0
It’s a cover photo for an online community college,1637765048,77,0
"Go to the dean, bring your notes and prep.",1637764983,5,0
 The Derek Zoolander University for Kids who Can’t Read Good and Want to Learn to Do Other Stuff Good Too,1637764876,73,1
Maizell,1637764858,4,0
I got much lower than I thought I did too,1637764566,2,0
"That was a great season (2009-2010).   They played Syracuse at the Carrier dome very close. About midway through the season they went to #1 ranked Kansas and almost beat them (they were leading with about a minute to play).   After beating Temple and Wisconsin, they were very much still in the game against #2 ranked Kentucky late,

One of the best games that season was the home game vs. Harvard, who at the time was the 2nd best team in the league.  Harvard was led by Jeremy Lim, who had a fairly sensational run in the NBA in his first couple of years.  Cornell beat Harvard by 36 points and Jeremy Lin had a melt down.  It was glorious.

The next couple of seasons went downhill, but at one of the tames I attended I sat next to, then Cornell president, Hunter Rawlings for the entire game and talked quite a bit with him.  He was a big (and very tall) basketball fan.",1637764429,2,0
They said wrong answers only,1637763624,142,0
Ithaca College,1637763474,11,0
"CoachUSA/Shortline now has their bus routes booked through [Megabus](https://us.megabus.com/) and it appears there are still several going to NYC.

OurBus and FlixBus are two other options",1637763311,1,0
"Again, she's not real -- this is just another hologram of AI Marth.",1637763292,2,0
"They also lift up the stairs in the one section around the lake once it gets snowy, so you have to detour on the road to go around that",1637763033,3,0
"I had to do this last year. I contacted the course administrator for the course I wanted who then gave me approval (If the course you want is full, you need to ask the Professor and the course administrator to make sure they can increase the class enrollment size). For me, I only had to email the course administrator. She filled out the form, gave department approval, and submitted it to the registrar. The registrar then added it to my schedule during add/drop. If I were you, I would email your course administrator as soon as possible to see what steps you should take. Good luck!",1637762866,1,0
It was only valid for 25 hours.  Perhaps that expired.  There are plenty of $30 tickets available in the 100 sections.  Those same seats are $150 for a rangers game.  The Red hot hockey and Frozen Apple games are a relatively inexpensive way to see a good hockey game at MSG.,1637762699,1,0
Hogwarts,1637762489,37,0
Pimento University,1637762482,5,0
This is not an actual University. It is an AI simulation engineered by Martha.,1637762216,85,0
Would you consider DOGE instead,1636743582,21,0
Well thats new 😅 i had her last year and it was a hellish experience. Im sure it was bc everything was online but she was NOT accomodating and it was just a really awful experience. Im glad she's better in person!,1636743345,17,0
"2800 is one of the best courses here, y’all are missing out",1636743065,1,0
Yes it’s happening!! Planning is in the works,1636742711,19,0
"&gt; only 1-5% of all covid cases resulted in hospitalization, the risk to the general public has been quite low since the beginning, the CDC mortality page i keep linking has been the same one since before vaccines.

1/100 to 1/20 odds of getting hospitalized for getting the disease (haven't even double checked this, working directly off your cited stat) sounds pretty awful personally. Especially considering lower-income people who could have more trouble affording the costs (especially in the good ol' USA). But I suppose you don't have to worry about this yourself given your stance on the matter, and are not concerned with other people's health as you also mention.

&gt; i dont outsource my health to people that wear lab coats or a piece of fabric.

...so you're opposed to modern medicine as a whole? That was developed using laboratory science, performed by people in hospitals who have always wore masks. Do you refuse to go to the hospital/doctor, never use any mass-produced medicine, etc.?",1636742692,5,0
"I wouldn’t worry. I don’t remember what I say in my discussion sections, let alone what other people say.",1636742648,12,0
shut up nerd,1636742159,5,0
I’m still listening…,1636742129,7,0
Knew something was off.,1636742085,18,0
Homie whatd you say 🥺,1636741845,42,0
🔫 pew! pew! Consider yourself cyber attacked my good sir.,1636741614,6,0
Yea I meant the history of their people alongside the colonization that came along during history!,1636741429,0,0
What's your favorite book?,1636741274,21,0
Well baked loaf 🍞,1636741263,3,0
Just wanted to say he is very cute.,1636741238,4,0
"I don't just mean specifically colonization.  The Cayuga people have a history that is not just composed of colonization.  They existed and were interesting people well before europeans got here, and their history does not only exist relative to europeans.",1636741233,1,0
*obvious plant*,1636741103,2,0
I just do v well on the homework’s and understand everything that’s happening but then I mess up really badly on the prelims 😞 And I don’t know how to fix it tbh,1636741030,2,0
What’s your favorite TV show?,1636740928,29,0
Don’t worry we are Cornell if the bullets don’t get you crippling depression will,1636740462,5,0
The AP chemistry exam does if u get a 5,1636740310,9,0
[deleted],1636740211,11,0
"I'll second Uncle Joe's. They have enough TVs that they'll pretty much always be able to put on any game anyone comes in wanting to watch. Can't hurt to call ahead to confirm they get the channel any given game is on, if it's an odd one.",1636740209,5,0
"Eyyy what’s up me neither, absolutely nothing.",1636740198,5,0
thank you for the reassurance!! Update as of today: turns out it counts :),1636739831,1,0
"Don’t do it at cornell, there are places to do it for a lower price (any SUNY for example).",1636739523,1,0
[deleted],1636739487,1,0
[deleted],1636739195,1,0
You could just not comment,1636739154,2,0
That shit was rough,1636739153,1,0
Me too man. I hope we make it through,1636739128,1,0
"&gt;REALLY bad

&gt;50%

You’ll be fine, chief.",1636739120,8,0
Predictability,1636739058,1,0
😂😂😂,1636738974,3,0
thank you so much!!!,1636738939,1,0
UPenn has BIG slytherin vibes.,1636738911,1,0
If you’re in A&amp;S career services is hosting an event next Tuesday and Friday afternoons. It’s posted on Handshake and you have to reserve a time on there and register ahead of time,1636738904,8,0
"I took 1101 with Schalekamp FA17. He's a great lecturer and explainer. Highly highly recommend the class, especially with Schalekamp.",1636738851,2,0
What the cluck,1636738733,1,0
"Omg. Def not a loser! I’m sure you’re a smart, friendly, delightful human being. Dm me! We can be friends!",1636738373,3,0
[removed],1636738153,1,0
[deleted],1636738135,-5,0
Uncle Joe’s is pretty good for sports but I don’t know if they do soccer,1636738121,6,0
Just sent you a message!,1636738073,1,0
The rollercoaster of emotions for ECON 1110 has been insane,1636737835,9,0
Just as a note freshman can’t live off campus now. But if ur not a freshman I recommend looking on Craigslist and perchn seems to have a lot of items. If you go the Craigslist route make sure to tour the apartments so u won’t get screwed over,1636737696,2,0
"Mini would work but also a regular iPad could work. Pros are overkill unless you are really into art. Honestly anything that works with an Apple Pencil is a good iPad, if you want to save money go with the older models if you can find them",1636737585,28,0
"No shame in having to drop a class, especially freshmen year",1636737244,2,0
"Ithacarenting is pretty good, collegetown is a nice location because its closest to your classes and its collegetown",1636737021,1,0
"I failed 3/4 classes freshman year, AMA",1636736912,4,0
"Not quite sure I understand your question. PhD students who teach get a tuition waiver + stipend defined by that link. Stipend is taxable, so take home is definitely less. Depending on package offered with acceptance, this might cover a few or all semesters. Departments allot funds for a set number of TAships, which they fill in advance with already-committed grad funding packages. Extra funding and demand for TAs usually goes towards more senior ABD students who are trying to buy a little extra time.",1636736879,2,0
C’est la vie,1636736779,1,0
"Sad that Cornell can’t provide consistent opportunities. I don’t think clubs should let everyone in but they gotta do something about students being in charge of the exclusivity. You shouldn’t be barred from an activity just because the club leaders like you less than others and they don’t have enough resources. students shouldn’t have to start their own clubs for engagement, they should be able to, but they shouldn’t have to.",1636736649,1,0
I got a 50 on the first prelim too though 😔 I might have to drop that class depends on the actual grade though.,1636736648,2,0
"To anyone also curious, I’ve heard kilpatricks might be good?",1636736591,3,0
I am the burnt toast,1636736511,4,0
"Oh hey even if it is 80 percent, a 50 percent on one prelim really won’t destroy your grade. I’ve been in the same place before, so I know how it feels. All will work out!",1636736479,1,0
"2800 is pretty doable if you put in the work (read: if you ride the curve, you'll probably make it out pretty easily with B- or higher). 4820 on the other hand, is actual pain because nothing makes sense even after spending 20 hours on the psets.",1636736333,2,0
This cracked me up lol,1636736117,3,0
The mean is prolly gonna be around 80 for both… 😔,1636735941,1,0
"Let's see...account made last night....

Hi Dr. Thomas!",1636735854,31,0
Nope,1636735738,1,0
ooh I’m excitedd,1636735516,1,0
Would gladly adopt this poor guy. Sent you a DM,1636735469,21,2
"You need Kirby's book for his class (if you looking into a book for his class) it has the year's oral exam questions in it. It's also not expensive, he sells it for the price it costs to print it out. If you arent taking his class, but are just looking for a book, I would say its pretty good but just specifically tailored to the curriculum and structure of his class. Its a good intro fluids book tho",1636735427,2,0
I don’t know the details of your internship but when I got an internship offer they wanted me to get mine done at Quest Diagnostics Cortland but I told them it was too far so they accepted my WellNow Urgent Care drug test. It’s worth asking especially if it’s a third party that is in charge of the screening stuff.,1636735412,6,0
[deleted],1636735387,-2,0
"Am from Michigan, Detroit is actually the entire board",1636735306,6,0
I went and asked for an extension like this THREE days after it was due and he gave me a whole week because I told him I was losing it and the homework wasn’t helping at all. He was super understanding. You probably won’t get a whole week but asking never hurts and they usually copy and paste that into the syllabus as a fear factor thing rather than a super strict policy.,1636735211,1,0
"Nicotine is an appetite suppressant, so is caffeine.",1636735064,2,0
"Look at courses in the Plant Sciences Major, Plant Sciences Minor, Plant concentration in Biology, Horticulture Minor, Landscape architecture, Plant breeding minor",1636735010,6,0
"Your sample itself would have been run more than once, though.",1636734892,16,0
When i tested positive in august i did not get a second test,1636734801,6,0
Best be explicit about what the penalty is for losing,1636733739,5,0
