body,created_utc,score,total_awards_received
"FYI, somebody commented about making 6 figs and feeling poor in nyc. Literally the problem. It’s gentrification in its most extreme example, so many junior workers pumping out 2k+ for a studio apartment. Ultimately, New Yorkers are most at fault for that,  I don’t know how anybody can live there and not recognize the extreme absurdity of fresh grads and finance workers pulling in so much money.",1634610054,9,0
Imposter spotted!,1634609998,6,0
She is recruiting you to her MLM,1634609788,6,0
Keep in mind COL in NYC is a lot higher. I just graduated and make 6 figs in nyc and god damn do i feel poor,1634609767,-7,0
Keep in mind COL in NYC is a lot higher. I just graduated and make 6 figs in nyc and god damn do i feel poor,1634609760,-9,0
This is actually one of the funniest threads,1634609740,11,0
[deleted],1634609694,1,0
you will be fine! especially since you’re taking a taxi,1634609514,1,0
📠,1634609306,1,0
Im fucked.,1634609179,2,0
"Have you seen the salaries of the President, Provost, and CFO, for starters? Then factor in the ever-mushrooming cohort of middle- and lower-level management? It's absolutely mind-boggling!",1634609123,5,0
"*insert your name here* College of Arts and Sciences 


Bidding starts at 50 million.",1634609073,7,0
[removed],1634609043,1,0
Me,1634608982,1,0
I took GOVT 1111 last fall.  Make sure to review the readings for the class.,1634608955,1,0
Glad I’m taking ECON 3130 instead...😳,1634608880,2,0
BEST TEAMMMMM!!!!,1634608734,7,0
Last year we didn’t have a midterm,1634608618,2,0
One every week until the end of the semester I guess,1634607889,2,0
That median....,1634607726,10,0
Ok I’m glad I’m not the only one that is completely lost on doing these questions and feel like we haven’t covered the majority of this information in the depth that the study questions ask…,1634606786,2,0
"Selling a Rolling Loud GA 3 day pass! DM if interested, I'll provide proof of purchase and ship same day. Selling below face value",1634606715,1,0
Sorry to hear that! I’ve decided to drop. Can’t let my depression keep going. I really hope you find a solution. Good luck pal!!,1634606670,2,0
$10,1634606437,1,0
I love hockey!!,1634606405,2,0
How much are tix?,1634606388,1,0
[bigredtix.com](https://bigredtix.com),1634606187,1,0
"FWIW, City drinking water is taken from Potter's Falls Dam, directly upstream from Second Dam. Main campus water is from Fall Creek.",1634606186,2,0
Where? How?? Ty,1634606155,1,0
^^,1634606146,1,0
they go on sale tm morning at 10am,1634606112,4,0
what project teams have open spots for next semester in their business sub team?,1635697634,2,0
What are the debt financing options available ?,1635696590,1,0
"I…. Want you to knowwwww
I’m a dyson ball
I’ll show you every version
of yourself tonight",1635696575,4,0
"Join CU GeoData! We’re pretty new and are working on a bunch of new projects for this school year, you can apply next semester.",1635696518,3,0
"nothing that I know of, which maybe is a good sign. no news about anything really so hopefully it wasn't anything too major.",1635695235,8,0
Thanks fam ! Means alot 😁,1635695212,1,0
"maybe so, that's what I'm assuming anyway. I can't really tell the difference between the sound of a firecracker VS other loud pop-explosion-y sounds",1635695173,2,0
"You will be considered as long as you submitted your CSS. If you didn’t, they will assume you don’t need aid. There isn’t a specific question in the app asking about it. Hope this helps!",1635695058,2,0
Restock on Monday. Opens back up on Tuesday from 4-7pm.,1635694538,5,0
Bonus: you get to be a bigger fish in a smaller pond,1635693597,23,0
Because they’re rich?,1635693196,5,0
Oh hell naw,1635691360,3,0
Any updates?,1635691137,13,0
I’d get sriracha 😋,1635690836,1,0
NOOO I MISSED IT😭😭😭😭,1635690254,2,0
"For the record, the parents feel like they have to act happy too.",1635689577,2,0
"Yeah, I don’t think you transfer in the typical way, you have to be admitted into the program. I’ve also heard of maybe one case of an undergrad transfer, they’re quite rare. 

Reach out to AAP student services, they can give more info on applying/transferring, degree tracking, etc.",1635687672,1,0
what a flip,1635687348,7,0
"The hardest of the undergraduate probability courses (except maybe CS 4850) 

Also the hardest to get into.",1635687014,1,0
I believe Monday or Tuesday,1635686890,1,0
Sounds like it could’ve been a firecracker accident?,1635685654,5,0
I heard it from ivy ridge.,1635684281,3,0
I could never see them doing that.,1635684178,1,0
Hmmm… I heard CU sustainable design is new and trying to launch soon. They’re also recruiting in the spring and have a marketing team if that’s what you’re looking for. https://cusd.cornell.edu/#mobileMenu,1635683851,1,0
"They cost something on the order of $200 per season, definitely cheaper than buying single game tickets but not a huge amount. Yes you can buy two, I always had a friend buy mine for me so I could get section B",1635683091,2,0
Can u get lazybones?,1635681407,1,0
"It is possible but pretty uncommon, I would get in touch with student services in AAP asap",1635678604,1,0
"Was it a single gunshot like sound? Damn, hope everyone's cool.",1635677072,7,0
Try swappa,1635673709,1,0
"Cornell-in-Rome is just one of several study abroad programs in Rome; pre-COVID there were programs through API or CEA and maybe others. Unfortunately, it seems like those are still on hold except for [ICCS](https://experience.cornell.edu/opportunities/iccs-rome), so probably best to talk to the [Education Abroad](https://abroad.globallearning.cornell.edu/) office.",1635666217,4,0
"I admit I did not take enough initiative with situation though. I was talking with my academic advisor about planning my schedule and which classes I would take abroad, but I never thought of going back to the study abroad program to make sure it still existed. I then realized that the departments probably don't talk much to each other.

If you go to graduate school you might still have a chance to study abroad, but chances are you might just end up visiting the country on your own. But I'm pretty sure its not the same and it's a real shame that we missed out on study abroad. But maybe we just need to learn to take the L and move on, and maybe take initiative to do something to make up for it in the future.",1635665177,7,0
"They teach the parts useful to a CS student at a level CS students understand, and the parts interesting to a math student at a level only math students understand. I enjoyed. It's a tense, but functional compromise.",1635664865,3,0
"you can take stsci 4740 or cs 4780 and get credit for the stat elective. there were a few revisions made to the requirements this semester and there’s a new req pdf floating around w these changes(like NLP being included too).

you just need to take at least one stsci/btry class for these two electives, but can get credit ow w other classes too.",1635664274,1,0
Found Saturday 10/30 before noon in the lthaca City Hall parking lot by the construction fence. They were wet from the rain but they appear to still work. DM me the serial number and will get them back to you.,1635662512,1,0
[removed],1635662438,1,0
"seems like this kind of situation happened to a lot of people. I'm sorry you had to miss out on the opportunity too, I know how much it sucks :(",1635662093,10,0
No doubt you’re crying tears of joy after solving each pset,1635661737,6,0
"i heard it too, hopefully all is good",1635661519,16,0
"The study abroad program that was one of the main motivators for me to transfer to Cornell apparently got cancelled a year before I found out, and I only knew since my friend who wanted to do that same program went to check in and found out. 

The whole time I was just waiting for the website to update for the new school year and to me there didn't seem like reason to suspect that it was cancelled. But then COVID hit so in the end it would not have mattered anyways.",1635660836,37,0
"not a business major but want to be on a business team so hi

do you know which teams are launching projects or products next semester",1635660750,6,0
https://itservicealerts.hosting.cornell.edu/view/6478,1635660534,3,0
"Of all the 4000 level math classes at Cornell, 4710 is probably the least difficult.",1635660210,4,0
same - I really hope whatever happened everyone's ok,1635659160,27,0
I just heard like 3 ambulances heading towards north,1635659100,29,0
"No idea. I live near the front of north campus, on thurston ave. My window is open and I heard it from a ways away. I can't pinpoint where it came from though.",1635657925,39,0
Where was this?,1635657860,29,0
I think what they meant is keep a lottery/random system for dorms but if you put someone in a shit dorm they have to pay less. That way you don’t have someone in Donlon paying the same 10k for the dorm that’s relatively crappy compared to Ganendago,1635657581,1,0
"Went to Libe Slope around midnight, no luck.",1635657474,6,0
Tell them to connect to the wifi on their phones and play minecraft pocket edition with you,1635657104,7,0
"I didn’t see that option on my app either, and I’ve seen other people saying the same thing. My guess is that aid depends on css stuff.",1635656827,2,0
"You generally just have to write a statement as to why you want to drop the course, and the circumstances surrounding it. I don’t think that they are often accepted, however, but it can’t hurt. Also, you can withdraw from the course if worst comes to worst. A “W” on your transcript really isn’t that big of a deal.",1635656718,3,0
thanks,1635656579,3,0
[deleted],1635656516,11,0
"**IMPORTANT** 

why do I not see the ""Do you wish to pursue need based financial aid"" on my Cornell University's commonapp.

I already submitted the CSS profile and now I'm unable to find the button I'm supposed to tick to be eligible for aid.

Please respond ASAP. thanks alott",1635656129,1,0
What are the repercussions if you drop after the deadline? Just wondering.,1635653738,1,0
Is it actually 5mins or do you mean the Fontana laundromat,1635652411,-1,0
Something I was able to do in my undergrad that might be worth looking in to:  If there is another university that offers online winter courses you might be able to take them online and get credits (transfer credits).  You would have to talk to an advisor about it asap though.,1635652354,2,0
[deleted],1635650994,1,0
Then you’re chillin,1635649781,9,0
Can someone please provide me with some feedback for my CAS supplementals essay? I'm applying through economics (ED).,1635649103,1,0
"Can anyone share their experience with the interview? Im applying to COE and ik interviews are only mandatory for art and architecture, but a friend told me that a relative of his in my area has interviewed engineering applicants in the past. Thanks! :)",1635649003,1,0
"This is the 1000th comment in this post lol

Just submitted ED but it would be nice if anyone with a history in InfoSci could give any insight on my profile - but more interested in how much my question at the end matters in comparison to this quick version of my profile

Demographics: Hispanic Asian Male, Upper Middle Class

Target: Applying ED to CALS for Information Science

Academics: 107.24/\~110 Weighted, 97.04/100 Unweighted, SAT 1570/790M/780V (CALS is Score-Free rip)

Activities: MIT Artificial Intelligence Summer Program, DECA President, Math Society Co-President + Math Team Captain, Founding Member of Hackathon Team, Morgan Stanley Finance Program, A Bunch of Competitive Music Things w/ Leadership, 100+ Hrs Community Service Volunteering

Awards: DECA International and State Awards, Regional Hackathon Third Place Team Thing, National Merit Semifinalist, National Hispanic Recognition

Other: Can't really rate essays and letters of recommendation, but I definitely feel like they all connected together under a few themes. Got a supplemental rec from my MIT Instructor, CALS essay talked about my interdisciplinary experiences leading up to choosing Information Science w/ the second half discussing my own fit in Cornell/CALS/InfoSci

My actual question is how much do quarter one senior grades matter? I'm assuming my school will send them for the ED round but I have an 82 in Calc BC atm. All my other class grades are just as good as in previous years, and my core math class grades have always been on the lower end (90-95). Will they be more understanding from a combination of it only being the scope of a single quarter + calculus sucking? (Sadly no excuse from an extenuating circumstance since I just happened to bomb 2 out of the 3 of our tests so far lmao)",1635648199,1,0
Cornell Healths pharmacy has a lot of stuff like that for a good price!,1635647764,2,0
"I haven't yet, I'm guessing there's too much cloud cover.",1635647721,5,0
So cute~!,1635646727,3,0
[deleted],1635646524,1,0
[deleted],1635645814,1,0
/S,1635644759,6,0
has anyone seen it yet?,1635643431,6,0
[deleted],1635643379,1,0
Why not both? You get two sauce packets per entree,1635643297,3,0
"Oh boy, I’m enrolling in that next semester! I can’t wait to take it now :)",1635643268,12,0
"MGFC Yard Show was this afternoon, which has dance performances by the MGFC fraternities and sororities (i.e. historically black or culturally-oriented), and there was sort of an after party for a couple hours afterwards.",1635642976,13,0
"Stop the planet, I want to get off.",1635642897,8,0
I used to own a mini washer that plugged into my normal outlet and drained into my sink.. that’s the way.,1635642056,10,0
"Half of us flossed and half of us did orange justice, since we had an odd number the odd one out did default dance. 

Ah, 2018.",1635640409,19,0
"but which fortnite dance

this is important",1635640020,7,0
The package must be protected!,1635639368,3,0
glowing recommendation!! I’ll add it to my schedule,1635637780,28,1
"In freshman year when I was in that edgy, large friend group phase, we would gather on the sidewalk and do a fortnite dance right  at the tour groups while maintaining eye contact. Those were the days.",1635637719,39,0
Lolz,1635637637,8,0
I can feel the sarcasm,1635637279,18,0
"No mother, its just the northern lights.",1635636971,5,0
I hope the cones spare me,1635636593,2,0
Seymour! The house is on fire!,1635636563,2,0
you can also grab some from the 7/11 in collegetown -- they have a variety of toothbrushes there,1635636321,2,0
Diff apt. That’ll get old so fast.,1635636131,14,0
IM CRYING I MISSED HIM..,1635635622,6,0
LMAOOOOOO,1635635596,9,0
No,1635634647,6,0
I’m already doing an internship with a dietitian,1635634564,10,0
Can I see it?,1635633646,5,0
Thanks.,1635632824,2,0
yes and I feel like I have to act happier than I am when I walk past,1635632171,29,0
"In that case, you're probably better off trying to arrange some sort of internship with a dietitian.  CCE Tompkins may have some opportunities in that vein.",1635631785,11,0
4.10 4.14 4.23 4.34 4.40 4.42,1635631725,9,0
Yes,1635631610,4,0
Thanks. Wonder if I should ask the professor.,1635631401,1,0
Yes if the apartment is significantly cheaper.,1635630798,5,0
Big Red Community College,1638835113,36,0
"RIP, Tara ...",1638835064,48,0
"same but I'm also in a bunch of large classes/weeders atm and I don't really learn in those environments so I'm quite literally shelling out $xx,xxx to teach myself

it's not the worst thing in the world difficulty-wise. it's just that everything takes so much time. 

unironically would be okay with dropping out if anything on the side works out",1638834832,11,0
"This is so sad. Clocktower, play despacito.",1638834786,14,0
"you are funny I like this. &lt;3, a big red barn cow",1638834633,5,0
Ezra’s Elitist enclave,1638834572,18,0
Rest in peace,1638834458,89,0
"Mine, sadly, are not. Release the bear and lie down with your wings behind your back.",1638834339,1,0
There are different flavors of seagulls. Mine are very honorable.,1638834209,1,0
The discount is 1 BRB.,1638834172,8,0
Yes  !,1638834106,3,0
Ok lol but resistors are honestly like pieces of loose leaf paper very easily replaceable,1638834079,13,0
"Genuinely curious what you expect as a reaction to this post. A pat on the back..??? Bro, students use reddit not professors. Complaining about how easy Cornell classes are to people who have no control over the difficulty of course material just seems pointless and needlessly provocative.",1638834074,2,0
Cope,1638833946,-4,0
"the one last night was in the microwave for minutes, someone either was trying to cause a fire or at least a fire alarm",1638833902,3,0
smart kid hah?,1638833897,1,0
"There is no honor among seagulls. I should know, for I am a seagull.",1638833851,3,0
Shut up,1638833760,6,0
Bold or you to assume I’m not a seagull.,1638833756,1,0
bro ur so cool,1638833647,6,0
Yeah the only meal that I had yesterday was some cereal and papa so I'm pretty sure papa johns is the culprit. Ithacan eateries seriously need a health check.,1638833616,2,0
Avoid the Enzo's suite of dining establishments,1638833546,1,0
The seagulls from the Best Buy parking lot have surrounded your house. You might want to release him.,1638833532,4,0
"Hope it's not too late. All Ithaca students pay Cornell’s student health fee ($210/semester) regardless of what health insurance they have. 

Visit for preventive care (including asymptomatic sexually transmitted infection \[STI\] screenings)  is covered by the student health fee at NO cost.",1638833530,2,0
Yeah bro I got diarrhea this morning. It was pretty bad. I didn’t eat anything spicy or something yesterday so I blame Papa John.,1638833425,3,0
Alright whew,1638833345,1,0
Oh shit you too??? I also ordered it last night. Damn sry to hear that bro. Hope u get better. I got some serious abdominal cramps and dry sweats. Crossed papa off my list for good 😂,1638833294,3,0
Yeap I heard it's standard Cornellian initiation.,1638833179,6,0
I also ordered pizza from papa last night and I got food poisoning this morning:-/,1638833125,9,0
So you have already had the Enzo's treatment 💀,1638833111,1,0
"Haha, I've been dodging that place ever since freshman year. That place gave me some wicked poisoning as well. I think Ithacan eateries really have some serious hygiene problems cuz the 4 times Ive gotten food poisoning in my life all occurred during Cornell - one from Cornell dining, one from the chinese eatery at the mall, one from Enzos, and one now from papa johns. I should really start cooking my own meals but I get so busy during finals that I normally just order quick eats.",1638833041,13,0
4 chicken nugget university,1638832878,38,0
Here I was thinking this had to Enzo's related 🤢,1638832790,6,0
White University,1638832674,-5,0
"Papa johns
I think the dough was undercooked in hindsight, but I was too hungry to notice it atm.
Kept me awake all night",1638832558,9,0
[deleted],1638832453,10,0
[deleted],1638832440,1,0
"I dropped it for literally ten seconds MAX, things don’t become public property as soon as they hit the floor",1638832410,-9,0
"No, the Skits are part of me.",1638832219,5,0
That depends. Are you an alum?,1638832160,5,0
Cayuga University,1638831348,72,0
Ithaca Institute of Technology,1638831235,101,0
I’ve gotten mixed reviews that’s why I’m asking.  People said it was easy while some said it was hard with a low workload.,1638831174,1,0
Harvard,1638831121,76,0
Cayuga Lake Technical Institute,1638831108,15,0
"Next time, give it back by doing this directly over the Okenshields stir fry",1638831048,3,0
We will not tolerate such outbursts against our beloved bingalee-dingalee.,1638830977,21,0
Another great look for the Company Store model of local retail options,1638830893,2,0
A,1638830880,1,0
Not at this event,1638830757,-1,0
"Thank u guys, I guess I’ll stick to the spring one then",1638830315,1,0
"This was not a troll, I literally found a missing resistor in rhodes. No resistors left behind.",1638829961,14,0
Ezra University,1638829913,41,0
"Moderna booster, had aches and pains for like 2/3 days….so I definitely would recommend delaying til after exam",1638829913,2,0
Idk if this is a troll or not lol,1638829869,9,0
Wee Stinky University of course,1638829847,29,0
Cornhell,1638829751,62,0
Are you part of The Skits?,1638829683,2,0
Do I get an alum discount,1638829436,3,0
"If so, you better hope they don’t see this.",1638829392,8,0
"ok but if most of us are forced to get the unlimited meal plans (‘25s and people in west campus halls) i feel like we should be able to eat enough without having to get up 2 or more times

don’t come for me if you think i’m wrong i just don’t feel the unlimited in the unlimited meal plan i was forced to get",1638829319,1,0
Now this is funny,1638829251,3,0
Cornot University,1638829090,35,0
"There’s one that lives under the porch at AD White House! Probably the same one. A lovely custodial staff member has fed him every morning for years. To the best of my knowledge, she recently retired — and still comes back to check on him ❤️",1638828687,12,0
High school student applying to Cornell over here! Please message me if you are majoring in sociology. I have a lot of questions to ask,1638828448,1,0
How many ended up on trays to be washed?,1638828298,4,0
Do humans wearing collars count as dogs?,1638828284,2,0
[deleted],1638828223,17,0
"Take it in Spring.  Lillian Lee is great.  The assignments are different, but the material is almost identical (we diverge in last week).",1638828149,9,0
I think you have to unfortunately,1638828078,6,0
"Wait… does Cornell not have the midnight scream the night before finals anymore? It was definitely a thing in my time, and I’m not even 10 years out. When did it stop?",1638827382,5,0
[deleted],1638827102,1,0
[deleted],1638827075,1,0
[deleted],1638826961,1,0
CS 1110 in the spring is one of my favorite classes at Cornell with Prof Lee and Prof Fan,1638826605,5,0
"Tbh, there aren't that many places. That's why my entire wardrobe consisted of Cornell branded shirts, shorts, socks, and sweaters...because the Cornell store was the most accessible location.",1638826535,3,0
[deleted],1638826410,0,0
"Did it have a collar or something? I believe there was a cat that lived around there that was grey colored, and I haven’t been on campus for a while (covid+graduated).",1638826290,4,0
Another great look for CHEM,1638826069,3,0
Tonight's the night.,1638825851,6,0
No,1638825516,-18,0
"I’m in it right now! If you’re one of those people who pays attention during lectures you will easily get an a! even if you don’t you can probably get an a as he gives you the options of what will be on the exam and chooses a few! there’s also a group work option on the exam that can only improve your grade. the final project is as easy as you make it (song, art, poem, twitter thread) and the readings have quizzes that you can ctrl f through or google probably. there’s also discussion boards every class but you can really put any question somewhat relevant and you’ll be fine! overall the professor is great and it shouldn’t be hard at all!",1638825495,5,0
"you’d need an appointment, i think you’d need to set it up by calling the clinic (number and address r on google)",1638825420,1,0
Martha AND Ryan,1638825383,12,0
ithaca free clinic! downtown on seneca street,1638825373,1,0
Cope,1638825350,21,0
"Partially to myself not working hard enough when I first got here, partially to how ridiculous the weed out chem classes can be, and overkill for someone who isn't going premed track in my major. Though actually I take back my original comment, I think my previous semester I was also happy with, just wasn't happy with covid circumstances. I took a year off so my previous sem was spring 2020.",1638824992,3,0
"We will hold onto it until you return. If it’s something perishable or important, call and let us know to forward it!",1638824252,11,0
Is Martha included?,1638824078,9,0
Gotcha!,1638823091,1,0
"Ourbus also has busses straight to the airport, fyi",1638822966,1,0
Good way to get downloaded into minitab,1638822683,7,0
Good way to get expelled.,1638822392,-7,0
"Apparently they have one day for senior photos in spring. It might be more, but that’s what I’ve heard. Either way they’re tryna get as many ppl as possible tl take them this semester🤷🏻‍♀️",1638822264,1,0
"In my experience neither one was particularly more challenging than the intro level courses, but I guess it depends on who's teaching.  3316 was one of my favorite classes I took Cornell so I would recommend it even if you aren't going for the minor but are still interested in physics.",1638822257,1,0
" How do you know it’s a mongoose and not a marten, or fisher for example?",1638821995,8,0
*Chimes,1638821953,23,0
"From what my very poor eyesight can see,
Brown, black, black, grey or silver, red.",1638821378,2,0
Not sure if you were in class but it can be more than a page!! Good luck!,1638821350,1,0
[removed],1638821256,1,0
I bet that Hotelie who’s the daughter of Marriott CEO is in one,1640926685,1,0
"I’ve thought about this before, but if I’m not social enough to get into a club, I’m hecka not social enough to start one haha",1640926670,1,0
Haha it is.,1640926442,1,0
At 2:40 in the morning,1640926317,1,0
"all staff except police and facilities emergency staff are off Dec. 24-Jan. 3rd. this means /u/MEGAYEL is posting in his/her personal time, gang, so show some respect.",1640926165,1,0
The Big Redjected club hahaha…..sorry,1640926136,1,0
then u make another club for everyone who got rejected from the club that everyone got rejected from went,1640926090,1,0
