body,created_utc,score,total_awards_received
"Right, enough is too much. This beloved artefact is now a cursêd įtem to the bearer until it is returned properly. Touchdown the Big Red Bear has been commissioned to aid in its recovery. 
With love,
~Alice",1632534238,27,0
U gon get caught lackin if u ain’t got the heater,1632534168,-2,0
"I might be interested, will get back to you shortly",1632532620,1,0
Green is the new yellow,1632532456,3,0
"wait, you asked them to explain why they think a type of policy works and they gave an example of it allegedly working. what possible response could they have given that would be less delusional? at least argue your position in good faith. and I'm sure if they started listing off all the countries in the world with higher standards of living and rates of satisfaction that have deployed leftist policies you'd give another canned response",1632531129,4,0
Lol,1632530976,1,0
wdym by social leftism?,1632530944,1,0
"Heeyy, I'm a prospective applicant wanting to talk to any Cornellian who's up for it :) I mostly want to know what the vibe in Arts &amp; Sciences (and Cornell overall) is. I've heard not many mental health resources are available and that the workload is so heavy many have a really hard time while at Cornell. Is this so?",1632530796,1,0
thank you,1632529148,2,0
And it’s caffeine,1633605628,1,0
Yes! Thank you! You are so correct!,1633605014,2,0
All trips will be surveilled and punished! - The Administration,1633604565,9,0
"Hi! 

**I’m currently at UNC-CH (OOS)**

Chance me for ILR spring transfer!

 I’m currently a sophomore (on my 3rd semester) and I’m applying to transfer for next semester for Cornell ILR My high school GPA: 3.1W 2.7UW (don’t ask me how I got in I still don’t know) (I had ADHD and lots of different ailments and lived in an abusive household) 

**College GPA:** 3.75 (One B+ and One W, I got a W because my laptop broke and I couldn’t submit my final and my teacher didn’t give me an extension retaking the class right now with a better teacher and I have an A right now)

I have all As rn which includes a class at Duke

**Extracurriculars include**

 Labor movement student organization leader 

Amnesty Intl Organization secretary for my school 

Donor research intern for the NC Democratic Party

 I was the executive director for a TEDx event 

Social media manager and code of conduct board for amnesty youth (outside of school) 

Teen ambassador for the attorney general of my home state 

Borgen project Human Resources intern 

Writer for school paper and more! 

LOR 1: 10/10
LOR 2: 8/10

I’m a rohingya refugee and I was born in a UNHCR camp and my common app is about using my privilege to create a platform for people like me throughout the world rather than solving the issue we must hear. I want to study specifically in ILR because both of my parents used to work in sweatshops and I have family members who survived the Rana plaza incident in Bangladesh. I want to help an create safer environment for my people back home in Bangladesh",1633604560,2,0
"Yes, it do be like that for the STEM gang",1633604412,10,0
The Mann lost and found is at the circ desk….,1633604403,1,0
"It doesn't look white, so be on the lookout tomorrow...",1633603426,3,0
Don't compare your inside knowledge of yourself to what you see other people presenting on the outside. There are plenty of people who feel the same way that you do.,1633597786,3,0
Jeopardy!,1633596155,2,0
"Respect.  Always a B’s girl, but when I was as far south as Kinston, it’s either the Chef &amp; Farmer or Parker’s for me.

The closest I’ve come to proper BBQ up north has been BT’s smokehouse in Sturbridge, MA.  

While it’s quite good, it is very much… different.  They understand the proper ideas about the meat and sauce, though.",1633595983,1,0
Nothing,1633592467,3,0
Thanks for the info :),1633590862,6,0
[deleted],1633590685,-4,0
"Slightly unrelated, I know they don’t curve for prelims in this class (only at the end) but is it the mean or the median which rly matters? Cuz the median was higher than the mean by a few points.",1633589918,1,0
"yes, if u happen to be in dickson put 21 sisson place as the address and pick it up in the loading dock. idk ab details for other dorms but i assume it’s basically the same besides address",1633589667,7,0
Is this math 2940? The median was a 74 right? Did the prof. say it’s curved to a B+?,1633589524,1,0
Take it next sem if you’re worried about the grade but if you know the content and like it knowing it now will be helpful for when you apply for internships,1633589196,1,0
"100%, at least notify the ombudsman and maybe whatever department head oversaw that class anyways just to make sure he can't come back. Is he a visiting professor as in he's a professor from another school? Cuz if so I'd maybe try to contact them too. Obviously it sucks that the victim is the one that has to go through all this work, so go as far as won't be stressful for you, but if you can get other classmates to work with you or heck some of us on here then maybe it won't be so exhausting. But hopefully reaching out to the ombudsman won't be terrible. Maybe talk to a trusted faculty member to make sure you're getting the process right, or if you're in a dorm an RHD might be able to help you",1633586936,5,0
"TAKE AN EXTRA SEMESTER/YEAR

YOU WILL STILL GET FINANCIAL AID

YOU CAN ALSO GET SCHOLARSHIPS TO TAKE A CLASS OVER THE WINTER/SUMMER FROM CORNELL IF YOU ARE ALREADY GETTING FIN AID

DO NOT BE AFRAID TO TAKE A LEAVE OF ABSENCE, I KNOW SEVERAL PEOPLE AT CORNELL WHO HAVE DONE THIS AND IT WAS VERY GOOD FOR THEM",1633586494,2,0
What is Cornell ESTB? And second floor of statler hall or hotel?,1633586274,2,0
Down. Pm me,1633586228,3,0
"I would imagine protest art being obstructive is kinda the point. I mean I don't need to tell you that compared to genocide and being consistenly removed from your home that some logs slightly blocking 1 of the paths on the slope is not that big a deal in comparison. 

From the website (in reference to land flooded by Kinzua dam):

""The path you are walking on now belongs to the Cornell community; however I will be taking away your access to it. It symbolizes how the native land still belongs to the Seneca Nation but is inaccessible to them because the government chose to flood it even though there was an alternative solution. The installation is a commentary on land ownership and what accessibility means to one’s land.""

But they definitely needed a better sign bc i also wouldn't have known about it's meaning if not for reddit",1633586101,15,0
"Yeah, just provide your dorm address and pick it up at your dorm's entrance",1633585922,11,0
Average Jerma fan spotted,1633585711,18,0
I was gonna say my only thought about the logs was it would be inaccessible for differently abled ppl and then I was like wait this is the slope lol we're well past that,1633585571,3,0
mm maybe the squirt bottle since we're more in a sudowoodo situation,1633585449,5,0
"the email I got from one of my interviews:

What should I wear? Dress however you feel most comfortable! How you dress will not be factored into our decision.

but every team is different so idk for sure",1633585299,2,0
"might be a visitor to campus in which case you probably should have brought it to the actual lost and found, hopefully mann sends it there eventually but theyll probably just get a new one",1633585203,1,0
i think if it's curved to B+ that means a std dev below is C+.,1633585070,1,0
"yes saw them in olin lib today, i appreciate ppl's service dogs bc they give the rest of us serotonin too",1633584886,3,0
[deleted],1633584874,1,0
Let’s do it. CTB tomorrow,1633583307,2,0
Like 3 hours,1633583167,1,0
"I met the friends I still keep in touch with my sophomore and junior years in undergrad.  Don't sweat not ""belonging"" when you have only been here a few months.  It's easy to look like you have it all figured out from the outside, but lots of times friendships will morph over time as you meet more people.",1633583150,1,0
"Yes, you have it bad and should talk to someone. 

I've also suffered from social anxiety and specifically some of the self-consciousness you mention. What helped me get over it was, one day I noticed something odd about this guy I'd known for a while, it was something weird with his hairstyle. It made me realize, how did I never notice this before? Then I realized, shit, if I didn't notice that then people definitely aren't paying as close attention to me as I've always feared. That moment of realization has stuck with me for 10+ years now and helped me get over some of my anxiety.

The only other thing that will help you is practice. The more you shut yourself away, the more awkward you'll become. Power through the awkwardness for a few years and work on your social skills by talking to people. Easier said than done, but like any exercise or skill-building, you'll be happy that you started today a month from now.",1633582833,12,0
My anxiety meds changed my life for the better. Please look into getting a diagnosis and a prescription. You won’t regret it.,1633581633,2,0
My anxiety meds changed my life for the better. Please look into getting a diagnosis and a prescription. You won’t regret it.,1633581624,7,0
"I didn’t read any of that, but I agree with you",1633581581,25,0
There is more to life then grades. 2 years after graduation no not is going to look/ask for your grades. Grades matter if you want to go ms/phd and may be for getting internship in FANG. So just chill and go your best and enjoy time in Cornell,1633581354,5,0
Lucky. Hopefully more of us will be in your shoes next year.,1633581209,1,0
[deleted],1633581190,0,0
"not OP, but I am also looking for a ride, please let me know if you are still willing",1633580994,1,0
"I’m a transfer from last year who went this year if that counts? I didn’t go last year/not even sure it was a thing last year, but this was my first year going to Apple fest and I’m still a transfer at heart lmao this feels like my first year.",1633580944,1,0
"Yes it is clear from what you’ve said that this is impacting your daily life in negative ways. Each person deserves the opportunity to be social and enjoy their lives, and it’s not a waste of anyone’s time nor is it too trivial for you to be able to have that opportunity. Just so you know your aren’t wasting any TAs or Professors time if you are struggling, if they dont want to help that’s on them, but you deserve their attention and I’ve found TAs to be willing to help! Best of luck!",1633580610,4,0
This is true the screams and farts were mine all made and edited by me,1633580401,8,0
taking a class s/u counts towards the credit requirement as long as you pass it (which in this case is get a S),1633580160,4,0
"It is true — proper grounds-keeping means to encourage natural growth that compliments the artifice of humankind, whatever may be erected. 

Send your thoughts onwards to those charged with upkeep!

Love,

Alice",1633580030,5,0
"It’s an Ithaca City garage, but you have a good heart, dearie. 

Cheers and love,

~Alice",1633579861,1,0
"get help! my therapist forces me to do stuff because i wouldn’t otherwise, and i find it super beneficial even tho i am comfortable leaving my room",1633579741,9,0
"You do us all proud. Well done and good luck!

With love,

Alice",1633579682,2,0
"What a shmuck. 

Love,

Alice",1633579624,4,0
"It took a long time for me to find my place here. The greatest struggle was the daily routine — the conscious practice to get out of my own “box” — and seek out time and space with new people. Some of those became my best friends. 

It is hard to be bold. Boldness is not just braving Okies’ stir fry or walking from North to West down the dark paths at 3am on Saturday — it is being open and honest and eager to get to know someone new.

You can do this.  

With love, 

~Alice",1633579568,4,0
"Indian Creek Farm! I just went there last week and they had ripe apples, asian pears, and bell peppers. I believe they also had pumpkins as well!",1633579529,1,0
"What a tosser. 

Good on you. 

Love,

Alice",1633579289,2,0
What’s a “prelim season”? I’m in ILR,1633579241,14,0
Cornell burning our finaid,1633579241,9,0
"He who helps others is based, despite their eccentricity. Mostly. 

Take this as a good omen, and help the next person you encounter samewise. 

Do take care of your eardrums, though.

Love,

Alice",1633579135,35,0
We out here playing temple run 😭😭,1633579084,2,0
Definitely not trivial or laughable. I don't really have an answer but I really hope you're able to get the help you need fam &lt;3,1633579081,12,0
"This is definitely something worth getting into regular counseling for. It can decrease overtime WITH effort and such efforts can be proposed or thought of during your counseling sessions. 



No shame in it. you did a good thing just talking about it here so you know you want to make a change and I bet you would be willing to take charge to reduce your social anxiety through counseling or otherwise.",1633578855,26,0
same bro,1633578767,1,0
"1. is there anything people can do to support you rn?
2. if you don't mind me asking, is this one of the inclusive leadership classes (like the ID ones?) I'm thinking of taking of those classes 7w2 but if this was your experience... yeah I'm out. 
3. if you are comfortable, talk to an advisor, department chair, or instructor you trust. they can definitely help with next steps
4. fuck that guy. idk you but I am quite sure you are not boring and boring or not nobody deserves to be treated this way, ever.",1633578558,4,0
Trying to get to Albany and would love to join!,1633578544,1,0
same :(,1633578229,2,0
thank you!!,1633577371,2,0
is that normal? i had five prelims these two weeks before break but none after,1633577272,21,0
[removed],1633576661,-2,0
You can also study in semi-public places like Duffield hall or physical sciences building or your dorm lounge,1633576632,3,0
Your barber,1633576542,1,0
Thanks a lot! Do you mind if I PM you? I have a couple of questions.,1633576371,1,0
[deleted],1633575343,1,0
"I’m a sophomore and I haven’t found a group either. I have a lot of individual friends and clubs, though, so my social life still exists, it’s just very different from the tight-knit group I had in high school",1633575270,11,0
Hey my group is looking for one last person to sign a 6 person lease for collegetown plaza hopefully before the end of fall break. Let me know if you are interested,1633575022,1,0
Hey my group is looking for one last person to sign a 6 person lease for collegetown ASAP. Let me know if you are interested,1633574998,1,0
Join a cultural club if you can!,1633573682,2,0
okay guy,1633573006,3,0
"Kinston, believe it or not. So Kings (which is not as good as it used to be) and Parker’s.",1633572932,2,0
"Kinston, believe it or not. So Kings (which is not as good as it used to be) and Parker’s.",1633572914,3,0
[deleted],1633572898,1,0
[deleted],1633572891,1,0
His name is Brutus and he is the bestest student! Always in search of pets and snacks but always finds his mom and no need to worry if he seems unmonitored,1633572885,1,0
[deleted],1633572860,1,0
[deleted],1633572789,1,0
yeah and then the cs dept had the audacity to ask for TA evals for the class 🤡,1633572771,5,0
Yeah we have a bunch of TAs but no way to contact them or go to OH lol. At least as far as I'm aware,1633572402,6,0
"My team asks people to dress casually. I think in general this is fine, but it couldn’t hurt to wear a casual button down.",1633572378,4,0
"This ^^


I feel like people underestimate the ability to bounce back and grow from failure.",1633572354,5,0
(I think the owner was a few paces behind),1633572343,6,0
[deleted],1633572288,1,0
[deleted],1633572268,1,0
In front of Bailey hall today! Tiny white chihuahua just vibin off leash—but I’ve seen a couple other chihuahuas on campus too this semester!,1633572234,10,0
"If you get one standard deviation above the mean on another prelim/final in the class it’ll balance out. I’ve been on both sides of the equation here- below 1SD on the first prelim and above on the second, or above 1SD on the first and below on the second. Your performance on one prelim doesn’t define your performance on the next one, for better or for worse. Just something to keep in mind.",1633571698,14,0
[deleted],1633571686,1,0
[deleted],1633571358,1,0
[deleted],1633571231,1,0
It's a psych test to see if students self-actualize and do something themselves or kvetch and hit like or dislike,1633571229,1,0
"What the fuck did you just fucking say about me, you little bitch? I’ll have you know I graduated top of my class in the Navy Seals, and I’ve been involved in numerous secret raids on Al-Quaeda, and I have over 300 confirmed kills.

I am trained in gorilla warfare and I’m the top sniper in the entire US armed forces. You are nothing to me but just another target. I will wipe you the fuck out with precision the likes of which has never been seen before on this Earth, mark my fucking words.

You think you can get away with saying that shit to me over the Internet? Think again, fucker. As we speak I am contacting my secret network of spies across the USA and your IP is being traced right now so you better prepare for the storm, maggot. The storm that wipes out the pathetic little thing you call your life. You’re fucking dead, kid. I can be anywhere, anytime, and I can kill you in over seven hundred ways, and that’s just with my bare hands.

Not only am I extensively trained in unarmed combat, but I have access to the entire arsenal of the United States Marine Corps and I will use it to its full extent to wipe your miserable ass off the face of the continent, you little shit. If only you could have known what unholy retribution your little “clever” comment was about to bring down upon you, maybe you would have held your fucking tongue.

But you couldn’t, you didn’t, and now you’re paying the price, you goddamn idiot. I will shit fury all over you and you will drown in it.

You’re fucking dead, kiddo.",1633571225,38,0
[deleted],1633571124,1,0
It's a pysch test to see if students self-actualize and do something themselves or kvetch and hit like or dislike,1633571102,2,0
Puta,1634651346,12,0
Then where are the water bottle fill ups??,1634651047,3,0
ECON/INFO 2040,1634650074,1,0
"my teas gone cold I'm wondering why, I got out of bed at all",1634649445,3,0
"International students, did you have to take an english proficiency test? Even if your school was an english speaking school and you got a 700+ score in SAT EBRW?",1634647363,0,0
Better networking,1634646671,1,0
Another great look for sustainability,1634646651,-2,0
"Isnt the whole point of standard deviations that it’s a normal distribution, so there will be the same number of people scoring 1 SD above as 1 SD bellow, or is this raw scores not curved?",1634646535,5,0
[deleted],1634646087,1,0
Damn supply chain issues again,1634645573,2,0
Which networks?,1634645520,2,0
Cornell is certainly not taking it easy on me,1634645502,12,0
"It should be fine, just stay with other people &amp; try not to get into a situation where you're alone. I think it's wise to just take a taxi to JFK at that hour.",1634644402,1,0
Give 100. Get your class grade + halfway to 100. More profit,1634644233,3,0
"Giving 100 is super reasonable here. Unless the professor intentionally makes the deviation low or the average is below 50 (in which case you should know intuitively to give yourself a 90 or something), you’ll never get 3sd with 100",1634643881,2,0
"In fact, the world shows us you'll be most rich *without* a college degree.",1634643320,-5,0
use this https://scl.cornell.edu/residential-life/dining/eateries-menus,1634643215,5,0
Washer 6 was hungry,1634642482,5,0
"Canvas asks ""you up?""",1634642416,21,0
Wojack levels of pain.,1634642272,5,0
How did you get this picture of me,1634642097,20,0
suffering even,1634641477,5,0
I went there right after my appointment I just had to wait for 10 min or so,1634640085,1,0
How to say I love you in Spanish,1634639985,2,0
The only reason they care about international students or alumni: money. This is Cornell this is America.,1634639845,2,0
had a similar experience- 1:06 AM “Assignment 3 has been posted”,1634639374,8,0
We only care about AirPods in this school,1634639292,1,0
Not until November,1634639173,3,0
Amber alert 🚨 Cornell alert 🚨,1634639102,6,0
STI?,1634639067,7,0
Looks like depression,1634637832,6,0
You can be rich without a college degree.,1634637595,3,0
(More than a feeling),1634628390,1,0
"why are we here, just to suffer",1634625997,8,0
me in every building on campus,1634625365,2,0
you can still change to pass/fail until the drop deadline which i think is thursday. google cornell key academic dates,1634625340,3,0
"to be honest, id say every building has random unnecessary lights left on every night (very sustainable cornell), so I don't know that I'd find that one weird in of itself, but then maybe that's part of the plan",1634625307,10,0
"Yes, once",1634625271,1,0
Chin up king. Sooner or later the nightmare ends.,1634624663,31,0
Do you just spend every single day shopping in soho and fine dining?,1634624097,-3,0
Large mood,1634623228,10,0
this school’s a fucking scam,1634622255,2,0
"got rejected from all the project teams i applied to freshman year (wo even any interviews), and ended up making one for my sophomore year. don’t lose hope.",1634621918,3,0
"If you usually use N sheets of toilet paper with A ply, and the new toilet paper is B ply, just use NA/B sheets of toilet paper",1634621888,6,0
"Staff is now sitting here wondering why we only got a *partial* repayment of the money that was taken out of our paychecks last year. And why we haven't retroactively received the yearly raise that was withheld from us last year either, even though most of us worked harder than we ever have to keep things running. And we have to use the same toilet paper!

Many upper admins are seriously giving us the ""just be glad you weren't laid off"" speech.",1634620696,6,0
We know the correct choice is in your heart...,1634620482,4,0
"I think I actually saw a hoop earing today but I can't recall the exact location. It wasn't tiny though, maybe about 3 in. in diameter. It was left on some concrete bench I think. Try looking by the agriculture quad or maybe somewhere by Ho plaza?",1634619411,2,0
No,1634618478,4,0
"I Do not think that was the intent tho.  And the prelim was \*rather easy and conceptual\*. Also the workload for this course is not that large. 

THe intent is that if you have conceptual misunderstandings, you will be able to see what they were ... and the prof can, to some extent, see that you critically looked at your mistakes and hopefully learned from them.

Also the class is like 20 undergrads and 40 grad students. The focus is learning, there is no gaming the system intended and I doubt people will try to

Kinda weird if u ask me. I think the stdev things were added on to make sure people didn't abuse it and make it seem weirder, but idk im open minded to instructors trying new things",1634618179,1,0
"word.

confused with what u said, but word",1634618104,7,0
"You can get ""rich"" (depends on what you mean) without being all that special. Not sure what that says about cornell/elite universities/certain industries but it is what it is.",1634617717,5,0
"These dining hall menus be looking like 5-star restaurant menus, and they serve food as good as 1800's England diner. Thirst trap. that's what it is... fucking thirst traps",1634617432,5,0
"Smh. project teams are so fkn overrated. Get over it. I am in a few and it's absolute bullshit. I would rather advice focusing on internships, leetcode and personal projects",1634617365,-7,0
I didn't finish either. Never expected time to be the issue for a prelim--it's usually difficulty.,1634617290,3,0
"yes, cornell health has a 24/7 nurse consultation service, you can call them at 607-255-5155. during business hours their front desk staff will answer and you can ask to speak to a nurse! more info here: https://health.cornell.edu/get-care/247-phone-consultation",1634615418,8,0
[deleted],1634615325,1,0
is everyone in this class a genius I didn’t even finish the exam bruh,1634614514,5,0
Pm me for price,1634614117,1,0
Sounds like they’re about to make Cornell Better than Ezra.  🥁🥁🐍,1634613613,5,0
"This fucking class, have you been doing well?",1634612345,4,0
What’s the wrong answer,1634612083,1,0
"Are quarter 1 grades required for Cornell early decision? I'm applying to CoE, and will, at best, end with a B in multivariable calculus. I spoke to my counselor and she said my school typically doesn't send Q1 transcripts unless schools ask -- would it be possible to withhold Q1 grades, and if so, would it be looked down upon?",1634611769,1,0
Gotta go to Harvard if you want that $50bn two-ply jawn,1634611727,3,0
This actually gets me every time. Their fried rice used to be amazing,1634611579,4,0
There should be a lost and found in the front right corner of G01.,1634611318,2,0
have good examples of key points on hand,1634610471,1,0
"A bus from here to Penn Station??  Sure it's not Port Authority, which is about 8-10 blocks up from Penn Station?

Make sure you have set travel plans before you leave, so as other have suggested, you can move around the city efficiently and confidently. Know where you're going and how you're getting there, so not to look like a bumbling out-of-towner.",1634610459,2,0
Honka honka,1634610279,1,0
