body,created_utc,score,total_awards_received
"try some white noise like a fan, if that doesn’t work maybe politely ask them to keep quiet after a certain hour.",1631514040,48,0
I’m away from my dorm right now and I’m dreading the walk back 😀,1631513487,5,0
Thunderstorms are great,1631513415,3,0
"If we’re talking about Intro Python, I finished every single programming assignment well over the median time and still got an A in the class. Kinda sucks for a time management POV but if you like the class I think you’ll be okay",1631513391,11,0
thought that was my suitemate snoring whoops,1631513258,4,0
Obsessed with how we go from loud ass helicopters one night to loud ass thunderstorms the next,1631513038,6,0
I find storms somewhat relaxing but my dog absolutely hates them. May need to invest in a thunder shirt if it will be this bad,1631512971,7,0
That is not ideal,1631512813,8,0
its gonna be 80+ this week 🤮,1631512744,29,0
people usually make really bad underestimates about their hours worked,1631512684,14,0
"For what its worth — I get seasonal depression and upping vit D really helps. I always lower my dose during the summer, and then sometime during October I tend to get depressed which reminds me to increase my vitamin D, and within a week or so feel improved. Your depression is more serious and I’m glad you’re getting additional help, but since the doc put you on D, I just wanted to share my experience to encourage you to see if it helps a little.",1631512591,5,0
"I wouldn't exactly call it polite. I had to push him pretty hard just for the $5. I condensed it in the post, but I went back and forth with him about the ""credit"" shit for at least a few minutes before he offered any amount of refund",1631512518,1,0
"It’s funny because that’s actually something I like about Cornell. The classes with hundreds of people in them are super smooth with a huge faculty and a colossal array of classmates to get help from and ask about due dates.

Plus, with a significant percentage of the student body being in the class, there’s a smaller chance you get dicked by an unfair professor who makes up an unreasonable grading scheme.",1631511810,19,0
"Franco’s and Ned’s are definitely the best around as many others have said. Pronto seems to do a pretty decent job as well, but I’ve only been once",1631511643,7,0
Take into account that some kids have been coding for years and years before freshman year,1631511458,25,0
"I have relatives who've taken it who've warned me of the same things. Also, yes I mean I've regularly been meeting with my therapist for a while now. I'm worried about starting antidepressants during the school year though... my schedule is packed and I'm not sure how it'll pan out.",1631511401,1,0
You guys are useless and just annoying.,1631511149,0,0
People have always been so disrespectful in packing up beforehand,1631510997,2,0
Which is strange given their hardline that students should be in person this semester. They seem too worried about outside people bringing the covids.,1631510886,5,0
"Yea you can get meds from a regular doctor but it’s not really standard. If your therapist thinks you should be on a pretty standard depression med (lexapro, Zoloft) you can go to the standard doctor and get it prescribed, but I also want you to know that when you get this medicine your life won’t change for the better soon (takes weeks to see the effects) Depression meds seldom work well without some sort of consistent therapy. Don’t think the medicine will change your life. You have to put some work on your end which comes with finding a therapist and changing how you approach your life. Also you may have some p gnarly side effects (mainly drowsiness IMO) so just consider those things. Also here’s the link to some more Cornell health info

https://health.cornell.edu/services/mental-health-care",1631510868,4,0
"And she was studying AI before it was cool! But for real, they seemed like they were done being covid pussies this year and then this happened.",1631510801,1,0
This is actually a crazy take. How do you think polio was eradicated in the United States? Was the mass vaccination campaign just some government hoax??,1631510630,3,0
Wow! Thanks for letting me know. So if I get in touch with caps they can help me get a psychiatrist? That's actually a bit annoying because I told the nurse that I was looking to get medication for depression and they gave me the appointment with the pa rather than telling me to go to caps.,1631510595,5,0
"I heard about that, but I dunno if that means the IRC days are still here... haha",1631510522,2,0
"Figure out quickly if your talents actually don't align with your major and make the right choice. Cornell accepts a variety of people with different talents for different reasons. The good thing though if you believe you were accepted partially for non-academic reasons (e.g. to balance gender ratios), that same process will likely be applied in the future so be sure to account for that. Not everything is imposter syndrome.",1631510452,7,0
"that is just how Cornell health is. They have always been extremely short staffed. I’ll let you know what you can do tho! General Cornell health and the mental health counselors are different. Go see an actual counselor (you can look online) called CAPS. If you are on Cornell’s insurance you will have to be referred out, but depending on how severe ur illness is, you will be referred to a new therapist or you can continue seeing caps. The appointment length to see a psychiatrist is always lengthy though. So depending on Cornell’s system u may get the psychiatrist appointment p late. But just for reference next time (and I know you obvi wouldn’t know this and that it’s a stressful time being suicidal and you may have been overwhelmed) but the general doctor/PA doesn’t prescribe antidepressants, they usually leave that to a psychiatrist",1631510227,13,0
warning: does not accept BRBs,1631510145,5,0
"Dude there are only 3 men in Ithaca, period. Basic logic suggests that it is indeed the same 3 men.",1631510114,18,0
"&gt; If it wasn’t then it wouldn’t be the fastest growing business communication platform.


You talk like a slack shill lmao

Discord does everything slack does except better, and free :) Too bad it's for ~gamers~ so it's not professional enough. Shame

Also obligatory fuck slackbot",1631509994,-3,0
It is legitimately sketchy some nights now. It wasn't always that way. The people who hang out there don't seem like students to me.,1631509905,4,0
"Intentional networking, knowing what internships to get before the big boy ones, knowing what sites to use and how to leverage your identity. Stuff like that helped me get superdays with like GS, CS, and some MF PE/Large AM firms like Blackrock. I'm a bit of a scatterbrain tho so getting superdays has become easy but getting the offer has been a bit tougher. I'll write a post about it eventually for the freshman once I'm done with consulting recruiting probably.",1631509562,4,0
Thiccc,1631509387,4,0
care to elaborate about what being “smart about it “ is,1631508971,1,0
[deleted],1631508911,1,0
[deleted],1631508872,1,0
hell yeah go big red,1631508723,1,0
this is 2110 right? i’m literally the same :(,1631508593,12,0
There's so many on and near the slope too. I do not understand how people sit there in the evenings. Maybe they just prefer me as a snack... sad times.,1631508554,1,0
At least the mosquitos will all be dead soon,1631508491,15,0
"Had one that loved our porch in fall creek. We loved sitting out there but if the skunk showed up, that was inside for the night.",1631508389,4,0
I have such mixed feelings about Enzo's. I want to support a locally owned shop especially in Collegetown where so many places have shut down in recent years. And it's always empty which is both sad and makes me think it could close at any time. But the service and quality of food are... not great. It's trying to be a lot at once and not doing a very good job at any of it. I've moved on to other Collegetown restaurants.,1631508374,4,0
"My input of living here in Ithaca for 5 years. Order from Casablanca from DoorDash, they are the best priced and most authentic New York style pizzas in Ithaca that I've tried. And I've never had issues with DoorDash, they give you an entire refund if something was wrong. 

Also, yeah NEVER fucking order from Enzo's/Mama Teresa's Pizza, I have gotten food poisoning from there. The reason it has two names is because the owner is typically vulgar and rude and angry to people who get the wrong order, which he does constantly as a way to cut costs; a lot of Cornell students do not like confrontation let alone being able to handle a phone call. So he changed the name to revive the reputation on review sites.

I have no idea why it has any positive reviews anywhere. The fact that he was polite to you lets me know that he knew you were a pushover, no offense. He was happy to scam you.",1631508281,9,0
You can be the Drunk Doctor,1631507776,4,0
Then why don’t I have a sexy ass boyfriend already 😐,1631507676,7,0
Pm me your number and I’ll add you that way haha,1631507563,1,0
Wouldn’t worry too much. If you have some minimum experience in public speaking/debating you’ll be fine.,1631507555,1,0
[deleted],1631507314,-6,0
"Just get Franco’s, Aroma, or Neds and you’ll be fine",1631507295,11,0
How tf you gonna find other gay people if you don’t seek it out,1631507233,6,0
It was a problem they had too before delivery and DoorDash were a big deal. And they have no repeat customers,1631507225,12,0
[deleted],1631507191,-4,0
If you’re straight maybe,1631507097,9,0
"Textbook was not very good, would just get 6th edition and ask Blake which problems correspond. Material is the same anyway",1631507067,1,0
"So, if Cornell was an unhappy place for you and you transferred out, why are you commenting on the Cornell community and even taking interest?",1631507058,-16,0
"It’s too bad you think everyone is artificial and not genuine and you feel alone and a misfit. You claim to have no friends but state your friends don’t care about your cribbing.  Seek help, it’s not all gloom and doom it’s how you perceive it. There is a light at the end of the tunnel, you just need to open your eyes and see the radiance of sunshine.",1631506859,-7,0
[deleted],1631506320,0,0
"Apparently by running multiple pizzerias out of the same kitchen, and not actually giving customers soda",1631506286,15,0
"No actually I just make poor financial decisions when I'm hungry. Only a few extra bucks anyways. I don't drink coffee like many people, so it cancels out",1631506199,12,0
"That one did not work either, I wonder why. Maybe it’s something wrong on my end?",1631505979,1,0
"this might seem random but you should try and find a hobby. For me it was rock climbing. Super nice people always at the wall here, exercise is great for the mind. Might seem insignificant in text here but i promise it could change everything for you mentally",1631505833,9,0
"I know a few people have mentioned Franco's and I just wanted to add to that recommendation! I don't know if they deliver, but I have tried pretty much every pizza place in Ithaca and it is by far the best.",1631505731,14,0
"Just sign the waiver, enter your name, and click join on the link I sent you. Then you should be added to an email list and they should explain how their club will function. Feel free to email [mgl49@cornell.edu](mailto:mgl49@cornell.edu) as well as he seems to be listed as the main contact on their website.",1631505560,1,0
"No school ranked above Cornell is even close in size, so it's not like expansion is significant.",1631505455,7,0
"Best university with over 10,000 undergrads. Some reasons US News is dumb: Things like faculty compensation don't account for different costs of living. Average SAT score ignores that some schools give more weight to a portfolio and/or interview like Art, Hotel. Average cost ignores the state schools that are cheaper for in-state students. Some classes are fine with over 50 students, and then smaller sessions with TAs. If smaller universities only have room for 40, is that really significant?",1631505341,1,0
Do you know how to join it,1631505206,1,0
Thompson and Bleecker is pretty good,1631505197,4,0
[Yes.](https://cornell.campusgroups.com/BoxingClub/club_signup),1631505133,3,0
"I am assuming this is not my class, but 2x median is normal. These stats have high variability.",1631504749,118,0
"https://groupme.com/join_group/70887255/oH2DGQ0U 
What about this one?",1631504510,1,0
The green dragon on the arts quad is an underrated cafe with those vibes!!,1631504462,5,0
Sadly it’s saying that something is wrong and that I cannot join when I click the link,1631504429,1,0
Do you know if other subteams have sent anything out?,1631504378,1,0
Don't be discouraged about what other people say. Everyone's experiences are different! Lmk if you have any other questions,1631504318,1,0
[deleted],1631504234,1,0
Oh that’s reassuring! thank you! not a lot of colleges have an animal science program in general so cornell having one is super great. A lot of people keep saying how cornell is super competitive and depressing which was what worried me so thank you for responding me,1631504183,1,0
Pronto is the only place with good pizza in college town. Enzo’s and CTP are genuinely awful. The mall pizza is significantly better than them.,1631504114,8,0
I habe really enjoyed the animal science program. I have met a lot of great people in the program! I have a wide variety of friends from juniors to freshman and everyone of them has helped me withing these last 2 weeks! It's really what you make of it. Ik there are some competitive people and there are others who are chill. Honestly it's not much different than the friends I had in high school!,1631503918,1,0
This\^ !,1631503910,1,0
Rugby,1631503898,1,0
"Ned’s is ok. 

Enzos is literal garbage that might give you food poisoning. It’s a real head scratcher how they’re even still in business.",1631503891,25,0
how competitive would you say it is?,1631503880,1,0
Yeah if you read the article the victims were men,1631503840,2,0
"Doesn’t matter, we pay for the meal we should get a meal.  Then reduce cost and we will buy our own",1631503832,0,0
Went through the CPU application process last year. They’re just checking to see if you actually know how to express yourself in a group setting.,1631503806,1,0
Anyone hear from CDS?,1631503771,1,0
It’s not a food storage as there is enough food just not enough ppl to cook the food and serve the food,1631503770,2,0
"Don't get this down on yourself for a couple of early slip-ups.  This happens to everyone; we all feel like imposters. You can make adjustments. This isn't how the whole semester will turn out if you start making changes now. Take better notes, go to office hours, talk with friends, etc. Take it as a challenge, not as a mountain too high to climb.

Also, everyone lowballs those CS hours worked numbers. I can almost guarantee there are other people working just as long and even longer than you.",1631503731,40,0
"Hey- there's always a light at the end of the tunnel, trust me! I personally was pretty ambivalent about Cornell, wasn't happy with Cornell socially, and transferred out. Transferring to a different school is a really good way to reset your environment. I definitely met much closer friends at the school I ended up going to! It's at least worth trying/looking forward to if you're especially unhappy right now",1631503623,14,0
"If that is all true and I empathize with the employees, but if there’s a food shortage and short staffing and what was presented is not being offered then tuition and dining costs should BE REDUCED",1631503512,-1,0
"Damn, Duke is #9 and #12 at the same time, very impressive :D",1631503438,3,0
"First off,  best pizza in ithaca is franco's (for pies anyway, restaraunt style maybe Thompson and bleecker). Second goddamn are you bezos' son ordering like 4 toppings on your pizzas?",1631503418,19,0
"I originally was just searching for pizza in the area online, and then I found the app and thought it would be a good way to compare all the pizzerias side by side. It probably doesnt have them all partnered though",1631503323,5,0
I saw the same girl walking on north campus a few days ago in a white dress and carrying her sword,1631503141,2,0
"Sorry for replying to this so late! Do you like the animal science, major? I really like the program but I am scared that the program might be too hard or too competitive. Or is it really chill?",1631503110,1,0
"I have heard good things about Franco’s pizza, but can not myself confirm the quality. Same for PastaVito.",1631503021,3,0
i miss the one who got run over near beebe lake two years ago. never forget &lt;3,1631502908,3,0
[deleted],1631502887,11,0
and a lot of us tend to be fucking dickheads,1631502849,8,0
hang in there buddy &lt;3,1631502837,6,0
Just create a new one. Thieves generally don't return things back,1632560044,-16,0
What did I just watch,1632558688,16,0
I knew physics was useful for something!,1632554400,10,0
Who does that lol,1632554102,7,0
I’m confused,1632553893,2,0
Greedy ass algorithm playing border patrol,1632552294,1,0
there’s an open volleyball messenger chat,1632549946,2,0
But where is Dave? I know you know where he is.,1632549870,14,0
"It made me more depressed, because when you look at the facts, research, numbers the answers  to solve many problems are there and the explanation to how we came here is there. But like any other field, the facts that can be used to progress humanity are befuddled with the flaws of being a human.. which can also be explained.",1632549136,10,0
2021 applicant clearly has tons of experience of the Soviet Union lol,1632548896,6,0
they serve tons of food with common allergens all the time?,1632548716,4,0
I have like $20 worth of quarters that I no longer need — DM me,1632547548,1,0
"fireworks, dw bout it",1632547124,1,0
Can’t bc allergies. It’s considered too much of a risk as it could kill someone.,1632544985,0,0
and UPDATE to anyone else who may need these PPEs- hickeys ran out of flute masks and bell covers for flute clarinet and oboe;-; they are currently on backorder and will be in stock in one or two weeks,1632544586,1,0
Fair enough 👍👍👍,1632544022,2,0
Its a concert,1632543944,0,0
Liar!,1632543706,1,0
"no but like the point is the the pollutants are like interacting with the surface of the filter in order to be removed, so those pollutants would remain on the surface that the water is now running against, and if the concentration is higher on the filter than the water then the pollutants would enter the water. I honestly should know how this works I've taken classes similar to this. and all tap water definitely does have pollutants we shouldn't be drinking, but like everything has something in it we shouldn't be consuming, that doesnt necessarily mean it's like instant death. but i guess the answer is neither of us know what we're talking about but either way you'll live",1632543578,2,0
LOL as if the Soviet block was the perfect representation of socialism…,1632543482,1,0
My birthday was yesterday. I’ll tell them to stop.,1632543349,27,0
Don’t worry they are just fireworks the sound crackles,1632543329,4,0
DMed,1632543245,2,0
DMed,1632543153,2,0
In your daydream!,1632543150,2,0
Same fam,1632543124,3,0
I know where he is,1632543099,6,0
me too?,1632543017,1,0
thank you,1632543003,2,0
goodnotes,1632542989,1,0
I’ll think about it.,1632542980,5,0
its mine,1632542967,1,0
can i have some,1632542957,2,0
"I don't need welcome. I want free meal swipe, or free money!",1632542951,1,0
I have some extra.,1632542502,2,0
Thank you.,1632542477,1,0
I’m not.,1632542442,0,0
yup. heard them and not sure if fireworks or shotgun. Probably fireworks. (?),1632542427,10,0
I’m just as confused as you are lol,1632541397,6,0
If there's room after everyone else has put on their permitted 1 piece of luggage - only then can you load the bike into cargo.,1632540611,1,0
It’s my birthday.,1632540361,13,0
I’ll do something about it.,1632540046,1,0
"What's a '420 Vendor'?  Love to know, but don't want to pay $$ to find out.  Like, are there going to be people there selling weed?  That would be cool.",1632540013,3,0
Thank you.,1632539710,1,0
“I can do that” - Hans A. Bethe,1632539693,3,0
I’ll help find it.,1632539601,1,0
Notability.,1632539537,2,0
I’ll do something about it.,1632539361,2,0
Can it fit me as well?,1632539313,1,0
I know someone.,1632539257,1,0
"I'm not a double major but am in a lot of GOVT classes, and I can say that a LOT of people are history/gov double majors, (or other similar double majors)  so you would have good company",1632539061,1,0
alright i’m interested,1632538919,1,0
I know someone.,1632538884,1,0
fwiw now we're not,1632538620,2,0
"Gates is the official CS hub, but as a CS major in the college of engineering I have had a lot of classes in Olin Hall, (most, probably), some in Hollister Hall and Phillips Hall, and (this semester) one in the ILR building. It really is mostly dependent on which large lecture hall is available. For example, CS 3110 this semester is in Uris Hall G01.",1632538346,1,0
IM SO HONORED TO HAVE TOUCHDOWN ON MY SIDE!!!,1632538239,10,0
If you go on Snapchat and click the heat map  you can see a preview of it,1632538117,3,0
\^ Just came here to report this problem as well,1632538102,1,0
nope!,1632537787,1,0
They even set up a fence.,1632537269,7,0
"Sharpies, toilet paper, rubber bands.",1632537232,2,0
One lives but once. Prøst!,1632537197,1,0
"The filter holes wouldn't get bigger so only water would be able to get through the filter still. Not like the pollutants would get through all of a sudden. Also the only pollutants would be from pollutants in tap water. So that would imply all tap water has pollutants that we shouldn't be drinking. Idk, I'm no water expert. Doesn't make sense to me tho",1632537195,1,0
Yes.,1632537154,1,0
"We have nothing to lose by applying — opportunities abound here!

(…in the pursuit of one’s true calling, a proper citizen of Canada could verily achieve the rank of Syrup Sommelier, and beyond!)

With love, 

~Alice",1632537111,4,0
Yeah? What is it?,1632536874,8,0
All my homies hate BEE 2510,1632536630,2,0
"Man, I almost want to apply myself now!",1632536484,2,0
Damn...,1632536393,1,0
"10000% only knowing you probably didn't get 20% right is like really good. When I finish a prelim I'm typically like ""ok I got 40% definitely right, 10% probably right, 10% maybe right, and 20% I'm really not sure, and 20% totally a guess/probably wrong"" and I'm pretty psyched with that. My personal goal is to feel pretty good about half the content. I got around a 50-60 out of 100 on both my prelims in Chem 3530 and got a B- in that class I think. Curves make up a 50 to passable most of the time. Legitimately I would feel pretty content with myself if not proud if I were you.",1632536241,2,0
Correct!,1632536165,1,0
I graduated already and it was like that on West back then too,1632536144,5,0
I am Curious Yellow,1632536102,1,0
"I think yes, you have to make sure tgeres room. First come first serve",1632536048,1,0
"pretty sure its just a really loud frat party on the university ave and west ave corner, it just sounded surprising amplified from my room and sounded like it was coming from a diff direction",1632535953,43,0
"well my feeling is that the water is typically passing through a filter, and if it's passing through a full filter then it would in theory I would think that the pollutants in the filter are now getting into the water so it's actually making it worse. Like washing a dish with a dirty sponge. If I knew it wasn't passing through the filter at all then i wouldn't worry about it, i drink ithaca's tap water all the time. But I have drank from a red filter water fountain before and I'm not dead.",1632535898,2,0
Rumor is they were looking for the Cornellian who bought out all the donuts.,1632535892,4,0
That’s beautiful. I’m sorry this happened to you.,1632535865,9,0
Welcome to the  freshman 15 😢,1632535765,3,0
What's going on?,1632535699,14,0
Gonna guess it’s speakers blasting music,1632535602,18,0
"Hi, I'm interested in studying materials science and wanted to know more about what the program has that other people who majored in materials engineering liked. What are some cool things that cornell material science and engineering offers that you didn't know before you got there? What drew you to mse at cornell?",1632535580,1,0
"In the before times yes but right now, no. Cornell ID is currently req'd for C2C under COVID provisions.",1632535471,11,0
"they only close over winter, and if you absolutely need to stay over winter you can apply to stay over in dorms but theres limited spaces so no guarantee, but a lot of ppl will sublet to u in winter",1632535195,6,0
And there are sirens ? What is going on,1632535189,15,0
Ok! PM me for details!,1632535122,1,0
[deleted],1632535082,1,0
[deleted],1632535064,1,0
"A chance to learn what it means not just to try and be the best, but to learn how to teach others the same. 

The Statler represents the tradition of Service. Of Quality. Kindness. 

Those who aspire to a better world, where hospitality is genuine and people are warm and honest, are most welcome here. Your choices may lead you to meet interesting and wonderful people — ones who may open doors of opportunity, of which you may not yet dream, but will one day. 

Since you need only ask, you would be a welcome addition to Statler’s Finest. 
Yours in service,
~Alice",1632534895,1,0
