title,selftext,created_utc,score,total_awards_received
Got a great shot of the stadium while checking out the pregame shows,,1574519496,1,0
ARC game day hours,"It says they have shortened hours on game day, but don’t specify. Anybody know what the hours are for today?",1574518863,1,0
The Jesus preachers are everywhere,,1574518718,1,0
*Clicking noise intensifies*,,1574517877,1,0
Ticket Bay down anyone selling Penn Stare tickets,pm offers,1574517279,1,0
Selling Penn State 38B message if interested!,$130 or best offer,1574514846,1,0
WAAAAKKKKEE UPPPPP! IT’S GAME DAY!!!!!!!,"Last home game of the season !

Let’s go bucks !",1574509819,1,0
Commencement tickets?,I'm graduating this semester and got an email about commencement tickets last week. I was broke last week so I didn't get any. Now it says they're not available even though the email said I could buy them for another week. Are they sold out or do I have to try and find a scalper the day of?,1574500564,1,0
Fridays are hard," Does anyone else feel this way? I don’t really have any classwork so I just sit here looking out the window wishing I could be doing anything else. It took me way too long to realize I have social anxieties, I didn’t use to. I’m graduating soon and I can’t help but feel like I’ve spent 4 years of my life being miserable for no reason.",1574497625,1,0
Can finally leave Alabama behind,,1574491683,1,0
Selling ticket for tomorrow in 3A,Anyone looking for a relatively cheap ticket?,1574479638,1,0
Big Noon Signs?,"Hey folks!

I’m deciding between Gameday and Big Noon and I’m wondering if Big Noon allows us to bring signs. Does anyone know? I can’t find anything online...",1574474138,1,0
Huge alumni worldwide. Need a suggestion for place to watch PSU game tomorrow. First hand only. I’m very familiar with Yelp et.al.,,1574471202,1,0
TTUN,It’s my first time going up to the armpit of America. Are there any Buckeye tailgates/things to do before the game next Saturday?,1574466394,1,0
I heard 180 credit hours was too much for a certain OSU money policy before graduation?,"I’m amongst the honors freshman putting together their academic plans, and while I absolutely won’t run into this problem, one of my roommates said his plan would finish him at 173 credit hours by the time he graduates. Before anyone freaks out, this is mainly from how much AP credit he has. With his current plan he actually doesn’t have many classes during his senior year and has to add more to even be full-time. 

Anyways, with the preface all done, I recall hearing in my survey class (from the instructor) that after you get 180 credit hours, osu stops giving you some sort of monetary benefit? I don’t remember much about it, and we can’t find anything online saying it yet. Can anyone elaborate? Thanks!",1574461920,1,0
Climate Change Questionaire,"Hello! Please take this last-second survey for my design research class! 

&amp;#x200B;

[https://forms.gle/4G5cdQRgjrGhC7CU7](https://forms.gle/4G5cdQRgjrGhC7CU7)",1574460654,1,0
Revoke Email,[removed],1574460001,1,0
O Chem 2510 Curve (Chang),Any previous experiences?,1574456001,1,0
Hold up Protest signs behind the Fox BIG Noon kickoff show tomorrow morning,Fuck noon games,1574455940,1,0
Rpac lockers,Are all the lockers in the locker rooms the one that you have to buy? Or are there some you can rent locks for. :) thanks,1574454515,1,0
Vs. Penn State puns,"To my fellow jokesters and satirical players:

I need your help coming up with a clever yet classy, oh so goofy slogan for a poster my friend is making for the game tomorrow.

Best comment wins $500,000,000,000 and a hug!!! A hug yes!!!

Thank u much,

EC3",1574454112,1,0
Every time I lurk onto the sub,,1574452536,1,0
Avoid the OSU optometry clinic,"I don’t have vision insurance (most people don’t) and I needed some new glasses so I tried the optometry clinic. You’d think (since a student is performing the exam) this would mean it would be dirt cheap... well nah it’s $145, about 2-4 times what they’d charge you without insurance at a regular eye doctor. 

The student was friendly, but he scratched my old lenses when checking my prescription (I went back to complain and got free lenses so there’s that) and the entire exam took nearly 3 hours (you’re a guinea pig and the student goes through a lot of tests that aren’t necessary for a young adult). An actual doctor needs to check the student’s work... you get bright lights and lasers shined in your eyes not once but twice!

The student got really serious and said things like “your optical nerve is badly misaligned,” and I started to panic. The actual doctor took a look and scolded the student, saying I was fine.",1574452246,1,0
Wake up time for the shows tomorrow?,What time is everyone getting up for gameday/big noon? I have no clue when to wake up. Wanna get kinda close. Obviously earlier the better but idk any insight would be cool,1574451432,1,0
"Reminder: Go to the Fox Sports show tomorrow, don’t do gameday","The title. Support a real show. Gameday is garbage now. Plus, Urban Meyer is at the Fox show. See you there.",1574450524,1,0
West Lane Garage Motorcycle,"Who ever has a motorcycle with a cover parked in west lane garage, someone knocked it over",1574449754,1,0
Penn State Ticket,"Selling a student ticket for penn state, price is negotiable lmk if interested!",1574445591,1,0
"I feel like someone has made something similar to this, but oh well.",,1574441108,1,0
Relatable meme for fellow freshmen,,1574441075,1,0
Fuck fire drills,[removed],1574440294,1,0
Assignments due during break?,"Genuine question: I’ve heard that professors aren’t allowed to have homework actually due on days that we have off class due to the university being closed (ie, thanksgiving break). My professor just assigned homework due on Carmen on Friday 11/29. People in my class were not happy about it and he said “you have a week to do it, just do it early before break.” Is this even allowed? The university offices are even closed that day. Thanks for any insights",1574438706,1,0
Mirror lake to be drained :(,,1574428103,1,0
Blue Powerade at Sloopy’s hits different,[removed],1574408122,1,0
Beat ❌ichigan Rally!,"Ohio Staters will be putting on a Pep Rally about the rivalry with TTUN on Sunday November 24th from 6-8pm at the Covelli Center. 

You can win free buckeye merch, watch performances from student groups and hear stories from past and current players about the rivalry. There will also be a chance to win free tickets to Lumineers, Buckeye Country Superfest and an OSU men's basketball game. 

Free parking will be available as well as shuttles from St John Arena to Covelli Center. Come get excited about the football game against TTUN and get some free stuff!",1574397115,1,0
New Loko Seltzer,Has anyone found the new Four Loko Seltzer around here yet? I haven’t had any luck yet. I need to drink away my sorrows from failing my exam yesterday,1574395481,1,0
Do we still have our regular # of swipes during Thanksgiving break?,Title :),1574394816,1,0
The clock tower’s new message...,,1574394686,1,0
Quesadilla sale!!! The fundraiser will benefit Moms2Be!!!,,1574394508,1,0
College fucking sucks.,"Im majoring in misery so my social life has been extremely limited, My SO told me i'm an awful person and took the dog and cats and packed her bags and hit the curb. I pay for tuition in cash I earn from 50+ hour work weeks because I have no family to rely on, and I just can't fix my grades, my relationship, or my dying succulent plant all at the same time. I've slept 10 hours this week trying to fix all the above, and I am currently typing this in a recitation room Ill spend the night in since I also have an exam I haven't started studying for yet. 

To whomever is having it hard, know you ain't alone. These moments are what build us into greater people in an ever evolving narrative. Its okay to not be okay. That's ultimately one of the many things that make life worth living, for if there were no bad times, we wouldn't have a reason to value the good times. 


Keep on keeping on, my buckeyes.",1574392795,1,0
3 questions about my first OSU football game,"I'm super pumped for my first OSU football game. I've been a huge Buckeye fan since childhoos, now I'm a student here and see the stadium every day. I'm going to my first game, and there are 3 questions I have.

&amp;#x200B;

1) Someone is going to transfer me the tickets (we're meeting IRL, so there is no scam). What app do I need to receive the tickets, and what do I need to have done prior to the transfer.

2) I have a Carmack 5 parking pass (WC5) and one of those Event Access keycards. Does that mean I can park in the Carmacks. Or in any of the parking garages free of charge?

3) Lastly, its most likely gonna be raining, so where can I buy a relatively cheap poncho (even if its just a one-time wear then dispose).

&amp;#x200B;

Thanks guys, Go Bucks",1574388582,1,0
J.K. Dobbins makes semifinal list for two Doak Walker,,1574388104,1,0
Selling Penn state tix $120,"Deck 32B row A, comment if interested",1574387524,1,0
Petition: Allow Chase Young to walk out Saturday alone to the Predator Clicking sound.,Like [So](https://www.youtube.com/watch?v=bTimNS0cpyU),1574387004,1,0
Tired of people not using locks at the gym,From now on when I open a locker with stuff inside I am not taking the courtesy to shut your locker. I will leave the door open and everyone can see your stuff inside. I am sick of opening locker after locker and seeing your stuff inside. Get a lock people!,1574383239,1,0
Does anyone know what the curves in math 1150/precalc is like?,I have a D (62) in there &amp; was wondering if getting bumped to a C- is possible,1574382169,1,0
OSU chem sucks,,1574380048,1,0
Pack back HCS 3475 Karl Danneberger,Anyone know how packback grades for this course? Is it just for completion of discussions or the score packback gives you? Also how hard does it grade and what are some tips.,1574376581,1,0
I need help but I don’t know what to do,"Hello all, 

This semester has been probably the hardest of my life. Im in the engineering field and I honestly don’t know what to do. Its my 3rd year of college and i feel helpless. Its my first semester on the main campus i spent the last 2 on a regional campus. Im currently looking at most likely getting all Ds or Ds and Cs my current GPA is 2.4. ( yes i know my gpa really isnt that good however over the first 2 years of college i had a lot of untimely deaths in my family and close circle of friends life was hard) My course load has been 2 different engineering courses one high level math course and a general chemistry course. Its not that i don’t care about my academics because i really do. I’ve been too embarrassed about my academic struggles to go to people about them especially with my family because they would probably shun me and I’d be viewed as a disgrace or disappointment. Obviously i want to do well and i want to graduate from this school. I really enjoy the track i am on and the things I study in class but i get this feeling that I either A) don’t belong there or B) cant keep focus long enough to grasp all concepts in lectures. My recent failure has ultimately pushed me into a hopeless depression that I can’t seem to free myself from. I do live on campus as well. Yes i made a throwaway account for this because people might know me. I appreciate any meaningful feedback on what i can do to fix this and I appreciate anyone who actually took the time to read about my personal problems i don’t ever open up about my feelings to anyone. 

Thanks.",1574374642,1,0
game day,How easy is it to get into games without a ticket?,1574374568,1,0
Is it feasible to double major in Finance and Marketing?,Does it matter that they are both in the College of Business?,1574373077,1,0
Volleyball teams to join for spring semester,"I decided to not join any teams for the autumn semester because I didn’t know how much time I would have and I didn’t want to do too much at once, but I miss having that outlet and I am trying to get back into the sport. I know there are club teams, but I want a little less serious because I know the club teams are crazy good. Even though I don’t want to play at a club level I still want to be apart of a group/team that will take it seriously. I would be interested in playing just women’s or coed and obviously indoor as the weather is not permitting for sand volleyball right now. If anyone is apart of a team or knows of any teams currently accepting membership please message me, I have 7-8 years of experience, I usually play front row, but I can play any position.",1574372203,1,0
Financial Aid Not Disbursed,"I recently enrolled in classes for the spring 2020 semester. At the advice of my advisor, I enrolled in three courses totaling 15 credit hours. I wasn't able to get a seat in one of them, so I was only enrolled in 11 hours worth of courses, technically not a full time student. 

The tuition payment date for spring semester is coming up in december and when I looked at my buckeyelink statement of account I found that only a small portion of my financial aid was being applied to the total. I've enrolled in an additional class now, thinking that maybe my credit hours were the issue (this was about 30 minutes ago).

If anyone has had this problen before, should I expect the rest of the financial aid to come through soon, or should I be worried?

Thanks.",1574371611,1,0
Does the Physics 1250 Final really cover mostly stuff after Midterm 2?,"Because I’m so fucked if that’s the case. Kind of don’t get the chemistry stuff, \*really\* don’t get the special relativity stuff, and idk what to do.",1574366580,1,0
Anyone here on keto?,If so what do you eat using swipes/dining dollars? I’m getting tired of eating omelettes and zoodles,1574365219,1,0
I love Scott,"Just walked in for a quick bite to see the worker handling the buns grabbing and moving piles of hot dog buns around with her bare hands, really really appetizing.",1574358648,1,0
CIVILENG 2405,"And tips, advice or recommendations for 2405?",1577764595,1,0
Buckeyelink,[removed],1577761439,1,0
OSU Boxing Class,Has anyone taken the boxing class taught at the RPAC? I’m considering taking the class just to get a good workout and wondering if it’s worth it.,1577761054,1,0
place to be for New years with no friends in state?,God damn I need to meet more people,1577760322,1,0
Buckeyelink,[removed],1577758993,1,0
Big Ten supervisor of officials: Fumble return for TD should have stood in Ohio State-Clemson game,,1577758550,1,0
Rajiv Ramnath for CSE3231 Software Engineering,Anyone had him and how is he? Most of his rmp ratings are pretty old and I can’t find any sei data on him,1577757949,1,0
F*** this school!,[removed],1577751700,1,0
"If I lose financial aid at OSU due to SAP, can I take classes at Columbus State using financial aid?",,1577750951,1,0
MolGen 5608 and 4703 textbooks,For anyone how has taken MolGen 5608 or 4703 did you find the recommended textbooks helpful? Or did you do just fine without then?,1577745547,1,0
Late Scholarship Payment and Fees Due,"I have a few external scholarships that I have to send updates in order to receive money for the following semester (term grades and the new bill). I'm pretty sure fees are due today and I haven't heard anything about one of my scholarships. Buckeyelink is closed and the scholarship trustees are not answering their phone or responding to email. I don't want to get slapped with any late fees, so I'm considering paying off the rest of my balance and hoping to get it back as a refund when my scholarship finally comes through

Does anyone know if making such a payment will alter my financial aid package in any way (i.e., will I get hosed of my refund if I make this payment myself rather than allowing my scholarship to pay it and missing out on a chunk of my refund due to late fees)?

\[On a side note, why are fees due so early this year?? I thought they were due by the first day of class last year\]",1577744730,1,0
Got a parking violation,got a parking violation for parking in the staff area at the stadium lot. I thought I was parked in the northeast section where C permits are allowed to park. I have a CXC permit but I had an appt today and it was my first time parking by the stadium cause I didn’t wanna walk all the way to buckeye lot. The row that I parked in said nothing about it being a staff parking. There was literally no signs on that parking lot. Has anybody had any experience with appealing citations through Campus Parc. Any tips?,1577742489,1,0
Tired of being fed talking points? Tell us what you think in our VOA Student Union survey about conflict on college campuses.,,1577738962,1,0
Female Subleaser Needed! In Car Garage! Available Now,"I recently got a new job that provides housing, so I need to find someone to take over my bedroom in a three bedroom townhouse asap! All utilities are included in the rent, pets are welcome, it’s available NOW, I’ll subsidize your January rent, and you’ll have your own bathroom as well! Message me!",1577736554,1,0
Looking for a bed,Looking to get a bed (bed frame and mattress)!! If anyone’s willing to let theirs go at $50 or less I’d be able to pick it up anytime today or tomorrow,1577735865,1,0
Dance 1101 or 1141?,"Has anyone taken any of the intro level dance courses here? If so, were they difficult or a waste of time? Thanks!",1577732741,1,0
When is the last date to access Rpac and Cota?,"I have asked Buckeyelink about the information but they couldn’t find the answer, either. I graduated from OSU last semester but I’m wondering if I can still use the service or not. Is there any website explaining about the begin and end dates of the services?

PS: Last week before Christmas I still had the access to both services.",1577731988,1,0
Aero admission confusion,I'm confused on the aero engineering admission decision. I still have not received a decision on my application to aerospace engineering while I know several people who have been rejected or accepted and wanted to see if anyone knows anything regarding this.,1577723142,1,0
Nervous,Starting my second semester here soon and I’m honestly so nervous. First semester went really bad and I really need to keep my shit together this time if I want to do something with my life. This really sucks :(,1577722342,1,0
Graduated from CS 1 Year AMA,Nobody came into work today so I am bored. Ask me anything,1577719411,1,0
Looking for a third roommate for 3bdr place on North,[removed],1577719281,1,0
Tired of the Crime?,"I honestly just wanted to make the most recent post possible about this to really gauge if maybe I'm not alone in worrying about this stuff.  I have to take a fifth year to finish up at OSU, but I have spent both of my off campus years in a high rise apartment building 2 steps from campus making it perfect for avoiding violent/confrontational crime at all costs.  However, it's incredibly expensive and I can't afford to keep living there for another year and so my sorry butt is now left frantically searching for living options with no experience with dealing with the dangers that seem to come with housing literally any further.  Is anyone else just tired of seeing the neighborhood notices spread closer and closer to campus and further West of High and North of Lane? Some of them sound like absolute horror stories to me, some in the middle of the day, early night time, it doesn't seem to matter where or when you are anymore.  I have no idea where to even try looking for housing with the combination of not having roommates, a budget, and what may be an irrational fear of Columbus and that itself terrifies me too.  As in to the point of wishing I could take all my last classes online so I can move back home to a place I can walk to my car at 5 PM without fear of being held at gunpoint.  These notices have long spread from 4th street, too.  Almost all of them for the past year or two have been north of 13th it seems and many near Waldeck (very close to campus and very north).  I know I'm being dramatic about it but honestly I don't have people to walk everywhere with, and how do you even leave the house after 5 PM during winter? Maybe I'm done with OSU in general at this point from being here so long lol but I'm ready to leave these muggers behind.

&amp;#x200B;

Finally, I realize it comes with having a campus so close to any major city, and isn't just an OSU problem I'm sure.  Just wondered if anyone else has noticed how awful the reports have gotten lately.",1577718738,1,0
Monarch NYE Ticket,"Super sorry if this kind of post isn’t allowed, my non-reddit using friend is looking for a ticket to Monarch’s NYE party. If you or anyone you know is trying to get rid of theirs, lease let me know!!",1577693119,1,0
looking for a place next year,"Hello guys,
I am looking for a place next year off campus. My price range is around $500. Prefer to be below that price or at that price to include utilities. Looking to lease from summer 2020-fall 2021. If you have a place and need a roommate please message me.Thank you.",1577690872,1,0
"O H I O - TBDBITL, Glendale, AZ",,1577688280,1,0
GPA too low to get into CSE major. Use all 3 Grade Forgiveness uses to qualify for major?,"I'm currently a sophmore (going into 4th semester), and my GPA (2.995) is too low to get into the CSE major. Would it be a good idea to retake the following three classes, using all three uses of Grade Forgiveness to raise my GPA enough to at least be close  to the 3.3 value I need? I'd then take a fourth class, and possibly some summer classes.

* CSE 2321 (C)
* ACCTMIS 2000 (C+)
* MATH 1172 (B-)

Normally I'd be asking my advisor this, but he is not responding.",1577681972,1,0
"Self-Defense and more, absolutely free",[removed],1577679716,1,0
Mental health services,"Hi, I’m a senior in HS who’s been admitted to OSU and have it as my top choice for CS. I’ve heard that the mental health services on campus aren’t that great and can be outright atrocious. I’m dealing with some issues rn and am scared that if I go there and try to get help it won’t end up well.  Oh, and I know people usually say “Since you’re on your parents insurance, go off-campus for counseling” but I literally do not have that option due to how my family deals with mental health.",1577677156,1,0
Missing financial aid?????,My financial aid isn't showing as pending. I meet SAP and the award still shows up in the financial aid section but it says I owe 7k. Anyone else having this issue???,1577675705,1,0
Still salty...,,1577674217,1,0
for everyone taking Systems I this semester...,,1577672486,1,0
Was Michigan always this nasty?,"Say what you want about us losing, but why is Michigan having a party?

Shouldn’t you always root for conference? I was seriously about to root for Michigan, but now I think I’ll be cheering for Bama",1577664526,1,0
New Years in Columbus,Is anything happening in Columbus for New Years Eve?,1577664111,1,0
Go Clemson!!!!,,1577661084,1,0
Retaking a failed course at a different college,[removed],1577656508,1,0
Any City and Regional Planning undergrad majors?,"I stumbled across this on the osu majors website. After some research online, it seems pretty interesting. Can anyone tell me what it’s like? What are the classes like? Projects, assignments, all that stuff?",1577652877,1,0
Textbook for Bio 1114?,"I’m looking on Barnes and Noble’s textbook list, and it shows that the textbook for Bio1114 w/ Chiucchi is recommended but not required. I used AP for 1113, so I’m not sure if I should invest in the book or not bc idk what the bio department is like. For those of you who have taken this course, do you think it’s necessary? Or does he teach you everything you need to know? Sorry if it’s a dumb question and thanks in advance!",1577651486,1,0
Can I take ACCT 1 with only haven taken Macro econ?,"The Course description says ""Prereq: Econ 2001.01 (200), or equiv""  I have only taken Macroeconomics and not Microeconomics. So can I still take ACCTMIS 2200 - Introduction to Accounting I ?",1577648131,1,0
This has been a bad 24 hours for Ohio State Athletics,"First football, now basketball. );

Press F to pay respects",1577647790,1,0
please stop coimplaining about the game,Y'all are literally so annoying. Yes the calls pretty much sucked and yes fuck clemson and Trevor Lawrence. But literally every post yesterday and today has been bitching about it like its going to do anything. Please for the love of God go journal or something.,1577645999,1,0
Is the Athletic Band sheet music available for download anywhere?,Bottom text,1577642598,1,0
"Question about ""Class not open to students with credit for…""","Currently wanting to retake Math 1075 from a few semesters ago to boost my gpa (I did very poorly in it) and it’s description says it's “not available for students with credit for any Math course above 1075.” 

However, I’ve already taken a higher level math course. If I’ve already taken 1075 AND have credit for a math course above it, can I still retake it with grade forgiveness?",1577641028,1,0
Busfin 3300 with Krempley,Has anyone taken this course that can tell me the general layout and difficulty? And any other info you find relevant? Krempleys rate my professor isn’t too hot but I need a finance elective that doesn’t have busfin 3220 as a prerequisite.,1577640435,1,0
We a basketball school now,Fuck Clemson,1577639509,1,0
What ACT score should I aim for to get a close to guaranteed scholarship at OSU?,,1577635596,1,0
