title,selftext,created_utc,score,total_awards_received
Engineering Expo Tips?,"As a first-year student, I wanted to ask what tips others have when it comes to the expo, or things you wish you knew before going to the expo. This is my first career fair and I want to try and make it a good one.

Also, I was doing some research on the companies that will be there, and I have picked out 13 on Monday that I want to try and talk to and 8 on Thursday. I wanted to ask if that is a realistic number from being at the fair from 2-4 on both Monday and Thursday, because I know some booths can get busy but I did not know how fast booths tried to get you moving.

Thanks, any suggestions help!",1569174601,2,0
OSU is mad that I don't use my iPad,,1569172726,252,0
"Yes, the server is happening, and yes, I created the clocktower.",,1569170393,108,0
I swear if this million dollar monstrosity needs someone to turn it back...,,1572891686,1,0
Microbio 4000,How is it in comparison to bio 1113? Easier? Harder? More work? Less work? Is lab relevant to lecture or is it random? Are there lab reports every week like chem 1210/1220 or is all the work during lab?,1572885713,4,0
ECE 2060 Midterm 2?,"I honestly have no idea what is going to be on this exam. I understand the notes and the homeworks, but beyond that I’m clueless. Does anyone who has taken the course before know if this exam is going to be hard/what I should expect? What do I really need to study?",1572882711,2,0
Curious Mind,"Hey guys!

Those who have had Dr. Callam for Ochem I in the past, what has been the range for the lowest A percentage? In other words, the syllabus currently states that an 87% is an A; obviously there will be some sort of curve; so, will an 85, 84, 82 etc become the lowest A? 

Thanks in advance!",1572882597,1,0
Ohio State Podcast - Time and Change,"Hey everyone, 

The Office of Student Life has been producing a student-run podcast called Time and Change where they bring on students, faculty, and other people in Columbus to share their experiences and give insights for current Ohio State students. There's a diverse set of guests and might be worth checking out!

Dr. Nicole Kraft - Journalist: [https://podcasts.apple.com/us/podcast/time-and-change/id1467818852?i=1000444515891](https://podcasts.apple.com/us/podcast/time-and-change/id1467818852?i=1000444515891)

 Juan Tramontin - Multicultural Undergraduate Student: [https://podcasts.apple.com/us/podcast/time-and-change/id1467818852?i=1000454335318](https://podcasts.apple.com/us/podcast/time-and-change/id1467818852?i=1000454335318)

 Dr. Matthew Stoltzfus - Senior Chemistry Professor: [https://podcasts.apple.com/us/podcast/time-and-change/id1467818852?i=1000449520128](https://podcasts.apple.com/us/podcast/time-and-change/id1467818852?i=1000449520128)

 Dr. Alex Grieco, MD - OSUCOM 2016 Professor of the Year: [https://podcasts.apple.com/us/podcast/time-and-change/id1467818852?i=1000447554439](https://podcasts.apple.com/us/podcast/time-and-change/id1467818852?i=1000447554439)

Dr. Roger Blackwell - Marketing Expert and International Speaker: https://podcasts.apple.com/us/podcast/time-and-change/id1467818852?i=1000446514251",1572881767,7,0
Re-activating an old buckID,"Might be a really dumb question. Had a buckeyeID, lost it and replaced it with a new one. I have since found my original buckID and currently cannot find the new one that I had made. Is it possible to go to the buckID office and have the original one Re-activated? Not sure if this is possible, thanks for the help in advance",1572880731,5,0
"CHEAP Maryland Ticket, Section 34B!","I won’t be able to make it to this weekend’s game, so I have got a ticket that I am looking to get rid of for cheap if anyone is interested!",1572879308,1,0
OSU skin sounds don't work,"Hi guys 

I downloaded this skin"" [https://www.reddit.com/r/OsuSkins/comments/cw7ybl/freyja\_v\_10\_osustd/](https://www.reddit.com/r/OsuSkins/comments/cw7ybl/freyja_v_10_osustd/) ""

i love it soudns but sometimes i hear the default soudns for some reason, i set "" ignore beatmap sounds"" ,"" use skin sound samples ""  and it still get me bad sounds ;c can u help me ?",1572877880,0,0
OhioState vs Maryland Game Poster.,,1572877602,153,0
Family coming to campus,Hey so my family is coming to campus for the first time since I’ve been here and I have no idea where to take them. I have food planned out but I dont know what to do outside of that. Any suggestions? (On and off campus),1572876908,4,0
Online class recommendations?,Does anyone have any political science or history online class recommendations? I’m hoping to get into history 3030 (history of Ohio) but there’s only 3 seats,1572876649,0,0
How are the science labs?,"Hey y’all, I’m currently a sophomore at a private liberal arts school not too far from Ohio state. The science labs here are all at 1:30 thru 4:30. I’m a bio major here and hopefully would be a microbio major at osu because I love the smaller class setting and I don’t really want that bigger lecture hall style class. I don’t want to have to do labs write up/reports every breathing second so I hope they aren’t to bad. If you are a microbio major can you please PM me I have a lot of questions",1572875426,3,0
ECE sophomore and wait listed for ECE 2020,"So ECE 2020 is basically a prereq for everything else in the major. If I don't get enrolled by January that might fuck my schedule up for more than a semester. I'm like 10th or so on the wait list, there's 180 people in the class. What are my chances",1572874285,5,0
Thank you to whomever left my iPencil adapter in the secret study room in Smith.,I never thought I would see it again!,1572874138,37,0
Tablet memes,"&amp;#x200B;

[true?](https://preview.redd.it/lohzh3j0inw31.jpg?width=400&amp;format=pjpg&amp;auto=webp&amp;s=1a49fd9766d683907f21e249c30ed2a621e588e7)",1572865142,2,0
How is English 2267?,Creative writing has always been a favorite past time of mine so I'm thinking of picking up a creative writing minor. How's English 2267 in terms of workload and what kind of stuff did you do in that class?,1572851116,0,0
Do research assistants get drug tested?,I have an interview on Wednesday for a research assistant job that I really want but I’m afraid they’re going to drug test me. I can stop smoking weed if needed for the job but does anyone know for sure if they test students and also if they would at my interview?,1572849320,1,0
Question regarding class delivery types,"I was looking at History GEs to take (I love History) and I saw that a class I was interested in, History 2202: Medieval History, and I saw class was in a ""Hybrid Delivery"". What's that? Would you recommend? Has anyone taken this specific class this way?",1572846348,1,0
busmgt 2321 curve,does klinker curve the class?? if so by how much?,1572844387,0,0
how to be a decent human being,"dining hall edition 

1.) pushing in your chair when you’re done

2.) bringing your dishes AND napkins to the correct place :) (we are also halfway through the year please do BETTER)

3.) stop leaving condiments at tables 

4.) use your brain 

5.) leaving when it’s closed (isn’t this common sense?) 

6.) once again. use your brain.

as someone who has to clean up your messes for hours. these are some of my pet peeves. honestly y’all are in college please be a decent person and clean after yourself thanks!",1572842964,58,0
Cop cars,"There’s like 7 cop cars in the alley between 13th and 14th, anyone know what’s going on??",1572839408,1,0
Looking for a female roommate for August 2020 through July 2021,"Renewed my lease but my roommate is moving out July 2020. Property is 2 bedrooms, 1 bath and about a 10 minute walk from north campus. Rent is $650/mo. (per person) which includes utilities and internet/cable and done electronically. Off-street parking is available but you have to buy a parking pass ($200 I believe for the parking lot and there are two garage spaces for $350 each). It's in the basement but there's a good amount of natural light.

&amp;#x200B;

I'm pretty quiet and have occasional guests (sometimes overnight). I drink and go out on the weekends but don't throw parties in the apartment. I'm also very neat and since we're in the basement I'd like a roommate that is as well to keep the pests away. If you're interested let me know and I'll shoot you a message!",1572836676,2,0
Chance of freshman cse pre major getting into Software 2 and Foundations 1?,So the advisors in survey made it seem like it can be hard to get into software 2 and foundations 1 as a premajor- is that accurate or should I be okay waitlisting them and eventually getting in? I don’t schedule until next Tuesday so I’m just sitting here stressing out about it till then.,1572834169,2,0
Becoming a TA,"I don't really know how all of this works so I don't want to sound stupid asking how to do this, but I really enjoyed my COMM class last semester and was wondering if it'd be possible for me to become a TA for the class. If I'm only a sophomore undergrad, is there a chance that I could get involved, and for current TAs, how did you get into becoming a TA? Did you get asked to be one or did you reach out?",1572832165,5,0
Private practice rooms on campus?,Hey guys! I’m thinking of picking up baton twirling/dance again. Is there anywhere on campus I can practice in? Like a private room i can reserve or something? I haven’t done it in years and I have waaaay too much anxiety to practice in front of people. Thanks!,1572829232,1,0
My professor is homeless and living in their office.,"Hi fellow OSU students, 

I need your feedback on a sad and slightly odd situation. It has recently come to my attention that one of my professor is most like living in their office. I by no means want to expose their identity or get them in any trouble, I just want some feedback and other people’s thoughts on the matter. I have begun to connect the dots that they most likely can not afford to live near campus, as they claim they are. I have asked them where the live (never inquiring directly as to whether they’re living in their office lol) and the answer only furthered my suspicions that they are homeless. My question is this: 1) how can I help them without embarrassing them, and 2) should senior faculty be made aware of their living situation? I try to show kindness and do nice things for this person, but it breaks my heart not knowing the full truth as to what’s really going on.",1572827106,15,0
Bio 3401?,"Anyone whose has taken 3401 what are some tips to ace the class? I’m taking 3401, molgen 4500 and eeob 4510 (comp vert anat) next semester and I’m kinda worried if it’s too much to take at once as I don’t want to do poorly in these classes.",1572826816,1,0
Sublet for Summer of 2020,"I have a room in a house thats a 10 minute walk from North Campus that I an looking to sublet from May 2020 till the beginning of August 2020. It is in a large, 5 bedroom 2 full bathroom house. The room I am subletting is in the basement, so it is a bit more secluded from the other rooms in the house. Rent is 550$ a month, 14$ for internet, plus utilities.",1572822697,1,0
do i have a problem?,"okay so ever since i got here (i am a freshman) i have been trying to go to the gym and get adequate amounts of protein each day. its been going well, except i now eat chicken nuggets daily. 
that shouldn‘t be too big of a problem, except i think i am addicted. the chicken nuggets at scott are too good, i don’t even have to put anything on them. i have 10-20 chicken nuggets a meal for 3-4 meals a day. its gotten to the point that i only go when its self serve so the employees don’t judge me. my friends make fun of me because of how many nuggets (or “nuggies”) i eat per meal. 
what do i do from here? i hate most of the other food at scott but am worried because ive gained well over 10 pounds since move in.",1572821236,145,0
Looking for someone to sublease!,"Hi!  

I'm looking to fill my room in a house until july 31. The room is on the second floor, as well as a parking spot in the parking lot behind the house. 

Rent is $530 a month, located near 11th and summit. 

PM me if you're interested!",1572818117,1,0
Biochemistry 4511 Exam 2 w/ Shimko,"Does anyone know when/if the sample exam 2 will be posted? Also, do the topics just go from Chapter 6 (Protein Folding and Tertiary Structure, but not Protein Secondary Structure) to Chapter 10 (lipids and membranes)? Thanks :)",1572813289,3,0
Forno and Fakes?,Is Forno strict with fakes? Asking for a friend.,1572807348,1,0
Yogurt at Scott,What type of yogurt is the vanilla/strawberry yogurt at Scott?? Is it decently healthy or some nasty danimals shit,1572798182,2,0
Anyone selling Cody ko tickets??,I need 2,1572791269,1,0
Where to get parent apparel,"All anyone in my family wants for the holidays this year is like a Ohio State Mom, Dad, Grandma etc shirt and sweatshirt. I’ve checked in traditions and the OSU bookstore but there is either none or only one option. And shopping online isn’t much better. Where have you all found good options for parent/grandparent apparel?",1572790442,4,0
TIME to turn those clocks back an hour!,,1572787990,18,0
Looking for roommates for AU20.,"Looking for male roommates to add to our lease for AU20. The property is a 6 bedroom 2 bathroom house on West 8th and Pennsylvania (over by the Med Center). We currently have 3 people on board and are looking for 3 more, whether in a group or as individuals. Rent is $510 when split evenly and utilities average out to just under $60 per month. Realtor is Pella. Very spacious inside and well maintained. Move in will likely be very flexible as the spots that are opening up will be vacated at the end of this academic year. PM with questions.",1572770958,1,0
Mental Health Counseling Options,"Hey everyone! As we all know, it takes at least 3 months to schedule an appointment with a counselor. This is the time of the schoolyear where mental health can be at an all-time low and where depressing thoughts can take a hold of us. My question is, does anyone know of any counselors or therapists that I can go to that are near OSU and do not have a long wait time? Are there any other options is battling mental health?",1572750517,22,0
Keep an eye out for these guys from weinland park,,1572749762,182,0
Difficulty of entering Accounting major(fisher),"Now I’m freshman majoring in math and I’m interested in adding accounting as my 2nd degree. 

I just want to know how competitive it will be? Like average GPA of students who are admitted. I’m planning to apply for fisher in AU20 (the ddl is June 1st next year)
If it’s possible, I also wonder how competitive Finance specialization will be.

Really thanks for your helping!!",1572749542,6,0
Rec Men's Volleyball,"Hi all, I am looking for some information for some rec volleyball, I understand I am a little late to join a team, as I had to focus on school work for half the semester.  I was wondering if there were any open nets or even a rec team to join.  I play libero and DS.",1572745649,1,0
Classes Full?,"Hey, everyone. I’m a junior currently pursuing a Communication major and a Screenwriting minor. My scheduling window doesn’t open until Monday, but every course I’ve looked at is full besides one. By the end of this semester I’m done with GEs, so taking one of those isn’t an option. I’ve always taken five classes per semester, and need at least twelve credit hours to remain full time. What can I do here?",1572745431,2,0
TMG tickets,"hi!! i’ve been waiting all evening for a ticket to see cody &amp; noel. i was about to check out when the site crashed :/ my boyfriend was able to get his, and we wanted to go together. so if anybody got a ticket that they’re willing to sell to me, i’d appreciate it a lot!! :)",1572742077,1,0
Lost keys on the way to hockey game,"Probably was dropped near the Brutus statue and Panera bread on Lane. It has a Chicago keychain as well. If anybody picked it up or dropped it off somewhere, hmu. Thanks so much",1572740647,1,0
Office365 offline?,"Can't seem to get an offline version of the apps. Tried to install Office365, and when I try to open up PowerPoint or Word, it goes to my browser and I couldn't access it without internet.

&amp;#x200B;

Anyone know how to get it offline?",1572736707,1,0
Parents in Student Section?,"I want to bring my parents to their first Ohio State football game this week, and plan on sitting in the student section. I know that in the years before with paper tickets, you just needed a Buck ID to get in. Would they still have to show Buck ID's or do they just need the ticket? Any advice would be great, thanks!",1572735175,3,0
Rpac pool,Can anyone just go to the pool at the rpac? Like can I just go and swim? Or do I have to ask someone? Or do I have to make an appointment or something??,1572731527,6,0
Lets become Food Best Friends,[removed],1572730921,1,0
Food,[removed],1572730211,1,0
Deans leadership academy,Is the deans leadership academy worth it or is it just a random thing I’ll be throwing on my resume that will mean nothing?,1572719506,2,0
Best barbers around campus?,"I have kind of long hair for a guy, (probably 6 inches, a little bit past my ears) and I don’t mind paying a bit for a nice chop. I know a lot of barbers are really good at giving fades and working with shorter hair, but I’m looking to keep it around this length. Suggestions?",1572719440,2,0
hello my tree osu develp 😡,testing,1572718286,1,0
"I lost my earbuds and they look like this, if anyone sees these laying around somewhere, please lmk",,1572716351,4,0
Hack OHI/O literally the first thing that pops up in sample code.,,1572706021,171,0
Acceptance Into Major,"When do you find out whether or not you get into your major? Not sure if it's different for different majors, but I'm going for CSE.",1572704452,0,0
Last minute hack Ohio team,Hey team of one looking to chill and casually work on one of the challenges,1572697416,2,0
Pro tip,"Never judge someone until you have walked a mile in their shoes. I personally try to keep an upbeat attitude, and find the good in people.",1572669172,0,0
Harding Hospital/other psych hospitals in Columbus,"Hey guys. Long story short, I’m in a pretty bad spot mentally right now and I need help. I want to admit myself to a psychiatric hospital before it gets even worse and it looks like Harding is the closest option I have, but am open to alternatives if anyone has any recommendations because I’ve heard some not so great things about Harding. I’ve been put into a psychiatric hospital before and that included them escorting me to there with an ambulance. I’d like to avoid that if I possibly can because neither myself nor my parents can really afford all the fees that come along with that, being put in the hospital alone is most likely going to financially wreck my family and I if it’s anything like last time. Can I just drive myself (or have a friend drive me) there and ask to be admitted? Should I call?",1572669115,6,0
Anyone going to Cincinnati next weekend?,"Hey, guys! I’d like to go to the university of Cincinnati next weekend, but I do not have a car. Do any of you have experience with taking a bus? I’m currently looking at barons bus, but if there’s any others you’d recommend, please let me know! Thank you!",1572660636,0,0
Hackathon teammates,If anyone needs a team for the hackathon tomorrow hmu. We have 2 people we need 2 more.,1572658173,4,0
Cannot register for a anatomy because I am still Pre ChemE,"I need to take anatomy 2300.03 to fulfill my pre-reqs for BSN, my GPA is a 3.0, so I won't be accepted into pre-nursing, and the only pre-req for 2300.03 is to be on the pre-nursing track.  What steps should I take to make sure I'm enrolled in this class for SP20 semester?  Any help would be very much appreciated.",1572654912,0,0
"If you're taking CSE 1222/2122/2421 or learning C/C++, this tool will make your life a lot easier!","Hey Bucks,

&amp;#x200B;

If you're planning to take any courses that involve programming in C/C++ or are taking any now, you'd probably be aware of how annoying Segmentation Faults are to deal with. \[Stensal\]([https://stensal.com/](https://stensal.com/)) is a free-to-use cloud IDE that has built-in functionality to help users debug segfaults in their code. If a segfault occurs during program execution, the built-in console will output a straightforward and informative message about where the segfault occurred and why, which makes debugging a breeze. You can even upload your own files and assignments to the IDE as well, so you can have a uniform work environment for your assignments. The tool was developed to help CS students and C/C++ learners in general have a less frustrating and more rewarding experience with C/C++, so hopefully some of you guys will find it helpful!

&amp;#x200B;

If you have any questions/comments/concerns/etc, feel free to join the \[Discord server\]([https://discord.gg/3dzgKZH](https://discord.gg/3dzgKZH)), which was created as a community for C/C++ learners and students like yourselves. Happy coding!",1572652078,1,0
"If you're planning to take CSE 1222/2122/2421 or are taking them now, this tool will make your life a lot easier!","Hey Bucks,

&amp;#x200B;

If you're planning to take any CSE courses that involve programming in C/C++ or are taking any right now, you'd likely be aware of how annoying Segmentation Faults are to deal with.  \[Stensal\]([https://stensal.com/](https://stensal.com/)) is a free-to-use cloud IDE that has built-in functionality to help users debug segfaults in their code, which was created to make programming in C/C++ pain-free. If a segfault occurs during program execution, the built-in console will output a straightforward and informative message about where the segfault occurred and why, which makes debugging a breeze. You can even upload your own files to the IDE as well, so you can have a uniform work environment for your assignments. The tool was developed to help CS students and C/C++ learners in general have a less frustrating and more rewarding experience with C/C++, so hopefully some of you guys will find it helpful!

&amp;#x200B;

If you have any questions/comments/concerns/etc, feel free to join the \[Discord server\]([https://discord.gg/3dzgKZH](https://discord.gg/3dzgKZH)), which was created as a community for C/C++ learners and students like yourselves. Happy coding!",1572651460,1,0
CHEM 1210 &amp; 1220 or CHEM 1250,So I have to take either 1210 &amp; 1220 or 1250. I’ve heard horror stories about all three classes and I haven’t taken chemistry since my junior year of high school. Is 1250 as bad as they say or should I just take     the other two and space it out?,1572650813,4,0
Looking for Native Spanish Speaker to Have Conversations With,"Hello, I'm trying to learn Spanish and I'm looking for a native Spanish speaker to converse with. I'm at the intermediate level, and I think this will be a great opportunity to improve my speaking skills. Thanks!

Hola, estoy aprendiendo el espanol y busco a una hispanohablante para hablar conmigo. Estoy a la nivel intermedio, y creo que esto sera una oportunidad buena para mejorar mi hablando. Gracias!",1572646201,1,0
Bio 1113 and Chem 1210,Will I be okay if I take both of these courses at the same time? How hard is Chem 1210?,1572645670,1,0
Has anyone taken EEOB 4510?,Is there a lot of outside class work? Overall thoughts ?,1572644071,1,0
Looking for roomate(s) for next year,"We are a group of 3 looking for people to add to the group on a 7 bedroom house. If you're looking for places to stay next year please consider PMing. The house is a block away from High St. in North Campus, 5-10 min walk from campus. Will message more details when you PM. Rent is 675 + Utilities though there is room with more people to bring it down.",1572643399,1,0
Ohio State Mental Health,"Please answer this question regarding your mental health experience at Ohio State. All responses will remain anonymous.

[https://forms.gle/rWFbgw11EUyStPCF8](https://forms.gle/rWFbgw11EUyStPCF8)",1572640202,1,0
Some points if you are struggling with classes,,1572639863,40,0
Tips for Morrill Scholarship?,[removed],1572637946,0,0
At least we have iPads,,1572637321,401,0
$10 tickets to our upcoming production of AS ONE,"We're offering $10 student tickets to our upcoming production of [AS ONE](https://www.operacolumbus.org/as-one/)! Use code SCHOOL when purchasing tickets [here](https://www.ticketmaster.com/search?q=as+one+opera+columbus). November 8 + 10 at the Southern Theatre!

As One is a compelling and thought-provoking story about Hannah, a transgender woman, as she endeavors to resolve the discord between herself and the outside world. This production is a celebration of the human character revealed through drama, music, and film.",1572636571,0,0
When the professor cancels the exam because the printer messed up,,1572636032,90,0
Shoutout to the printers screwing up a midterm,"We are about to start a midterm for STAT 4202 and the professor grabbed his mic and cancelled the exam because a lot of the exams had been printed wrong. 

Little pissed that I spent a long time studying, but hey we take those",1572635298,22,0
Please participate in a social psychology study for our lab! Click the link below!,,1572633759,0,0
Popeye's chicken sandwich is back,That is all,1572630727,0,0
Bake sale on west side of Derby Hall,"Donate a dollar and take a couple of cookies, brownies, candy, etc. Proceeds go to the OSU Meteorology Club and to our annual spring severe weather symposium (this year on February 14th, 2020).

We take Venmo and cash!",1572624514,5,0
CSE 2501,Does anyone know why all of the CSE 2501 sections are disabled on schedule planner? I schedule in 30 minutes and I need to take this class. HELP!,1572622592,2,0
