title,selftext,created_utc,score,total_awards_received
Caption this,,1571492933,50,0
Can't escape it even at work,,1571487083,268,0
Groovy,,1571472205,39,0
Music rooms in dorms,"For the newer dorms with music rooms (Raney, Houston, etc), how soundproof are they? I’m planning on singing with some friends and would like to not disturb people.",1571462405,2,0
Ohio state football,We are good.,1571460078,74,0
NoRtHwEsTeRn HaS a ChAnCe..,,1571456874,44,0
zellmer shitpost,,1571454383,32,0
Pumpkin patches near campus?,"Does anyone know of any pumpkin patch type things around campus? Preferably something with like hay rides, cornmazes, etc. Somewhere that’d be a nice little date spot! Thanks!",1571452892,3,0
Brutus,"Why does Brutus punch his own head like an autistic child having a tantrum? Or do all mascots do it? 

Don't get me wrong, I think he's super cool. I just cringe whenever I see him hitting himself.",1571450671,0,0
Anyone have a 3D printer I can borrow?,[removed],1571448701,3,0
"How do you download your entire courses... I have come to the section where I believe you should be able to yet there are no options to do anything( aka ""generate ePub"") Someone here has to know how.",,1571448316,5,0
History 2201 book,Is anyone selling the Ancient Mediterranean Civilizations book for history 2201?,1571436495,0,0
Is Northsteppe a good company to rent with?,"We’re thinking about renting with Northsteppe, is that a good idea?",1571434147,1,0
Is east 13th and north 4th a sketchy area?,My group and I are thinking about getting an apartment at the intersection of 13th and 4th. Is this area is safe to live in?,1571430483,1,0
Selling Wisconsin ticket,It is in section 37B.,1571428594,2,0
ACCTMIS 4780/4784,Has anyone taken either of these classes and can comment on the difficulty or if you enjoyed it? Trying to finish off my CPA requirements and of course Fraud Examination has a waitlist of 10+ within a day of schedules opening up. Was just wondering on some insights about the classes.,1571416751,2,0
Flu shot on campus?,So where’s the best place to get a flu shot on campus? A better question is where are some places they’re administered? Any help is appreciated!!,1571416344,5,0
They’re back and with an alias,,1571415997,28,0
CSE or Non-CSE 2 hour tech elective,"Does anyone know of a 2 credit hour class that will give me credit for the CSE tech elective hour requirements? Other than ISE 2040, it doesn’t look that interesting, but I’m saving it as a last resort. I’m graduating next spring and need exactly 2 hours, I’d take a 3 credit hour course but then I’d be at 19 and have to pay extra :(",1571409948,0,0
Aviation Engineering,"Can anyone tell me what the difference is between Aerospace and Aviation Engineering? Their curriculum is very different, but I'm not too sure what the engineering part in aviation is. Hoping I can find some aviation engineering majors in here.",1571409871,2,0
Exchanging Swipes for $,Looking for someone with a gray 10 or scarlet 14 to swipe me into Scott on Wednesdays for $5. Would need to be swiped in around 2:50-3:00.,1571408266,0,0
"""We proved that women could certainly stand the rigors of Antarctica""","the 50th anniversary of the first all-female expedition to Antarctica -- led by four women from OSU. How awesome is this photo??

&amp;#x200B;

https://i.redd.it/z1km4kisrat31.jpg

[https://news.osu.edu/we-proved-that-women-could-certainly-stand-the-rigors-of-antarctica/](https://news.osu.edu/we-proved-that-women-could-certainly-stand-the-rigors-of-antarctica/)",1571403482,213,0
Scheduling for CSE,"Hey guys, I’m currently a CSE pre-major and taking math 1172. I was looking at the requirements to apply to the major, and it doesn’t look like 1172 is one of them, as I initially thought it was. I’m considering dropping and taking it at c-state this summer. Would this have any negative effect on me applying for the major/ taking future cse classes? I’m in software 1 rn if that helps.

I plan on talking to an advisor tomorrow, but I thought I’d see if anyone else had any advice on this. Thanks!",1571374394,0,0
Off campus housing?,Need some help! Which are the best place to rent an apartments? Me and my friend are planing to move close to campus in summer.,1571365497,0,0
Lost AirPods on Oval,"Today when I got back to my dorm, I realized that I was missing my AirPods. After looking at my ""Find My"" app on my phone, I realized that I might have lost them when I was on the oval, helping a friend with her photography project. I know that the location tracking, especially for AirPods, is finicky, but I was hoping that maybe someone may have found them. I perspective, this is a longshot, but has Anyone found/see AirPods in a navy blue case with a silver clip that was in or around the Oval?",1571363286,13,0
Archery range on campus,Is there a range on campus anywhere? I thought there was a team but I didn’t know if they practiced on campus/if it was open to other students,1571362521,6,0
Dorm room locks,What's the point of the locks on dorm rooms if you can swipe to get in anyways?,1571361660,2,0
Trying to get a YangGang OSU started [FACEBOOK GROUP],,1571360719,0,0
Can I focus on animation in the moving image production major?,"I want to do animation but most schools with it as a major don't have fencing, so can I concentrate in animation if I pick moving image production major?",1571358895,1,0
Anyone have a 4 or 5 bedroom lease they’re not renewing?,Thanks!!,1571354952,0,0
Best route to Columbus State,I plan on taking a class next semester at Columbus state and I am wondering what the best bus route would be? I live in Morrill by the way.,1571353845,0,0
Off campus housing/ RA,"Hey I’m gonna be a junior next year and so I’m not “guaranteed” housing and don’t really care to live on campus.
Anyways, I’m applying to be an RA and won’t know if I’m selected until January/February. I was wondering if it’ll be too late for my too look for off campus housing at that point. I’d probably be lookint just to join somebody’s lease who needs an extra roommate. 
Just looking for advice thanks!",1571351643,1,0
Wondering which of these ECE courses would be hard,"ECE 2050, 2560, 3020,3030,3027",1571350338,1,0
Social events for graduate and professional students?,"I know OUAB has a few events geared toward grad and prof students, unfortunately they're not that frequent and the trivia is a night that I teach and cannot ever attend! Boo!


Any other graduate or professional students on the sub?  It'd be nice to connect with more people on campus and I'm always up for trying new activities.  I hope this doesn't come across as ""sad"" or ""desperate"" but it's just so hard to meet people when you get a bit older and are in an online grad program (oh yeah, I'm in an online grad program, but work on campus and live in town).  You don't realize how ""easy"" it is comparatively to meet people when you're in your undergraduate years...it's way harder now.",1571343595,3,0
Dog,There is a black poodle looking dog running around the clock tower/ curl area without an owner. If you are looking for your dog I hope this helps.,1571340135,11,0
QUIC Module 6,Does anyone know what the interview question is in QUIC Module 6?,1571340116,1,0
Has anyone here went to the eSports arena yet?,"Can you only play the games that they have pre listed or can you download some from steam? I play some fighting games and rhythm games that they don’t have listed. I have an external hard drive with the games on it too, is that allowed?",1571339454,13,0
Please listen to the new petitioners!! They want Ohio to switch to renewable energy!,"I know, the petitioners the past few weeks were aggressive, annoying, and we all wanted them gone. We will call the annoying ones petitioner A. 

There are new petitioners on campus right now, I will call them petitioner B. They have new sign sheets that are vertical, whereas petitioner A sheets were horizontal. 

Petitioner B is a petition to have Ohio switch to more renewable energy sources instead of using coal. They were here awhile ago but OSU banned them for a couple weeks because a student got into an altercation with one of them (I don’t know all the info on that)

Petitioner A will be directly affected by changing to renewable energy, they work with coal and their business would lose a big chunk of money if we switch to renewable energy. However, renewable energy is so much better for the environment and would provide a large amount of jobs to replace the jobs we would lose in the coal business!! 

Also, petitioner A people were getting paid per signature, petitioner B people are purely activists trying to have Ohio switch to more sustainable practices. 

PLEASE, if you care about the climate, please take a second to sign their petition. They won’t be here very long, they only have about a week to get all the signatures they need.  Thank you!!!",1571338271,1,0
Is it a bad idea to commute from downtown or uptown area?,"Hello,  

   I am an incoming student who is looking for housing near the campus. I found some apartments located in downtown or uptown area(specifically, around John F. Wolfe Columbus Commons) and was wondering if it's a bad idea to commute from there. I googled the location and it gave me 30 minutes by COTA. It will be ideal to figure it out by myself but unfortunately, I am an out-of-state student and in the middle of a semester here. Thanks in advance and kindly advise.",1571338018,0,0
What is Masters Mechanical Engineering at OSU like?,[removed],1571337957,4,0
Double Counting GEs?,is there a way I can find GEs that will fulfill more than one category?,1571337689,0,0
When D-Tix doesn’t have discounted tuition,,1571334575,96,0
Andrew Yang meme bus: hilarious,,1571331469,42,0
"Meanwhile, at Thompson...",,1571331275,426,0
Carmen can’t connect,I can connect anywhere but carmen ????,1571330790,6,0
"Watch out for the Hooked Deals dudes and their ""free"" donuts","They are set up on 18th with a big sign saying FREE donuts. One of the owners was out there telling people to download the app and to check out their ""new monthly subscription service"". I let them know I have the app and proceed to get a donut. The owner blows up at me and gets upset that I took a donut without signing up for the $5 service. He then proceeds to rant about how I'm not helping him make money. He didn't even want the donut back.",1571330593,9,0
Too bad LTE sucks too,,1571328095,217,0
Easy Arts GE?,I have to take 3 hours of an Arts class so if anyone has any suggestions feel free,1571327364,0,0
The truth about energy petitions on campus,"Hi everyone, 

As I’m sure you’ve noticed, there have been tons of petitioners flooding campus talking about government bailouts, climate change, and energy efficiency standards. Currently a battle ensues between the coal and nuclear lobbyists and the environmental organizations.

Earlier this year, House Bill 6 was signed by the governor allowing two of Ohio’s coal companies and two nuclear companies to disregard Ohio’s energy efficiency standards. In addition, they are increasing Ohioan’s energy taxes to provide money for four governmental bailouts of those same companies. When a bill is signed by the governor it goes straight into effect without receiving votes from citizens. 

There are two petitions currently floating around campus: one by the environmentalists and one by the coal/nuclear lobbyists. The environmentalists are petitioning to gain ballot access on a referendum to house bill 6. This allows a vote on Election Day for, or against, this bill, hoping to kill it at the polls. These petitioners are identifiable by a large paper packet attached to their petitions, containing: an explanation to what the petition is, a certification from the attorney general that this is a legal petition, and they always ask if you’re a registered voter of Ohio before allowing you to sign the petition. Some of them are paid, some are volunteers. However, NONE of them are paid per signature. The other petition is from the coal and nuclear companies who hope to stop the referendum from reaching the polls because they assume people will vote against it. They are identifiable by one page petitions with a statement of certification at the bottom. They are not verified by the attorney general, so have no seal of approval to verify they are real. This is a political tactic called blocking. Blocking is used to confuse the public into thinking they already signed the petition so there is no need to sign again if they are ever approached by the environmentalists. People doing this are called blockers, and are paid $8 per signature. They typically do not ask if you’re registered to vote. 

I hope this clears things up!",1571326381,109,0
HTHRHSC 4000 - online or in person?,Has anyone taken Health and Rehabilitation Science 4000? I’m trying to decide if I should do online or in person. It’s with Teresa Gueth if anyone knows anything about her that’d be cool too.,1571322234,1,0
lost apple pen,I guess it fell out of my bag in my class at Campbell Hall (rm 119). I went back there and there was a class going on and no one said they saw it so idk what happened. This is a long shot but if anyone happens to see it please pm me ):,1571318312,6,0
fisher advising appointments are the WORST,"fuck advising at fisher. site doesnt even work to schedule appointments, now times show up for me. calling i always get te damn busy signal. AND EVEN WORSE I TRIED TO SEND AN EMAIL AND I GOT AN EMAIL BACK SAYING THAT THE EMAIL THEY HAVE ON THE SITE DOESNT EVEN EXIST. how the fuck do i schedule an appointment. any one else?",1571314625,0,0
Data Analytics vs CSE,What’s the big difference between the two or does it really not matter. I’ve always loved statistics so I keep considering switching over to it instead of doing CSE,1571284353,1,0
Exam complaints,"Took an exam earlier today where we were all crammed into the Hitchcock auditorium . During the exam, we were all forced to only use the small side desks on the auditorium seats while having to have our iPads flat on the desks, so there was virtually no room to do calculations comfortably. Does anyone else find this super annoying ? Is there anyway we can file complaints and possibly get a better testing location ?",1571281085,3,0
Alright who has that super nice 3 bedroom lease that they're not renewing,dm me will pay finders fee in form of beer,1571276536,1,0
Thinking about studying abroad? Use CABS.,,1571275345,279,0
Declaring a specific engineering major?,Once your in engineering school when do you declare your specific engineering major ?,1571274264,1,0
Is there a way for me to check my body fat percentage at the RPAC?,,1571272713,4,0
Me to myself 5 minutes after walking outside in a light sweater,,1571271053,461,0
Missing Cat near Mirror Lake,Saw a black cat roaming around Mirror Lake in the tall grass. Runs away from anyone or thing. Just worried since it’s cold and it seems to be avoiding all interaction.,1571270955,1,0
Ticket for Wisconsin,"Section 32B, pm best offer",1571270454,1,0
I pulled an exam switcheroo—chances of getting away with it?,"Long story short, I’ve not had the time to study for my history of big rocks exam. I spent most of fall break hitting up the bars and partying. So lest I admit, I was not adequately prepared for this examination. Luckily, some of my fellow colleagues were. Towards the end of the exam, it was time to turn our exams in. It was quite obvious to me I was not well studied on the biggest rocks history has to offer. So, I did what any student would. I took someone else’s exam that they had turned in, wrote my name on it, and didn’t turn mine in. Personally, I think this plan is foolproof. What are my chances of getting away with this escapade?",1571270294,0,0
Classes next semester,"Can anyone give me advice on these classes or insight into their difficultly?? Thank you!

Econ 2002.03H with Darcy Hartman

CSE 2111

Anthropology 2200H

English 1101.01

Art Education 1600 (online)",1571268947,0,0
Sasquatch centennial,,1571267795,13,0
Creepy Messages on N. High St,"Anyone know what’s going on with the signs on north high st? 
For a little bit now they’ve been saying things like:

“In some instances it’s better to die than continue”

“It is a gift to the world to not have babies”

“self-awareness does more harm than good”

And everyday they’re getting a little creepier.",1571263942,12,0
For those of you with cell service down,"Currently downtown cbus, there’s about 50 trucks doing maintenance on cables for AT&amp;T and Verizon right now.",1571261171,25,0
Want 5 bucks?,"I didn’t know exactly what to tag this but survey seemed fitting 

I need some people to conduct a focus group for a class at 7 pm tonight on campus. I’m willing to Venmo 5 bucks to whoever can make it out. I anticipate needing about 5 people, but that might vary based on if my group members are ever able to get back to me :/ 

Only requirement is that you have been to chipotle and at least know (or belong to, even better) about their rewards program for frequent customers 

Please dm me! I’m still figuring out specific location but it will be on campus",1571260733,1,0
Looking for new games to play on xbox,I have kind of been in a rut playing the same stuff and wanting to play games I've played millions of times before. Any good games out there that you all would recommend? I'm into basically everything from banjo kazooie to halo to rocket league.,1571260404,2,0
I just want some peace &amp; quiet,"I have 3 midterms this week, twice as much homework as usual &amp; my immune system is finally succumbing to the campus flu. All I want is to study in the union basement before my final at 8 pm tonight. WHY is there 50 first graders down here and WHY is someone playing flight of the bumblebee as obnoxiously as possible on the piano? I am losing my mind",1571258051,80,0
No service,Anyone else have AT&amp;T and have no service anywhere on campus?,1571256908,8,0
Does everyone get along with their roommates?,[removed],1571256569,10,0
Where to go for mental help on campus,"My mother recently passed from cancer and I do not think I am handling it well. I have been having random crying spells, crying randomly in class, difficulty focusing, thoughts that resemble survivors guilt, and some other random dark thoughts. I never thought I could ever have mental issues and don’t even know where to go.",1571256506,36,0
What’s up with the people wearing bandanas playing some game on north campus,"What’s up with the people wearing bandanas playing some game on north campus

Basically what game is it and who are they with",1571256358,2,0
Typical Scooter Dude,,1571254888,81,0
Ticket for Wisconsin,"Section 34b for $110, pm if interested",1571252522,0,0
"Which is more annoying, petitions or surveys?",,1571249801,0,0
"New to skateboarding, looking for other skaters to help me out",I’m a sophomore who just started skateboarding at the beginning of this semester. I would ride a longboard a lot last semester but I’m just starting to skate now that I have my own board. I just got comfortable doing a running start to skating and now I’m trying to learn to Ollie. Any other OSU skaters want to meet up and help me out?,1571249419,8,0
Help finding Underground Railroad Plaque?,"I am looking for the underground railroad plaque that is apparently located by the RPAC field or the one by the  Olentangy River. If anyone has seen the ones in these areas before, can you give me a better idea of where exactly they are? They should look like the image of the one I've added below.

 Thanks!!

https://i.redd.it/13iexam1zxs31.jpg",1571248552,0,0
Is there a lost and found for Hagerty Hall??,title says all,1571244149,1,0
2 tickets for Wisconsin game,"Tickets are in section 34B, $200 for both or $110 each. PM me if interested.",1571240869,0,0
Petitioning to take 19 credits,"Anyone here successfully petition for 19 credit hours of classes their freshman year? I plan on double majoring in 2 majors that don’t overlap well and I would rather not add on an extra semester. I would love to do a summer semester but I have no idea when that would fit into my schedule as I have other commitments that I plan to do in the next few summers that would prevent me from taking the classes. 

Anyway, I talked to my advisor the other day and was told that I probably won’t get approved for the 19 credits. I currently have As/A-‘s and am taking 17 credit hours. I’m also in a few different sport clubs that I plan on quitting next semester that take up about 18 hours of my week. I’m wondering if anyone knows what my chances are of actually getting approved?

If this helps anything, here are the classes I’m planning on taking:
Chem 1220 (this is literally the only one I’m worried about)
Bio 1114
Neuro 3000
Sociology 1101H
Online Language Class

Any advice would be much appreciated!",1571237168,0,0
Stat 1350 midterm,What did people think of it? Seemed easy but whenever any thing math related seems easy I think I’m doing it wrong,1571233577,3,0
how bad is a W really?,"so i’m enrolled in one class for my major this semester and i absolutely hate it. i’ve already decided to change majors and honestly, it’s killing me to continue on with the class. i’m doing poorly anyways and would be lucky to get a C in the end if i continue. Is it really so bad to have a W on my transcript? Would i have a chance at getting into another major with a W?",1571231394,7,0
OSU Archives Flickr Page that has a bunch of retro photos from campus,,1571229541,84,0
Question for third and fourth years about food,So do third years and above have a dining plan or now do we have to buy groceries and food?,1571223262,2,0
apartment hunting osu,"Hello! this is my first ever post on reddit and I just had a couple things I wanted to ask.

I'm planning on living off campus next year as a 2nd year and I have no idea what to expect. I'm wondering is anyone knows what are some nice apartments near campus that are less than $900 and in a fairly safe neighborhood. I am willing to walk/take the bus to get to class since I don't have a car. I've been looking at One Pearl Place and Uncommon Apartments, but I'm just looking for cheaper places. 

Also please comment any personal stories with apartment hunting/tips",1571207504,1,0
"Whoever's missing a single sock... Well uh, I found it",,1571206712,13,0
Looking for Bucks who are interested in music and mental health!,"Hi there! We the team at[ www.ensu.com](https://www.ensu.com/), are building an app related to music listening and emotions. The premise is that if you listen to Spotify, we can help you understand how your music listening correlates to mood / emotion states (specific for you), as well as giving you new insights around patterns in your moods and emotions over time.

We're a team of mental health passionate people who are all recently out of college, and we're looking to get input from OSU students (we're designing the app specifically for college students) on the concept and the app. We're still in beta so would appreciate y'all signingup and giving us feedback!

If you're interested, please go to[ www.ensu.com](https://www.ensu.com/) and sign up! Feel free to message me if you have any questions :)",1571200096,2,0
question,is it appropriate to share tiktoks with your professor,1571193703,0,0
When you spend so much time on Taylor series that you forget everything else that’s gonna be on the 1172 midterm.,R.I.P,1571192796,31,0
(Academic) Survey for Fundraising Event (For College Students),"Hi all, I'm a college student from Miami University (OH). A class that I am taking Cit 205, is essentially a project management course, and for our project we are making a fundraising event for a non-profit here in Ohio. So my group decided to take our survey to Reddit and see what other college students would consider a fun event.

If you could take this survey it would help my group out greatly thanks!

Link to the survey: 

 https://forms.gle/68v8ydVvKWPrYBhQ6",1571192390,0,0
"Competent, intelligent humans use electric mobility devices safely and appropriately. *OSU freshmen at 30 MPH on every flat walk way*",,1571187805,48,0
Is Grubhub working for you guys?,"Everytime I try to deliver food from somewhere on campus to my dorm, the driver tip doesn't match the tip I select. Because of this, the receipt doesn't add up properly and it wont let me order. I just want to know if I'm the only one. Tapingo didn't have this problem.",1571182913,10,0
"Buy VPS Server, VMware VPS Server Hosting, Virtual Private Server",,1571180435,1,0
is it too early to search for roommates for fall 2021,"freshmen here, I decided to do random for my first year on campus and it’s, kinda fucked me over. And I guess I don’t want to put myself in a situation like this again (even though I think any situation is better than what I have). I know housing doesn’t open up until February but I figured it would still be good to start earlier. So if any future sophomores are thinking about wanting a roommate and don’t already have an established group please feel free to pm me :)",1571179961,2,0
"Cat found on the South Oval by the Old Ohio Union. Cat was pure black, small, and medium to long haired. Most likely an adolescent, green to yellow eyes, skittish. No visible collar. Please DM me if you have any information.",,1571179356,23,0
What programs/softwares do civil engineers use in their courses. Not counting engr 1182.,,1571178142,4,0
