title,selftext,created_utc,score,total_awards_received
What’s happening with the frats?,Why’re like all the frats banned from drinking alcoholic rn? What happened?,1582266183,1,0
Sloopy’s Barbecue Chick’n sandwich,Why does this taste like shit. I don’t know if they tasted this before they started selling it,1582261228,1,0
The most important day of this century has arrived.,,1582255027,1,0
Students tickets vs. Maryland,Anyone selling or know where to get students tickets for basketball vs Maryland on Sunday? Sold out online,1582253064,1,0
Communication technology minor,Has anyone minored in communication technology? I’m currently a information systems minor and think it’d be a cool pair to have this as a minor,1582252901,1,0
Econ 2367.02,[removed],1582249606,1,0
Summer Class,Does anybody know any GE historical study that’s offered in the summer?,1582245158,1,0
Accounting career opportunities,[removed],1582240657,1,0
Looking for a 3rd for Buckeye Rocket League,Registration ends Monday. Looking for D3+,1582240250,1,0
Found a pair of AirPods on the ground!,If you lost your AirPods message me the name of them and I’ll get them back to you!,1582239783,1,0
Found a pair of lost air pods!,If you lost your AirPods and can identify the name message me!,1582239674,1,0
Metalhead Trivia TONIGHT,If ya like metal come on down to The Shrunken Head tonight at 7 for trivia 🤘.,1582238096,1,0
i need consulting,[removed],1582237871,1,0
2220 with Johnston,[removed],1582235025,1,0
Curry Chicken Nuggets Review,"Hey all, Meat Science major here.

I just read the post about a chicken nugget addiction and it reminded me of the new Curry Chicken Nuggets at Scott, so I thought I'd give a review since I am, as a Meat Science Major, *completely* qualified to do so:

**1. The Meat**

As a Meat Science major, this is an analysis of the kinds of chicken used for the Curry Chicken Nuggets. They are obviously made out of higher grade chickens (if I had to guess they are probably Wyandotte or Orpington Chickens, I am not 100% sure though because it has been a while since I compared at home) and its eather breasts or high-quality thighs. This makes the meat nice and juicy and also not as fatty as the regular Breakfast Nuggets (I think I looked it up and the supplier produces the nuggets out of Polish Chickens, a subpar breast). The Curry Nuggets also therefore have better consistency from nugget to nugget. So with no downsides, I'm giving this a 9/10 in the meat category.

**2. The taste**

The seasoning on the nuggets is fantastic. I am not 100% familiar with homemade curries or anything like that, so having no other curry experience I can wholeheartedly say that the taste blows anything else at Scott out of the water. I can put any condiment (shoutout to my mayo kings) on these nuggets and they taste fantastic. I wish they were a tad bit spicier but pairing a teeny bit of siracha sauce gives the nuggets a fantastic kick. I give the taste an 8/10.

**3. The Outside**

I'm just gonna come out and say it, the Curry Nuggets look like shit. I was skeptical about trying them because of how awful they looked but after taking the leap I can say that the breading is fantastic. It is fried but not too thick and it doesn't take away from the chicken's flavor. They remind me of Chick-Fil-A's nuggets, probably a bit worse for you but nevertheless really good. I'll give it a 6/10 just because they don't look pretty.

**Recap**

The Curry Chicken Nuggets at Scott are made out of high-quality chicken and taste fantastic, even though they do not please the eye. I now eat them every day and beg the managers to keep them and add them to the Mongolian station upstairs. Fuck it, they are better than the General Tsou's chicken. I said it. 

What do you guys think? Have you tried the Curry Chicken Nuggets yet? Lets talk about it :)",1582235011,1,0
Champion’s System 2 Midterm,What...? What did I just take? Anyone else feeling like that midterm just didn’t make sense? And also like the point distribution was really weird? One of the questions was literally writing a single number and you got 10 points while multiple choice were only 3?,1582234924,1,0
CLAS 2220 with Johnston,"Does anyone take good notes for every ppt?

If answer Yes, could you share your notes with me?

(I could B. U.  Y )",1582234719,1,0
"Seeking lost cat, Akira, last seen Tuesday 2/18 off Indiana/Lane Ave. Please look out for her!",,1582233307,1,0
Seeking lost cat near Indiana/Lane Ave. She wears a sailor moon collar.,,1582233189,1,0
Why can the ducks do the mirror lake plunge but we can't? 🤔,,1582228573,3,0
How to reserve or get access to dance studio in Baker?,"Hey all, I’ve seen a lot here about how there’s open dance studios in Baker West but haven’t seen anything on how to actually get into them. Can I just walk in at anytime or is there some kind of reservation system? Should I ask an OA or would they be clueless?
Anything helps :) thank you!",1582227918,1,0
BUSMGT 3332 Midterm,can anyone who has taken the class offer insight into the midterm-- professor is Dr. Waleed A. Muhanna,1582227091,1,0
Anyone taken PSYCH 3331 before?,What is it like? Is it essay based?,1582226359,1,0
I love this school (and this subreddit),,1582225847,5,0
18th Ave Library Rules,"So I just came to 18 ave and went to the third floor, upon arrival I was asked to show my buckID and I was told that 3rd floor was only for grad students. I did not know this and I have been on the third floor a few times before and never had an issue being there. Is this new? is it just for a period of time? is there other floors specifically for certain people that I cannot use? is there a part of the website where I can find these rules? thank you for your help!",1582225574,1,0
Stop coming to the library to socialize,"Why do people insist on coming to the library and talking loudly the entire time? Shoutout to the people at the table on the 9th floor of Thompson, thanks for being really distractive!",1582223402,1,0
"in theory, what would happen if one was to reach out to an instructor about being sexually assaulted?",,1582222941,1,0
Please don’t slurp soup on the quiet floor of the library,Title says it all.,1582222099,5,0
Student Emergency Fund Reminder,"This has been a thing for a few years now (although the source of funding has changed) but a reminder that Student Advocacy  [https://advocacy.osu.edu/](https://advocacy.osu.edu/)  has a financial assistance fund you can apply to for up to $1,000 for help covering unexpected emergencies (they can't pay tution, FYI). They just wrote about it again in The Lantern  [https://www.thelantern.com/2020/02/emergency-fund-designed-to-reduce-student-financial-stress/](https://www.thelantern.com/2020/02/emergency-fund-designed-to-reduce-student-financial-stress/) 

Below are the eligbility requirements, but visit their website for more info on applying   [https://advocacy.osu.edu/student-emergency-fund/](https://advocacy.osu.edu/student-emergency-fund/) 

### ELIGIBILITY

* Applicants must be domestic, undergraduate students. This funding is **not** available to professional or graduate students.
* Students are only eligible to receive funding during the semester in which they apply, so they must be **currently enrolled** in coursework when completing the application.
* Only students enrolled on the Columbus campus may apply.
* Applicants must have a FAFSA on file for the current academic year.
* Applicants must provide **documentation** reflecting their financial emergency. No funding will be disbursed until all supporting documentation is provided.",1582217177,2,0
Ohio State among universities targeted over bias against men - News - The Columbus Dispatch,,1582217177,1,0
physics 1201 exam,anyone else think it was sort of easy? is anyone anticipating a shift on this exam?,1582215512,1,0
email scam going around just in case any of y’all thought this was legit,,1582215254,0,0
Spring semester blues,"Hello fellow OSU students,
I know spring semester has the ability to bring us all down. Something about the academia feels more intense than fall semester. There’s not as much lively events to look forward too, it’s really heckin cold, etc.
But I just wanted to drop by and say: you’ve got this! You are wildly capable of getting wherever you desire to be! Put in the work that you can, then do a little bit more, just a wee bit more. And lastly, know that you are wildly significant and you’re here for a great reason! You were meant to be here!!

Cheers friends, it’s almost Friday! 
And it’s also almost sprang break!!",1582213321,1,0
Share your story about CCS,,1582210237,1,0
Need course that satisfies both global studies and culture &amp; ideas,Help! I need a class to satisfy both my global studies requirement AND my culture &amp; ideas requirement,1582206858,1,0
Should I bother appealing,"TL:DR; I have 33 ACT but I’m 6th decile, accepted EA PoliSci, should I bother appealing not getting any scholarships


I got admitted EA out of state (NY) for PoliSci, and I really want to go to a big school because clubs, extracurriculars, social scene etc, but I got no merit or financial aid. I want to consider appealing for a scholarship, but I technically don’t apply for them, and it’s not why you would think.

My ACT is 33, 36 on both science and reading, so that qualifies me for every scholarship. 

Last year 95% of accepted students were in the top 25% of their class, I’m in the 5%. I wasn’t even in the top half, I was 6th Decile. It’s a long story (I swear I studied for the ACT on my own, I probably should have a lot more I only did for like 2 weeks, I’m not Olivia jade tho) and my school is competitive but it isn’t *known* for being competitive. 

The criteria for the National Buckeye Scholarship, which I what I plan to ~~beg~~ appeal for is ACT 29 and to be in the top 25% of your class. I surpass the ACT criteria but I obviously don’t make the class rank criteria.

I think I could make a strong argument, my act is very good, my school is competitive, almost everyone meets this requirement according to your student profile, why should you exclude the very few “holistic” students who don’t make it, and, I was accepted into SUNY Binghamton, which is the best state school in NY which could give me much cheaper tuition, but if I got enough aid I could basically guarantee I would be going to Ohio. 

Ohio was my second top choice (GWU is #1 but we do not stan 55k tuition and 15k other expenses) and if my appeal was successful I would without a doubt confirm for Ohio State, but back to the title, should I even bother. Will they really smudge it for me? I’d appreciate any tips (also I’m just sending it to the admissions office email and just hoping it is the right one), and thanks for reading my diatribe.",1582197020,1,0
Double major questions about accounting,"Hi, I’m a freshman and majoring in mathematics major now. I will change my major to accounting in sophomore. However, I’m a little bit worried about what I should double with accounting(150 credit hrs required for CPA exam). At first, I planned to double accounting and math in financial track, but it’s quite tough and has lots of non-business related math courses.   
Is that a good idea to double accounting and actuarial science or accounting and management information system with Business analytics minor? 
Besides, which one might be better for both applying for graduate school and career?

Really thanks for helping!!",1582179504,1,0
Praise be,,1582178915,1,0
clear the roads! New skater,"hello! me (19F) and my friend (20F) just started skateboarding and are looking for some beta (good spots, advice, etc) message me if you are able to help at all we could use it 🤓",1582178246,1,0
Spotted Xerxes just north of campus flying over the river,,1582174347,1,0
Neglect of mental illness,"I‘m on south campus, and a student terribly and unfortunately committed suicide a few weeks ago. I‘ve talked to people about mental health problems in students, and it seems like there‘s a general neglect of students with mental health issues. I don’t have any myself, however friends have reported the wait times for psychiatrists being 3+ months. It‘s so sad to see such a need on campus but no help. Also incredibly angry at the University for responding to the tragic death of a student with a wellness app on OSU iPads.",1582173832,1,0
PSA: Beware of skunks East of High,"I’ve seen a few of them going through people’s trash recently. Don’t get sprayed, y’all. May Xerxes rain hell upon the skunk menace.",1582171667,1,0
I remember why I chose The Ohio State University: Family,"I remember why I chose to go to Ohio State. As cheesy as it sounds, the 48,000 undergrad students here care about each other. It’s the biggest family I’ve ever been apart of.

The other night, I posted trying to figure out where free food was available around campus. See, I am very short on money ($9 to be exact) until I get paid next Friday and was trying to get by until my next paycheck by hitting up some events that offered free food. Without even asking for help from other students I had multiple students telling me they would let me use their swipes, where to go, and even had someone reach out and eventually donate money to me via Venmo. Thinks about it, strangers I’ve never met before willing to help out a fellow buckeye. 

There is not another campus in the world like Ohio State. Now, I know I get tired of my fellow peers from time to tone too, but think about it, we’re a family, as cheesy as it sounds, we help each other and you all helped me. When I graduate in a few months I will never forget this place, this campus, my classmates, the football games, the oval... I will never forget Ohio State and the people who have helped me out here. I love you all who helped me. I cannot describe how much stress has been relieved from your simple acts of kindness. I went to the store today and was able to buy food because of you all. This was honestly a life changing moment. I love you buckeye nation. Thank you.",1582171243,1,0
Has anyone else noticed that Ximera does this? It's different for every question/page.,,1582169583,1,0
Skip to the 12-minute mark. I don’t know who this man is. I don’t know what year this is. I just know that I was going down a rabbit hole of YouTube videos and I thoroughly enjoyed this coincidence and I thought y’all would too,,1582167614,1,0
Party scene,I’ve heard it’s a party school but I wanna hear what it’s actually like from students,1582166769,1,0
Petition to rename Scott Traditions to TTUN: That Tradition Up North,KComm is clearly superior,1582163891,1,0
Babic Systems 2 Midterm,[removed],1582162246,1,0
University Honors vs Engineering Honors?,[removed],1582160401,1,0
"Shit my pants, scared :/","Hey guys.  I shit my pants the other day at a house party.  Poo everywhere, more than your typical nascar racing stripes.  I’m scared from all the stuff online I see like that girl who went to OU recently who got bullied.  Should I be worried?? Peepeepoopoo is scary stuff.",1582159814,1,0
CSE 2133,"RIP to my grade, dear god man.",1582158294,1,0
How to study for Advanced Investments (4229) with Pirim,Any advice appreciated.,1582157219,1,0
3461 Midterm w/ Shattal,Anyone who has any experience with him care to share how his midterms are? Personally I don't think he's a good lecturer and is very boring.,1582157138,1,0
ASL 1103 Difficulty Levels,"I am finishing up taking my sign language classes next semester! I only have one option though which is to take the 8 am one, which sounds horrible. I was thinking about taking it over the summer at a different university. I just wanted to ask about the difficulty of ASL 1103? I have pretty much been handed A's in 1101 and 1102. If it is easy and I can get A I would definitely want to take it here since I will need that GPA boost.",1582153293,1,0
F to pay respects for insta story,,1582151029,1,0
Restaurant Survey for my Comm Class,"Hey, if you guys could fill this survey out so I can have a broader sample size and more accurate results. Itst for a grade, so I'd really appreciate it if you could. Thank you so much to those that can!
https://forms.gle/3tdmz73V81HqDqoW9",1582150929,1,0
Carmack 5 hellhole,"I wish they'd leave some buffer space at the end of the parking rows so you're not nearly blind when turning out. Unless you're in a humongous SUV or truck, it's hard to see into the road leading up to the stop sign. And since they've squeezed the lot dry w so many spots, even that road is barely big enough to handle 2 way traffic. 

Anyone else feel my pain?!",1582145277,1,0
Dieselpunk bicycle spotted,,1582144535,1,0
Scooter Snappers Beware... they can hear you. They’re coming!,,1582141070,1,0
Found the Scooter Snapper,,1582140830,1,0
Anyone know why there’s fake rocks by all of the dorms on south?,I know it’s random but I feel like I’m the only one who’s noticed,1582139710,1,0
Networking w/ Jim Vickroy Advice?,"Much of the reviews about Jim Vickroy's class state that he was incredibly easy, class was simple, super fair, and all of that, but his section this semester is hardly that.  He's a fantastic lecturer and super open to questions, but his quizzes are, quite frankly, unreasonable and blatantly unfair.

This week's quiz was the second one in a row that asked some questions that were nowhere to be found in the material we covered.  The *only* place you might be able to find some of the information - emphasis on might - is by meticulously reading all 100+ pages of the incredibly dense networking book and remembering every last detail.  It's insanely difficult to do well at all when every quiz has questions that just flat out shouldn't be on there.

So I guess for anyone who's had him before or even those who have him now, what's the best way to proceed in the class and not do horribly?  I've studied more for this guy's quizzes than my systems II midterm and do significantly worse even still.

&amp;#x200B;

P.S. He also doesn't have office hours and is rarely on campus, so setting up any extended meetings is quite difficult if possible at all.",1582138872,1,0
Complimentary Screening of THE WAY BACK at Gateway! (3/3/20),"Hi everyone! I'm back to share another complimentary advanced screening at Gateway! This early screening is for THE WAY BACK, a film staring Ben Affleck who plays a widowed, former basketball all-star in a struggle with addiction and attempts to comeback by becoming the coach of his high-school alma mater.

The film comes out on March 6, but if you're interested in seeing it before its release you can grab complimentary advanced screening passes on Warner Bros. site at: [http://wbtickets.com/TWBCOL1](http://wbtickets.com/TWBCOL1). The screening will be at 7PM on March 3 at Gateway! #TheWayBack",1582138452,1,0
Complimentary Early Screening of THE WAY BACK at Gateway (3/4)!,"Hi everyone! I'm back to share another complimentary advanced screening at Gateway! This early screening is for THE WAY BACK, a film staring Ben Affleck who plays a widowed, former basketball all-star in a struggle with addiction and attempts to comeback by becoming the coach of his high-school alma mater.

The film comes out on March 6, but if you're interested in seeing it before its release you can grab complimentary advanced screening passes on Warner Bros. site at: [http://wbtickets.com/TWBCOL1](http://wbtickets.com/TWBCOL1). The screening will be at 7PM on March 3 at Gateway! #TheWayBack",1582133377,1,0
Anyone know of a Microwave near Jennings?,I have about a half hour between classes and need somewhere to hear up lunch near Jennings/Mirror Lake area.  Anyone know where I can find a microwave?,1582129726,1,0
Math 1151,"So im currently taking math 1149 as dual enrollment in high school and am considering taking math 1151 over the summer before i take AP calc next year. Math usually comes naturally to me which is how i was able to pull off an A last semester with absolutely no studying. If anyone else was in the same boat I'm in, was it hard taking that with no previous calculus experience?",1582129312,1,0
Lost Shoes,"I seem to have lost my black and grey Nike sneakers, size 7. I have checked the lost and found of places they could be, but have not had any luck. If you see them please let me know!",1582128318,1,0
External degree,I just found out that I have an external degree from the OSU that I completed back in 2011. It doesn't count as any associate's degree or bachelor's degree - what type of jobs are hiring people with external degrees?,1582113706,1,0
i finally understand the scooter snapper,"I finally understand why he/she does it. Someone is parking one of those things on my block every night. Then it starts sending out a distress signal and IT NEVER STOPS. ""EEEEP EEEP EEEEP EEEEEP EEEEP"". All night long.  Shut the fuck up. Nobody is going to lay a hand on your dum ass",1582112339,1,0
How easy is Entomology 4607? Online second session,,1582091611,1,0
Free Food on campus?!?,[removed],1582088805,1,0
Kaitlin Bennett in Ohio University!!!,,1582079218,1,0
For rent 08/01-08/15 room $450 a person with utilities for the fall 2020-201 year,"All these upvotes but no comments? Here's a little more information about the place. It's on Chittenden avenue a couple minutes walk to the union and a 4 bedroom apartment. It's not a separate house and unfortunately no pets are allowed. We currently have three guys: myself (a grad student), an undergrad (ECE) student, and a senior (environmental science) student. We need one more person to sign the lease with us August 01 or August 15. The Landlord is flexible in terms of move-in dates. If you need to move in later than August 1, August 15th would be fine as well. Street parking is free and laundry is coin operated. Feel free to either DM me or send me a message and I can provide you with pictures as well. Also if you want to meet up on campus that would be fine as well. We have no preference in terms of gender we would just prefer no cigarette smoking and an OSU student! Thanks!
-Also sorry mods idk if this is the right tag.",1582074915,1,0
PLEASE!!!! take this survey!!! - power tool brand preferences and product innovation..... Which power tools do you use?!!?,"[https://osu.az1.qualtrics.com/jfe/form/SV\_e3RFx9uS6E9yTgF](https://osu.az1.qualtrics.com/jfe/form/SV_e3RFx9uS6E9yTgF)

Please do me a huge favor and take this survey. Conducting research on power tool brand preferences and product innovation. Do you work with power tools? Do you enjoy DIY projects and home improvements? Do your hobbies include gardening, woodworking, outdoor winter sports and activities? Camping? Hiking? We have products for you!!! Ever heard of Milwaukee tools? Give us some insight as to what you know about the brand and it’s offerings. Not a fan of Milwaukee? Let us know. Ever heard of heated jackets!?!?!?! Now you have. We want to know your thoughts, learn more here!!!!!! Thank you for your time.",1582072923,1,0
Accounting 2200 v 2200h,Seen some comments about how tough accounting 2200 is with M Smith . Any thoughts on whether 2200h- honors is a better or just a different choice.  Pros and cons . Any thoughts appreciated.,1582072458,1,0
MSLC Tutoring,"I’m looking to possibly get a new on campus job next semester because working in dining has me bored to death currently. I got the email for MSLC tutoring and I have some questions for those who have tutored before.

What’s the atmosphere like? Can you chill and study if it isn’t reallly packed? How are the shift hours? What happens if you don’t know how to answer someone’s question?

Thanks in advance.",1582071023,1,0
Accounting 2200,"Here’s a rant from an unsatisfied student. I’m in accounting 2200 with roughly 700 other kids. Our last midterm average was a D. Marc didn’t address the class average at all. If you think about it, he quite literally failed probably around 200 to 300 kids. How do you run a class like that? And the premed students don’t come at me with your chem test averages. This is quite literally a BUSINESS CORE CLASS that he makes WAY TOO HARD. Also, don’t say “oh he curves it” okay yeah he curves the class 3% that doesn’t make up for shit. Also - when you fail that many kids, it’s definitely on you. So what if you run one of the best accounting programs in the country. That’s for kids who specialize in accounting! You have no clue how to teach accounting to students who are just learning it/don’t have a vested interest in it! Sorry but if you’re making six figures and are one of the top paid professors at Ohio state you have to do better. This is absurd. Also- a bunch of super outdated videos making up your entire class lecture don’t exactly sue the trick. On that, it’s a scam that your videos often amount up to more time than you’ve had in lecture. If you get paid this much, have one of the best programs in the country, and make us to do so much extra work out of the classroom, have the class do better. Make it make sense.",1582068123,1,0
Lost Ring,I lost a ring with necklace this morning probably in North Express bus or RPAC. DM me if you find that. Thank you so much!,1582068005,1,0
What's up with the people on campus trying to make us vote?,Is everyone feeling the Bern already? 🤔,1582067639,1,0
Freshman/Sophomores rooming together?,Is it possible for a group of say 6 sophomores to add 2 freshman to our roommate group in an 8 person suite?,1582066654,1,0
Study guide for Jones CSE 2421 Systems I,,1582062739,1,0
