title,selftext,created_utc,score,total_awards_received
Can you take a class even if you have the AP credit for it?,"Since some professional schools don't accept AP credit, I need to take a statistics course despite already having the credit for 2450 from AP Statistics. I would still like to take the course at OSU (possibly over the summer). Would I be allowed to register for Stats 2450 still? The course requirements state ""Not open to students with credit for 245""; I'm guessing 245 is a typo and they meant 2450? Anyone have any past experiences about taking a class they already technically received credit for?",1588469964,1,0
We don't give a damn,,1588469716,1,0
M4100 General Microbiology Syllabus Wanted.,"I'm a Food, Ag, and Bio Engineer trying to get a class approved as a Tech Elec. If anyone has an electronic copy of the syllabus that would be awesome. Stay Safe!",1588468024,1,0
Petition to take back the pass fail?,I accidentally murdered a final I didn’t think I would. Most of the grades weren’t in. And I could potentially get permission from the Professor. Would that be achievable ?,1588467386,1,0
A beautiful view,,1588465686,1,0
"Cheers, to the best 4 years. We will meet again someday.",,1588460450,1,0
Dining dollars,"If I get an off campus dining plan like Carmen 1, could I still add additional dining dollars",1588460285,1,0
Please thank your TAs,"I’m a TA for a STEM department and I spent all day applying for minimum wage jobs and the OSU emergency fund. The University has put summer research pay for most TAs on hold... our last paycheck comes on the 15th and it looks like that’s all we’re going to get until the end of August. Even though we research and teach 40+ hours per week, OSU has classified us as students rather than regular employees (to reduce the unemployment insurance the university has to pay) so TAs and RAs aren’t eligible for unemployment. Many of us have student loans and families, and many of us don’t get help from our parents. 

My department hasn’t announced fall pay yet, so there’s a likely chance we’ll also see a pay cut. 

I’m not asking for pity, but if you have a TA who went the extra mile for you - even if it was years ago - please thank them. 

This doesn’t mean you should send some last-ditch pandering email asking for a “curve” or “bump” - trust me, your TAs have argued with their departments and lecturers to bump as much as possible.",1588458177,1,0
Graduation drinking game.,Any ideas for what to drink to. I'll start with unprecedented times and covid-19,1588457124,1,0
ACCTMIS 2300 exam 3,Anyone else’s accounting 2300 exam 3 not graded yet?? It’s been over a week since we took it and Marc smith is usually a fast grader.,1588456941,1,0
Computer Science Undergrad,"I have a BS in cybersecurity from a different college, but would like to go back for a BS in computer science(more applicable to IT/Web Dev) or a Masters in it. I was checking over the information focused major and had a few questions:

1. What lanugages does OSU focus on? I see some C/C++ and some python 3.0. 
2. How rigorous are the coding assignments? I noticed one assignment introduced Python(same week) then jumps right into developing an FTP program.
3. What it be ideal for a BS or MS?
4. Does OSU offer hybrid classes or flexibility with full time jobs? I would like to attend class and still experience college life since I am in my early 20s.
5. How high of math is required? I see the 2019 major topology,  but not sure. 
6. Would some of BS classes transfer or start from a fresh slate?",1588454315,1,0
Me when OSU told me to go home after spring break,,1588453189,2,0
Global business learning community,"Hey guys 
I’m an incoming freshman at OSU. I’ve recently been accepted into the Global business learning community (GBLC). Anyone who’s been there please let me know your experience and whether you suggest joining it. 

(P.S. Are LCs better or should I just go for regular housing???)",1588452695,1,0
Physics 1250 final grades,Anyone’s final grades for Physics 1250 been posted yet? Maybe I’m just spoiled because of fast graders last semester.,1588452164,1,0
Final Grades Posting,Does anyone know when final grades are going to be posted for the semester?  My parents want to know what my final grades are....,1588449894,1,0
When is the last day to schedule for summer classes?,Looking for a friend,1588446034,3,0
Should I take BIO 1113 over the summer?,"I'm thinking about signing up for a few GE's, and I'm wondering if BIO 1113 would be easier since it will be entirely online. Is this a good strategy, or should I wait until I can take it in-person?",1588442393,2,0
Shoutout to my professor for giving an extra 10 bonus points for no reason. Bumped me from a B to an A!,,1588442367,10,0
Graduating senior and I feel nothing,"I finished finals and didn’t feel that sense of relief or excitement all my friends were talking about. I feel no excitement about fake graduation tomorrow and feel kind of sad seeing social media posts of peers taking photos in caps and gowns near the stadium. Mostly I just feel a sense of looming dread and I don’t know why. I’ll be graduating without a job so it’s also hard not knowing what my future is. 

Anyone else feeling this way or is it just a me thing I have to work through?",1588437169,1,0
OSU Clock Tower Twitter Account,,1588433910,1,0
Clock Tower Twitter Account,"https://twitter.com/real_clocktower/

May the clock tower watch over you. Stay well!",1588432730,1,0
What ever he said...,,1588427531,1,0
"Selling Textbooks ECE 3030, 3050, 2020, 2060, Physics 1251. DIRT CHEAP",Need money for rent. If you need one of these textbooks for next semester ill mail them to you for whatever shipping costs plus 7 dollars.,1588424467,1,0
school supplies?,"hi :) I’m gonna be a freshman in the fall, and assuming campus re-opens I was wondering what general school supplies I’d need as a psych major?",1588414297,1,0
Looking for a Roommate Group with John Glenn Civic Leadership Community!,"Hey guys! I'm looking to see if anyone would be interested in joining up to form a roommate group with me this upcoming year. I'm currently participating as a first-year in the John Glenn Civic Leadership Community which is at Busch House. I'm a Political Science major who loves running, biking, volunteering, playing the trumpet, and jazz music! I'm also very interested in discussing current events and learning more about our government. I love to follow MLB and NFL and although I'm typically shy at first, I'm very open and receptive. I take my studies very seriously and prioritize academics. However, I enjoy playing video games in my free time and wouldn't be opposed to doing the same on campus! PM me if anyone in the learning community wants to group up with me, I'm also open to joining an existing one.",1588400384,1,0
"Finished my graduation cap, I still don’t know how I’m managing to graduate with a bachelor’s in chemistry from OSU",,1588395836,1,0
Stat 3470 question,So I am just wondering if having taken AP stats would help in STAT 3470,1589764099,1,0
Fisher Specialization GPA? (InfoSys and Logistics),Was wondering if anyone had information on the GPA required for Fishers information systems specialization? Recently applied with a 3.23 but the cutoff for applying was 3.1 and I had a B+ in calc and english so I think my chances of getting in are okay? Any info that’d help gauge my chances would be appreciated.,1589763341,1,0
Are there computer science or software development classes at OSU?,I want to be a software developer and want to go to OSU but I'm not sure if they have those classes.,1589742152,1,0
Biochem 4511 help for a deployed medic (Guard),"I’m pretty tired and can add more later but I was activated to assist a facility with over 2/3 of its staff and patients testing positive for COVID-19. I’m going to be gone for at least 5 weeks from the sounds of it and be working 3 12s (12 on 12 off) with a day off then repeat. If anyone has any notes or means of providing some help that’d be amazing. Online should be manageable and I have a good computer with me plus an iPad, but just want to make sure I’m doing all I can. I’m pretty new to reddit and not looking to karma whore or whatever it’s called. Just want Ochem help and stating why.

I’m gonna go pass out now, thanks homies",1589710255,1,0
Where to fly a drone on campus 🛸,"Okay, I bought a DJI Mavic Pro today (super excited) but soon after I remembered that there is an airport for aviation students 7 miles away and 11 miles away is the commercial airport.
Has anyone tried flying on campus, did you clear it with the FAA or are there specific places you think are legal to fly at? I didn’t see any G Zones (legal fly zones) that close to campus but I’d love to be able to! I have a couple of friends who I think wanna fly it too and I’d love to be able to offer to let them! Anyways, feel free to comment if you have any advise on where to fly for this incoming Freshman!",1589683422,1,0
Joined a course a week late and have been assigned zeros for previous work I wasn’t in the class for,"First time dealing with these online classes, my professor gave me zeros for 1 assignment and 1 quiz that had due dates before I had even joined the course. Professor says that that I can’t make them up and that it’s alright because they are “designed to be missable”. 

Having had troubles with grades in past semesters the worst thing to see is a solid zero from stuff I wasn’t in the class for. Is there anything I can do here?",1589671497,7,0
Well this sucks,,1589664275,113,0
How's ANTHROP 2200 Online?,"I am thinking of taking this course online during this Fall semester, since it clashes with one of my major class

Have anyone taken this class online and how was it?  
Read some posts about it but its a mix review. Some say it's difficult but some says its easy.",1589661603,1,0
Does anyone know how long refund checks take to send after being processed?,"I have a refund dated 5/13/2020 for the summer semester, and I was wondering how long it takes to get processed and when I should expect a check. I don't have direct deposit set up, so does anyone know how long checks usually take to get processed?",1589660005,1,0
Dean’s List,Anyone know when the deans list comes out,1589658444,0,0
Student Football Tickets,Has anyone gotten an email about ordering student tickets as the website says the ordering window opens on the 18th. Im assuming they have pushed everything back due to what’s going on but I wanted to be sure I didn’t miss anything.,1589653522,4,0
Country Party,Anybody know if there’s some big country party tonight? It sounds like an absolutely horrible idea but I know some people who are going and may infect me if they get the virus,1589649741,2,0
Catfish Biffs (URGENT),"Anyone have any info on if catfish is open for carry out or anything? Last I checked the sign said closed “indefinitely”. Any insiders willing to share some info? I’ve always heard rumors of the guy who runs it lives in Florida and runs it remotely, the whole place is kind of an enigma, but’s that’s why it’s so great. I am desperately in need of their pepperoni with Cajun seasoning.",1589643579,3,0
MedColl 2022,Has anyone that’s taken the class explain how the class works? like what type of schedule I should have? Is the shadowing a once a week thing? Can it be done during weekends?,1589641080,1,0
Financial aid question,"This summer will be my second semester at OSU because I transferred from community college. I never received any financial aid through CC so it’s kind of a new thing for me. Anyways, I attended OSU Marion campus last semester and decided to “switch” campuses summer semester so I had more options towards online classes. 

Well apparently I got a $1,200 scholarships (Alber Trust Fund is what its called?) but Buckeye Link says they’re holding the disbursement because I’m now “attending” Columbus campus. Do I drop a class at Columbus Campus and switch back to Marion so I receive the scholarship, or should I call financial aid? 

I’m a first gen student and have no idea what I’m doing, so any advice is greatly appreciated lol",1589638404,1,0
For those still living on campus...,"Please be smart.


I drove through campus yesterday afternoon and just noticed a lot of people out at the bar patios, no distancing.

No masks.


Anyway, please be smarter than that.  Make good decisions for yourself but importantly for others.  Remember you are young and think you’re in great health and not likely to get infected with symptoms. Which is wonderful for you, but just remember you are putting others at risk. 

Other people like myself who lives with a compromised immune system. 

We all want some return to “normalcy” but just be smart. Use that OSU education you are receiving to educate others and have common sense.

This all sucks but forego putting yourself and others at risk. 

Thank you!",1589632508,1,0
Just another rant,I'm a full-time OSU employee in dining services.I am lucky enough to benefit from their generous tuition assistance program. The current disaster leave ends today. And we have heard no further announcements. I understand that this is a unprecedented situation. But I'm not sure the University appreciates that some of its buckeye family  rely on OSU not just for full-time employment but to further their own education. leaving full-time staff members in the dark about possible layoff decisions seems extremely cruel especially since some of these students might be forced to pay for classes they were expecting to be covered by OSU tuition assistantI and and currently bin class. I am now left in the unevitable position of possibly losing my job and being removed tuition assistance from school with a $3500 bill on the way due to revoked employee tuition assistance. I understand The complication of the situation the world is in right now but but it doesn't reduce the amount of extreme stress that I'm under with the possibility of losing both employment health insurance and school. My superiors have seemed to know as much as me. Not really really the Ohio family vibe they try to push to much.,1589618868,1,0
Dating scene for international students?,Just wanted to ask how the dating scene is for international students? I’m one myself and am really looking forward to dates with locals as well,1589613580,1,0
Math 2153 summer 2020,"I’m currently a student at another university trying my damndest to get course permission to enroll in Math 2153. The calc 2 course I took at my home university was deemed insufficient for prerequisite approval, and I was told there is no exam available to place into calc 3. Is there anything else I could do? I’ve seen some stuff about EM exams but don’t know if those are applicable/available given my circumstances. Is there another course similar with lower prerequisite requirements? Any insight is greatly appreciated.",1589597055,1,0
Psych 1100 book,I bought the psych 1100 textbook and then decided to drop the class unfortunately so I have the book for sale for $30 + shipping if any one needs it for summer/fall,1589592699,1,0
Anyone else get a MyBuckMD message they cant open?,Title.,1589592618,1,0
C State Question,So I was accepted as a transient student but one of the classes I was going for was filled just as I was accepted. I emailed the instructor about letting me into his class and he said yes so I gave him my ID so he can add me. Fast forward 3 weeks later and he has yet to add me. I sent follow up emails every 7 days just in case. the payment deadline is coming up on the 20th and I'm not sure what to do right now,1589592088,1,0
"OSU recreation staff, do you know when the gyms will open again?","Just wondering if there’s any timeline for when gyms will begin operating on campus again and what safety changes will be implemented, if this has been discussed. If I’m not mistaken, Ohio will begin to allow gyms to reopen on the 26th, and I’m wondering if there are plans to open then or shortly thereafter or if I should look into a gym membership elsewhere for the summer. 

Thanks",1589591594,1,0
"Math 1151, textbook and practice problems?","I’m not currently enrolled in the class, so I don’t have access to materials on Carmen. But I’m looking for practice problems for math 1151 (I will either be taking it in the future or taking the EM test and I want to review)

This is the link I have for [Ximera](https://ximera.osu.edu/mooculus/calculus1), is this the only textbook? It doesn’t seem like it has a lot of practice problems. Is this all Math 1151 uses?

I’ve been learning from the online lessons posted on OSU math’s website.",1589591551,1,0
Anyone have experience/luck with being able to waive requirements?,"So some background is that I've been in school for a significantly longer time than your average college student, still undergrad because I've been putting off some core prerequisite classes for my degree. This isn't due to me just being lazy, I wish, its due to some learning problems I have where I know I wont pass the classes. (Long story short, I have a type of learning disability that makes math basically impossible and it comes with working memory problems that hinder memorizing basic math formula and with that same coin, the foreign language requirement. I do ASL but not to where I could pass 3 sections worth of it in a classroom setting)

I've talked to my advisor a couple times and apparently there is a petition process that I could try by writing basically a plea to let me waive the math and foreign language, but I would still have to pass a data analysis class, which frankly if that was all I had to worry about I could definitely try and scrape by, but she says the petition is a hard thing to have pass. I haven't done the petition yet for a few years as frankly I'm afraid what the result will be and that I will have to change my entire plan completely. I was wondering if anyone else has  petitioned/had luck with petitioning, and what your experience was?",1589591381,1,0
EDUTL 1901 &amp; 1902,"Hi, I'm planning to attend this Fall and it seems that I have to take the ESL placement test. I have a question for students who have taken these courses. 

If I am required to take one of these courses for Fall semester, will my fall semester only consist of only this English course or will I take this course along with other requirements for my major (eg: Calc 2)?

Thanks!",1589590892,1,0
Did anyone else get a buckMD message?,I can’t even open it I have a feeling it’s a waiver for fall of some sort,1589587822,2,0
My BuckMD down?,Can't seem to get My BuckMD to open on any of my devices (keeps getting stuck after getting through Duo). Anyone else or is this a me problem?,1589585690,1,0
Psych 2220,I’m taking this course in the fall with Seth Miller. Has anyone taken this class and would be willing to share their experience and their opinion on the overall difficulty of the course ?,1589585577,1,0
Student Football Tix,"Does anyone know what's going on with student tickets for this fall? Obviously there's more important stuff going on and the season might not even occur with fans (or at all but let me be optimistic) but  the website lists ordering windows as beginning next Monday ([https://ohiostatebuckeyes.com/football-student-ticket-information/](https://ohiostatebuckeyes.com/football-student-ticket-information/)). The emails have always gone out mid-May the last few years, just curious if anyone has gotten an email and I missed it for some reason, or if they're delaying this sort of thing until they know more about whether campus will be open/games will happen.",1589582381,3,0
Chem 1220 EM test - is one semester of lab enough to take it?,"Every advising office is just responding saying they aren’t currently offering EM tests and that the testing center is closed, and ignoring my question. So I was wondering if anyone had taken the EM test for 1220 and what past experience you had with chemistry.

I took AP chem in high school, got credit for 1210.   But I already had credit for 1210 with lab from a Community college class (dual enrollment in high school). I’m wondering if this is enough to get the exam referral from advising.

I want to test out because I know most topics in 1220 from AP (amazing teacher + I love chemistry) I have the textbook and topic list so I was reading through it to make sure and review things. I’m planning on taking Organic chemistry after 1220 or this fall if I test out.",1589582329,1,0
Is anyone taking Psych 3331 this summer?,Can we get a study group going?,1589570724,1,0
TEXTBOOK FOR HISTART 2001,Do we need the text book for this class? It’s like 50 dollars for the ebook and I don’t want to buy it unless I have to.,1589570150,1,0
how does cse catch cheaters?,"first i just want to say i have no intention of cheating. i've seen WAY too many COAM posts in the last couple months and have full intention to do 100% honest work without chegg coursehero etc. i'm taking software 1 over the summer with bucci and he keeps talking about how if you cheat you'll get caught which makes sense considering how many COAM cases are cse related. but i'm honestly just really interested to know HOW they catch people. like is there some kind of turnitin software that checks for matching code or sumn? i mean theres no way the graders can just remember if they've seen the same code befor. anyways, just curious lmao please don't roast me",1589570054,5,0
Requirements for Emergency Grants,"Hi Everyone,

I know I am a little late to the party on this, but I could use some help. I was reading around on the subreddit and it looks like the program might be out of money now, but I thought that I should ask about my situation anyways. I will also contact buckeyelink/student advocacy, but I wanted to hear what you guys had to say. 

I was a student employee at OSU who was laid off due to COVID. I did not  originally apply for aid because my parents were providing support for my bills while I was unemployed and I didn't want to take away money from someone who needed it more. I just found out the the restaurant that I worked at will not be reopening yet because they don't think that they will have enough business to stay afloat. I was counting in this job to continue paying my bills and my parents aren't in a financial situation where they can continue paying them either. I also have no idea how I can afford tuition this fall without these jobs. I am currently applying to other positions, but I made a considerable amount of money at this restaurant and don't think that I can likely make it up. Does anyone have any advice? By the way, I did not qualify for unemployment or a stimulus check. Thanks!",1589569665,2,0
Incoming OSU Transfer student. A couple of questions,"First off I am transferring from Columbus State and coming here in the fall. It looks like campuses will be open, at least to some extent by then, assuming all things equal. But how are the online classes here? Are they generally good or what? Because it would be much more convenient for me to take a bunch of online classes living in Delaware than commuting even to Marion, which is where I initially planned. Even without the Covid stuff it is far more convenient. Also can people online do sports like cross country?",1589566036,1,0
Does Ohio State have any musical theater?,"I was looking on the department of theater website, and it seems like they only do straight plays. Is it under a different department? Does OSU just choose not to do any?",1589565306,1,0
When does OSU remove you from the honors program?,"I'm pretty sure I'm going to be removed from the honors program because my GPA was only 3.3 at the end of this semester and the minimum GPA for honors is a 3.4. I was wondering if they will remove me and if they will send an email when that happens or how I know?

Also, does this mean that I would be removed from the honors class that I'm currently signed up for in the fall semester? And would it be worth it to take a summer course to get my GPA to the honors minimum even if there's no honors gen eds being offered during the summer?

I realize that I should ask my advisor these and I have I just thought I'd ask here as well just to see if anyone knows.",1589560861,4,0
Summer class registration closes at 5 pm Tonight!,Just in case anyone’s life got too hectic and forgot.,1589556376,4,0
FE/FEH UTA,"Current or former UTAs/GTAs,

If you do not get a position, does the Department still take the time to contact you?",1589551806,4,0
Lost Cat found at 13th Ave &amp; 4th St,,1589547279,1,0
EEOB 2520,"I am currently taking the online 4-week physio course with Bronson. I need to do really well to help my GPA (not just trying to pass), but I am SCARED. I’m looking for all the advice you have for doing well in this class. Her exam questions are so analytical and annoying. HELP. Also if anyone is also in that class hmu ans let’s study. 

Thanks",1589543955,1,0
