title,selftext,created_utc,score,total_awards_received
My contribution to the rainbow trend,,1583303058,1,0
CampusParc ticket in Morril lot?,"My girlfriend, who is visiting out of town, came out to her car in the lot between the towers about 5 minutes past her time on the pay by plate machine and received a $72 ticket (on a Tuesday night... at 12AM... all the more reason to hate campusparc). The hours were labeled poorly and she thought that after midnight she wouldn’t have to pay.

What are the penalties for not paying, and what’s the best thing to write in an appeal in this case to get it at the very least lowered? Thanks",1583301163,1,0
Look it's a rainbow. Upvotes to the left.,,1583300663,1,0
Lottery Number,My 6 person group got the lottery number in the 5800s out of 7500. We got fucked. We want to split up into doubles and stay on north. We are willing to take anything on north. What is the possibility of this happening????We do not want to live on south/west and i’m unsure how fast certain rooms go. Let me know!!Thanks.,1583300639,1,0
Looking for a Metal Singer,[removed],1583298030,1,0
Ambulances &amp; police at RPAC?,Anyone know what’s up,1583296738,1,0
so apparently most if not all of gen chem 1220 midterm 2 tests are lost,what would happen if they don't find them?,1583291454,1,0
Does osu offer any Culinary classes?,I’ve always wanted to learn how to cook properly not just follow recipes. Does osu offer any classes like this?,1583290717,1,0
Get out of Classes (for Almost Free) Card,"What's boppin Buckeyes? It's ya boi HiPigdom here bringing you the down and dirty on how to get out of all those boring classes that you learned in 10th grade in between your teacher ranting about her divorce. If you've seen half of my posts on this Reddit page, you will know what I'm about to talk about. 

&amp;#x200B;

# Credit by Exam

**HiPigdom, what the hell is that?**

Good question. After talking with multiple departments at **The Ohio State University** **^(TM)**  who say they offer credit by exam, I can tell you that you know about as much as any staff member at this university. 

[For a quick reference, click here.](https://registrar.osu.edu/priorlearning/examination-credit.html)

Credit by exam is a way to shorten your time towards a degree here at OSU, but nobody does it. Tests are through various companies/departments and cost varying amounts. The three I will talk about most are **College Level Examination Program (CLEP), EM Tests, and Departmental Exams.** 

&amp;#x200B;

# CLEP Tests

*AKA half my courses completed here at OSU*

[CLEP's Site](https://clep.collegeboard.org/register)

[Here's all the juicy shit you won't have to do, if you look closely, you'll see MATH1151](https://registrar.osu.edu/priorlearning/clep-tests.html)

First and foremost: **CLEPS Cost around $119 per test, unless you are military affiliated.** 

&amp;#x200B;

CLEPS are multiple choice tests that are produced by the same company as your AP high school tests. For some reason, the college level tests for these classes are much, much easier. I've casually walked in, taken a test, then walked out with +3 credit hours to my transcript in under a half an hour. The College Board charges you a fee to register for the test, then OSU charges you a fee to take the test, because they've ~~gotta siphon money off broke college students~~ support operations somehow. **CLEP Tests are 90 minutes long, and can be anywhere from 44 questions to 150 some questions.**  Longest one I've taken was the biology test, I think it was 141 questions. **Your raw test score is converted to a score between 20 and 80, 50 being the equivalent of passing the test with a C. Ohio State doesn't care if you passed the test, they care about if you passed with a score acceptable enough for their liking.** For instance, the Calculus CLEP test, Ohio State sets the minimum passing score to 64 instead of 50. Don't hate the OSU Testing Center for this stuff. The math department sets this requirement, not the nice people at OSU Testing. **Failing a CLEP Test will not hurt your GPA or affect you in any way, aside from losing your money.** So far, these tests have been the easiest for me to pass by far. 

If you fail a CLEP test, you can still retake the CLEP test at a later date. You can also try and take the EM test or Departmental Exam for that topic. Likewise, if you fail a CLEP test, you can still take the EM/Departmental Exam.

&amp;#x200B;

# DSST

[Their Site](https://www.getcollegecredit.com/exam_fact_sheets/) 

[See what the Ohio State Testing Center has to say about DSST](https://registrar.osu.edu/priorlearning/dsst-tests.html)

I have yet to take a DSST, only putting it here because someone may want to take one. Again, free for military. **Civilians have to pay DSST $85 for a test, then OSU another $30 ish. Please note that Ohio State only awards credit for three DSST tests.** Failing this test will not affect your grade or transcript in any way.

If you fail a DSST, you can pay to retake it. You can also take the CLEP, EM Test, or Departmental Exam on the subject if you don't want to take the DSST again. 

&amp;#x200B;

# EM Tests

*A New Hope*

[What the Ohio State Testing Center has to say about EM tests.](https://registrar.osu.edu/priorlearning/em-tests.html)

EM Tests are basically the **Ohio State equivalent of CLEP tests**. ~~Less effort put into actually making the test as every one I've taken is filled with typos and grammatical errors~~ Efficiently made and ~~more likely to fuck you over for no reason~~ academically rigorous. **They are $60, and you get one go at it. Military get it for free.** Some are on Carmen, you go to the testing center, log in, take a 100 question test, and suddenly you don't have to take BIO 1113. Although they are cheaper, I would recommend taking the CLEP test first. Only use EM tests if you failed the CLEP, or if CLEP doesn't offer a test in that subject. **Some tests, like Physics and Chemistry, provide formula sheets to use. Some tests, like chemistry or earth science, require permission from the department before you are allowed to take it.**  Some tests are entirely multiple choice, some are entirely essay based. Some are designed to ~~fuck you over~~ remind you collegiate calculus is different than high school calculus. **Failing an EM Test will not impact your GPA or leave any negative mark on your record, you simply fed Ohio State $60 and are barred from taking the test again.** 

If you fail an EM test, you can still take the CLEP test. Likewise, if you fail a CLEP test, you can still take the EM/Departmental Exam.

&amp;#x200B;

# Departmental Exams

*""I've been teaching ENR2100 for 12 years now and you are the first person to make this request so its very rare.""- Professor Brian Lower*

*""What?""- Fisher College of Business*

*""What are you talking about test?"" -College of Education and Human Ecology*

*""It has been a few years since anyone has requested this so the test will need to be reviewed by the course coordinator""-Random Point of Contact for BUSMGT 2320*

*"".....""-Nearly every other damn department.*  

[See what the Ohio State Testing Center has to say about departmental tests.](https://registrar.osu.edu/priorlearning/departmental-exams.html)

&amp;#x200B;

**Same as EM Tests, just taken at the college/department rather than the OSU Testing Center.** I have yet to take a departmental test, but I'm scheduled to take a bunch of them for shits and giggles. **(Military affiliated, again the test is free. Civilians pay $60.)** Many departments have no clue what the hell you are talking about when you talk to them about the test. Others are skeptical, some flat out won't return your phone calls or emails. (Looking at you Professor Slater and Professor Bomser). These tests are even more varied than the EM tests offered by the testing center. **Power move: Most Departmental Exams are either the same final the professor is giving everyone else that semester, or it is a generic final for the class. Taking the test is $60, and if you fail, at least you will know exactly what to study in order to pass the final when you have to take the class.** 

If you fail a departmental exam, you can still take the CLEP test. Likewise, if you fail a CLEP test, you can still take the EM/Departmental Exam.

# A Very, Very, Very Important Note on Departmental Testing

[Easter Egg Generator](https://classes.osu.edu/class-search/#/)

**The Ohio State Testing Center does not list all Departmental tests on their site.** The College/Department has to notify the testing center to tell them to update their site. Due to the fact that Ohio State ~~is hell bent on collecting the most money for the least amount of effort~~ there is no streamlined method that I know of to have these colleges communicate with the testing center (Aside from calling the center or emailing them, but who does that?), you may have to search for EM tests on your own. This is how I found out ENR 2100 and ENR 3300 had EM tests, along with what appears to be all CONSYSM/AGSYSM courses and a lot of medical major stuff. There is another reason why these departmental exams aren't posted on the Testing Centers website. Staff come and go. Very few people utilize these tests, despite the massive cost savings they can provide you. The lady at the front desk might only be a work studies student, and nobody told her about Departmental Testing. A professor may leave and never tell people that they had a test in place. As such, you may have to contact the department. Use the link above to see what classes there is a test for. I liked to show them screenshots from the Easter egg generator to prove my point. The general reaction seemed to be ""Oh wow, I didn't know my department even offered that, I guess I'll just give you the final for the course."" **The testing center doesn't know these tests exist, the departments don't know these tests exist, the the professors that teach the class don't know these tests exist, and Ohio State doesn't advertise these tests** **~~(Because why would they? The test is $60 and the class is what? $900, plus a book deal?)~~****. It is up to you to contact them and see if they will honor a commitment they made many moons ago.** I've had more professors contact me saying they will make a test just for me (or just hand me their pre made final) than I have go cold on me or say that test is no longer offered. **The more people that call and ask, the more likely this program is to expand.**   


# TL;DR

Tests are cheap. College is expensive. Taking these tests can help you graduate early, free up time during hectic semesters, and/or allow you to get a minor more easily. Not being required to take a stressful (or boring class) is a great feeling. 

&amp;#x200B;

For more information, PM me. I have taken nearly every CLEP test there is, and I am starting to take EM Tests/Departmental Tests now. I'd be more than happy to help you with what I know.",1583290592,1,0
Where do the used test tubes/single use equipment for labs go?,"If anyone’s familiar with how disposal works in chem/other labs, that would be very helpful. Does all of the used glassware just get thrown away or can they use them again? I feel like it would be possible to wash the test tubes and reuse them... otherwise that’s just wasteful as hell.",1583289318,1,0
Shoutout to whoever makes all these Quizlets,I’ve made a few over the years but gosh darn every time I need to study there’s one already made y’all are out here doing God’s work.,1583288027,1,0
What are our chances of getting two four person suites??,Our lottery number is 3834,1583287721,1,0
Housing,so i’ve gotten my lotto number (1851) and it says that my housing portal opens tomorrow however they have yet to show me or email me a time slot. does anyone else have this same issue? and how can i find out my time slot,1583286700,1,0
🌈 needed this,,1583284384,1,0
This was a couple hours ago and only lasted 7 minutes so thought I’d post it,,1583284162,1,0
Adding OSU email to Mail app (IPhone),I’m having trouble signing into my OSU email on my phone. I’ve been using my laptop but I can’t seem to get it to work on my phone in the Apple mail app,1583283405,1,0
Math 1151 midterm 2,[removed],1583283272,1,0
Math 1151 MT2,"I'm retaking the class after failing, pulled a 49/75 on MT1 and I'm pretty sure I got like a 50/100 on this. FML. How did yall feel?",1583282504,1,0
This entire subreddit right now,,1583278355,1,0
The result of this wacky weather,,1583278161,1,0
Seen on my way to my Calc midterm. A good omen hopefully.,,1583277744,1,0
Something to brighten up this gloomy day :),,1583277547,1,0
Caught the 5sec rainbow before it disappeared 🌈,,1583276852,1,0
A pretty double rainbow over the union,,1583276814,1,0
Praise be,,1583276650,1,0
It’s a sign,,1583276649,1,0
Double Rainbow,,1583276616,1,0
Double Rainbow,,1583276613,1,0
"Cops are arresting someone on the south end of the union. There’s like 10 cars, you should probably stay away.",,1583274607,1,0
Scientologist shit post in KSA,,1583273809,1,0
Didnt get a single,"I wanted to get a single dorm next year but I didnt get it, so now im in the general lottery. Am I still able to pick a group or am I just kinda screwed and I'll get what I get?",1583269021,1,0
Chances of worthington or Neil ave,Lottery number is 1449,1583266867,1,0
Looking for sublease for this summer,"Hey everyone, I have an internship this summer in Columbus and need a place to stay from June 1st through the end of July. PM me if you are subleasing, thanks so much",1583265079,1,0
Anyone else have this fee? I'm confused as to what it is.,,1583263446,1,0
advice from pre-med students???,"hey guys!

i’m a pre-med student at northeastern univ. in boston, and i’m looking to transfer either to OSU or univ. of cincinnati.

could any pre-med students at OSU give me any insight on how your experience is in general, what major you are and if you like it, if you like OSU, etc.?

if any of you happened to consider UC as well before choosing OSU, would you mind telling me what made you choose OSU and if you think you made the right decision?

thanks so much!!! go bucks!",1583263376,1,0
How do I view tuition and financial aid?,"Hi everyone,
I was recently accepted into OSU and I'd like to know how to view my tuition and financial aid info. There are some numbers given under SFA Status and aid summary in 'my financial aid' that I don't understand. Could someone tell me how to make sense of it?
Thanks in advance",1583261804,1,0
Advice on junior year burnout?,"So, I'm a junior here, and this semester, I've been noticing that I'm way more burnt out than I was last semester. 

This isn't new - I had this feeling this time last year. However, this time around, it's tougher to deal with because of my on-campus employment with ResLife and my obligations to my student organization.

I'm looking for advice on how to deal with this, and I wasn't sure where to turn, so I came here. Thoughts?",1583260926,1,0
campus bathrooms ?,"i’ve lived in suite/room bath but next year will live with “corridor bath” how is this different from “wing/floor assigned by gender” bathrooms, such as north campus dorms like blackburn?

also when i tried to go to the dorm with corridor bath, they were all locked so i left; do u have to live there to enter ? lmao",1583260555,1,0
GE English,Might be shut out of HDFS. How much work is PHR 2367 or Comm 2367 with Sigler. Am I better taking Classics 2200 to do a literature class. How much work is Classics?,1583259904,1,0
I've been recently admitted to OSU and I wanna change my major,I've been admitted to OSU recently for computer and information science. I've always wanted Computer Science and Engineering but the college of engineering is full. Now I want to switch to Exploration major and take classes which Computer Science and Engineering students take so once I transfer to it I don't have to take any pre major requisites. So can I switch before I even start at OSU?,1583257395,1,0
MATH 1150 Midterm 2,I did really bad on midterm one despite studying a lot for it so I asked my prof what to do to study for midterm 2 and he told me to do the problems off the slides so I did them and I’m a little more confident I also did the posted review but the review was over only like half the material so I was wondering if there’s anything else you guys have done to study for 1150 midterms thanks.,1583255496,1,0
Why can’t we get guys like this on our basketball team?,,1583254772,1,0
Why can’t we get guys like this on our basketball team?,,1583254750,1,0
Why can’t we get guys like this on our basketball team?,,1583254734,1,0
Why can’t we get guys like this on our basketball team?,,1583254718,1,0
Why can’t we get guys like this on our basketball team?,,1583254704,1,0
"Quitting gaming, selling Switch with games","Selling 1st gen Nintendo Switch with blue/red joy cons+ thing that makes it like a controller and games

Physical copy Super Smash Bros with 1st fighters pass DLC

Fire Emblem Three Houses Installed

Indie game called Tangledeep Installed

DM if interested, cash preferable, but can work something out.",1583254623,1,0
Campus,,1583254162,1,0
Campus,,1583254139,1,0
physics 1201 with Gupta,"has anyone had him before and if so, would you recommend him?",1583253535,1,0
Online VPA gen ed classes requiring minimal effort?,"Basically exactly what the title says. I am looking to take my last GE this summer online, but want something that will be an easy A bc it'll be summer and I don't want something that is too much work since I will also be taking spanish and a science course lol. I heard theatre 2100 was a good choice but I enrolled last autumn and there were like 3 plays with writing assignments about them, 2+ hw assignments due weekly, and 4 exams so I dropped it since I am not trying to spend that much time on a class I don't really care about and is not part of my major lol. Any help is appreciated!!",1583253527,1,0
Low Carb/Keto Dining Hall Meals?,"Anyone with a low carb/keto diet know what foods at the dining halls are compatible? I know the rpac has salmon, but I’m getting a little tired of just salmon and traditions chicken breast and eggs everyday.",1583252405,1,0
Michigan,We give michigan a lot of crap for losing to us in sports but they are the superior academic school by far... this is the general consensus is this correct?,1583250165,1,0
F,Anyone else get destroyed by pauls 2520 midterm 2 exam?,1583249465,1,0
How does In state tuition work?,"I got instate tuition because I live here and my parents live here, but my parents are moving out of state next January. Do I keep the instate tuition for the four years or would I have to pay out of state tuition? I just don't understand how instate tuition would work for someone like me??",1583248691,1,0
I am already done with the new USG admin even though they haven’t been elected yet.,,1583248582,1,0
time to hit the lost and found,,1583244216,1,0
I Just Want to Get to Class,,1583243415,1,0
Post grad research opportunities?,"Hey folks, so I graduated last May and have been working full time ever since. I hope to go back to a graduate or medical school program in the next year or two, and figured that getting some research work in would help boost my resume a bit. 

Do most (or any) research labs accept post-graduates? If so, is there a certain route to take for applying/reaching out? 

Thanks!",1583240770,1,0
Shamrock towing alert,"If you have a tan ford sedan in the lot behind catfish biffs, you are getting towed. You can make it if you run.",1583240204,1,0
Jones Tower Advice,"Hey! So I got really lucky my freshman year to room in Blackburn. It’s really nice, especially with the floor to ceiling windows. I have one roommate, but I am definitely a bit of a hermit and would prefer to have my own room. I got lucky again with the lottery this year, and got a single room in Jones Tower. I was wondering if anyone had any advice for living in there. Is there items I should bring that I wouldn’t have had in a double with communal bathrooms? I know the windows aren’t that big and the rooms don’t seem to have much lighting. I hate using the overhead lights when I’m in my dorm now. Any advice for that? Thank you for the help!",1583223353,1,0
Possible gunshot around W Norwich Ave?,"Around 2:15 a.m. in the Varsity Club area across from campus? I could be wrong, but it sure sounded like a single handgun shot fired outdoors. Anyone else hear it/know what it might’ve been?",1583220442,1,0
Earth science 1121 midterm,"Is anybody In / has been in earth science 1121 (preferably with lower but any advice would be awesome) that has any idea what’s going to be on the midterm? I know it’s open book and supposedly a very easy class, but everything seems very broad.",1583216604,1,0
Lei Bao fake RMP reviews,"I have noticed that Lei Bao's ratings on Rate My Professor are so obviously fake.

On multiple occasions (Around Feb 20th, 2020 and May 13th, 2016) he randomly received an influx of several generic 5.0 ratings.

I guess this post is a warning for everyone who is unfortunate enough to have him for 1250 to not believe the ratings.

 [https://www.ratemyprofessors.com/ShowRatings.jsp?tid=706060](https://www.ratemyprofessors.com/ShowRatings.jsp?tid=706060)",1583214690,1,0
Having a motorcycle or scooter as a freshman living on campus?]?,"The title pretty is the question in its entirety. I plan to live on campus this upcoming Fall semester but would really like to have the transportation option of a motorized vehicle. I read that you were not allowed to have a car as freshman living on campus, but what about a scooter or motorcycle? Thanks for any advice in advance!",1583212806,1,0
Did ya'll know the Malcolm X movie almost had a white director before they gave the project to Spike Lee?,,1583211368,1,0
The Warehouse replaces Bullwinkles: More changes to come for campus bars,,1583209718,1,0
Anybody know how to get a flu-shot at the Student Health Center?,"I only have the OSU health insurance, and it doesn't really work at a lot of places, and I need a flu-shot before break. You can't make an appointment online, and I've never been in the Student Health Center before, so I don't want to look like a lost puppy.",1583208695,1,0
Accounting 2300 Exam,Anyone else get stumped on that 4 part problem (#32-36)? Everything else went pretty well for me but I more than likely lost 36 points on those 4 alone...,1583207269,1,0
Lottery Number 3900 North Odds,We have a group of 4 and got 3900. Will we have a chance of getting into a 4 person on north or getting two doubles beside each other ?,1583207202,1,0
Chances of getting an 8-6 person suite,[removed],1583206670,1,0
Anyone wanna join my Nintendo Online Family subscription?,"It's $35 total, but we'd be splitting it evenly. I have a total of 4 people so far, which means $8.75/person but more people make it cheaper. Feel free to DM me, payments would be over Venmo. 

FYI, I'd add you to the plan before you pay me so you know I'm legit.",1583206391,1,0
Anyone have old midterms from cse 2123 I can study off of? Test bank didn’t have any,[removed],1583206103,1,0
O-H,,1583205182,1,0
Pre-Design Petition,"Hello! I made a post earlier about petitioning for transfer to the design program. When I opened the petition all it asked me for was my name, email, my desired major and my current major. No GPA or essay prompt. Is this how it's supposed to be? I'm thinking of contacting the design program just in case there's a mistake but I thought I'd ask on here too.",1583204336,1,0
BIO 1113 Curve?,I have Booton and Danhart this semester and the averages on midterms have been in the 70s. Has there been a curve for this class before??,1583204189,1,0
Update on the Geiger counter,,1583203967,1,0
Thompson library study spots,Curious to know what are some of your favorite places to study in Thompson library/campus in general?,1583203928,1,0
i got a full ride!!,"i posted about this in january when i got the morrill prominence scholarship but... i got a phone call today from the office of diversity and inclusion informing me that i was selected as a morrill distinction scholar!! so i have a full ride!

i’m still not sure where i’ll be going to school yet—so far i’ve gotten accepted to GA tech, vanderbilt, and columbia and i cannot make decisions for the life of me—but when i visited OSU in february i really loved the vibe and the campus. maybe i’ll see y’all in the fall!",1583203561,1,0
What are the chances I get into scholars?,"I applied to Honors but was rejected and received an email a few days ago encouraging me to apply to scholars. They had me fill out a form where I rank my top three programs, and I selected Green Engineering, Environment and Natural Resources, And Entrepreneurship &amp; Innovation. They all sound great and I hope I get into one. Did anyone else get rejected by honors but then got into scholars? Are the programs selective? What would my chances of getting into one be? Thanks.",1583202736,1,0
Welcome to Logic &amp; Reasoning 2020...,...where institutions that happen to have a white majority must be inherently racist. There will be a quiz on this next week! Take notes!,1581193606,1,0
"Neuro 3000, Bio 1113, Ochem 1",Hello. I am trying to figure out classes for fall 2020. I am a psychology major with a neuro minor and on the premed track. Has anyone take that combo of classes and/or be able to share their experiences with them? It is not that many credit hours however all of those classes are content heavy from what I hear and I wasn’t sure if that combination would not not be a good choice.,1581191480,1,0
