title,selftext,created_utc,score,total_awards_received
RA jobs might still be eliminated,"Hello friends, I've been getting emails requesting that we fill out information regarding our willingness to continue working as an RA, and noticed that our jobs are still up in the air. Regardless of our personal preferences, there is still a very real threat of many of us being forced to leave so that the university can consolidate its RAs. I, personally, am exhausted with the rollercoaster of emotions regarding all of this; I have gone from I'm-losing-my-job to oh-great-I-can-still-work to yeah-I-might-get-fired all in a couple of days. I get that ResLife is trying to save some money, and our jobs are rendered partially obsolete, but that still shouldn't take away the fact that we are volunteering to work with students in a very complex situation.  What are your thoughts on this new development, and what action steps could be taken?",1584400582,3,0
Admitted iPad,I have been getting a ton of e-mails and letters about the iPads that OSU gives. What are the restrictions of getting this iPad?,1584400149,3,0
You cant win 'em all :(,"&amp;#x200B;

https://preview.redd.it/5kod4cwi84n41.jpg?width=629&amp;format=pjpg&amp;auto=webp&amp;s=f7736559a4c5b04e654617ef6049d2577e28da3b",1584399890,5,0
Spectrum is offering free internet to students!,,1584396800,0,0
At this point just #CancelTheSemester,,1584395487,1,0
At this point just #CancelTheSemester,,1584395470,1,0
At this point just #CancelTheSemester,,1584395455,1,0
What is the FEH robot project course doing?,"As someone who took it in the past, I am curious how they are changing the course to an online one. Anyone here taking it now or know what they are doing?",1584395175,4,0
SP20 Semester Extended,,1584394579,2,0
Losing Scholarship due to GPA being too low,Has anyone ever lost a merit scholarship due to their GPA being too low to receive it? I need to maintain a 3.2 to keep my scholarship and I am currently at a 3.02 if my grades this semester keep up (assuming online class does not kill my grades) I will get a 3.17 which is not the required GPA. I was just wondering how serious OSU is about enforcing this? I have friends at other schools who have been below the required GPA but still have kept their scholarships.,1584394340,0,0
Academic Calendar Extension,,1584394310,5,0
Final Wave of the Morrill Scholarship,Does anybody know if the last wave of Morrill Scholarships has been sent out? I *really* want to go to OSU but financially I'm kind of banking on scholarships to allow me to go there so... yeah. I haven't seen if the last wave has been given out and this is basically my last hope.,1584394276,1,0
RIP,,1584393606,4,0
Bio 1113 scheduling,I'll be scheduling tomorrow and I'm trying to take bio 1113 however the only classes that don't start at 9am are located at Jennings hall. its not horribly far from me (like a 15 minute walk) it would just be kind of annoying to have my lab and lecture there so be walking 4 days a week down there. should i try and wait to see if more classes open up or just schedule it and live?,1584393264,1,0
Can anyone confirm whether or not housing selection is back up at this time?,"I know the housing selection process was not happening during spring break. With the extension of the break, I was wondering if that hold is still ongoing or if people are starting the process again. I'm nearly number 6000, so I wouldn't expect to know on my own anytime soon.

Also, I want to be clear that I'm not rushing anybody if things are still paused; plenty is going on and I would get it. I'm just curious. Thanks!",1584392425,1,0
How do you think Knowlton will handle design courses online?,"To the architecture students I am curious to hear how you think your studio section should handle your design class and if they announced it already, how are they handling it? The professors have sent messages asking what they think we should do and what softwares we should use that are free/cheap but for the life of me I cannot think of anything!",1584392275,1,0
Easier ECON 5000 level courses?,"Hi all, I'm trying to fill out my schedule with some 5000 levels courses and was wondering if you guys have any recommendations. I'm willing to put in the work, I just don't want to screw myself over if the material/professor is too hard.

If you guys could let you know which classes you took (with the professor's name) and thought were easy/fair, let me know. Thanks!",1584392153,1,0
How to sign up for classes?,"Pardon my dumb but whats the correct way to sign up for classes for pre-cse majors? I applied to major this semester and should get in and am in honors if that matters. Last semester when I tried to sign up for my classes in buckeyelink it waitlisted me for all my classes even though they were open, so I emailed cse advising with the classes I wanted to take and got a prompt response that I had been enrolled in all the requested courses so Im not sure if that's how Im supposed to be signing up... Also can I get into software 2 without being in the major? Thanks.",1584390840,1,0
Any idea if gyms are still open?,Title. Wanna get a lift in tonight but I don't know if JO South is open (covid-19 scare and all),1584387765,1,0
CSE 554X Courses Already Full,"I have Honors scheduling (will be a senior next autumn), so that translates to being decently high on the scheduling priority.  Despite this, one of the classes I absolutely need to take this upcoming autumn only has one section (for both 5542 and 5544) and is already full.  I fully understand staff is quite busy at the moment, so I just wanted to get some feedback on if I should really be worried that I'm waitlisted for this.  Is is more than likely that they'll create additional sections (given how large I'm sure the waitlist will become)?",1584387601,1,0
What to do about your CampusParc permit.,[removed],1584386408,1,0
"If you aren’t able to work at your campus job anymore, check out Kroger!",,1584385696,2,0
PSA: Today is the RPAC’s last day of operations,We will be closing due to Gov. DeWine’s most recent announcement. Stay safe out there.,1584385320,2,0
I am so sorry to the class of 2020,A lot of you guys had your first semester during the most controversial election in modern history and now get to spend your last semester in the middle of the coronavirus and potential recession. The universe is playing one big cosmic prank.,1584385013,3,0
When does connecting grounds close today?,.,1584384844,1,0
Grocery Shopping,"How’s the grocery situation I’m Columbus?
I’ve been hanging with my family out of state and I’m about to go back to off campus living but the news makes it sound like there’s literally no food, should I be stopping somewhere before I get to the city?",1584383909,1,0
Capstones not showing up on scheduler,Does anybody else not see the capstones for CSE listed anywhere on the schedule planner,1584383445,1,0
What is life at OSU like?,"I'm a senior in high school rn and OSU is one of my top choices. I live pretty far away so I haven't had the chance to visit campus yet, and it looks like I won't be able to before decision day. 

I've been accepted into the school of business so if you have any info about it that would be great! 

These are some other questions I have:

What made you choose OSU?

What do you love/hate about OSU?

What do you wish you would have known before going to OSU?

Thanks!! :)",1584380909,1,0
Psa: Thompson library closing for foreseeable future,"Hey all, anon employee here. Effective March 17, Thompson and departmental libraries will be closed until further notice. 18th Ave. will remain open on a modified schedule for OSU students, faculty, and staff only. All library services will be provided virtually; what exactly that means for you all, I can’t say because I don’t know. But we’re here for you as staff, and will virtually help you to the best of our abilities!",1584379523,1,0
Me making sure my dog is paying attention for these online classes,,1584379364,1,0
CSE 2111 EM Credit?,"Hey y'all, I'm thinking about switching majors heading into my Junior year, and I had a real quick question.  Has anyone here taken and gotten EM credit for CSE 2111?  I feel pretty confident with my spreadsheet abilities but I was curious to know what all is in the course and if there are any alternatives in terms of reading material or online alternatives that I could take to prepare for the exam.  Thanks for the help!",1584378891,1,0
Should I take Econ 2001.01 online in the autumn,"I’m a 4th year civil engineering major prepping my second to last semester in the autumn. One class we are required to take as a GE is Econ 2001.01. I love meeting new people so taking a class not in my major in person would be awesome cause I could meet new friends. However, I am not looking to make friends with people 4 years younger than me just stating their academic careers. I’ve done it before and it’s not my cup of tea. I end up doing a lot of hand holding. Does anyone know if this class is for mostly underclassman and if it is, is it an easy online class? Thanks!",1584378822,1,0
"Wagenbrenner Management offering short term leases, waives application fees for displaced students.",[removed],1584376501,1,0
Sublease,"Hi everyone, one of my roommates and I are subleasing our rooms in our apartment. Message me if interested; they’re two rooms next to each other with a shared bathroom in the hallway. Thanks!",1584375162,1,0
Anthropology 2200 Online at OSU,[removed],1584374123,1,0
"shoutout to the cse department for closing sections, changing class times the day people start scheduling",[removed],1584372180,1,0
"Selling Psychology 1100 textbook. There was no cover when I bought it, so the pages are in a normal binder. I’ve used highlighter in it, but no pages are missing or anything like that. PM if interested please",,1584370116,1,0
Temporary Housing Available for Displaced Students from Dorms,[removed],1584369582,1,0
Temporary Housing Available for Displaced Students from Dorms,[removed],1584368538,1,0
Too late to apply as a freshman?,"Hey guys I’m a senior in high school and I have a bit of a dilemma here. I live in Illinois and I was planning on going to UIUC, all up until now. I really want to go to OSU now but is it too late to apply now? I heard they have rolling admissions? Can someone explain what that is?",1584364757,1,0
Taking foundations 1 and systems 1 together,Will cse department allow me to take foundations 1 and systems 1 together?,1584363184,1,0
"Off campus housing students, are you staying in your hometown or returning to Columbus?",I’m currently at my parent’s for break but I’ve got a single apartment I could return to. I still haven’t decided where I should spend the rest of the semester so would appreciate your guy’s feedback.,1584360648,1,0
"As of now, The Union, Berry, Prior, and Terrabyte will be open this week. We have limited spring break hours. Additionally, there will be no dine in options, just GrubHub and to go orders",,1584359354,1,0
Free online math help,"Hey Buckeyes,

I hope everyone is staying safe and healthy while the school is shut down. At this time, classes are continuing online. I know many people rely on the mathematics help rooms on campus to understand concepts. I wanted to remind everyone that I offer FREE help on twitter (@OSUMathTutor) and on reddit. Just post/tweet me with a picture of the problem you need help with, and I’ll help you solve the question. This is a free service, and I reply all day long. I help with math up through calc II and the some calc III and differential equations. This service is FREE and will remain FREE.

Most importantly, stay healthy, stay quarantined, and don’t panic. 

Best of luck everyone.",1584359339,1,0
Anyone else get a hold on their account?,Just got a hold on my account for $90 because of a “past due balance” that I have no recollection of. I swear they better not be charging us for online classes or some shit since all classes are online now. Will call buckeyelink tomorrow tho,1584339890,1,0
Park Stradley RA Room,[removed],1584334802,1,0
Anyone have any updates on the BUSMGT 2320 Exam 2?,It was supposed to be this coming Wednesday. They moved it online before the extension of the spring break was announced. But I haven't heard anything about what they're gonna do now cause they surely can't have it during the break. Haven't received any communication about it and Carmen still shows that the exam is scheduled for Wednesday 8pm,1584330113,1,0
College Credit Plus - How long until acceptance/rejection?,"Hi, I am a junior in high school who applied for OSU full-year.  I had applied \~3 weeks ago and the label on my BuckeyeLink application status had switched to evaluated \~2 weeks ago (Specifically, it says ""Your application is complete and is in the process of being evaluated."").  Will the recent outbreak delay application results? If not, how long does it usually take to get your results back?",1584329828,1,0
CampusParc rejects request by Wexner Medical Healthcare Providers,[removed],1584327740,1,0
I have a dark confession that's been weighing on me. I'm sorry to dampen the mood but I need to get this off my chest.,"No way to say this without sounding like a total pos but:

We were at a typical drug-filled frat party. The girl wasn't the brightest so we got her faded with a drink/drug mix and threw her in a bathroom. She was passing out so my friend's first idea was to give her some of his clothes to make everything look like it was consensual (his logic not mine). All I did was keep lookout and helped change her clothes some. He sent us videos of what happened the next day and we never told a soul.

We were made to feel this sort of behavior was okay. It was even encouraged during my time there. Brothers don't snitch so I was never caught in any of this (used gloves to avoid fingerprints). But looking back I regret it everyday. I feel I'll never be able to reconcile this in my head...I can't imagine how she feels.

After we graduate I'll send an apology letter to her family. I want to be sure I have my diploma first because I don't want to risk expulsion. I'm not giving anymore details because it's not worth the risk.

If she ever does see this, *I'm sorry*. There's nothing else I can say. I feel like shit whenever I think about it and yeah...I'm deeply sorry for this whole situation.

I know this is out of the blue, but so is my head recently. Wish them the best in life.",1584327367,1,0
anyone driving from toledo to vote in columbus?? help,"Hi, I registered to vote in Franklin County with my address there, but now that spring break is two weeks long I do not have access to transportation to get to cbus on voting day. Anyone I could tag along with? I'll pay for gas.",1584325316,1,0
What if my computer doesn’t have a webcam?,[removed],1584324864,1,0
"Sublease available from now to July at Ohio Stater. It’s the largest studio room at Ohio Stater. (N High St, Columbus, OH 43201) It’s fully furnished and includes all utilities(water, gas, electricity , internet and etc) The room is super clean and nice. $980/month. Garage pass is also available.",,1584322727,1,0
Sublease available - Ohio Stater Largest Studio,"Sublease available from now to July at Ohio Stater. It’s the largest studio room at Ohio Stater. (N High St, Columbus, OH 43201) It’s fully furnished and includes all utilities(water, gas, electricity , internet and etc) The room is super clean and nice. $980/month. Garage pass is also available if you want. 

PM me for pics and more info if you’re interested!

Thanks!",1584322226,1,0
Summer course load,Do you think taking two online classes (HIST 1152 &amp; EDUTL 2368) is too much? How heavy of a course load would it be?,1584321858,1,0
A Solid Meme As We Say Goodbye To OSU For The Summer,,1584321017,1,0
Is scheduling still happening as normal?,"Hey! I know it’s not at the top of a lot of people’s list but I’m supposed to schedule for fall tomorrow and just don’t want to miss anything.
If you guys know what’s happening let me know!",1584317615,1,0
If you are broke and need food during this time,,1584316689,1,0
3D Printing,I am sad because I normally get 3D printing done through the University and now everything is closed so I can't. Any recommendations on 3D printing services I can use that don't cost $8 billion per print?,1584315830,1,0
Intramural Sports,"Are they still allowing intramural sports? Just got an email about a my game being tomorrow, but i don't believe that they are allowing us to play, are they?",1584315516,1,0
Anybody else stressed about scheduling?,"Hey guys, rising Honors sophomore here. I am super frazzled about scheduling classes for autumn semester. I left my academic plan inside of my dorm before break (was planning on returning to the dorms after break like everyone else did.) My window opens on the 17th and I have no memory of what I was planning on taking. If I get my forms when I move out (Saturday), will I still be able to schedule?",1584314541,1,0
What are some ways eating at OSU can be improved?,"We need your feedback to figure out what the best takeout program for you and your classmates is. We want to go beyond the traditional Grubhub and Doordash format and make takeout social. For example, you would be able to gift a boba to a friend before a final or impress a girl by gifting her $10 at her favorite place, Chipotle. If you could take this survey, it would help immensely. It should take 3 minutes at most. Thank you!

Link: [https://forms.gle/xqWsSppNfrWMSxtq8](https://forms.gle/xqWsSppNfrWMSxtq8)

*Also, we understand that the COVID-19 spread is a concern to you students and we apologize for the interruption. As students ourselves, we are unable to go to colleges in person and conduct our surveys as initially planned and have to bring our operations online to finish our business pitch on time.*

*We have been preparing for this competition for a while and have had our plans and deadlines cut or removed due to the outbreak; we are again extremely sorry for the interruption but this is the only way we are able to conduct our research atm. Please stay safe!*",1584313471,1,0
Assignments due during extended break,Are we allowed to have assignments due over break? I am supposed to have a part of a paper due tomorrow and the teacher has not addressed the class. I’ve messaged her multiple times and it seems like she’s gone off the grid.,1584313324,1,0
Refund for housing!!!,,1584310891,1,0
Any word on Summer classes?,Has there been any announcement as to whether or not summer classes will still be offered?,1584309578,1,0
Ohio State announces prorated refund for housing and dining services,,1584307696,1,0
How are you doing?,"This has been a stressful time for everyone, if you need to talk to someone about it feel free to reach out. I know it impacted me harder than I thought.",1584307637,2,0
OSU will be giving us refunds (info coming next week),,1584306924,1,0
Student Workers,"What's in store for student workers who live off-campus.. I don't think any of us, especially in dining services qualify for unemployment even with the changes. Some people need to pay their rent and live pay check to pay check from working in dining services.. We don't get benefits either. Idk what do do anymore.",1584306121,1,0
Ohio governor considering closing bars and restaurants due to coronavirus,,1584298461,1,0
"Sublease furnished apartment 3 bed/2 bath apartment ASAP to July 31st on north campus. Monthly rent is negotiable. The apartment has queen beds, 2 parking spots in attached parking garage, wifi/cable, washer/dryer in apartment, all appliances, gym, lounge room, and more! PM for more info!",,1584297987,1,0
Have a room in my apartment available to lease out for the rest of spring/all of summer,"I have a room in my 2 bedroom apartment available on Iuka that I won't be in until next semester starts up

The location is on north campus close by the Panda Express on high street. 

There's a parking garage available if u have a car

I'm willing to negotiate but the rent would be $400 a month along with electric, internet, and gas utilities",1584296456,1,0
The situation at OSU,"So since this whole coronavirus thing has come into effect in Ohio and we are moving to online classes, do you guys think the professors will be a little more lenient? I understand this is still college and the expectations are still high but personally I don’t learn that well from online classes and I’m afraid that’ll reflect on my grades for the semester, and I’m sure other people feel the same. Anyways, hopefully the professors understand that not everyone does online stuff that well.",1584293787,1,0
Public places with reliable internet?,"Like the title says, I'm looking for suggestions on places to go for reliable internet. I was considering the library or  McDonald's, but both are now closed due to the virus. It would be great if this hypothetical place was quiet, but I understand that that's unrealistic.",1584293502,1,0
Housing exceptions,So I asked for a housing exception not thinking I’d actually get to me but I just received news that they accepted my request. Should I actually do it? I live in smith Steeb rn and I don’t want to have to move in with someone else,1584293493,1,0
Assignments due this week,Are we still allowed to have assignments due this week with the extended break? I'm unsure if there are any special rules in place currently because of the circumstances. The majority of my professors haven't said anything and it's getting slightly concerning considering how late it is.,1584292674,1,0
Are people staying on campus moving to a different dorm?,"My request to stay on campus has been approved and the email made it sound like they are having people move to another dorm together. Is there anyone else in the same situation? 

This is the email I received:


Your Exception Request to remain in university housing until the end of the semester has been approved. As a reminder, we are planning to consolidate vacancies once we finalize the move-out process and the specific residence hall has not yet been determined.

More information will be shared later this week.

Housing Services Staff",1584292361,1,0
Are people on campus moving to a different dude dorm?,"My request to stay on campus has been approved but the email sounded like they’re having people move to a different dorm together. Is there anyone else in the same situation? 

This is the email I received: 


Your Exception Request to remain in university housing until the end of the semester has been approved. As a reminder, we are planning to consolidate vacancies once we finalize the move-out process and the specific residence hall has not yet been determined.

More information will be shared later this week.

Housing Services Staff",1584292126,1,0
OSU This is our time!! Tuesday is the big day!,,1584290875,1,0
"Should we change the title to ""offCampus Weekly""? Or maybe ""noCampus Weekly"" ....",,1584290633,1,0
April-July Sublease,"I'm subleasing one bedroom out of a two-bedroom unit at Harrison Apartments on W Lane Ave. It's $825/mo, all utilities and cable/internet are already included in the rent. It's furnished, and there's a gym &amp; laundry facilities in the building too. If anyone needs it (especially if you're stranded) you can move in as early as you want, and the lease ends July 30th. Message me on here if you're interested or have any questions!",1584289522,1,0
Campus employees,,1584288494,1,0
The Future Of Ohio Is In My Classroom,,1584288174,1,0
"does anyone know if any dining halls will be open this week? I guess we have two swipes, and I plan on being here until at least monday (gotta vote baby) but I have no idea what’s open. everything except for esspressOH is closed on grubhub. and if that’s the case that fucking sucks",,1584287872,1,0
I'm running out of ideas for new passwords at this point,,1580135007,1,0
International Business Exam 1 with Rafael Corredoira,[removed],1580133814,1,0
A post for someone,[removed],1580104981,1,0
looking for an accounting 2200 study buddy,"just looking for someone to chat with, ask questions to, and work together on quizzes (ETHICALLY) 

please pm me if ur interested! :)",1580100043,1,0
Stressed about admission,"Hey everyone. I’m a senior in HS applying from out of state for Engineering/CS. I’m worried that my app didn’t get through in time to make the Nov 1 EA deadline, and if that’s the case, that I won’t make it into CoE. Any advice or even closure on the chances of admissions would be much appreciated, because I’m stressed about this in addition to other colleges, because I haven’t been accepted anywhere yet. Thanks.",1580091772,1,0
Linear Algebra 2568 Fei-Ran-Tian,Any suggestions about the 1st midterm....what should i study?  Any help is greatly appreciated,1580074987,1,0
[CSE1222] ARRRGRRRR HELP ME,,1580067521,1,0
how do y’all study for accounting 2200?,i’m feeling a little overwhelmed there’s just so much content. everything just takes up SO much time for me and i wonder if i’m being inefficient. any tips on how you guys studied and reviewed? ty :),1580063373,1,0
So Campus Computers Save University-wide?,I need Windows for a genomics program for class but I have the MacBook Pro.  I currently running a virtual box but I really don’t like it.  Makes computer run slow and hot as expected running to operating systems.  Would it be possible to download the program on a windows computer at a library and save my progress and continue on other desktops?,1580058115,1,0
Huge connection speeds at Scott Lab on a Sunday,,1580052734,1,0
