title,selftext,created_utc,score,total_awards_received
Question Regarding Asking Professor to Teach a Class Again,"I'm a CSE major trying to plan out my course schedule. It seems like a lot of the higher level classes and technical electives I might want to take are only offered on professor's whims. For example, some classes which have been taught in the recent past are listed as being available during Fall or Spring semesters on the course page (like [here](https://coe-portal.cse.ohio-state.edu/pdf-exports/CSE/CSE-5472.pdf)) but don't show up any semester in OSU's [Class Search](https://classes.osu.edu/class-search/#/?q=cse%205472&amp;campus=COL&amp;term=1202_1198&amp;p=1). 3903 even shows up on the [BS CSE Requirements Page](https://cse.osu.edu/sites/default/files/uploads/purple_bs_cse_requirements_and_sample_schedule_au18_3341_revision_rev_062019_purple.pdf) even though it doesn't look like it's being offered any time soon.

Has anyone tried emailing a professor before to ask if they would teach one of their classes again so you could take it? What sort of response did you get?",1576474490,1,0
I got an EN on my transcript for one of my classes. What does this mean?,,1576471819,1,0
1210 final,Why are they taking so long to release the grades? I just want to rip the bandaid off and find out,1576466569,1,0
Can you get into the gym with your buckID over winter break?,,1576465881,1,0
CSE instructors,Is there a certain date they get announced?,1576464901,1,0
CS waitlist,"Hey guys, I had some questions about the cse waitlist for software 2 and foundations 1 

One of the sections I waitlisted says it has ~20+ seats open, and I’m around 10 on the waitlist. Does this mean I’ll definitely get in this section and should go to its classes the first week? I’m not sure if they’re holding those seats or something similar.

Also right now I signed up for a couple of gen eds to put me over 12 hours so I can remain a full time student. However, I’m worried that if one of the sections I waitlisted opens, I’ll be skipped over because adding one of these sections would put me over 18 credit hours. Should I go ahead and drop the gen eds? Not sure what I should do in this situation

I’d really appreciate any advice :))",1576464682,1,0
CSE waitlist questions,[removed],1576462901,1,0
CSE Waitlist,[removed],1576462285,1,0
Spring 2510 Instructors,"Does anyone know what instructor is teaching the 8 am classes MWF for 2510? Also what other instructors are teaching Spring and at what times. I've already checked the course catalog and schedule planner for any information.

Thanks in advance!",1576457900,1,0
What are some clubs that meet on days other than Tuesdays or Thursdays?,,1576457717,1,0
Study spots open late over the holidays?,Everywhere I go is closing 2-4 hrs early bc of the holidays. Does anyone know any study spots (that aren’t 18th) that are open late? Plz help,1576455141,1,0
Housing Question,"Hello everyone, using a throwaway because I don’t want my real information to be out there. Are there any RAs on this subreddit? I have question about one of the housing directors that used to work there last year. She no longer works at your university but she works at mine where I am an RA. We have a lot of issues with this particular housing director and we have heard a lot of rumors about her when she worked at your university. I was wondering if anyone could DM me that might have been an RA last year. 

Thank you so much",1576454760,1,0
Is it worth trying to ask Elizabeth Renker to raise my 92.6% to a 93% ?,"
92.6% doesn’t count as an A? 

I’m a biochemistry major that’s been putting as much effort as I can afford into this class and it just really sucks knowing I made it so close.",1576451331,1,0
Is it worth trying to ask Elizabeth Renker to raise my 92.6% to a 93% ?,[removed],1576450522,1,0
Nursing Admissions,I just recently decided to change my major to nursing from a engineering track. I finish my pre-req classes next semester and still have the gpa to apply. My concern is I just finished taking physics 1250 and the final didn’t go as planned. If I finish the class with a C or a D will this affect my chances of being admitted to the nursing program even tho the class is unrelated to nursing.,1576450274,1,0
Found this in the commencement book. I thought it was humorous.,,1576450133,1,0
At least satan is on my side,,1576444439,1,0
Is D+ a passing grade?,Asking for a friend.,1576442482,1,0
Good places to study open late?,"What are some good places to study that are open pretty late, like 11pm+? I don’t like 18th very much, so any other suggestions?",1576436034,1,0
Free Math 2177 Textbook,Hello! I have a Second Custom Edition Math 2177 Textbook. It’s missing a page in the answer key FYI. PM if you want it.,1576427230,1,0
Osu dumpster diving,Anyone ever looked through the trash at OSU? Is there ever anything good?,1576423878,1,0
"For those grads not walking today, are we able to pick up our diplomas today or do we have to wait until tomorrow?",Thanks in advance,1576422955,1,0
Oracle Application Portal Down?! Ph.D. Chem Admissions due TODAY!!,"I'm a current M.S. in organic chemistry and am applying to OSU for Autumn 2020. I was only waiting on my undergraduate advisor's letter of recommendation. I did two years of undergraduate research with them and it was a great experience besides the point now that they're a huge procrastinator and told me to remind him every day since Wednesday to write my letter of recommendation, and a phone call to them friday afternoon informed me that they were too busy graduating their Ph.D. and needed to write it this weekend. 

Now trying to check on the Oracle application portal its giving me an error saying I cannot login at this time to check the status and I still don't know if I have my application completed or not! I am only applying to Ohio State since I'm moving to Columbus regardless after I finish my Masters degree. Does anyone know why I am having these issues and if a technicality screws me over will it be fixable past the due date?

Thanks in advanced!

TL;DR- a letter of recommendation got procrastinated by my undergraduate research advisor and the application is due today but I am having trouble accessing the application portal. Help!!",1576418196,1,0
"Happy commencement day, Buckeyes!",Congratulations to the class of 2019! We'll miss you here at r/OSU.,1576398718,1,0
Here we go again.,"Idk if I am paranoid or sth, but the sound of gunshots or fireworks at exact 2:35 am for four straight days troubles me A LOT. Is this pattern of behaviors hinting at sth, maybe sort of illegal drug deals? Or could there be ppl in danger? Whatever it is, it’s freaking annoying. It’s like, like a bug that stings. Gosh, wish somebody could do something about it.",1576395814,1,0
Prospective Student (2024),"Im a high school senior from Tennessee and currently have a 3.87 GPA and a 24 ACT. Is this enough for me to at least get accepted, better yet at the main campus, I’m sure most of you will say it might not be enough or just barely so that’s understandable. Or will this at least get me considered for the other campuses? Is the tuition after financial aid applied affordable; scholarships? Alabama accepted me but it’s to expensive so I’m looking for alternatives and OSU really stands out.",1576393941,1,0
Missed the application to my major and im freaking out,Title. 3rd Year CSE. I was going to make the requirements to get into the major this semester but it completely slipped my mind that you need to apply before classes end. Im not gonna have the requirements next semester. What do I do???? I really dont want one (1) error in memory to cost me my admission to the major.,1576393143,1,0
Can someone walk me through commencement? Having anxiety,"Can’t make it to rehearsal. do I just need to know to stand up when the person in front of me stands up, walk when they walk, etc? Do we go on stage together? Walk away together? Do I have to shake anyone’s hand when on stage? Should I say anything to anyone up there? “thank you” I would guess.. Is it frowned upon to be on my phone during the ceremony since it is possibly 3 hours long? 

Also does anyone know how early my family should get there to get an ok seat? I know doors open 2 hours before the ceremony at 2 so they were thinking 1230 ish maybe 1 

Thank you so much to anyone who feels like answering this!",1576390776,1,0
Easy Econ Classes?,"I need an easy A Econ class (3000+) to complete my Econ minor. I just took ECON 4140 w/ Ethan Doetsch and thought it was a lot harder for an easy ""A"" class.",1576381242,1,0
Physics 1251,,1576379509,1,0
Commencement Tickets Question,"Lol anyone got any extra Commencement tickets I know this is last min. Also if my friends do not have any tickets are they still allowed in. If they show up the last 30 mins to take pictures, anyone know from past exprences ?",1576379021,1,0
Economics program?,Figured I’d go to the underground but how is Ohio states economics program? I’m guessing obviously high stress but is it rewarding?,1576377266,1,0
Downloading Course Content?,"So was going to download course content from this semester like I've done before, going to Carmen &gt; Account &gt; Settings &gt; Download Course Content.

However, the only course I see is one from the previous spring semester, and nothing from this semester. Why is that?",1576376347,1,0
Metrology?,"I’m an engineering student and I have been wondering for a while now if anyone has taken a metrology class here or if there even is one. Any input is appreciated.

Go Bucks!",1576372500,1,0
Made the Dean’s list for the first time ever. What happens?,Just curious I’m pretty stoked,1576365689,1,0
Graduation Tomorrow,"Does anyone know who is graduating know when we are supposed to be there tomorrow? I know the ceremony starts at 2, but when should the graduates get there?",1576365325,1,0
Can professors go back and change grades for a specific assignment if it was graded wrong after grades are due?,"So one of my assignments was graded wrong by the UTAs. While this seems super trivial, this assignment was the difference between a B and a B+ for me. Since grades are due in two days, I doubt he will be able to fix it before the semester ends. So I was wondering, can professors change grades for a specific assignment after the semester ends?",1576363938,1,0
anyone still need graduation tickets?,"have 4 extra commencement tickets, selling at $5/piece. pls take them!",1576363060,1,0
Whoever came up with idea of a 8pm Friday exam should be jailed. Change my mind...,The title says it all.,1575676551,1,0
ELI5: why does the date of new years day change every year,,1575676103,1,0
Stolen Fishing Bag,"Just want to put it out there for the area East of high street and like 10th-13th, you see a black sling backpack with fishing gear in it, please contact me. My truck was broken into two nights ago and all of the fishing gear I owned was in a black sling backpack. I know I’ll probably never see it again but it’s worth a shot.",1575675230,1,0
But why,,1575674745,1,0
Autumn 2019 Curve Megathread,"It's that time of the year, folks. Use this thread to ask about and share info you have for class curves. You can also use this as a place to rant.",1575668962,1,0
Seriously though,,1575668451,1,0
Does anyone know why tf my Carmen is like this?,,1575668196,1,0
Does anyone know why tf my Carmen is like this?,,1575668095,1,0
"Columbus' Otherworld named to TIME's ""Worlds Coolest Places for 2019""",,1575668079,1,0
Finals week,"&amp;#x200B;

https://preview.redd.it/2xe2tqwlr2341.png?width=604&amp;format=png&amp;auto=webp&amp;s=f1957b09ab28d8c12851f237cad73ff035700551",1575665324,1,0
CSE 2431 Final w/ Champion,[removed],1575665098,1,0
Ugly Tuna Raids,"The past two times I’ve gone to tuna it’s been raided and I keep hearing about people getting underages there. I just wanted to get the word out before the weekend, especially bc I know there are always a lot of raids near the end of the semester. Be careful guys!",1575664678,1,0
I now understand why college kids are sad,,1575664288,1,0
Don’t let these puny exams get in the way of your big dreams and ambitions. Save all the stress for bigger things in life. Good luck 💛,,1575663960,1,0
Room change,"Has anybody ever had experience getting a room change on campus (dorms)? Is anybody planning to do it in the Spring semester, or has a roommate doing so? Looking for some much needed advice and/or to hear of experiences.",1575663017,1,0
Yo where are my Bockrath ppl,Absolutely ridiculous. my 97 is gonna drop to 87... Press F to show respect,1575662897,1,0
Bockrath Physics 1250 Final,Oof.,1575662137,1,0
When do buckid's stop working?,Not taking classes this spring and wondering when my buckid will stop giving me access to gyms,1575661246,1,0
Curve in Physics 1250,Does anyone know if Physics 1250 has a curve ? specifically the section with Zhong,1575660176,1,0
Any 3 credit hr science courses w Lab?,Super appreciate it🙏🏽,1575660082,1,0
Anyone know if there is somewhere on campus that has the mech 2030 (dynamics) text book?,,1575658574,1,0
Where to check if I owe any fees to school that could prevent graduation?,Just a bit paranoid about it,1575656666,1,0
How does one know when the traditions halls are doing self serve? Is there a schedule or pattern for it?,,1575654672,1,0
OPEN ROOM SPRING 20,Due to my schedule and personal medical bills I’m looking to move out of my current apartment and move somewhere cheaper for the spring. Apartment is located on W Northwood about a 2 minute walk from Lane Ave. Rent is 650$ a month with internet and all utilities included. In house washer and dryer. There are 2 other people living in the house but they keep to themselves for the most part. If interested let me know!,1575654023,1,0
Shocking Picture Taken at 18th Ave Library (4th Floor),,1575648862,1,0
Fake Studiers,"I get you pay tuition to go here too, but please stop taking all my study spot...I actually go to the library regularly js",1575647983,1,0
Prof problems,"If you believe a professor is being unfair with his grading, is there any way to resolve it? 

Can I go to someone higher than him and bring it up? 

Here’s the deal, this professor doesn’t have point rubrics, so basically everything he grades is based on his personal opinion and mood. Despite meeting all the criteria he outlined (in syllabus) for each assignment (but no mention of point value for specific criteria), and turning in great work, he has taken more points from me and my classmates than we think is right or fair. 

His justification for the point deductions is weak, and everything has been along the lines of “but I wanted this...” - which has been mentioned after the assignments were turned in and not before. 

Sorry I’m not going into a lot of detail, it would be easy for people to figure out if I gave specifics. 

Has anyone been in a similar situation and challenged a prof’s grading? Any suggestions?",1575647670,1,0
Nearest drop off location to campus to send rented textbooks back to Amazon?,"Where is the nearest UPS drop off to campus? Or can I just bring my rented textbook to the Amazon hub on high street? Also, where can I find a cardboard box to put my textbook in?",1575645547,1,0
Back in my dayyyyy,"We didn't have reading days. (can you imagine? we also only had 3 days of finals)






GOOD LUCK WITH FINALS AND PROJECTS AND PAPERS EVERYBODY.



No matter what happens, it's going to be fine in the long run. So don't stress TOO much.


:)",1575639672,1,0
To those of you who have never been to the library before,"Shut YO MOUTH on the silent floor at SEL, pls ❤️. Also don’t come up there eating corn on the cob next to ppl who are just tryna study (this girl had a whole as barbecue next to me the other day).",1575618665,1,0
Java tutor,Hello I’m taking cse 2123 and I’m looking for a tutor. Please message me if interested!,1575611469,1,0
Buckeye fans be like,,1575610187,1,0
PHYSICS 1250 (Prof Dougherty),"Worried about this Final and looking for study tips, I know it will be weighted more towards relatively, thermodynamics, and fluids - the topics I don’t understand. Was just wondering if anyone had any idea of good things to study or practice problems? Also was wondering how big of a curve this class will get, currently sitting at a 76 :(",1575606906,1,0
Me Scrolling Down Reddit rn,,1575602490,1,0
Looking for a vet techs help!,"Hi everyone! I am a 5th year student that lives a little north of Hudson street. I have a cat that will be on pills every day for the next 84 days at the same time every day. I know this is a long shot...but he is very difficult and I am hoping to pay someone to give him his pill! I can do gift cards or cash, I just need to give him his pill lol. You will literally get money for 2 minutes of work. Please help!",1575600987,1,0
Ohio State management be like:,,1575600564,1,0
let’s take a little detour,,1575597654,1,0
"If the sign says don't walk, please just don't walk.","This year is my first year driving on campus, and I cannot understand how ridiculously stupid most people on campus are. I've noticed this mostly at the intersection of Neil and 12th. People crossing 12th see that the light facing 12th is red and start walking, only to almost get hit by cars turn left onto 12th that have the green arrow and therefore the right of way to turn. I almost wish campus police gave out more tickets for people jaywalking and crossing without the signal because honestly, there are so many crosswalks that if you are jaywalking you are just plain lazy.",1575595487,1,0
Does anyone know where you can get the Nike winter coat Ryan Day wears on gameday. GREY with a Black upper and the Ohio state Logo?,Just Wondering. Assuming it’s a “Athlete Special” but I’d love to get one. Thanks!,1575589688,1,0
CSE 2221 Final Questions,"Hey all,

I have my CSE 2221 final tomorrow and I'm doing my last bit of reviewing and studying but I'm pretty nervous and not sure what to expect. Is there anything that I should especially practice, or is there any advice from people who have taken it in the past? Overall, any input is appreciated!

Thank you",1575588691,1,0
"Make my friend, Bruce Banner, Tik Tok famous!",,1575585901,1,0
Final Exam Stories,"With the approach of everyone’s favorite week of the year, I thought I’d share my favorite final exam story I’ve had so far.

Last semester I had a class that normally started at 12:45 and the final was from 12-1:45. I wrote down the correct time of the final and everything, but on the day of, I mixed the two up and just had the idea that the final was starting at 12:45 instead of 12. My boyfriend called me a few minutes after 12 and asked what time my final was, and the slow horror set in that my final had already started. I was at home, so it took me about 20 minutes to run to my class, but when I got there, **the professor wasn’t there yet**. The class was completely full and everyone was just as confused as I was. Turns out he had made the same mistake I had and thought the final started at 12:45. I couldn’t believe my luck.

Anyone else have any good final exam stories? Horror stories, funny stories, etc.?",1575584668,1,0
It’s that time of year again,,1575582989,1,0
Why isn't anyone in Columbus talking about Jeffrey Epstein's connection with Les Wexner?, [https://www.columbusmonthly.com/news/20191203/what-jeffrey-epstein-scandal-means-to-columbus-and-les-wexner?template=ampart&amp;\_\_twitter\_impression=true](https://www.columbusmonthly.com/news/20191203/what-jeffrey-epstein-scandal-means-to-columbus-and-les-wexner?template=ampart&amp;__twitter_impression=true),1575581326,1,0
New TA seeking advice on how to be a great TA,"Hi everyone, I recently was hired to be a science TA. Looking back on all of your previous TAs, what have been the best and worst qualities of all of them? I want to be the best TA possible and make sure my students succeed, getting the most out of the class.  Thanks!",1575580714,1,0
Rent/lease for fall 2020,"Hey r/OSU 
I know I made a post about this before, but now I'm actively searching and advertising for a place to rent/lease for fall 2020. I already have one person (a friend of mine from high school) who's going to be moving with me, but because rent is so high in the city, I'm also potentially looking for a third signer. If you're looking for someone to take your lease, or someone to lease with please send me a message with details. Ideally the apartment/house would allow pets (dogs and/or cats), and would be close to campus or a bus stop/shuttle.  I'm not trying to go over $1050 a month, but again, as rent is pricey that number is a bit flexible. 
Here's a link to my fb ad as well 
https://m.facebook.com/groups/379832262202968?view=permalink&amp;id=1282821231904062

Hope to hear from you soon!",1575579108,1,0
stoplights not working?,[removed],1575578735,1,0
"my study spot for the day, happy reading day! go bucks!!",,1575576809,1,0
I only see these tree rats on south campus occasionally.,,1575576399,1,0
Donating clothes,I have some clothes that I brought here and haven’t worn so I was wondering is there somewhere on campus I can donate them?,1575575895,1,0
The Big Shush,,1575575437,1,0
Finals got you stressed and need a laugh? Watch this video of academic researchers losing their minds,,1575575334,1,0
Finance 3220 Final,"The final exam for finance is tomorrow, and I am unsure if it is cumulative or not. The syllabus and formula sheet seem to point towards it being non-cumulative.

Does anyone currently taking finance with Susan Clark know if the final is cumulative or not? Thanks in advance",1575574505,1,0
Tech ticket response time,So I have gone to OSU since 2017 before the iPads were given I have recently ran into a problem where the digital flagship is required for a course. Has anyone else gone through this process? What was the average response time? What was your result?,1575574286,1,0
Lost Notebook,"Hello fellows

&amp;#x200B;

Tuesday at 7:00PM I left my big important notebook under my seat in Dreese 264. I went back to look today and it was gone. I checked The lost and found in 205 and in the union with no success.

&amp;#x200B;

If you've had a class in 264 since Tuesday or have even the slightest clue hmu!!!!!!

Any and all help is appreciated",1575573505,1,0
How do upper level cse courses compare to lower level courses,"Computer science interests me greatly, but so far software has honestly bored me and hasn’t seemed interesting at all. I was wondering if the upper level courses get better in content or just overall.",1575572139,1,0
Found a USB Drive at Knowlton Hall Room 195,,1575570627,1,0
cse 3461 (networking) final with dave ogle,[removed],1575568873,1,0
and so it begins...,I still have the “I forgot to take my final” nightmares.. even though all of my finals are papers 🤦🏻‍♀️,1575568346,1,0
The 4 Stages of Grief,,1575560108,1,0
Finals Santa in The Columbus Dispatch," [https://www.dispatch.com/news/20191204/finals-santa-brings-end-of-semester-cheer-to-ohio-state-campus](https://www.dispatch.com/news/20191204/finals-santa-brings-end-of-semester-cheer-to-ohio-state-campus) 

Good luck on finals everyone",1575558674,1,0
Student Work Habits / Ideal Study Space survey,,1575557664,1,0
Math 1116,How hard is it?? Forced to take it,1575555666,1,0
Saving seats at the library,So its reading day and I got to Thompson at 8ish and there was peoples stuff everywhere on the tables on one of the floors but no people and I was like what? I slowly realized that one girl had spread her stuff out to save seats for her friends. She blocked off like 4 whole tables. I feel like this is pretty shitty? Right?,1575555561,1,0
Math 2153 Final,"Compared to the midterms, how is the final in terms of difficulty? Is it mostly focused on the material past the midterms, or is it very cumulative? Have the final tomorrow and am panicking. Has there been a curve in the past?

Thanks!",1575553732,1,0
Go Bucks,,1575534454,1,0
PSA: OSU Basketball is Legit,"Beat Cinci by 8, Nova by 25, and tonight we beat #7 UNC by 25. If you haven’t cared about our basketball team before, this is the season to start watching! Go bucks!!",1575521699,1,0
OfferUp never fails to entertain me..,,1575519322,1,0
weird bomb sounds on south campus???,,1575518443,1,0
Added Class Reserved for Graduating Seniors without Waitlisting,"I just added a section of CSE 3461 to my Spring 2020 schedule. In Buckeyelink, under ""Class Notes"", it says the section is reserved for graduating seniors, and everyone has to waitlist before being added to the class. I was able to add the class without waitlisting, even though I'm not a graduating senior.

Is there a chance I get dropped from this class because I'm not a graduating senior? I want to make sure I'll be able to take this section so I can move some other stuff in my schedule around. I'd ask my advisor but I don't want to snitch on myself or anything lmao",1575518234,1,0
"Teacher won't re-open a quiz for me when my computer malfunctioned, even though I have proof","Any idea who to contact? My teacher just said ""No. I cannot re-open it"". I don't know how to find the course supervisor so do I just go straight the Dean, or just file a grievance? Any help is appreciated.",1575517068,1,0
Does anyone else always have loading/connecting issues with Ximera?,Whenever I try to use the website it either never saves or just times out. Homework that should take me 30 mins max ends up taking over 2 hours simply due to me not being able to connect. Does anyone else have this problem or is it something on my end?,1575515888,1,0
