title,selftext,created_utc,score,total_awards_received
how does this spring 2020 schedule look?,"mac 2313-calc 3  
phy 2048c-physics 1 using calc 1  
dig 2500-fundamentals of interactive design  
cop 3223c-intro to c  
spc 1608-fundamentals of oral communication  


from what ive gathered i think im expecting a shit ton of self teaching (given my professors) which im ready for, i go to the gym and know how to manage my time so is this something i should be able to handle?",1573517945,1,0
how do I sight up for classes,,1573516127,1,0
Question for UCF photography students from Daytona State.,"I posted this also in the Daytona Beach reddit but realized it might be more relevant here.

Has any one taken PGY1800? What’s the course load like?

Also why is color theory 7 credits, is it really hard or something? I’d like to take color theory in summer, it says that’s when it’s typically offered but I’d have to take pgy1800 (photography and the digital image) in spring.

Thanks in advance!",1573514498,1,0
UHouse v. Mercury 3100,"I’ve been thinking about going off campus next year (fall 2020) so I’ve been looking at apartments. I’ve narrowed it down to UHouse and Mercury. If any of you guys lived at either of these, which one’s better? Especially with safety and maintenance?",1573513241,1,0
Anyone worked at Blaze Pizza?,"just wondering if anyone's worked there can provide some insight into how good of a place it is to work, thanks!",1573512696,1,0
Is Immunology Lab Required for Health Sciences Pre Clinical?,"Hey!

I'm on the pre clinical track and registered for the Immunology lecture. I don't want to take or need the lab for PA school and really don't need the credit at this point either, and wasn't prompted to choose a lab time when I registered.

I see the lab is on the restrictive elective page though, but is it required? Unlike lab for gen chem and bio, microbiology and physics etc. Just not sure if there's some weird like... requirement or you don't get the class or get to graduate lol

Thanks!",1573511491,1,0
Looking to take over a lease spring 2020,"Hi there, I'm looking to take over a lease for the spring semester, if anyone is interested in transferring let me know. Preferably in the UCF area with a shuttle.",1573506872,1,0
Deferred?,"I submitted my application for Fall 2020 and check my portal yesterday for it to say that I am ""deferred for further review"" or something like that.

Have any of you been deferred before and can possibly offer advice on what additional materials to send? I also heard that calling to see what they're unsure about is a good idea.

Thanks in advance. :)",1573506552,1,0
Airsoft,Hey! Any fellow UCF students play airsoft? I’m getting back into it and wanted to see if there is anyone else who plays.,1573504739,1,0
Does anybody have this or the preferably the white one with the 50 and the citronaut in XL? I’m trying to get it for a friend whose graduating. I will pay of course.,,1573504316,1,0
"Welcome to NorthView, the most expensive and ""luxurious"" housing option",,1573501373,1,0
"On webassign, Is there anyway to buy access to a single class? Or do I have no choice but to buy cengage unlimited?",,1573500875,1,0
Anywhere else but UnionWest,Is anyone else a downtown student that lives in UnionWest know about anywhere else to live that’s relatively closer to downtown that doesn’t charge an arm and a leg for rent/housing.,1573500388,1,0
Girl roommate wanted for August 2020,"I currently live in a 4x4 and will be having my boyfriend and one of his friends move in. His girlfriend doesn’t want to move in here since she has her own commitment. We would just like a girl that is super chill, neat, and quiet. She would have to be okay with living with two guys and one other girl! I just don’t want to live with 3 guys tbh. I also would like a girl that is trustworthy so neither I or the other girlfriend have to worry. If anyone is interested please pm me!

For anyone: It isn’t that I don’t trust my boyfriend rather I don’t trust other people’s motives.",1573499957,1,0
Smart Pen Survey - help me not fail this class lol,"Need 50 more people to fill this survey out. If you have the time to fill it out, it'd be much appreciated! (only takes 2 minutes to complete) :3",1573499576,1,0
Getting ready....,"A few questions:
1) I sent in my application for Northview a few days ago and was wondering when I’ll get any notification if I got approved for a room. As well as what should I do if I do get denied?
2) When will I know what Fafsa is going to cover? As well as Bright Futures (still confused if I’m getting it or not because I definitely reinstated the application after not using it for two years)?
3) I know it’s not great but I’m prepared to apply for some loans- so which one should I avoid (subsidized and unsubsidized) or just try and get any and everything I can??
4) Anyone knows when the move in day for Spring is? Only thing I got was “On-Campus Housing opens” and I think that’s the day but wanted to make sure?",1573498144,1,0
Modern Warfare,hmu if you're trying to team up and clap some cheeks on MW,1573497103,1,0
chem department in a nutshell,,1573496760,1,0
"ok Lads, how bad is Anthony altomare and am I gonna die",lads I'm freakin out cause I got Anthony Altomare for chem 2041 and he's got One (1) review that says he literally sucks do you guys know anyone who took him thank,1573496178,1,0
Light Up UCF Student Knights?,Anyone know if this is happening?,1573495375,1,0
"Second Bachelor's Degree, First Time UCF --- Registration Time &amp; Excess Hours?","Hello Knights!

&amp;#x200B;

I'm entering this Spring semester for a second bachelor's in computer science, my first being in mechanical engineering. My first degree was in UF (Gainesville) and after a few years in industry, I decided to make a career switch to computer science.

A master's degree seems to require a 4-semester chain of courses to even apply, and I didn't much like the idea of CS boot camp, thus my choice to go for a second bachelor's (for now atleast).

&amp;#x200B;

I know 2nd bachelor's like me are rare, but I have two questions if anyone out there is like me:

&amp;#x200B;

1) How are 2nd bachelor's students treated in terms of class registration date &amp; time priority? Are we like ""normal"" undergraduate seniors, or are we like low-priority non-degree-seeking students?

&amp;#x200B;

2) Does anyone know if I will be treated with excess hours surcharges due to my large amount of credit hours from my 1st degree, or does a 2nd bachelor's have a ""clean slate"" in terms of credit hours.

&amp;#x200B;

Thanks! Charge on!",1573492293,1,0
Any Pokémon Go players on campus?,"This is super nerdy, but I recently got back into playing Pokémon Go and I was hoping to add a few people. Here’s my trainer code for anyone that wants it :)  1939 2068 3731",1573491573,1,0
Hammocking Club,"Although I usually see a bunch of people hammocking by memory mall, I noticed that there's no official club and was thinking about starting one. Would this be something any of you guys are interested in?",1573490765,1,0
PLEASE take my survey so that I don’t become an even bigger disappointment to my mom,https://docs.google.com/forms/d/e/1FAIpQLSewaCrrkkkOwKIclZAsRbW4zSDZjjJnpzYtR8LZzJJQExoVPg/viewform,1573488570,1,0
alright i need friends to hang out with,i know it's almost the end of the semester or some shit but this girl really is really feeling down and i need some friend/s to hang out with preferably tues/thurs nights like around 4:15 to like idk 9p???? i'm down to do anything ... almost anything lol im not looking for a hookup or anything okay i just want to distract myself,1573486637,1,0
Orgo 2 Daoudi,"Anyone has advice or life hacks on how to pass Dr. Daoudi’s Orgo 2 class, please pm me!",1573486525,1,0
[Free] join Robinhood using my link and we'll both get a free stock worth $8 up to $300,[removed],1573484957,1,0
What happens if I don’t complete the AlcoholEdu training?,"I had forgotten about it and just got an email that it was past due, just wondering if it has any consequences.",1573484304,1,0
Is there like a petition we can sign to keep cults off the campus?,I feel like every day on campus there's always at least a couple people walking around preaching about some cult we should join. Feel like there should be a vote by students to keep people like that off campus.,1573484070,1,0
Took this picture on my phone last week,,1573483824,1,0
how do I sign up for classes,"I am trying to sign up for spring classes but I am having some trouble and keep getting this error, what I'm trying to do is get a PSY 3074 class, and PSY 3204C class, any help is nice. 

Please and thank you",1573481474,1,0
"if you haven’t found a group or club of people that you fit in with here, you’re not alone","I see people in sororities and frats, sports, band, clubs, programs, etc. that all have similar-minded friends/groups that they fit in to that make it easier to have lots of friends. looking at all those people makes me realize that I haven’t found anywhere where I truly belong here. like everybody says, it’s a huge campus and hard to find your niche, but it just seems easy for so many people. it sucks not having friends to go to the movies with or go out to eat with or even just hang out with by the reflection pond and have deep conversations. people who actually care about you. I guess I thought before coming here that I’d have a fresh start and be able to make friends with people who I vibe with, but now I feel like I’ve changed and don’t even know who I am anymore so I can’t be myself. most people I meet are nice at first but then doesn’t show any interest in being friends after that. I have a couple of friends I hang out with sometimes but no deep connections. and yes, I’ve tried going to some clubs, events, and talking to people in my classes.


just wanted to put this out there so people who are feeling this way too know they’re not the only one.",1573468099,1,0
Struggling with superior intellect,"Hello everyone. I have an issue and would like some advice. As the title suggests, I am extremely intelligent. I have struggled all my life with being significantly more intelligent than my peers. At first, you might assume that this is a blessing rather than a curse. However, some issues that my superior intellect have caused include the following:

&amp;#x200B;

1. It is difficult for me to work in groups. I often get stuck working with simpletons. Their inferior minds are to mine like a mouse is to a lion.
2. I cannot relate to most people because I'm significantly more intelligent and they don't understand me when I speak of quantum physics and why E=mc^(2) is wrong.
3. Everyone else wishes to get intoxicated and engage in coitus. Meanwhile, I'd rather watch Rick and Morty and read studies in the field of quantum physics.
4. I often feel the need to speak less intelligently to appeal to the less intelligent peers of mine. Otherwise, they don't understand me. 

Any advice on how to coexist with the simpletons that our society consists of?",1573452783,1,0
Anyone selling an iclicker2?,"Dm me, i lost mine somehow lol",1573449514,1,0
Campus closed,Hey since campus will be closed tmrw .. will shuttles be working or naw ? :(,1573444179,1,0
Am I late for classes,"So I'm meeting with an advisor on tuesday to help me find what classes I need. But yeah I'm kinda worried things will already be full. Lastly, do we have class tomorrow?",1573443840,1,0
Clubs that don’t exist but should," serious and not serious ideas are welcome.
Also, here’s the link to list of already existing [Clubs](https://knightconnect.campuslabs.com/engage/organizations)",1573442365,1,0
3x3 Knights Circle Sublease,"Subleasing my 3x3 at Knights Circle from (earliest) December 16th-  (latest) January 1st to July 1st 2020 at $780/month utilities &amp; everything included. Fully furnished, washer and dryer in unit. Shuttle to campus, you can walk as well since it is right across the street. Great amenities and great location for groceries/food/necessities nearby. Private room and bathroom. I have room B :) Room C is currently empty, and Room A is occupied by my very clean and quiet roommate who is a nurse! Knights Circle is a great place to live, management + maintenance have always helped me out as quickly and efficiently as possible. I am only leaving because I am moving into a place with friends, I have loved my time at Knights Circle. 

If you have any questions please message me :)  

https://preview.redd.it/ivogepjs2zx31.jpg?width=1440&amp;format=pjpg&amp;auto=webp&amp;s=e0362424d36280f430eda274084fc0aa123fda3e

https://preview.redd.it/20w8opjs2zx31.jpg?width=1440&amp;format=pjpg&amp;auto=webp&amp;s=1d46fcfd095f945e0a51e59a0ca7255fd1d80169

*Processing img q209owgs2zx31...*

*Processing img 8ab59vks2zx31...*

https://preview.redd.it/lqqs7rgs2zx31.jpg?width=2560&amp;format=pjpg&amp;auto=webp&amp;s=67d37189d2722606b5aadc477acdab57f2985547

https://preview.redd.it/yta0czis2zx31.jpg?width=2560&amp;format=pjpg&amp;auto=webp&amp;s=4a8b918a720281bad66b1a268d09aaa7123b30c4

https://preview.redd.it/i5ynewjs2zx31.jpg?width=1440&amp;format=pjpg&amp;auto=webp&amp;s=501c37156416807ab852c80509a34ca989159d68",1573441145,1,0
QUESTION! Why do we need 3 different numbers to tell us that shit is going down...??,,1573438401,1,0
"In need of brand design, logo design, ad.. etc","Hey everyone! I’m a freelance graphic designer and I’m interested in working with anyone looking to have a logo or brand design for your company, small business, yourself, etc. Prices vary on what you’re looking for. 

My speciality’s 
- Brand design
- Logo design
- T-shirt design
- Flyer Design 
- Ad Design
- Business Cards
- Books


My portfolio website 
https://wiaskew1.myportfolio.com/",1573434792,1,0
Towers Ethernet,"We are in Tower 3, and for our gaming devices, we typically use the ethernet ports in our private rooms, and it works very well. However, we have an ethernet port in our main room which doesn't work at all. Even though our system is registered on ResNet, our living room  ethernet port won't do anything. Does anyone know if this is a problem that maintenance can fix, or do we have to just run an ethernet cable from our private room all the way to the living room?",1573432955,1,0
Is there any 4-4 dorms available for a first year student going for fall and spring?,,1573429698,1,0
This seems like a lot of extra police presence for a burglary,there’s even quite a few choppers flying around campus,1573429406,1,0
UCF Off Campus Housing (Mercury 3100) - 4x4 Private Room and Bathroom,"Rent is $750 with utilities included (water &amp; electricity have a cap). I am looking for someone to take over my lease which lasts until July 31st, the room is available on January 2nd (Office won't be open on January 1st).

The room is on the second floor near the back of the complex, the apartment complex also has a shuttle to campus (Route 4) which brings you to the shuttle station behind Milican Hall, as well as other amenities such as a pool, grill, basketball court, and gym.

If you are interested or have any questions you can message me on here, or text me at (772) 206-5496",1573427459,1,0
"Hey everyone, my group is looking for some respondents for a survey in our product management class",,1573423614,1,0
UCF Alert,Anyone know what the UCF Alert is about?,1573422470,1,0
Looking for a Graphic Designer,"Hey everyone, I'm not sure if I'm posting this in the right place or not. But I'm a UCF business student looking for a graphic designer/artist to help me design a brand (theme, logo, package) for my business. Can anyone here direct me on where to look on campus? Already spoke with some of my professors but the people they referred weren't freelancers, who I'd prefer to work with at this point in time. Thank you!

&amp;#x200B;

PS If anyone can link facebook groups for requests like this based in UCF please do :)",1573422336,1,0
Is it sketchy to park at Garage B with no permit on Sundays?,I know parking services is closed but I don’t want to get a ticket,1573418301,1,0
Help,"I have to get 4 of my wisdom teeth removed soon, how long did it take yall to start showing up to classes again after you had yours pulled out? I want to make sure I’m not screwing myself over especially around this time in the semester.",1573418281,1,0
New LGBTQ+ STEM Student Organization at UCF,"Hi everyone, a couple of friends and I are starting a chapter of oSTEM (Out in Science, Technology, Engineering, and Mathematics) here at UCF. oSTEM is a professional development organization for LGBTQ+ students, and we need to get interested students' contact information so we can officially register with UCF and start holding meetings this upcoming Spring 2020 semester. All are welcome and encouraged to join, so please feel free to sign up even if you aren't LGBTQ+ or a STEM student, thanks!

Please fill out the Google Form below if you'd like to join our organization!  
[https://forms.gle/FbpmsnM3KcxKaSSo6](https://forms.gle/FbpmsnM3KcxKaSSo6)",1573417476,1,0
Ucf counseling,Does ucf counseling work? And can they prescribe pills?,1573414748,1,0
What's open on Veterans Day?,"I live off-campus and can't get work done at home. I usually go to the library, but it's closed on Veterans Day. Does anyone know of a quiet place to study that's actually open?",1573413794,1,0
Starbucks in HPA,"Does anyone know if the Starbucks in HPA 1 takes Starbucks card? I tried calling and nobody picked up. I know the one inside B&amp;N doesn't, but I wasn't sure about the other one. 

Thank you!",1573408664,1,0
Waitlisted number 5 in a class of 20,Impossible? Or do I have a chance?,1573407037,1,0
"Weekly Ask Anything Thread - Here's a chance to ask any question you might have about UCF! Week of November 10, 2019","Have a question about classes? Clubs? Events? Athletics? 

Or maybe you're a prospective student and have some questions about a certain degree program?

Either way, feel free to ask any and all questions you may have about UCF here. 

**Go Knights!**",1573405716,1,0
The Corrine Kaplan's who dissed UCF on Twitter,"This is her CBS actor profile. I am not shock nor surprised by what she said now. LMFAO!!!

[\\"" snarky, irreverent and opinionated\\"" can we add pretentious to that? ](https://preview.redd.it/tz7ghda01wx31.png?width=1790&amp;format=png&amp;auto=webp&amp;s=091b0c22fc6ca710225c3b85f9ebf5a43bba3edc)",1573404509,1,0
The Roast by our very own Orlando Sentinel,,1573402276,1,0
Could you guys please fill out this survey so I dont fail out of college and dishonor my family 🙃,,1573401598,1,0
Best Teacher at UCF,Who is the best teacher at UCF and why is it Alaa Hashim?,1573393794,1,0
Now we know where Ratman went,,1573370108,1,0
CHM 2041 w/ Altomere,Anyone have any experience with his classes? RMP only has one review...,1573364336,1,0
MAR3025,I’m going to start my junior at UCF next semester. I need to take MAR3025 before Completing entry requirement for business school. Should I take it @ UCF or Valencia?  I need an A to save my GPA and my financial aid.,1573356218,1,0
KSI vs Logan,Is there a streaming of the fight anywhere on campus tonight? Thanks :),1573355411,1,0
best places to cry on ucf campus?,i've cried on the top floor of garage b about a million times and it just doesn't hit the same way it used to.,1573354803,1,0
psa: eternal atake got leaked to apple music &amp; spotify,"run it up, free uzi, etc were leaked forever ago but yeah jus saying in case any fellow knights were trynna add EA to their playlist or sum. also if anybody trynna have a lil listening party hit me the frick up",1573349627,1,0
Qun Huo and Karin Chumbimuni Torres,Does anybody have experience with these professors? What are they like? How are their classes?,1573348537,1,0
Bogo domino pizza,I'm selling unlimited use till the end of the year bogo large pizza cards. 5$ for the card and every time you buy a large pizza you can get one free. If anyone is interested message me,1573347997,1,0
Zaurin / Foo Fighters - My Hero,,1573347043,1,0
Worst teacher at UCF?,Who's the worst teacher at UCF and why is it Matthew Rex?,1573345001,1,0
Any boxing viewing spots for tonight?,,1573341423,1,0
Knights Circle Sublease 2x2,"Looking for someone to take over my lease at Knight’s Circle for Spring and Summer semesters starting January 1, 2020 to July 31st, 2020 This is for a 1 bedroom and 1 bath in a  2x2, all 👩 girls apartment :) Rent is $805 a month one of the cheapest prices for this apartment layout. I'm only leaving because of family issues.

Roommate is very nice, respectful and helps maintain the apartment.

Location is extremely close to campus, you could 🚶 walk or take the 🚍 shuttle (🏆best off-campus 🚍 shuttle service at 💛 UCF)

Free gym and pool access, lots of activities, and very safe/guarded community!

It is fully furnished, includes your own bathroom inside your room, full size mirror closet, desk and chair, and dresser with bed included! Washer and dryer are included in unit. Maintenance has always addressed any issues I have had within 24 hours.

It is within walking distance of Walmart, Publix and many other food choices. Right in front of a main bus stop if you need it. 

Feel free to message me. Serious inquiries only please.",1573331776,1,0
Where can I find the seat number for classes?,"I got waitlisted for a CRW class and I'm position 5, but I can't find where the seat number is listed. Am I number 5 in line for a class size of 25 or 100, we may never know.",1573330207,1,0
Guys I think we made it since an actor nobody knows is calling us out (BTW: This Tweet got picked up by many national media people and is getting trashed ) 😂🤣,,1573325754,1,0
Gang Chen for CHS 1440 after getting an A in CHM 2045?,I’m about to get an A this semester in 2045 and was wondering how hard CHS would be?,1573325418,1,0
Classes start in a week and I'm at #6 in the waitlist. Am I screwed?,,1577760993,1,0
How to contact Professors before classes start,I'm going on a business trip on January 8th for work so I'd miss the second class of school and wanted to email my professors for the classes I registered for to notify them and to see if there is anything I should do beforehand. I also have a lab on Friday of the week and I won't be able to attend the first lab because of the business trip. How would I go about notifying each professor early on so there is no miscommunication? I'm mainly worried about the lab because I can't attend the first class.,1577759280,1,0
1000 Level Courses as Electives,"I need an elective to graduate and I'm thinking of taking a 1000 level course as a transient. Has anyone done this?

I honestly don't wanna pick up any intensive courses in my final semester and trying to keep the load light.",1577759187,1,0
How does Office of Student Conduct decide sanctions?,"I was reading about the different sanctions and the whole process for it. Myself and about 10 other people recently reported someone and we were wondering what sanction they would likely get. 

If anyone is familiar with the process I’d appreciate any help",1577754430,1,0
"Textbooks for Sale (COM, SLS, MGF)","In good used condition, asking $25 per book. 

Intro to Communications 
Com 1000 
Human Communication UCF Custom Edition 
ISBN: 9781260304145 

SLS 
SLS 1501 
Strategies for Student Success 
ISBN-10: 0357027728 
ISBN-13: 9780357027721 

Explorations in Math 
MGF 1107 
ISBN-10:  0134469046 
ISBN-13: 9780134469041

Message if interested, thanks",1577746512,1,0
Pointe at Central room available,"Hello everyone. I have 1 room available at the Pointe at Central for sublease. It is a 2/2. Spring 2020 move in. Rent is $740. Move in is available asap! Please email me at szwarcjulia@yahoo.com if you are interested.

Thank you.",1577746247,1,0
Housing Room Change,"Hello, I'm wondering how long a room change may take if I request it to housing as soon as ucf reopens? 

Background: Fall semester was very rough for me as I didn't get along with my roommate to the point that it gave me anxiety and I would stay out til 2 or 3 in the morning walking around campus because I didn't want to be in my dorm. It's been damaging to my health and my doctor said it's would be most beneficial to move out. I don't think talking will fix the situation as I already attempted that. Will they force us to talk or can I just change rooms?",1577738844,1,0
KNIGHTS CIRCLE SUBLEASE,"KNIGHTS CIRCLE SUBLEASE

Need somebody to take over my lease at knights circle, 3 roommates with gym basketball tennis volleyball and pool 20 feet from my window. 3 Boys, $685 a month.",1577738459,1,0
How is parking on the first week of Spring semester?,Is it just as bad as the fall term?,1577736445,1,0
Subleasing a room at a 2/2 Apartment for Spring through Summer!,Send me a message if you’re interested!,1577732057,1,0
How do I register my internship for enrollment?,"Hi guys, hopeful last semester the only thing I’m missing is my internship which I just got word I’d be receiving. I know I need to “enroll” it but I’m not quite sure how to on MyUCF. 

Anyone knows how?",1577731686,1,0
Talking to someone about class signups,"I am looking to speak to someone about coming back to UCF for spring classes. Is there hours, a phone number, or any way to contact an advisor? Also, where would that be on campus?",1577728064,1,0
C Tutor,"This semester, I will be tutoring students entering COP3223. I am a computer science student here at UCF that has been programming for several years. I will be offering two services: teaching C language concepts and assisted debugging. If anybody is interested, feel free to message me to discuss rates and meet-ups.",1577724762,1,0
