title,selftext,created_utc,score,total_awards_received
How do you deal with the bug bites??,"I'm from out of state, havent lived in FL in over a decade, and Ive never been this itchy for so long.

I first got bitten a TON at fright knight (was a scare actor out in the woods all night), it was all over my ankles even though i swore i had covered myself entirely in bug spray, and the bites have JUST recently stopped itching there, but I keep finding new bites and bumps all over myself and the itching is driving me insane, its been two months straight.

Do you guys just spray yourselves with bugspray every time you leave your place? Or do i possibly have bugs in my apartment that i cant see? Do bug bites normally last for a month here?? My friend doesnt seem to be getting bitten nearly as much as i am and his seems to go away much quicker too, so is being allergic to common bug bites a thing? Help",1575513798,1,0
What’s Borgon’s QBM final like?,"Does he go into details, or are they more broad questions like “what is a Bradford assay?”",1575512542,1,0
Anyone currently in or know someone who did Healthcare Systems Engineering?, I plan on doing my Masters in Healthcare Systems Engineering. I wondering if anyone out here knows more about the program or has graduated from it? Thanks!,1575509116,1,0
Anybody got advice for the final for geb 3006 (the first geb),I've been trying to get everything that i need for this final but its in videos/ lectures that go over 15 hours of footage! Anybody got advice or tips on what to focus on?,1575507228,1,0
The E-SCOOTERS,"I fucking swear to god. DON'T treat them like you treated lime bikes. Its a privilege and stick to it. I am not kidding if i see someone fucking them up, I'll call the cops on you.

&amp;#x200B;

UPVOTE IF YOU THINK THE SAME WAY

And if you dont think the same way try misusing them, so that I can whoop your dumb ass.",1575506012,1,0
I have a 7am and a 4pm tomorrow,,1575505859,1,0
Who was my drawing teacher???,"I took Drawing 2 Fall 2016. about to graduate, still don't know the guys name and i cant access the course on webcourses. He was shorter, a bit husky, always wore khakis. usually taught the class with another man who i thought was his husband (or brother?) but wasnt. pls help thxxx",1575504413,1,0
Pegasus Scholarship Awards?,"I recently got accepted into UCF (about a week ago or so), Go Knights! But, I was wondering when I would hear about whether or not I would receive a Pegasus scholarship award. Should it have been on my acceptance letter with the enclosed “what’s next?” steps or will I get a letter in the mail with scholarship info and financial aid packages later on? Thanks for any help in advance, I’m just curious to know if I didn’t receive any. Cheers",1575503597,1,0
Szumlanski CS1?,Is Szumlanski still teaching CS1? I finally got fucking verified and got my tuition hold taken off and I'm not seeing him at all for CS1 next semester.,1575501703,1,0
Apartment at The Verge,"There is a room (with private bathroom) opening up for a female student at an apartment in The Verge kind of across from UCF. The rent is $769. If anyone is interested, PM me.",1575499579,1,0
What to do if I don't meet the minimum GPA in my pre-major for the College of Busines?,"Hey guys, 

I'm currently pre-marketing, taking all of the primary core courses. Basically I'm not doing so hot with accounting for decision-makers and quant 2 and I will likely get a C for both courses and won't make 2 A's to counter them. I don't really know where to go from here, would I have to re-take a class next semester? If so, how can I stay full-time while trying to get into the major? Should I change my major to Integrated Business and then come back? 

pls help lol",1575498438,1,0
Knights Circle (4x4) Sublease Available,"Hello, reddit. I'm currently trying to sublease my KC apartment since I'm taking a semester or so off, and last subleaser flaked on me at the last second. I live in 4x4, all female apartment that is located in Phase 3 (near the front right next to s shuttle stop) and overlooking the lake and woods. Willing to pay the $350 leasing fee, and your lease will start on January 1st. Please DM if you have any questions or interest.",1575493588,1,0
Lofts 2/2 avail for Jan :),Hello! I have a bedroom available in my 2/2 for January 2nd. You would be paying the current rate the lofts has. My unit has new stainless steel appliances that were put in about 4 months ago. If you are interested DM me! I can show you the bedroom/unit.,1575492669,1,0
Just a little horsing around outside Millican.,,1575492021,1,0
The cute chick from McDonald’s,"The story goes like this (skip to the bottom if you don’t wanna hear my story):

There I was, a 19 year old kid walking into Mcdonald’s. Life was good. I was preparwd to devour a not-so-nutritional meal and absorb it i to my 19 year old human flesh. I was with my friends. For the sake of keeping their identities secret, their names were d*ckface McF*ckington, *sscheek Mcgee, and Female Companion. 

The time was 10pm flat. I say flat because the only thing that is sharp was my keen eye. So there I was, ordering my not-so-nutrtional chicken wraps and a Mcdonald’s Sprite (We all know it isn’t just regular sprite). I waited for my food and laughed with my indentured friends over something politically incorrect. I hear my name: Order ###. I shot up and walked over to the counter to see a fair skinned, redheaded, glasses wearing goddess hand me my food. I said my signature “thank you thank you.” She then looked at me from the shoes up saying “you are welcome.” and turned around sassy and stylish. I knew right then and there that I wanted to get to know the woman I dubbed as “The Mickey D’s E-Girl.” I didn’t know if she was flirting with or not until my two female friends, Female Companion and *sscheek mcgee started to go “OOOOOOOH.”

We spent minutes conversing over the matter. I knew that one day I would have to see the Mickey D’s E-girl again.

HOWEVER, SHE DOESN’T WORK THERE ANYMORE AND I NEED HELP FINDING HER FOR HER NUMBER!

😅😅😅😅😅😅",1575491696,1,0
Graduation cap and gown questions,"I went to get my cap and gown today and being the idiot I am, didn't try them on at the Alumni Center. When I got home I tried them on and the cap is way too small and the gown arms go past my hands. The length is fine but my arms don't go out without me pulling the sleeves up. And i live 2 and a half hours away so I can't just swing by and get it fixed. 

Is anyone able to give me some advice?",1575490085,1,0
HMU if you play these games,,1569393757,1,0
Turnitin help,How do you pair Turnitin with an assignment you’re submitting? I don’t see the option.,1569392479,1,0
What should I include in my Graphic Design Portfolio?,"Hello all!   
I'm currently attending my first semester at UCF and an advisor told me that portfolio reviews for Graphic Design BFA is next semester around February. I'm currently taking Drawing Fundamentals 1, Intro to Computer Art, and Design Fundamentals 3D. She said I could participate in portfolio review next semester, but I want to know what are some things I should include in my portfolio review.

I'm a transfer student, but the projects i have made in the past are of really poor quality and I need to make new pieces this semester if i'm going to be accepted. I'm not the best at drawing but I want to do my best and get accepted so I won't have to wait a whole new year to attempt it again if i end up not getting accepted.

Also, I want to practice drawing the human figure since alot of posts i've read so far really push that but since i won't be taking Drawing 2 until next semester i want to practice it before, any advice? Should i practice drawing figures from photos?

Also should i incorporate 3D models in my portfolio?",1569388191,2,0
Power outage at Unionwest,"Thought I should make a post about this. Power is currently out at the Downtown UnionWest campus. It seems to be affecting multiple buildings on the block. I haven't confirmed anything else, but I have class in the morning so I'll edit this post with any further information tomorrow",1569387489,2,0
A very specific question,"Anyone in Libra housing have any idea how one is suppose to shave your legs in the bathroom?

The seat in the shower is like mold ridden, and there’s no where else to shave that wont plague the tile or carpet with little hairs",1569383410,4,0
"How do all of you stay motivated to study and not let work, social life, family get in the way? Any advice?",,1569379670,19,0
Why do people keep sticking used paper towels on the bathroom doorhandle?,On the 5th floor of the library the men's bathroom almost always has some stupid crumpled piece of paper towel stuck in the handle on the inside of the bathroom. What the heck?,1569379175,2,0
Security????,"Someone hit my rental car the other day and fucked some shit up. They didn’t leave a note or anything and just left. Now I’m stuck having to pay a high ass deductible and now about to be dropped out my classes. Worst part about it, someone gave me the license plate of the person who did it and I SAW THE CAR AND DAMAGE and was told oh well, we don’t have a witness name. Fuck you didckheads who can’t drive",1569374196,1,0
Bros at UCF - Male Bonding!,"This is for guys who want care and emotional support from other guys.

https://discord.gg/gAHDaht

You can find dudes to hang out with at UCF and have intellectual discussion about emotionally deep topics.

Safe space where you can vent and have intelligent discussion.

---

We've had multiple meetups on campus so far, and the first time we posted about it, 40 people joined in one day.

The response has been way better than we expected.


A lot of guys at this age are focused on girls and getting wasted, so it's really hard to find dudes that actually care about their dude friends.


So if you want a gym buddy, a dude to talk to, or want to meetup and have a brohug at UCF

Check out Bros at UCF!",1569373979,50,0
Exams,"Good luck to everyone with exams this week and next week! I got my lowest score today, out of ALL the exams I've taken. I'm withdrawing from the class right now so I can save my GPA lol",1569373370,47,0
"Car crash infront of the starbucks, Moe’s, snow tea - that intersection","Be wary, looked bad :( F to the Knight😔",1569373076,14,0
Petitioners,I was just called racist because I didn't sign a petition that a black man asked me to sign. I explained to him why I didn't want to sign (possibility of my info being sold) and he continued to yell out that I'm racist in front of people. Smh I don't like it here,1569371024,63,0
Rosh Hashanah,Does anybody know whats happening for services in regards to hillel?,1569370804,3,0
I hope they at least add some cool murals or something to new robot library’s otherwise barren façades...,,1569370686,1,0
To the boys that decided to scream as a prank in the UCF library at 8pm.,"That’s obnoxious. Especially as a female going to the library relatively late at night, I just find it rude you chose to do it at 8pm on the 5th floor where they’re no employees. Not funny at all.",1569370204,99,0
These things everywhere!,,1569370055,165,0
I’m doing my part,,1569368823,1,0
Rivals of Aether Club?,"Hey, I just started picking up Rivals of Aether and am looking for folks to play with. I'm not sure if there is a club or anything, but if not, i was hoping any of y'all were down to play. If anyone's interested in playing, I'll dm you my steam info. Thanks :)",1569366780,3,0
Lost airpods case,"Hey all,

I know it's a long shot but I believe I lost my air pods case (case only) today in the business administration building. If anyone finds them, it would be much appreciated. Also, does anyone know if there is a lost and found I could check with?",1569366223,1,0
Let's hear it for the remarkable efficiency of UCF parking services,Saw a parking lot with a sea of green slips tucked snugly under windshield wipers. These dudes don't miss a beat.,1569365569,35,0
Can I get a temporary parking pass?,"I already have a parking pass for my car, but am having car troubles at the moment. If necessary can I use another car to park on campus with out a tag a possibly get a temporary pass for that car?",1569364990,1,0
Eco 2013,I have my first ECO 2013 exam today! Any advice on what to study or what is on it that I should include on my notecard?,1569364595,1,0
Where is lost and found,Found something in A CB2 lecture hall. Is there a lost and found for that building ?,1569363580,1,0
Everytime I see a shuttle,,1569363135,184,0
"Fuck the UCFPD, they ruined me and I committed no crime.","I posted on reddit that I was depressed and felt like dying because I had no friends. I was desperate for some companionship, even if it was virtual. I really, sincerely, was desperate. What happened? Why the UCFPD came looking for me in class! Thankfully, I was late that day, so what did they do? Why they called me and demanded I present myself immediately. I asked if I could just meet them after class, thinking that A) talking to the police in view of the class wouldn't exactly do wonders for my social life, and B) I was rather nervous about why the fuck they were looking for me. They told me to go to the station as soon as I was free. I, again, being scared, went. They took my ID and locked me in an interrogation room. They had my reddit post. They demanded to know if I was depressed. I said yes. They asked if I felt bad often. I said yes. Then, the detective or whatever the bitch's rank was left the room. She came back with two officers and announced I would be Baker Acted. I am not from Florida (or even from America), and I had never heard the term before. They said ""we are gonna take you to somewhere that will help you"". Still not seeing what was happening, I said that I had class in two hours (which I did), and asked if I would make it. They said sure. I was taken to the University Behavioral Center, in handcuffs.

&amp;#x200B;

""But what's so wrong with that?"" I hear you ask. ""You said you were depressed!"". Well, to begin with I was already heavily medicated AND I had my own doctor AND my own therapist that I saw every week. And if you think the UBC is good for anyone, I invite you to commit yourself there. They drugged me by force. They did so many medical tests. They told me I'd be gone in under an hour until they locked me up and said ""Oh, doctor is gone, you will see him tomorrow."" and then they dropped the act and said ""Actually, by law we keep you here for 3 days."" Great time. They didn't even let me eat with the rest of the prisoners there for a day, and yes, I will call them prisoners because we weren't allowed to be free. What else? Oh they therapy of course. They told me UCF had been alerted of my being committed and that I would have to speak to them or I wouldn't graduate. Did I mention I asked for support online because I didn't want what I felt to be commonly known? When I started crying out of despair for the situation, they had security drag me away. Great place. I hope it burns down. After 2 days, the doctor finally ""arrived"", and, after talking to me for 5 min and hearing my situation, he let me go. Wow, its almost as if, if you aren't a lying piece of shit, you might be more efficient than doing something akin to a kidnapping!

&amp;#x200B;

So yeah, fuck UCFPD. They started this hell. Fuck UBC. They continued the hell. This was a little over a year ago. To this day, I can't see a police officer without fearing for my safety, UCFPD or otherwise. To this day, I cannot see a therapist without being afraid to my very core, and feeling the same dread I felt while locked up. I am in constant fear that one day, they might decide to take me away again. And hey, it did something! Now I feel even more alone and unable to trust anyone! Thanks, UCFPD! Oh, and if anyone reading this IS from UCFPD, fuck you. Fuck you. I hope you live the worst life possible. FUCK YOU.",1569362676,3,0
Lost my dog keychain,In between my korean and intermediate math class (NCO&amp;MSB) (or maybe somewhere in business admin buildings) I lost my white/black dog keychain. If anyone finds the little guy please dm me 🙏 he’s a little over an inch tall and maybe half an inch wide and is a black/white dog.,1569358377,2,0
Selling 3 nosebleed seats to Tyler the Creator,"[65$ each](https://imgur.com/a/PIwwgVA), PM me if you want more details",1569358095,0,0
Any Ultimate Players?,[removed],1569356453,1,0
is there anywhere on campus that sells redbull?,[removed],1569355004,1,0
Get out of my apartment complex,,1569354922,114,0
Riverwind at Alafaya Sublease,"**Riverwind at Alafaya Sublease**  
4x4 female apartment. No pets. The room is available for movein as soon as you want ( like right now is totally fine). The rent would be only **$675** monthly. I had to relocate to another location. I can't be paying rent for 2 places. Help me and help yourself. Roommates are really awesome. 

Fully furnished with Washing machine, drier, microwave, refrigerator. 

DM me for any questions.",1569354323,5,0
Did anyone else see the CBP recruitment SUV on campus?,"I just saw what I thought was a police car driving along Gemini, but was emblazoned with bald eagles and American flags. It said ""CBP RECRUITMENT, JOIN TODAY!"" or something like that all over it. 

The human rights abusers are really trying to recruit college kids to detain people and put kids in cages now, huh?

Who let them on campus?",1569352580,0,0
UCF Dynamics vs. Valencia,Which is easier and any prof. recommendations?,1569352573,1,0
Only dudes named Kyle are getting good WiFi?,"Wasn't bad enough the garages are full, theres White Claw everywhere.. But they're taking our WiFi too!?",1569351659,2,0
To the people at the lofts and orion,"The tow trucks are out and about today, make sure you move your car if you're parked somewhere you aren't supposed to be (or if you don't have a decal for your spot yet). Someone just got towed... :(",1569351277,10,0
Selling Ethernet cord,I’m selling a 7ft amazon basics Ethernet cord for $5. If you’re interested PM me,1569348591,0,0
Food,"Hi y’all. Question, if I sold food around lunchtime for $4-5, would anyone buy from me? This would include a bottle of water, snack and something made by me (summer rolls, sushi, sandwiches, Mac &amp; cheese, lasagna, etc etc)... it would be healthy, delicious, and fresh!!! Let me know :)",1569347886,3,0
How do you guys feel about Testing Centers?,"Ik Engineering / CS has the EPC testing center and Business has the COBA testing center, and most likely other majors has some type of testing center they're require to go to sometimes. So i'm just curious, how do you guys feel about them, in general, as I feel like more and more professors are starting to use them more (along with Protor Hub/webcam testing)?",1569347399,2,0
Douches in Suits,"Today’s the day. You see them, roaming, saving parking spots for their “brothers”  by standing in a space for 25 min. Asked daddy to get the suit tailored so he could impress Becky in Pre-Calc when in reality he’s, sippin’ claws, screaming “There ain’t no laws when you’re drinking claws baby!”. Becky definitely gonna drip and drown when they see you walking by bud, don’t worry, you don’t gotta keep polishing your shoes every 5 min. It’s a great day to be a UCF Knight.",1569344460,0,0
Anyone know if boxing gyms around here?,"Anyone know or some boxing gyms near winter park or UCF? I’m looking for a place to practice in afternoons if anyone knows of a place that does classes etc. 

Thanks!",1569344199,6,0
Park &amp; Ride lots are full,"Where are they directing people now? The people that orchestrate the Park and Ride told me to turn around but I kept driving into the field and found a parking space. I’m not familiar with the campus at all, it’s an hour and a half drive for me.",1569343799,10,0
Is anyone looking for 2-5 GA tickets to Tyler the Creator’s 9/28 Tampa show? Please message me for details!,,1569343753,1,0
Please tell me yall saw these at the career fair,,1569342899,67,0
NSC majors please DM me!,,1569342330,0,0
A monument to my sin,Not gonna lie they're comfy as hell,1569342202,1,0
Parking today is HORRENDOUS!!!,Took me 1 hour and 30’ to find a spot because of whatever events they’re having right now at the stadium,1569339709,18,0
Game Knight Research Fundraiser for International Medical Outreach,"Just wanted to let everyone know that International Medical Outreach is hosting a game night to fundraise for our research trip to Haiti! The games consist of a Super Smash Bros. Ultimate Tournament (link below), and a general game night with board and card games. The Smash tournament has first and second place prizes, while the other games have eight baskets which you earn tickets for and are raffled off a the end of the night. 

There is no required entrance fee, however any donation is appreciated as it goes directly to the research since we are a non-profit. The tournament has a paypal link if you want to pay beforehand, otherwise we accept cash and card at the venue. 

We are hosting in BA2 rooms 207 and 208 starting at 6:00 pm Friday (9/27). Feel free to bring anyone interested, and if you are participating in the Smash tournament, bring full setups (console, controllers, gamecube controller adaptor, dock, and TV/monitor) if possible. 

We hope to see you there, and DM me if you need any more information!",1569337707,2,0
another lost wallet,"probably lost it in classroom building 1. has like, tribal design on it and a clippy thing? lmk if you've seen it please!",1569337483,1,0
Why is the campus packed today?,No garage space at all at 10:20 and University is backed up a mile. What gives?,1569335536,8,0
Plaza Millipeeeeeedssss,"Who else is pissed seeing those gross little millipedes all around the property of plaza. Let’s write emails so that they can call pest control, which I am sure they havnt done for at least 2 years now.",1569334226,0,0
Dressing up for Career Expo?,I forgot to dress like a regular person and am wearing comfortable but slightly strange clothes and I can't change before the expo is over. Is it still worth going or am I only doing myself a disservice by starting off on that rough start?,1569331782,3,0
"Use the code ""CAMPUS"" on Grubhub for $2 off your on campus pickup orders","This sounds like an ad but I'm just trying to spread the good word. Grubhub added an campus pickup option (just like Tapingo) and you can use it to skip the line at restaurants on campus like Chick-fil-a, Panda Express, and Huey Magoo's. If you apply the code CAMPUS at checkout you get $2 off. It doesn't cost anything to use either. I just got a bagel from Einstein's for $0.27. Okay ad finished have a good day.

I bring it up because I work at Huey Magoo's and whenever I see Grubhub orders I don't see the discount applied; use those deals. You're saving money and time.",1569329176,37,0
PSA: Jobs4Knights sighted in NSC,Be on the lookout. Do your part. Protect your fellow knights.,1569328971,40,0
Gym,Whats the difference between the rec center and the rwc on knights laza? Is one better than the other?,1569323869,2,0
we really need a motion sensor on the Centaurus light,,1569291906,44,0
Career Expo for summer internship?,I wasn't able to go to the internship fair last week and I am looking for a summer 2020 internship. Do you think it is worth it to go to the career expo tomorrow? I know there will be less internships than the fair last week but it seems like it is too early for summer internships. Am I better off waiting until the spring fair and applying online when more summer internships become available later this year?,1569291001,6,0
discrete mathematics for $,Any compsci major wanna take a discrete test for some money? (with proof that you've done well in the class before),1569290600,0,0
Handshake,Do you guys ever get anything back from handshake or find anything worthwhile on there?,1569289180,1,0
Education in America,"What do you think about education in America? I personally believe we have been forced into a society where we need a degree in order to work a McDonald’s, but in no way is the government making that reasonable to America without taking out loans you will never be able to pay back.",1569288924,3,0
Excuse Me?!,,1569288899,20,0
What buildings have rooftop access? (Mainly at night),We all know about Psych and while that’s cool I want to know if there’s any other places I can get up to and relax. Anyone know?,1569287188,14,0
Important,"If you’re feeling sluggish/tired/fatigued/etc etc.... GET YOUR VITAMIN LEVELS CHECKED! 
Recently found out I had a deficiency. Started taking the vitamin supplement daily. And I feel like a new person!!!!! Trust me, your body will thank ya.",1569283679,18,0
Anyone else feel like the entire Orlando area has no internet?,"This whole week I’ve been having either slow or completely down internet wherever I go: campus, home (Tivoli), and work (in Baldwin park). Is everyone else experiencing this too?",1569282694,1,0
Book I need,"I know I probably asked this before but could not find the website for it, does any one know were to get a pdf file of Biological Psychology 12th Edition by James W Kalat?",1569282074,0,0
Karaoke,"Knight Library doesn't do it anymore and the bar by full sail gets a bit too....draggy for my tastes, are there any good places that fills up mostly with students?",1569275754,4,0
"Whether European, Asian, Hispanic, or African - join SwiftSpace, the place for lovers. (www.swiftspace.co)",[removed],1569275246,1,0
What's the rule with after hours parking?,Are D permits allowed to park on B and C lots/spots after a certain time?,1569275182,4,0
PSA: This is not okay,,1569275104,67,0
