title,selftext,created_utc,score,total_awards_received
"Enjoy drawing, creating art, character design? You could win up to $500 in Knight Cash!","The UCF Information Security Office is looking for a UCF student to design our new mascot!

We need a mascot who will represent the idea of information security:  defending against scams, protecting information, and raising awareness.  Your character could appear on awareness materials, promotional items, and our online training courses.

If you are a current UCF student and would like to design a character to meet these efforts, please submit a portfolio or a collection of your previously completed work. **Deadline for submissions is November 11, 2019.**

Finalists chosen by a selection committee will receive **$200 in Knight Cash** to produce an original character design. The selection committee will then select designs for online voting by the UCF community.  The winner will receive an additional **$300 in Knight Cash.**

Review the contest rules, and how to submit your portfolio, on our site here:  [https://infosec.ucf.edu/mascot/](https://infosec.ucf.edu/mascot/)",1572446870,8,0
Orgo II Daoudi vs Frazer,Making another thread about this topic because there's so many conflicting opinions. The professors are not currently shown but from previous semesters it looks like they'll be the only 2 options for the upcoming one.,1572446195,3,0
"Even if there is no stop sign, a white line on the pavement means you need to stop",Almost every morning when I pull into wawa somebody runs the white line and will probably get hit one day. I hate to do a “to the” post but it seems that people aren’t aware of this rule,1572444270,169,0
ENC1102 Professor Recommendations,does anyone have any recommendations for enc1102 professors. I have a pretty heavy course load next semester so I’d like to know which professors to stay away from and which are good.,1572441831,6,0
Where do I go for my advisor,Sorry last post about this. I wanted to know how to check who is my advisor and how I can talk with them. Thank you guys you have helped make my freshman year very enjoyable,1572439818,5,0
Quick money:Any legit study posted around campus,Post them here I need them to pay some plane tickets.,1572437466,2,0
Application essay.,"These will probably be stupid questions, but how many paragraphs/sentences does it have to be? Is it one essay with two topics combined or two separate essays with two topics?",1572436846,2,0
Hm... full at 7:30? Seems unlikely.,,1572434868,1,0
Has anyone taken EML 3500 with Jihua Gou?,,1572431632,7,0
COP3402,Anyone here who took COP3402- System Software with Professor Paul Gazzillo and did the projects in the course can help me out with the projects for quick cash ? Hit me up or pm me. Thanks,1572430411,4,0
Can I become a tutor with a lower than 3.0 gpa? I'm a transfer student.,I have a low overall cause i'm a transfer but my ucf is like 3.31. Can I still tutor next semester?,1572415546,2,0
Internet issue at UH,"Anyone living at UH finding the internet situation absolutely ridiculous, it actually goes out almost on a daily basis. Idk if it’s property wide or just me. Right now it’s affecting me when I’m in the middle of enjoying some games with my friends, which while annoying is somewhat not a big deal. But I’m constantly on edge that while I’m doing an online exam or assignments the internet is just gonna go down on me. If anyone else has the same issues could you also email or call the UH staff, because this is starting to be unbearable.",1572414932,11,0
Fun things to do on Halloween night around UCF?,"Hi! My Gf is coming to visit me from Gainesville for Halloween.  
It's my first year here and I don't have close friends on campus but was wondering what is there to do that night? We are down for anything really, from partying to something more chill.",1572408575,20,0
Out-of-State Living learning community,"I was looking at housing info for next year (incoming freshman) and have yet to accept so haven't started a roommate search yet.  With what I've seen Neptune stuck out to me the most, however at the campus visit I attended housing made it seem like I had a better chance of winning the lottery than getting a room in Neptune.  Based on that, I noticed the out-of-state llc is in Neptune, I am an out of state student so I could apply for it.  I'm wondering what it is and what(if any) involvement commitments there are and what it is overall-google was not very helpful.  I feel like if I were to do it it would help me a lot but also that I'd be taking advantage of it to get into neptune, any thoughts/feedback are appreciated.",1572406316,4,0
Animal Clinic,Does anyone know of a preferably cheep and good animal clinic and I can take my dogs to for their rabies update? Maybe a non-profit of sorts?,1572404324,4,0
Nintendo Switch,"Hey guys and gals, have any of you perchance found a Nintendo Switch in a Pokéball case in TCH 116? 

Please?",1572403716,2,0
GEB,I’m usually really good with scoring high on Lonny’s quizzes. Not sure wtf is up with this semester?? I knew the material so well &amp; while doing it I felt good about my answers..... BUT.......ended up getting a 16/30. WWWWTTTTTFFFFFFF,1572396543,3,0
Found Keys,"If anyone lost or knows someone who lost the keys to a Nissan Rogue parked in front of the Barnes and Noble in Knight's Plaza, I found them just laying on a bench and turned them into the ticket office at the arena. 

Note: not an open invite to say they're yours and commit grand theft auto",1572393783,7,0
"Those of you who were originally Computer Science/IT majors, what do you major in now?",,1572393610,11,0
Rate my schedule,"Computer logic and organization 
Computer security 
Stats
Computer science 1
Techniques of technical writing",1572391491,1,0
I need some help,"Hello, everyone, a couple of days ago, I met a girl on here and we made plans to meet up tonight, we were texting and talking on kik, she for some reason got the impression that I was faking a number even though I'm not and by the time I messaged her she had blocked me. I think this is the only way I'll be able to reach her right now so I'm just hoping she'll see this",1572391418,0,0
CS Spring 2020 Schedule Opinion,"Do you guys think this schedule is too much? I'm for sure taking Systems, and Discrete, but I wanted to know if adding Bio and Physics on top of that would be too much of a workload. I was considering changing one of them to some easy elective, but I wanted to get some input before I did that. Appreciate any advice!

https://preview.redd.it/5v91zvhf9kv31.png?width=1060&amp;format=png&amp;auto=webp&amp;s=45865d2fd27fc75874dbf984f05b30ca5d4c6904",1572390247,3,0
Did i ruin my chance getting into med school?,**So I'm in my second year at UCF and i have been taking Pre Calc 3 times now. This semester is my third time taking it and I'm failing it once again. I looked at my grades and if i get an 80 on my final i will barely pass with a C. I want to go to med school but does this ruin my chance into getting into any at all? I am freaking out to what i should be doing as November 1st is the deadline to dropping the class. What should I do? Don't sugar coat it i know i did wrong...**,1572389697,1,0
The Art of the Perfect Shot,Granted with a university so large everyone is bound to find at least one person who they find themselves decently attracted to. So fellow knights how did you shoot your shot? Or did you just come on reddit with a “to the...” post to make up for not having the courage? Share your failures and successes (especially my girls who’ve made the first move) If it worked out how long did the relationship last or are you still together? If it didn’t would you be so bold to go for it again?,1572379700,10,0
Anyone know any good all you can eat sushi places around campus?,,1572377821,19,0
"Math Majors, I'm looking for advice and also what do your schedules look like?","I'm currently a Mathematics Major with a Computational track trying to figure out a plan for my future semesters. (Finished Calc 3 and Diffeq, currently taking Matrix and Linear Algebra) Unlike a few other majors, the UCF Mathematics degree doesn't have a track/flow chart/path so I'm currently looking at the catalog and trying to make my own. Then I discoverd Pegasus Path and that helped A LOT, but it does have gaps that simply state ""take an elective"". 

&amp;nbsp;

So now my question is what are the hard classes/professors that I should avoid or take during an ""easy"" semester so that I can focus on that course? (Because honestly, it's kind of hard to tell what will be the hard classes when you got names such as ""Numerical Methods for Computational Sciences"" and ""Introduction to Partial Differential Equations"" and ""Advanced Calculus 1"")

&amp;nbsp;

Also, what has your experience with the major been like so far?

&amp;nbsp;

Any advice as to what to expect later on in the major would be greatly appreciated.",1572375353,5,0
Subleasing a 4 bedroom 4 bathroom apartment room,"Im only subleasing one of the rooms but i didnt want to be misleading. 

There are 3 roommates who are extremely quiet. 

You would have your own room and your own bathroom, the kitchen and living room are decently sized and the apartment is on the firdt floor (no stairs). 

Rent is 699 a month with electricity, water and utilities included. 

Please dm me or leave a comment so I can dm you if you are interestex",1572374563,2,0
UCF vs Houston Football Ticket 11/02 available,"Got a guest ticket for the wrong game, so I'd like to sell it to recoup my cost.",1572374133,7,0
How do you guys stay motivated?,Especially if you’re like me and don’t really like or care for the classes that you’re taking and only attending college for career’s sake?,1572372729,31,0
Is anyone else getting destroyed by calc 2 because they shouldn't have passed calc 1?,"I had calc 1 with Oleksandr Tovstolis his first year of calc 1, and he passed me (along with a lot of other students) when we shouldn't have passed. If I was given a D (NC) I would have been able to re-take the class with no problems, but a lot of the class was curved and forced to move on. Now I need calc 2. I've taken it before, failed, took it again this semester, and now I'm withdrawing because I'm struggling with just the simple calc 1 concepts.

Is there anyone else out there going through the same thing? What can I do? If a lot of other people are going through this, I'd like to talk to UCF about it or something.

If I do get a little group together, where do we even go with our issues?",1572371862,10,0
I need to take trig/pre cal...BUT....should I take MAC 2147 instead?,"They collide for all time/day slots for the spring with my other class and really need to get them done (cant take them transient because of fin aid) my advisor suggested taking MAC 2147 instead, but uh...I'm kind of concerned as it seems a lot harder? She said it was just a combination but further research it seems that you should already have basic knowledge of calc ? Suggestions?",1572371045,2,0
Looking for Friends that Game,"I suck at making friends so I’m here looking for friends to hang with and play with. I play smite, csgo, dbd, and a handful of other miscellaneous games.",1572370028,4,0
Does anyone have extra dec 13 afternoon ceremony grad tickets?,If anyone has or is going to have any spare graduation tickets for the Fall UCF afternoon graduation ceremony on December 13 I would really appreciate it!! I’m trying to get at least five extras but I definitely could use more!,1572368671,3,0
Question about taking multiple classes at SSC,"Would it look bad, as a Bio student, to take both a math course (which I've been doing because UCF math is awful) and a chem course at Seminole? I would be taking 2 classes at SSC and 2 classes at UCF.",1572368004,2,0
Physics with Calc 2,Should I take this coming up summer or wait until Fall?,1572366219,2,0
"Sublease may 2020-july 2020, 2/2 @ the pointe at central, females only, $685/month + utilities, pm if interested :-)",,1572365571,2,0
Where can I go fishing on campus without getting shot by UCFPD?,,1572362879,28,0
Package coming,"Hey,

I'm getting a package tomorrow (Wednesday) from the academic village mail center (fedex). Does anyone have any idea when it should arrive at the center and when I can pick it up?",1572362666,1,0
Where can I go fishing on campus without getting shot by UCFPD?00,,1572361824,1,0
We need this for Engineering and CS,,1572359397,256,0
HSC3211 - Preventive Healthcare,Has anyone taken this class and which professor have you taken it with? I am trying to decide between Catherine Hearing and Fazal Jameer but the ratings for both of them are pretty average. Any input is appreciated!,1572357445,2,0
The moment of truth,What is the majority in UCF? Iphone or Samsung users?,1572355157,0,0
Is it worth getting a Windows workstation laptop as a student majoring in CS,"...or will my 2015 MacBook Pro get the job done in all CS related courses. Will I ever be crunching numbers? Will I benefit much from using Windows? I’m more concerned with the difference in operating systems, and also if a higher cpu performance is needed.  I don’t want to partition the little space I have left, so boot camp is not something I’d want to do. Rather buy another laptop dedicated for my CS degree program if necessary.",1572354939,1,0
she called herself “adrea” (737-990-7931) &amp; said she could take over my lease as soon as possible. then she asked me to pay her $199 to cover a nonexistent “transfer student fee.” moral of the story is don’t use your actual phone # if you’re in the subleasing game &amp; always trust your spidey senses,,1572353527,1,0
Fill out my survey please?,https://forms.gle/AErLJnVmozoQdzGk8,1572328890,5,0
Withdrawing from class,"Does withdrawing from a class make it so you don’t have Pegasus or bright futures anymore? I’ve looked online, but I can’t really find clear answers to this.
I’ve been having an extremely difficult time with my mental health while taking Anatomy this semester and I really think I need to withdraw. Who on campus could I talk to about this?",1572325680,2,0
"How can I tell if a course is ""Service Learning"" before I enroll?","I am a I/O psych major, transfer from Valencia, and I'm currently in my first semester at UCF.


I had to drop a couple courses at the beginning of this semester because I didn't realize they were SL and I don't really have the time/desire to do that right now. 


I suppose it's possible that these courses are all SL, but the catalog made it sound like some sections are and some aren't. If that's true then will it say SL when I'm enrolling or....? 


Thanks in advance!",1572319942,6,0
ZOO 4743 with Samsam,"**How hard is Clinical Neuroanatomy and Neuroscience (ZOO 4743) with Samsam? I got a B on anatomy with him but it was a 6 weeks summer, and I was also taking other classes.**",1572317216,2,0
"I gotta say, I'm a little disappointed that whoever carved these guys didn't at least add some of those fake flickering candles to really set the mood",,1572314859,27,0
D&amp;D,Any D&amp;D groups on campus? I’m interested in getting into it.,1572311704,3,0
Canon EF 35mm f/2 IS USM with accessories,"Canon EF mount 35mm f/2 IS USM Comes with breakthrough X2 3 stop 67mm ND filter, polarizer filter, lens caps, ND filter case, polarizer case and original box.

[https://imgur.com/a/EMkM1lK](https://imgur.com/a/EMkM1lK)

$450 but negotiable",1572308291,2,0
Help me out with my midterm by doing a survey!,"I need like 30 more responses on my survey, it will only take a minute and I appreciate anyone who takes the time to fill it out, thanks!

https://forms.gle/BtAZm8eANhabfz8S7",1572308066,8,0
Memes to help survive the rest of the semester,,1572305962,1,0
Interdisciplinary Studies Degree,I am considering an MA or MS in interdisciplinary studies. Does anyone know if your degree states what the two disciplines / focus is? Or would employers have to judge based off curriculum alone? Thanks.,1572305074,3,0
Does UCF offer student health insurance?,,1572300875,9,0
How to regain Financial Aid Eligibility,"So I did a Syllabus Quiz that was supposed to count as my financial aid eligibility for a course. I did the quiz, but for some apparent reason, it didn't register for my financial aid, and now my Pell Grant was reduced. Do you guys know any way that I can ""regain"" my financial aid eligibility?",1567750097,6,0
"Friday 6th, September, 2019 aprox. 1am at Libra Citrus, i’ve done it",,1567747070,273,0
See y'all tomorrow,We were so close to having 9 straight days off...,1567744431,29,0
"The Anime Spot Launch Party is Friday, 7pm in the Key West Ballroom","Fan of anime, manga, k-pop, light novels, asian drama, cosplay, and want to meet other knights like you? Come on out to Anime Spot's Launch Party tonight at 7pm in the Key West Ballroom!

We will have pizza, drinks, music, and activities as we introduce Anime Spot and get you acquainted with what we do. Come on our and have a good time!",1567741954,16,0
VA Payming The School And Pell Grant,"Hello All!

I just checked my account on MYUCF and my Financial Aid Awards paid most of my tuition.  I am going to school on my Chapter 33 benefits. I know that I will get my Financial Aid when the VA pays the school but, is that pretty quick? Just looking for a timeline.",1567740929,4,0
Did I just fuck up my financial aid???,"Alright, so I'm a dumb freshman. I got Bright Futures senior year and was pretty happy about it but I still needed money for my housing, right? So I took out a loan as my parents suggested. Tonight I heard about people getting their BF stuff posted on my.UCF so I checked it out. I guess they put the loan towards tuition and now I have only about $700 in BF money. Looking back I feel kinda stupid but I'm also freaking the hell out. I really can't afford a mistake like that :( has anyone else had this happen to them before? I know they just posted all the info so could it just be a mistake? Ig all I'm really looking for is reassurance or someone to tell me I did in fact fuck up... idk man",1567737484,3,0
Tuition and Bright Futures question,"Hey all. I got the Florida Medallion Scholar award where 75% of my tuition gets covered yet when I check to see the amount due for tuition it still says its $2K when it should be $700ish. What should I do? Also it says my tuition is due November 1 this year, is that normal? Thanks!",1567735451,1,0
Parking rules,Can someone explain what’s the difference is between last year’s parking rules and this year’s? Where do license plates come into the picture if we still have the same decals/hang tags?,1567734491,1,0
Is there a Tekken scene here at UCF?,"I'm looking to play some Tekken 7 irl, anyone know if there is a weekly thing for that?",1567734350,1,0
Apollo grant,"Was wondering if any of guys got the Apollo grant for this semester, I got the Apollo grant last spring but it’s not on my fee invoice for fall 2019. Maybe it might show up randomly like last time?",1567734329,2,0
Music Production for broke people,"My name is Liam and I'm new to the UCF community. I have been self producing music (mostly alternative/Indie) and am trying to know more people around that are into creating songs. I want to meet others to learn more about DIY recording and music production as well as other artists who make their own songs, that would be pretty sick. Any information regarding venues, open mic areas, and other musical communities on campus would be super cool too just lmk.

\-My Band: instagram-@woodlawn\_

\-My Bandcamp: [https://wisterial.bandcamp.com/](https://wisterial.bandcamp.com/)",1567733949,6,0
If you’re still waiting on an email confirming your refund type F,F,1567732453,11,0
Finally found a good use for the Touchbar,,1567731810,5,0
Financial Aid not showing up?,"I'm supposed to have full bright futures and some Florida pre-paid but under the fee invoice the all of that stuff says 0. Also, under the view financial aid and accept/deny awards tab it says no financial aid information found. Is this normal??",1567731175,3,0
FAFSA trouble (pell grant),"I just received my financial aid disbursement, but it was a much smaller amount than I was expecting. I looked on myUCF and my Pell Grant wasn’t applied to my disbursement. The check box to accept the grant was greyed out. Please enlighten me to what may have happened. Thanks.",1567730279,8,0
Plaza on Univeristy,"Lets say I lost my keys and got new ones from plaza. 

Now I found the lost keys, do they deactivate the older keys?

&amp;#x200B;

&amp;#x200B;

I think they do, but I just want some confirmation here.",1567729841,1,0
Do other states have a scholarship similar to bright futures?,"If not, we are very fortunate and blessed to live in a state that offers us an opportunity to receive a scholarship that pays for our entire undergraduate college tuition.",1567729612,21,0
bright futures,"for the top tier of bf they give $300 for books. does this go into the account i set up for direct deposit? if not, what do i have to do?",1567728752,3,0
When that rent hits,,1567728667,45,0
When that financial aid hit,,1567728590,124,0
"Help!!! I lost my stuffed bro named Leo-n on the way back to my apartment from Libra Garage. I live in Nike, 1st bldg. coming out of the garage. Most probably dropped him within this path, or maybe the first flight of stairs to the 2nd floor. Pls notify me if found!!!",,1567728525,297,0
When that Financial Aid hit,,1567728484,1,0
NorthView WiFi ...... sigh,"god the irony. anyone wanna spam call spectrum about this again?

![img](eizbhsxt7vk31)

![img](w1u88ygv7vk31)",1567728442,7,0
Question about my refund? Help?,"I checked my fee invoice and my fee assessment was 3,194.00.

I was notified for a refund of 943.95.

Which is off because I am being given 8836 for the semester.

Can someone explain why on my fee invoice is says BF Florida medallion scholarship and my Pegasus scholarship being subtracted as a payment of 4,138.15?

I have a lot more grant money as stated to total as 8,836. I am just wondering why my refund if off. I plan on contacting financial aid tomorrow, was just curious if anyone with more experience had answers or a similar situation.",1567727170,0,0
Anyone’s pull grant show $0 accepted?,On myUCF my pell grant shows the amount to pay for my classes this semester but $0.00 accepted. Anyone else?,1567727023,1,0
Anime Spots Launch Party is TOMORROW!,,1567726948,1,0
Anyone have any reccomendations on where to sell back old textbooks?,I’d prefer to get back more than 12 cents.,1567726371,1,0
Finally that sweet sweet Fin Aid,,1567725820,16,0
EOS Apartments DnD,Does anyone know of the people who play DnD in the EOS apartments lounge?,1567725445,2,0
BSC2010C lab purchase question,"So in the lab syllabus and messages on Webcourses, Yeargain mentioned that the *only* two places to buy MyLab and Mastering were in the website itself or at the UCF Bookstore, including ""Trust me - you cannot purchase access from a third party website, from another student, etc."" 

Is that true? Or can I just buy the code off Amazon and save me a good bit of money? Thanks.",1567725271,6,0
Playing football at memory mall (again),"Anyone interested in playing football at memory mall once a week for an hour or two? You don't have to be good, it is just for fun. I made a groupchat so contact me so I can add you.

I work during the week so I can either weekends or weekdays after 5:30. Let's go next week sometime.",1567725103,6,0
How many people at UCF have the full bright futures scholarship?,"I know there's no way of truly finding out, but how many people do you think have the full bright futures scholarship (FAS)? Or even percentage, what do you think is the percentage of students who have the full bright futures scholarship compared to those who don't have it?",1567724542,5,0
Buying iclicker2,Pm me,1567721792,1,0
GEB3006,I don’t have to attend every single class of GEN2006 right? I Mean I could just watch the it online?,1567721323,1,0
"My Bright Futures has kicked in, but when will the other financial aid stuff come in? (grants etc)","I’ve got 3 grants that will cover whatever my Bright Futures hasn’t paid for, but when can I expect this to kick in?",1567718925,17,0
"My bright futures payment kicked in today, what about y'all?",Just writing this post to give those who have been waiting for it to have peace of mind,1567717633,12,0
Housing Payment,"Hey All,

Sorry if this has been asked already, but according to myucf my housing payment is still due tomorrow. Should I worry about this if im anticipating financial aid to cover it?

Thanks",1567716688,4,0
Tuition Late Payment Fee,"Has anyone ever had luck waiving the late payment fee of $100? 

Its my fault I didn't pay it on time but its my first time missing it so I was wondering if i could call the collections number and get it waived. 

Thanks!",1567715380,0,0
Speed reading and study skills program,"I am a first yr student with a criminal justice major. I was sent through mail and email information about the above mentioned reading program. It seems pretty great opportunity since my major warrants extensive reading and any type of  reading improvement would benefit myself. I don't doubt that this course would be beneficial. What has me double thinking it, is the price. Total is $340.54 for 2 weekends (Sat-Sun, 9-12). Does anyone have insight on this course? Is the course worth the price?",1567714850,6,0
