title,selftext,created_utc,score,total_awards_received
Friday 13th tattoo deals near ucf,Hey guys! Does anyone know of any tattoo places doing deals for the 13th?,1568347900,2,0
Rape whistle?,"Hey is their anywhere on campus to get a free rape whistle, i got a free one on campus b4 from and event but i lost it",1568346860,0,0
Has anyone taken Visual Communication with Gary LaPage?,Looking to buy the textbook for the low!,1568342916,1,0
See y’all tomorrow,I’ll be at Millican at 9 if anyone would like to join me,1568341027,7,0
Can we store whatever we want in our Microsoft OneDrive?,"My MacBook and my phone are running out of space, and I don't want to go out and spend money on an iCloud subscription, an external hard drive, or any other cloud storage subscription. I then remembered that we have Microsoft OneDrive. How many gigs or terabytes do we get and can we put whatever in there? I mostly want to put my overload of old photos/videos in there.",1568340101,1,0
Can't upload file to Eustis COP 3223,"Hi. I'm trying to upload a file to Eustis through Win SCP for my Intro to C class, but whenever I do it I get ""Permission Denied"". Anyone else had this problem ?",1568339877,1,0
"I’ve gotten three parking spots this semester and I just found out UCF made $1.5 million off parking tickets in 2015, so I’m kinda mad. Lol",[deleted],1568336587,2,0
Can you deposit financial aid check online?,"Mine came in today and I was wondering if I can deposit online via the phone app (fairwinds) or if I have to actually go in person, because usually I just deposit online for every other check",1568335117,2,0
Who else didn't get their disbursement today?,"Tuesdays and Thursdays are apparently the days disbursements are released. Every ding of the email notification today was a burst of hope and then disappointment. 
Here's to those of us still waiting. May next week be our week. 
Side note, anybody have any luck selling feet pictures from that earlier post? 😂 I'll hang advertising up in the MSB bathroom, I'm broke.",1568334384,8,0
Where to tailgate without a Memory Mall spot?,My friends and I missed the Memory Mall tailgate reservations on Sunday. Does anyone know of a map or something that shows us where we can set up a tailgate on campus outside of that area?,1568333890,3,0
Here we go again... [x-post],,1568333454,1,0
"You’re welcome, UCF",,1568333397,1,0
Any students giving piano lessons?,I’m brand brand new to piano and really want to get good at it. Are there any students on campus that give lessons?,1568332771,8,0
how to quit my job,"so if i quit my job at aramark, can i move to another aramark job? i have never quit a job before someone pls help. what do i do",1568329545,5,0
Project tips for CS majors,Does anyone know what projects I should work on or get involved in as a first year CS Major? I am familiarized and experienced with coding for a few years now but I want to eventually be a software engineer / programmer for a big tech company or any. What can I do to boost my chances and what are things I should do that stand out on a resume?,1568328033,9,0
Working for Housing,"After applying for a job at Housing, about how long does it take for them to get back to you? Or any job on campus? I applied to housing and the student union so I’m just wondering when (or if) I should expect a response. 

Thank you!",1568326148,2,0
How do I withdraw my intent to graduate?,So I filed it in before this semester just in case and now I don't want to graduate this semester anymore. Does anyone know how to withdraw?,1568324340,3,0
Anyone in COP 3223C I need help.,Anyone that has successful done the first homework can you pm me I don’t know how to setup my gcc to run my program. Thanks!,1568323340,4,0
Kittens at CAPS,,1568323292,262,0
Yeargain’s Bio 1 Class Help (BSC 2010C),"Hii Knights! 

I have a question regarding how to do well in Yeargain’s class. How am I supposed to do it? Her class feels so overwhelming. It’s the 3rd week and we’ve done like almost 6 chapters and our test is on Friday and I’m unsure of what it’s going to cover. This is my first fall semester in college and quite frankly I feel doomed. Anyone got any tips?",1568323095,12,0
still no internet at uHouse!!!,"i crave death, do any of yall crave death as well?",1568322418,12,0
UCF Tissue Engineering Bradley Willenberg,So I’m taking this class this fall and was wondering what all I needed to study for the quizzes and tests? Do I have to read the articles he posts or just the PowerPoints?,1568320388,1,0
"Umm, anyone else seeing what's going on outside the library???","Theres the guys out there preaching you're going to hell for being gay, theres a women outside holding a sign that says ""I need to poop"" and there getting into screaming matches. And apperently this has been going on for years now??? And they also apparently have a history of going up to students with armies of kids and harassing them. Wtf is this campus.",1568319925,49,0
Petition people inside buildings now,"I’m just trying to study and I’m getting attacked.
They’re everywhere. You can run but you can’t hide",1568319160,29,0
Free printing @ AKS and SU,Any updates on if the free printing is up again yet?,1568318630,1,0
Apple TV for Sale,"Hey everyone, I have an Apple TV which I know could be pretty useful if you’re living on campus. I have no use for it since I have an Xbox and smart TV so all my apps are on there already, but if you could use one let me know!",1568316491,4,0
Towers gym,What’s the best time to go to the gym near towers? When is it least crowded?,1568316378,1,0
Looking for Pokemon Go Friends!!,Let's be friends in Pokémon GO! My Trainer Code is 4364 7840 2552!,1568313889,11,0
Is the pegasus shuttle running today?,It's not showing any eta's in the app today. Does anyone know if it's actually running or if it's just an issue with the trackers?,1568313410,2,0
Is it worth it to bike to campus?,"Hey guys, 

I live off of Mcculloch and was wondering if it would make a huge difference in my life to bike to campus as opposed to taking the shuttle. 

The reason I’m considering a bike is because the last few days I have been late to my classes and penalized for the bus being extremely late. Today tops it, I left for my 9am class and waited for the shuttle from 8am until about 8:56 when it showed up. I was extremely late to class and my grade went from a 100% to a 40%. Yesterday I was late for an event and lost a spot that was pretty important to me for me, even though I left early. 

How bad is it taking a bike to campus?",1568312712,7,0
W Soccer today. Who’s going?,#chargeon,1568310571,2,0
MSB Locker not Working,"Okay, I feel like a total dumbass. I was tryna lock some stuff in one of the lockers, I paid the 50 cents and everything, and I just can’t grab the key out, like legit I felt like a psychopath tugging on it like crazy. Who do I grab to help me with it 😂",1568309669,1,0
What happens if my UCFID is stolen?,"Hey, 

So I was signing up for an advising next week over the phone with First Year Advising. They asked for my UCFID so I gave it to them. I dont think anyone nearby was listening in the hallway was listening, but if someone did and wrote down my UCFID, how bad would that be?",1568308509,3,0
Where is the best place to park?,"Tuesday I spent an hour trying to find a place to park, and ended up being late to class (rather than missing it entirely) only because I was lucky enough to be the first one behind a car that was leaving, so I was able to snag their spot. 

I don't want to have to do that ever again. I read somewhere on here that someone mentioned a ""commuter lot"".. first time I've ever heard of such after being here for nearly 4 years. It's not displayed on the Parking Map at all ([https://map.ucf.edu/parking/](https://map.ucf.edu/parking/) ), and typing in the search box for the commuter lot displays 0 results. So maybe they were just trolling, idk.

Any recommendations for where I should park?",1568308026,1,0
Looking for MAD 2104 (Foundations of Discrete Math),Just looking for some extra help in this class. If interested just send me a dm with your information so we can get in touch.,1568307067,1,0
Gym Buddy,I’ve been wanting to get into shape for a while now and figured that this is as good as time as any to get going. I’m just pretty new to all this and I’m not entirely sure how to necessarily get into shape so I’m asking that if anybody would like to take me under their wing I would be really grateful!,1568305922,6,0
Refused my first petition today.,The guy looked so sad. I guess it was because I wouldn't sell my info so he'd get paid 🤷‍♂️🤷‍♂️,1568303221,33,0
Setting-up Alexa Echo Dot under the Plaza at University wifi network (MyCampusNet),"I’m having trouble setting up my echo dot under the mycampusnet wifi network. Has anyone been able to successfully set-up their echo dot? If so, how?",1568301684,1,0
Wtf happened to the fries,,1568299581,42,0
How are people enrolling for spring already?,Im curious because im trying to take human anatomy in the spring and the classes are already getting filled up but i cant seem to enroll myself,1568298535,2,0
tfw,,1568298516,38,0
Scantrons Downtown,Does anyone know if SGA is giving out free scantrons in downtown or if there are any vending machines that have them over there?,1568297323,5,0
Need someone to take over Marquee lease 1 bed/1bath,,1568296591,2,0
Disney,"Anybody here work at Disney and trying to hook it up ? 
Asking for a friend 🧐",1568295739,0,0
Easiest way to become a student athlete?,Any easy sports out there that take almost anyone?,1568295658,0,0
Millican,So is the move to go to Millican hall tomorrow if we don’t get our disbursements today,1568295642,5,0
PSC1121 - Physical Science,"Who’s taking physical science in classroom 2, and who is actually understanding it, bc I may need help lol. I’m interested in forming a study group if anyone’s down?",1568295143,1,0
"Ah Shit, Here We Go Again",,1568291358,6,0
Thursday parking,I am confused on the Thursday/game day parking rules. I parked in garage d and will be leaving around 6 so is it okay that I parked in d or should I move? Also I’m not attending the game I’m doing classes,1568291258,0,0
Papercut Down,All Knight Study Printing (and I think Student Union) is down right now. I think the library and hub still can print.,1568291231,3,0
when you’re still waiting on financial aid reimbursements,,1568291113,267,0
Are there comfort dogs on campus? Or where is the nearest place to find some?,,1568290928,2,0
"BEWARE OF LEGALSHIELD, they are currently “hiring” but it’s a pyramid scheme, stay away","I was approached at work today by a lady claiming to work for a company called legalshield, she said the company is currently looking for “associates” and she was very interested in the fact that I was a legal studies major and she went on and one about all the good things about working for the company. She ended the conversations stating that she was planning on putting up flyers at UCF to “recruit new associates” 
Now I am not stupid I know when things are too good to true, upon further research the whole company is pretty much a pyramid scheme you have to pay 250 dollars to “become an associate for the company” and you will most likely never see that money again, lmao. Anyway this has been your warning and to any freshmen this year let this be a lesson- when something is too good to be true, it probably is.",1568290240,103,0
Just a friendly reminder that the Lynx bus system is free for students!,I take the bus to get to campus everyday and I frequently see students (or at least people with backpacks heading to UCF) pay the fare to board the bus. All you have to do is show your UCF ID and you can ride the bus for free! I hope everyone has a good Thursday!,1568289727,54,0
UCF fees,This is my first semester at UCF and I am baffled that the mandatory fees are higher than the tuition itself. Has it always been like this or is it a new thing? Is there any way to opt out of them? I only have class once a week and the rest is online. I'm never going to use the services they are making me pay for.,1568265698,3,0
Spectrum internet,Anyone else being blessed by spectrum right now with such great internet that I can’t even use it.,1568263820,10,0
question about aleks,"i need to purchase an access code for aleks for my math class and it's cheaper to buy the full year access code rather than two seperate semester codes (i plan to take college algebra next semester which uses aleks as well)

the website, which i'm purchasing through, makes it seem like you have to buy a new code for each course you take, is this true? i'm assuming one access code should work for multiple courses, but i can't find any clear information about it.",1568262731,2,0
How to make some money?,"I’m still waiting for financial aid to hit my bank account, as I’m sure many of you are, so I figured we get the ball rolling with ways to make a few bucks in the area.",1568262072,11,0
Millican Snake 🐍,,1568261041,142,0
Internet at uhouse,"Is the internet not working for anyone else or just me. I’m wired and something seems to be working, thought it would fix after waiting like 10 min but it’s still not working.",1568260965,8,0
Guy's feet got run over by a car near Nicholson school of communication at 7 pm.,The questions about the emergency vehicles and cop cars were bc my friend was in an accident where no one was at fault and his feet got run over by a car. Nothing broken only sprained so he is all good.,1568259219,51,0
If I buy Cengage Unlimited to get access to both WebAssign and OWLv2,"I'm currently taking Calc 2 and CHS 1440and one class requires WebAssign and the other used Owlv2 but since they're both Cengage related sites, can I access both with Cengage unlimited?",1568256434,5,0
Cops at Tower 2,"Idk, just looked out and there were 5 cop cars. Wtf happened?",1568255088,13,0
😭LOST MY LAPTOP AT HEC101 or Eng2 Idea Lab(101D)😭,"- Can’t remember which two of those exactly😭it’s silver Microsoft Surface. 
- Please contact me if anyone finds it!!!🙏🙏🙏🙏 tel 4072423038",1568254889,5,0
😭LOST MY LAPTOP AT HEC101 or Eng2 Idea Lab(101D)😭- can’t remember it clearly🥺please contact me if anyone finds it!!!🙏🙏🙏🙏tel 4072423038,,1568253448,1,0
Bookstore student account opt-in payment???,Can I add the bookstore charge and the tuition charge together and just write one  check or do they have to be paid separately?,1568253138,4,0
"\\Pres. Trump backs int'l Soros child rape ring for $4billion bribe Pelosi paid $3b 'to ensure safe passage over border'. Rapists include 0bama, Schumer Cuomo, Buttgieg, DeBlasio, Thiel, Dorsey, BMurray. 60+ deaths from rapes in BuffaloNY\Jan2019, $15+billion in payoffs. Listen to them do it here:",[removed],1568249539,1,0
UCF is starting to get too damn overpopulated Rant,"First of all to the rude girl in the library that made my friend and I move from our study room, saying she had a group coming and a reservation fuck you! Today was a shit show for me. There was no parking at all. And on top of that there’s way too many people in the library no where to sit. In previous semesters the library used to be my safe haven. Where the fuck am I supposed to study now. I’m tired of all these fricking people coming. UCF needs to slow down on the acceptances. Are other universities like this too?",1568247513,0,0
What color are we wearing to the Stanford game on Saturday?,,1568247209,3,0
What happened at the RWC?,There were two emergency vehicles outside just now. Is everyone ok?,1568246467,19,0
Advice for labor Econ and healthcare Econ,"Hey everyone I’m taking Healthcare Econ with Guldi and Labor Econ with Gibbs and I wanted to ask those who’ve taken their classes, what are some tips and advice y’all have when it comes to studying for their class in general and their exams? I’m trying to get an A in their classes and would greatly appreciate any help or advice!",1568246365,3,0
Anyone over 21 want to make a quick buck?,Would anyone over 21 (or that has a fake)  that lives near or around campus want to make an extra $10 tonight? 20y/o here w no alcohol and it’s my buddies birthday tomorrow so you know I want to make it a good time. would meet you anywhere you usually go to buy. Greatly appreciate any responses!,1568244036,0,0
Messed up Big Time,"I withdrew from a class in a moment of emotion, and I now just realized that I can work my schedule around it and it won't be too bad. Who do I talk to now, if anyone? Did I fucked up fucked up?",1568243196,13,0
Does UCF reimburse me for transient courses I pay for?,I received an email today that I interpreted as a yes and then almost an hour later got another “mass email” that said the first email wasn’t meant to be sent? They are really toying with my financial emotional?,1568241697,3,0
UCF downtown parking,Was wondering if anyone found free parking for people that can’t afford that parking pass right now,1568240824,2,0
Textbooks for Sale,,1568240407,1,0
Dorms during winter break,"So I just got a job at Best Buy and they require me to be available to work during winter break, but I live on campus and they close the dorms during winter break. Can I sneak into my dorm or am I just fucked?",1568240219,9,0
Current Mood,,1568238821,1,0
DIG 2030 how to comment on someone else's assignment,"Hello!

I am taking DIG2030 and my teacher wants us to peer review other people's assignments. Nobody has posted their review online publicly. I got comments on my assignment from webcourses' assignment tab. How do I do this? Thanks!",1568238765,1,0
"If you were on the TCH 2nd floor, near the vending machines, and lost your android headphones",I found them and will be turning them in at the student union after class. Tried to turn it in at some office here in the building but they were all closed.,1568237314,5,0
Lost wallet,Do you know where to inquire for a lost wallet? If anyone find a wallet in Nicholson or PAC building or just anywhere please let me know ASAP,1568237048,1,0
Wanted: Undergraduate Students to Participate in a Study at UCF,"  

I am a UCF student, in the Texts &amp; Technology PhD program, performing a study regarding the usability of telemedicine communications. 

I am looking for UCF undergraduates to participate in an one-time, one-hour study where you will interact with a website on a computer and your smartphone and talk out loud your thoughts during this interaction. The purpose of the study is to find out how easy it is for people to find information on a website. 

In order to participate, you must be 18 years of age or older and required to bring a smartphone and be willing to use it to access the internet for one activity. You will also need to agree to be video recorded. All data transport, analysis, and storage, will be done by the PI and using a password-protected USB, computer, and data analysis software. All data will remain confidential, and all video recordings with identifiable data will be destroyed after data analysis is complete. The results of the data, which are de-identified, may be published in future publications or presented at conferences. The study will take place at UCF, in a classroom or computer lab. You will get a $15 Amazon gift card for participating. 

To schedule your one-time usability session, contact Jessica Lynn Campbell. My contact information is below.

Jessica Lynn Campbell

Call: (407) 810-7542

Email: jessicalynn@embarqmail.com

Please note, your contact information will only be obtained if you contact the PI and will not be retained following your participation in the usability test. The PI will not know your contact information unless you call or email her to participate.

If you have questions, concerns, or complaints, please contact or concerns, please contact Jessica Lynn Campbell (jessicalynn@knights.ucf.edu), or Dr. Sonia Stephens (Sonia.Stephens@ucf.edu), Ph.D., Assistant Professor, UCF Department of English.",1568237024,8,0
Question about class withdrawals,"I withdrew from my class today without realizing that the drop/add is over, is there anyway to undo the withdrawal?",1568237006,1,0
"""RAA"" for Physics 2?","Hey all, so I'm taking physics 2 with Ahlam Al-rawi and instead of exams she has these things called RAA's and I've asked multiple people what they are and nobody can give me a definitive answer. The most information I've gotten is that we can complete them with our group but.... will we have any resources? Is she gonna help us on them? Do I need to study for them like an exam? To me they're sounding like exams with extra steps. If anyone can clear it up for me it'd be greatly appreciated.",1568234701,1,0
Ucf football,Are tickets to the Stanford game sold out for students already?,1568233884,3,0
How does qmb3003 mathlab work?,"I have two chapters due saturday and was wondering how many tries i get for each. Also, should I do all the review chapters before I attempt the homework?",1568233224,1,0
Filed for intent to graduate? Expect loans in 3 more fucking weeks.,😡,1568230076,2,0
Anyone need an iclicker 2?,"Got a friend selling one for 50$ on campus, already has it. Dm me if interested",1568230014,1,0
Anyone taking EUH2001 online with Garcia?,looking for classmates to communicate with,1568229687,1,0
Stop Enrollment,I got an email that a class I signed up for in spring is a stop enrollment class and that I need to switch out of it. I’m a little confused on what that means if someone can explain it please.,1568227439,2,0
UCF Speed Reading and Study Strategies: scam or not?,"I got an email from UCF about this workshop course and I was interested in being able to read faster/study smarter. But the program is $340, there are only a handful of seats in the class, and the program is only once a year. 

On the surface, this seems a little sketchy, since the class doesn’t have hardly any information online or any actual detail about how the course will be taught. 

Has anyone here taken this course? Is it a scam?",1568225638,6,0
Selling mini fridge,"Never posted here before so sorry if this isn't the right place to do this but I'm looking to sell my mini fridge. 
It's a black Kenmore fridge 17.75""L x 19""W x 25.5""H
$35 OBO
PM me if interested or want pics",1568225204,5,0
Looking for Ping-Pong partner,If you are a relatively normal person and would like to play Ping Pong in the morning or late afternoons feel free to PM me! I used to be pretty good as a kid but haven't played in years and I'd like to get back into it. The Rec center is free for students and they have nice tables.,1568224247,7,0
HELP! Financial Aid - PuertoRican Taxes (HOW DOES IT WORK?),"I recently got an email from the financial aid offices saying *""We are unable to complete the processing of your 2019-2020 financial aid application due to inconsistent or missing information.""*  They already have my mother's W2, do they still need a copy of another tax form from PR? The W2 is THAT! Also, the inconsistent information is probably because she filled the tax filling statement wrong. Should I upload a new one? 

&amp;#x200B;

I hate to ask but the financial aid is always full and barely help out. I'm a transfer student and stuck in this very specific situation regarding financial aid and PR tax forms. 

https://i.redd.it/t4cpbmguvzl31.png",1568221224,6,0
iclicker reef,"after you have checked into class using the app, will it count you absent if you leave class early? 

also, do you need a subscription to only check in?",1568220927,5,0
Is it a law that you have to pee on the seat on CB1?,"This is the worst thing in the world, I gotta take my daily after coffee and class dump, but when I get to the stall some dipshit aimed for the seat.",1568220382,1,0
sorry in advance: iclicker 2?,"hey i'm looking to buy an iclicker 2 from someone. 

hopefully i can get it from you today...

please lmk if u got one for sale! 

...and as my title went, sorry in advance for another one of these posts",1568219124,3,0
Anyone rushing Alpha Sigma Kappa?,"I missed the meeting yesterday and was wondering if anybody here went and could tell me what I might’ve missed? Also, does anyone know where today’s rush event will be?",1568218845,5,0
EXP3604,Hey if anyone is in the section with Robert Kennedy could you message me or let me know if there is a group me for this class? Thankss,1568218632,3,0
Scantron question,"Can I get one scantron at the Student Union and one at All Knights Study? Or only one per day total? 

Thanks!",1568217245,11,0
Singing!,Is there any club where you can just chill with people and like sing?! I hate that with all these clubs there isn’t one where you can enjoy music without being a music major. My friend and I wanted to do musicals but they aren’t available for plebs :(,1570432991,11,0
Financial Aid,"Just wondering, I’ve only applied for FAFSA and Bright Futures and was wondering if these two will be able to cover costs? have a few more I’m gonna apply, but was just wondering.",1570429078,2,0
diy music scene?,any local bands that do house shows around ucf/orlando? thanks!,1570424172,8,0
Looking for anyone willing to do a photoshoot with (model or photographer) on UCF campus. I’m trying to familiarize myself with the campus as I try to work towards doing some grad sessions . My ig is @artmanexposure if you’d like to see my work.,,1570422510,1,0
COM 1000 textbook for sale?,"Thought I could make it through the semester without it but for Hanlon you need it.

Anybody have a used copy they are willing to sell for less then what the bookstore is going to charge me :)?",1570419870,6,0
The OGs remember these days,Yik yak and yeti used to be that shit man. Sad all of them died off,1570414692,73,0
Nice.,,1570413381,1,0
