title,selftext,created_utc,score,total_awards_received
Advice about failing calc,"I'm currently failing math 231 and have no idea what to do. Calc isn't relevant to my major, these are just classes I need to take in general. I've always been terrible at math and don't have a good background in it due to my poor education system, so while the class is speeding through concepts I'm left behind. Even with tutoring and studying my grade is below a D and I don't think it's going to come up before the semester ends. I was planning to take the two calcs at my local community college and transfer the credits, but it turns out I have too many credits from the AS I already have and can only take one.. I have no clue where to go from here and I feel hopeless.",1574208164,1,0
"Local history podcast Re/Collecting Chapel Hill tells the story of James Cates. Born and raised in Chapel Hill, murdered on UNC's campus when he was just 22-years-old. (2nd of 3 part series on Silent Sam)",,1574201054,2,0
What info/advice do you have/know about the Radiologic Science Major/Program?,"I'm currently a Bio major on the pre-med track, but the Radiologic Science (Medical Imaging B.S degree) looks very interesting and has a wide range of applications for the health sciences field. I'm trying to find out more information as I consider applying for the program.

Thanks in advance!",1574199204,6,0
Carmichael '20-'21 Room Selection,What are my chances of getting to live in Carmichael next year? I'm a rising sophomore and my selection time is like 11:40. Since I've heard that getting a room in Carmichael is very difficult; I was wondering how true that is.,1574198935,4,0
Any good tips or life hacks at UNC?,Just want to hear some.,1574129380,1,0
Failing Calc 3. Any tips?,,1574108195,1,0
How does enrolling in an honors class (COMP 89H first year seminar) as a non honors student work?,"I’m already enrolled in a different fys but I’d like to be able to swap it for COMP 89H if possible. Connect Carolina said that registration for this course for non-honors students would be locked until today (11/18), but I’m still unable to add the class to my schedule. It says I need to obtain a permission number? How would I go about doing this?",1574099875,1,0
LPT: Go to Onecard.unc.edu to check how many swipes you have left before the end of the semester,"https://onecard.unc.edu/ 

I saw someone had a question earlier about checking how many swipes they had left or flex dollars. This would be useful to know and remember: you lose the swipes you don’t use!!!",1574053832,1,0
Meal Plan Usage,"Hey, I was wondering how I could figure out how many dining hall swipes I have used if I have an unlimited meal plan. I am curious so I know what plan I should get next semester",1574052204,1,0
Astronomy 101!,hi i am failing astronomy does anyone have any tips/tricks. i understand nothing and i need help please,1574049159,1,0
Dermatologist recommendation?,Anyone have a dermatologist they like near campus (reasonable Uber-distance)?,1574012285,1,0
Best Housing for Apartment or Dorm,"I will be an incoming transfer for Fall 2020, what are some recommendation for the best housing or some great apartment areas that are nearby that I can rent?

I am more concerned about the quality, cleanliness, and saftey. Also, I do not want any distractions such as frats or people who are going to be a nuisance if that makes sense. I already have plenty of friends that I know so the freshman and sophomore expierence is unnecessary.

Cost and distance shouldn't be too much of an issue as long as it is not over 20 minutes away and isnt crazy over priced.

For the apartment, I am talking about a single toom, if not then 2 room.

Thanks",1573999604,1,0
When can I start applying for Granville Tower Housing?,,1573971768,1,0
Exchange student -- Housing in Northern Campus?,"Hi there, I'm an exchange student from Hong Kong coming in Spring 2020 struggling with my housing application. So far I've only been considering Northern Campus since I've heard that freshmen usually reside in Southern Campus and I'd like to avoid all that freshman hype (esp when I'm introverted).

Having perused the info on the housing website, the choices I have in mind right now include Spencer and Old East. I like how some rooms in Spencer have a sink in each room, and that it is **NOT** with central air-conditioning and proximate to Franklin St. One downside is that the room dimensions are slightly small for double-rooms (?). And Old East just 'cause it looks so antique. 

Overall, is Spencer a good choice in the Kenan community? I'm not sociable and enjoy quietude + nature (sunlight, a view of greenery and all that) in my room -- Kenan community seems a good choice. Distance from campus isn't a great deal for me -- I'd rather be proximate to where I can buy my daily necessities. Also, any recommendations for cleaner rooms and nice bathrooms?

Thanks in advance!",1573962957,1,0
Getting to the Airport from campus without a car?,I'm taking a flight out for thanksgiving break from RDU but I don't have a car and I still haven't figured out how I'm going to get there. Does anyone have any suggestions?,1573949488,1,0
"Is COMP 401 structured in a way to weed out Comp Sci majors? I took COMP 110, so will I be okay in COMP 401. (Rate My Prof. has so much bad reviews)",[removed],1573863845,1,0
Chemistry B.A and Entrepeneurship minor/Economics B.A?,"Hello, 

I am interested in pursuing a Chemistry B.A coupled with something related to business. I was wondering 

 1. Has anyone else has done something similar to this and if so how it ended up working out for them (chances at graduate school, finding jobs etc.)?   
 2.  How extraneous would this be?                      

Any type of advice would be helpful, thanks!",1573861854,1,0
"Is COMP 401 structured in a way to weed out Comp Sci majors? I took COMP 110, so will I be okay in COMP 401. (Rate My Prof. has so much bad reviews)",[removed],1573847507,1,0
JAPN 102,"Hello! lol be taking JAPN 102 next fall, and I was wondering, has anyone taken it? I want to ask some questions. Please DM me.",1573844919,1,0
Transfer Credits,"I can't seem to find a page on ConnectCarolina or otherwise that tells me how many credits I transferred here with. I was dual-enrolled in HS at a local community college and got my AS, but I know a few credits didn't transfer so I'm not sure how many I came with. I'm terrible at math, the calc classes here are killing me and they aren't related to my major, so I'm hoping to take them over the summer at a community college, but I'm not sure if I have too many credits to do so. Where do I find my transferred credits at?",1573836598,1,0
Thoughts on classes?,"How bad is doing CHEM 102, PHYS 119, MATH 233, and COMP 401 in one semester.",1573823971,1,0
Tips when applying for Fall 2020 transfer,"Hello all, 

&amp;#x200B;

I am a first year at NC State majoring in Bus Admin with a concentration in Finance. 

I was wondering what the odds of acceptance and what are some things I should do to differentiate myself from the other applicants? 

I think I will end with about a 3.7 gpa this semester for context.

&amp;#x200B;

I really appreciate you taking the time to read this and replying!!",1573781316,1,0
Housing application for exchange student,"Hi there, I'm an Australian exchange student coming to UNC in Spring 2020. We're finally able to apply for housing but unfortunately most of the places I looked at are unavailable to apply to. Does this mean they're full?

I've been recommended North Campus, Mid Campus and Granville and currently the only North Campus halls available are Everett, Lewis, Stacy and Aycock. What are people's thoughts on these/does anyone suggest how I should rank them?

Thank you!",1573780237,1,0
Chances of Transfer,"Hello all, 

I am a first year at NC State majoring in Bus Admin with a concentration in Finance. 
I was wondering what the odds of acceptance and what are some things I should do to differentiate myself from the other applicants? 
I think I will end with about a 3.7 gpa this semester",1573773407,1,0
Mod Announcement: Introducing AMAs!,"Hey, Tar Heels! We loved the Peer Advising AMA that we had this week (thanks /u/gonzola101 for taking the initiative!) and have discussed as a moderator team having more AMAs in the future! 

We would like to ask for community feedback and see what you'd like to see from AMAs. For example, who would you want to give an AMA? Professors? Certain roles on campus (e.g. ITS employee, COMP 110 TA, Hot Med Deli guy)? If you have any suggestions or feel like you have some unique quality that would make you fit to give an AMA, drop a comment on this post or message the mod team!",1573756027,1,0
Anyone register for COMP 401 next semester?,"So, I found out i can sign up for a class next semester that I want. It just so happens to land during my 401 recitation on Friday. 

Im in section 603 for recitation.  Could anyone switch recitations with me?

I need either section 601 or 604!

Thanks!",1573755426,1,0
Watch party for the game tonight?,"Freshman here, anyone know some fun spots around campus/on franklin to watch the football game at Pitt tonight?",1573753927,1,0
Do you think I'll get in?,"still in high school, have 60 CC credits 

GPA Unweighted is 4.4 
Weighted is 3.8 

Rank=2nd 

Act=29 

was president of 2 clubs 

Will apply as a first year",1573738703,1,0
Any MBA@UNC students here?,Want to ask some questions. Thanks!,1573733959,1,0
One of my friends who applied to UNC recently got this letter. Does anyone else get this when they were applying to UNC?,,1573677703,1,0
Does anyone know about the Model United Conference in Chapel Hill (MUNCH)?,How is the conference? Is it really competitive? Thanks.,1573668018,1,0
"Hey UNC. You May Win at Basketball, But Can You Make a Hilarious Commercial? (Class Project)",,1573660695,1,0
History Rigor,"So I am a currently a History/sports admin major and I have the vast majority of my gen Eds done and I was planning on taking a good amount of history classes next semester. Based on availability, I could end up in 4 history classes (currently enrolled in 3) and I was just curious on the overall difficulty of the history department and if taking 4 was a realistic option. I know it probally depends a lot on the professors but RMP has most of the ones I’m interested in rated highly (Talbert, Lee, Gelleman and the 4th I’m considering is Naiden). Any feedback would be greatly appreciated.",1573613821,1,0
I DO NOT WANT TO WRITE THIS PAPER,drop your best yo momma jokes below. Or anything really. Just give me an excuse to not do this paper and wind up probably failing the class because the world is ending hahahahaaaa,1573608644,1,0
How is AMST211??,,1573605354,1,0
What are the chances of a first year seminar opening up?,"Just that. I'm not in one this semester, and was hoping to get one next semester... anybody feeling like dropping one?",1573603624,1,0
Has anyone taken Chem460?,"If so, what were your thoughts?",1573602286,1,0
Waitlist,What are the odds one can get off the waitlist for math 233? I’m like 8th on the list.,1573594736,1,0
Thoughts on taking two chemistry classes in a semester?,Might have to do it...has anyone done this? Just want to hear what to do in this scenario.,1573589399,1,0
Schedule,"If my enrollment time is past, but I still need a class, how do I enroll? I found an open class but not sure how to add.",1573586728,1,0
Help! I’ve only taken the Second Science course part of the requirements for Comp. And I’m currently taking the other Pre-Reqs at the moment. So how do I calculate my CompSci major GPA? is it just the points I got from that Second Science Course?,,1575676714,1,0
Updoot for boobies,,1575661063,1,0
Cole Anthony jersey,Does anyone know how I could get my hands on a Cole Anthony jersey? I’ve looked everywhere online and they all seem to be fakes from China. I do not live in Chapel Hill but I’d be willing to pay somebody to buy it and ship it to me. I understand that he is a current player and his jersey may not be for sale on the market right now. Thank you!,1575657950,1,0
Who do I contact about these insane exam circumstances,"I took my Math 231 exam this morning (section 3 with smirnov). 


First off, the room the exam was scheduled in was already occupied by another class about to take an exam (some type of physics iirc) so our class ended up spending 20+ minutes trying to find/get in contact with our professor. He ended up showing up outside the original location at about 8:10 (it was an 8 am exam) and told us we would probably wait 30 minutes to see if it could be rescheduled or the exam would be cancelled. Around 8:45, he told us that we would actually be taking the exam right now at a different building a decent distance away. 


By this point, much of our class wasn’t together back at the original building and only about 70 of us out of the 150+ class even ended up making it to the new location. We started the exam in the new building at about 8:52 and he sent the new exam location by email 5 minutes AFTER it had already begun. This was the first communication he had given all morning. It was a 3 hour exam, which was supposed to only go to 11, so I missed an important event since it didn’t end until 11:52. All the extra stress of dealing with this shit instead of taking my exam at 8 in the correct building like we were supposed to made me do pretty bad on the exam, not to mention that it was just hard in general.


Who can I contact about all of this? Also, if anyone’s experienced something similar before, how will this be handled? I couldn’t imagine they would drop the exam from just the 70 that didn’t show up but it also doesn’t seem likely that half the class should get a 0 either.",1575653433,1,0
Chem 101 Curve.,I just took a chem 101 final. Did NOT do well. Is Chemistry 101 curved at UNC?,1575650168,1,0
Math 231,Do they ever curve the final for Calc 1 cus im pretty sure i did trash,1575649061,1,0
Cheers to all who streaked!,Good luck on exams everyone! Hope to see ya next semester!,1575612793,1,0
Seems pretty true,,1575612246,1,0
How/when do I sign up for spring rush for frats,Title,1575610216,1,0
Who’s going streaking tonight,Title,1575568831,1,0
"if you're on the fence about streaking tomorrow nite, do it",that is all good luck on exams everyone,1575515099,1,0
Halls after hours,Do they lock buildings and classrooms after hours (if they have any?) Specifically hill hall,1575501183,1,0
How good are social life/dorms at UNC,,1575489792,1,0
DKE Or Phi Delt,"Among these two frats, how do they differ in terms of the general reputation of each one and the type of kids in each fraternity?",1575434340,1,0
CS Transfer Student lost on what to do,"Hey there, I am a transfer student from a community college (AS). At the start of the semester I was excited and happy to be here. I enrolled in COMP 401 and MAT 381 along with a FL and an LFIT course for my first semester. The semester started out fine, I was familiar with java programming and coasted through the first couple of assignments. I started to fall behind on the content in both my MAT 381 and COMP 401 course and was lost on how to complete most of the assignments. Admittedly I should have taken advantage of the LA's for the COMP course and started going to my MAT 381 office hours early in the semester. I started to become very depressed because I wasn't doing as well as I would have hoped. I dropped a 50% on the COMP 401 midterm(30% of the course grade) but decided to keep pushing on and hope for a curve so I could continue on with the CS courses in the spring. 

&amp;#x200B;

I will definitely pass the two classes, just probably not with a C (current grade is a C before a7 and the final). The problem that I'm facing is I might not pass 401 and the 401 section in the spring is full. If I do not pass 401, or get into 401 in the spring I will have to waste my spring semester waiting for the fall so I can start again (with the new curriculum they're introducing). So basically I'm super behind on getting my major requirements out of the way, and am lost on what to do. 

&amp;#x200B;

I honestly expected a lot more from the CS department, I realize that a lot of this is my own fault but I can't help to think that the insanely large class sizes and how the course is structured had an impact on my ability to succeed(30% of my grade depends on the midterm and 35% on the final, so 65% of my grade is dependent on two tests wtf.) I haven't really been happy at UNC during my time here and have been considering transferring to UNCC because some of my close friends go there and have told me that UNCC CS is better structured than UNC's. I would be worried about pushing my graduation date back by transferring again, but if I don't get a C in 401 or get a C in it in the spring then I'm literally starting from square one in the fall again. I get that UNC is a more prestigious school than UNCC but I feel like the CS program at UNCC is better than UNC's.

&amp;#x200B;

I would really appreciate your advice.

&amp;#x200B;

Sincerely, a person who is stressed to the max.

&amp;#x200B;

TLDR: might not pass 401 this semester, cant retake it in the spring because the only section is full, so starting from square one in the fall. Considering transferring to UNCC because of (what I believe to be) a superior CS program and it wouldn't push my graduation date back.",1575432615,1,0
If you need help procrastinating,[removed],1575426711,1,0
Procrastination Assistance --&gt; Scroll on Website,[removed],1575425848,1,0
How hard/easy is Classical Mythology with Emma Warhover?,Question is the title lol,1575410022,1,0
Opinion: The fb meme group is kinda pathetic sometimes,"It's literally just 

1) Blatant political opinions disguised as memes (the woker the better of course)

2) ""I hate my life"" and other zoomerisms (dAE FInaLs stRESfuL just isn't funny at all)

3) Generic college stuff (see #2).

Of course, I've seen lots of funny, niche, UNC related content there. But it's annoying to log on and be inundated with memes that are ultimately *complaints* about the school. Yeah, college is tough, and sometimes the university does stuff that contradicts your values, but that's kinda the point, no ? One of the apparent benefits of a college education is being taken outside of your comfort zone and into the real world. So why do we take a place for students to escape that to look at funny memes and turn it into a complaint box ? Like why are you even here if that's going to be your outlook.

And yes I see the hypocrisy in complaining about a meme group because it complains too much",1575409623,1,0
What's your opinion on the campus food here?,"A lot of my friends say they don't like it, but I personally think it's pretty above average.",1575408616,1,0
Camp Kesem!!!,"&amp;#x200B;

[Hi everyone, happy Giving Tuesday! I am a part of this awesome organization called Camp Kesem! We put on a week long summer camp every year for children whose parents have been affected by cancer. We need help raising funds to support camp so every kid can go FREE OF COST. Please donate to support this amazing cause!](https://preview.redd.it/0kdwr40b4h241.jpg?width=1242&amp;format=pjpg&amp;auto=webp&amp;s=46a2c9d1fc2523259b2b2515c4246f0af0f7768d)

[https://donate.kesem.org/fundraiser/2489517](https://donate.kesem.org/fundraiser/2489517)",1575403058,1,0
Is it possible to send packages from UNC using their services?,Or would I have to UPS any packages I have to send out,1575357740,1,0
Anth 319,I will be taking several difficult courses next quarter and want to take an easy course to satisfy my geneds. How difficult is Anth 319 and would it be a good idea to take it while having harder courses?,1575330997,1,0
MUSC 89,"Has anyone taken this FYS? I have it next semester, but I do not know what to expect.",1575258890,1,0
Anyone here know how hard it is to make the snare line? I’m very excited for college drumline and this school is my top choice!,,1575215705,1,0
"Chancellor, excuse me, but what the fuck?",,1575172274,1,0
"How hard is chem 102 compared to 101? (Took ap in hs, got a 4, doing really well in 101)",,1575145722,1,0
Questions about the CS changes,"Hi all, I transfered into UNC last year as a Comp Sci major and I've been hearing a lot about the changes they're making. It's making me a bit uneasy tbh lol. 

I haven't taken Comp 401 yet because I needed Calc 1 as a pre req which I took this semester. I didn't sign up for 401 next semester either because I figured 110 would be helpful first so I am taking 110 and 283 in the Spring.

If I'm already declared a Comp Sci major and they do implement an admissions process do you guys think I'd have to go through it or is there a chance that those who already declared would be grandfathered in",1575131021,1,0
Best Ways to study for the LFIT Finals?,"What is the best way to study for it? Currently, my plan is just to review previous quizzes, and skim chapters for important concepts. Does this sound like a good plan&gt;",1575097180,1,0
How to get a lab job,Y’all I’m a freshman chem major  and i just have 0 clue how to find the opportunities. Any help would’ve appreciated please,1575079923,1,0
University Student Satisfaction,"Hi

We are a group of students from Villanova University.

We are doing a research about University student satisfaction nationwide.

Could you please take this short survey, it would help us a lot!

[https://forms.gle/zWeSJjGZvVquWUQb8](https://forms.gle/zWeSJjGZvVquWUQb8)

Thanks for your time.",1575043546,1,0
"UNC Board of Governors give Silent Sam to the Sons of the Confederacy, along with a 2.5 million dollar budget to preserve it.",,1574886328,1,0
RA position,I’m considering the RA position for next year but I just wanted to know a little more about it from people who’ve had some experience. How difficult is the selection process (how many applicants and how many available spots)? Whats the pay like (How much/how often)? Thanks for the info!,1574839482,1,0
Math 381 with Yiyan Shou,Any opinions on teacher or class?,1574800954,1,0
What are my options here?,"Okay so today I had my housing selection, and every single double room had at least one person in it, so my roommate and I selected a triple in Old East with one other person in it. I just found out that another buddy of mine wants to live in the triple with us, but it won't let us back out to pick another room. What can we do here?",1574796405,1,0
Opinions on Spencer Dorm,"I'm a rising sophomore and I'm living in Spencer next year, I've heard mixed reviews and was wondering what the general consensus is about it.",1574790713,1,0
Taking CHEM 251 and CHEM 262 at the same time?,"CHEM 251 is Inorganic Chemistry while CHEM 262 is Organic Chemistry II. Has anyone ever taken these two classes together, or are they too similar to take together?",1574788648,1,0
Spring frat rush?,"Anyone know if there is a spring rush, and if so when stuff for it is gonna be posted?",1574743788,1,0
Spring 2020 Housing,Does anyone know when we find out what dorm we got for Spring 2020? Am coming for exchange so submitted my application in the last few weeks :),1574742799,1,0
Does the tech shop sell chargers for cci laptops,"I lost mine and I need a new one quickly because all my work is on it, so I’m hoping I can get a new one when it opens tomorrow morning",1574648766,1,0
Chances for curve with McLaughlin for 232?,Wondering how the curve has been in the past if at all for math 232 with Elizabeth McLaughlin,1574637440,1,0
I tried to make an origami Duke University. Thoughts?,,1576710026,1,0
"$25,000 Cash Prize Coding Competition | Terminal Live: UNC v. Duke","This year, join us for our first ever head to head competition against the Duke on **February 1st.** [Terminal Live](https://terminal.c1games.com/unc) is your opportunity to code your game strategy, watch it compete, and win **$25,000+**! 

**Round 1 Applications are due Sunday, January 19th at 11:59 pm ET.**

**Apply Here!** → [c1games.com/unc](https://terminal.c1games.com/unc)

This year, **you represent more than your team.** This year, you’re competing head to head against Duke students. At the end of the day, we will crown a Terminal Live champion!

**FYI:** It's easy to apply - fill out a questionnaire, upload your resume, and complete a short assessment.

Curious about the event? Check out this [brief clip](https://vimeo.com/324998162) about Terminal Live.

[Terminal Live: UNC v. Duke](https://terminal.c1games.com/unc)  highlights include:

* $25,000 in cash prizes!
* Opportunity to showcase your coding skills in a novel, eSports-style competition
* Exclusive recruiting opportunities with Citadel, LLC and Citadel Securities

If you have any further questions, please direct them to alex@correlation-one.com. We look forward to seeing you on **February 1st**!",1576694965,1,0
Can anyone login to ConnectCarolina right now?,"I just keep getting errors to clear out my cache, which I did. Thanks!",1576692016,1,0
"How doable is this course combination that I (freshman, second semester) am taking?"," Chem 102 + L, Bio 201, Comp 390 (comprised of sections of the former Comp 401), Anth 319.",1576688928,1,0
Math 232 honors,I just got an email about the MATH 232H class. Should I take the honors class or just the normal one because I've already heard that the class is one of the hardest at unc. Also if someone has any general experience with any honors classes that would be much appreciated.,1576674010,1,0
"What does a grade of ""NR"" mean?",I can't seem to get a consistent answer across unc dot edu,1576651852,1,0
