title,selftext,created_utc,score,total_awards_received
Sorry for bothering you guys,"I would LOVE to attend UNC. I’m submitting my official report right now. Should I report my very good sat score without an essay, or also report the one that was bad but had an essay score. Please please help!!PLEASE ASAP

Edit: 1590 with no essay, 1450 with a 20 essay.",1570406626,7,0
AP scores,"I'm a high school senior working on my application and would like some advice about AP scores. Should I self-report them on my application? I have mostly 3s and I have heard that this could look bad. Basically, I'm trying to decide if I should self report them or wait until later to officially send them.",1570383274,2,0
Can you take one 400 level mejo class if you are not a major?,"(Ignore the fact I’m a freshman, I don’t mean necessarily next semester.) I am really interested in just one of them.",1570333292,6,0
Applying to Honors Carolina in less than 10 days and I still can't seem to understand it.,"Apart from smaller class sizes, cushy housing and the occasional guest lecture, what are the advantages? The website is rather vague in really differentiating the leg ups that Honors students have over regular ones. If it's relevant, I'm planning to major in CS.",1570324869,11,0
ENGL 225- Shakespeare,"Has anyone taken ENGL 225 with Prof. Floyd-Wilson? I'm caught up on all the readings, but what's the best way to prepare for tests?",1570323530,9,0
"Hilariously bad scam email I got on my heelmail account, if you get something like this make sure not to respond",,1570140081,26,0
What is the highest possible cutoff for an A that you've ever seen?,"So took the midterm for a class recently and it was like super super easy. Everyone I spoke to said the same and so far all the assignments in the class have also basically been a breeze. While this sounds great, I can't help but feel that the criteria for an A in the class is gonna be insanely high because of this. So what's the highest you've ever seen the criteria for an A be? This is a 500 level Math Course so I thought it would be much harsher on grades but doesn't at all like that. (not giving exact class to keep anonymity).",1570125669,1,0
Midterm,Failed my first midterm with a 68 do I withdraw from the course or stay?. I'm really trying so hard in the class,1570105437,10,0
Math 232?,How difficult is math 232? Like if I got a 4 on the ap calc AB could I do well?,1570050368,8,0
High school senior applying to UNC early. Would love if a current student could read my supps.,"Basically title.

&amp;#x200B;

Thanks a lot!!!",1570031033,0,0
EXSS 385,Gon fuck around and catch my first F senior year. Anybody got resources that could help out? It’s basically a Physics course.,1570029760,1,0
1 like = 1 prayer for the Poli 130 midterm today,I am NOT ready to identify whether a country is consociational or majoritarian,1570018388,43,0
do you have to live campus your second semester of freshman year?,to save money ..,1569985078,3,0
is it possible to make up your mid term without penalties?,basically i'm going through some really bad shit right now. it's been going on ever since i've moved in and im so fucking exhausted im breaking down pretty much every fucking day. and i know the next few days is going to be worse but i have a midterm on thursday. i dont want my personal life to fuck up my academic life but im literally a mess and im dealing with this shit and i feel so alone because no one can help me and im tired of having to run out in the middle of the night to just cry in the middle of campus because my roommate is probably sick of walking in on me crying. so just please i'd appreciate it if someone can help me out and let me know if i can somehow push my mid term back,1569971792,1,0
Math 233,I have the option next semester to take Math 233 honors. I was wondering what exactly is the difference between the two. Is honors a lot harder than regular. I work better in a small classroom so it may or may not be better.,1569954502,8,0
ResNET?,what is it like being part of ResNET? and how much do you get compensated for housing? can you get a single room? and can rising sophomores apply? how competitive is it?,1569946422,3,0
does anyone know where i can get weed,dm me a plug before i get banned or this post gets removed please bruh,1569899790,0,0
On-Campus Housing,"How does the application for on-campus housing work for current students? It says it opens tomorrow, but then it opens again later. Do we have to have our roommate situation/where we want to live figured out as soon as the application opens, or is it a lottery system again, so we just need it done by the deadline? Thanks for the help",1569881451,21,0
"Hi everyone, I’m a prospective in-state student applying for the Morehead-Cain. I was wondering if any of you have any tips on the application itself and any tips on how to handle the “admit your mistakes” essay. I have everything completed but I wanted to get some input from students, if it’s okay!",,1569878178,5,0
The first time Jordan missed,"&amp;#x200B;

https://i.redd.it/om8xulnzwrp31.jpg",1569867657,1,0
"People who lived in chapel hill and go to UNC, is it suffocating",do you feel like its another 4 years of high school,1569817522,2,0
Admissions question! What did you put for this section and how did you format it? Thanks so much!,,1569778492,4,0
Does UNC have a Minecraft server?,,1569775351,19,0
We have a local hardcore show tomorrow night at Local 506.,,1569771215,0,0
Appreciation post to all students,"To everyone who was at the game today, getting loud in the student section I just want to say thank you. We are showing these recruits that we can be a football school and making Kenan a tough place to play! Clemson had so many penalties because WE were loud. Job well done. See y’all October 26th!",1569718840,35,0
"Which is better, Eduroam or PSK",,1569706604,4,0
Looking for scrap Magazines for art project.,Anyone know where I can find any on Campus?,1569705497,1,0
What happened to club football at UNC?,,1569692776,1,0
Roy can dance,,1569647715,55,0
A thank you note from a Duke Graduate Student to the UNC Senior who was really kind at S Columbia St. at Sitterson Hall &amp; ROTC bus stop.,"Hello there!

Thank you for being so kind. I find it really hard to meetup and talk with new people but you were really kind and it warms my heart that there are such people out there. I hope that UNC Tar Heel's loss to Duke Blue Devils Men's Soccer Team doesn't spoil your weekend. Thanks again and have a great weekend ahead!

Warm regards,
/u/DukeGraduate",1569637070,26,0
Working for ResNET?,"Hey everyone,

I was wondering if anyone could tell me their experiences with ResNET/the hiring process. Also, is it required to have a lot of tech experience?

Thanks.",1569633157,3,0
October 8th Pokémon Go event,On October 8th from 6-7pm there will be a Pokémon go event with 5 star raids featuring MewTwo. If possible pm this account so that a sizable group can be formed to take on the 5 star raids and get a chance to catch MewTwo.,1569615004,5,0
Music lessons?,"I'm a freshman here at UNC, and I'm looking to learn a musical instrument (guitar, keyboard, saxophone, I really don't care as long as it's fun). I learned a little guitar senior year, but I didn't keep with it. I can't read music either.

My life is super boring, so I think playing an instrument will definitely be a relief from all that (not to mention it's super cool). Since pretty much all the lessons offered at UNC are for intermediate players, are there any options off-campus or with student teachers?",1569549902,8,0
Getting into PSYC 270 as a sophomore,"I'm a sophomore that is graduating in May (came here with all my geneds done), but in order to get my psych major, I need PSYC 270 and have been told that it's virtually impossible to get into the class as a sophomore. Has anyone had this issue or has anyone been able to get into the class as a sophomore?

Technically, I'm a senior, but due to applying as a freshmen the year before last, I have sophomore standing when registering for classes.",1569537807,3,0
Any tips for out-of-state students to get into UNC?,"If you got accepted into UNC from out of state, what were your SAT/ACT scores and what type of student were you?",1569535493,5,0
how is working at UNC phonathon,Title^,1569535170,12,0
Transfer from uncc to unc (comp sci) worth?,"I'm currently a junior comp sci concentration software engineering, minor math. GPA 3.86. Math tutor, but no internships.

Are there significant benefits to transferring to UNC , or would it be better to just finish my degree at uncc. 

I'd love to hear some input! Thanks!",1569527090,5,0
Do I get any type of refund if I only withdraw from one class?,Basically just what the title says! I’m withdrawing from French and forgot to ask how it’ll affect my financial aid. Anyone have experience with this or just happen to know? Thanks!,1569520291,5,0
FREE THE WHISTLER,title,1569472132,19,0
question,"if I’m taking the SAT October 5th, and I’m applying early action to chapel hill, will they get my score in time?",1569457561,2,0
Landlord blacklist?,"Hey y'all, I'm thinking about moving off campus next year, and I was wondering if we/anyone have a list of terrible, no-good landlords set up. 

Thanks!",1569450995,7,0
Late Night with Roy Seating,"LNWR is general admission right?  How early would I need to get there, based on previous years, to get a seat close to the court.  When do people start lining up for it?",1569437399,18,0
Has the belltower always been one minute late?,"Every time the belltower rings, it’s always 1 minute late :-(. Has it always been that way?",1569431953,15,0
Is Bio101 curved?,,1569429782,1,0
UL or Davis?,"Which one do you prefer and why? I like the UL more simply because I like the study cubicles, it's open 24 hours, and it's way more updated.",1568338004,3,0
Somebody lost their keys!!,,1568316206,32,0
Any tips or suggestions for MAC program?,"Applying to the MAC program and I was wondering if anyone had any advice or experience with it. Think my odds are good and my GPA is high enough so I don’t need to take the GRE or GMAT, but was wondering if anyone knew what they look for and maybe some areas to focus on when applying. Thanks in advance",1568264177,1,0
"PSA: If you’re above the second floor in Davis, please whisper",I’m currently on the fifth floor and people are talking and laughing and it’s not fun to study to,1568256653,32,0
Where to get clothes tailored on campus?,,1568254045,1,0
Can you get a single room in Rams Village when your suitemates are doubles?,My suite right now are talking about going to Rams next year. I wanted us to go completely off campus because I know a place on Franklin Street but they said their financial package includes housing so it has to be through UNC. I want a single room but they love having doubles (because all 3 of my suitemates have the same sleep schedules but me haha..and I literally can't sleep because they're up all night talking and laughing and I love them but I'd rather have a single room and my roommate spends a lot of time in the other room with the others anyway,1568248073,3,0
Anyone have access to a drill press or power drill for an extra hole in my belt?,"I’ve lost 10 pounds since coming to UNC after losing 15 over the summer; enough that I’ve gone past the last hole in my favorite belt

Not sure where or how, but if someone could drill the hole for me they’d be doing me a huge favor

Btw I’m a freshman at Craige",1568231744,6,0
Research Assistant/Volunteer,"Those who applied for positions in labs at UNC, how long did it take to hear back from the lab? I applied to be a research assistant in psych lab about 1 1/2 weeks ago and haven’t heard anything yet.",1568214143,3,0
state vs chapel hill,"which is better for computer science? Going in for undergrad. I’m submitting my application to both colleges, I highly doubt I’ll be accepted to BOTH. But in the even that it does happen, which is better and why?",1568157422,8,0
What’s the weird bright green light,,1568080934,1,0
Are to-go boxes microwaveable?,"Title, sorry if it's a stupid question",1568079315,25,0
Need advice on best freshman lower quad dorm to move to,"I'm currently filing a housing reassignment form and am deciding which of the freshman north quad dorms I want to move to. I'm currently stuck between Stacey, Everett and Lewis. Any advice on which of these dorms is the best to move to would be appreciated. For context: I'm a freshman male, and am looking for a dorm with a nice climate (where everyone's friendly). I currently live in Hojo 

Thanks",1568062347,5,0
Best floor in Davis Library to study on?,"Eight floors, can't really decide lol",1568052587,2,0
USNWR Rankings,"We moved up one from 30 to 29 in national rankings. 

We stayed at 5 for public schools. 

We are at 10 for best value schools (next public school isn’t until UVA at #32).",1568048208,52,0
I liked how the rows of bookcases in the upper parts of Davis looked so I snapped a pic and the second I did some guy turned around and the result is this kind of creepy image,,1568007536,67,0
are the CDS nutrition facts on myfitnesspal?,it’s so annoying having to look it up on their website each time,1567995585,3,0
Where to find experienced programmers (students) on campus?,I'm recruiting experienced front-end developers (and considering back-end) as well as designers (UI/UX and illustrations for websites) for my recently-registered e-commerce company. My partner (back end developer) and I (front end) are looking for committed team members and I'm wondering where I can find students who could be interested?,1567976504,8,0
how difficult is it to get a position on CoGo? + time commitment?,i recently got contacted to interview for a position in cogo at my residential community. just wondering how difficult/competitive it is? and what's the time commitment like?,1567976100,3,0
Churches and campus ministries around UNC?,"I've searched up churches on the sub and haven't found any information so I guess it would be a great time to ask: what churches have you gone to while you were at UNC? Would you recommend them? 

I'm looking for a new church, and my friend really enjoys his time at Newman Catholic Center, but I'm not Catholic. I know right off campus there are the Lutheran, Episcopal, and Methodist churches by the planetarium--I guess I'd say I am theologically undecided, having grown up in Southern Baptist ""non-denominational"" churches. Just curious to hear your opinions",1567973862,3,0
Turned down better colleges for UNC,Did any of you turn down a better school for financial or other reasons to go to UNC?,1567907873,0,0
Quick Question,My friends and I came down from JMU to tailgate with the UNC kids but we couldn’t find the student lot. Can anyone tell me a good place to go out for a Saturday??,1567894951,6,0
Parking for Visiting student,"Hey everyone.

Do you guys know of any good places for parking for a friend visiting? Like a place that does not enforce parking heavily",1567891017,2,0
Anyone at UNC interested in vintage computers and want to form a club/meetup?,,1567884811,9,0
Best Parking LOT for tailgating?,"Coming in for a game in a few weeks.  What parking lot is best for a fun tailgate?  Drinking an rowdiness allowed. 

Prefer no parking deck",1567864986,1,0
"If I apply undecided or for economics and get admitted, can I directly switch into Computer Science? Or is it hard to do so?",,1567862531,1,0
Feeling lonely,"Is it normal to feel pretty lonely at UNC? I’m staying in Granville but I missed out on all the parties and stuff due to family stuff back home and issues, and my hall is pretty quiet. My friends from home all went to different colleges and the people I’m familiar with here are in pretty exclusive groups, and I’ve tried joining student orgs but there’s nothing back yet about whether I’m in or not. I’m just looking for a group of friends to hang out or party with but idk, it’s pretty rough here. Has anyone else been in that situation here at Granville or somewhere else?",1567830293,16,0
Good places to study on south campus?,,1567801240,3,0
Where do I return my takeout box?,"I borrowed a to-go box from lenoir and I am ready to return it. However, I am a mere freshman who doesn’t know where to return it to. Upperclassman or even fellow freshmen, please enlighten me.",1567799670,1,0
What’s the premier photography club at UNC?,Title,1567799586,2,0
High School Student - Dual Enrollment,[removed],1567797142,1,0
Carolina ranked the third best public school in the nation by the Wall Street Journal and Times Higher Education,,1567720437,59,0
Where can I record a song on Campus?,Is there anywhere on or near campus where I could record a song? I have one that I'd like to re record.,1567718545,4,0
Trouble Joining UNC Related Facebook Groups,"Hi all, so I've been trying to join some facebook groups that are only open to students. To prove attendance, they ask for your unc email. However, they only let you use an email with a @unc.edu domain and not the @ad.unc.edu. My email uses the latter emails sent to &lt;myaddress&gt;.unc.edu result in an error. Any ideas on what to do? Thanks",1567709128,5,0
leaving classes early??,im only taking one class with like 100+ people and i notice that some students just like..leave early and the prof doesnt say anything. is this a thing people do? asking for a friend :),1567699189,2,0
UNC vs ASU tickets (4),"Anyone have 4 tickets to the App State game they are trying to sell?  


Thanks,",1567694840,2,0
Anyone know how much early bird concessions are discounted?,The early bird discount at the football games.,1567634748,2,0
Does anyone know anything about this old man with dyed orange hair who walks around campus?,"All my friends keep saying they see him walking around campus on the evenings, and that he's creepy or something. Idk.",1567633363,13,0
Interested in the BS in Information Science? Learn about it at an event I'm helping to host! Can also answer questions in comments.,,1567621664,4,0
Anyone on campus know how to cut hair? Or any off-campus recommendations?,Ya girl is in dire need of a trim,1567616800,1,0
How the hell do football tickets work now?,I had this down-pat and then they switched up the policy.,1567599190,12,0
NC Residency,"How do you fellow out-of-staters go about establishing residency? I heard it is pretty difficult, but I am trying to figure out a way to lower the cost of coming here a ***tad*** bit.",1567563477,7,0
Looking for a group of guy friends,Hi my name is Ben. I’m looking for guy friends/wingmen  in the area. Any groups of guys interested in adding an additional wingman to their crew. About to jump back in the dating game.,1567562097,5,0
Where can I find access to stationary tools like a stapler?,Currently in Davis,1567524589,2,0
Added grad student and PHD candidate user flair!,"It was mentioned in the chat room that they didn’t have user flair, and I’m so sorry for that oversight!! :( It’s been added now and we are so glad you’re here. 

If y’all have any more post or user flair suggestions, drop them below!",1567517123,17,0
UNC Basketball Tickets?,"What's good everyone... I know the hype for football season this year is real after that big W on Saturday (Sam Howell for Pres) but it's never too early to start thinking about basketball season. As an incoming transfer student, I understand there's a lottery system for all conference games/power 5 non-cons, but it seems like the odds aren't too great for obtaining such tickets. Does anyone have a general estimate for how likely it is to win the lottery?

I also noticed there was a standby line and turn-it-back line for the tickets that went unsold. On some DTH article (albeit old) I found online, it mentioned that the success rate for getting tickets this way was nearly 100%. Any truth to this??? If so, are there any tips/tricks you would recommend?? When the time comes I want to go to as many games as I possibly can. 

Sorry if that was a bit much... Go Heels!!",1567489304,2,0
What is the nicest dorm building?,,1567481153,10,0
Is safewalk operating tonight?,I want to go study at a diner of Franklin but I’m sure I won’t be through until after 11. Do they go to Franklin or just on campus?,1567467393,11,0
Postmates,Anyone have a referral code they want to use on me?,1567448525,2,0
Hurricane Dorian Class Cancellation Predictions,,1567433089,23,0
any places to study today?,everything seems closed and i’m tired of sitting in my dorm,1567430951,7,0
How selective are Rams apts that are 100% singles?,I mean single with private bathroom? I’ve heard they only have a few of these.,1567386892,3,0
Odd jobs?,"Does anyone know of any good sources for odd jobs (yard work, that sort of thing)?",1567374075,11,0
Is there free parking tomorrow (Monday) for labor day?,I know normally you have to take your car back to your spot after the weekend bc free parking ends but I was wondering if this extended to Monday bc labor day,1567370698,3,0
Is there a way to make chiropractic appointments through Campus Health?,,1567363048,2,0
Lenoir?,Is Lenoir open this weekend,1567359530,14,0
Parking in Bowles?,Can I park my car in Bowles for free today?,1567354667,2,0
Upgrading to unlimited meal plan,"I'm tired of deciding between spending my whole day in the dining hall on one swipe or just not eating. The website says your current block plan will be refunded based on the number of unused swipes, and then you'll be billed for the full cost of the current meal plan. So I'd get back the cost of my block plan minus 11.50*(number of swipes used) and then have to pay for the new plan in full. Is that how it works or am I mistinterpreting? I don't really want to pay an extra $200...",1567347122,1,0
Cheapest way to get UNC One card?,"Hi everybody,

I am an au-pair from Italy. I am in Chapel Hill as an au-pair for this semester. I am wondering what is the cheapest way to get a UNC One card? I would like to use the gym while I am here. I am currently measuring costs to find the cheapest option since I am on a budget. Sorry if my english is poor.

Ciao a tutti!",1567320690,3,0
Morning Classes cancelled?,"Don't want to start the speculation too early but just was wondering what you guys think the possibility of morning classes being cancelled tomorrow morning is. I know there is a lot of water on the roads and sidewalks right now, and it is going down to around 25 degrees tonight.",1573582069,1,0
Could I take Linear Algebra for Applications (MATH 547) at community college and transfer the credit?,Thinking about taking it over the summer at my local CC. Would UNC accept the credit?,1573578528,1,0
Most Fun or Interesting Class to Take,"What's the most ""fun"" class to take?  I have a couple credits I need to take but I fortunately can take almost anything.  Any recommendations on classes that are fun/interesting and not a ton of work?  Thanks in advance!",1573577490,1,0
Transfer help,I’m a current freshman at UNCC and I should be ending the semester with a 4.00. I’ll have about 40 credits by the end of this semester but the catch is I’m transferring to NCSU in the spring. I really want to go to Carolina in the end (yes I know 3 schools). I just would like to know my chances. I got a 1430 on the SAT and a 33 on the ACT. My high school gpa was a 4.17w and a 3.5 uw. I’m a current Chem major at uncc and I know I’ll be ending with a 4.00gpa. I’ve been volunteering over the summer and at school as well. If you guys could chance me considering my transfer to state (which is what I think is going to be my demise) id really appreciate it!,1573527444,1,0
What is the Monday night spot,From out of down in chapel hill and need a spot,1573524329,1,0
Anyone taken musc121?? How is it,,1573522922,1,0
Thoughts on SOCI 122 w/ Kathleen Fitzgerald?,,1573522654,1,0
Is spanish 101 not offered in the spring?,"I didn't get spanish 101 first semester because they were all filled up, and now it looks like there's only one SPAN 101 but its online and requires special permission. Am I just gonna have to wait till next year to start spanish?",1573520005,1,0
PX Gen Ed requirement,"For the PX (science with a lab), which class should I take? I'm an ECON major so it doesn't matter that much. I've heard Bio is easier than Chem, is that true?",1573510329,1,0
How is the French department here?,I’m looking to try French for self enrichment. I will be completing my language gen eds this semester with Spanish so I would not be afraid to take some French courses pass/fail if need be.,1573508169,1,0
Yoga and Pilates LFIT,"How hard is the yoga and pilates lfit? I'm considering whether or not I should go for it or try for something possibly easier, like indoor sports.",1573506779,1,0
Registration Question,"I have a pretty late registration (tomorrow at 1:15) and I’m worried about getting into classes I need for applying to BME (bio 101, calc 2, physics 118). How likely am I to get into these classes with such a late registration?",1573495822,1,0
Math 381 with Thompson?,Very small sample size on ratemyprofessor but he seems pretty average/bad? Can anyone comment on the difficulty of the class?,1573494934,1,0
Best ECON 101 option?,"Title says all. What is the best route for ECON 101? I have a general interest and slight experience in economics, but I'd like to learn more about the subject, rather than it being a pain in the back to take the class. I've heard that Stout or Balaban might be the best option (but they have flipped classrooms). Let me know what your experiences were like.",1573494653,1,0
How hard would these classes all be together?,"Would taking Econ 410, Busi 102, and stor 155 all at the same time be a little too hard? I'm guessing yes but I wanna ask some of y'all first",1573483905,1,0
