title,selftext,created_utc,score,total_awards_received
PSA: The UNC Class Profile for the Fall 2019 incoming freshman class is out!,"You can view it [here](https://admissions.unc.edu/apply/class-profile-2/)!

Similar to last year but interesting nonetheless.",1571538944,5,0
English 105 Survey,"My group made a survey for an English 105 assignment. It’s about UNC student’s opinion on the new football ticket acquiring process. I would like to ask for any UNC student who has time to spare to answer the 15 question survey. Nothing personal is asked except if you have been to a game before, if you plan on going, and your college year. Thanks in advance!

Survey: https://unc.az1.qualtrics.com/jfe/form/SV_2lSUsG2q2Kxw8kd

Also you may need to sign in with duo.",1571536148,0,0
Mold is an issue for UNC students at both campus dorms and privately managed Granville,,1571523050,27,0
The COMP departement is wanting to become a school. What do yall think of that?,"Its been an ongoing problem at UNC that the comp department cannot keep up with the student demand, the department has nearly quintupled in 10 years iirc! Class sizes are absurd, and students are getting jipped of valuable professor time. Many large courses are starting to be run by TAs (see 426), and other courses are hardly givin the time of day by the prof (see 411 last semester with Bishop, or 550 this year with Pizer). It almost seems like many people in the department are fed up with the whole thing, and students are left to deal with the fallout. And I can see why. How can a single professor manage 200 students? Much less balance their important research, like literally helping cure cancer. Demand for TAs is high but many TAs are left high and dry and sometimes left overworked if my sources arent exaggerating. Is making the department into a school and having entrance requirements the best choice though? I mean in a perfect world students would be able to study what they like and the school could just hire more people and purchase more resources. As much as I hate the idea of denying students education they desire, having lackluster courses is getting to be annoying and devalues the major. As stated early on this sub, most prof dont teach more than the average google search. Also, it has been said many students only get into CS because they beleive that is their ticket to an easy 6 fig salary, but they hate the major.

Im a bit split. What do you guys think should be done? What are some things that could be improved? Has CS always been like this?",1571513332,32,0
How long did it take y’all to get an admissions decision? (EA),,1571444139,0,0
Does anyone have a fantasy basketball league I can join?,,1571435538,2,0
Had a good view of your campus from my office today,,1571433000,1,0
Question about EA Application,"I submitted my ea application on the 14th, and they have all my materials including my scores and one recommendation. They only require one reccomendation, but I have another teacher working on one that will be turned in next week (deadline is nov. 1). UNC’s website says that they begin reading applications once all required materials are in, does this mean that they could potentially read my application without the second recommendation? How do I prevent this from happening?

For reference, this is what their website says

“we ask that you submit the other parts of the application (transcripts, test scores and supporting materials from your teacher/counselor) by November 1 for Early Action, February 1 for Regular Decision, and March 1 for the Transfer deadline. Of course, the sooner you complete your application, the sooner we’ll be able to review it. After you’ve submitted your application, we’ll send you information on how to check the status of your application and view any missing items online.""",1571429205,1,0
Studying Abroad?,"Hey everyone,

Has anyone studied abroad in Grenoble, France or the NYU campus in Shanghai, China that could give me info on their experience? I'm going back and forth between studying abroad over the summer, I keep on overthinking everything. Any other info. on other study abroad experiences would also be greatly appreciated (especially from introverts).

Thanks.",1571424289,12,0
Are there any actual benefits to applying EA instead of RD?,"See title. Also, I am aware that the EA deadline has passed. Just wondering because I am also doing Questbridge.

Thanks in advance!",1571372876,7,0
"Coby White Full Highlights 2019.10.17 Bulls vs Hawks - 29 Pts, 6-8 3PM! | FreeDawkins",,1571367146,36,0
I am applying to UNC this year and was wondering if someone could help me pick between two essays?,"I wrote three essays. One turned out really well. The other two, I am not happy about. I would like if someone could suggest edits on the one they think has better potential and sounds better. Thanks!",1571353229,4,0
"X-Posting from r/Raleigh: If you interested in both Indie Games and/or Beer, come to Oak City Indie Games (This Saturday, Oct 19th). Thanks to Voodoo Ranger IPA, it's FREE.99 to attend!",,1571350392,4,0
How do I pay for the Triangle Buses,"I'm going to a concert in Raleigh on Saturday, but I've never used the Triangle buses. Can I just pay the fare when I board or do I need a pass (if so where do I get one)?",1571349552,8,0
How hard is the business major?,Just got into KF today. How hard is the UG business major? Are there classes that are pretty much free As or will I need to keep studying? If you can't tell i'm a slacker.,1571285430,8,0
How is the STOR major/minor?,"Whoever is in it, do you like the courses/ professors?",1571282986,6,0
Withdrawing to part time question,"Hi all

Okay so I’m taking 14 credits and want to drop a 4 credit class due to protecting my GPA. 

What’s the procedure on doing this and going under 12 credits?",1571274933,2,0
Parking at OCLQ,Do I need to register my friend’s car for parking on tuesday and wednesday of thanksgiving break? The university is closed on thursday and friday and weekend parking is free so I’m assuming she will be good those days. I will also be paying for overnight parking on tuesday and wednesday night so I just need the daytime covered.,1571272200,3,0
Parking question OCLQ,"My friend will be parking on thanksgiving break from tuesday afternoon to sunday afternoon. The university is closed on thursday and friday, and parking is free on weekends. I am paying for over night parking for tuesday and wednesday night. My only question is how can I register her car for the daytime on wednesday and tuesday. Thank you!",1571270329,1,0
UNC kenan flagler UBP megathread(10/17),post results here with stats and any info you're comfortable with sharing. good luck everyone!,1571241073,15,0
Do Econ 420 exams get curved?,,1571202343,9,0
Does anyone want to do a quick look at my UNC Supplements?,UNC extended their deadline and I want to take advantage of the time by revising my supplements a bit more.,1571195811,1,0
Send TOEFL scores ?,"I've sent my TOEFL score the same day as SAT scores (Oct. 5th), but the Portal said that they've received my SAT score but not my TOELF score. I'm wondering if this is fine and if the college still considers my application. thxxxxxxx",1571188454,3,0
Looking for UNC students interested in music and emotions!,"Hi there! We the team at[ www.ensu.com](https://www.ensu.com/), are building an app related to music consumption and emotions. The premise is that if you listen to Spotify, we can help you understand how your music listening correlates to mood / emotion states (specific for you), as well as giving you new insights around patterns in your moods and emotions over time.

We're a team of mental health passionate people who are all recently out of college, and we're looking to get input from UNC students (we're designing the app specifically for college students) on the concept and the app. We're still in beta so would appreciate y'all signingup and giving us feedback!

If you're interested, please go to[ www.ensu.com](https://www.ensu.com/) and sign up! Feel free to message me if you have any questions :)",1571182539,1,0
Question for b-school applicants,When you apply does your intended major on sakai change from pre business to business administration?,1571162271,3,0
UNC Document Viewing," [https://mycarolina.unc.edu/portal/appointment](https://mycarolina.unc.edu/portal/appointment) 

&amp;#x200B;

If you go to the above link, you can look at your admissions documents. This includes what admissions officers said about you and how they scored you in each category, as well as letters of rec if your FERPA rights weren't waived. It's interesting information and you have the right to view it.",1571152495,42,0
October 15 Deadline passed? Even though today is still October 15th?,"I have read online from multiple posts that you could submit early applications to UNC till 11:59 PM on October 15th, but when I log into the the common app website it says that the deadline has passed.

What should I do, should I submit my application anyway?
Should I call the UNC submissions office and ask?
Should I call the common app organization and ask?

Please help, I didn’t submit yesterday as one of my “other recommenders” hadn’t put in his recommendation for me and he told me to talk to him about it today, and a bunch of my friends said that some people’s deadlines had passed, while others hadn’t.",1571152392,3,0
Is there any place on campus where you can purchase coffee creamer?,,1571151930,3,0
Should I pass/fail LFIT?,I’m losing some points from attendance and am missing 2 quizzes. Do they offer extra credit or bonus points? It doesn’t seem like I can make an A anymore.,1571127925,5,0
Optimal Plus Swipe.. Discuss,"I have come to the conclusion that the P6 at Wendy’s is your best bang for your buck option for a plus swipe... let me elaborate.
You get 2 Jr Bacon Cheese Burgers, fries and a drink. That is quite substantial. The fact that it is the only (true) late night option since it is available until 1am is a bonus. 

What do y’all think..?",1571109726,5,0
Any UNC students willing to read my Common App Essay?,\^,1571101626,2,0
"HS Senior, anyone want to read my supplements?",Submitting my EA application to UNC tomorrow. Anyone want to take a look at my supplements and give any feedback?,1571089444,1,0
Why does UNC have the worst grass?,Just wondering why we have such shitty grass considering quad-sitting is so popular. Would really appreciate nicer grass.,1571081147,3,0
Finding a rideshare/share a cab to RDU airport for super early flight on Thursday (Oct 17),"If anyone is heading to the airport for an early flight on Thursday (Oct 17) and have a ride/want to share a cab or Uber, please message me! My flight takes off at 7:20 AM so it's too early to be asking friends to drive me over/most of them are already out of town anyways by then. I'd aim to be at the airport by 6:30 at the latest.

Or where else should I post requests for rideshares like this? Is there a group on FB or a specific website?",1571011968,1,0
Work study,"Hi Hello.
So I applied for work-study last month and I don't know if there is something. The jobs site just says submitted 
Do i have to go to the places or just wait 
I just really need to work
1. Halloweeeeennnnnnn 
2. Don't just want to eat at lenoir
3. Halloween
4. Many other reasons",1571011369,9,0
Application Deadline,"Does anyone know if the application on Common App is due 11:59pm on the 15th or the 14th, the deadline says October 15th so I’m not sure if that means that you can submit it on the 15th or not.",1571008998,4,0
Is the UNC EA Deadline due today at 11:59 PM or tomorrow at 11:59 PM?,On the Common App,1571000592,0,0
any current student willing to read over my common app &amp; supplements?,Hello! My name’s Emma and I’m going to submit my UNC application (hopefully) tonight aaah. I’d love to get final thoughts on my essays from current UNC students. Thank you so much for your time! :),1570997832,2,0
Common app and supplement review?,Hello! I am applying EA to UNC. Will anyone mind reading my common app and supplements? Thank you so much!,1570991407,0,0
UNC App question—Does applying to Honors Carolina give me a better chance at scholarships?,"I’m not particularly interested in Honors Carolina, as I feel like UNC would be challenging enough for me without the added rigor of honors coursework. However, would I have a better chance at scholarships at UNC if I do apply to Honors as well?",1570989914,1,0
Any current students willing to read my CommonApp Essay?,"Applying EA, thanks",1570986741,3,0
Run an errand for me pls,I will give someone money to buy me boxed wine and pay extra for the trip (receipt pls). PM me,1570929636,0,0
Didn’t the whistler get banned from campus,"I remember seeing this article https://www.dailytarheel.com/article/2019/09/whistler-banned-0925 but I just saw (er, heard?) him by the old well 🤔",1570907109,23,0
Best Professors for MATH 232?,,1570897817,9,0
Is subleasing a realistic option,I plan on getting a 12 month lease at the union but also want to be outside of chapel hill during the summer (fuck this humid ass place). Is subleasing a realistic option or will I have trouble finding a subleaser?,1570814995,14,0
What are the differences between the Ram Village Apartments? Which one is the best?,Looking for a place for next year 🙃  p ewww,1570765025,6,0
Best place for a haircut?,"Curious where the men go for a haircut as I’m needing one. Nothing fancy, just a buzz and trim.",1570755838,5,0
Does UNC do an autograph signing with the basketball team for students at any point in the year?,First year at UNC.  I thought it would be cool to have the chance to meet the players but wasn't sure if Late Night With Roy is the only real fan event?  Thanks in advance,1570715284,6,0
"Questions about School of Public Health, Scholarships, and Honors Carolina from a Prospective OOS Student","I’m a current senior applying to UNC for Health Policy and Management or Biostats. I’m hoping to also be considered for the Chancellors Science Scholars program and Honors Carolina. I would be really grateful if anyone who is currently in any of those programs could share some of their experiences so far (pros and cons)!

Also, because of my interests, all of my essays, including my common app, are related to STEM. I’m writing about biochem research, health care equity, and volunteering in a hospital. Should I reconsider and modify essays to include a more well-rounded perspective on my interests so they aren’t all related to science and healthcare?",1570680569,2,0
Places to take a private phone call?,"I have a phone interview tomorrow shortly after my class ends in the morning, so I won’t have time to go home or to my car to take the call in private. Are there rooms on campus anywhere I could use without interruption for a quiet phone interview?",1570675801,5,0
Is it just me or are people more depressed this year?,"So I'm currently a sophomore, and when I ask my other sophomore friends how their semester has been, a lot of them have been telling me that it really has not been good for them and that their first year here was way better when it's literally the exact opposite for me. Has anyone else run into this?",1570671949,21,0
How’s the gym at UNC?,"I’m applying this year, and I also really want to work on my physique. Especially muscle gain. I’m like 140 lbs and want to get to 170 in the next three years. So I was kinda curious",1570664988,3,0
Best Professors for Math 231?,Professors you recommend Math 231??? Are there any I should avoid like the plague?,1570662739,2,0
Does the BUSI 102 final usually get curved?,"Has anyone had their BUSI 102 (Skender) final curved? My friends and I just took it today and holy cow - none of us even had time to finish all the problems. We all had high As on the midterm and now we're freaking out a bit. People on rate my professor said he usually curves the final a lot, but I was wondering by how much? We'd love to come out with As or Bs in the class (obviously lol) and were just wondering what to expect. Thanks!",1570658657,2,0
Sophomore honors carolina application,"Did any other sophomores apply to Honors Carolina this semester?  They said they should tell us who got it in about three weeks, has anyone been notified?  Does getting nothing mean no?  There's very little explanation of the process on their website lol thanks in advance",1570654439,2,0
Where to play piano,"So I want to practice playing the piano, but my dorm community does not have one. I heard about Hill Hall, but read you have to be music major or pay for a permit.  Where I can practice as a non music major?",1570651897,3,0
Do they curve chem 101 lab??,Plz say yes,1570637130,19,0
Help!,Do they curve chem 101 lab ???,1570636842,1,0
Anyone know of a presta valve bike pump around campus?,Someone broke the one outside greenlaw and my tires are on the struggle side of low,1570627273,3,0
Do any of you know the GPA percentiles here?,"I mean for the undergraduate student body. What is the average GPA, 85th PCT, 90th PCT, and 95th PCT?

A lot of schools post this but I can't find any data on UNC.",1570597146,3,0
Scared Transfer,"Hey, so I’m an incoming Dramatic Arts major and music minor from community college who’s about to enter as a junior this fall. I’m really excited to get started at UNC, but I’m also kinda terrified. My family is extremely close, and I’ve never been away from them for more than ten days. Also, my best friend is at ECU (admittedly where I thought I’d be next year). I don’t wanna go up and be a homesick dorm rat, any advice on how to be successful at UNC?",1570568670,2,0
has anyone been caught for breaking the honor code / cheating on a paper before?,i don’t know what to expect and i am panicking very hard. also i didn’t even copy a paper but i did copy an outline to guide me so i guess that’s cheating. do i be honest? do i fight it? will i get kicked out??? should i drop the class?,1570551887,0,0
Why does the RU bus wait in the family medicine circle for so long?,It seems like forever that it’s just sitting there. Does anyone know why?,1570551570,17,0
best places to put flyers up around campus?,they're flyers about free practice tests for professional exams like GRE/MCAT etc,1570550207,7,0
Best Dry Cleaners in the area?,,1570500193,5,0
Where do seniors stay if they happen to choose to stay on campus?,I am ideally looking to have a room to myself. Anywhere on north campus. I'll be a senior (but am probably going to stay an extra year due to being a transfer and not having enough time). So basically a junior again.,1570486294,4,0
intramural heels or rams,"so for intramural sports theres always two leagues, mens heels and mens rams. is there a difference? or does it not matter which one i join?",1570480770,5,0
(HIRING) Summer Jobs for UNC Students,[removed],1570478951,1,0
Who is the person in the Rameses suit?,Currently procrastinating on a paper and this question popped in my mind.,1574619922,1,0
Bio 101 placement test,"Anyone taken the placement test for bio 101/L? I’m taking in Jan, wondering what to review.",1574560759,1,0
How is McIver dorm?,,1574527483,1,0
Is it feasible/prudent to stay nearby at an inn before school commences in Jan?,"I'm thinking about arriving at Chapel Hill on 31 Dec or 1 Jan (aiming for the latter), staying at an inn near to UNC and wait till housing opens on 5 Jan to move in. Since I'm an exchange student and know nothing about the area, can anyone tell me what it'd usually be like during that time period? Will there be difficulty accessing food? or is there something I've missed?

I'm not sure if I'll execute this idea, but any recommendations on what I can do during these few days would be highly appreciated.

Before some of you ask, the reason for arriving at such an awkward time/date is because the flight costs like half of what it'd be if I arrive on 5 Jan...",1574518830,1,0
UNC Nursing!!! A few questions...,"I was wondering how hard is it exactly to get into the nursing school at UNC, and the characteristics (gender, GPA, extracurricular activities, classes, high school GPA, etc) of people who usually get in vs people who get rejected? Thanks in advance, you're helping a worried high school junior out :)",1574475141,1,0
Prospective Out of State Student,"Hello everyone, I am a senior in high school and I am considering applying to UNC. The problem, however, is that I am out of state. If any of you are out of state can you maybe offer some insight into how much it costs?",1574471927,1,0
Spencer Dorm,"I got a single on the third floor, can anyone tell me about this dorm? thanks",1574448744,1,0
UNC students create ‘anti-racist’ alert system as tensions over Silent Sam still fester," Racial tensions on North Carolina’s flagship campus continue to persist. Students at the University of North Carolina Chapel Hill have created a “UNC Anti-Racist Alerts” texting system to warn each other when pro-Silent Sam demonstrators are on or near campus.

“SMS alerts when white supremacists are at UNC-CH. … Not an emergency service nor university affiliated,” its Twitter page [**states**](https://twitter.com/UNCAlerts).

The alert system was created last month as some continue to clash over the Confederate statue Silent Sam, which was [**torn down**](https://www.thecollegefix.com/protesters-forcibly-topple-confederate-war-memorial-statue-at-unc/) by students and its pedestal [**removed**](https://www.thecollegefix.com/photos-show-unc-has-wiped-out-every-last-scrap-of-silent-sam-from-campus/) by the school last year.

from

 [https://www.thecollegefix.com/unc-students-create-anti-racist-alert-system-as-tensions-over-silent-sam-still-fester/](https://www.thecollegefix.com/unc-students-create-anti-racist-alert-system-as-tensions-over-silent-sam-still-fester/)",1574439576,1,0
Which dorms have Pod style bathrooms asides from Joyner?,Also anyone know which dorms have the largest rooms?,1574437936,1,0
UNC Financial Aid AMA,"Hey Everyone

I currently work in the financial aid office and I thought that some of you may be interested in AMA regarding Financial Aid and what not so I reached out to a mod, got approval, and I’m here to answer any questions that you may have. 

To start with, as many of you know FERPA protects the rights of college students and because of that I am not allowed to get specific in terms of anyone’s exact aid numbers, if we have received a specific document from them and things of that nature. But anything else question wise, I’m more than willing to answer from current or prospective students.

Also if your question is something that I can’t answer (I’ll let you know if that’s the case) be sure to schedule a appointment at our office, go to drop in hours, or give us a call. We are located at 111 Pettigrew hall on North Campus. 

Feel free to ask any questions you have and I’ll get to it as soon as I can.",1574431946,1,0
Weird acapella music,Anyone hear some acapella music near chase hall going toward main campus. Im coming home at 1am and I hear it just wondering what it is.,1574400785,1,0
Class scheldue into calendar,"Hi there, incoming exchange student from Australia! At my home uni they provide a link to put your class scheldue into Google Calendar/iCal etc.. Just wondering if there's any way to do this with UNC or do we have to manually put it in ourselves? Thanks!",1574383139,1,0
Casual discussion thread,"Let’s use this thread to just talk about UNC, student life, or just to make friends!",1574372961,1,0
Anyone missing a dog around north Columbia street?,,1574358538,1,0
Grade Needed for MATH 547 and STOR 435,"Stats major who may end up with a D in calc 3. One adviser said I only need a D to move on, but another said I need a C. Anyone know what I actually need?",1574332767,1,0
Don't take ARTS 82,Don't,1574322943,1,0
"Is comp 110, chem 102 and 102L, and math 231 in one semester doable?","My other two classes are span 402 which will be pretty easy, and engl 105. I’m not sure if I’ll be able to handle all three of the stem ones at once. Has anybody done this or something similar?",1574295378,1,0
Question about admissions,dont want this to turn into a chance me post so ill just ask if a 1520 is considered a good/low sat score for unc,1574291666,1,0
does anyone know if Cobb deck is normal parking hours tonight,There’s a basketball game so I’m not sure,1574288412,1,0
Transfer,[removed],1574273436,1,0
Chance Me,[removed],1574273268,1,0
Housing Selection 2020-2021,How does it work? I got assigned 8:56 AM this Friday. Is this an early time or do people start selecting rooms like now? What are my odds of getting a single?,1574270261,1,0
Admission,"Good morning all,

I got 1210 on my November sat and there is no more time left to take it again,

I want to ask if there is anybody in this group that got accepted to UNC Chapell Hill with a 

low SAT score?

Thanks in advance!",1574259918,1,0
How is physics here?,"Was thinking about taking PHYS 114 summer session 2, but I've heard from some sources that a lot of people here actually take Physics I and II at NC State because apparently it's not very good here? What are your thoughts?",1574215019,1,0
"What are some classes that are ""hidden gems""? Professors?","What are your ""lesser known"" favorite classes?",1574209025,1,0
