title,selftext,created_utc,score,total_awards_received
How I become a female student athlete?,Don't care what sport I just wanna join a moped gang.,1568767700,19,0
Easiest ECON 400+ Elective,,1568767244,1,0
Is comp 101 gonna be offer again,Do they still offer comp 101 here because I can’t take another semester of math I suck at math 110 but I need comp 110 for my major but for me to take it I need comp 101 or another math after 110,1568765991,1,0
Student Section Football Seating,"If my family already has tickets to Saturday's game, can they come sit with me in the student section?",1568765960,0,0
How do you get Clemson tickets?,"Usually, we would receive a link indicating that we can get on a virtual queue. However, that email hasn't been sent out yet and the game is two weeks away",1568755485,1,0
Best restrooms on campus?,Really want to hear responses. Lol/,1568749945,3,0
unc football tickets policy,"So I won student tickets for the app state game this weekend through the student lottery but will no longer be going. Am I allowed to sell or transfer these tickets? Can only students use this ticket? 

Sorry I am so used to the old one-card policy I am just very confused.",1568748794,2,0
Kessing?,"Walking back to my dorm today, I noticed a tragic sight... there was a tarp over Kessing outdoor pool. Just when I thought maybe they were covering the water, I also noticed to chairs were set up around the perimeter. Is this the seasonal end for the eighth wonder of the world in terms of cooling down after sweating like no tomorrow in Woollen??",1568746256,1,0
Know who this belongs to? Found it on the NS bus (number 1713),,1568743384,3,0
what do i do if i forgot to take my keys with me?,who can i ask to open the door for me?,1568717821,0,0
Favorite thing to get at Med Deli,"The title says it all. This includes sandwiches, hot buffet (ie the chicken+rice), and sides (of course).",1568693226,3,0
I just want internet points.,,1568678731,59,0
Off-campus housing?,I'm a junior and have lived on campus for three years. Next year I want to live off campus though. How do I look about finding a place and getting roommates? (not sure if my roommate this year would like to go off campus with me).,1568659324,3,0
i hate eduroam,why is this wifi SO BAD it never works. you would think with the amount of money im giving to unc that they would at least have some decent wifi,1568652140,19,0
Apple Wallet,Is there a way to add your One Card to Apple Wallet?,1568651893,2,0
LENOIR BURRITO STATION MEATS RANKED?,"my submission:
1. Pulled pig
2. Ground cow
3. Pulled chicken
3. Turkey, ground like cow
4. Tofu when it's good, fried or blackened 
5. Shrimp (universally reviled)",1568582257,19,0
does anyone listen to explosions in the sky?,saw that they're coming to raleigh and i want to go but no one i know listens to them :(,1568571936,9,0
How do you check out electronic books to your Kindle through the UNC library system?,"I can't find any information about this. I see that you can check out actual Kindle readers, but when I try to search for electronic books to check out on the Kindle there isn't any information I can find.",1568569133,4,0
community at UNC,"hey, I'm applying as an OOS freshman this year and I'm struggling a little to write the UNC supplements, so I was wondering if someone could tell me more about the community there -- is it collaborative, etc. thanks!",1568558454,8,0
how do you go about this?,"hi, i’m a relatively new reddit user (had an older account, lost password, yadayada) and this is my first post so go easy on me, fuckers.

im gonna be short and to the point - how do you guys find someone you met at a party and want to talk to again? friend/romantic interest/otherwise, what do you do when you left before you could get any of their information?

all i know is their name and what they’re majoring in - both the name and the major being pretty common, making it feel impossible to believe you’ll see them again.

you felt like they might’ve also had interest in seeing you again, but not enough to the point where they’d go ~really~ looking for you.

do you just hope that you’ll run into this individual again somehow, someway, on a campus with thousands of students? or do you (must not be a pisces) just let it go and give up? 

i feel like my best bet is to keep going to parties with the same type of crowd and hope we’ll run in to each other again - but i have a feeling this might become exhausting.

advice answers criticism - everything welcome",1568536786,12,0
Gf over for the weekend; is there anything going on tonight that her and I could attend?,Any ideas also appreciated.,1568514437,1,0
Nintendo switch won't connect to ethernet after DHCP,"I set up my Nintendo switch with the DHCP for ethernet after I bought an adapter. However even after a day it's not working. It's telling me that it couldn't get the IP address. 

Does anyone know how to fix this? Thanks 🤙🏾",1568502644,3,0
I have finished my UNC supplemental essays!,If someone is kind enough to give feedback on how they are please let me know. My parents couldn’t help and my friends gave really minimum criticism. Thanks!,1568500833,3,0
Information science fb event,Did anyone attend the information science session that they posted about on here. I was in class so I couldn’t attend. Idk if I miss any important information,1568406991,2,0
What's the best Chinese takeout?,"I wanna eat a bunch of Chinese food in my dorm, what place has the best takeout?",1568406459,7,0
"Bernie Sanders will come to UNC on September 19, Young Democrats announce",,1568378336,58,0
New section at Chase is open,"It just opened today, kind of underwhelming though IMO. They pretty much just moved the salad bar and  added some custom salads or something? They don't look that good. The salad bar doesn't have anything new, it's the same stuff. The extra seating is a big plus though.",1572538409,36,0
Alternative to Franklin?,Seems like the weather is going to be crazy tonight. Are people still planning to head there tonight or doing something else?,1572525258,13,0
Can anyone lmk how to get bands for a party tmrw or get me bands?,Probably not gonna work but Thanks lmao,1572495843,0,0
Easy geography electives?,Just want to hear suggestions! :-),1572491901,3,0
"Applying to be an RA, but not sure what to do when applying for housing","Hi guys! 

I’m a current freshman who is seriously thinking about applying to be an RA next year.  If anyone on here applied in the past, what did you do about the housing application?  I don’t want to agree to room with someone just to get the job and have to leave that person alone.  Does anyone have any tips or advice?",1572489160,3,0
"Everyone, meet Trenton Simpson! He is a 5🌟 linebacker who is showing interest in UNC. We need to show him love Saturday because he will he at the game. We need a “We Want Trenton” chant in the student section!! Everyone have a great rest of your week and see you Saturday night!",,1572483048,44,0
"Legendary coach, leader, and pumpkin model. Happy Halloween Tarheels!",,1572469856,44,0
Lenoir worker makes me uncomfortable,"Every time I go to top of Lenoir, the male lightskinned (ish), chubby worker waves and says hi to me. I thought he was just being nice, until today I was eating with a friend when he literally stopped what he was doing to walk over and compliment me. He paid no attention to my friend, and I haven't noticed him to do it anyone else besides me (he probably does tho). It makes me extremely uncomfortable considering I'm a 19 year old girl and he's 40 something. My friend who was with me told me he has autism so I can't just be like ""leave me alone"". What should I do??",1572462467,0,0
What time does Franklin st. Halloween/costume shit usually start?,Title.,1572459929,7,0
Is there any place on campus to get an eye exam?,\^,1572452197,8,0
Premed at UNC,"Hey guys—- prospective student here. I was wondering if any of you could give me deeper insight into the premed experience at UNC (e.g. professor quality and accessibility, class difficulty, research and shadowing opportunities, etc.). Thanks in advance!",1572404904,6,0
Morehead Planetarium Survey,"Hi fellow Tar Heels. I am writing a paper on the changing perception of the Morehead Planetarium and would really appreciate it if you all could fill out my survey (it takes &gt; 1 minute!). Thanks friends

 [Student Body Perception of Morehead Planetarium](https://unc.az1.qualtrics.com/jfe/form/SV_3gAxifiwWC73DJX)",1572391823,5,0
Got accepted into the online MBA program!,"Just wanted to let you guys know. BTW, I’m a NCSU grad, so I’m glad to pursue a graduate degree from another top notch NC university. 

If anyone had been through the program, I’d love to hear what you thought of it and if anyone had any tips. 

Thanks!",1572384620,13,0
Thoughts on CAPS?,Have heard mixed opinions...,1572366371,7,0
Getting an on-campus​ job?,"Hey guys,

I'm currently broke as hell and need to make some extra money by working a job. There was only one on-campus job on Handshake (for the ITS Service Desk) which I applied for and got denied. Are there any other ways to get a job on campus? I don't have a car so I can't really work anywhere else. Thanks in advance.",1572315772,2,0
Roommate won't turn down thermostat?,"So the thermostat is on my roommate's side of the room and he constantly turns the thermostat up (like both sliders on the thermostat almost all the way up; we live in Cobb) and it's literally unbearable. I can't reach the thermostat because he's always in the way playing video games on his computer and if I tell him to turn it down or if I turn it down when he isn't in the room, he'll turn it right back up. It's literally impossible to communicate with him because he's very antisocial and always gives me snippy, one-word answers if I try to talk to him. Any advice on what to do? I really do not want to get into confrontations.",1572314628,11,0
Order of Ghimgoul,Does anyone know how to apply or join the historic order of ghimgoul?,1572291465,4,0
Studio Arts Courses,"I was wondering if anyone who is not an art major/minor has taken one of the 100 level studio art courses and what they thought about it. Did you like it? Did your art actually have to be top tier to get an A? I need a VP course and I'd honestly rather take a course like this, but I'd like some more input.",1572287994,2,0
The End of an Era: the Legendary 11 Foot 8 Bridge in Durham is being raised to 12 feet 4,,1572267251,23,0
How screwed am I if I forgot to do the first year modules,"So they told us at orientation that they would email us before school started with these modules on sexual assault and the honor code we had to. They emailed it to us the day before FDOC and I promptly forgot about it. Just now learning that they said they would put a hold on your registration if you didn’t do it, kind of freaking out lol. I’m a transfer rising junior so I need some classes ASAP. I realize this is my fault. Meeting an advisor tomorrow but like... can anyone give me an idea of how fucked I am",1572235813,2,0
Good boba?,Where do you guys go to get your boba fix.,1572230029,9,0
"Am I crazy, or did they do away with Friday classes?",Every MW class I see is just that — MW. Not the typical (dreaded) MWF. Did anyone else notice this? Can anyone confirm?,1572195845,4,0
Can you major in computer science with no experience?,I’m a freshman and I’ve never taken any computer science classes. Is comp110 a good introduction to the rest of the major courses?,1572191703,4,0
Can you buy a basketball jersey at the games?,"Wanted to get a jersey for my girlfriend, but it's hard to find a white youth XL size for her.  Do they sell jerseys at the game, or does anyone have any recommendations on where to find one?  I tried finding one online but they don't have size XL",1572187093,4,0
DOOK SUX UPVOTE PARTY,Chazz Surrat is my dad.,1572135554,126,0
how competitive is business administration at chapel hill? Is 22 ACT enough for it?,Title,1572135223,0,0
Found Watch After UNC vs. Duke Football Game 10/26/19,Message me and let me know exactly what and where via DM. I just want to help whoever out :),1572134146,10,0
Why study maths at University of North Carolina-Chapel Hill when they dont teach you that it is proven maths ends in meaninglessness/contradiction: 6 proofs/examples,"Why study maths at  University of North Carolina-Chapel Hill when they dont teach you that it is proven maths ends in meaninglessness/contradiction: 6 proofs/examples

http://gamahucherpress.yellowgum.com/wp-content/uploads/MATHEMATICS.pdf

http://gamahucherpress.yellowgum.com/wp-content/uploads/All-things-are-possible.pdf

Magister colin leslie dean the only modern Renaissance man with 9 degrees including 4 masters: B,Sc, BA, B.Litt(Hons), MA, B.Litt(Hons), MA, MA (Psychoanalytic studies), Master of Psychoanalytic studies, Grad Cert (Literary studies) : who proved Godels theorems to be invalid

http://gamahucherpress.yellowgum.com/wp-content/uploads/GODEL5.pdf

He is also Australia's leading erotic poet

http://gamahucherpress.yellowgum.com/book-genre/poetry/

and showed science/mathematics ends in meaninglessness

1)Mathematics/science ends in contradiction:an integer=a non-integer

http://gamahucherpress.yellowgum.com/wp-content/uploads/All-things-are-possible.pdf

Mathematics ends in contradiction:6 examples

http://gamahucherpress.yellowgum.com/wp-content/uploads/MATHEMATICS.pdf

2) the theory of evolution ends in meaninglessness

http://gamahucherpress.yellowgum.com/books/philosophy/Natural_selection.pdf

3) biology is not a science

http://gamahucherpress.yellowgum.com/wp-content/uploads/Bbiology-is-not-a-science.pdf

3) biologists dont know what a species is-thus theory of evolution is nonsense

http://gamahucherpress.yellowgum.com/wp-content/uploads/BIOLOGISTS-DON.pdf

all very simple and clear

the facts are

1) 1 is a finite number it stops

A finite decimal is one that stops, like 0.157

A non-finite decimal like 0.999... does not stop

when a finite number 1 = a non-finite number 0.999.. then maths ends in contradiction

another way

1 is an integer a whole number

0.888... is a non-integer it is not a whole number

0.999... is a non-integer not a whole number

when a integer 1 =a non-integer 0.999... maths ends in contradiction

2)1)Darwins book is called On the Origin of Species by Means of Natural Selection ....

but

this paper shows natural selection is not the origin of new species Natural selection is not the origin of new species

Natural selection does not generate new genes/species Natural selection adds no new genetic information as it only deals with the passing on of genes/traits already present and it will be pointed out genetics cannot account for

the generation of new species/genes as it is claimed the generation of new genes [via mutation] is a random process due to radiation, viruses, chemicals etc and genetic cannot account for these process happening as they are out side the scope of genetics physics, chaos theory etc may give some explanation but genetics cant

2) Biologist cant tell us what a species is -without contradiction thus evolution theory ie evolving species is nonsense

Biologists agree there is species hybridization

but that contradicts what a species is

3) biologist tell us they investigate life

but

they cant tell us what life is-they can tell us what life does but cant tell us what life is they cant even give a definition of life that is not nonsense",1572129090,0,0
Best professor for Chem 430?,"Hey everyone,

I'm signing up for classes next semester and was wondering if Brian Hogan was the best professor for Chem 430 or if there were a better professor. I saw his ratemyprofessor (rating of 3.7), but I'm still unsure. I'll be taking phys 114 and bio 205 as well. 

Thanks",1572113256,5,0
Math 233?,Should I take katherine Newhall or Prakash Belkale?,1572058400,3,0
How do we find seminar classes?,"Also, what are some good seminars for policy, global studies, prospective public health major?",1572030992,1,0
GLBL 210 or POLI 150?,How are these classes? How much reading/homework/writing?,1572030339,2,0
Fun/Interesting things to do?,My friend is visiting me this weekend (Fri-Sun) so I just wanted to see if anyone knew of any must-do things at UNC besides exploring Franklin. I know it might be hard to find stuff to do since it’ll be the weekend but literally anything helps. Thank you!,1571984391,3,0
orgo w/ austell?,"Is it worth waiting to take orgo if austell if teaching both semesters this spring? i've heard mixed opinions...

On a side note, how comparable are Comp 110 (Jordan) and 116 (Krishnamurthy) in terms of workload/difficulty? Thanks y'all!",1571969056,3,0
Housing,"If you are in a housing group and you apply for a hall style dorm, will you be put in the same hall as all of the people in your group?",1571968855,5,0
Where can I study with a second monitor?,Hello! Is there a library or study space on campus that offers a second monitor? I've got a lot of research to do on a tiny laptop screen and another monitor would help so much. Thanks!,1571941451,2,0
Comp 110 final,"What is the comp 110 final like? I feel like dog shit, but I don't want to make the final 20% if it is a super difficult final. Thank you!",1571918665,1,0
English 225,"I’m currently a freshman just trying to plan out my second semester and wanted to know if anyone could tell me about English 225 (Shakespeare). I really enjoy Shakespeare’s work and would like to get into more. How difficult is this class and what type of work is assigned? Also, which professor would you recommend? Thank you!",1571896850,3,0
“Go to UNC for the education” my parents said,,1571888898,38,0
Wifi,"Wifi in Hojo is unusable at times for hours on end. Can’t even do my homework assignments, let alone play any games. Ive tried multiple networks and different devices but that doesn’t seem to have an effect. Not sure where I would go to fix this issue since it isn’t just a personal issue, it’s for everyone i’ve talked to in Hojo. Any tips? 

Tested tonight multiple times ranging from .07 - 1 mb/s if anyone’s curious.",1571882145,5,0
UNC Yang Gang," Hey guys, I'm starting a Youth for Yang group here on campus for UNC students in support of Andrew Yang for President! If you haven't heard of him please Google him!! He is one of the only candidates talking about the real issue facing the American economy: massive job loss from AI and automation. His flagship proposal to combat this is called the Freedom Dividend; giving every American citizen $1000/month no strings attached. Anyway, if that sounds interesting or you would like to learn more about how you can get involved, please join the server below or DM me. Thanks! [https://discord.gg/2rfkzD](https://discord.gg/2rfkzD)",1571863536,12,0
Showers in hojo,Ok so I live on the 6th floor of hojo and I haven't been able to get shower water that isn't freezing during any times of the day for about a week. Is this just something I have to deal with or can I report it to someone?,1571859763,20,0
Business School as a Junior?,"This is my first year at UNC as a sophomore, and I am currently studying economics. When the application for KF undergrad opened up in August, I decided not to apply as I wished to study economics instead. Just to keep my options open, will I have the chance to apply next year or even in the Spring? I will have completed STOR 155, ECON 101, and ECON 410 by the time the application opens up. 

&amp;#x200B;

Thanks!",1571855795,5,0
PAGANS and WITCHES! I am starting a student-run pagan organization for pagans &amp; witches at UNC and if you are interested please join the groupme here: https://app.groupme.com/join_group/55137207/iysnHdKb,,1571854470,0,0
what is generally easier chem 101 or bio 101,Obviously neither are easy but which one is better,1571845727,3,0
Survey for ENGL 105,"Hello! I need at least 20 responses! It's completely anonymous. Thanks! 

[https://unc.az1.qualtrics.com/jfe/form/SV\_7aD4CLDrYqOTEeF](https://unc.az1.qualtrics.com/jfe/form/SV_7aD4CLDrYqOTEeF)",1571840328,7,0
GoTriangle bus payment,Do GoTriangle/GoRaleigh buses accept debit card payments or do I need exact change/cash?,1571812311,5,0
CO2 Levels in Our Atmosphere - globalGrowth,"globalGrowth is a cryptocurrency token pegged to the inverse of the current carbon-dioxide levels reported by the NOAA at their observatory in Mauna Loa, Hawaii, USA. So what this means is that when the CO2 levels in our atmosphere decrease, the price of the token will rise and if the CO2 levels were to increase, the price of the token will go down. This will incentivize the public to decrease their own individual CO2 output. If you are at all interested, please check out our github: globalgrowth.github.io",1571795072,0,0
Most fun things to do on Halloween?,"I saw that Franklin Street gets worse each year, and was wondering if I should do something instead. I haven't done Franklin St before. What are y'all doing on Halloween?",1571788582,8,0
Aussie/Z-land Roommate for 2020-2021,"So my plans to room with someone fell through, no biggie. Thought I would give a shot here. Honestly, if you're from Australia or New Zealand that is a plus, I just love those places, accents, and culture so I think we'd get along well (god, I know that sounds weird, but I want and Aussie/Z-land friend). If you snore, I'm sorry dude, I cant do that. Currently a Junior. Thinking of living in Kegan community on North Campus. PM me if you are interested. I'm a guy BTW.",1571780522,0,0
McCombs for MATH 233,"I’ve seen good reviews for Math 231, just curious about MATH 233. Should I wait till next semester for Linda green? Or is he good too",1571767883,3,0
What exactly happens if I declare a class as pass/fail,"So what exactly happens if I declare a course as pass/fail? In particular I care about the following two hypothetical scenarios:

So let's say hypothetically I decide to declare my ENG 105i as a pass/fail, does that mean that this course's grade will not count towards my GPA but I still get the gen ed credit for it?

How does this work for major specific classes? If I'm taking a class that will count towards my major and then I decide to pass/fail it, then does that course no longer count towards my major?",1571760540,6,0
When is the last day to withdraw (W) from a class?,Bombed the midterm,1571720127,9,0
Easy 1 credit hour class??,"I need a 1 credit hour class that will count for graduation. Preferably one with minimal work/optional attendance. 

I wanted to take a PHYA but those don’t count towards graduation.",1571704168,10,0
Looking to transfer in as a sophomore. Currently have all As. I made a 26 on the act in high school. Should I take it again?,,1571696032,4,0
Does Econ 420 get easier in the second half?,Or does it get worse cuz my GPA is crying,1571691672,4,0
Are student ticket lottery emails out?,"My friend says he wasn’t selected for the Duke game, anyone else get them",1571689877,10,0
"Look on my Works, ye Mighty, and despair!",,1571688183,12,0
"English, Creative Writing, and Philosophy Questions","Hello! I'm applying to UNC for transfer. I plan to major in English with a concentration in Creative Writing and minor in Philosophy. Can anyone tell me what the programs are like? What have your experiences been with the English department in general? The Philosophy department? Are there any professors I should avoid or seek out? What is the workload like? Also, I'd appreciate any general information that is useful to know about the English department/major and the Philosophy minor. 

Thanks! And go Tar Heels!",1571673869,3,0
Enrolling for COMP 401 without 110/116,"Since I plan on taking COMP 401 without having any credit from 110/116, do I need to talk to the instructor or someone to ""unlock"" the course for me to enroll or can we just directly enroll into it during our enrollment period?",1571672769,3,0
MATH 233,"How hard is MATH 233 at UNC? I know its Cal 3 material and somewhat know about the various topics, but never learned in detail about it. 

To give some context, I'm a freshman and this would be the 1st math I'm taking here. I scored 5's on AP Cal AB and BC and I've pretty much self-taught myself math (as all my high school math teachers sucked). But I know that high school doesn't always equal college classes. If it does play a factor, I genuinely like math and find it interesting.

Is it a really hard or scary class or manageable? Anyone have a favorite teacher to recommend? :)",1571672466,7,0
Best Academic Advisors,Who are the best academic advisors?,1571663317,4,0
Housing,Are there any dorms on south campus that aren't first year only dorms? Trying to fill out the housing application for a suite for sophmore year and we don't know where to live. pls help,1571622032,7,0
How is generous is this schools merit aid?,Hello! I am oos and am wondering how generous merit aid is. The school is pretty pricey for oos students and want to see how generous you guys are.,1571619886,1,0
Anyone take HIST 106 with Devereaux?,"I'm thinking about taking HIST 106 - Ancient History with Devereaux in the Spring, but can't find anything about him on Rate my Professors.

Has anyone taken his class before? Any thoughts?",1571619783,1,0
Halloween on Franklin Street?,What do you actually do on franklin that night?,1571605012,13,0
Best coffee shop around campus?,"I’ve been trying to find a coffee shop near campus where I can sit, do work, and drink some quality coffee",1571588416,14,0
Freshman seminars,"I didn't take any this semester for reasons (most were taken up)  and I wanted to take some next semester 
Are there any that are recomended 
I want to do some that aren't stem ( out of comfort zone I'm a comp sci major)",1571546412,3,0
