title,selftext,created_utc,score,total_awards_received
I’m tired of the fetishization of M&amp;T students.,"The females on this campus are out of control. The first time I ate lunch wearing my M&amp;T shirt (with fully covered legs, mind you), I had literally 3 different women try to sit down and court me, like I would know how to talk to a girl. I quickly demonstrated superior knowledge of each of their niche interests, which apparently eliminates me from the dating pool (why shame me for being smart?).

Anyway, that got them to leave but the problem has persisted in the past 3 months and I am so fed up with everybody wanting to get with me. I've taken to moving all the other chairs at tables I sit at to other tables, but yesterday a small asian woman literally pulled up a chair and began ranting about the last STAT 431 midterm. Girl, I don't struggle with STAT 431. I'm an M&amp;T student, not some single degree simpleton. After making it markedly clear that I did NOT in fact want to copulate in a Huntsman GSR, she finally left me alone, but I wish these girls would stop worshipping me just because I am enrolled in the hardest program at Penn (which was not difficult for me to get into, by the way).

The worst are when students from the college attempt to talk to me. We'll be having a nice, platonic conversation, when they inevitably ask the fateful question: ""What's your major?"" As soon as I say those two magnificent letters, I see their whole demeanor change. The doe eyes, the flushed cheeks, the jiggling cleavage. What makes a PPE major think they have a chance with me? Finance and CIS are on whole different planes of existence. I'm not about to impregnate somebody that makes infographics about the gender pay gap  for ""work.""

You may think I'm just remarkably handsome, which I am, but my attractive acquaintances in LSM (they're not smart enough to be friends, but their childlike innocence is sometimes enviable), have literally no problems with this incessant harassment and courting from female creatures. Females see me as an object and a genius, when really I'm so much more: I'm top 100 in the world in Destiny 2. My gray shirt shouldn't reduce me to a bag of meat; if you want my heart, you have to grind with me, raid with me, join my clan, and most of all, watch Rick and Morty with me, and understand it -- no fake fans that shout ""pickle rick"" like its some kind of joke, when it's really the climax of the most tragic episode of season 3. Not that I cried.

If you want somebody for cheap sex, the LSM students are right there (I don't blame you for avoiding PPE majors though). Stop fetishizing my kind for something out of our control. I didn't want to be born a super genius. Hell, sometimes I wish I was an LSM student, moving through the world in ignorant bliss. But I have a responsibility to save the world and create the next Tesla. Seductively touching the iron ring isn't going to make me want to get with you. Come back in a Morty costume, get a return offer from Sequoia, or implement Djikstra's recursively, and then we'll talk.",1637744630,1,0
"Anyone Dropping EALC 151, ENGL 121, or ENGL 112?",Dm me if you are and I’ll bake you a cookie.,1637726871,1,0
Cozy reading spots on/near campus?,Hi! I was wondering if anyone had recommendations about cozy reading spots indoors on campus. I’m looking for a well naturally-lit area that has a more or less intimate atmosphere where one can just curl up and read a good book without it feeling overly formal. The closest I’ve found so far is VP 6th floor but the whole space feels kinda impersonal. I’m picturing more like a small nook in a library by a window or a cute coffee shop. Ahhh I know this is very specific but hopefully the bookworms on here have found some gems. Thanks :),1637726387,1,0
Question about applying to Wharton,"Hi everyone! 

I'm applying to Wharton for the class of 2026, and the intended concentration I'm putting down in my ""Why Wharton"" essay is ""Entrepreneurship &amp; Innovation."" I had a quick question. 

Does Wharton accept students who say they want to do the ""Entrepreneurship and Innovation"" concentration but want to join/start nonprofits in the future? Or do they only want typical for-profit finance kids? 

Please let me know!

Thanks.",1637724284,1,0
Is there any flexibility on the date of a final?,,1637722775,1,0
Curve for FNCE 238 with Michael Stewart,"Hi, 

How's the curve for FNCE 238 with Michael Stewart? Is it hard/easy to get an A?

Thanks!",1637720662,1,0
If anyone dropping Math 513 lemme know!! 🥺,,1637719187,1,0
if anyones going to drop HSOC 150 lmk pls ily &lt;3,title &lt;3,1637717862,1,0
Endemic Covid? / Disillusionment,"I wonder when the US is gonna start bracing itself for endemic COVID. I hate wearing a mask – within 5 minutes of being in class I'm always drenched in sweat. But I've learned to bite my tongue because I think COVID is gonna be here for the long haul. 

Are the Penn Administrators real people, or are they computers? I really can't tell. What is their job? To Administrate by sending noncompliance  emails  multiple times daily? They do not keep us informed about much except for the latest round of shots, tests, and forms. Their emails are always as bare as possible. This institution claims to promote ""democracy"" yet administrators do not attempt to make themselves accessible to student input. Perhaps it's an effect of Covid but I have become increasingly suspicious of all the faceless people working for this University. This has been a pivotal few years and Penn's responses have always been meek, after-the=fact, and never take a strong stance on anything. Didn't universtiy adminstrators once take strong stances on issues that they believed in? Weren't they once leading intellectuals? Is that what happens when current Admins make &gt;$4 million annually for being professional fundraisers?

&amp;#x200B;

\[Anyway...\]

&amp;#x200B;

As a greater % of the population gets vaccinated I'm concerned about immunity and ever-stronger variants going around. On this end, I think a lot of universities around the country are keeping their students in the dark about potentially valuable info that they are likiely discussing behind closed doors. E.g., what is the likelihood that Covid will be a part of our lives for 3 years? 5 years? 10?I think masks are still necessary. The fact that there haven't been any severe on-campus outbreaks yet is an attestment to their effectiveness. We've all gotta get used to  masks for a while most likely; I have a feeling that endemic Covid will be affecting us for years to come. I also credit masks for protecting me from Covid thus far. Some of the long-term effects of Covid sound awful too. There are way too many stories about healthy people dying from Covid  for me to want to take my mask off for long periods. I don't blame anyone for wanting to do it in Pottruck tho. working out with a mask is horrid. 

&amp;#x200B;

I am grateful for access to testing. But I wish Penn had invested more in improving the student experience. Why hasn't Penn created more heated outdoor sitting spaces so that students don't congregate indoors?  This has been much needed. I couldn't imagine making friends as a first-year student this semester. There are far less places to see people with the mask requirement. I feel like I'm in my own bubble and definitely less likely to chat with others while in class.  Hope everyone is hanging in there.",1637712695,1,0
I need to do laundry. Where can I get quarters if my bank is out of state?,"Are there any stores or Penn buildings around campus that have a coin machine? If not, are other ways to get coins online? I'm all out of quarters and have to do laundry ASAP.",1637709019,1,0
URBS270,Might be a long shot but if anyone here is dropping URBS270 please DM me..? 😭,1637708601,1,0
DM me if you’re dropping…,"PSCI298, PSCI235, basically any SPAN300~ course, and any of the basic negotiations courses. I’d really appreciate it 🙏",1637705707,1,0
TIL there are free streamable radio broadcasts for a lot of Penn sports games,"Shoutout to the folks at Quaker Audio Network.

[https://portal.stretchinternet.com/pennaudio/](https://portal.stretchinternet.com/pennaudio/)

You can even listen to prior events on demand, neato",1637700684,1,0
PiT question,Penn in touch says a recitation is open but I can't add it to my schedule. Is there something wrong on my end?,1637700443,1,0
Available Textbooks At The Cheapest Price You Won't Find Anywhere,,1637698869,1,0
Plz DM if you're dropping phys 151 or 141!,"The only section that I can take is Eleni Katifori's section, so if anyone is dropping it, plz lmk!! 🙏 It's a required course for me to take in the spring. Although I did set penn course alert, I'm worried I won't get it...",1637698306,1,0
Math 425 for Freshman,Is it recommended for freshman who did pretty well in Math 240 and haven't got the credit for Math 114 to take Math 425 in freshman spring? Or maybe Math 314 is better?,1637694230,1,0
Mktg101 Lecture Time Change,I am currently in the 3:30 section and trying to change into the 5:15 section for the lecture. Let me know if you want to trade,1637693649,1,0
Penn-In-Touch got me like,,1637692882,1,0
Assessing the difficulty of a brand new class?,"I couldn’t get into PHIL 231 next semester, and was told by the professor that it might be difficult to get in at all, so I’m looking into alternatives. PHIL 157 with Weisberg sounds very interesting, but (as per my understanding) it’s a brand new class. How does one go about assessing the difficulty of a new class, given that there’s no PennCourseReview data or past students to look to for an idea?",1637692648,1,0
How bad is CIS 320 + CIS 240 + Math 240,"Also taking  another easy CIS class (any of those 3: nets 150, cis 545, cis 450) and an easy humanities class",1637692499,1,0
Phys 151 with Klein: Why are there so many contact hours?,,1637690466,1,0
PSCI 107 Add/Drop?,"Wasn't able to get PSCI 107 w/ Trussler during Advance Registration. Is there a chance that I can get it during Add/Drop, or should I email the prof?",1637690365,1,0
Negative vibes at Penn?," Hey everyone, this is my first time posting on Reddit so bear with me. I am currently a freshman in a dual degree program (do not want to reveal which for privacy) and I am really concerned with the overall negative vibes at Penn (for lack of better words). It feels like so many people at Penn, from underclassmen to faculty members, in person and online seems so…miserable. And really forward about it too lol. I understand Penn is difficult and I struggled a lot myself in the beginning (though I am glad to say I have overcome and am currently doing pretty well in my classes), but based on what I’ve heard from friends at other ivies + what I’ve read online, it seems like there’s a disproportionate amount of dysfunction and overall misery here compared other schools. From all of the DP articles that seemingly have a new exposé every week (the Gene therapy program article was terrifying) to Freshmen nearing the end of the semester still dealing with loneliness (which I definitely relate to) to one user on here saying they were r-worded by a CAPS admin and it's getting covered up? That’s just online…talking with upperclassmen and graduate students (from SEAS, Wharton, CAS), their comments are so pessimistic and they always say they are so ready to leave. 

Every other day I go back and forth as to whether it was worth it and if I should transfer. I did pretty well in college admissions and got into Yale, Stanford, Princeton, and other top 20 schools…but Penn’s dual degree was my first choice because it had the career pathway that I thought I wanted to get into (that since has changed slightly) and the extra layer of exclusivity, more advisors, and the community made it seem like I would get so much more out of the program than at another Ivy. It’s been fine, but definitely fell a bit short of my expectations. Everyone at other peer schools just seem to take much more pride in their school, or at least have less complaints? I feel like the negativity has been weighing on me and I am seriously considering transferring after the end of this year, though only if I could somehow get readmitted to these top colleges :/ I would love to hear you all’s opinions and discuss why this might be the case.",1637683543,1,0
PiT Down?,"Is anyone else unable to access PennInTouch? Like the ""Maximum Sessions Reached"" doesn't even show up, it just loads for like 5 minutes and then gives ""503: Service Temporarily Unavailable""?",1637682954,1,0
PiT Down?,"Does PennInTouch just not load for anyone else? As in the ""Maximum Sessions Reached"" doesn't even show up, and then after a while, it goes to ""503: Service Temporarily Unavailable""?",1637682713,1,0
How To Sign Up For Minor,I currently am almost done with my Econ and math minor but I’m confused on where I can sign up for them (I have all the classes). Is there some form I should do or someone I need to email?,1637682616,1,0
Please dm if dropping mktg 101,,1637681471,1,0
Guys I am just joining Penn next sem as a guest student. I have not decided the college house yet. I have the option between fourth-year college houses and upperclass houses. Please suggest me one? Also any tips for me to have the best time there?,,1637678261,1,0
BEPP 250 permit,Why do I need a permit for BEPP 250?? It's not even mentioned on the course description? Does BEPP 250 originally require a permit or is it an error or something...,1637677689,1,0
Emailing to get into closed section.,"Does anyone have advice on the best way to go about emailing a professor to get into a class? Specifically an art class FNAR-148. I have been trying for 3 semesters but it’s for art majors first. Is there even a chance they would let me in? Also, does anyone know about the auditing process? 

Thanks!",1637677687,1,0
Course Permits,"Yea so uh what’re the chances a professor actually says yes and permits me into their class because I only got 1/5 of my classes and I kinda rlly need the two other ones. Also, side note how hard is it to get in negotiations yeesh.",1637677277,1,0
MGMT 101 Permit?,"I am a Wharton freshman and it says I need a permit to take MGMT 101, why ?? And who do I email to get the permit? Thank you!",1637676876,1,0
NETS 150 Waitlist?,I registered for NETS 150 but don't currently have it since it says I need a permit from the department. I am new to this — could someone let me know what this means and what I should do to get the course?,1637673920,1,0
Consumer psych minor,How do I declare? I can't enroll in MKTG courses. I've emailed the advisor in the department several times but did not reply. My pre major advisor doesn't know shit.. who should I talk to?,1637672674,1,0
permit to register?,why does intouch say i need a permit to register for a class? confusion,1637672460,1,0
essays,[removed],1637672394,1,0
Essays,[removed],1637672148,1,0
anyone take cis181 or dsgn264/dsgn636 before?,i’m taking cis160 and math114 both next sem and i kinda wanna take an easier courseload alongside them so i don’t die — can anyone who took cis181 or dsgn264 tell me abt the workload or what the classes were like overall?,1637671994,1,0
registering for mgmt 101,why is it telling me that I need a permit for this ???? anyone else have this issue,1637671318,1,0
My head hurts,,1637670957,1,0
My advisor never signed off on me. What do I do?!!!! No courses and I can’t even try now!,,1637670676,1,0
can anyone get into pennintouch,bro,1637669612,1,0
course registration,Isn't it supposed to be open rn? I woke up for this,1637668977,1,0
Course Permit,I submitted the instructor permission request for a course and never heard back. On PIT the course shows as open but I didn't get it so I'm assuming the permit wasn't granted. Should I reach out to the prof or just take the lack of response as their answer?,1637651541,1,0
PHYS280 instead of PHYS151 as a PreMed,"Hey, for some very brief context I'm premed studying computational neuro. 

I have AP Credit for PHYS150 and PHYS151, and I'm planning on retaking PHYS150 because apparently med schools want a full year of physics with a lab. However, I found PHYS280 (Physical Models of Biological Systems) to be a lot more interesting and worth my time rather than retaking PHYS151 and just relearning things. 

The issue is that med schools want lab experience, and from what I can tell, PHYS280 does not have a lab component. Would it still be worthwhile to take 280 instead of 151, even though I won't have that ""lab component"" that most med schools recommend?  I would still technically have 151 show up on my transcript, so would that be excusable for the lab component?",1637651077,1,0
A grad student watching people freaking out over PIT crashing,,1637650469,1,0
PennInTouch Class Sign up not working?,"I might just be overlooking something but is everyone able to sign up for classes? 

&amp;#x200B;

Every time I try to go under ""Register for Courses,"" I keep getting this message and cannot sign up for anything:

&amp;#x200B;

https://preview.redd.it/3mbsj795fa181.png?width=357&amp;format=png&amp;auto=webp&amp;s=fc27b9b6f2988293c778ca975ba8734a56a3c6ed",1637648158,1,0
When does open registration begin?,,1637643847,1,0
Math240 vs Math260,"Does anyone know which class is easier to get an A in? 

I’m in 114 right now but I wish I took 116 instead lowkey.",1637642983,1,0
What happens if you graduate with 2.0-3.0 GPA?,Does Penn's brand name carry any value at that point? can you get employed?,1637642156,1,0
Class Schedule for Tuesday Wednesday,My friend got an email from the College saying that tuesday wednesday classes this week are being replaced by thursday friday. Is this true for all types of classses(like wharton and engineering too)?,1637641300,1,0
can some of y’all log out of pit xoxo thx 💋😘❤️🥰👌,"students of peen, ily 😍😍😍",1637638607,1,0
Just curious how PennInTouch is really out there giving people less than 4 CUs,,1637638566,1,0
lps section?,"I have an LPS section of a class in my schedule, does that mean I have it or is it not confirmed until the second class?",1637637713,1,0
the algorithm hates me,,1637637593,1,0
Ummm I got into a recitation but not the class?,Is that possible????,1637637123,1,0
When you got into Penn but can't get into PennInTouch,😎😎😎,1637635265,1,0
I am a senior and got two classes,"actually what is this, i put mgmt 101 as my top class and did not get it, i need it to graduate",1637634680,1,0
Schedules are out,,1637634025,1,0
Anyone is ENFJ? We should be friends :),,1637632571,1,0
Has the schedule come out,Can someone comment on this when it does thank you!,1637627241,1,0
Apartment Search: Worth it to play the waiting game?,"So my roommates and I are currently looking for housing for next year and are looking for a nice place that's 1.) clean (newer, few pests) and 2.) close to campus. As such, we've been looking into apartments but have run into a problem with all of the places we've found.  The Radian is really nice and has a great location but, at $1,384 per month, we can't justify the price even if it comes furnished. Hamilton Court is in an arguably better location and has great prices on their 4-bedroom units but unfortunately, we started touring just one week after they leased their last 4-bedroom unit; the cheapest they have available right now is two-bedroom units starting at &gt;$1,500. Finally, we looked into 40th &amp; Chestnut, and although it is reasonably priced (\~$1,100), it is a bit too far from campus and doesn't have enough natural lighting to be worth the price. 

So the question is if our budget is somewhere around $1,150/$1,200 per person, will we be able to find places (either now or in the future) that hit this price? I have heard that the Radian sometimes gets desperate for tenants in the spring and will lower their rates to get lessees. Is this something we can bank on (especially now that sophomores are required to live on campus, freeing up off-campus housing for upperclassmen), or is this a risky game to play? Alternatively, I hear that sometimes HamCo will have units open up if people drop their lease or neglect to renew--is this a reliable gamble to make? Will we be able to get a good-priced lease at the Radian or HamCo with any certainty or should we play it safe and sign someplace that may be farther off just to secure housing? 

Would really appreciate any and all anecdotes/advice on the matter (and any strong feelings for or against any of the apartments I did (or did not!) mention). Thank you!",1637621899,1,0
"Current German Dept professors and or grad students!!! Hi! I am a student conducting a project on Instagram Live and on my Podcast, if anyone is interested in this, DM me😀",,1637613465,1,0
What is the point of rewards/points in the PennEats mobile app??? Am I missing something ?,,1637608056,1,0
Are schedules for next semester supposed to be released on PennInTouch today?,"I just checked my PennInTouch, and as of 9:30 am, it shows my class schedule for Spring 2022 as completely blank. There’s no way I didn’t get a single class, right?",1637592099,1,0
COGS Honors Thesis/Independent Study,Hi! I'm wondering if I could talk to someone who has experience with completing an independent study and/or honors thesis through the cogsci program since there's not a ton of info on the website. Thanks!,1637590120,1,0
Has anyone had dental work done at Penn dental?,I have insurance but have a bad dentist who did not do a cleaning last time i was there. Has anyone had a general teeth cleaning at Penn dental school?,1637563519,1,0
Any group that plays soccer?,Hello! I'm looking for a group to place soccer. I know there is a club that has tryouts but I'm looking at a rec level. Any idea?,1637562112,1,0
Becoming a DoorDash Biker,"I've been thinking about delivering food around University City whether it is through the app DoorDash or GrubHub or whatever, since I have a bike and it would be nice to get exercise and earn extra pocket money in one swoop that I have total flexibility over when I work. Has anyone tried this or does anyone think this is a good/stupid idea? Any safety precautions like where not to be during night?

Basically my goal is to earn pocket money while being able to choose when I work, so if there are better alternatives to this, I would appreciate suggestions.",1637559269,1,0
Just a shoutout…,"u/ttp394 asked if I am schizophrenic because of my post. Told me I was “laying it on too thick” because of my suicide attempts. 

A few other users here have literally encouraged me to commit suicide because of my allegations.

I plan on name-dropping each and every one of you until it stops. Not schizophrenic- definitely depressed and shocked that so many of you are assholes though. 

Here’s a few more cute ones: 

“You should try committing suicide again” - said by someone that works at the University IN one of the departments this involves {delete your comment history people!!!}

I love how I literally come out and talk about what happened to me and I get told to kill myself and have my MH questioned. 

Anyone have any other questions? Or any other suggestions on what I should do? Please feel free to post comments below. Let the world know exactly how you feel about the University protecting multiple admins over a sexual assault victim whom has evidence that corroborates their whole story.",1637555811,1,0
Freshman 1st semester is kicking my ass.,"Genuinely hate it here. I spend most of my nights pulling all nighters so I can just get by in my classes. I got the lowest score in the class on my midterm for the second time in a row. I never go out and I get angry when I see people partying on Instagram. I want to do that, but I can’t. I hate how much work I have here and how unprepared I was. Any other freshman feeling like this?",1637536432,1,0
Rushing as a Junior,"I am a current junior and I’m thinking about rushing a sorority. I had a tough freshman year and decided not to rush back then, and last year during covid didn’t want to rush from home, so I decided against it again. Now I’m a junior and I feel like I’m not involved in much, and I am finding I really wish I was in a sorority. At the same time, I feel like it’s way too late to join and either sororities won’t want someone who is already a junior, or even if I do I might not fit in well. If any girls in sororities have advice please put it out there and don’t be afraid to be honest.",1637536307,1,0
how do the college houses work and are they super inclusive/dominant part of ur social life,"are all UGs sorted into a house like in harry potter? or are these ""12 college houses"" not a big part of one's non-academic life?",1637534423,1,0
"In the college, double major in CS vs. dual degree. What extra classes would one have to take with the dual degree compared to just the major?","Title, thanks!",1637533476,1,0
Foreign Language test,"Hey everyone, 

I am going to take the Gujarati foreign language placement test. Can anyone tell me how hard it is and what I need to know for it? 

Thank you!",1637532950,1,0
About my posts that have been invalidating actual sexual assault victims.,"You guys aren't giving me enough attention. I have created multiple fake stories in an effort to gain fame and you guys downvote my comments?? Did you guys not read the part where I said I would harm myself repeatedly? Wake the fuck up UPenn, CAPS and Amy G are EVIL! hopefully this posts opens your eyes so I don't have to threaten suicide again !!",1637526096,1,0
