title,selftext,created_utc,score,total_awards_received
"Effective communication: How to speak, write, generate value; and some powerpoint(s)!","[https://youtu.be/SoXLXJmetH8](https://youtu.be/SoXLXJmetH8)

This video originates from a post-production (non-copyright) session taught at the University of Toronto to students in an undergraduate Ecology course.

The purpose is to arm you with the heuristics you need to be successful in conveying your ideas successfully in academia, the workplace, and all that you say, write and posit.

In addition, tips for creating bombastic PowerPoint slides that employ maps and figures - common facets in professional talks, are provided.

Remember, the function of your communication is to generate value, progress a conversation, and change the way your audience thinks about the world.",1638377549,1,0
i need guide to be an upenn student hehe,"hi every1!! i'm filipina, 17y/o and planning to apply here in upenn for college to take entrepreneurship. i'm currently reviewing for my ielts, sat, act, &amp; toefl (??, not sure abt this one since i researched that some of the intl students only took ielts, sat, &amp; act) that i will take on january. so yeaaa, my qs is, can i apply for multiple scholarships in US or it just requires one?? bc here in the philippines, u can only apply for a government scholarship &amp; for a institution scholarship.

&amp;#x200B;

my junior high school general ave are - 90-94 out of 100

grade 11 - 90(1st sem),  92(2nd sem)

we just ended our 1st quarter for this year, grade 12 so i don't hv any idea of my grades.

ECs - i was part of our school's military training (cadetteee), i was part of student council when i was grade 10, i also became a class officer, we organized a charity event for orphans, i also became officer in diff school clubs, i was part of theatre acting when i was on 7th grade, and i also tried publishing our school newspaper.

 i transferred school for senior high school and they didn't have any orgs, events that involves divisions, student government (the current officers are the alumni), and school clubs but i'm planning to join organizations outside school like environmental, agricultural, anti racism/anti asian racism, youth organization, or any orgs (planning to be a volunteer in UNICEF but idk how and where to start).

does the extracurriculars needs certificates?? 

 thank u sm in advanceee. i hope to see yall soon. i'm gonna pass!! claimiiiing!!!",1638375621,1,0
I think i just heard a gunshot,"545am, somewhere near 41 and pine. Anyone else hear it?",1638355705,1,0
everything is going fine but I'm just kinda lonely?,"freshman here. I can't say that there is anything specific about my experience here at Penn so far that is too negative. I mostly enjoy my classes, clubs, living space and all that, and I'm doing okay in them. And I have a couple friends and talk to people as I go about my day, but I just am really not getting that feeling of groundedness or security I'm used to. I feel so much more sensitive to different cues of social rejection or hierarchy even if it is in a sense that I don't care about. for example, I don't really esteem popularity but seeing it in others makes me feel inadequate

I honestly have always been pretty independent and introspective, and I'm surprised that this feeling has been bothering me as much as it has. Before college I would have been okay going about an entire day on my own. I often preferred it. I think it might just be seeing everyone else seeming so happy and outgoing and connected that makes me feel like I'm missing out. sometimes social media, the dining halls, or even locust walk can feel kinda isolating.

moreover, my response to this is to just be patient (hoping it will get better with time) and to focus on myself, and I've been doing that. for example, I deleted social media (temporarily most likely) and I've been getting into my schoolwork and trying to take care of my body and space, which are all great things of course. but they all seem actually counter to helping my original problem which is that I feel socially disconnected. I feel like I have made almost zero new, meaningful connections since like NSO.

the funny thing is, I don't even feel like I have enough time to really expand my social life all that much, but that doesn't really prevent this feeling. can anyone relate? any upperclassmen have advice? I know this is not a particularly novel experience but just wanted to put this out there",1638340102,1,0
Freud with Prof. Weissberg,Has anyone taken?  Thoughts? Penncoursereview can be deceptive sometimes… so asking for a friend!:),1638338634,1,0
MATH 114 Grades,"For those who took MATH 114 last year: 

I currently have a 14.3/16 average on weekly quizzes. Historically speaking, would that place me around an A/A+?

Thanks",1638335766,1,0
Opinions on 313 with Martin Bies,"Anyone have any opinions on Math 313 with Bies? He has the hardest difficulty and work required for the class by far, so I was wondering if anyone had any opinions on his class before I tried to get into it.",1638334382,1,0
is construction legal after 11PM in philly,Is it legal for construction to go on after 11PM? Its so loud from where I live and I cannot physically go to sleep because of it ;(,1638331385,1,0
study spots,"any recs for study spots near franklin field? also, any recs for a power nap spot on campus? wondering if I will be judged for taking a power nap in a gsr... 

happy finals szn",1638329031,1,0
how to clear a red pass,"I tested negative today, but my open pass still is red. When I click on the link for steps, it just tells me to get tested (which I already did) and there is no way for me to update my test.

Does it clear by itself? Or do I need to call them tomorrow?",1638324395,1,0
Upenn decision,"Hi, does anyone know when do Penn results come out for early applicants ? 
Mid December ?",1638316431,1,0
"""[W]e strongly encourage all students to postpone any social events in light of recent rising case counts""",,1638302873,1,0
Loud ass people in the library,"Why do people think it’s okay to have lively Zoom discussions in the quietest parts of Van Pelt? They never bother to keep their voices down, either.",1638299419,1,0
non-compliance red pass,I received a non-compliance red pass today. Should I take the test as usual in the Du Bois Tent or should I be tested somewhere else?,1638296247,1,0
Red Pass even tho I tested negative,"I got a non compliance red pass today even though I tested negative yesterday. Called and they said they can’t release it manually, anyone else get the same thing?",1638295712,1,0
ssh elective recommendations,"freshman in cis, looking for recommendations for a low workload, easy/fun ss/h elective to take in the spring!",1638290018,1,0
Creative writing class recs,Engineering student looking for some chill creative writing classes… I’ve only done writing sem in terms of writing experience but am looking for something fun /engaging /not too much work. Thanks!,1639880819,1,0
Harvard is first Ivy to announce classes moves online: for first 3 weeks of January,,1639875820,1,0
sorority rushing,I’m thinking of rushing this spring. I read about sororities and not kidding they seem to all be the same. Can someone please tell me what are the vibes of each? and their order of popularity? Thanks xoxo,1639872405,1,0
Do they check your room after you check out?,My bed is pushed against my air and window and I was wondering if they come by and check that once we leave? If so they will have to climb over my bed lmfao so I’m just wondering. Thanks!!!,1639869931,1,0
Grade CIS120,How badly does getting caught for cheating on a homework impact your grade in CIS120?,1639865965,1,0
"How to live in Psi Upsilon? I was on campus today and the house looks super cool structurally and I really wanna live there. I did a quick google search and it seems like it’s a frat, how do you get in?",,1639865257,1,0
Man is down astronomically for the answer.,,1639863805,1,0
Question about CIS MSE,"Hello, I am currently a sophomore in the college trying to plan my courses out so that I can submat into CIS MSE. The core prerequisites to apply to the submat program do not include CIS 240, so I didn't plan on taking it.

I'm looking at the MSE requirements now, and its required I take a systems course which include 505, 553, 548, 555, and 551, and it looks like 240 or 380 is a prereq for all of them. 

Is it possible to do ok in any of these classes without knowing the material from 240?",1639863026,1,0
What happened to the Goodwill bin by Rodin?!?,,1639856812,1,0
"I’m interested in applying for the Moelis advance access program. Could someone who knows the program or has gone through it, offer some input?",,1639847537,1,0
national collegiate research conference,"has anyone attended this before? found out about it through curf. would love to hear what you got out of it as I'm currently deciding whether to attend!

thanks",1639845952,1,0
Opinion on Legal Studies and Business Ethics,"Any thoughts on Legal Studies &amp; Business Ethics at Wharton? In HS and I'm tied between majoring in mathematics or something like legal studies. I probably want to pursue Law School after undergrad, as there's really nothing else I can see myself doing. (even math) The major really depends on the school I get into, because I know I can do really well in math (GPA matters a lot for Law obviously), and I am not sure if I should apply to UPenn for math under the College of Arts and Sciences, or if it would look better to apply to Wharton. After browsing the website, none of the Wharton ""majors"" really seem like something I would really care about and do well in except for what I listed above. Thanks for any info.",1639845950,1,0
What to expect from Mailath for econ 101?,"Going into this class next semester, how should I prepare and is there anything specific I should know about the guy?",1639845784,1,0
What are some fun social activities to do on campus?,,1639834969,1,0
CIS240 Final Grades,"With the CIS240 final coming up, is anyone able to comment on roughly how grading in CJ'S class works? I have no idea what to expect going into the final. I know he chooses cutoffs at the end of the class, any previous experiences with this?",1639811219,1,0
Pest problems bother me to my core,"To some people this will seem very dramatic, but no one has ever really posted about this and I’m wondering if any other people feel similarly. 

I knew coming in to living in the high rises there would be issues with bugs - it’s old, filled with tons of people, and we are in the city after all. However the lack of action of maintenance against trying to tackle roaches in particular has left me feeling anxious and uncomfortable in my own bedroom. I am pretty terrified of bugs, but previously a clean room meant not really interacting with any except the occasional house spider. 

I’ve become obsessive over cleaning and am constantly on the lookout for bugs. Today I had deep cleaned my room for winter break and discovered an entire nesting area for the cockroaches with their waste underneath my air conditioner. This battle is becoming detrimental to my mental health. 

This isn’t a big deal and I am aware of that, but also I’m exhausted from fighting something I can’t do anything about. I would suggest to those looking to live in the high rises to ask yourself if you are okay with living with bugs all of the time. If you have any sort of aversion, the previous answers in this Reddit may mislead you that because you are clean you won’t deal with it. But it is seemingly unavoidable and has taken a toll on my general anxiety this semester.",1639809941,1,0
appealing financial aid...?,"hello! I was just admitted into CAS as part of the Class of 2026 and I'm hoping to appeal my financial aid offer before the enrollment deadline. 

I've seen comments on this subreddit from people who have appealed/called and gotten significantly higher amounts of aid, and I was wondering if anyone would be willing to elaborate on how they were able to do that? (esp since plenty other comments tried to appeal and received..well..nothing)

I haven't necessarily had a change in financial situation which would maybe draw them to reconsider - my family still sends a considerable amount of money to relatives and supports family members living with us that still do file their own taxes so they are independents, which has likely skewed the fin aid's offices' perception of our financials. I have a full ride to a state school (UNC Chapel Hill) and was hoping to use it as leverage, but I'm worried they will not consider it since the school isn't a private institution//scholarship wasn't need based. 

anywayyy if anyone has any advice or experiences, lmk!! tysm",1639806023,1,0
"If you’ve got 15 minutes sometime this weekend, consider helping out a study in the linguistics department by playing this quick game!",,1639797979,1,0
Best dorms for incoming freshman?,Hi! I just was admitted into UPenn and was wondering which dorm is best for single. (Heard a lot of good things about the quad),1639796967,1,0
Deleting penn google account,Is it possible to delete penn google account and open it again?,1639792456,1,0
Lauder-FirstYearExploration,Anyone in the Lauder-FYE program?  How is it?  Is it hard to get in? What type of students will fit most in the program (introvert? Artistic?…)?,1639790749,1,0
thoughts on bio 101 final?,,1639789514,1,0
What is a Penn conspiracy you believe in?,Mine would be that some classes with extensive assignments purposely don't post their syllabus because they know students wouldn't sign up for class. Seeing the syllabus for the first time when you're already enrolled reduces the student's likelihood of dropping due to limited options and the endowment effect.,1639788528,1,0
Looking for a language partner to practice Tamil with at Penn,"Hey everyone, I'm a grad student at Penn and I'm trying to get some practice with my conversational Tamil. Does anyone here happen to speak the language that would be willing to help me improve with occasional practice? Thanks so much!",1639785969,1,0
Single or Double in the quad?,"Hello Im an incoming freshman in CAS.  I’m hesitant between applying for a single or double in the quad. I’m pretty social, def a party person, but I also kinda want privacy. I’m just scared that I will feel isolated if staying in a single. Please give me sum advice.",1639785461,1,0
Do most classes post grades before Christmas?,Title,1639782198,1,0
The Wombats in Philly?,"I have a ticket. It clashes with my shift schedule and I can’t find someone to replace me, sadly I can’t go. Dm if you’re interested.",1639782143,1,0
So tired of anti-Asian harassment on and around campus,"Is it just me or has there been a huge uptick in anti-Asian sentiment on and around campus over the past couple of months. Just over the last few weeks, I've experienced/witnessed 

* A guy screaming ""CHANGE??!! CHANGE??!!' at the top of his lungs at a group of Chinese-speaking students waiting for their food by a food at 38th/Spruce. He was literally standing directly in front of their faces screaming. Finally he gave up and yelled ""fucking c\*\*\*k"" 
* A group of teenage-looking kids walking past a couple of Asian girls near Sansom West and yelling ""KUNG FU KUNG FU KUNG FU HIYAHHH"" (ngl kind of funny but really rude and racist) 
* A drunk homeless-looking guy on the trolley verbally abusing an older Asian lady using racial slurs and screaming ""tiger mom' - fortunately the driver intervened and made him get off at 40th. 
*  At 38th st. Wawa I (Asian-American guy) was passing through the vestibule and a guy standing there demanded if I have change. I ignored him and he yelled, ""DO YOU SPEAK-A ENGLISH? C-H-A-N-G-E?!?""
* Anecdotally, I've heard of Chinese/Asian international students who've been spit on, had ice cubes thrown at them, had people yelling ""China virus"", etc.

I don't know what can be done about this issue considering most of these incidents are happening with people who are not obviously members of the Penn community. I am just getting sick of it and starting to feel more bitter than I'd like to be feeling about the west Philly community. 

And I feel helpless and also complicit because I am not always able to bring myself to intervene when I see these things happening. I used to think people were being drama queens or exaggerating when they told these stories but now I've begun to experience it myself and I'm not OK.",1639777807,1,0
Student Loans for Canadian,"Hello everyone!

&amp;#x200B;

I was accepted into the class of 2026 yesterday, and I'm excited to be attending UPenn in Sept, 2022! However, my financial aid package has left me with a significant amount (for me at least) to pay for the upcoming school year. I was wondering if any of you had advice on where to look for student loans or scholarships to help me with the costs? I'm a Canadian student, so I'm not sure which resources are available to me. If anyone has advice it is greatly appreciated!",1639777702,1,0
deferred -&gt; admitted question,[removed],1639768468,1,0
Stanford Reverts to Online Classes for Winter Quarter Amid Omicron Variant,,1639766822,1,0
You think you can hurt me? I'm currently being ghosted by my Disability Services Counselor 4 days before my final.,"Me: ""So I'm still getting my legally mandated testing accommodations even with online tests, right?""

Weingarten: ""No ❤️. We hope you have a great Winter break!""

Me: ""Wait isn't that illegal?""

Weingarten: ""Have a great Winter break!""

&amp;#x200B;

In summary you can hurt me very easily I'm in a very emotionally frustrated place rn.",1639766337,1,0
Recent controversy involving UPenn,"This story has been making the rounds on social media: https://swimswam.com/what-are-the-boundaries-penn-parents-demand-ncaa-change-transgender-rules/

I'm really glad the UPenn team has been supportive and Lia is being welcomed. I'm really disheartened by the folks who chose to pen this letter opposing her inclusion. 

But can we talk about how the letter was written by parents of students? How embarrassing is that to have your parents write in and complain that you didn't win an NCAA swimming title? 🤣",1639759829,1,0
Meal Swipe Conversion,"I've heard that you can convert meal swipes to dining dollars at a poor rate, but at least all the value doesn't just disappear. How do I do this? Google was unhelpful",1639759490,1,0
sorority rush online?,Do we think rush will be moved fully online?,1639709996,1,0
Odds Next Semester is Virtual?,"You guys think Penn will make the Spring semester virtual?

[View Poll](https://www.reddit.com/poll/ri6ux3)",1639708407,1,0
meh first semester,"how common is it to have a bad first semester at penn? between trying to maintain a friend group, getting used to living away from home, and finally having to tackle my time management issues/poor study skills, my grades have suffered. I can't say I truly grinded this semester, more so just tried to get by, and I wanted to be pre-med. two of my classes I think I'll end up with a decent grade, the other two are kind of in the air but not looking too good. I know everyone says pennface is a thing but the vast majority of people I've talked to these past couple of weeks say they're doing bad and then reveal they have an A- or B+ :/ 

this sounds all over the place but I guess I'm just looking for input, as a pre-med stem major first semester at penn, should I be worried about a bad first semester? I know this sounds really dramatic, excuse the anxiety, but I guess should I think about whether I'm actually suited for the subjects/careers I was interested in.

thank you!",1639707562,1,0
that phys150 final...,i might be just stupid but are we sure this class isn't curved hahahaha,1639706185,1,0
Megabus stop,Anyone know where it moved to? It’s supposedly not at 30th st station anymore,1639703364,1,0
Penn accepts 15.6% of early decision applicants to the Class of 2026,,1639702477,1,0
Visiting professor previously impeached and accused of crimes against humanity.,"María Paula Romo was impeached and censored  by the Ecuadorian National Assembly when she was a government minister accused of crimes against humanity, attempted bribery, among other charges.
  
Thus, with this precedent, it was requested r/UPenn rejected the hiring of Romo as a visiting professor at the University of Pennsylvania with at least 11,000 signatures of support, a request that was rejected  by the Uni. citing that there were no sufficient reasons to terminate Romo's position.

This civil action promotes and protects the rights of migrants and students to a dignified and exemplary education.

  Location: University of Pennsylvania
  3718 Lobster Walk
  Philadelphia, PA 19104

  Time: 11:00 a.m. 
  Date: 12/17/2021",1639701415,1,0
Registering for Time Conflicted Courses,"I'm trying to take CIS 121 and BIOL 221 next semester. But, the only slot I can take CIS 121 is 10:15-11:45 and the only slot offered for BIOL 221 is 10:15-11:45.

I saw a form on the SEAS website about getting a permit for time-conflicted courses. Does anyone have experience with it? How easy was it, and how did you go about it?",1639698689,1,0
Unpopular Opinion: Moving finals/classes online due to COVID rates spiking is like forcing us to use paper straws because of global warming,No one in charge is going to address what is really causing the problem.,1639697689,1,0
So NOW people “care” about covid,When they see their finals might be online smh,1639697166,1,0
Solution to Lia the swimmer: create a category in the ncaa where transitional student competitors compete amongst themselves. Have a category like NCAA trans athletics. There you go. I figured it out. And I went to U Md 😉,[removed],1639693268,1,0
Can you use more than 2 swipes at McClelland?,"Like using 2, then going back around and using 2 more",1639690881,1,0
"For those of you going home this break, are you packing your stuff?",[removed],1639687779,1,0
I opened the wrong final exam on canvas today :’),,1639686029,1,0
Booster shots in the middle of finals,"I appreciate Penn’s efforts to offer booster shots to the students, but did this really have to be offered in the middle of finals season? It’s well known that vaccines cause side effects lasting up to 24-48 hours in many people. Just does not sound like a great idea…

- Sincerely, someone who currently in bed, shaking uncontrollably with a high fever and bodyaches, and has to write a final paper by tonight &amp; take a final exam tomorrow",1639683250,1,0
Official Admitted Student FAQ and Decision Reaction Thread [Class of 2026 ED Edition],"**In less than 5 hours, the Class  of 2026 will receive their ED Decisions for Penn (Thursday, December 16th, 7PM Eastern). This thread will be used as a centralized Decision Reaction and Q&amp;A Thread.  Posts with specific questions about Penn will still be allowed. Other posts, including but not limited to Internal Transfer and Penn vs. XXXX  posts, questions that can be easily googled, and general reactions to admissions, will be deleted and the OPs will be sent here.** 

**Welcome to** [r/upenn](https://new.reddit.com/r/upenn/)!

Please read the subreddit rules on the sidebar if you are new to the subreddit.

Good luck to all those waiting for their decisions!

Current students and alumni: Please check this thread to answer any questions, including the FAQ ones I will post below.",1639682537,1,0
CIS waitlist spring 2022,"Just out of curiosity, has anyone heard back from the CIS waitlist yet?",1639682361,1,0
Piazza sells our data to recruiters,"Lol ""Where Piazza can help recruiters: the troves of data it’s collecting on students, including what courses they are taking and the types of questions and answers they are contributing to the platform, all of which companies are now using to run targeted searches and to send personalized messages to students who opt in to its recruiting service.""

[https://www.strictlyvc.com/2015/06/29/piazza-backed-by-sequoia-and-others-looks-to-next-round/](https://www.strictlyvc.com/2015/06/29/piazza-backed-by-sequoia-and-others-looks-to-next-round/)",1639682219,1,0
Frat spreading covid,St A’s/Hall has covid and gave it to everyone through social events. They knew they had covid,1639682106,1,0
Vaccine Booster Clinic,Does anyone know if they are strict about appointment times or if we can more or less walk in?,1639681703,1,0
Dining Plan,"Probably a popular opinion but I'm going to rant about it anyways. The two year required dining hall plan is greedy as HELL from Penn admin. The price per swipe, making swipes unconvertible to dollars, and charging what Penn does on the plan for food that tastes like either road kill or rubber is absolutely atrocious and should be a crime. The other day I bit into a cheeseburger that cracked in half like a cracker. I'm not even a picky eater at all, but the food is genuinely below average at best and it's clearly a policy put into effect to get more money out of kids already shelling out an insane amount for everything else. Absolute highway robbery from the folks upstairs. I'm finishing the semester with a stupid amount of swipes left even though I use them often and am regretful to do so every time for the sorry excuse of whatever inedible trash that commons is serving that day. Based on the pricing it would most likely be cheaper to eat out smartly or cook instead, but no, this school wants to kick us in the face even more and drain my family's bank account even further.",1639680062,1,0
