body,created_utc,score,total_awards_received
I’m in the CAS for Physics right now. So basically I’m capped at 5.5 no matter what? Even if I’m taking 2 (+.5 with lab for physics I guess) core classes and 4 gen ed?,1588697460,1,0
"I read this article earlier, and while the sentiment is fine. She simply offered no substantive policy for reopening campuses, other than parroting the idea that campuses really have to open. If you think about it, all the things she mentioned is going to be incredibly difficult to execute, and let's be honest, it's college students. No way they're going to follow a ridiculous amount of policies. The thing about public health is that the moment one idiot or one frat decides to throw a party, and ONE student contracts corona - it's over. We see how fast disease spreads every year with the freshman plague (literally thousands of coughing freshman...). So while I would LOVE LOVE LOVE campus to re-open, I just can't see campus being able to open \*safely\*. Unless corona just goes away over summer? Pretty please? Haha.",1588697150,1,0
"So does this mean that we are probably staying at home again? Or is it really going to be a mix of on campus + online (which seems super pointless to me, because if the goal is to social distance, having thousands of college students in person is a terrible idea. The dorms are cramped, and the dining halls are busy...",1588696903,1,0
"The freshman seminar in Ottoman history with Prof Oscar Mandujano Aguillera is super great. It's not difficult grading wise, but you learn so much abt Turkish history because Oscar is so knowledgeable. Also.... he takes you out to eat as PART OF CLASS TIME at least 4 times... Theres a unit about dumplings and you go out and eat different cultures dumplings (we did Korean, Turkish, Chinese, Tibetan, Polish).",1588696820,1,0
"The intro math classes suck, but I heard they get much better in upper levels.",1588696543,1,0
"I second this. I would perhaps consider a minor in STAT from WH, instead of doing the full degree as well. Less work!",1588696518,1,0
"Looks like you're in engineering so I can't say for your advisors. The WH advisors will hard cap you at 5.5 first semester freshman year, and even after that its difficult to increase the cap depending on who your advisor is. My understanding is that first semester freshman year there usually will be hard caps because advisors don't want you struggling too hard first sem.",1588695981,1,0
how are his teaching methods generally?,1588695916,1,0
Thanks for the help! I’m interested in the stats department specifically,1588694961,1,0
professor trench is great! i’m in her writing sem now. i took it because i heard great things and it was the best a writing sem could be.,1588693895,1,0
Shhhhh don’t tell them it pays for my aid,1588687217,1,0
"Tbh all of these courses are very expensive ways to give kids a “penn experience” but if you are really interested, philly is a fun place and you will probably meet some cool people",1588686043,1,0
I took it last semester as one of my first classes and it was pretty good. It’s basically an over view of philosophy as a whole so you get a decent idea of a lot of stuff but never go too in depth on any one topic. If you want something that goes a little more in depth I highly suggest history of modern philosophy if that is running,1588685376,1,0
It varies by the department; in some departments you just ask the professor and in others there's an application process you have to go through. Which department do you want to TA in?,1588684664,1,0
So. If you’re a TA it’s more of an academic thing rather than a work study thing. Work study is preferred if someone is looking for positions as a grader.,1588684107,1,0
Do you know if preference goes to work-study students?,1588684043,1,0
Very hard,1588673515,1,0
"Given that the application is centered around anonymity and protecting user data, and there are boilerplate policy templates that cater towards this, it is weird that the service opted for this specific wording. I don't see how this is really a rebuttal or addressing the issue at hand.   


It also do not guarantee security of data on the platform and the wording in the ToS limits the liability of Librex",1588668003,1,0
"I'm a broke college student who created a platform for Ivy League students to discuss topics that matter on campus. I couldn't afford a lawyer, so I used a boilerplate privacy policy. I intend to tweak it when I have access to a lawyer this summer. 

I'm literally doing this as a labor of love. You can go on the app and see that the only information we ask from you is your email to verify that you are an Ivy League student. I know you may still be skeptical, but I hope you can empathize with where I'm coming from.",1588667235,1,0
"Even if you claim to not have not sold any data or shown it to investors, provisions that enable you to do that exist in your privacy policy. There is no mention of how you disclose your information to third parties and what the categories disclosed for business purposes and valuable consideration are. Perhaps I am mistaken, but I was unable to verify your claims with the information present in the privacy policy.",1588666001,1,0
"Yes, that is in our privacy policy under ""Information Sharing"". We have never made a cent from Librex or shown any data to any company. I pay all of the data hosting costs out of pocket. We have no ads and we have refused all offers for investment. I wrote that privacy policy up back when it was just me and my computer because I didn't want any legal issues and couldn't afford to pay for a lawyer. Now that Librex has grown, a big-time silicon lawyer is helping us rewrite the privacy policy.",1588664922,1,0
"*""By using Librex you consent to share the content of your posts and comments with the public.*

*Your posts may also be used in conversations with vendors, to protect the rights of Librex users and LibrexLLC, in negotiations regarding mergers and sales of the company, and to comply with legal regulations and processes.*

*Aggregate data may also be shared for marketing and technical analysis.""*  


Does this Privacy Policy sound familiar?",1588663920,1,0
"Finding the group that meets in Meyerson every Sunday morning as Grace Covenant Church, which took a lot of pressure off me to be part of the hookup-drunk crowd in order to be social.  

Getting into a research lab that was driven by curiosity, and that truly enjoyed and supported individual successes (not all are like this, but quite a few actually are), as well as seeing the genuine camaraderie of faculty.

Periodically enjoying some of the really great and special things about Philadelphia - theaters, orchestras, museums.

The acquaintance and advice of a faculty member living in my college house who, years later, appears likely to become a lifelong friend, role model, and confidant.

The medical care I got at HUP that time I really needed it.

The biopond.",1588663522,1,0
It’s not too bad. The reading wasn’t tough and you could easily knock it out as a 5th class.,1588663144,1,0
Yep. If you got an A- or better in the class most profs would be fine with you TAing if the application process isn’t competitive.,1588660188,1,0
Yea we are used by 3000 Ivy Leaguers every day. It's poppin',1588658819,1,0
"I know that there isn't an all-girls dorm, and anecdotally all of the floors and halls I've lived on/visited have been mixed gender. If you have religious, mental health, that kind of serious reason to ask for it, my guess is you'd be placed in a suite or apartment style dorm room with all girls. If it's just personal preference you're probably out of luck.",1588658180,1,0
"I'd say we are closer to what Reddit used to be in that we are an open, moderated space for discussion in the Ivy League community.

But Librex is a bit different than Reddit. Unlike Reddit, we are exclusively for the Ivy League, we don't censor political speech, and [we won't sell your data.](https://yaledailynews.com/blog/2019/11/01/this-yale-start-up-wont-sell-your-data/)

Happy to answer any questions about Librex if you are still curious, or [you can visit the Librex website.](https://librexapp.com)",1588657863,1,0
Just send the ones you want credit for.,1588651926,1,0
[removed],1588651500,1,0
The only scores you need to submit are ACT/SAT and subject test scores. AP scores can be used for placement but aren’t necessary,1588651500,1,0
"I've finished the math major and I've never had a problem with any of my professors, but I do think I got lucky and had mostly the good ones.

If you're looking to major in math, I would discount the advice of people who aren't math majors or haven't taken many ""real"" math classes at Penn (i.e., 116, 202, 203, 260, or 314 and above). The professors are generally worse at teaching intro calculus than actual math courses, although judging from some of the other comments here they might not be great at teaching actual math courses either...",1588651321,2,0
Thank you so much!,1588647074,1,0
"* freezing my face off on the DRL roof to see a lunar eclipse
* AWE study break breakfasts
* story time with Ghrist in 114E",1588646271,2,0
I did not get an A lol even with 99% on the 3 midterms.  He wouldn't do anything to my grade in the end.,1588644766,1,0
Mind speaking to the humanities people in KCECH? Freshman trying to decide between BFS at Hill or Humanities group at KCECH. Thanks!,1588644639,1,0
"After my last class of the day, I used to listen to my iPod and walk into Center City a few times a week. I usually headed south from Walnut onto Pine Street, walking Pine all the way to Society Hill and back. It would take me about 1.5 hours. Sometimes I'd deviate and head to my fave ice cream place ever (Franklin Fountain!)

My last walk ever on Pine, a few days before Commencement, the tears streamed down my face.  Please don't take Philadelphia for granted. It's one of the most beautiful cities in the USA, you really feel in some parts that you're being catapulted back into the 18th century.",1588643799,2,0
"Sorry, your submission has been automatically removed because we do not allow ""chance me"" posts here (nobody here can give you meaningful information). If you believe this post has been removed by mistake, please message the moderators.

*I am a bot, and this action was performed automatically. Please [contact the moderators of this subreddit](/message/compose/?to=/r/UPenn) if you have any questions or concerns.*",1588642444,1,0
"Last semester, Gupta made the final insanely difficult and long (20 open ended in 90 minutes) for no reason. Some of the questions we had never gone over before or were a part of the review. He got a lot of complaints and ended up giving almost everyone I knew an A. He definitely has learned from this and I’d expect it to be similar to the previous midterms. Either way he bumps most of his students to an A if you put in an ounce of work over the semester",1588641003,1,0
"Is there a way to move the credit cap to 6 for freshman if you’re trying to do a dual degree but aren’t doing one yet?

If so how does this schedule look 1st sem

MATH 116, PHYS 170, ANTH 012, AFRC 002, PHIL 080, FREN 110

And 2nd sem

MATH 261, PHYS 171, PHIL 004, ANTH 104 (if offered), Writing Sem, FREN 120",1588638631,1,0
"So I decided to do a dual degree between Wharton and the College. I plan on actually keeping both majors, but I know some people who apply uncoordinated dual degree so they can drop the college later. The acceptance rate for dual is a little higher but I think it's still under 10%.",1588635885,1,0
I don't think you are even allowed to retake them. The classes that I got waivers for meant I had to take an upper level course,1588635693,1,0
the button,1588633624,1,0
It’s literally 4chan for the Ivies. There aren’t too many Penn people who are active compared to Dartmouth/Yale but its a fun app to kill brain cells on.,1588631549,3,0
"think he said 45% As, 45% Bs, and 10% Cs? anyone know if As/A-s are going to be evenly distributed within that?",1588631297,0,0
"Three come to mind. 

1.	Meeting my girlfriend
2.	Tripping on acid during fling back when fling was still fun and in the quad
3.	Accepting a job offer and the subsequent carefree second semester of senior year

Good times.",1588628751,1,0
"I think it was a paper plate w/ whipped cream and chocolate syrup, but yeah surprise happy birthday pieing",1588625929,2,0
You pied her with chocolate syrup? Love the flair btw,1588625762,2,0
Congrats!!!,1588625243,2,1
[I guess I undersold myself. I should probably bump her up in my list...](https://imgur.com/D931INw),1588625157,3,0
Had to give myself plenty of runway,1588624688,3,0
Just opened a year or two ago!,1588624015,4,0
"Thanks it works! Better than clearing site cookies every time. 

I'm curious, how does it work exactly?",1588624010,1,0
Can we also get your wife's list and see if you are the fourth highest of her's?,1588623966,6,0
"So I didn't live on campus, since I'm from the area and could just commute. I took stats one fall semester, and the day after the final was due I was flying to the Midwest to spend the holidays with my girlfriend. So, I decided I was going to come into the city that evening, do my final, stay over, and fly out the next morning. Except I forgot the libraries/buildings close early on the last day before break and by the time I arrived the libraries were all locked up. I needed to use Maple for the final and had to find a computer with it on. After a few failed attempts, I tried Rittenhouse Labs, but my access card no longer worked. So I waited for someone to exit the building, snuck in, and proceeded to wander around for a classroom that was open. I found one, but the computer was hooked up to the projector and I couldn't get it to work. Finally I resorted to jimmying a door open to a classroom and (2 actually, the first didn't have a working computer) and managed to get my final done and submitted with LITERALLY 2 minutes to spare before midnight. I sneaked back out of the building and got a B in the class (final exam grade was never posted but I guess I did fine.) So my wholesome moment was B&amp;E to do a test.",1588623942,3,0
There's a bonchon on campus now!?,1588623893,3,0
"I asked her just now, she said hanging out with friends and laughing at stupid stuff. And that campus is really pretty, and walking down Locust in Spring/Fall with the colors and flowers. The first nice day in Spring when everyone is out and happy.


When I brought up your comment, she said that she doesn't consider our meeting as ""wholesome"". ggs everyone.",1588623806,8,0
Math Econ,1588623612,1,0
"stay away from the math department. if you like math and are stuck at Penn consider CIS, ESE or Physics",1588623171,1,0
"That’s awesome to hear. Assuming you’re in STEM because of your dream schools, what has Penn offered that makes you feel that way?",1588622733,1,0
"* Adam Grant saying at the beginning of class that if you want an A in the class, then just ask him. He would rather you be *present* than fret over grades.
* The few professors saying at the end of class that they are our life-long resource and to email/call/text them if we ever need their advice in the future
* Seeing leaders across campus convene for a midnight meeting in Du Bois after someone wrote an op-ed in the DP about getting called the N-word while walking on Locust 
* My wife's contact photo in my phone is the same photo she snapped of herself when she gave me her # in the old Arch common room when we were underclassmen
* Every interaction with Chaz Howard",1588622232,8,0
Can we also get your wife's list and see if you are at the top of her's?,1588621631,8,0
"Last semester I finished my final project at like 1am, decided I wanted something more than just wawa again, called up two of my friends, and went to bonchon at that ungodly hour",1588621174,5,0
"I'm gonna dispute your ""not like a whole community"" thing on it-- we're quite a closeknit group, just check out our discord! :)",1588620539,2,0
Isn’t PennCourseReview hosted there?,1588618714,2,0
"- one night i got hungry and was craving chicken nuggets so i called up my friend and we went to mcdonald’s together lol
- for a group project in one of my classes we were joking about getting dim sum and i was like bet so we went to dim sum house and just chilled and ate
- at a pregame/dinner i met this person and i saw them at a park over the summer but i didn’t know if i should say hi or not but i didn’t say hi and then later we messaged on fb and now they’re one of my closest friends
- i love studying at united by blue w my friend; we would grind tuesday and thursday mornings at 7 am over cold brew and matcha lattes 
- my friend and i would have impromptu dance parties in our rooms blasting pop from the 2010s and just making fools of ourselves",1588618308,3,0
"Two specific memories:

1. I was a weirdo who decided to do my  honors thesis junior year, and my thesis defense winded up being on the morning of Hey Day. I was super nervous before my presentation, but a few seconds after I started, my PI, who was also my professor that semester, walked in to listen. It was extremely rewarding to present in front of her and 2 professors whose classes I would take my senior fall. After I was done, it was only 9 AM; a ran back to the high rises gleeful, grateful, on a natural high; changed, took some shots, and then marched down Locust Walk with the class of 2019! I took dozens of pictures with all the friends I had made, including one of my favorites with my freshman hall mates. It was the best day of that year, by far.
2. My senior year NSO, my a capella group was rehearsing in Houston Hall for a freshman event. The University Chaplain, Charles Howard, happened to hear us because the rehearsal room is right next to the office for Religious Life. Apparently he listened to us sing the whole time, and it was arguably one of our best performances of that song. He was brought to tears! He came in after and said, ""One of my longlasting memories from decades after graduating college is singing with my best friends and musical partners. Please cherish these times forever.""",1588618087,5,0
"* Meeting my now-wife volunteering for graduation
* Playing pick-up soccer at what we called ""Greek Lady Field""
* Accidentally biting a bit of my friend's hair off during Hey Day
* Playing drunk frisbee golf on campus at midnight
* When Prof. Grey said ""fuck"" during a lecture and it shocked me
* Walking downtown with friends in fancy clothes to eat at IHOP
* Playing Mario Kart in my dorm with my ""Penn Pal"" (local elementary school kid)
* My equally incompetent roommate and I cooking dinner once a week and being proud of the finished product even though it was garbage
* Friends and I crying in the Harrison lobby as we were moving out, knowing that the good days were here, and almost gone",1588617832,9,0
"LOVED his class, He's interesting and easy-going. Course load isn't rigorous. The material is fun and interesting as well, so it's not a chore to do the readings.

ETA: I took it as a summer online course",1588617031,1,0
"It's usually taught by a fresh PhD student who never teaches the course before, so you cannot extrapolate too much from others' experience.",1588611754,1,0
"As someone who was interested in Greek mythology when I was young I thought the class was really interesting. There was a lot of reading although the texts are great and you can get away with skipping some. His lecture style is pretty engaging and I enjoyed it. 

Your grading is done by TAs and mine was really brutal although Struck adjusted grades at the end to boost the recitation sections with low averages which was really nice of him. I would recommend the class.",1588611555,1,0
"I had a lot of fun in the class! It is a LOT of reading but otherwise the workload isn’t too bad. Recitation is also definitely mandatory so do t count on skipping . If you take the class, I would suggest making flash cards of every term that seems relevant because you’ll be tested on them. Honestly though, as long as you go to lecture and pay attention to the online textbook and what you talk about in recitation, you’ll be good!",1588610977,2,0
"Canvas is great for graded assignments where you want students to post something, and maybe respond to some number of comments.

But Canvas doesn’t really support a “discussion”, in the sense of back and forth conversation in which students post things, other students or you post replies, and then students then read those replies and perhaps respond again.

The problem is that Canvas doesn’t provide any way for students to get notified when someone has replied to them. (They can get notified of all posts and replies, but Canvas won’t distinguish the case when someone replies specifically to them.) So unless students are reading everything that gets posted, they tend to “post and forget” and not see any answers they get from you or other students.",1588608807,1,0
"Econ, Mathematical Econ, or Math. 

In addition I would also add a minor in computer science or data science.",1588608114,1,0
Snakeology,1588606961,1,0
I personally don't think this is the best option. Move to Econ101 and if you decide that's too challenging you can drop back down to econ01/02 without a problem,1588606847,1,0
"Not exactly, got rejected/not enough aid from schools I'd preferred, but I chose Penn over Cornell once I got off the waitlist (I would not have enjoyed Ithaca)",1588606094,1,0
"This was pretty much my experience. There were a couple good classes and honors calc 1 was great, but most of the classes were independent study for speed-writing tests. I learned a good amount on my own but it felt like a waste of tuition.",1588604428,1,0
"I was split between chemical and mechanical engineering when I applied, so I applied engineering undeclared for now. Hoping to figure it out during fall semester at the latest.",1588601035,1,0
"Don't retake them, I hear the curves are pretty harsh. Just move on to econ101 and other higher level electives",1588597964,1,0
"Hey! MIT was my dream school too, followed by Stanford though. I didn’t care much for any of the other universities I applied for (including Penn), just wanted to get into something. 

But let me tell you, I love Penn now and if I were given a choice to transfer or do it over elsewhere, I’d still go to Penn. 

Sure it’s freaking hard but it’s not like it would be easier elsewhere. Penn offers you so many opportunities and I made so many friends, there are some amazing communities here. 

What’s your intended major?",1588585280,1,0
"Lol no. I applied just because why not (submitted application late even). Went to the interview just because why not. 

But now I genuinely love it and wouldn’t have gone anywhere else, not even my then dream schools (MIT and Stanford).",1588584939,1,0
Grad student here. Penn was my first choice &amp; chose it over Columbia/Stanford. Penn was also my dream school (grew up from Philly) for my undergrad but I took a little detour and went to Miami for hefty scholarships. Really love my hometown and the Penn community here,1588584238,1,0
math or stats + amcs submat maybe?,1588582770,1,0
No one knows. But operate under the assumption that it is possible.,1588576594,1,0
Highly depends on the prof you take it with. Epstein curved our 508 midterm average to a C,1588574604,1,0
"You can still get in if you talk to them, only thing is they’ll probably prioritize people who get 5s so you might be put on a waitlist (but you’ll probably get in, there’s usually more than enough space). People end up dropping in the first couple weeks",1588572309,1,0
"The Minecraft server is a great opportunity to see all of the different buildings on campus, but as of now there are no official tours on it. Also it’s not like a whole community on it it’s mostly a few hard working people online who are building it. Definitely check it out but it’s still a work in progress",1588571005,1,0
"subject tests work for foreign lang (except chinese)! the chem department will only allow their own exams, though",1588570777,1,0
Reddit is so cringe sometimes,1588569433,1,0
"Dope, thanks",1588568938,1,0
bruh why would you do that to yourself,1588567138,1,0
"I'm not so sure about when people pare saying that the upper level courses are taught so well. I've heard that the honors calc sequence is usually taught by good professors, but 360/361 and 370/371 have been awful in recent semesters. Some of the worst professors in the department have been teaching these classes now (seriously, Pimsner advised a student to take 361 in a semester when he's not teaching it), or they're taught by postdocs that have no teaching experience. The math department had some absolutely excellent professors, but you get them once or twice in a major that is otherwise taught by some mediocre faculty.",1588567111,1,0
"This is a pretty good summary. If your priority is GPA, Econ is definitely among the most difficult majors. It’s not impossible, but unlike many of the other college majors it’s not set up for everyone to get a high grade. B/B+ are standard average/good for Econ and a 3.0-3.3 isn’t going to cut it for top IB to even read the rest of your resume.",1588565568,1,0
"What srsly? :(
Will my Subject tests demonstrate my academic proficiency through? I have an 800. (Same for chem)

It would be a waste of time to go through all that again lol.",1588564453,1,0
"No, 001 and 002 are hard prereqs if you don’t have a waiver for Econ 101, 102, etc",1589774374,1,0
They’re specific to whose room it is,1589774204,3,0
