body,created_utc,score,total_awards_received
"If you’re just looking for a room and you’re a Penn grad student with a penn email, join the Housing fb group and post that you’re ISO a room, including price range, etc. Someone will probably message you! It will most likely be a room in a larger house.",1583175548,1,0
"Regarding price: Radian is out of price range, but Chestnut Hall/HamCo are in price range if you share bedrooms. Radian requires you to have your own room (no sharing, and comes with full bed).

My friend who lives at Evo told me there have been multiple break-ins there recently, but that’s all I know about it.",1583175460,1,0
We will be offering a bus route to Penn so make sure to sign up!,1583172226,1,0
Alum are allowed to use VP no? He isn’t sleeping there as some others have suggested. So doesn’t seem like he is breaking any rules.,1583171464,1,0
"I knew some people that lived in EVO, Italy a nice apartment complex. It's closer to Drexel's campus so there more drexel kids there, but the area is nice and the amenities are solid! I believe the bedrooms each have their own private bathroom as well.",1583168629,1,0
I’m a little surprised that Penn is okay with this to be honest. I wonder if they’re aware.,1583168231,1,0
It depends on the course. You should email the professors.,1583167263,1,0
"Hey also in grade school, I moved out to the suburbs, East falls has some nice apartments for much cheaper than in the city and the location is pretty good. Just take a short train ride to Penn. I pay $795 for a one bedroom and I live about a five minute walk from the train, takes me 30 minutes to get to campus. A friend of mine pays $800 for a room at the Avenue apartment complex and he seems to really like it. Just something to look into if you’re interested.",1583167160,1,0
"yes, he comes to some of the reading groups hosted in VP and I have talked to him.",1583167036,1,0
Do we know this for sure?,1583160501,1,0
"[One Step Away Philly](https://www.osaphilly.org)  

Actually a pretty cool organization they work with a lot of the churches in center city that offer meals and help coordinate where people experiencing homelessness can get breakfast and lunch/dinner or get off the street for a little while and get some basic hygiene done.",1583155819,1,0
:/,1583155737,1,0
"If someone can review the following, it would be helpful.
1. Evo cira centre south
2. Chestnut hall apartments
3. Hamilton court apartments 
4. The summit at university city
5. The radian",1583155529,1,0
"DMD is a pretty hard degree with a lot of CIS courses so people minor using their electives rather than double major most of the time. I don’t have any experience with how transferring works, but DMD is in SEAS, so if you can’t transfer to SEAS, I’m unsure how you could major in DMD.",1583154302,1,0
"He was in my booked GSR last night. Gave my friend some trouble as she tried to get in and he refused to leave. He asked her to what she needs the GSR for and who else is coming and what not, and she was like “I don’t need to tell you this” and so he started lecturing her on having an attitude. When I got there I was nice to him but he was clearly annoyed, but he left then",1583152527,1,0
He is an alumni who is currently homeless /leaving in shelter.,1583151109,1,0
"I have also seen him on Locust in the day-time. Don't know what to make of it, though.",1583144230,1,0
Yes !! That’s him.. I’m honestly intrigued as to what his story is,1583139020,1,0
OP does he walk with a limp and have white hair? He usually hangs out in a GSR reserved for library consultations,1583138572,1,0
"There's a guy I often see in VP, who in my Freshman year (2016) was handing out newspapers near NCH for a couple dollars, which would apparently go to the homeless. I always wanted to talk with him more to understand what organization he works for. He seems a bit disheveled and potentially homeless himself? Not sure.",1583136852,1,0
"Sorry, your submission has been automatically removed because we do not allow ""chance me"" posts here (nobody here can give you meaningful information). If you believe this post has been removed by mistake, please message the moderators.

*I am a bot, and this action was performed automatically. Please [contact the moderators of this subreddit](/message/compose/?to=/r/UPenn) if you have any questions or concerns.*",1583134734,1,0
[removed],1583134734,1,0
How many times do we have to teach you this lesson old man?,1583134432,1,0
"Use [penncoursereview.com](https://penncoursereview.com) 

It gives you the quality and difficulty rating on a 0-4 scale (0 being easiest, 4 hardest). It may not tell you about the intricacies of work for the course, but it is a good overview and you may be able to find a syllabus online.",1583133656,1,0
[deleted],1583118432,1,0
Good stuff. Glad it continued past our year.,1583108554,1,0
Alumni house I think. It happened late in the semester 2013.,1583107459,1,0
The holiday party or the alumni house event?,1583107389,1,0
Yay! I think the first COCO mixer was my senior year!,1583104323,1,0
The right stuff,1583104211,2,0
go Cipactli!! always l.oOved the annual COCO mixer,1583104098,2,0
Mostly theory,1583102770,1,0
"Thanks for the info, i definitely see it now that you said that",1583099439,2,0
"This post made me really happy, remembering good times. So thanks!

The thing that looks like a fish is Cipactli (google for a pic) that looks more like a crocodile than anything else.",1583099299,1,0
"Oh cool, makes sense.",1583099040,2,0
Cipactli Latinx Honor Society. #CL is Cipactli Love. Must have initiated a new cohort. Yay!,1583098500,3,0
"I might not be the best person to respond - am considering a BBB and Comp. Bio Major - but the main difference between the CS &amp; CogSci and the only CogSci major is the depth and breadth.

In the CS &amp; CogSci major, you take more CS courses, do all the Engineering reqs and have a more computation-focused curriculum. There are around 8-10 courses (if I'm not wrong) that you elect for your CogSci major. On the other hand, for the CogSci major, you'll have to complete, firstly, the breadth requirements (psych, math, CS, philosophy, linguistics, neuroscience), and then your focus will allow up to 4 ""technical"" courses and a total of 8 or 9 credits for depth (5 for the Computation &amp; Mind focus). This means that you'll prob not be able to count that many ""advanced"" CS courses for your major but will just elect them as electives. A pro though for the CogSci only major, you would get to do more actual cognitive science, e.g. psych, neuro, philosophy, and also more extra credits to use for a Masters, another major or minor, or anything really.

Transferring - have heard that it's not that challenging but still requires you to take physics and math (because they want someone that is suited for engineering and its rigour).

What I personally would advise (I'm kind of in the same boat because I've considered transferring into SEAS to do CS with Neuroscience): If you like the CS courses, you can do a double major (one major in the college and one in SEAS), the major in SEAS will be included in your degree as if you did it in SAS (as a BA not a BAS or BSE) and you will have more space to explore CogSci courses. If you insist on getting a BAS or a BSE (Engineering degrees), then transferring is an option up until sophomore year (so, there are always options).

If you want to see the courses that you need to take for the majors in SEAS and SAS, check out the [catalog.upenn.edu](https://catalog.upenn.edu)

Also, if you have any further questions, I'd be happy to help. Either way, don't worry about deciding your entire path first semester. Not to be cliche but it's about the academic journey, not the destination (a lot of Penn students often forget that).",1583093543,1,0
"They're pretty expensive, as you have to pay for each credit. I recommend avoiding summer classes unless you absolutely have to to graduate on time. Since you're still a freshman, maybe try getting a summer internship or working instead?",1583092805,1,0
"If you go to “Course Search” on PennInTouch and set the term to “Summer 2020”, you can see a list of all the summer courses being offered.",1583087112,1,0
Apparently according to my friend who lives in Gregory it was a shooting (?) dont quote me on that.,1583083632,1,0
only adults can sign to go down on my package,1583052839,1,0
Underrated reply,1583043039,1,0
underrated reply,1583043002,1,0
"One of the Penn safety officers on bikes said it was ""a bunch of kids getting into trouble."" [Flash mobs](https://billypenn.com/2017/03/13/flash-mobs-in-philadelphia-the-racialized-rise-of-urban-terrorism/) of teens who [rob stores](https://www.inquirer.com/opinion/south-street-video-mob-teens-philly-jenice-armstrong-20190710.html) and [assault people](https://www.nbcphiladelphia.com/news/local/flash-mob-attacks-teens-arrested-center-city-philadelphia/33890/) happen every so often in Center City, so I'm guessing it was something like that.",1583029936,1,0
"it's an ""adult signature required"" label, do I need to bring my ID when i pick it up?",1583024565,1,0
Also like 2 weeks ago 34th and walnut wth was that like,1583023981,1,0
"saw this break out. was at 39th and walnut when people started screaming. a wave of people started running towards us looking terrified. if anyone has more info, I'm pretty shaken up over it",1583022638,1,0
They sign for it,1583017260,1,0
Same!!!!,1583001470,1,0
They said we hear back after spring break,1582993331,1,0
When she came for the one girl simply because she was named Summer and from Tennessee... lol why Bronwen,1582986598,1,0
"She’s also been replying to students’ comments that are simply tagging their friends, one of whom she called out for being named Summer and being from Tennessee... did she really have to come for people like that? Lol",1582986527,1,0
"[She’s certifiable.](https://imgur.com/a/x5erQMa)

Tl;dr: all American students are idiot children, Americans in general are uncivil boors who voted for trump and murder children, this is ageism and has been reported to the authorities.",1582985833,1,0
I will!!,1582982091,1,0
Hopefully! Be sure to let us know!,1582980864,1,0
This is great news. Congratulations!,1582980829,1,0
zero comments,1582973675,1,0
"If you make it optional rather than mandatory, won’t future grad schools/employers just assume you did poorly due to selection bias",1584417113,1,0
Exactly!!! I’m living at the Radian this summer!!!! And yes I saw a bunch of parties,1584406548,1,0
"Hey! No, there are no interviews as part of the transfer application process.",1584405599,1,0
"As disappointing as this is, it's the safest thing to do. I expect other universities will follow suit. 

Though tbh, I don't get why they can't plan to reschedule commencement if they're also moving class reunions to the fall.",1584405268,6,0
"Adding on to this, even if you're young and healthy, we know that previously young and healthy survivors of previous versions of SARS sometimes end up with lung, bone, or even neurological damage. Might be early to tell right now, but it seems like this version of coronavirus might similar in that regard.",1584404771,1,0
"Didn’t they extend the pass/fail deadline til the 27th so those who want to take their classes pass/fail can do so??
I doubt the petition would be modified so significantly from its original meaning so imo it makes more sense not to circulate it, and instead spread awareness about the extended P/F deadline.",1584403533,1,0
"Penn's summer website says as of right now yes, but it may change, keep checking the website for updates:

[https://www.sas.upenn.edu/summer/](https://www.sas.upenn.edu/summer/)",1584403269,2,0
In what world? How is it conceited and selfish to want to reschedule graduation at a later date?,1584403175,2,0
"Does anybody know how to contact the person who created the petition to modify it? I agree they should give the option, not enforce it on everyone indiscriminately.",1584402171,3,0
you’re out here doing God’s work,1584402009,4,0
"I am fully aware of the current global health crisis and that canceling the May graduation is the only responsible thing Penn should do. However, the petition isn't asking for graduation to be held this May -- it's asking for it to be postponed to a later, safer date instead of completely moved online.",1584401588,5,0
"I’d be fine with the *option*, but that’s not what the petition says. If I had to pass/fail the easy classes I’m taking now, the harder classes I have to take later will bring down my GPA even more than they already would. So I won’t sign the petition.",1584401458,8,0
"From big G:

&gt; To protect the health of our graduates, their families, alumni, and faculty and staff of the University—our highest priority in the face of this unprecedented coronavirus pandemic—**we are cancelling this year’s on-campus Commencement events and moving them to a virtual ceremony that will be broadcast online.**

From Alumni Relations:

&gt; For those expecting to celebrate class reunions in May (i.e. class years ending in 0 and 5), we will be working with the University to try to reschedule in the fall – possibly over Homecoming Weekend.",1584401453,3,0
[deleted],1584399437,0,0
"First of all, if everyone signed this, it would do nothing,  but you can try to make yourself feel better anyways. Second, as someone who has walked across the stage, it's not as memorable as you think. And third, this post makes me think you are conceited and don't care about anyone but yourself. Grow up.",1584399423,-2,0
Stay safe frens &lt;3,1584398218,3,0
Thanks!,1584397459,1,0
"Grocery stores in Chinatown... plus they won’t be as crowded because most people don’t want to shop there :P But if you want an option closer to campus, try Old Nelson Food Co, there are several locations around Drexel.",1584394294,4,0
"And to piggyback off of this: please do not take your youth for granted folks

I know you know about spreading to older people more at-risk, but also consider your friends who may have chronic conditions you're unaware of, and that even for young people ""mild pneumonia-like symptoms"" can still be pretty fucking brutal",1584394178,3,0
"I don't why people are panic buying bottle water and toilet paper. Like...there is always tap water and shower. Bunch of countries don't even use toilet paper, just hop in the shower bud!",1584392978,0,0
/u/chinkiang_vinegar,1584387083,1,0
"TL;DR - three undergrads have tested positive, all three traveled abroad for spring break and came back to campus, ""where they lived in close quarters and socialized with friends""

Coronavirus is here in Philly, and I suspect cases are far higher since we don't have adequate testing capacity.  In South Korea, the highest frequency of positive tests is in the 20-29 age group, since they are testing hundreds of thousands of people.  So even without symptoms, you may be infected and can pass the virus to others.

Stay safe, folks.",1584383185,11,0
West River drive,1584381599,1,0
Maybe I'm not a Penn student. I could be a KGB spy,1584381445,1,0
How am I supposed to answer that question when it has nothing to do with mine?,1584379182,1,0
How am I supposed to believe you’re a Penn student when you can’t even answer a simple question about Penn?,1584379119,1,0
How am I supposed to ask this question without offending you?,1584379033,1,0
there's an info doc the prof emailed to me DM if u want it,1584377603,1,0
"Judging by your post history, though, this one was quite tame by your standards",1584372266,1,0
"Not offended :) not even a Wharton student

Nice job playing dumb on the whole issue, by the way! Really worked out well for you. Your post lasted a couple hours",1584372201,1,0
"You could try a public play ground and use the monkey bars, but wipe everything down and use alcohol hand sanitizer.",1584367365,1,0
seems predatory to me (sexually and financially). please be careful everyone,1584362172,1,0
Why do you want to take it?,1584359264,1,0
"Sorry, your submission has been automatically removed because we do not allow ""chance me"" posts here (nobody here can give you meaningful information). If you believe this post has been removed by mistake, please message the moderators.

*I am a bot, and this action was performed automatically. Please [contact the moderators of this subreddit](/message/compose/?to=/r/UPenn) if you have any questions or concerns.*",1584349981,1,0
"We removed this comment because your account is too young. Please contact the moderators if you need this post re-approved.

*I am a bot, and this action was performed automatically. Please [contact the moderators of this subreddit](/message/compose/?to=/r/UPenn) if you have any questions or concerns.*",1584337411,1,0
"We removed this comment because your account is too young. Please contact the moderators if you need this post re-approved.

*I am a bot, and this action was performed automatically. Please [contact the moderators of this subreddit](/message/compose/?to=/r/UPenn) if you have any questions or concerns.*",1584335226,1,0
"I entirely recognize this. So far I have found a subletter for whom I have lowered the price significantly, due to these factors. However, my roommate’s parents are not permitting her to lower her price as they would like to break even (as much as possible) what they pay for her rent, since she lives internationally and needed to buy a plane ticket on very short notice, amongst other factors. 

We know this is still expensive and in many ways, our pricing is out of our control. Still, we are trying to offer as much as we can in this situation, which is namely to accommodate multiple people in a room (compared to other people in our building who are only permitting one person per room, which is more expensive). 

In addition to subletting my room, my family and I are opening our home (not in PA) to students who are not able to return home for a variety of reasons. Unfortunately, I could not do the same thing at my apartment in Philly, but I hope I can help someone, either by giving them a place in the Radian or at my home.",1584331466,1,0
Bro are you an alien? Your post history is absurd,1584331038,1,0
"I think, considering the circumstances, lowering your price would get you a lot of goodwill that, in the long-term, would be worth a lot more than $345 per week.

Consider this: at your current rates, it appears that your goal is to make roughly $350/ week regardless of how many people show up. If you said $115/ week per person, it appears that you are trying to help as many people as possible (although $115/week is still admittedly high for some students). What is your goal here?",1584330969,1,0
How am I supposed to ask a genuine question without you calling me a troll?,1584326243,1,0
"Like, all of it. I know/have known many Wharton undergrads. At the end of the day, they’re normal people, with normal people problems. They get overwhelmed, acne, depression, anxiety, maybe come from low-income families, struggle and ultimately overcome a lot... just like the rest of us. Stop generalizing and being a troll.",1584326124,1,0
What parts of it seem untrue?,1584325808,1,0
Is this satire?,1584325761,1,0
"?

I like the Wharton students. I’m asking what it’s like to be one.

How am I supposed to ask this question without offending you?",1584325496,1,0
caviar flavored death,1584323839,1,0
Who hurt you,1584323421,3,0
It feels like salt?,1584323140,1,0
Salt,1584323115,1,0
[deleted],1584323086,1,0
How is their existence offensive?,1584322781,1,0
"We are intending to have double or triple occupancy. 345 is very far from cheap! But we want to open it up to more people, rather than look for single occupants, since that would hinder many people. 

ETA: if someone does want to pay 345 and live in a bedroom alone, we also don’t want to stop them. We want to give options to people in a variety of circumstances.",1584322146,1,0
How is $345/week cheap? Are you guys nuts?,1584322095,1,0
[deleted],1584321720,1,0
I wouldn't recommend taking CIS 455 at the same time as CIS 240. CIS 455 requires a level of programming maturity far past the typical CIS 240 student. Take a look at the CIS@Penn Facebook group for more advice on taking CIS 455/555.,1584321077,1,0
his tag is emotionalRedux,1584319994,1,0
exist,1584317880,1,0
Thanks for the advice. I got it figured out.,1584317357,1,0
"Sorry, your submission has been automatically removed because we do not allow ""chance me"" posts here (nobody here can give you meaningful information). If you believe this post has been removed by mistake, please message the moderators.

*I am a bot, and this action was performed automatically. Please [contact the moderators of this subreddit](/message/compose/?to=/r/UPenn) if you have any questions or concerns.*",1584314966,1,0
[removed],1584314966,1,0
"This just in, Business school students are different from Liberal Arts students, news at 11:00",1584314720,3,0
What sorts of things do they do that make them seem that way?,1584314208,1,0
I actually was joking about them all being a-holes but they are definitely a different breed from liberal arts and engineering students. The Wall Street gunners in particular.,1584314181,1,0
Lolololol What sorts of things do they do that make them seem like a-holes?,1584314089,1,0
You know everyone who goes to Wharton?,1584313891,2,0
"Sorry, your submission has been automatically removed because we do not allow ""chance me"" posts here (nobody here can give you meaningful information). If you believe this post has been removed by mistake, please message the moderators.

*I am a bot, and this action was performed automatically. Please [contact the moderators of this subreddit](/message/compose/?to=/r/UPenn) if you have any questions or concerns.*",1584313778,1,0
Because the people who go there are all A-holes - not a joke. The other students at the school don’t even want to deal with them so we’re happy for them to think they go to different school 😂.,1584313570,-1,0
"Wharton has had a large amount of big $$ single donors (including the namesake of the school, Joseph Wharton)...so as a result of those donations, the names are changed.

Also it is definitely called ""Wharton School of the University of Pennsylvania""

Other schools such as engineering, nursing, and the college have had a lot of donors but are likely small $ donors or don't want to rename an entire school.

Compare that to penn med (Perelman) and penn law (Carey) which had single gift donors giving upwards of $200 million and $100 million respectively for each school.",1584310751,1,0
How am I supposed to interpret that?,1584310537,1,0
[deleted],1584310515,1,0
[deleted],1584310484,1,0
$$,1584310436,2,0
wait what happened here,1584307793,1,0
"Not sure they didn't tell us, I heard a rumour that it was the Prof but apparently he's fine so I think it's one of the students",1584307594,1,0
"Honestly, I have no idea. Having them hold it doesn't seem unreasonable but who knows what they'll do given the way they're handling the rest of this situation. If I were you, I'd email Penn Mail once you get a notice that it's okay to move back in/get your stuff and see what they say. You might also be able to contact UPS directly and see if they can intercept your package and reroute it to wherever you're living now.",1584306518,1,0
Thanks for the info. The package is non-perishable and is being shipped through UPS so I guess they will hold it for me. Do you think they will be able to hold it until next year in August? It would be quite a hassle to have to fly back to Penn just to pick it up when they tell us it is safe.,1584305704,1,0
Update Penn InTouch with your permanent address and they'll either forward it to you if it's USPS or just hold it for you if it's another carrier. More info/FAQ here: [https://cms.business-services.upenn.edu/residential-services/coronavirus-information](https://cms.business-services.upenn.edu/residential-services/coronavirus-information),1584303875,1,0
"It's for 30 days, but I'll check if the cost afterwards is manageable. Thanks.",1584301544,1,0
"Thanks, I just had a call with SFS and they booked my flight. I kind of want to just move out of my room entirely since I don't have a lot of stuff that I need to store, just a lamp and a few things. I'm trying to find the best option right now.",1584301376,1,0
I heard that Uhaul is offering free storage for Penn students.,1584301001,1,0
"wE sYmPaThIzE wItH yOuR dIsApPoInTmEnT

&amp;#x200B;

sorry that you're in that situation, hope all goes well",1584300316,2,0
"I never assumed all people had a safer alternative living situation and don’t state that anywhere. As I said, it’s an unfortunate situation, for many reasons. But nothing changes the fact that it’s absolutely not medically wise to have people staying in on-campus housing during an international viral pandemic.",1584299688,1,0
"Just got denied too. Anyone know the best options for storage until August? Also, if there are lower cost options as a FGLI student?",1584299469,1,0
"&gt; I think naturally a lot of people want to stay on campus, but like the email said, it’s not medically wise. 

This assumes that everyone has an alternative living situation that is better than campus, which is not true for many people. It's not the bros partying outside that are begging Penn for housing--it's the people whose alternatives are much less safe--physically, medically, mentally.",1584298327,1,0
