title,selftext,created_utc,score,total_awards_received
Selling Wharton Women Summit: She’s speaking ticket!! $50 -pm me!!,,1631513260,1,0
Anyone selling or know someone who’s selling a bike?,,1631504766,1,0
"$1,500 &amp; Resume Benefits - Helix Home Appliances Innovation Challenge",[removed],1631503567,1,0
MGMT 111 or BEPP 203,[removed],1631502391,1,0
Theoretical question (TW),[removed],1631501299,1,0
Where do I get one of those scooters????,I wanna zoom down locust walk too,1631500906,1,0
Applying here for grad school and had a silly question,"I was perusing the online bookstore (as one obviously does as a non-student) and I noticed clothing merch simply saying “PENN” instead of University of Pennsylvania or simply, UPenn. Why is that? Wouldn’t people confuse PENN with Penn State? As you can tell, my Sunday evening is uneventful. Also feel free to let me know how you feel about the school as a whole.",1631495990,1,0
Psyc 215 (Data Science for Language &amp; Mind),"If anyone is thinking of dropping Psyc215, pm me! That would be a bless :)",1631495004,1,0
Whoever cooked the brisket at Lauder tn,you deserve a mfing raise this shit is fire,1631488194,1,0
Penn Buy / For Sale ?,Anyone know if there is a website for UPenn students to buy / sell college things? I saw the old Facebook page but it doesn't seem to be used since 2014. Trying to buy a few apartment things and sell a microwave (HMU if interested),1631486672,1,0
How is UPENN?,"Hello! I'm going through the application process rn and was wondering how upenn is for undergrad studies. I plan to go into engineering and have heard about their M&amp;T program. Overall could someone tell how the campus, opportunities, students/staff are and whether it's worth coming here. If there's anything bad I'd appreciate if you could tell me that too... Thanks in advance!",1631485683,1,0
US Open watch party in 20 minutes!!,A couple friends and I are watching the US Open (tennis) final in about 20 minutes (4:30) in NCHW second floor on the 70 inch TV. Stop by to see djokovic or medvedev make history!,1631477433,1,0
Reminder: screening tests start this week!,"Per the [latest guidance](https://coronavirus.upenn.edu/announcement/message-campus-community-start-fall-semester):

&gt;Beginning the week of September 13, all [fully vaccinated] students enrolled in an on-campus program will be required to participate in a mandatory screening test program twice a month.

(For non-vaccinated students the old requirement of 2x/wk still holds.)

Schedule [here](https://covidscheduling.upenn.edu/), view results [here](https://covidresults.upenn.edu/), and find instructions [here](https://coronavirus.upenn.edu/content/penn-cares-testing-program)

A TL;DR of instructions and tips:

*No food, drink, gum, tooth brushing, smoking, vaping, etc. for 30 minutes before the test
*Bring your PennCard and OpenPass
*Remember you'll be asked to keep your mask on as much as possible; wear one that's easy to push up partway.

*If you're eternally underhydrated like I am, set a reminder for 1 hour before and another one for 30 minutes before your test. Use the time between the 2 reminders to drink as much water as possible.
*Gently biting your cheeks between spits can help encourage salivation
*Tuck your chin, raise your tongue, and let gravity do the work as much as possible. Forcing too hard adds bubbles, which don't count towards the required volume.",1631474436,1,0
Does anyone know how much entry to the dining halls costs using dining dollars instead of swipes?,,1631474395,1,0
Morning covid test,"If we get an early morning COVID test, can we get the results on the night of? Is there a cut off time?",1631473556,1,0
Clinical Experience/ Volunteer Hours,[removed],1631467324,1,0
International student in need of a US banking account,"Hello,

How do I open a bank account as a non US citizen ? 

&amp;#x200B;

thanks",1631463792,1,0
At what time does Pottruck gym close today?,,1631455404,1,0
Van Pelt library rec?,I'm new to penn and I went to val pelt library a couple times. I didn't know where to go so I went to 3rd floor but it was too dusty. I don't want to stop every floor and bother other people studying so I was wondering if y'all can recommend me some place to study alone ! thank you!,1631452916,1,0
"For international students, is the med school considered ""on-campus"" for work study",,1631452155,1,0
Anybody ever booked sessions with the trainers at Pottruck?,"I want to get into working out since I’ve never really done it before.
Are the trainers at Pottruck good? Or does anybody recommend any personal fitness trainers in the Philly area? (I’m a girl, 21 y.o.)",1631413382,1,0
Anybody know what happened at the frat between Harnwell and Harrison?,[removed],1631410881,1,0
Psyc-207 (Intro To Cognitive Science),"If anyone is thinking of dropping Intro to Cognitive Science, please pm me!! I really would love to get into the class, so if anyone is dropping, can you please let me know? :)",1631406192,1,0
In need of Allen Wrench/keys,This is the stupidest thing I thought I’d never have to post but apparently nobody on this campus has a toolkit and the nearest store that has Allen keys is 4 miles away. If you can help me out shoot me a pm.,1631393902,1,0
Feeling unmotivated- anyone wants to do MCAT problems together throughout the sem?,title.,1631393212,1,0
"Selling two John Mulaney Tickets for the Monday, October 4th show!","Both tickets $220 total ($110 each including fees). Not trying to upsell and I'm breaking even. I can't make the show and they have a strict refund policy. The seats are in the orchestra, **W-2, W-14 and,** are one seat in between each other near the aisle. These were the only tickets left when I bought them but I was thinking the one person in between would not care if you asked them to move over.

Please let me know if you are interested!!!",1631391441,1,0
How common are A pluses?,"Asking because I’m pre law where A plusses count more, are there people who get a lot (like more than 5) A pluses?",1631388987,1,0
FNCE 237 HW Partners?,"Does anyone want to join a FNCE 237 group for the HW?

&amp;#x200B;

:)",1631385447,1,0
Accidentally loaded Calculus Blue in 4k,,1631382473,1,0
testing starting on monday?,aren’t we supposed to start getting tested on the 13th once every 2 weeks? does anyone have any info on this i feel like penn has barely said anything (unless i missed something),1631373356,1,0
Specialist visit over $300?,Went to a dermatologist and got billed $317?? i’m under psip as well,1631371460,1,0
Anyone switch a course this late into enrollment?,Did you feel you missed a substantial amount of teaching or was the switch an easy change of direction?,1631368366,1,0
How to find friends in competitive environment?,"I have a friend group but I always feel like they get jealous of my accomplishments instead of mutually supporting each other. They match my humor and we have fun together, but I feel like they take me for granted. How do I find more caring, ""innocent"" friends?",1631332378,1,0
Stat 435/535/711 HW Group,Anyone in Stat 435/535/711 wanna work together on the homework?,1631328598,1,0
Fastest way to get to the airport from campus?,"Is it better to Uber to the airport, or is there another way we can take to get there? If so, what is the route like?",1631320952,1,0
ANTH 190 Intro to Africa by David Amponsah,Has anyone taken this course? Added it last minute and would love two cents on what the course is like,1631309628,1,0
Tennis Hitting Partners,"Anyone near campus play tennis? I'm not like a recruited athlete or anything but played 4 years of varsity hs. DM me if you want a hitting partner. Also, I got tested negative for covid.",1631307209,1,0
i have gotten four emails from handshake in the last 6 hours,,1631306416,1,0
Wifi always switching to ‘Connect to AirPennNet’,Am I the only one where the wifi switches to “Connect to AirPennNet” every mf time I enter/exit a building so it has to reconnect? Any insight is greatly appreciated,1631300980,1,0
Where to get carts?,[removed],1631299902,1,0
Does anyone know where to get… carts?,[removed],1631299831,1,0
Anyone know where I can get a… pen?,[removed],1631299767,1,0
test,,1631299725,1,0
Bento workers language,What do they speak? Just curious after having been penn student for three years.,1631294384,1,0
Psyc 001,"Any suggestions on how to study - keep up with the work?  
How much attention should I pay while reading the textbook vs class lectures? 

Appreciate it",1631292758,1,0
Best clubs to get girls at,[removed],1631292305,1,0
Contact The President,"I have to write something to our President Amy Gutmann.  How can I write to her?
Is there any email address?",1631291287,1,0
Does anyone know whether schools within Penn are allowed to set policies that contradict those of the whole University?,"I was in Joe’s Cafe today and my mask was off as I’d been eating, and some people from Wharton admin came in and told me I needed to put it back on, as there are apparently designated food spaces in Wharton buildings and you’re only allowed to have your mask off while you’re actively eating in those spaces. Obviously I’m fine with that policy, but I was wondering whether it’s within their authority, given Penn has [specifically mentioned](https://coronavirus.upenn.edu/content/public-health-guidance) in their public safety guidance that there is an exemption to the indoor masking requirement for those in shared spaces where 6ft distance can be maintained (which was the case in Joe’s cafe, since it was pretty much empty). As a student new to Penn admin, is Wharton admin authorized to do this?",1631284786,1,0
penn mobile not showing amount of dining swipes/dollars,"no matter how many times i refresh or log out/in, my pen mobile still shows 0 for all my swipes and dollars. i know i have them, since they've been working just fine when i go to dining halls and houston, but it's a little annoying that i can't actively check how many i have left 

does anyone know what i should do?",1631282978,1,0
SEPTA Bus Card,"Hello, where can I get a card for SEPTA bus system on campus?

&amp;#x200B;

thanks",1631282743,1,0
Is math 104 a semester or year long class?,,1631274809,1,0
Do you think UPenn will be forced to go back online due to Covid-19?,,1631256120,1,0
Warm places to study on campus/off campus?,"As someone that's cold all the time, I'm freezing on certain floors of VP, etc even if I do have a sweater. Any recs would be helpful!",1631243942,1,0
Anyone trying to queue for CSGO,I lost my rank since I haven’t played since school started but I’m GN1,1631229967,1,0
are there any sociology/anthro/hsoc majors on premed track I can pm? thank you!,,1631229704,1,0
places on campus with best wifi?, \^asking for a friend,1631226600,1,0
Beginner Tennis,"Hi, i'm really interested in learning to play tennis - I've never actually tried but I want to get into it. Is anyone down to practice with me (beginner level too)?",1631223698,1,0
does anyone know the max number of classes PennCAP covers during the summer?,"also, is the PennCAP grant only for Penn summer classes or can it be used at another 4 year university? thank you!",1631216147,1,0
Molecular Model Kit,[removed],1631214639,1,0
More than 225 instructors petition Penn to allow option to teach remotely.,,1631211276,1,0
CIS 19x Class Workload,"Does anyone know the what the workload is for any of the CIS 19x classes? I'm looking for a potential half credit substitute for my current half credit tech elec (ESE 292). 

How much time is spent outside of class doing homework, reviewing material, etc.?",1631209795,1,0
Cheap used bike/ bike rent that is NOT Indego?,"Hi, I am an exchange student and will be staying at Penn for this Fall semester only. I figured out that bike is one of the best way to get around campus considering the abundance of bike racks.

I am wondering if you guys know any shop that sells cheap used bike? My budget is $150 if that helps.
I am also wondering if there is any option to rent bike monthly but without the hassle of returning it to a dock like Indego? Thanks!",1631204753,1,0
Transfer,"How easy is it to transfer here? I’m currently at Penn State planning on double majoring in 3 years currently with a 3.9 GPA. I’m practically miserable here. I like school and being challenged, which I’m not. Anyone have any input on the transfer experience?",1631203323,1,0
UPenn,,1631202488,1,0
What is the process for petitioning a class to fulfill a sector requirement?,I have this class that doesn't fulfill a sector but is pretty similar to other classes that do fulfill that sector.,1631198667,1,0
Internal Transfer from CAS to SEAS,[removed],1631195792,1,0
Humanities major needs help choosing sector courses,What would be the easiest course to fulfill the Physical World sector requirements?,1631194553,1,0
"At this point, guest WiFi is way more reliable in my rez than student WiFi","WiFi in my rez getting worse and worse since the day I moved in. My computer can't even make a stable connection to regular student WiFi for more than a minute since the ""outage"" yesterday.

On the other hand, the Guest WiFi actually makes a stable connection. It's only 4 megabits/sec, but at least I can do homework and zoom meetings on it.

Anyone else still struggling with this?",1631191444,1,0
"How do people feel about the ""flipped"" nature of MATH courses at Penn?","When I say ""flipped"", I mean that we watch video lectures online and that class is mainly meant for practice. Classes such as 104 and 114 use Ghrist videos, and 240 (class I'm taking now) is using DeTurck's videos. Personally, I don't enjoy the format because it seems no different than online learning. I am, however, a fan of the Friday quizzes over midterms. What do you guys think?",1631163321,1,0
PSYC 001 with Jenkins,Anyone who has taking this class before -- do we actually need to do the readings? Or can we just read the review points at the end of each chapter?,1631162438,1,0
what's the easiest major to get a high GPA in??,[removed],1631155273,1,0
any communication majors??,"is the major ""hard""? do you get a lot of homework? what do your exams typically looks like? I'm considering communications as a major but was curious about the difficulty of the major. Thanks!",1631152811,1,0
Phil 025 (Philosophy of Science) vs BiBB 149 (Cognitive Neuroscience)?,"Has anyone taken both of these courses? Trying to choose between them to finish out a minor but can’t figure out which one would be more enjoyable. This would be my 6th class, so I’m curious if one might be more doable than the other.",1631151028,1,0
heyo gamer gamers,"if you play literally any pc game: come join upenn gamer gamer on the University of Pennsylvania Discord hub! we'd love to have you (and we play a lot of valorant &amp; apex if that's a sell for you)

link to the discord hub: [https://discord.gg/4wRJjYb7gV](https://discord.gg/4wRJjYb7gV)",1631150800,1,0
How do I confirm I have a Pottruck membership?,I am only taking 2 classes this semester. How do I confirm/see if I don't have a Pottruck membership?,1631148498,1,0
Work Study outside of campus,Can you have a work study with a non Penn start up or company?,1631144379,1,0
Wifi,Bruh. The wifi went out 3 times during my canvas quiz before I gave up and turned on my hotspot. I had to turn off the wifi to open Reddit cause it was sooo slow. Wtf are they using that technology fee for when I can’t even open an email,1631143945,1,0
can I pm a premed student? (preferably a non-stem major),^i had a personal question! tysm!,1631142471,1,0
Let’s try again M&amp;T students here,[deleted],1631141818,1,0
"Where tf is ""chap""","Hi everyone,

An upperclassman and I are meeting for lunch tomorrow and he told me to meet him at ""chap"" at 2. Does anyone know what the hell that means? I tried looking it up and the closest thing I've been able to find is the chaplain's office in Houston but that seems like a strange place to meet. I met him through the frat he's in and so my next best conclusion is that he's referring to their frat house (like chap as in chapter). Someone please help",1631137939,1,0
on the verge of passing out w mask on in class,been feeling so oxygen-deprived and dizzy when I'm in a class room with mask on. unsure if this is a me-problem or what. who with me,1631137150,1,0
Sample Schedule Huntsman Program,Hi! I was hoping a current student could share their schedule with me on direct messages. From the website it is difficult to grasp what a schedule at huntsman could look like. Also open to talk to huntsman students about other things than the schedule! I would really appreciate a response!,1631130292,1,0
Package lockers vs mail room.,"Hi, I live in Hill. There is a package locker and a mail room both in the building. I ordered a package and USPS says it was delivered yesterday. I haven’t gotten a notification for it yet (I’m assuming they’re sorting packages and haven’t gotten to mine yet). 

Do packages always go into the locker or are they found in the mail room as well? I’m just confused about what mail items go where. Thanks",1631127248,1,0
WiFi down?,why,1631123847,1,0
Are there any meditation rooms on campus?,if not we desperately need them,1631121937,1,0
Fox Fitness and Shower Access,Asking here since the recreation website has little to no useful info. Wanted to check where I can access showers since Fox apparently has no locker rooms? Supposedly Tse has some but my PennCard didn't get me in today when I tried. Am I forced to go to Pottruck if I want the gym AND shower experience?,1631121600,1,0
Philly Tattoo Festival,I’m planning on going to the tattoo festival this weekend at the convention center by city hall. I thought I’d see if anyone else from Penn was planning on going and wanted to go as a group.,1631120042,1,0
Volunteering at Presbyterian Hospital,"Can anyone share their experience with volunteering at Presbyterian? I’m a pre med student looking for some volunteer / clinical experience. 

It would be great if you could share your application process, whether the experience was meaningful, letter of rec at the end, etc. thanks!",1631117789,1,0
Drop/Add Period Closed Classes,"If it's Wednesday and the add period ends on Tuesday, do I still have hope? 

I.e. are people still course shopping this late into the semester? Would make my **YEAR** if someone didn't need a spot in COGS-001-401.... 

Happy shopping ;)",1631117345,1,0
Is there any fashion modeling/photoshoot opportunities for students at Penn?,Maybe any clubs or activities?,1631115015,1,0
Any non-stem pre-med major willing to offer advice ?,can I pm anyone some clarifying questions about non-stem majors + doing pre-med? none of the advisors are really helping,1631114325,1,0
Anybody have experience with PennCU?,"Asking my fellow staffers:

Any thoughts/experiences on [PennCU](https://penncu.org/)? This is the Penn employee-specific federal credit union, not the student one(SFCU). I was looking at options for mortgage and auto financing and saw that PennCU rates are not as competitive as I would've hoped. Just wondering if there's anything I'm missing that really makes it worthwhile joining as a member.",1631111037,1,0
Free food on campus?,[removed],1631109546,1,0
Mgmt399,Can anyone who’s taken this course for the wh capstone or heard anything about it comment on how the course is? Thanks!,1631105772,1,0
Do I need an OPT before applying to a job at CHOP?,,1631105760,1,0
Changing the College,[removed],1631099676,1,0
going to a class youre not enrolled in,theoretically could you just go in and sit in a class you aren’t enrolled in to see what it’s like in case you want to take it?,1631099654,1,0
New College House West Reservations?,[removed],1631093645,1,0
How do we make a reservation for the dining hall at NCHW,[removed],1631093558,1,0
anyone interested in prepping for data science recruiting together,"looking to practice behavioral/product/stats interview qs with someone, lmk if ur interested",1631070725,1,0
Why does the Chipotle here suck so much?,Literal plain white rice &amp; canned beans,1632540229,1,0
What is SIQ (like on Penn Eats?),,1632534163,1,0
How are phys 101 and chem241 over the summer?,Not together though,1632533499,1,0
What are some unique aspects of UPenn MSE?,What are some cool things that upenn material science and engineering offers that you didn't know before you got there? What drew you to mse at upenn?,1632530931,1,0
Remote STEM Volunteering Opp,"Hi Everyone, I'm Dom, Penn class of '18 grad and co-founder of EasyA. We're a 100% free, on-demand maths tutoring app. Any K-12 student can download our app, take a photo of their question and connect with a college student who can help!

If you got a 5 in AP Maths and would like to help students across the world in your free time, we'd love for you to join us.

All tutoring is done via chat and there's no scheduling ahead (and no minimum time commitment), meaning you can help out whenever YOU have time.

If you're interested in volunteering, even if just a few minutes each day, please sign up here! 

[https://forms.gle/C3zeDxNDoH7aiaPM8](https://forms.gle/C3zeDxNDoH7aiaPM8?fbclid=IwAR2e8DevcbyIMk2saG3g4RuUOyw_IlFge76oox3OV8BM6zYE26YUNHT8xtQ)

(Find out more about us here! [www.easya.io](http://www.easya.co.uk/?fbclid=IwAR3YgssRHhxHDvRoyakjcK0yOAOLkjHHXuTYgAIlZjl5sykLO5w3myUytyg))",1632525782,1,0
Where can I give alms?,The obligatory meal plan bothers me on multiple levels. I wish to give bags of to-go meals to the poor. Where do you usually see them? I don't want this money that I had little choice in spending to go to waste.,1632524059,1,0
parties this wknd,where can i find the parties this wknd haha. im down for frats im just like ahh how do i get in ? ya know .,1632521228,1,0
Grad student hang out at Board and Brew tomorrow at 1!,"Hello! I made a post last week about getting some grad students together to hang out and play some games or sports. I ended up making a discord server for everyone on that thread to join. Here’s the link: https://discord.gg/k4uUTU38

The plan is to go to Board and Brew and play some games there tomorrow at 1, and then maybe play volleyball together next weekend depending on how many people are interested. If you want to come then join the discord, send me a message, or just show up!

I’m a grad student myself and I don’t think there are too many fun, casual clubs for grad students which is why I aimed this at grad students, but if you’re an undergrad and want to come you’re more than welcome to!",1632515066,1,0
"Penn student assaulted at Castle fraternity party, leaving him with severe injuries",,1632511569,1,0
Anyone have decent typed notes from Hist 135 (Cold War: Global History) lectures so far?,I switched like all my courses during add period and am trying to catch up pls help a girl out and share a copy with me 😭 I'll venmo you like 10 bucks or buy you smth,1632511531,1,0
(Dentistry) Care Center for Persons with Disabilities Personalized Care Suite," Want to know all about the new Personalized Care Suite,? Check out this helpful patient guide, which includes details on our services, special features, fees, and parking.  

 To learn more about the Personalized Care Suite or to make an appointment call: 215-898-8965 

[https://www.dental.upenn.edu/patient-care-facilities/care-center-for-persons-with-disabilities-personalized-care-suite/](https://www.dental.upenn.edu/patient-care-facilities/care-center-for-persons-with-disabilities-personalized-care-suite/)",1632502113,1,0
Asking for exam score after dropping class?,"I dropped a class after a midterm, but I’m curious to know what I got? Would it be weird to email the professor and ask for my score?",1632501714,1,0
Question specifically for ladies,What do you look for in a guy,1632499321,1,0
lol,,1632497496,1,0
Professor Adam Grant is the keynote speaker for a FREE virtual event on November 9th - if anyone wants to attend you can sign up here!,,1632496864,1,0
Leetcode premium for 99$/yr instead of 159$/yr if 50 students from same school signup.,,1632496285,1,0
Starting a Club at Penn,So I’m thinking of starting a new club at Penn. What’s the best way to put this out there and get potential club members?,1632488002,1,0
Room Change Requests,[removed],1632451510,1,0
need to get rid of a gov ball ticket…,selling a gov ball ticket for saturday at a discounted price 😸 pm if interested,1632450147,1,0
