body,created_utc,score,total_awards_received
"I agree with the idea that you can pretty much find snakes anywhere haha. If you surround yourself with good people, whether they're premed or not, then you should be more than fine. Your experience as a premed is not entirely dictated by your friend group, but the people you surround yourself with definitely play a role in your happiness and success. There are plenty of great, genuine premeds here and plenty of snake premeds, but the same could be said for anybody pursuing any career path.",1585489867,1,0
is it confirmed already?,1585468100,1,0
"Hey! This prolly isn’t what you wanna hear, but I applied to BFS, filled out the essays, got in, and then within two weeks of school figured it wasn’t for me and dropped it. 

Pros:
- Being a BFS scholar looks good, possible advantages getting into BFS seminars (no stats on that tho) 
- Apparently Paul Sniegowski is a rly good prof (he’s also the dean of the college) 


Cons: 
- No schedule flexibility (dictates what classes you can take because ISP takes up two lecture periods twice a week and a recitation) 
- It covered foundational approaches/sector reqs that my interests and major were going to fulfill anyway 
- Eats up half your classes freshman year
- Not actually seminar style — still big lectures 
- Curriculum wasn’t incredibly interesting for me personally (dm me if you want more on why)

I still was allowed to live in Hill (although they did threaten to kick me out lol), so I still got the social benefits ig. Signing up doesn’t hurt; there’s always the option to back out.",1585466747,1,0
"Yes but you also can't ignore the confounding variable of socioeconomic status, which I would hazard to guess is significantly higher among Greek ppl than others",1585464033,1,0
I would look into Public Policy and Social Change in Fisher.,1585461287,1,0
I just bought any gutmann’s house so maybe we can work something out but only if you can buy me a rolls Royce and a few cartier pieces,1585459069,1,0
Thank you!,1585458531,1,0
"I think this might be what you are looking for:

https://upenn-community.symplicity.com/index.php?s=student_group",1585458279,1,0
How can I find clubs that I want to join? Is there a list of all of the Upenn clubs somewhere?,1585458165,1,0
"Really depends who you interact with. Premed anywhere can be cutthroat. But outside the premed world, I feel that penn has more pockets of snake-iness than brown would (mainly in wharton) but idk about brown.",1585457889,1,0
Thanks a lot and only worry that I have is the cutthroat environment would I handle that or not.,1585457753,1,0
"So. Just looking at brows avg accepted gpa, it’s roughly the same as penn’s. The courses outside premed (which don’t matter as much for med school) tend to be graded higher (I think?) at brown, but from a sciences perspective it’s basically the same. 

But brown and penn are basically the same prestige and resources wise. You have a great choice and can’t really go wrong with whatever you choose :)",1585457521,1,0
Hi I have all the same question as this post and Thanks and got into Penn and Brown and will go same premed track. Same my parents are towards penn more resources and more opportunities. What u think about Brown since liberal and easy to get high GPA. And how hard is it to get into med school from penn.,1585457233,1,0
oh shit,1585456765,1,0
Get into harvard.,1585456373,1,0
"Grading curve is basically B-/B for most intro premed courses. Orgo is B-/C+ as the average. I feel this may be the case for most premed type courses though at higher ranked institutions. But yes it is deflated compared to the humanities. 


Difficult ish. And Yes. Avgs on exams run in the 60-70% range. 

Can’t really say one of the other. Some people form tight groups that are super collaborative. But those groups tend to be tough to get into. I did just fine going solo! And having TAd some of the kids who did exclusively group work, they used it more as a mechanism to get out of doing work, which really f’d them over on exams. 

Clubs: so...I never had difficulty getting into clubs but I had the skill set they were looking for coming in. Wrt premed clubs specifically, I joined a couple and dropped immediately bc they seemed kinda generic (for lack of a better term). I know it’s harsh but premed clubs (on any campus) tend to be generally “connect to doctors”, “raise money for X national organization”, “volunteering somewhere in the community”, or “go to random 3rd world country”. I did just fine volunteering on my own and serving philadelphia locally, so I had no need for the clubs. But I can understand that others do want a community as well, so the clubs are a good way to get into that. I wouldn’t say it’s difficult to get into premed clubs. 


So...I’ve been a bit negative on premed life at penn but here are some positives. 

1) you sure as hell are going to have a much easier time getting access to resources here. Big schools have a disadvantage of students clawing over resources and research opportunities. 

2) At penn you’re probably way more prepared for whatever med school you go to. 

Also FYI, premed courses are rough nearly everywhere that’s competitive to get into. You get a tiny bit of slack at penn but not much.",1585456344,1,0
"SEAS definitely isn't a walk in the park, but you can do well if you put in the time and use the resources that Penn gives you (Office Hours, meetings with profs, tutoring if needed, etc). Penn hasn't released official school-specific GPA averages in a while, but the most recent one was from 2001 and Engineering was the lowest of the four with an average GPA of 3.28. 

I also would stress that it's a different type of learning than humanities courses and it's difficult to compare them - straight problem sets vs. essays and readings, from experience both offer their own challenges if you take them seriously. 

I think a 3.8 is definitely attainable, but it depends on how much you're willing to put in and how well you do in time-pressured exam environments. I think the time pressure aspect is something that people have to adjust to coming in, but it's something you can also get better at as you take more classes. 

If you choose your courses carefully and don't take a ton of hard ones in a single semester, you should be fine. To the point of grade deflation, I don't think any curves at Penn Engineering are designed to give you a worse grade than your raw score, in my experience they usually only help you. That being said, Penn is not a place that has the type of [grade inflation at Harvard.](https://www.quora.com/What-was-it-like-to-attend-Harvard-when-it-had-grade-inflation)",1585456127,1,0
What about majoring in one and minoring in another?,1585455534,1,0
Also /u/johnathanjones1998 is there anything you can't do?,1585455501,1,0
Pinging /u/publu123 /u/iwantitall123 /u/johnathanjones1998,1585455485,1,0
"I don't know shit but here are two past threads on this topic:

https://www.reddit.com/r/UPenn/comments/99rtpd/double_major_math_and_cs/

https://www.reddit.com/r/UPenn/comments/dqduzx/can_i_do_an_uncoordinated_dualdegree_cs_and_math/",1585455319,1,0
"Potential incoming freshman here hoping to be on the pre-med track! 

* What is the grading curve like for intro premed course requirements? Like for general chemistry or intro bio. Is there actually deflation?
* How difficult are the exams for intro premed requirements? Is it super easy to lose points with dumb mistakes and land yourself with a 50%? 
* How collaborative vs cutthroat is the premed environment?
* How difficult is it to get into clubs here (both medicine related ones and clubs in general)?

For more context, I have been accepted to Penn, Vandy, and CMU, and right now Penn is my most expensive option (by a lot). CMU doesn't seem like the best option for pre-med, and I've seen A LOT of threads complaining about general chemistry and grade deflation at Vandy.

I haven't really seen this level of horror about pre-med at Penn, but from my research the weed-out courses here also seem pretty intense. I've also seen that Vandy intro premed courses grade on a B-/C+ curve (that seems pretty standard, so I don't really understand why there's so many deflation complaints), and I was wondering if UPenn was the same? 

UPenn seems pretty competitive, so is there a reason that there's not THAT much complaining, or am I just looking in the wrong places?

My parents like Penn a lot (for the prestige) and are supporting me to come. I'm just very concerned about the cost though because medical school tuition is no joke, and also the difficulty of getting into clubs here. So if pre-med at UPenn is just as hellish as say at Vandy, should I just try to take the cheaper option?",1585455235,1,0
Thanks. How easy is it to double major in Math (CAS) and Computer Science (SEAS)?,1585455008,1,0
"You are TOTALLY fine!

We (really I) am trying to figure out a line between helpfulness and clutter, and I'm often wrong. 

Super super congrats on getting in. I hope you find answers to your questions, and do not be afraid to directly message the people in the thread who say they are Pre-med (though feel free to just comment a question to them as well).

Best of luck!",1585454836,1,0
"yes, will do, sorryy",1585454695,1,0
"Depends on the degree. But generally harder/more work than a humanities major. 

I want to say like a 3.3? 

Uh hard to say. Relative to the rest of penn, yeah. Grad level courses though tend to have more As (at least in CIS). 

I’d say more time consuming than hard. 

Hard ish. You need to plan your courses well (pad hard classes with easy ones). you’ll get a sense for what you can handle in your first semester.",1585454234,1,0
"Also, you can google some of your questions, like the GPA one.",1585454136,1,0
"I can't tell if you Private Messaged them or not.

I pinged people the first time, but I just learned that if you ping too many people, they won't get a notifcation. So I tried again, Wait a day or two and then feel free to post your question here again if they still don't answer (but make your titled more descriptive).",1585454095,1,0
Pinging /u/landonb272,1585454013,1,0
Pinging /u/maximumcranberry /u/toxic-miasma,1585453996,1,0
Pinging /u/jonathanjulius /u/johnathanjones1998,1585453966,1,0
"Yes my friend please try asking those specific people in that thread. 

&gt; I would post this in the megathread for questions, but I've seen variations of this question asked a couple of times and haven't gotten the exact answers I'm trying to figure out.

Because you haven't asked them yet!!

Give it a day or two and then feel free to post back here. If that happens, I'd suggest you shorten your post and be specific and succinct about your questions and your concerns.",1585453745,1,0
I have but I got no reply,1585453643,1,0
Ask folks from the pinned comment here: https://www.reddit.com/r/UPenn/comments/fp1acz/official_admitted_student_questions_thread_class/,1585453552,1,0
Ok thank you!,1585452806,1,0
"I placed out of 241, this is all the right advice for OP to follow. Get/download the textbook, set yourself a schedule, and follow the syllabus until you can do the past exams. Ivan Li's videos will probably be one of the best resources you can get. The placement exam is generally just the make-up final for the people who took it the previous semester. If you can score well on the past finals, you should be able to place out and bypass the trouble of actually taking the course.",1585452260,1,0
Pinging u/naturegal2000 to help answer this question.,1585452249,1,0
"I worked with YouthHack Philadelphia on a venture before, great group of people",1585452221,1,0
Hey u/dreamcloud78 ...ask this person.,1585452196,1,0
"I was admitted (or maybe just nominated?) to the University Scholars Program and would like to know more about it. From the website and the letter, it seems like it's mostly about getting a faculty mentor to help you with research. Are there any current students involved in the University Scholars program that have more information on what it is?",1585452126,1,0
you are a champ,1585450527,1,0
Look at the previous years for better data. This one is pretty sparse.,1585450181,1,0
https://www.reddit.com/r/UPenn/comments/fp1acz/official_admitted_student_questions_thread_class/flr7msg/,1585449756,1,0
I think Kings Court (KCECH),1585448935,1,0
What’s the discord server?,1585448073,1,0
CLASS OF 2024 yayyyyyy. Is there any group chat set up for our class to talk?,1585448038,1,0
You can transfer at the end of freshman year. You just need to write a short essay about why you want to transfer + create an academic planning worksheet as part of the application. The process is pretty straightforward,1585447666,1,0
"(Not in the program but) iirc MLS often attracts people interested in the MD/PhD route, so there's a decent number of premeds.",1585446138,1,0
2024!!!!!,1585443702,1,0
"is anyone here involved in the nrotc unit at penn? i was just admitted RD and would love to hear about your experiences, advice, etc with nrotc! thank you :)",1585442986,1,0
"seems like they'll cancel purm this year, wonder if they told yall freshmen and sophomores anything about that yet",1585442891,1,0
Hint: the numbers are high,1585442441,1,0
which dorm is closest to pottruck?,1585442258,1,0
"there is a reason why there are more networking events for women, because at the end of the day, sure there are diversity programs, but there is still an overwhelming propensity to hire men in most industries. So women need to prove themselves in other ways. Yes. The women’s programs with superdays do hire just women. However, 1) a lot of these networking events don’t have superdays and don’t end up being that valuable 2) when it comes to regular hires there is definitely still a bias. So it ends up being women competing amongst themselves during these diversity programs and then when it comes to regular recruiting the unconscious bias for men kicks in. Obviously a generalization but definitely a trend. 
Companies are working towards more diversity. No one wants to be sexist. I think that men have to rely less on GPA to succeed. Personally, I don’t even think GPA is that important or determines intelligence. It’s just that in my experience and from the research I’ve been exposed to, women rely on a track record of past success while men can rely more on confidence, the inherently tighter networks of their frats, and the unconscious bias in the recruiting processes.",1585442034,1,0
"Yes, my friend is a native Arabic speaker as well. Workload is certainly still intensive!",1585441629,1,0
I see. Being able to find a subletter during the summer seems like a major factor to consider and makes me more wary to go with the off-campus route. Thanks for the information!,1585441299,1,0
"If you like nice/clean/private, NCH (LCH now) is unbeatable. Also Cam and Ann and Bridgette (in house faculty) are incredible people!!",1585440973,1,0
"The main thing with off campus housing that sets it apart is that you’ll have to find a subletter for the summer if you want to actually realize the cost savings.


I haven’t ever had to deal with it myself, but subletting for the summer definitely has a lot of supply without a ton of demand. Obviously, if you can’t find a subletter, you’re taking 3 months rent as a loss.


Off campus has enough variation in size/location/price that you’ll probably be able to find someplace for cheaper, as long as you can find a subletter.",1585440924,1,0
"The professors I've had thus far have been spectacular, although perhaps I've just been lucky!",1585440897,1,0
"AP Stats gives you a STAT101 Waiver (Waiver, not credit, so it doesn't count towards graduation, although pro-tip, take STAT101 w/ Shuva Gupta even if have taken AP Stat). 

4+ on language gets you the language requirement 

5 on BC Calc gets you a CREDIT(counts towards graudation) out of 104 (try to get out of 104, it's a massive amount of work and reasonably difficult). I don't recommend taking Math114 or linear algebra if you don't like math, Penn math is quite difficult, even for my friends who are quite good at it. 

5 on Micro/Macro gets you a WAIVER (not credit) for Econ 10. Econ 10 with Saka is pretty enjoyable, but feel free to waive it if you so desire. 

Other APs like History/Literature etc. don't get you anything unfortunately. Wharton is quite stingy about giving AP credits. I'd get out of Math 104 and the language requirement if possible and then just take the other classes.",1585440789,1,0
"Kinda surprising you say that given the abundance of women-focused networking events that can do exactly that for women.
Re: above, women have had higher grades in colleges for a long time and this isn’t exclusive to Penn. There’s been a lot written on it if you google.",1585440715,1,0
"That’s true. But I actually speak it at home; I consider a second language, rather than a native language, though. Especially since my parents taught me the Iraqi dialect as kid instead of Modern Standard Arabic, which is the form of Arabic that’s typically used during international travel and professional events.",1585439854,1,0
"My friend does Arabic. From what I hear its rather work intensive, but that's to be expected if you really want to master a foreign language!",1585438724,1,0
"The CAS/WH minors are a nice option! They're very cool minors, I'm doing American Legal History (unsure why LGST is in WH, but oh well).",1585438618,1,0
Internal M&amp;T is probably quite difficult. I know some pretty smart people w/ high GPAs who didn't get the transfer.,1585438561,1,0
"WH -&gt; CAS easiest. 

CAS-&gt; WH hardest 

SEAS -&gt; WH not too bad 

WH -&gt; SEAS kind of a weird path to take, not many ppl do this so I'm not quite sure. 

Also I think its totally possible to transfer as long as you take the prereqs for WH, and have a really high GPA, but most important is a valid reason for transferring, so nail the essay.",1585438475,1,0
"From my reasonably unqualified opinion, I think so! You can also try a stat minor from WH.",1585438393,1,0
"I would say only Wharton Clubs/On Campus recruiting is ""cutthroat"". It can be very easy to get As across the board if you take easier classes, but harder if you're taking more difficult ones. Basically, you can take a hard path through wharton, or an easier path through Wharton. I have no plans to join WH Clubs, and I'm not aiming for any of the big consulting or IB Companies, so it's very chill.",1585438308,1,0
Quality shitpost,1585437908,1,0
"Page 3 here: https://cdn.uconnectlabs.com/wp-content/uploads/sites/74/2020/03/2019_CAS_Career_Plan.pdf

Consulting is the top industry where College graduates go to work in after Penn. Financial Services is #2, and if you scroll down, you'll see that Investment Banking is a good chunk of that.",1585437759,1,0
"I was recently admitted into the college for PPE. I truly don’t know exactly what I want to do so I admire the interdisciplinary approach that my major offers. If I do end up wanting to go into investment banking/ consulting, would I still have a great chance or are those opportunities taken by Wharton students",1585437532,1,0
They can rely less on frat connections for jobs and less likely overall to be able to just network their way into a company,1585437209,1,0
"Is a Mathematical Economics + Logic, Information, and Computation double major suitable for someone wanting to work in quantitative finance?",1585435744,1,0
You're good! Congrats!,1585435674,1,0
Thank you. These questions are out of curiosity more than anything.,1585435651,1,0
"Hi! 5th year student at Penn. I joined the Science and Technology Wing (STWing) floor my freshman year and lived on the Perspectives in Humanities (PiH) floor my sophomore year. I returned to and am currently still with the STWing program.

So the activeness of a program really varies depending on the incoming freshman community, since the ""spirit"" of the floor comes from the community. in the past, most if not all of KCECH's programs have been pretty great, STWing and WiCS being the two most active. maybe if you were not a part of the program community you felt like the floor was inactive, thus the mixed reviews?

I think any program community is definitely worth participating in--at least for a first experience as a freshman. you can always live in a suite or an apartment (like the Quad or Lauder house), **but you can only try the freshman dorm experience once.** why not do it the right way and choose a program community?

Choosing to live on the floor doesn't mean you're obligated to participate; in fact, you can have a room on floor and decide to not join after all for whatever reason (maybe all your friends are outside the program community). program communities are as much academic environments as they are social groups, so its kind of like having an entire dorm floor for your club members. this means your floormates not only likely have the same class schedules but also the same interests, and for someone who came in to Penn really shy, the convenience of friends who were ""pre-filtered"" for me made it really easy for me to adjust to college life. :)

cant say much about the first two, but PiH is great! this upcoming year has great leadership (i know the pih managers and ragas personally) and has a lot planned for incoming freshmen. :) 

btw, its programming focuses more on the arts and humanities if that is what youre interested in. if youre more inclined towards bio,chem, or the like, STWing might be more inline with your interests.",1585434788,1,0
"If no one reaches you out here, considering contacting UMOJA (https://www.umojaupenn.org/contact) and/or Makuu (https://www.vpul.upenn.edu/makuu/; makuubbc@gmail.com). I'm sure they'll be able to connect you to a current student to chat.",1585434666,1,0
I would love to speak to someone who is a member of the black students association at penn.,1585433682,1,0
"Awww okay :(
But thank you so much for the articles and the insights you gave! They were so helpful! ^_^",1585433382,1,0
"Sadly no, as I wasn't an English major/Didn't have many friends who were. I took a handful of creative writing classes because they were great. But here is a look at where English majors objectively moved onto right out of college for the Class of 2018:

[https://cdn.uconnectlabs.com/wp-content/uploads/sites/74/2020/02/2018\_CAS\_Career\_Plans\_Survey\_Report.pdf](https://cdn.uconnectlabs.com/wp-content/uploads/sites/74/2020/02/2018_CAS_Career_Plans_Survey_Report.pdf)",1585433337,1,0
"1 very hard if that's your goal don't come to Penn

2 not that hard, need a 3.0 and some classes. Check other comments on this post, it's been discussed",1585432948,1,0
Okay thanks,1585432937,1,0
Thank you so much for the insight! I’m thinking of really delving into writing and English at Penn. Are you aware of the kind of internships/job prospects that Penn offers for writers/English majors?,1585432729,1,0
"Penn IS very strong with creative writing! The professors are absolutely fantastic and extremely supportive of undergraduate writers. Penn has this unique hub called the Kelly Writers House. It's a cute little house that has events EVERY DAY, inviting authors from all around the country to provide wisdom and showcase their work. You will undoubtably find amazing company in the English major at Penn, and valuable resources and connections as well.",1585432625,1,0
How hard is it to internally transfer to Wharton from CAS?,1585432522,1,0
There is no pre-med major at Penn,1585432490,1,0
I got to 500 sqft and lost it!,1585431631,1,0
"Yes, you can major in whatever you want in the College and minor in whatever you want! I’m minoring in Wharton.",1585430892,1,0
Ok Thank you as applied as Cognitive Science major and might want to change to BioChem and then minor in Wharton can I do this.,1585430845,1,0
"Yes! Sorry, that was a bit unclear in my first response. You have to have a major in the college in order to also have the CS major in the college. Aka you can’t graduate the college with just a CS major. You can be English and CS, math and CS, etc",1585430236,1,0
Is it possible to change major within CAS.,1585429917,1,0
"yeah as someone who took 240 last sem if you can do all the problems in that link you're good to pass the exam (highly recommend just taking the placement vs taking it at penn btw.) just do a quick google search to find an e-copy of the textbook for the problems. Also i recommend watching Ivan Li's videos for learning content, they're really thorough. Lastly definitely do the old 240 tests that are on the math dept's website.",1585429667,1,0
"Major congrats! Just wanted to point out also that one of the three concentrations in cogsci is computation, where you can pretty much take any of the computer science courses and count them towards your major. Probably the most popular concentration and something you should definitely look into.",1585428886,1,0
I assume you meant test out? I would recommend just doing the problems on their online syllabus ([https://www.math.upenn.edu/sites/www.math.upenn.edu/files/math240syllabus\_0.pdf](https://www.math.upenn.edu/sites/www.math.upenn.edu/files/math240syllabus_0.pdf)) and watching Khan academy vids.,1585428344,1,0
Hi I just got admitted to UPenn and Brown and my major premed and going to go to med school after. Really considering Penn as so much opportunity but how is it to get good grades to keep up with the GPA for applying to med schools with Penn.,1585427662,1,0
My people 🥰😜 Can you dm me their info so we can go to NYC clubs together?,1585426380,1,0
The high GPAs mean that Penn has grade inflation,1585425838,1,0
