title,selftext,created_utc,score,total_awards_received
Therapy recommendations near campus?,So I have been given a list of practices by behavioral services and I was wondering if anyone has any recommendations? Also does anyone have experience with going to the Perelman outpatient psychiatry @3535 market? I really don’t want to have a bad experience or I might never try therapy again and I need it. Thanks!,1633418348,1,0
wharton class code for complimentary bloomberg market concepts access,Does anyone know the Wharton class code for complimentary access to Bloomberg Market Concepts? Thanks!,1633403533,1,0
SDS BS,"Anyone else work with Student Disability Services at Penn? Over this whole covid fiasco, I realized I probably have ADHD, so I went to a certified Neurologist who did a couple tests and diagnosed me with ADHD. I now take medication, which helps, but went to SDS to inquire about getting extended time on exams. (Scheduled back in August, and earliest appointment was late September. Whole ass month for a simple meeting) Even though I had all the documentation from my doctor, SDS lady basically told me unless I take a full NeuroPsychological Test, they can’t verify that I have ADHD (this test costs upwards of 2,000$-3,000$, isn’t accepted by insurance, and takes months to get results back). 

Wondering if anyone else has dealt with SDS over this issue. This isn’t me faking to get extra time, I genuinely need it. 

This whole mess made me realize how right people are when they talk about how between CAPS and SDS, Penn does a horrible job of looking after and caring for the students.",1633400831,1,0
Expected Actual Internet Speed on AirPennNet?,"I am wondering how fast is the internet can we expect actually? I remember my first day here back in NSO in the college house speedtesting having 1000Mbps and was gasped. I vividly remember downloading GTA V in only a few minutes back then. Then the big network outage happened and then everything went so slow and then here we are now on 100Mbps. However, ocassionally it drops down to 30-ish Mbps like at the moment I post this. Since I have just been here this semester, how has the internet been before? What speed should we expect? Are we currently still having the aftermath of the outage?  


Note: All speedtest was done on fast.com",1633399473,1,0
Financial Aid for international students,"Hello, I know that Uppen offers financial aid for undergraduate international students, however, when I was going to fill the CSS Profile, it said that the Wharton School doesn't accept this type of financial aid. So, does Wharton School offer financial aid (need-based) for undergraduate international students? If yes, do I need to send the CSS Profile using the Uppen regular code? Thanks for answering",1633390844,1,0
Anyone want to be friends?," Current junior. Despite my best efforts, have mightily struggled to meet anyone. Also a bit harder being a transfer here",1633388612,1,0
Anyone want to be friends?," Current junior. Despite my best efforts, have mightily struggled to meet anyone. Also a bit harder being a transfer here",1633388509,1,0
Question for grad students: is taking 4 courses too much?,I’m taking 3 courses this semester and it’s heavy but still manageable. I am planning to take 4 courses next term but my advisor said it will be “too ambitious” but my friends from other programs are doing 4-5 and seems pretty much able to manage. Will it be really too much?,1633381004,1,0
Anyone want to be friends?,[removed],1633377957,1,0
phys150 curve?,"kinda dying in phys150 ahaha the midterm’s tomorrow and i heard there was a curve, so can someone please reassure me if that rumor’s true or not 😭",1633377202,1,0
[Academic] Temple University Technology Usage Survey,[removed],1633374194,1,0
is a neuroscience minor worth it?,i’m considering adding a second minor in neuroscience. do you think it’s worth it? like will it look exponentially better for grad school apps? I’m considering pursuing interdisciplinary research in neuroscience and the humanities and have taken a number of neuro classes but still have 3 more classes for the minor (i’m a junior). basically my question is do grad schools really care about having an official minor or would i be okay being a few classes short of the minor?,1633373312,1,0
Is it bad that I don't have a full time offer yet?,I'm a senior and it feels like all of my peers already have a job lined up after graduation. It's getting pretty stressful lol. I'm applying a lot through handshake and linkedin but haven't got any traction yet.,1633363434,1,0
Where the banh mi truck go,"You know, that one banh mi truck next to the quad run by 2 elderly asian ladies. There they at? I want a banh mi really badly",1633361062,1,0
places to be completely alone and can’t be heard by anyone ?,share a bedroom and looking for a place to do caps therapy where no one can hear me. thanks,1633359907,1,0
Is there a scale in pottruck,[removed],1633358340,1,0
Good for them :),,1633329059,1,0
Consulting clubs,,1633321791,1,0
Reasons to Apply to UPenn,"Hi current students and past students, 
UPenn is a school I have a lot of admiration for. 
I am wondering, as students who are there, have been there or are looking to go there, what is UPenn like and what does UPenn have that other schools don't offer. 
I have seen a lot on the professional environment but the very ""work hard party harder"" kind of life is also very existent. 
Are there features which make this college attractive to an outsider?",1633316043,1,0
PSYC-111 (Perception) with Prof. Burge--- HELP!,"Does anyone have any tips for the first midterm? It's on Wednesday, and I have no flipping idea about what's going on in this class. I feel like concepts that should be easy are just flying over my head, and I literally don't understand anything other than the experiment with the chick from one of the first lectures. I'm considering dropping this course, but I feel immense shame even thinking about it.  I'm so overwhelmed. My plan is to drop it if I don't do so hot on this first midterm, because each midterm is worth 25% of my grade (2 midterms- 50%), the final is worth 40% (just...why?), and HW is worth 10% (no problem there). 

I don't want to make a habit out of it, but... any cramming tips for this midterm? I'm feeling trapped ATM.

Thanks for taking the time to read this and/or leaving any tips. Both are appreciated.",1633310980,1,0
Any addy plugs?,Please pm me,1633301618,1,0
Any packers fans on campus down to watch games together?,,1633295734,1,0
"Ppe major, 4Cu?",I feel like taking 4 cu’s this semester so I plan to drop my 5th class. I took 4 freshman fall and 5 freshman spring. Any advice on if taking 4 cu is fine?,1633294598,1,0
Freshman Stress,"

Hi, Penn Reddit.

I’ve been thinking a lot about making this post for some time now, and held myself back multiple times. I was afraid, and still am, of coming to terms with what I’m experiencing. But when you feel what I feel every single day here, it’s impossible to not want to reach out and see how others feel/respond. I’m sorry if this may sound rant-y sometimes, but it’s just the truth of my experiences. Thanks for reading.

I’m a freshman, and I moved in on the regular dates in late August. I was so excited to start a new chapter in my life and live in a new place, but my time here soon made a turn for the worse. 

In spite of the fact I like my classes, my dorm, and Penn as a whole, I’m cripplingly lonely. 

I’ve always been introverted and usually enjoyed spending some time alone, in spite of the fact I had a great friend group in high school I was really close with. (We did a bunch of things and had experiences that really made us close.) My BFF from high school pretty much vanished from contact, so my lifeline for support during the transition was gone. I saw everyone making friends and going to events, and felt forced to do the same for fear of being alone. All my social connections from my life before this were gone, after all. I tried to reach out to people by going to all the events, but every day, especially in NSO, I felt worse and worse, going to everything alone and having no one to talk or connect with. I was already going through so much adjustment from leaving my home, country, and parents, that my social awkwardness and anxiety made it really hard to talk with people normally.

After that, it seemed like everyone had groups to eat or hang out with all the time, and that was something I desperately wanted, and still want. Every fun Instagram story, every time I see a group walking off down Locust to do something fun, every story people tell me about how much fun they had doing X or Y with their group, it feels like a dagger to the heart. I see people texting friends on their computers in class about what they’ll do after with them and feel just as bad. Every time I leave my room, it’s a reminder of how lonely I am, and how I failed to reach out to people. Even when I find someone I like, it feels like they always have their own thing and their own friend groups, so I feel even worse. 

One thing I’m honestly thankful for is that I have one friend that I feel close to and comfortable with, but I’m worried he doesn’t fully understand what I’m feeling. 

As time goes by, I get more and more afraid that I’ll have no one to connect with, and no one that will understand my feelings. I’ve talked to CAPS a few times too, and they did help a little, at least. 

If you’re a freshman and you’re feeling similar to the way I am, please feel free to DM me. I know I can’t be alone with this horrible feeling I have to bear every single day of my life. I’m not looking for people that pity me; I’m looking for people willing to listen and understand. It might turn into a friendship, even! 

Penn has been a rollercoaster, but my huge qualm and constant fear is a social one. I love it here, but emotionally, I’ve never been in this much recurring pain. I want things to get better, and I know that they can. 

If you have advice, stories, or if you want to talk, feel free to comment or DM. Again, if you’re a freshman (or anyone, I guess) and you want to meet/connect or share your experience, also feel free to talk to me.

Thank you guys for reading what I have to say, and here’s hoping my future in Penn is brighter.",1633292828,1,0
Feeling Lonely,[removed],1633279527,1,0
As someone who is considering going to UPenn for my doctorate:,"Do you guys ever get annoyed with the confusion of UPenn being a state school instead of an ivy? 

I’m from the west coast and from the tiny amount of people I’ve talked to, it seems like a normal occurrence to confuse UPenn with Penn state.",1633278003,1,0
Feeling Lonely and Anxious as a Freshman,[removed],1633273532,1,0
Professional headshot,Where would I be able to get one?,1633229954,1,0
please don't play the fucking piano in the lounges during finals week,"ik u need to practice but some people really need to fucking study. Most of the time it is terrible, loud music that makes my ears bleed.",1633226363,1,0
Not mine but this researcher is looking for participants. $12 for 30 mins of rating voices. She can meet you basically anywhere/anytime bc it's run on her laptop.,,1633219406,1,0
Sorority Rushing,"I don’t really know anything about Greek life but I’m interested. How does sorority rushing work at Penn? I know frats are dirty rushing right now, and some sororities have had events and stuff, but how does it all work?",1633211872,1,0
CIS 350,"Anyone know if it will be offered this spring? If so, how hard do you think it will be to get a permit as a CAS student double majoring in cis?",1633206547,1,0
Render of the new Amy Gutmann Hall,"&amp;#x200B;

https://preview.redd.it/vn0oqg2k03r71.png?width=630&amp;format=png&amp;auto=webp&amp;s=ac57893bb7a792c3fb059d756101770f05284a7f",1633200016,1,0
Outdoor studying space with power outlet?,Anyone knows? any kind of chair + table + power outlet combo that's outdoor?,1633176438,1,0
Stop purposely throwing toast at the cheerleaders and band members.,"You all are assholes, all of you who did this tonight. Or any game in the past for that matter. It's not funny to try to hit cheerleaders/band people with bread, it just makes you a giant sociopathic douchebag. You are not children. You are adults. Have some fucking self control. These people are here to entertain the crowd with their flips or songs, they're not some lifeless targets that you can chuck bread at. They shouldn't have to dodge pieces of toast while they're performing, or ever. Just stop.

On top of that, stop trying to throw bread onto the field. It's troublesome and potentially dangerous to the players.

Throw toast when you're supposed to, at the end of the third quarter.",1633152260,1,0
Anyone taking this CAS second major path?,"Anyone here in CAS majoring in a social science and pursuing a second major in Engineering (Computer Science)? If so, what’s the total amount of cu’s your plan includes?",1633144875,1,0
Anyone know how to reset penn email password?,"It keeps telling me to contact domain admin, not sure what to do",1633144722,1,0
anyone wanna go see Joji in concert in Nov?,really wanna go but none of my friends know joji lol. send me a pm if you're interested in tagging along.,1633123704,1,0
Chem 101 curve,How often is the class average curved to a B? Or do grades usually end up being your raw score,1633122099,1,0
"Making sure y'all see this, don't want anyone to get shafted when you go for chicken over rice!",,1633120132,1,0
Where can a hot young grad student find some pickup volleyball?,Where tho,1633120069,1,0
Engineering merch,,1633113866,1,0
Moving in to Stouffer?,"How did y’all move in to Stouffer? From what I can tell there’s no elevator or anything, did you just carry the moving cart up the stairs??",1633109897,1,0
"f your tests, it's only 12pm","Didn't the people who were responsible for this atrocity that they call ""awareness test"" go to college? Like hell, if you ever gone there, for sure you know that 12pm is prime-time sleeping time for most kids. Sadists.",1633104302,1,0
Anyone hear an announcement or something near the quad?,,1633104196,1,0
Should I take the math 114 requiz?,"I have an average of 14/16 over the past 2 quizzes, since the first quiz doesn't count. I also have a cis 120 midterm today (24 hours).

What grade does 14/16 correspond to? Strategically speaking, should I take the requiz today or focus on my cis midterm? 

I am a bit worried since I heard plenty of people got 16/16 on the past couple of tests.",1633101762,1,0
Extra '17 P Sweatshirt?,"Lost my class P sweatshirt, if anyone would be willing  to part with their class of '17 one please dm me",1633090290,1,0
how many AS levels are needed for upenn,"Good Evening , I just wanted to know if my application would be less preffered if i took 3 AS level subjects instead of 4 AS levels , and I am planning to give 3 A levels only , thanks.",1633080097,1,0
Grades at UPenn - has anyone been struggling to acclimate? I’m a transfer student and I’ve been struggling to stay on top the amount of work while also doing well. Does anyone have any tips?,,1633058999,1,0
Is Fall Term Break only for undergrad?,[removed],1633055115,1,0
Could I take chem.53 and 54 the same time?,,1633035381,1,0
chance me,[removed],1633032724,1,0
Staff at Penn??,"What is with the staff here (not the professors/faculty)? Went to Gourmet Grocer the other day, found a bunch of items in the freezer that expired in JULY, told the staff and they just started yelling at each other because apparently someone restocked it from the trash. 

Also, tried calling residential services for help for my missing package in the package room and they groaned and responded with ""i dont know"" and told me to ask my RA for help finding it?  

Don't get me wrong, there are some very sweet staff members here that make my day! I just feel like there are a decent amount that are completely unprofessional and rude. Sorry for the rant.",1633025722,1,0
Looking for someone who ran into me outside Pret and dropped their iced coffee?,[removed],1633020218,1,0
Wharton Courses,[removed],1633008562,1,0
Streaming English soccer in US and Penn,Does anyone knows how to watch english soccer in US and Penn in case students get any discount ? I know Paramount+ got Champion League but cannot find a service with all the matches of Man Utd in EPL,1632989207,1,0
does getting a 5 on bc calc count as 1 cu,it says so on penn intouch but just making sure,1632981761,1,0
Uncoordinated Dual Degree (CAS + Wharton),[removed],1632970330,1,0
Uncoordinated Dual Degree (CAS + Wharton),[removed],1632970278,1,0
SELLING 6 ROLLING LOUD NYC 3-DAY TICKETS,Hello. My friends and I are looking to sell our 6 Rolling Loud NYC tickets. The festival is from Oct 28th - 30th. Tickets were each $510 but we are willing to negotiate the price. DM me for questions/interest.,1632965658,1,0
I don't get what Penn loses for giving us a longer thanksgiving and winter break?,We get only two days off for thanksgiving and less than 3 weeks off for winter break.,1632957513,1,0
Resurrecting math petition?!,"So I've just read [this DP article](https://www.thedp.com/article/2020/10/math-104-curriculum-changes-petition-penn) about this [petition](https://www.change.org/p/university-of-pennsylvania-administration-petition-to-revert-math-104e-to-math-104?source_location=topic_page) that was started last year in response to the curriculum the math department created. Since the grievances aired last year are still valid, the sentiments now felt by this year's students, who's in for resurrecting the petition?!",1632953360,1,0
Are Student tickets sold out for the football game Friday,damn i didn't know penn got this hyped for football,1632947602,1,0
Student Employment Opportunities @ Penn Libraries,[removed],1632943176,1,0
Penn Alumnus Donald Trump still lists his occupation as “President of the United States” on QuakerNet,,1632941300,1,0
Penn Alumnus Donald Trump (W’68) still lists himself as “President of the United States” on QuakerNet,,1632941099,1,0
Getting help?,"Holaaaa, I am wondering where I could get help in terms of thinking about career options, what I want to do in the future and how to get there, I know career services exist, what type of appointment would I book with them? Or are there any other resources that would be good for this type of thing? Thankssss, I'm a sophomore for reference",1632939950,1,0
Help,[removed],1632938536,1,0
Is there a commitment to the Venture Lab?,"Read about the Venture Lab in an email, seems pretty cool to have access and be able to 3D print miscellaneous things. Wanted to check if there were any costs, commitments, that come along side it?",1632938254,1,0
campus apartments - worth the price?,does anyone have experience renting from campus apartments? i saw some nice and cheaper units at the royal palm court apartments (s 45th) but i was wondering if that building will be super loud/not well maintained. im not a current student but i graduated this spring - is it going to probably be all current undergrads? i was hoping for something that didn’t feel like I was still living in an dorm.,1632935917,1,0
Mice in housing? (Off-campus housing with UCA),"The house I'm living in with 4 other roommates has an increasingly worse mice infestation in the kitchen. We are pretty clean, and it seems the mice were in the walls prior to us moving in. We're with UCA, who has been of no help and whose 'exterminating' consists of putting down a few traps. Does anyone have any advice on what to do or the general prognosis for dealing with a company such as UCA? Can/should we withhold rent to get their attention?",1632933133,1,0
Fall fair headshots,"for anyone who got headshots taking at the recent career services fall fair - do you know a way to find our photos without looking through each photo on the link they provided? as of now, i just see a bunch of jpegs in a folder and there's no way of searching without opening each one individually",1632929168,1,0
How can I access the 1st floor bathrooms in Rodin? There’s a code on the door.,,1632929082,1,0
Unable to book GSRs,"Is anyone else having an issue where if they try to book a study room on penn mobile, it says “you seem to have exceeded the booking limit for this venue”? If anyone knows how to get past that please lmk!",1632928432,1,0
math 240 syllabus,"Can someone please link me or dm me the math 240 syllabus pleaseeee.

&amp;#x200B;

Thanks :)",1632926491,1,0
Strike from class. Call your deans. Do not let this stand.,,1632922416,1,0
TRUMP WENT HERE LFG!!!,,1632901741,1,0
A Peruvian kid got beaten into a state of semi-unconsciouness at a UPenn frat by a violently racist student while his frat bros looked on. Here is an open letter to the assailant...,,1632874111,1,0
Red Pass,"I just got a red pass and have a midterm today, what should I do? Didn’t realize how testing requirements work, my own fault totally.",1634640387,1,0
Comm 125 vs. Comm 130,[removed],1634618508,1,0
Are there any clubs related to Fifa on campus? Been getting into the game some this fall.,,1634617958,1,0
Therapist recs?,"going thru a lot rn and i already went to CAPS and maxed out my limit

thanks in advance &lt;3",1634601310,1,0
Has anyone taken PHIL 005?,"I’m a freshman, and I kinda wanted to take it second semester. However, the ratings say it’s pretty hard, so I was wondering if there were opinions on it, and if it was impossible to get an A.",1634600287,1,0
Easy Spring Courses,[removed],1634599050,1,0
Is it too late to get off campus housing close to campus? Any recommendations?,,1634598747,1,0
STAT 430 - Newish Professors,"Howdy folks,

Was checking out spring classes and saw that there were two newer professors teaching stat 430 this semester. Has anyone had/heard good or bad things about either Yuting Wei or Winston Lin?

Thank you!",1634597999,1,0
"Are yearbooks kept online, and can they be found online?",,1634593151,1,0
anyone know how to switch rooms with someone,like where do i go/click?,1634591400,1,0
CIS 350 without 121,"Saw that they are offering cis 350 in the spring. The prereq is listed as cis 121, but I've heard people say they took it after 120 and were fine. I'm in 120 now and hope to take it next sem. Anybody have any thoughts on this?",1634589516,1,0
Help out !!,"I am applying to Upenn this year., specifically Wharton college and I was wondering if any of y’all have an advice for me, as an international.",1634581785,1,0
Transfer Masters Student,[removed],1634581762,1,0
"current wharton students, is wharton actually as cutthroat and preprofessional as ppl say it is?",[removed],1634580358,1,0
Is ECON 102 very difficult if you’ve waived ECON 002?,"I got a 5 on AP Macroeconomics in high school so I have a waiver for ECON 002. I’ve heard nothing good about Bossi (prof for ECON 002), so I really want to use this waiver. However, I looked at the old final papers for ECON 002 and it all seemed familiar. Has anyone skipped ECON 002 and had trouble in ECON 102 as a result? Thanks.",1634579947,1,0
Looking for a CIS545 Tutor,"I have already asked the tutoring center and they said they don't have any CIS545 tutors, so I am looking for a CIS545 tutor. Please DM me if you or anyone you know is interested. I will pay. 

Thank you!",1634575845,1,0
Event spaces on campus,What are some good event spaces on campus or near campus? To host 100-150 people (for a conference/student club event),1634575115,1,0
Can emailing a professor for the syllabus of a class you’re interested in taking be considered rude?,,1634573171,1,0
penn engineering major + humanities minor?,"has anyone here in engineering done a humanities minor to replace tech electives or is that not possible?

for reference i’m planning on studying for a bas in cis",1634568058,1,0
participation,Some of my classes have participation as a grade but how do prof grade this if they don’t even know our names or take attendance???!!!!!!,1634562720,1,0
Wharton Learning Lab,"I'm a high school senior looking to ED to Wharton and came across the Alfred West Jr. Learning Lab while researching the school. It seems really interesting to me, but I can't find really find too much about it outside of its website. If there's anyone who has some experience with it, I'd appreciate it if you could leave a comment so I can reach out to you.",1634562348,1,0
HELP ME OUT HERE,I am planning on applying to UPenn this year. What are some cons of you Upenn. I mean is it small or too noisy like that. Also what are the best things about Upenn? I am trying to get a picture of the uni and due to pandemic I am counting on you guys to know about the uni,1634561819,1,0
Minor in SEAS for Wharton student [HS senior question],Can Wharton student minor in material since and engineering from SEAS? Are students who would like to do it well supported? Is the workload from Wharton and minor SEAS bearable? Thank you very much. I have already looked up the general information on the website but would like to know some insights here.,1634559172,1,0
In Memoriam: /u/Housesize3,"He's not dead or anything, but the idiot got himself locked out and he created the account with a temp email so he can't reset the password or anything. RIP",1634553710,1,0
SOCI 135 law and society,Is there anyone who is either in the class right now or who has taken it in the pass that would be willing to talk to me? Please message me! Thanks,1634522035,1,0
Phys 101 with Devlin,How is Phys101 with Devlin? Difficulty?,1634518673,1,0
