body,created_utc,score,total_awards_received
I'd be surprised if anyone went through a class they didn't hate. Just gotta power through it.,1582265951,1,0
take some gen science and fulfill those requirements if you're unsure but switching isn't too hard and having a bunch of random open requirements makes it relatively easy to switch if you want to,1582253626,1,0
How can I get one??,1582250999,1,0
"I think if you cold email a bunch of professors, it's definitely likely that you'll get a position, but I'm not sure how likely it is you'll get a paid position.",1582246779,1,0
what is the design you're talking about?,1582246319,1,0
How do I buy these??,1582245291,2,0
^^^ this is the real artist if ppl want to buy pain stickers!,1582240494,2,0
Just for rides around campus though?,1582239418,1,0
damn people really stealing my designs YIKES,1582238554,2,0
These are inauthentic/stolen designs - my roommate was the original creator!! OP message me if you want to support the real artist behind the stickers,1582238107,3,0
frat parties?,1582236208,1,0
I got mine from here [https://www.redbubble.com/people/scstickerstore/works/45141062-ow?asc=u&amp;p=sticker](https://www.redbubble.com/people/scstickerstore/works/45141062-ow?asc=u&amp;p=sticker),1582233655,1,0
You definitely need to work this out with your instructor in advance though!,1582229569,2,0
Ah thanks. I've heard of being retroactively added to courses which was what gave me the idea,1582229320,1,0
The only time I've heard this being done is if a student was literally was just doing all the work and was (for all intents and purposes) part of the class but due to some course cap they weren't able to be formally registered.,1582229184,1,0
"Saw a mouse once in 3 years at Harnwell (floors 4, 14, 22). Otherwise, nothing, and we kept a very clean apartment.",1582227053,1,0
"Yeah put in a work order, housing will send an exterminator. I never paid for traps, they took care of it.",1582223870,1,0
[deleted],1582222595,1,0
well i need roommates since im in a post bacc :( where are grad ppl at,1582222418,1,0
"Based on the price I'm guessing the lease is for the whole place, not just one bedroom. I lived around there and it's a great area",1582219373,1,0
"finance and fiancé only are only one letter apart; if she’s a wharton snake, join her nest",1582218947,1,0
who are the other roommates,1582216934,1,0
"Summer college programs are generally $$$ scams that do not directly increase your chance of admission. If you want to attend solely because you think your chances of getting into Wharton will increase...don't and save the money for something else (unless you family has ""fuck you"" money then do whatever).",1582213409,1,0
/u/EmotionalRedox's dating advice,1582213105,1,0
Not too sure... lots of these programs are cash-grabs. Girl in my grade went to LBW this past summer and got rejected ED. I did an engineering program at Penn that gave credit and was graded and was admitted in December. Not to say that either may guarantee  the results I encountered but,1582211259,1,0
LBW is an exception lol,1582209988,1,0
"If you can find a program that offers college credit and has grades then it may be more valuable. LBW doesn’t offer credit and assignments aren’t really graded. It won’t substantially help your chances of admission really at all. If you can get an internship that’s related to an interest or can invest lots of time into a personal project, then I’d say that you’d be better off",1582209255,1,0
"It was for my third choice, which is why I think CURF didn’t pick me",1582203396,1,0
"*Highly* depends on which floor you're on. I'm on a low floor and getting up and down is a breeze. My friends upstairs complain all the time about how long it takes just to get to the lobby, and I've experienced it myself when ive needed to go upstairs for different reasons.


But consider that with a low floor you miss                      t h e  v i e w.  But you get it with a high floor. I haven't done both so I can't tell you which is more worth it tbh. But man, sometimes at the window like, ""I wish I had an actual view"", but then I'm late for class and it takes me 30 seconds to get downstairs and I forget all about it (at least until I come back after classes lol)",1582201306,1,0
Electric,1582200703,1,0
"There's a not-so-secret tunnel system connecting Leidy, Levin, and Lynch. Basically you go down through the old hallways of Leidy and suddenly everything gets sleek and minimalist and you know you're in Levin haha. After that is just waking through a long industrial-looking tunnel with pipes and stuff and a bunch of unused/broken science equipment. The you exit at Lynch and you're there.

Only way I know about it is because that's how we went from our biol102 lab to the greenhouse for the assignment without exposing ourselves to the cold that day. There's probably way more secret tunnels and stuff out there, this one's not too secret. Ask any staff member in Leidy and they'll probably know. Beyond that, in not sure how you could find other secrets, but it's cool you're attempting it!

Note: goes without saying, don't get yourself locked in/out by assuming your PennCard will work at any scanner; many of the scanners in the tunnels work for staff only.Props if you actually succeed in doing this",1582200694,1,0
"If you are interested in coming to Penn for college, yes. I know a significant amount of people who go here now who did this program during high school. Obviously, it’s not a promise of admission, but if you are able to go, I think it will be useful to you no matter where you attend college!",1582200327,1,0
the English department,1582181495,1,0
"Put all your open food and snacks in Tupperware bins! For your personal snacks, I recommend big rubber tubs that you can put under your bed.",1582180573,1,0
"I'm a big fan of skipping CIS110, but that's mostly for people who have experience programming or taking coding classes before. But that's usually because you've already learned the fundamentals in another language.

If you're starting from scratch I'd just take CIS110.",1582180219,1,0
This is the best description of Wharton I've seen in a while,1582180126,1,0
Thanks!,1582175023,1,0
Lived on 17 and never had a problem. Be weary of food,1582174299,1,0
Pretty sure it's 11:59pm on 2/24,1582174166,1,0
[removed],1582173184,1,0
"It's $60 because there's a waitlist of students that the system defaults to—in other words, the buyer demonstrated he was an unsophisticated market participant.^/s",1582160154,1,0
It was me I did,1582157117,1,0
" /r/ApplyingToCollege 

good luck!",1582157079,1,0
"Maybe they're closed to new clubs? Similar to how PAC has been closed to new performing arts clubs for a while, they're just at capacity.",1582154914,1,0
"It’s honestly pretty random. I have a friend on the 22nd floor, while I’m on 5th. If you’re lucky, the lift stops once or twice. If you’re unlucky, it can stop every other floor, which I have seen once before. 
Leaving early is just a precaution in case you get stuck in an unlucky situation.",1582150935,1,0
fr tho can I get that room off you whoever you are,1582142479,1,0
"yknow if one class does actually make this big a difference, im surprised the going price is only ~$60

like

you guys study _finance_ and your most sophisticated course-buying procedure is a giant groupchat? no bidding system? no contingency clauses in case you guys get caught? the incentives are this lopsided and no one has petitioned to increase their credit limit just to flip courses?",1582136032,1,0
Wow I didn’t know that existed at all. That’s amazing !,1582134833,1,0
"Not sure if this is what you're thinking of:

There's an underground road that goes from the football field to Huntsman -- you can't access it as a student as its mainly used by facilities and security. 

Only reason I know about it was because I locked myself out of the computer lab in the basement of Addams Hall at 3am (all my stuff was locked inside). I called campus security and they took me through this [building](https://goo.gl/maps/4fvoUWAmNwC193BM7) behind ARCH. It looks like a small brick shed with nothing but a large metal door -- behind the metal door is an elevator that goes down to said tunnel. (For some reason he couldn't open the front door of Addams.)

Long story short, it's basically a large underground road that runs beneath the campus (guard told me). I remember seeing a row of big garbage trucks parked down there as well as a bunch of cars used by campus security. 

Anyway, he took me to the underground entrance to Addams using this tunnel and he swiped me into the lab that was locked.

If you're curious, ask a security guard about it.",1582133729,1,0
"you haven't met me then!  


i would probably not suggest skipping it to OP though if there is no CS background at all",1582090308,1,0
I think this is correct,1582090177,1,0
"As a former 110 TA I endorse this. It is actually a pretty thorough class which does a good job of teaching you the fundamentals. By skipping 110 you still have to take an extra CIS elective later on, and you will have to take plenty of electives anyways. Unless you absolutely are super confident and skilled to the point 110 would be boring, you should take it. I have never met someone who regretted taking 110 but I have met a lot who regretted jumping into 120 unprepared and proceeded to crash and burn.",1582087566,1,0
Thank you!,1582087536,1,0
"No problem! 

And yeah that’s what I meant by sections.

The bathroom is also empty most of time during the day besides morning and around 11-12, but it’s really easy to go to bathrooms in other sections. 

It’s generally pretty clean, and also it’s gender neutral.

You can pm me if you have more questions",1582086035,1,0
"Thank! By each section do you mean like A, B, C etc? 

Also how does the bathroom situation look like?",1582085778,1,0
"There is a kitchen in each section (and there are like 6 kitchens), and I think two kitchens have ovens. 
It’s pretty convenient and it’s pretty much always empty.",1582085695,1,0
"My recommendation is just to take 110. People who skip with no experience often struggle or require a lot of effort to succeed, whereas the class is relatively painless (although tedious) if you have a background",1582085258,1,0
Google \*name of minor\* university of pennsylvania declaration form  and then it should direct you to the department's website with steps or people to reach out to for you to declare your minor!,1582085115,1,0
Thank you so much!,1582078816,1,0
pee pee poo poo,1582078624,1,0
"nah, here's the thing: with penn dining you wouldn't want to eat regularly at their dining halls anyways.

tbh you'll end up spending extra money regardless of plans so might as well get the most dining dollars so you can get vary those up between Houston hall, gourmet grocer, and stommons",1582076083,1,0
"Use something like veracrypt or encrypted zip to encrypt the files before hand. 

Assume yes they have access. 

If you are sharing the link and file, you'll need to share the key too.",1582075558,1,0
Van Pelt bathrooms on the 3rd and 4th floor,1582074749,1,0
SEAS or grease,1582074725,1,0
It's where you get shit-faced and have a shit ton of fun for a day. Many also lose their virginity that day,1582074695,1,0
"Nothing is wrong with PPE, it just doesn't apply to investment banking",1582074546,1,0
"I agree. All I used to study were the past exams he gave us, and you could tell based on the past exams that this one would be very similar. I hope the future exams and final will be like this.",1582071850,1,0
Tru. But 2-3 questions were tricky if you didn't read carefully.,1582070596,1,0
Was that interview for your top preference?,1582069836,1,0
"CURF actually decides based on how you ranked your preferences. I applied for PURM, got selected for an interview, but then CURF didn’t select me. I ended up doing it as an independent study outside of PURM, but sometimes professors have other funds they can use to pay RAs.",1582069730,1,0
"I believe CURF decides which professors/projects get grants, based on how many people apply to them, but I’m not sure who decides who gets accepted to each project. Some project listings asked for you to include certain things in your application, so probably the professors decide?",1582066309,1,0
It was the second exam for us.,1582065044,1,0
depends on what minor and for what school,1582064727,1,0
I love deemo so much!!,1582064152,1,0
Wrong.  Check yo self before you wreck yo self.,1582062791,0,0
"I took Econ 2 last semester, the first exam wasn't curved at all. The second was by 2 points, and the final by 4 points. It depends tho, he only curves questions that a lot of people miss.",1582056537,1,0
"It is possible to take the CIS approved courses from Wharton. I think you can take upto 3 courses outside of CIS and make it count towards your degree. Afaik, you are free to take as many courses, but any more than 3 won't count towards your MSE in CIS.

I don't think there's a minor of sorts for MSE, but it is possible to do a dual degree or something like that. The catch for that is, you have to be admitted to both the schools.

Hope this helps!",1582055468,1,0
only if you have a job or plan for post-grad lined up already...,1582054400,1,0
"Idk about this class, but I'm going to guess that discussing exam questions isn't exactly what should be done outside of official class approved channels (esp if people have to do make-up exams). Soooo just be aware.",1582051056,1,0
was it the first or second exam?,1582044771,1,0
You can get a lot of free food at events or clubs.,1582042301,1,0
"yeah at home shits cheaper but i haven’t seen anything *in Philadelphia* better than fresh grocer. Trader Joe’s is definitely worse, Giant on 34th and Chestnut is definitely worse.",1582031396,1,0
"[https://tor.stackexchange.com/questions/906/does-my-isp-know-what-sites-i-have-visited-if-i-am-using-tor](https://tor.stackexchange.com/questions/906/does-my-isp-know-what-sites-i-have-visited-if-i-am-using-tor) 

Keep in mind, Penn would only try these things if they had reason to. Like if they had a request from law enforcement.",1582028162,1,0
"It’s a me, Mario” - L. Bossi",1582012394,1,0
"Thank you so much for this comprehensive guide! Extremely leaning towards FNCE251 now cuz there's absolutely nothing like that offered in my uni hahaha

Do you happen to have any insight on FNCE203 Advanced Corp Finance too? Looks like I'll have to do either 203 or 207 concurrently to be eligible for 251, but kinda hesitating as it does seem pretty standardised across all universitiesXD",1582010699,1,0
"Rodin resource room (check out board games, vacuums, 500+ moves, even a fucking Wii for free!) is something none of the other high rises can hope to compete against. 

Check the rodin website (loan library) for a list of all the stuff",1582009252,1,0
"Quaker Days is when admitted students come and spend the day at Penn. There are tours, info sessions and various other Penn-run activities. It also gives you a chance to interact with your peers who are in your shoes and facing the same decision you are. You will also talk to current students about their experiences. 

Regarding the overnight aspect, it has been removed so Quaker Days is more like Quaker Day. The overnight is only being offered to students that were admitted to the Multicultural Scholars Program.",1582007826,1,0
"High rises, beets, battle star Galactica",1582006426,1,0
"If it's still Bossi teaching it, he did curve one of our exams because the average was so low. This was also back in F15, so take w/ a grain of salt.",1582005115,1,0
"We removed this because there is a centralized thread for Penn Alumni Interviews here-&gt; https://redd.it/djbtbx. If this thread has nothing to do with Alumni Interviews, message the mods and we'll approve the post

*I am a bot, and this action was performed automatically. Please [contact the moderators of this subreddit](/message/compose/?to=/r/UPenn) if you have any questions or concerns.*",1582005036,1,0
"I'd advise you to take fewer than 3 economics and 2 finance classes just so you can also fully enjoy the social aspects of going to Penn.

  
Also not sure if MGMT238 is Adam Grant's class but if it is then the chances of getting into that are pretty low. You have to apply for a seat in the class. 

Both FNCE 207 and 251 are amazing classes where you'll learn a lot but taking these two together would make your course load way too hard. If you really want to take one of these classes I'd go for 251 as it is more unique to Wharton than 207. 

208 Apparently is a lot of statistics and calculating exchange rates.  

FNCE 238 is a great and informative class. Would recommend 

Don't know too much about the ECON classes as I am a finance major in Wharton.",1582003453,1,0
"idk about you but at my home grocery store, a pint of talenti isn't damn near $7",1582002169,1,0
"They're great! I never lifted weights in my life before I started doing BODYPUMP. It not only changed my body for the better but also makes me mentally feel better about myself. 

Definitely buy a semester pass (costs $80) -- you'll end up saving so much more money and it helps you keep yourself accountable so you go more often and ""get your money's worth!""",1582001641,1,0
Do you recall what you got for the last two?,1582001496,1,0
"Senior here - spring semester has always been more stressful for me. I think it's the shorter and darker (and rainier!) days and that winter break wasn't long enough to fully recharge. I always feel like I'm burnt out towards the end of the spring semester. 

Made it through 7 semester of Penn so far, so will take the 8th like a champ :) You can do it too!",1582001042,1,0
Yes,1581999927,1,0
I was in CIS and now study East Asia and will still be graduating in 7 semesters total. Don’t sweat it.,1581998496,1,0
username checks out,1581998490,1,0
What the crap,1581998446,1,0
I thought it was pretty straight forward,1581998267,1,0
"I think they mean ""while not being a current student at NYU, Columbia, Barnard""",1580111029,1,0
Theres an undergraduate research program at Sloan Kettering but the deadline to apply for that program is in a week,1580104147,1,0
"Talk to your professors or CURF about any insights they have, but if you're eliminating ""Columbia, NYU, Barnard etc"" you're really limiting some quality options.",1580101188,1,0
Perhaps take a shot at PPE w/ a minor in music? It seems to keep a lot of options  open for you wrt future employment thats relatively lucrative.,1580101009,1,0
Just go to someplace that isn't frequented by college kids + is outside university city. You'll be fine.,1580100858,1,0
"RenTech doesn’t recruit undergrads from anywhere, and Citadel only on very rare occasions. TwoSigma took one MIT students my four years at Penn. DE Shaw doesn’t recruit quants from Penn. SIG does, and is the other big quant option. Jane St doesn’t. A few of the Chicago prop shops do. Regardless, it’s rare, and MIT, Harvard, Princeton, etc.. are all much stronger schools if you’re seeking a quant offer.

This is akin to saying Penn is a great school for NFL careers because we have a few in the league. 

You’re a freshman at Penn in the college? You have no idea what you’re talking about and shouldn’t be commenting.",1580098636,1,0
"I'll be honest, if you're looking for finance recruiting, you might as well just go for Wharton and see what happens. If you're going through the difficulty of leaving your original college and move across the country, it might as well be for the best business school in the world",1580098527,1,0
"This is clearly a salty CAS student. Many students from Penn have gone on to Citadel, TwoSigma, RenTech etc. But it is true that they are usually dual Wharton/SEAS degrees (not necessarily M&amp;T though).",1580098437,0,0
Most byos dont care,1580096672,1,0
"I've been to one where they checked one person's ID and the implication was that only that person was allowed to drink, but they didn't enforce it- was likely for liability reasons.

All others did not check ID.",1580096292,2,0
"What I would recommend considering (and what I have seen others do) is to do a double major in economics and philosophy (or music maybe). That way you can pursue your passion and still have good job prospects. If you fill your elective slots with philosophy classes you can essentially get the double major without having to take too many more classes than would be required to graduate. I see a lot of people do this where they have a fun/passion major and then a major which pays the bills and which will get them a job. 

I would only recommend doing solely a philosophy or music major if you plan on getting a professional degree (like a law degree).",1580095245,2,0
"To start off, I think one of the starting problems is that I still don't have a very strong interest in any subject or major. To add on, the majors I do have a bit more interest in, philosophy and music, do not have the best job opportunities and pay, especially since I don't expect myself to do exceptional enough in them. I've been thinking I should be more reasonable with my major and do something that can help my family situation since we are lower income. Anyway, I think it's great that you found a way to combine your interests and I'll take that advice if I ever face it in the future too.",1580095182,1,0
Do byos check for ids these days?,1580095033,1,0
"Thanks for the information and resources. I guess coming from a more lower income family, I'm starting to think more realistically about the job prospects and potential earnings of my major rather than just following an interest. As much as I love philosophy and music, I don't think I will excel too well in them to stand out or be able to make up for the lower job opportunities and pay. I've been thinking about economics since it is a pretty practical major for a good job, which is why I guess most people choose it in the college, and I am not entirely opposed to it since I do find economics interesting in a way, especially the more philosophical parts.",1580094331,1,0
There are 18+ downtowns depending on the location and host.,1580094319,1,0
"There’s Tri-I with Rockefeller, Weill Cornell, and Sloan. Each has its own summer program. There’s also Cold Spring Harbor in Long Island. However, the deadline to apply is very soon, usually Feb 1st.",1580093982,1,0
"Jesus, I know your type. Stuck up, dumb and wrong...",1580091823,2,0
"Columbia has SURF/AMGEN, and WCM/Icahn both have research programs targeted at undergrads. These are open to undergrads across the country. No Penn-related ones as far as I'm aware.",1580087982,2,0
"Quite frankly, you should look at the career services reports for [The College](https://cdn.uconnectlabs.com/wp-content/uploads/sites/74/2019/09/2018_CAS_Career_Plans_Survey_Report.pdf) and [Engineering](https://cdn.uconnectlabs.com/wp-content/uploads/sites/74/2019/08/2018_SEAS_Career_Plans_Survey_Report.pdf). They only show where people end up working and salaries by job type, but you can find starting salaries by major [here](https://www.wsj.com/articles/which-college-graduates-make-the-most-11574267424?mod=hp_lead_pos10). You should try to find something that both interests you and also allows you to put food on the table and afford a decent quality of life. Not that money is everything when deciding your major but there are MASSIVE gaps in how much certain majors and certain professions pay, so if you are mostly indifferent between two but one offers much more in terms of the quality of life you will be able to afford after you graduate, then its a no brainer in my mind.",1580084827,3,0
"What part are you struggling with? Is it picking a major that'd help your future career? Being unsure what that career may be? Not being able to find something that combines your interests? 

For me, I eventually went with a Bio + CS double major because well...I couldn't pick between the two. The only thing I really knew was that I really liked the CS courses I was taking, but I didn't want to do a full CS degree since I didn't really care for lower-level systems courses like 380 and 371. I also knew I wanted to go to med school in the future (or at least do something clinical informatics related in the future), and eventually I found that there was a computational biology concentration in the Bio major that'd allow me to double count some courses.

I'm unsure what could really apply to your situation, but basically my point is that if you have multiple interests, there is a path forward. That being said, that path forward may take a lot of work, but you can technically do it for a  lot of combinations you can think of.",1580083834,1,0
I pissed on the Ben Franklin bench and I read the scroll he was holding; it was ACTUALLY interesting! On that night I knew I was a history major at heart.,1580080737,11,0
"Penn isn't a top school if you're pursuing quant seriously, and is not what people are referring to when discussing finance at Penn. Other than an AQR pipeline (which is very heavy M&amp;T) it's rare for a quant fund to take a penn kid. Good fundamental hedge funds take few people regardless, but exclusively from Wharton as far as I know",1580075905,0,0
Take a look at the [career services reports](https://careerservices.upenn.edu/post-graduate-outcomes/) for the college and Wharton. Particularly look at the outcomes for economics students. It will give you hard numbers on student outcomes and the employers students end up working for. Combine that with the general anecdotes that it is harder to transfer into Wharton and make your decision from that.,1580075083,1,0
I emailed them. They said they are processing the apps for applicants first so the earliest would be mid-may.,1580073943,3,0
