title,selftext,created_utc,score,total_awards_received
double major question CAS Econ and Music tech,"I've just been accepted into Steinhardt's music tech program and want to double major in Econ. Will NYU accept transfer credits if I take some classes at a community college over the summer so that I don't have to take 18 credits each semester? I am entering with 8-12 college credits, and have tested out of Algebra and Calc. What advice do you have for me?",1588655317,1,0
double major in Steinhardt music tech and CAS econ,[removed],1588655233,1,0
Double majoring in Music Tech and Econ (c/o 2024),[removed],1588653849,1,0
Biomolecular sciences at Tandon vs. Pre-Med at CAS,Hi so I was accepted into biomolecular sciences at Tandon and do have an intention of going to medical school. I noticed that biomolecular sciences at Tandon is said to help prepare you for Medical school if you choose that path. Though what is the difference between that and pre-med at CAS? Should I consider internally transferring?,1588644605,1,0
Don't Go to College This Fall by David Perell — What are you thoughts?,,1588638739,1,0
‘24 class registration,I’m an incoming freshman and I was wondering when and how we can start registering for classes?,1588631754,1,0
NYU Waitlist Admits,When will be the students from waitlist admitted for fall 2020 session.,1588631395,1,0
NYU Nursing Waitlist,"What are my chances of getting off of the NYU Rory Meyers Waitlist? has anyone gotten off of it before? thank you, I sent in a LOCI also.",1588626244,1,0
Have any admitted students received an acceptance package from NYU yet?,"The one with the folder

[View Poll](https://www.reddit.com/poll/gdjmne)",1588624670,1,0
"Hello everyone, I am a research student working on a personal project related to COVID-19. I have constructed this easy 6 question survey, takes less than a minute to do. You might find some questions lacking info and that is intentional. I appreciate everyone who helps me out. Thanks, stay safe.",[https://forms.gle/EKSnJAFUoWYL4P8R9](https://forms.gle/EKSnJAFUoWYL4P8R9),1588623110,1,0
"It’s been a long semester, but hang in there bois almost done",,1588621288,1,0
Missed housing application,"Hi, 

Sorry in advance if this is a dumb post. I'm pretty worried at the moment so any advice would be helpful! I'm an incoming freshman for class of 24. I'm applying for Fall 2020. I stupidly missed the housing application deadline of May 1st. I submitted it today. Do you guys know what impact this will have on my housing/anything else?",1588621198,1,0
Underclassmen: stop giving career advice or commenting strong opinions about things,"tl;dr: Underclassmen stop giving career advice before you even have applied to a real internship/job and discouraging other people. This subreddit isn't the right place for career advice regardless of what anyone says. Period.

I've seen so many people post on here asking for career advice regarding whether a specific major would be right for them or not, school would be right for them or not, or even something like whether getting a job in a field of their interest is possible from NYU or not.

I get that now is a time when a lot of incoming freshman/some underclassmen have questions about career choices but with all respect, this subreddit isn't the right place to ask. Most of the people here seem to be people in the class of 23, class of 22, maybe even some highschool students who haven't even gotten into NYU. These people have barely had any real internship experience let alone a job experience but still here they are giving career advice or giving strong opinions on certain things.

I'm a graduating senior and decided to browse the subreddit because I'm bored before finals and saw at least a couple of posts from perhaps underclassmen interested in some field in finance. As someone fortunate to have had good guidance throughout the years at NYU which lead to landing a job I wanted and is highly desired, I know what kind of guidance made that possible. However, I still see some idiot from the class of 23/22 commenting ""No qUAnt isnN't PoSsible oUT oF underGraD tHis ISn't MIT"" or ""YeaH ThERE aRE 150 kinds dOinG IB oUT of STern"" like seriously? In what universe are both of those replies even remotely correct? The first one clearly doesn't know there are different areas one could do related to quant out of undergrad as someone pointed out in the thread and the second one seems to discount any other competitive applicant from other top schools applying for those positions. Most of you guys haven't had a real internship or are maybe a year or two away from even applying from one and you're going to give out career advice?

At least comment something remotely useful even if it's ""check out linkedin and reach out to almuni for informational interviews or ask people at wasserman to point you to right resources."" I can only speak for finance because I have experience with that but regardless of what you study at NYU, NYU is a good enough school to open doors at any career choice you want. Sure, NYU isn't wharton or something, but with the right guidance and by taking advantage of being in the city, you can do so much. Personally, I'm headed to a BB that many people desire to work at, I know of people who are headed to EBs that many people also desire to work at, HF/PE is rare out of undergrad but I know some people who still managed to land a role, some people even not in stern managed to land an amazing job that people in stern compete for, I've come across certain CAS students in my superdays at banks and the list goes on... You know what made that possible? **Proper guidance from people who could actually help and give proper, honest advice instead of just discouraging you. That is what will lead you to your dream job. Utilize the actual helpful resources you have, not Reddit.** Getting a job out of college is perhaps the most important thing, don't screw that up by listening to some bozo on reddit.

Stop acting like you know everything as an undergrad and grow out of the bubble you have attended school in so far.",1588620595,1,0
Black experience at NYU Shanghai,"Hey! I am thinking of studying abroad at NYU Shanghai. (I am currently a Freshman and might study aboard junior Fall) I have been watching tons of YouTube videos about racism in China against Black people and the resurgence of it because of the coronavirus (government try to pin corona on Africans). Can you talk more about the racism you've experienced in China? And just about your experience as a whole? This question is open to all if you wanna talk about your general experience, pros and cons ( if the discrimination is worth a global experience), and exciting places to check out. Thanks!",1588620168,1,0
Underclassmen: stop talking out of yours asses and giving career advice/strong opinions,[removed],1588619677,1,0
For people who cheated in the Calc 1 midterm exam,,1588616004,1,0
information tech/management major,hi! was doing some research and was wondering if NYU had an information technology management major (or something related) for undergrad? thanks!,1588612990,1,0
"we didn't take SAT or ACT in my country, can i still get in?","im from the philippines, we dont take sats or acts or ap, but i really want to go to nyu, its my dream school, is it possible to get in?",1588611284,1,0
Fifty years since the massacre of students at Kent State,"This article was published today on the World Socialist Web Site. The WSWS is published in part by the efforts of the International Youth and Students for Social Equality, (IYSSE) a socialist youth group which has a club at NYU. I hope everyone is staying safe and healthy.",1588610418,1,0
Fifty Years since the massacre of students at Kent State,,1588610259,1,0
Switching Majors at NYU Tandon,"Hey guys, I recently got admitted into NYU Tandon's Business and Technology Management program but was wondering how hard is it to transfer majors internally? Personally, I want to transfer into the Computer Science major at NYU Tandon and was wondering exactly how this whole process works? Is it hard to transfer majors in NYU specifically? Does anyone have prior experience with this? Thanks!",1588609176,1,0
Waitlist,"Hi guys!  

Anyone heard back from NYU after he filled the wait list form? specially INTERNATIONAL students",1588598310,1,0
Will students get rejected by some good universities’ master’s degree program just because she/he got the bachelor degree in nyu sps?,I just transferred to nyu sps for undergraduate program. I’m planning to apply for master’s degree in nyu (not the sps). I’m not sure will I get rejected because I graduate from sps?,1588587416,1,0
Help with Survey! Films that represent cultures among students.,,1588576394,1,0
Easy Cultures and Contexts classes in the Fall?,Does anyone know of Cultures and Contexts/Societies and Social Sciences classes in the Fall that are easy As.,1588576262,1,0
Pass/Fail 3 classes CAS,"Hi,

Hope everyone is doing well during these times. Just wanted to ask if anyone has petitioned to raise CAS limit to 3 P/F classes this semester and has been approved? 

Would appreciate any insight! 

Thanks",1588576068,1,0
greek life,is there greek life for alternative people?,1588565373,1,0
NYC CERTIFICATE IN BUILDING DESIGN: HVAC,"Has anyone here taken [this course](https://www.sps.nyu.edu/professional-pathways/certificates/building-design/building-design-hvac.html)? 

Do you think this course would help with future potential employers? 

Did you improve your technical skills significantly? 

Background: I am a mechanical engineer working for a MEP firm.",1588564839,1,0
It’s been a rough one folks,,1588564411,1,0
Transfer,"hi everyone! I'm currently a student at a university in upstate NY and just finished my freshman year. I've been heavily considering transferring into NYU! I just wanted to ask current and previous transfer students if it is hard to make friends at NYU? I've heard that it's a bit harder than other schools but was it really hard for you, personally? also, I'm currently an Information Technology and Management major, is studying IT or tech management at NYU a good idea? this post is all over the place haha sorry but TIA!",1588562682,1,0
How to make grad school more affordable,"How do I go about making the grad program more affordable? I'm beginning to wonder if $60,000 a year worth it. Does anybody have any tips?   For reference I'll be in tisch in the fall. 

Thanks everyone",1588559538,1,0
NYU Stern MBA Admins from SUNY,"Hi! I'm currently a freshman from SBU looking to graduate in 3 years and pursue and MBA program at NYU. I was looking into the 1-year fashion and luxury program and since it was relatively new I was wondering if anyone knew how competitive it is? I am also considering the 2-year full time track. 

I currently have a 3.7 gpa and hoping to keep it up there. Does anyone know how competitive the Berkley scholarship is as well? I'm super engaged in the SBU community and hope I'll be able to attend NYU for grad school",1588557309,1,0
Not sure how to feel about this :/,,1588553823,1,0
Should I rush a sorority?,"I'm going to be a junior next semester and haven't really been able to find my ""place"" on campus yet. I tried rushing an all south asian sorority but it wasn't a good experience. Should I try panhel? I'm an introverted extrovert, I'm kind of in between both categories. I love to go out and explore and party but I am not going to be the most talkative person in the room.",1588553775,1,0
Admissions Ambassador,Can anyone who works/worked as an admissions ambassador share their experience when applying and what their job involves? Thanks,1588552015,1,0
Undergrad at stern,"Hi! I am currently a high school freshman interested in going to stern(although it is nearly impossible). Aside from good stats, what other things should I do( such as extracurriculars, classes, internships, summer camps etc.). I am planning on joining fbla or deca next year and taking an accounting class. Thank you!",1588548981,1,0
Incoming Grad student at Stienhardt,Who’s trying to be friends come fall😂. Native NYer here that did his undergrad up the block at Baruch. I’m not trying to be that “first semester lost” in the fall (if we are allowed to come back).,1588548558,1,0
A question about federal student loans.,"Hi, I am an incoming freshman. When i applied to NYU I clicked the option that said I would commute from my parent's. Because of this NYU did not factor in the cost of dorming when giving me finaid. But a couple months ago I changed my mind, decided to dorm, and paid the housing deposit. Since I am dorming, my costs for college is no longer negligible, and I will have to take out loans. However I was not offered any federal student loans (I think because my initial cost of attendance was near 0). What are the chances the financial aid office would give me some federal loans if I asked them about it now?",1588523714,1,0
is TISCH WORTH IT? I need all the details,"(don’t forget to read the last part)

As an international student aspiring to be an actress, I’ve been looking into a lot of schools for a long time now. Tisch, is very well known, and allows international students to audition without attending in person (they allow online auditions which is super convenient). The alumni list is really good too when it comes to acting.

but is the debt worth it? NYU IS JUST TOO EXPENSIVE. Do you really get offers from the industry when you’re at Tisch? spill everything!! 

Please recommend other universities too (even in LA or Chicago or wherever) that offer acting courses to international students with good reputations.",1588521046,1,0
NYU - Sports Management SPS,"I am currently a HS junior and was instantly drawn to a Sports Management degree still NYU SPS. I know that it’s primarily for graduate students or older, but is it worth it? I still want to have a fun undergrad experience, and do you know how many undergrads are at SPS?",1588496652,1,0
nyu fixed payment plan,"is anyone here using this payment method plan?

I've got some questions and would really appreciate if I could ask you some!",1588487200,1,0
Finding Challenge at NYU?,"I am at the tail end of my first year at NYU, and the whole time (even pre-Zoom) I’ve been feeling really unchallenged academically. Any ideas for great professors, classes, and clubs that are both intellectually challenging AND really interesting/inspiring? (I’m in Gallatin studying some kind of storytelling, so looking for more humanities answers vs sciences but open!)",1588481276,1,0
Old MFE tests to study from,"Hey all,

&amp;#x200B;

I am taking a MFE placement test (place into MFE 2), and wanted to know what the best way to study was. Currently, there is only one test from 2013 online, and I was wondering if anyone had any old tests from MFE 1 they would be willing to share. Thank you!",1588470794,1,0
How are you all doing finals?,"Personally none of my professors have said much about finals besides they’re going to be timed. 
I don’t know how they’re gonna be proctored (or even IF they are) or if I have to take them early in the morning since there’s a time difference from NYC and where I’m from. 
Have any of your professors given you any ideas how your class will be doing them?",1588458502,1,0
What does the Animation Area mean?,"Hello! For a long time all I've wanted to do is to major in Animation so for the last year I've been looking into my options (which schools have the best courses, opinions from alumni, what did people did after graduating)  and in almost every list Tisch Film and Television program comes up (I'm for the class of 2025 btw).

Looking into it on the Curricular Overview page I noticed that the major has Introduction to Animation, but then there's a separate section called Animation Area...? I'm confused as to if the Animation Area is what the courses are for ItA or if it means that you are studying Film but specializing in Animation.",1588456464,1,0
Tisch Drama Students: Help! (Transferring + Studios),[removed],1588453841,1,0
Federal PLUS Loan?,Is anyone else not able to accept the federal plus loan on Albert? I called NYU numerous times and they told me that it would be available to accept in May.,1588447152,1,0
NYU nurse directory,"Hey all.

Is there is an online nurse directory for NYU nurses. I am supposed to email a medical document to a nurse there however I do not remember the last name and can’t seem to find the business card. 

The last name is unique (Scandinavia) if I see the the name I’ll recognize it. Thanks",1588439845,2,0
Should I consider switching from CE (Computer engineering) to CS( Computer science),"I got an admit from Tandon school of engineering for MS in CE. I applied for CS but they offered me CE instead. At the end of the day I want to get jobs like that of Data scientist, Data Analyst or Machine learning engineer. How can I make it work with MS in CE? Or should I  look for switching to CS? If yes, how do I do that? 

Another way that I can achieve my goal will be appreciated :)",1588427162,1,0
Is NYU a target school for quants straight out of undergrad?,,1588400495,1,0
"saw this on a few nyu stories, is this legitimately an nyu professor?",,1588398901,1,0
Transfer student,NYU does not require SAT after 32 credits and I have applied to this school with just my college work. Is it possible to transfer to this school with a 3.2?,1588393623,1,0
In what ways has zoom improved or worsened your anxiety,Creatives: do you still want to create in the era of Zoom?,1588388251,1,0
Question about choosing classes fall 2020,Hi I was wonder how do you begin registering for classes in fall 2020. I haven’t gotten an email or found anything online.,1588382020,1,0
HELP!!,I thought the deadline to pay for housing was at 11:59pm like the enrollment. It was at 5pm and I payed at 6:30pm. They still allowed me to pay.... I really need housing. I’m freaking out and called them and emailed though the office is closed. Im a feshman and the housing application only allows me to choose from upperclassmen dorms!!,1588381236,1,0
Question about choosing classes fall 2020,Hi I was wonder how do you begin registering for classes in fall 2020. I haven’t gotten an email or found anything online.,1588380608,1,0
HELP! Paid freshman housing one hour late,I thought the deadline to pay for housing was at 11:59pm like the enrollment. It was at 5pm and I payed at 6pm. They still allowed me to pay.... I really need housing. I’m freaking out and called them and emailed though the office is closed.,1588379713,1,0
Question about choosing classes fall 2020,Hi I am an incoming freshman I was wondering how do I begin registering for classes. I haven’t gotten any emails and can’t find anything helpful online.,1588379518,1,0
I am an admitted transfer student. Missed the financial aid deadline. How fucked am I?,Really hoping to join ya'll come next semester but first I need aid. Did I screw the pooch? Do I have any chance of getting aid? Is there someone I should talk to? Thanks ya'll.,1588378533,1,0
I am an admitted transfer student. Missed the financial aid deadline. How fucked am I?,Hopefully can join y'all next semester but in order for that to happen I need aid first lol,1588378403,1,0
I am an admitted transfer student. Missed the financial aid deadline. How fucked am I?,Hopefully can join y'all next semester but in order for that to happen I need aid first lol,1588378399,1,0
Admitted transfer student. Missed the financial aid deadline. How fucked am I?,,1588378297,1,0
Admitted transfer student. Missed the financial aid deadline. How fucked am I?,,1588378203,1,0
Admitted transfer student. Missed the financial aid deadline. How fucked am I?,,1588378180,1,0
Admitted transfer student. Missed the financial aid deadline. How fucked am I?,,1588378163,1,0
Admitted transfer student. Missed the financial aid deadline. How fucked am I?,,1588378161,1,0
Admitted transfer student. Missed the financial aid deadline. How fucked am I?,,1588378155,1,0
Online Proctored tests,"Hey all, 

Has anyone had an online proctored exam yet? What are they like? I am kind of anxious at the thought of having someone monitor me constantly via webcam and monitor me like that. Not because I want to cheat, but it is like having someone look over your shoulder while taking the test. Does anyone else have this feeling?",1588377138,1,0
Housing Freshman,"So I am applying for housing but when I have to choose my dorm preferences it only lists dorms for undergraduates who are not first-year (so there isn;t lipton, rubin, brittany etc)... Today is the deadline and I'm nervous",1588375004,1,0
CSTEP,[removed],1588372945,1,0
How to be a successful student at NYU? (Tips and Experiences would be greatly appreciated),,1588371553,1,0
Do transfer courses affect nyu gpa?,"hey guys i was just wondering if i were to take a non-nyu summer course this summer and have it transferred over/approved by department, would it factor into my gpa or is it just for credit?",1588367818,1,0
Any deals / free stuff / resources for NYU students?,Incoming law student,1588365925,1,0
Dramatic Writing vs. Film and TV Major,"Hi! I'm a rising senior who's going to apply to NYU (maybe ED, we'll see) and I'm debating which major to apply for. I'm more interested in the screenwriting side of things than directing, but it also seems that film and tv is a larger program that might allow me to explore different sides of production and allow me to make more connections. I've really been having trouble finding information about dramatic writing especially, so if anyone has any advice/information about the curriculum, type of classes and projects, ""vibe"" of people, etc, of either major I would appreciate it so much!! Thank you!",1588365687,1,0
Will NYU campus reopen by next Fall semester?,hello! my boyfriend got accepted to NYU Tandon for next Fall 2020 and we plan to move from California to NY. we are a little worried that classes will be held remotely next semester due to the pandemic in which we'd have to defer to the spring semester. do you guys think the NYU campus will be open again by next Fall and will physical classes likely resume?,1588362835,1,0
Is there a curve in CSO?,I am taking CSO with Joanna and the second half is proving to be pretty brutal. Is there a curve in this class?,1588361829,1,0
Found website selling off entire sunglasses stock for $5 (going out of business) - Proceeds going to Coronavirus research 😊,,1588361299,1,0
Cultures &amp; Contexts: Italy w/ David Forgacs,"Has anyone taken this class? If you have, was it interesting to you? How was the workload/grading? How was the professor (interesting, engaging)? Thank you!",1588359495,1,0
Presidential Honours Program,"Hey guys, I just received an invite to the program.  How do I accept the invite?",1588358720,1,0
I got accepted to NYU Silver School Masters program for this fall! Coming from South Carolina.,Should I off myself now or wait until they tell me it’s gonna be remote last second?,1588358245,1,0
Is the housing application due today at 11:59 pm EST?,,1588355699,1,0
The Economist Student Subscription Deal," **I hope everyone has been staying safe and healthy throughout this quarantine. On campus I was a campus ambassador for The Economist magazine. As an ambassador, I was entitled to some pretty sweet deals. Given how valuable it is to remain well-informed during recruiting, thought I would share with everyone here. A 12 week $12 subscription program using this link economist.com/ev5 or a 51 week $51 digital subscription using this link economist.com/TNEV5 Hope this helps you all pass time while on lock down.**",1588352594,1,0
Missing picture...,"In (approximately) February, my friend and I were photographed by a young lady in Washington Square Park while smoking a cigarette, for what she said was some sort of photo project. I would really love to find this picture, as it has become a nostalgic vestige of my time in New York (though I have yet to see it). I have shoulder length blonde hair, blue-ish eyes, and was probably sitting with my legs crossed. He has shoulder length curly black hair, brown eyes, a nose ring, and was probably wearing a denim jacket. I know that this isn’t very descriptive, but anything helps!",1588351903,1,0
Othmer residents pwease interact,[removed],1588351686,1,0
Dropping a class? Econ CAS,"Hope everyone’s doing alright. Just had a few questions/concerns about dropping a class.

I decided to take a class pass/fail this semester. This class is a major requirement, and I will most likely pass it. The only problem is that I don’t feel like I actually learned anything. I am not confident that I should move on to the next class, as the next one is a direct continuation of the current one. 

Im leaning towards dropping the class and taking it again next semester.

I don’t want my transcript to look like I’m lazy but I also would rather learn the material, I mean that’s what I’m paying for. 

How bad would dropping a class look given the current circumstances. I am planning on applying for grad school in the future.",1588347597,1,0
Quality of the CS program?,"Admitted as a CS student in CAS for undergrad.

What are the job/research opportunities like? Is the quality of the program up to par with top schools? Is it recognized/prestigous? Will I learn what I need to know? What does all of this have to do with Courant?",1588321766,1,0
What time on May 1st is the housing payment due for incoming freshman?,,1588319805,1,0
Cheapest Summer Classes in NY?,What college offers the chepeast summer classes in NY for international students?,1588318410,1,0
