title,selftext,created_utc,score,total_awards_received
Bimolecular Science at NYU Tandon,"Hi guys I was just admitted for bimolecular science at NYU tandon. Just want a little insight, how are the courses? Teachers? Social life? Opportunities given?",1586147576,1,0
Help me clarify things I heard from NYU shanghai; NYUSH vs. UCI,"Help me clarify things I heard from NYU shanghai; NYUSH vs. UCI

Hi I just got into NYU shanghai class of 2024 and these are some things I heard about that school so if anyone goes there, please clarify for me!

1. School is for chinese students
I heard grades are hard to get as chinese students get very easily graded. I also hearf that there is more opportunities for the chinese kids so I want to know if as an international student we would get the same treatment/support.
2. Recruiters/Employers don't know the school or thinks lowley of it since it is not nyu ny
3. just a question but is Internal transfer to NYU NY hard? I want to transfer if I dont like the school
4. Would it be worth it to go to NYU SH as a marketing major instead of UCI undeclared? 
5. UCI doesnt actually have the marketing major I want. Would it be better since it is a bigger school and all? I feel like they would not give enough support.
thanks!",1586146674,1,0
Freshman housing?,"Are we supposed to have done this already? 

Is it even open?",1587621270,1,0
Stuck in Quarantine? Bored out of your mind in your zoom lecture? Come play on NYUMC the unofficial NYU Minecraft Server!,IP and Discord below,1587620634,1,0
Division III Fencing,"Hey i’m a student athlete, that’s rly focused on fencing and i was looking forwards to trying NYU but then i saw that it was a Division III school. Why is that? also does it still offer sport scholarships? and what does the sport program look like?",1587620555,1,0
Awesome playlist for sparking creativity 🙌,,1587607991,1,0
GroupMe Group Chat for Class of 2024,"https://groupme.com/join_group/59389545/X8Ao9LB2
There's 200 of us and we're actually pretty fun! The chat hasn't died yet.",1587607838,1,0
May I see your Gallatin degree?,"This might be weird but I am in Gallatin right now and I am just curious what my future degree would look like and what it says on the thing.

Take care!",1587605084,1,0
LS writing II class,"hey, what are your guys' experiences with these LS professors? especially the freshman profs like hasri, rzonca, brown, etc... not doing so hot right now because my home life is chaotic right now",1587604614,1,0
Social life in NYUAD,Hi I am very intrested in studying in NYUAD and hoped someone who is studying or studied there could help me out. How is the social life inside the campus?,1587598081,1,0
Help me out with my VIP project and get a chance to treat yourself!,[removed],1587597861,1,0
Undergrad Research for CS,"If I were to do undergraduate research, would I have to spend my breaks (summer, winter) in NYC conducting research? I am looking to get into CS/ML Research but I want to be able to pursue summer internships. Anyone have experience doing Compsci related internships as well?",1587594766,2,0
Gallatin MA,Hi there! I was recently accepted to Gallatin's program. I wanted to know anybody who had a good or bad experience and what their advice is? I am debating giving my deposit once I hear about financial aid.,1587594745,2,0
NYU would benefit more by deferring the fall semester rather than going remote.,"This might be an unpopular opinion, but NYU would benefit from deferring the start of the fall semester rather than operating remotely.

\- If NYU is online in the fall, many students are going to take a semester off, and the class of 2024 is likely to defer. If they defer then classes are going to be small, and NYU won't receive the tuition funding they need to properly employ their professors and staff. Likewise, it will make admissions for the class of 2025 unnecessarily difficult.

\- Students should not be paying $55,000 in tuition to attend an online university. This is an elite institution, not ASU.

\- Many artistic majors such as music, drama, studio art, etc require equipment and levels of interaction that are not available virtually.

\- It would be possible to run two full-length semesters with short vacations starting in 2021 and be able to have a month off in the summer before beginning the 2021-2022 academic year as planned. Although, this would eliminate J-Term.

There is no reason why NYU should be ""fully operational"" in the fall if we are not getting the quality education that we have worked hard for, and are paying to receive. I would personally rather postpone the school year than have a mediocre fall semester online.

I would love to hear your thoughts, please let me know your opinions.",1587582891,5,0
ACCTUB20 Analysis of Financial Institutions,"I’m an Econ major who has taken Financial Accounting so I’ve fulfilled the prerequisites of this course. I’m wondering if there are any comments about this class up here since I can’t find any info about the professors (D. Gode and S. Ryan). 

I’m taking this because I’m used to taking a 2-credit that I find interesting every semester. Came across this and thought this might be a solid choice so would love to here more about it. The syllabus looked solid and the content seemed to be very applicable in the future. Just worried if it would be too out of context if I haven’t taken any other accounting/finance courses and the style of professors. Welcome any comments/advice on this course!",1587578940,1,0
I haven’t been notified of my room selection time for Phase 2 Housing...,Should I be worried?,1587578640,1,0
Non-Stern Registering for Stern Classes,"**I encountered this when trying to register for stern classes ""**

**Error:** You are unable to enroll in this class at this time. Available seats are reserved and you do not meet the reserve capacity requirements.""

&amp;#x200B;

Does anyone know the reasons for this?

&amp;#x200B;

Thanks!",1587578288,1,0
ECON 370: Macroeconomic Policy Analysis by Professor Lars Ljungqvist,Has anyone taken this class? It's an Econ 300 elective I'm trying to find information on. What's this class like?,1587571647,1,0
Victor Shoup or Alan Seigel?,Who should I take for Basic Algo? I am really confused. Someone please help me decide.,1587570815,1,0
iPad for notes,"hello. sometimes I see people using the iPad and Apple pen to take notes in class. needless to say it looks very very cool.

has anyone switched from traditional notebooks to the iPad and pen? what do you think, does it help you organize your notes better? I am considering getting one but I have this irrational belief that using pencil and paper helps you learn material better",1587565999,2,0
Has anyone else's class literally or practically turned into a COVID-19 class?,"In some of my classes, the professors may reference COVID-19 here and there when it directly relates to our planned topic for the day. 

But in one of my classes, we've literally spent the past few weeks (since the switch to remote learning) discussing only COVID-19. I'm pretty pissed as one might be if one signed up and paid for a course on X only for it to be converted into a course on Y. I had genuinely looked forward to learning more about the topics listed on our syllabus, but now class time is being spent discussing news items and watching news clips probably a bunch of us have already seen. 

This is a bit of a rant, but I'm also curious if anyone else's class has undergone a similar change in direction?",1587562148,1,0
Does applying for financial aid lower my chances of acceptance?,title,1587556206,1,0
Organic Chem,[removed],1587536077,1,0
College VALORANT Tournament,"Does anyone wanna join me and register in a team of 5 in a college VALORANT tournament? The information can be found below, I’m looking to enter with anyone from NYU. People are currently doing scrimmage matches so there still should be time to register. Please reach out if you’re interested. I would love to participate in this. Thank you.",1587535298,1,0
Federal Pell Grant taken away,"Hey everyone, so my initial financial aid plan was essentially a full ride with the Pell Grant included. But for some reason my plan got updated without the pell grant included, making my net cost around 6k a year. Did this happen to anyone else?",1587530956,1,0
DLI grads attending NYU??,"Hello, I am getting out of the Marine Corps next year and I have so many questions about college applications, universities accepting DLI credits, using the GI Bill, etc. I am a graduate of the Arabic program at DLI and am hoping to get into NYU. I didn't do all too bad in high school (mostly A's and B's) but I completely fucked off for two years in college and failed one or two classes. I graduated DLI with a 3.08 GPA and left Monterey with a 2+/3/1+. I know NYU isn't the easiest school to get into, but I know what I want and I'm willing to do what it takes to get there. I'm asking if there are any DLI grads who've attended NYU or any high end school and what their recommendations would be to make myself stand out throughout the application process. I do not know if I should atudy and try to take the SAT/ACT or if I should use my Associate's Degree to trying to get a Bachelor's Degree before I get out. Any guidance or recommendation is greatly appreciated

 Also, for veterans attending school in New York, how do you make it work with the GI Bill? Is the monthly allowance enough? What neighborhood/ size of apartment do you live in?  Do you have roommates? Thank you for your feedback.",1587522587,1,0
does anyone know what’s going on with housing?,why’s it so late?,1587517987,1,0
When will Spring 2021 applications open?,"I’m trying to transfer to NYU for the Spring term of 2021. Whenever I search for “NYU” or “New York University” on the Common App, no results show up. At what time will I be able to begin my transfer application?",1587517097,1,0
NYU Tel Aviv,"To anyone who has been to NYU Tel Aviv:

What was your most interesting course? What was your easiest course? Any general advice?",1587514357,1,0
CollegeTV,,1587508186,1,0
Orgo,[removed],1587506591,1,0
Choosing a basic algorithms professor,It looks like the only choices are Victor Shoup or Alan Siegel. Currently Siegel’s section is full but I’m registering in less than an hour. I should be the first or second person on the waitlist so I’m pretty sure I could get in either section. Both of them have very mixed reviews on rmp (mostly negative though) so I don’t know if I should try to get in Siegel’s class or go with Shoup. Anyone have experience with either of them?,1587498972,2,0
Why are all the CAS Core Texts and Ideas classes currently closed on Albert?,[removed],1587498415,1,0
State School (UGA) or NYU Tandon for 1 Year?,"This might be a stupid question in y'all's eyes but here's my situation. I've been offered transfer to Georgia Tech after my freshman year as long as my grades are good. Therefore, I'll spend a year at either UGA or NYU Tandon (CS major). To Tandon students, is Tandon worth experiencing? I was really excited to come to the school because I've never been to New York but now I'm not sure. So many people have told me that they dislike being separated in Brooklyn or that it's too stressful to be enjoyable.  


Both would cost me the same (around 14K) so cost is not a factor for me.",1587498388,1,0
CAS CS Question,,1587497312,1,0
"The IYSSE at NYU would like to hear about and publish your experiences with housing evictions, refunds, and your current living situations.",[removed],1587494199,1,0
Opinions of Spanish Prof. - most not on RateMyProfessor,"Hey everyone - I'm horrible at Spanish, I took it for 4 years in high school and know nothing. I have a better attitude about learning it now, for my lang. requirement but really don't want a bad professor to ruin that. Has anyone taken a class with Carolina Davila-Diaz, Eduardo Segura (he's on rate my professor, but very mixed opinions), or Michel Nieva?",1587490434,0,0
How likely is it that Fall 2020 will be remote?,"I have been hearing that there is a potential for fall 2020 to be another remote semester, I really hope this does not happen, just wanted to see if anyone else thinks this is gonna happen, I know some models predict we could face another rise in covid cases after the summer.",1587488280,2,0
Who do you secretly blame for this COVID-19 situation?,"

[View Poll](https://www.reddit.com/poll/g5ivgj)",1587488001,0,0
Question for CAS CS students (from Incoming Freshman '24),"Hi, I hope there is someone on here who can help. I'm incoming freshman into CAS, and I'm interested in doing the Joint CS + DS major. Forgetting DS reqs/courses/etc. I was hoping someone could help with what are the harder Computer Science courses, easier courses (so I can balance difficulties), when i should do CAS core stuff. don't wanna overwhelm myself in college so if someone could help out that'd be awesome.

also, when applying i chose Data Science not CS, and I know nobody at CAS starts with a major, I'm just now wondering if that will be a problem and I may not be able to take CS classes until I do Data Science ones?

thanks for help whoever responds",1587487272,1,0
easy classes on monday and/or wednesday,I have space for any elective (in any school) on mon/wed. what are some good ones?,1587486280,2,0
photography for non tisch,Has anyone taken oarts-ut-11 before and have insight on the class? Is it fun and easy? its the photography class for non tisch students.,1587486214,2,0
Should I defer my enrollment?,"I am an international student who got into CAS, class of 24. I really don't want to spend my first semester online. Also, can you just defer for a semester does it have to be for the full year?",1587486187,2,0
That Feeling When Midterm Gets Cancelled Last Second," 

https://preview.redd.it/7uiplwst57u41.png?width=2862&amp;format=png&amp;auto=webp&amp;s=ddd676feef2efe50c509ab781fffd126ea352cc8

Cancelled exams are always welcomed...but not when I've been working my as\* off solving the questions for 70 minutes, only to be notified that it was cancelled minutes before the turn-in time.

The prof. says that s/he's very frustrated but I can almost bet that the students who went through the entire exam for nothing are even more frustrated.",1587486160,4,0
That Feeling When the Midterm Gets Cancelled Last Second,[deleted],1587486050,1,0
Should I take a gap year if this continues?,"I got accepted to NYU for the class of 2024, and I'm super excited to go, but I feel like it would kinda be a waste to spend some of my first year online. Does a gap year make sense if we're still in quarantine this fall?",1587479490,1,0
Anyone doing data science major/minor??,"Hey! I'm just considering potentially doing a data science major or minor (minor likely, because I'm graduating soon)...is anyone in it right now? I'm curious about whether you feel its worth to pursue as theres so many courses, etc",1587477857,1,0
Hard decision to make - &gt; MPS ITP vs Yale MFA,"Context:

So I've been accepted to NYU, in the ITP program;  as well as to Yale, in the MFA  graphic design. 

To make it sort, I would love to attend ITP (because it's more engineering focused) but I had a full scholarship from Yale while almost nothing from NYU, so I will probably ends up with 150K in debts minimum if I attend ITP . Any international students studying at ITP out there? How do you guys manage the financial thing? Any scholarships I can hope to get after I've entered in the program?",1587466851,1,0
Requirements for scholarships,"Hey I am planning to go to NYU in a couple of years and I wanted to know what are the requirements for a scholarship for a dual major? Say I want to be in Video Production and Video effects and I am coming from california. How much community service would I need to commit to get in and what is the GPA needed to apply?

Also what If I did not do too good in freshmen year with my grades and behavior but massively improved the rest of the years? Would that affect me or does it matter who I am now and how I have changed?",1587445848,1,0
Liberal Studies Core,[removed],1587442149,1,0
Cutting Edge Software,,1587438075,1,0
Does Stern offer financial based guaranteed transfers?,"I was admitted to Stern for c/o 2024 but i would have to take out 140k in loans to go. My parents are willing to let me go for 3 years if I can defer my enrollment for financial reasons and get a guaranteed transfer with credit transfer guaranteed. Is this an option?

How hard is it to get an external non-guaranteed transfer into Stern?",1587432790,1,0
Anyone taken law and society?,"Registering for summer classes and considering taking law and society with Sabrina Dycus. If anyone has taken her class/ the same class with a different professor, how difficult/ demanding is it? Any suggestions for similar law related classes that aren’t going to be incredibly difficult?  Thanks.",1587430153,1,0
Remote classes until next year Spring 2021?,"So, given that we haven't gotten any email regarding housing (unless some of you have), is it safe to assume next semester will be remote also? Is anyone else also frustrated by this?",1587423292,1,0
NYU School of Law Shifts to Mandatory Pass/Fail,,1587410076,1,0
Easy CAMS classes,"Hello all, hope everyone is healthy and staying safe. Can anyone suggest any easy A cams classes for this upcoming semester? Would appreciate it!",1587406994,1,0
Organic Chemistry with Jones or Canary?,I took Jones for Organic Chemistry I and had mixed feelings. Is Canary any better or should I stick with Jones? Thanks,1587405588,1,0
Transfer from Global Liberal Studies to Liberal Studies Core?,"Hii, I applied to NYU GLS and got in ED1. However, I want to swap to LS Core now because the idea of doing 4 years of liberal studies doesn't thrill me, and I'd much rather have 2 years so I can explore and then go into another one of the schools in NYU. My college counselor isn't really helping, but I was just wondering what are the chances of NYU letting me swap? Thanks :)",1587401020,1,0
Have you received your items from the dorm?,"I was able to pack my stuff in the dorm before I left and I got the boxes in the mail at the beginning of last week. I have yet to open them because my parents wanted to let them sit in the garage for a few days “just in case.” I was honestly surprised to get them back less than a month after we all got booted.

However, a friend got their boxes back and a bunch of their valuables were apparently lost or stolen- namely jewelry. This is after they were unable to pack up the room for their self.

I’m curious what other experiences have been so far. Have you received your items yet? After packing them yourself or the university packing? Anything missing or broken?",1587392722,1,0
Has anyone taken Professor Alice Teyssier's classes?,"How are they?

I was thinking about taking her Expressive Culture course next semester and was wondering how she is.

Thanks",1587389380,1,0
Film and TV Non-Major Question,"I'm a Cinema Studies major trying to enroll in 2 Film and TV courses this fall, Producing for Film, and Script Analysis. Both have designated ""non-major"" sections, and they're options for the producing minor, but it still looks like I'll just be on the waitlist until the course opens to all majors in May. What are the chances of me actually getting into these classes? Do they tend to fill up w/ Film and TV majors really quickly? For context I'm currently first on the waitlist.",1587388517,1,0
"COVID-19: Asian-American Doctor On Being ‘Both Celebrated And Villainized At The Same Time’ | TIME - Dr. Chen Fu, a hospitalist at NYU Langone Medical Center, reflects on his experience as an Asian-American doctor on the front lines of the coronavirus pandemic.",,1587367099,1,0
School in the Fall Announcement,"I was just wondering, when do you guys think they’re going to be announcing their decision for whether they’re going to keep school closed for next semester. And even if they didn’t, would they still allow some students to use Zoom to go to classes instead of going in person? (in my case, my parents are super paranoid about me possibly catching the virus so they said even if school does start back up, what about the possibility of a 2nd wave, so they wanted me to stay home pretty much for the rest of the calendar year)",1587361110,1,0
Major in Psych (CAS) and Minoring in Econ?,"Has anyone majored in psychology in CAS and minored in econ (the policy minor)? If so, how was it?",1587360912,1,0
Transfer NYU IMA vs UCSD Cog-Sci,"Looking for: advice, experiences, stories, etc.  especially in student life as an IMA student.  


I am still waiting to hear back from both schools, but I would be an incoming junior at NYU or UCSD next fall. I have a strong interest in a profession in interaction design, assistive technology with a research interest in the Ability Project, and a personal interest in immersive environments. My background is in computer science as a major but I have a lifelong passion for visual arts.   


I like that the IMA program is a BFA, but have hesitations regarding campus life (I simply know more about UCSD) and questioning whether NYU would be a good fit for me socially and for my mental health--both are reasons in part I am transferring. At UCSD--other than enjoying the radiant sun--I'd be a Cog Sci/HCI major. My instincts tell me I am sacrificing the opportunities of studio-based coursework to fuel creativity, gain skills, and build a portfolio, but I would develop a breadth of content from my current cs foundations, the cog sci core, and design + interaction electives. Another caveat, I have not found any faculty that does assistive-technology driven design research. However, the recreational center resources, location, student organizations, and culture seem more fitting to who I am and what I want as a college student. Of course, NYU does win in most food and entertainment categories--can't compete with the fresh avocado oasis that is San Diego. Another minus at NYU I foresee is the commute between the Manhattan and Brooklyn campus--I am already experienced with a 20-30ish minute commute to campus from my off-campus apartment at my current college and don't love it. It feels restricting especially someone who has a pet I try to return to once in the middle of the day. Well, there's my thought vomit. I appreciate all the help the reddit community can provide.",1587360270,1,0
Econ 300 level recommendations?,"Hey everyone,

I'm looking for some level 300 Econ course recommendations. None look particularly appealing tbh. Any recommendations?",1587359243,1,0
Academic Advisor,"Hi incoming graduate student here.

Just one question, is advising network the same as the academic advisor?

On my Albert it said I was ineligible to enroll for Fall 2020 cause advisor clearance is required.

So I was looking through my Albert page and found out there was sth called advising network. But wasn't sure if this was the same as the academic advisior.

A bit confused here, can anyone help me?
Thanks in advance.
Take care everyone :)",1587357908,1,0
Does anyone have a list of courses offered to first year NYU tandon students? Specifically Biomolecular science majors.,Ty :),1587357391,1,0
"Looking for subjective responses to ""is it worth it?""","So I got admitted to Tandon for IDM as a transfer. I've seen a lot of posts asking the same thing regarding whether or not it's worth it to take out loans to attend NYU. However, all those posts have been about Stern. IDM is my dream major, and I applied because it's one of the only programs I could find that actually met my academic and personal interests (I'm currently a math major and I'm extremely unhappy with my studies), but I haven't seen anyone talking about the job prospects like with Stern.

So, for anyone in IDM (or anyone from NYU honestly), do you think it's worth it?",1587351663,1,0
Pre Law Major,What building would pre law students go to?,1587346509,1,0
Sophomore Scholars,"Does anyone know how selective the CAS Committee is for the Sophomore Scholars program? I was invited to apply and I'm kind of really invested now and want to get in, so I don't want to get my hopes up. Just wondering if anyone knows? Do they place a big emphasis on community service? Thank you!!",1587343695,1,0
Recitation on Albert says TBA,"There’s a course I plan on taking next semester where the professor and course hours have been announced, but I can’t add the course to my cart because it says recitation hours are tba. Should I just assume that when course signup opens that it will be announced or should I message my advisor to see if he may know what’s going on with that course?",1587342856,1,0
Is it better to transfer or ED?,"Hey guys, I'm currently a junior in New Jersey and I have always been interested in NYU, specifically Nursing since I want to be a Nurse Midwife. My family is low income though and I have heard about how high tuition is in NYU. I have been thinking of first going to community college and then NYU to save money, but at the same time, I don't know if I'd get the same education as I would. 

I would also like to know how the classes are there for nurses and the possibility of getting in (I have a 3.9 GPA, many extracurriculars and sports, but can't take my SAT right now)

Thank you so much everyone!",1587341092,1,0
How much money does ap credit save per gen-Ed class?,,1587333577,1,0
Is anyone else going to take a semester off if we're still online in the fall?,I'm seriously considering it since I don't know if I can handle another 4 months of online classes,1587329841,1,0
