title,selftext,created_utc,score,total_awards_received
physics BS vs BA?,"prospective transfer student here. when selecting a major on the application there's either a ""physics"" or ""physics (bachelor of science)."" i'm aware that the difference between them is mainly just coursework, but is one more competitive than the other? i'm not sure which one is the best option for me right now (it would depend on how many of my current courses transfer over) but would i be doing myself a disservice by selecting the BS option? (is it harder to get into?) thanks in advance!

sorry if this isn't the right place to post this, i've done some research on this and i'm coming up blank :/",1585095322,1,0
pass/failing CS courses,[removed],1585095082,1,0
NYU transfer process?,"Hey guys, I am applying to transfer to NYU for this fall 2020. I am a freshman in college now so I submitted an official transcript with my Fall 2019 grades, but I was wondering if they would ask me to submit another transcript with my spring 2020 grades on them as well? Like how can they make a decision based on one semester of grades. Thank you.",1585091819,1,0
Pass/Fail should be mandatory,"This whole opt-in Pass/Fail thing NYU is doing is silly. It's trying to not let economic inequality heavily affect academic performance, but all it does is stop kids who are heavily affected by the Coronavirus from tanking their GPAs. Some kids will return to homes that are sitting on a lot of money and will be able to perform at the same or even better academic level as they did at NYU. However, others will return to homes in which both parents have been laid off due to Covid-19 and they don't know where their next meal will come from. Many of these less wealthy students will end up Pass/Failing their classes, and the wealthier kids will get the letter grades. The wealthier kids will be able to boost their GPAs, and the less wealthy kids will not. THIS IS NOT FAIR. We should not allow academic performance to be more a reflection of economic status rather than merit. Also, many employers will see that students pass/failed a class instead of getting a letter grade and assume they didn't do well or didn't try as hard as those who got a letter grade. One of the main purposes of pass/fail was to take the stress off of students. But it does barely anything, as many students will be just as stressed, as they would much rather have an 'A' than a 'P' and will work as hard as if we were under the regular grading scheme.   


Columbia, MIT, Smith, and many other colleges have implemented Mandatory Pass/Fail and NYU should follow suit.   


This article from the Chronicle of Higher Education better explains why mandatory pass/fail should be implemented   


[https://www.chronicle.com/article/Make-All-Courses-Pass-Fail-Now/248281](https://www.chronicle.com/article/Make-All-Courses-Pass-Fail-Now/248281)",1585082534,1,0
"Music &amp; mental health, + daily COVID-19 mental health tips for students","Hey everyone! Our best wishes &amp; prayers from San Francisco - hope y'all are hanging in there in NYC :(

If any of y'all listen to a lot of Spotify and are stressed with everything that's going on with Coronavirus / life etc., would love it if you check out we're doing at Ensu. We've been an app to help people use their music listening (Works with Spotify only atm) as a tool to understand and manage their mental health. There's also a big social component in the app which makes it really easy to be able to check in how your friends / loved ones are going emotionally, and support each other in this crazy time.

You can [download the app here](https://ensuapp.app.link/DmgVeRJC74). We've made it free for everyone :)

Separately - We're doing daily coronavirus related tips on little things you can do to feel better in this time: [https://www.instagram.com/ensu.app/](https://www.instagram.com/ensu.app/)

We also have a discord server where we're working more closely with students on what we're doing, if you're interested please DM me and I'll send you the invite for our server :)

Hope it's helpful! Please share / tell your friends who are going through difficult times, if you like it!",1585078993,1,0
[advice] MPH in NYU,"
I got accepted by NYU, does anyone get their MPH from NYU? How is the program and social network, is it easy to find a job after graduation?",1585076960,1,0
Pass/Fail CS major classes?,Anyone know anything? I’ve lost any sort of motivation I had to do well in Operating Systems lol,1585065193,1,0
None of the professors even know what’s going on and it’s absurd,"Sitting in my statistics “class” right now and the professor has no idea what’s going on, no idea if we’re having more exams or if he wants to ditch em and pass/fail all of us, or if the departmental curve is still applying this semester. This is so embarrassing they’re not even communicating with the professors well.",1585063425,1,0
Pass/Fail Deadline,Does anyone else think the deadline for pass/fail should be moved to after finals instead of may 12th? That's what rutgers is doing.,1585060064,1,0
Accepted to MS in Applied Statistics for Social Science Research. Any insight?,"I was recently admitted for a master's in applied statistics (ASSR). The deadline to accept/decline is approaching and I was hoping to speaking with someone in the program that's willing to share their insight. There's a virtual event scheduled from March 31 but I was hoping to get to know more about the program before then. If anyone's familiar with the program, I'd really appreciate it if you could comment here or DM me. I highly value your personal experience!

Also, I'm trying to find reviews about professors (rate my professor) but I can't seem to find many NYU professors on there. Does NYU have it's own site that students post reviews on regarding professors?",1585058944,1,0
#coronavirus #hospitality #nyc,,1585046649,1,0
does palladium have singles in suites for undergraduate students?,"Any idea which floors they are on? Each palladium floor plan is different 

Also, any idea what an SIH suite is? it’s listed for the themed engagement communities in the 4th. 5th and 6th floors",1585033780,1,0
Deferring a semester or year before enrolling,"Hey all,

Im a senior in high-school who’s been accepted as a member of the CAS class of 2024 through ED(woo!) However, with the way things have been going in NYC concerning COVID-19 I’m a little worried about attending next year. NYU has been my top school for a while and a big part of what attracted me to it was the campus(or lack thereof) I figure that if my first semester of freshman year has to be online, I’d honestly rather defer admission for a year and experience what NYU has to offer the following year. I’m hoping to see if any of you have done this/know people who have and could comment on what it’s like readjusting after a year off, specifically at NYU.  

Thanks!",1585026032,1,0
Transferring from UC School,"I'm interested in transferring to NYU CAS (or Stern) from a mid-tier UC school (Irvine, Davis). Is this possible/what's the transfer admissions rate? How do I make myself a competitive applicant? Would really love if I could chat with someone about this. Thanks!",1585025948,1,0
Steinhardt MA in Educational Theatre and English 7-12,"Hello!

I'm currently a fourth year student at another university in an integrated Bachelor's/Master's teacher preparation program for Elementary Ed. I'm thinking about applying to NYU for a second master's in Ed. Theatre and secondary English. I'd love to hear your thoughts on the program or any related Steinhardt programs. 

Thanks!",1585017738,1,0
Who should I contact if I forgot something in my dorm?,"In the survey I said I will remove all my stuff from my dorm but I forgot something important in the living room after I already signed out. Good thing is my suit mate still has all his unpacked stuff in the dorm since he went home before spring break and didn’t come back. I texted my suit mate but is there anyone else I can call to make an arrangement to ship my stuff to me? I’m not sure if they would just assume that the object is my suit mate’s and just ship it to him.

Thank you so much.",1585014486,1,0
Tisch Got Corona,[https://nyunews.com/news/2020/03/21/tisch-covid19-cases-confirmed-email/](https://nyunews.com/news/2020/03/21/tisch-covid19-cases-confirmed-email/),1585006483,1,0
Sprintax discount code,[removed],1585004178,1,0
SEO/SEM Temporary Position Opportunity,"Our company is looking for an experienced SEO/SEM Copywriter who is a junior, senior, or master student. 

PLEASE DM ME, IF INTERESTED! （With Portfolio or Website, if you have.）

Assisted on

\- Optimizing copy and landing pages for SEO/SEM

Required

\- Native Speaker interested in writing and editing

\- Communications/Business/Marketing major preferred",1584994847,1,0
CAS Pass/Fail,Does our professor know if we choose to take their class pass/fail? Is there a reason at all to tell them or not tell them? It's a small class with maybe 15 people in it.,1584992978,1,0
Pass/fail option in CAS - a few questions,"CAS Dean Gene Jarett:

&gt;Please note that **the Pass/Fail option can apply toward fulfilling the requirements of the Core Curriculum or a department elective**.  Your request to apply Pass/Fail toward a major or minor requirement must have approval from the originating department.

Director of Undergraduate Studies (Economics):

&gt;The department **will accept any courses taken in Spring 2020 on a pass/fail basis towards the economics major or minor**, in accordance with the CAS exception for the current semester.

Math Department:

&gt;Please note that for Spring 2020 only, **math majors will be permitted to pass/fail major requirements**. If you elect the pass/fail option for a course and receive a P, the course will be able to count towards your major and to satisfy math course prerequisites. 

&amp;#x200B;

1. Does this mean that I (as a math/econ major in CAS) can P/F a Data Science course taken as a general elective and receive the 4 credits after passing the class? *Basically, despite not counting towards GPA, does passing a P/F course still award credit as usual?*
2. Will they be approving *any* P/F petitions this semester (within the limit of 2 courses P/F)? Or will they be as strict in asking for proof as before?

My pea-sized brain is having trouble understanding the changes to P/F policies right now... forgive me for this. Any clarification would be greatly appreciated.",1584992562,1,0
Pass/fail option in CAS - a few questions,[removed],1584991178,1,0
Pass/fail in CAS - credit awarded?,[removed],1584989932,1,0
"Coronavirus crisis in New York: As doctors warn of “our Chernobyl,” state government plans Medicaid cuts",,1584989435,1,0
Older student; am I screwed?,"To make a long story short, I royally screwed up my first attempt at university, and now after some soul-searching, I’m coming to NYU as a sophomore transfer this fall.

Thing is, I’ll be 25 when I start here. I’m not worried about dorming, because I’m currently renting an apartment in Alphabet City the size of a shoebox.

What I am wondering however, is how socializing is gonna work out. Making friends, joining clubs, nightlife and frats. Will I even be allowed to pledge for a frat?😂

I know that I’m being neurotic and 25 is like still college-aged kinda, and I’m not exactly gonna be immediately identified as the “old guy” whenever I walk into a room, but I feel like I’ll already be starting at a disadvantage socially since I’m a transfer and I live off-campus.

Is there anyone else that can relate?",1584987249,1,0
Stern Pass/Fail policy questions,"I bombed a midterm worth 30% of my grade for foundations of finance and was wondering if I am able to pass fail it with the new policy despite it being a concentration requirement. If I did, would I still be eligible to take classes for my concentration next semester or would I not be allowed since I pass/failed the concentration requirement prerequisite. If I can't I'll just take the GPA hit I guess but I'd rather not. Also, would it look bad to employers if I chose to do this?",1584983665,1,0
External Transfer to Game Design,"Hi so uh basically I am conducting an exploratory inquiry into the prospect of trying to transfer to Tisch's game design program. I (a first-year) am currently at northwestern's medill school of journalism and - to put it lightly - am not at all a huge fan of the program or just NU.

So like, do you like it? :)

Also, the thing is that like if I were to transfer in, I'd be entering the program during my junior year...Is that not a problem?

But hey, enough of what I think. What do you guys think about Splatoon 2?",1584982627,1,0
"Please, Please, Please fill this out. NYU is an institution with an enormous amount of money and influence, but nothing will be done to help those in need in our community unless we, the students, fight for action.",,1584979479,1,0
I failed Foundations of Finance takehome midterm very hard should I consider pass/fail?,[removed],1584976331,1,0
I absolutely bombed a Foundations of Finance Takehome Midterm,[removed],1584975426,1,0
I still don't understand why should I pay for the full tuition.,[removed],1584935829,1,0
I’ve never hated a person more the way i hate Allyson Green for these videos and emails she sends us. IM SICK OF IT,,1584930979,1,0
IMA,Is there anyone who got into IMA program in Tisch? Let’s make a group chat :&gt;,1584926384,1,0
Absolutely not ready nor do I want to start classes tmr,"I feel so overwhelmed esp with the news getting worse/things changing each day. The break didn’t feel so bad, I had the time to process everything but my anxiety’s gonna tick with classes starting and it’s impossible to concentrate",1584925666,1,0
CAS Spring 2020 Grading Policy,"Anyone else very upset about the grading policy for this semester? You can only pass/fail 2 classes, and there is no guarantee they will count towards your major if they are major classes. Anything we can do about this?",1584923946,1,0
What’s Byron Court like?,"Hi! I’m a Boston U student who *might* be studying abroad in London this summer (if the program doesn’t get cancelled because of corona). Anyways, we are supposedly going to be housed in this residence called Byron Court, which is a NYU residence. To anyone who has lived here before, can you tell me about it? Are the rooms nice? What is located near the building? Would you recommend I choose a twin, triple, or quad if I’m going random? Etc. thanks!!",1584908721,1,0
Anyone willing to let me sit in on their courses?,"Hi guys, strange request but I graduated January 2020 with a degree in Biology and had a job lined up that ended up getting pushed back into late spring, so I've been thinking about taking online courses in biology or learning how to code while I'm holed up in my house.  With all NYU classes going remote, is it possible if anyone can offer me the opportunity to can sit in on some lectures on any classes related to biology or even programming/biostatistics? Part of me is also really curious as to seeing what the online courses on Zoom look like. Thanks!",1584907323,1,0
Is CAS introducing a similar Pass/Fail option that other NYU schools have offered to students?,,1584906739,1,0
Free CompSci Tutoring,[removed],1584905062,1,0
Where will we be relocated?,"Those of us who are staying in residence halls, any idea where we'll be relocated and if they'll help us move? It's not Lipton or Weinstein and I'm guessing it has a dining hall so maybe Palladium?",1584901366,1,0
Can I still take Open Arts courses if I transfer into Tisch Film as a junior?,"Just looking ahead and trying to see how much wiggle room I'd have overall outside of the required curriculum and while trying to keep my credits in check.  I'm aiming to supplement the liberal arts + required courses with more of my interests.  

If anyone could answer, it would be much appreciated.",1584896692,1,0
Anyone displaced (in NYC) by housing please hit my line. Need to sublet,"Mods feel free to remove if this is inappropriate—I don’t have Facebook and know that plenty of users on here have been displaced by NYU booting everyone out of the dorms.

I’ve also had to pack everything at the drop of a hat and head home, leaving behind a furnished apartment. 8-10 minute walk from campus, cheaper than any dorms. If this interests you please DM me and we can talk. Be safe!!",1584892783,1,0
I write papers for $10/page,Can provide samples of my work. I am an English major who scored 100% on the COMPASS test for English. I am unemployed due to COVID-19. DM me if interested.,1584892284,1,0
NYU choose your own adventure part 2!,"Last time was a smashing success so it's time for part 2. You're a senior, less than two months away from graduation. Your life gets flipped-turned upside down when you find out you have to vacate your dorm. You're presented with two options - find an apartment somewhere in the city or hide out in your dorm building somehow. What do you do?",1584891651,1,0
*IMPORTANT* How to use Zoom COMPLETE TUTORIAL,"Guysss if yall like me and don't know how to use the ZOOM online thing we are about to use, my friend made a really nice video explaining how to use it! Hit'em with some luv while we all quarantined :/

This should help out anyone about to go into their online courses soon!! 

**Tutorial Vid:** [https://youtu.be/ZlZLBr9on-I](https://youtu.be/ZlZLBr9on-I)",1584855681,1,0
Just hear me out here,"What if students just refuse to leave the dorms? It would take NYU months to get official eviction orders for everybody.
Remember that many international student cannot leave the country because of their visa status or because flights back home might not be available or affordable for them. NYU really f*cked a bunch of good people here.
Here’s an inspiring story on students who did a similar thing before: https://dailycollegian.com/2008/09/butterfields-legacy/",1584419224,1,0
NYU Foreign Language Placement Exam Question,How do they administer these online without having students cheat?,1584419033,1,0
Any info on the process of having our stuff shipped to us?,"It is super irresponsible of NYU to force those of us who went home over spring break to move out on short notice. I can’t fathom who and why they thought that this would be a good idea. Quite frankly, I hope all this backlash causes them to alter their decision. 

In the case that they don’t, how are they gonna go about shipping our stuff to us? I have a lot of stuff. Will they be able to ship all of it back? How will they know to not mix my stuff up with my roommate’s? 

The lack of transparency throughout this entire experience has shown that we are giving $70k a year to people who are completely incompetent.",1584418827,1,0
Google form where you can share your feedback about NYU's handling of the outbreak,,1584417778,1,0
IRHC Releases Demand Action Regarding NYU Resident Eviction,,1584417198,1,0
do nyu profs use canvas (for CAS mainly),,1584416858,1,0
"Hi all! I would like to know if anyone here is attending part-time LLM as a foreign student. I’m planning to apply this year, so would be glad to get some feedback. Thank you!",,1584415109,1,0
Library Books????,"I have 3 books checked out from the library, and now Bobst is closed and we're all supposed to go home. What am I supposed to do with the books? Is there some return on the exterior of Bobst I've missed? Or did I miss something saying we had to bring them back earlier? Everything I'd seen from the school until today seemed to say the libraries would still be open",1584414409,1,0
Did any other students receive this email/know how and why this kid replied to the whole school?,,1584410181,1,0
I rely on financial aid to pay for off-campus housing...,Anyone else in this situation? Am I going to have to give back the remainder of the semester's rent? I committed to a lease. This is so irresponsible on NYU's part.,1584409123,1,0
Are people actually going to fly back?,"For those of us who left stuff in the dorms, but are now at home and out of NY, are people going to fly back and get their things or wait to see what happens with NYU's ""packing service""? 

I am in no position to fly back at the moment so I've got to leave it to NYU. But they've given virtually no information and that form we filled out basically said ""we'll contact you later"".",1584402175,1,0
As an international,I can’t even go home,1584401332,2,0
Can you help by taking a 2-minute survey?,"Can you help out 3 UX Design students by completing our brief survey about making medical appointments? Thank you!
https://docs.google.com/forms/d/1ispanAcjJ8gocgsio72vyebjpeNhCixSVVUNBtSDcwU/edit",1584400913,0,0
will federal work study/student employees still get paid?,"I work at Tisch as apart of my federally granted work study, and i know that a couple days ago they sent an email stating that we would continue to be paid our scheduled hours while in remote classes. I was wondering if anyone knows if that’s changed now that the school has essentially closed all the way down, and if anyone knows who to contact to find out more info.",1584399050,1,0
This is dumb,"Regarding recent news that students have to leave residence halls:

1. Not everyone has a home to go back to.
2. Travelling by plane is incredibly irresponsible in the current situation. I would be flying from NYC to another coronavirus hotspot in California. I also have asthma and was ready to self-isolate for at least a month in my dorm. Now, I have to risk getting the virus and spreading it to my family at home.
3. Students have to pack and handle all the logisitics of moving while studying for exams and doing homework due next week.
4. Students who went back home for spring break will supposedly have their belongings sent to their homes, but by who? How would they be able to tell whose things are whose if there multiple people share a room? It's a gross breach in privacy.

I honestly don't know what's going on. Please just end the semester (including online classes, because many students are missing out on lab work and in-person experiences they are paying for) and partially refund tuition and dining plans.",1584397174,6,0
Leaving the US for the semester,"Hi! I am an international graduate student at Tandon. Right now, I am not sure if I should leave the US before my home country closes its borders with the US too. 
I was wondering how many of my fellow international students are planning to leave the US for the remainder of the semester.
Stay safe everyone.",1584397004,1,0
Thoughts on graduation being cancelled?,"I would be so upset if graduation is cancelled, but it seems that’s a very real possibility. Does anyone have any thoughts or know anything?",1584396935,2,0
Pass/Fail should be expanded,"I just heard from a friend at Carnegie Mellon that all undergrad student are permitted to convert any course to pass/fail grading. Let’s face it, Zoom is a sh*tshow, NYU should follow this same policy",1584393652,2,0
shipping out. weed and alcohol in dorm...,[removed],1584392783,1,0
See you guys next August.,"RIP 2020 Spring semester.

Stay safe out there guys!

Press F to pay respects. ",1584392461,2,0
This Shit is Ridiculous,There’s no way flattening the curve is worth all this trash. Change my fucking mind.,1584392209,1,0
"Tuition refund due to coronavirus Shutdown. If Harvard can do it, so can NYU",,1584391702,2,0
NYU wants everyone to move out by Sunday March 22 and will have online classes the rest of the semester.,,1584389346,7,0
NYU's closing residence halls.,,1584389115,1,0
Zoom,"Anyone want to send me there zoom codes so I can listen into lectures, I will be very grateful",1584373929,1,0
Catan game?,anyone have access to catan and or want to play?,1584330248,1,0
"Well, see you guys in August",,1584317833,1,0
"Well, see you guys in August",[deleted],1584317791,1,0
Cancelling whole semesters?,University of Massachusetts - Amherst has cancelled the Spring and Summer semesters in their entirety. How likely is NYU to follow suit?,1584315487,1,0
Does Gallatin offer individualized minors as well?,I’m an admitted Class of 2024 who got accepted to Tisch dramatic writing. I’m wondering if I could minor in some thing related to acting but it doesn’t look like there are any specific minor programs for acting or drama. I was wondering if I could pursue that route through Gallatin or maybe have another program that interests me. Thanks!,1584306882,1,0
Psychology Masters Acceptance Date,"Would anyone happen to know when applicants for a masters in psychology will receive the decision on our applications? The website said decisions come out any time from late March to several months from now depending on the major, but I can't find anything about the dates for specific majors. The deadline was March 1st so I'd imagine it'll still be some time before I hear back, but it's always nice to know when to expect a response. Thanks!",1584301215,1,0
Announcement from Governor of NY,"Cuomo just spoke live and said the following:
1. He wants the US military to come in and turn buildings like college dorms into emergency hospitals.
2. Every projection shows that this will overwhelm the healthcare system. 
3. “We have no options.”

People, especially if they are young and healthy, can transmit the virus, even if they have NO SYMPTOMS. If you are reading this, you can’t claim you were not warned. 
If you are college aged and you get the virus and happen to need hospitalization, your life will be prioritized. You will probably live, but you will be the reason an older person will be taken off of support and left to die. This is already happening in Italy.",1584295299,1,0
