title,selftext,created_utc,score,total_awards_received
CORONAVIRUS- too soon?,,1580103732,1,0
CORONAVIRUS - too soon?,,1580099201,1,0
The best way to get organized for coursework,"If you haven't tried [syllabuddy.com](https://syllabuddy.com/), you should.

It automatically transfers due dates from your syllabus to your Google/Apple calendar.",1580088183,1,0
"I got invited to a group thing, just wanted to verify it’s legit and I’m not gonna get my school email hacked.",,1580087153,1,0
"nyu wifi, you aiight","&amp;#x200B;

![img](vdk98gkyc7d41)",1580079130,1,0
Laptop for Stern + Cs,[removed],1580072774,1,0
Which operating systems section to take?,[removed],1580069292,1,0
Is a MBA in finance here worth the money?,,1580061403,1,0
NYU Summer Housing - how long do applications take to get a response?,"I'm a ""Non-NYU, Not Affiliated Applicant"" (meaning I'm just here for the summer to do an internship), and I was wondering if anybody knows the timeframe of applications to the summer housing program? I'm a little nervous as I'm pretty late to apply; I could have applied as early as two months ago but I spent a lot of time reviewing all my options. I couldn't find any information about the acceptance/rejection timeline of an application, and was looking for some anecdotes and y'allses experiences :)",1580056564,1,0
Greenwich Hall?,"Freshman probably applying for upperclassmen dorms here. I want to know a little bit about Greenwich hall. Someone said it has roach problems. Is that true? And does the cleaning service actually come on a regular basis (ie when they’re supposed to come)? They have singles, right? 

I’d probably be applying for a single studio and I’ve heard it’s easier (?) to get singles there. And overall, how do/did you like it?",1580056341,1,0
graphic design or art clubs,"as club fest approaches, does anyone know of any graphic design, art, or design centric orgs on campus? just looking to be more creative this semester with a cool group of people",1580028471,1,0
Intro To Food Science Help?,"TL;DR: Can I use the knife of my choice in the lab section of this class or must I use the knife in the assigned chef kit?

Alright so I'm taking Intro to Food Science (NUTR-UE 0085 I think) and it's the most base food class one can possibly take. However, it says I must purchase from the NYU bookstore the NYU chef's coat, an NYU baseball cap, and an NYU Chef's kit, which includes an instant read thermometer, an 8 inch chef's knife, and a knife sheath. 

I'm very excited to take my first culinary class, but I must ask, to anyone who's taken this class before, are you allowed to use a knife other than what is provided in the chef's kit?",1580020563,1,0
liberal studies to stern,"Has anyone experienced this transfer process or have any tips someone should know? Classes to take, feasibility of being able to transfer, possibility of transferring in one year instead of two? LS advisors haven’t been really clear about  what to do (or maybe I just haven’t been asking the right questions) but I’m pretty nervous of taking the “wrong classes” this semester especially since I don’t want to be an Econ major if stern doesn’t work out.",1580004555,1,0
Anyone taken Math 228 (Earth’s Atmosphere &amp; Ocean) before?,"Hi guys! It’s my first semester at NYU, and among the classes in my course load, this one seems most difficult - especially since it’ll be the first math class I’ve taken since community college. It’s also with a professor called Laure Zanna, who I can’t find on rate my professor.

Can anyone share their experience with this class or professor? Thank you!!!",1579987492,1,0
Easy Electives for Sternie,"What are some easy 4 credit electives you guys recommend. Preferably with a light workload, was interested in creative writing but put off by how many assignments I saw on the syllabus.",1579968777,1,0
Discount code for nyu merch,,1579942383,1,0
Hack NYU 2020,"Hey, so I’m an incoming graduate student studying in the Management of Technology program at Tandon, and I was curious to know if anyone would be interested in forming a team for HackNYU. 

The website says it’s scheduled from 3/6-3/8, and teams I believe are around 4 people (don’t quote me, pls fact check) 

So .. yeah. If anyone’s down, lmk! It’ll be my first time at HackNYU, not my first Hackathon tho",1579913617,1,0
Life Science Brain and Behavior textbook,"Hello! If anyone is taking the CAS life science class Brain and Behavior with Professor Schneider this semester, I’m selling the required textbook “The mind’s machine” for $80 (originally bought for $150 from amazon). Gently used, looks like new. PM if you’re interested.",1579904466,1,0
Current CAS student looking to Transfer into NYU Film &amp; TV with a question,How important/advised is it to have an actual completed film in my creative portfolio? I’m struggling with getting a camera in time for the deadline and I’m considering submitting the script as my creative submission. Will that hurt my chances? Also any general advise would be helpful.,1579876667,1,0
Reading materials for cybersecurity bridge program,"Wassup yall. I start the cyber security bridge program in March 2020. I just wanted to know what materials I should study/read to prep myself in advance.

If anybody is currently taking or had taken it. I would love to know about your experience, assigned materials..etc",1579844992,1,0
Does anyone have experience with taking a personal leave of absence?,[removed],1579838539,1,0
Get fit with me plz,[removed],1579834723,1,0
French texbook so expensive.,"I am taking Elementary french this semester and the textbook required(En Avant) is sooo expensive. It's $146 in the bookstore and even more on Amazon!!. I am compelled to buy this book since I need the access code too for online assessments.

Is there anyway around this or am I stuck?",1579834299,1,0
transferring from nyu wsq to nyush lol,I know most people want to transfer from NYUSH to WSQ but I want to do it the other way around! Does anyone know what the process for this looks like/how hard/easy it is? I figure since so many people want to transfer from NYUSH to WSQ it must be somewhat easier?? but also I think NYUSH/WSQ might deny all of those requests so maybe it’s just not possible,1579833832,1,0
"[Tip] You can make 2FA less annoying by using a different ""authenticator""","Just want to share some methods to make 2FA more convenient when using a **trusted** computer (a.k.a your personal laptop) without (too much) security sacrifice. 

You can check out the general instruction at [https://github.com/quangIO/no-duo-lockout/](https://github.com/quangIO/no-duo-lockout/releases/)

![video](e96794bhvmc41 ""Fake u2f device"")

![video](5fkfp2bhvmc41 ""pass code generator as a browser extension"")",1579831864,1,0
nyu summer classes," Hello. So, I was looking at courses to take over the summer, and I'm torn between taking Social Foundations III and Cultural Foundations III, or one of those and Life Science which is online. Has anyone taken any of these classes in the summer and has any advice on what to do? Or can attest to how easy/difficult online classes are? Thank you in advance.",1579830845,1,0
Summer Classes Help,"Hello. So, I was looking at courses to take over the summer, and I'm torn between taking Social Foundations III and Cultural Foundations III, or one of those and Life Science, which is online. Has anyone taken any of these classes in the summer and has any advice? Or can attest to how easy/difficult online classes are? Thank you in advance.",1579829624,1,0
NYUSH coronavirus,"I know that the schools communicated a bit on it and that as of now classes are still starting as scheduled, but if the WHO declares this an emergency or cases grow in shanghai, what would the schools reaction be? 

If they were to postpone/cancel the semester, would we all just be forced to take a semester off? Would they send us to study away sites? Would they start classes late and run into the summer?",1579804115,1,0
NYU vs Fordham vs University of Maryland?(computer science or information science)? Is it worth it?,"So I am currently thinking about going to these schools and which one should I transfer to? I live near Manhattan in a nice neighborhood and because I am instate, I would be getting some possible aid from NYU and Fordham. I would most likely get my own place like apartment near the schools and would want to major in computer science or information science. The reason I also applied to Maryland was only because of the ranking of its computer science program. I didn't like the campus, I am not the typical college student and don't really care about the traditional experience all I want to do is make friends and go to a good school to earn some money. I actually feel very uncomfortable going to Maryland and am attending it and it just seems weird for me. I didn't make any friends, most kids here are from maryland so its hard to actually find something common with them. Its like a culture shock like im in a different country. I am currently a sophomore and will be attending UMD for this spring to but as a junior I feel like I should go somewhere else. Since I transferred to UMD from a CC. I would be graduating about a year and a semester late so I feel like id rather go somewhere I feel comfortable and just keep working hard. I have heard the tandon at NYU for CS is not good and the main campus CS is part of the arts college at NYU. I was also thinking about information systems and dont know how that is ranked at NYU. Fordham I would go to the lincoln center campus not the bronx and I have heard its really bad for computer science so I would have to go into information science business. Now, I feel comfortable at NYU or Fordham due to it being close to home and I can connect better with the people. At maryland, I just don't like it at all and if it wasn't for the computer science program, I would have never applied. Now the cost is also changing my mind. I did not get aid at all and am paying 37k a year for tuition without room and board. I think I can lower my Fordham tuition or NYU. Is NYU as bad as they say for comp sci? Is Fordham as bad as they say? Should I suck it up and suffer and just graduate from Maryland? Being isolated here I barely talk to anyone and can't even get connections with people due to it being hard just to live here. I just don't know what to do? Any suggestions?",1579798198,1,0
Summer Sublease,Looking to sublease a room in the city for June and July.,1579798041,1,0
Coronavirus,Am I being reactionary or is it right to be concerned about the coronavirus with classes starting next week? Especially considering a large portion of the students here are international students from China. Plus we all know how crowded the classrooms can get (so more easily spread).,1579761217,1,0
Paying to get off waitlist: Intro to Microeconomics?,Would anyone be taking ECON-UA-2 next semester? Paying someone to get off waitlist,1579746959,1,0
Textbooks for Good Prices!!!!,"PM me the textbooks you need, and ill get you them for a good price!",1579746559,1,0
Application,"I'm looking to apply for the Food Studies Master's program, but wouldn't be starting until next spring. The website says decisions for spring semester usually begin going out in November, which I know is a long way away, but does anyone have any idea around when the application for the Spring 2021 semester will be available?",1579738978,1,0
NYU ID q - new student,"hey\~

I'm an incoming steinhardt music grad student, so I have to take placement exams before the semester starts. My problem is that I don't have a proper updated ID (I do still have a green one from a workshop this past summer) yet and don't think I'll be able to get one before the exams (tomorrow ew). Any other steinhardt students/other departments been in a similar situation? Hope they'll let me in to take my exams lol",1579709734,1,0
Tandon math diagnostic,"Since I didn’t find too much useful information about math diagnostic, I’m going to leave a post here so fresh student next year can probably see it.

First attempt test is Super easy, there is NO calculus at all, not even basic derivative. Mainly basic algebra and one or two logarithm questions. Trigonometry was mentioned in the exam prep but did not present on actual test either.

Source: just finished the diagnostic minutes ago.",1579708972,1,0
Taxes on Scholarships?,"Hi, I’m a freshman (Tandon) and I recently received an email stating that my Scholarship may be taxed. And that I myself must figure it out with my personal tax advisor. Since when have scholarships been taxed? Is this only at NYU? And why am I only learning about this after I’ve already made a payment?",1579708390,1,0
NYU gear,[removed],1579667724,1,0
Music Producers/Artists at NYU?,Is there any club or org for music prods and artists at NYU? I want to meet others w similar interests.,1579662472,1,0
Does Rubin Hall Single Dorms have a bathroom in the room?,,1579658744,1,0
Stern Ph.D,"Hello Guys,

&amp;#x200B;

I am here to see if any of have info on the Ph.D program at Stern, I would like to student profiles as I plan to apply for in the future. Also please let me know if I can gather any information that could be useful in this regard.

&amp;#x200B;

Thank you.",1579653046,1,0
I can’t be added to the NYU FB group?,"I put my NYU email in several times and have not gotten a confirmation email from the Facebook group. I’ve been doing this for a few days now. I checked my spam folder too - nothing.

Any of you in the FB group can figure out what’s going on or who I can contact?",1579644157,1,0
How much debt do you guys have?,Honestly just reading up on how much is costs to be at NYU and wondering how much private and public (federal) loans you guys have.,1579639728,1,0
urban dancing club??,hey guys! i know nyu has toooons of clubs but for some reason i couldnt find urban dancing? do they even have one?? ive always wanted to be in a team or just attend to learn cus im no dancer by any means but i think it would be fun. does nyu compete in any dancing competitions? thx in advance xoxoxo,1579639480,1,0
Residential Hall Programs?,"Hey there. I’m applying for freshman housing right now and I came across people talking about certain residential hall programs/benefits. So I was wondering, what are the different programs or benefits for each of the freshman residential halls?",1579627601,1,0
Question about the IDM Program,"Hi, I'm currently an undergrad at University of Central Florida as a Digital Media: Web Design track major. I saw NYU Tandon's masters program of Integrated Digital Media and it *really* caught my eye. I already know how tough it is to get into; however, I was wondering if \[those who are in it\] think it is worth it. I read some posts on here where people recommend not doing this program, but those posts were from about three years ago. Any advice would be appreciated!",1579626406,1,0
I got a 93.25 and I got an A-. Where should I appeal?,"Hello

I got a 93.25 in a class and I got an A-. I just realized this today after calculating the score I got. Where shall I appeal? Should I contact the instructor? Or is there somewhere else I should contact?

&amp;#x200B;

Thanks",1579581950,1,0
Go and attend a Gallatin seminar that I am waitlisted for??,"Hi everyone! 

I’m on the waitlist for a few IDSEMs in Gallatin and I was wondering if I should still go to the classes during the first week in the small chance that I might get off. But at the same time, I’m not sure if that’s impolite or awkward especially if I don’t end up getting off the waitlist. I’m a relatively new student and the classes do tend to be pretty small so I don’t want to embarrass myself in front of the professor and everyone else, if that makes sense. If anyone has any advice on what I can do or what the proper etiquette is, I would really appreciate it!",1579546589,1,0
NYU Summer Housing,"What’s up guys, I’m not an NYU student but I’m looking into NYU housing for this summer for my internship. From the portal, it gives me the option of Broome, Greenwich, or Lafayette Hall. Was just wondering if anyone could give me some details about what kind of amenities are included in these spaces and if one is better than the other (they’re all $4800) for the 3 month summer term",1579542728,1,0
Vailable - scheduling app for student organizations (a better when2meet),"I’ve noticed that a lot of student orgs and communities use [when2meet.com](https://when2meet.com/) to schedule board meetings and campus events. However after using the app myself, I found that the frontend design is very unattractive and makes it really hard to schedule/enter availabilities on mobile.

I created a new version of when2meet called Vailable ([vailable.io](https://vailable.io/)) that keeps the best parts of when2meet but has a cleaner frontend and more functions. It's totally free and allows you to view people’s availabilities to choose the best meeting time. I've already migrated a lot of Yale students to the platform and it has been working great so far. I'm really excited to see it help student groups at NYU as well!

If any of you have any suggestions or features that you would like to see implemented. Please let me know!

https://preview.redd.it/ce1ji92dsyb41.jpg?width=484&amp;format=pjpg&amp;auto=webp&amp;s=b7286859bc123a29f8cabc4eb52f842783af0dc9",1579539504,1,0
"Looking for tutors with subject such as SAT,SAT Subject,ACT,AP"," Hello,

Fendodo ([www.fendodo.net](https://www.fendodo.net/)) is a company registered in Hong Kong.

We are an online tutoring and admissions assistance platform committed to providing counseling for admission to U.S. universities and offering curriculum tutoring for various high school courses and standardized tests such as SAT, SAT Subject tests, ACT, AP exams and essay writing.

The admissions support includes consultation on applications, individualized strategy roadmap and interviews practice for major U.S. universities and colleges.

Whoever with top tier college educated background and interested in teaching is welcome to apply for the adviser position with us. Work schedule is very flexible and we will pay progressive hourly rate ranging from $35 to $60 in USD, depending on your experience. Both seasoned and novice tutors are wanted. We have a professional team with expertise in online tutoring to provide you with guidance for delivering the pre-set lesson plans effectively to our students.

If you have interest to apply,please fill in the form in below link. [https://docs.google.com/forms/d/1SW9E7MNvLaOT6KDM\_zxVoi1n2yJ9yN0bolGveppbUy0/edit](https://docs.google.com/forms/d/1SW9E7MNvLaOT6KDM_zxVoi1n2yJ9yN0bolGveppbUy0/edit)

If you have any questions,feel free to chat or message me.

Thank you!",1579514868,1,0
course offerings question,"hello! i was looking on the required courses for the linguistics major, and some of the classes say ""offered every year"" while others say ""offered every fall/spring."" does anyone know the difference between the two? does that mean some classes are only offered one unspecified semester a year? thank you so much in advance!",1579493132,1,0
Computer Security Elective,I'm thinking about taking this elective as a CS major and would like to hear some people's opinions on the class if they've taken it. Was the course hard for anyone and was the subject material interesting? I'm hoping that the class is a lot more engaging than something like CSO which really put me to sleep.,1579492732,1,0
Chances of getting into NYU as a transfer student?,"Currently a Chapman freshman. I have a 3.37 college gpa and a 3.67 HS GPA. 1290 SAT, 3 HS awards, 1 varsity sport, 7 AP classes, and 200+ hours of volunteer work. I’m going to try to be an English major at NYU, w a journalism minor. What chances do you guys think I have of being accepted? Thanks",1579486413,1,0
Financial aid disbursement,"I saw somewhere that disbursement was supposed to happen 10 days before our first class, but I have not received any email confirmation nor payment. Anyone receive their disbursement yet?",1579484635,1,0
textbooks,when do we see what we need for the semester? im in gls,1579460519,1,0
How to cancel a meal plan?,NYU randomly added a $2500 meal plan for the spring semester onto my loans and I don’t want it. How do I remove this? I didn’t have one last semester.,1579444946,1,0
Any way to move?,"First year here and my dorm situation has been a nightmare. 

I’m in founders and the two kids in the other bedroom of my suite have been constantly throwing parties and destroying the suite. The bathroom is full of crusted up semen and throw up all over the toilet and sink. Whenever I try to talk to the two of them I get cursed out. It’s gotten to a point where I don’t even think I can use the bathroom anymore. The attempts I’ve made to reach out to housing have just ended with them saying to talk to the RHD and my meeting with her basically ended with her telling me to fill out a room change request and hoping for the best. 

I really don’t think I can live here much longer, is there anything I can do?",1579442873,1,0
Therapy at NYU,Hey people! I was wondering how I could get therapy at NYU. I think I need it but I always get confused on how to sign up for it. I have the basic insurance that all NYU students get if that helps. Help a fellow human out :),1579418279,1,0
Summer Housing Sublet End of May to Mid-August,"Hi! I'll be living in NYC this summer and I am looking for a room during the summer. I am clean, respectful, and accountable. My budget is 1, 500 for a room. If you know anyone how is looking to sublet please send them my way! Thank you!",1579399850,1,0
Stein grad student interested in photography/video,I'm a stern music grad student in my last semester and I'm wondering if there are any good advanced photography/videography classes that I could reach out to the professor for and ask about just auditing the class? I already freelance as a photographer and work for the school as the staff photographer and videographer but I would like to keep honing my skills and meet people with similar interests in the city. Unfortunately I'm out of credits but I'm guessing there's a chance the professor would allow me to audit. Any advice is appreciated!,1579374889,1,0
When do Freshman pick their classes?,,1579367929,1,0
How is my schedule?,"Object Oriented Programming

Discrete Math

Principles of Financial Accounting

Introduction to Microeconomics 

&amp;#x200B;

Is this schedule doable or would it require much work? I'm not too sure of the difficulty of the classes so any feedback would be appreciated! :)",1579366258,1,0
giving away my broadview anthology,"I took writing the essay last semester so I have no use for this textbook anymore, so I figured I’d just give it away to someone who needs it. it’s the third edition.",1579365208,1,0
NYUmedia password,[removed],1579324302,1,0
App Developers at NYU?,"Hey everyone! 

I’m a recently admitted NYU student to the class of ‘24 and have recently copyrighted an app idea that I require aid with developing. Would anybody here know anybody with the skill set to do this who would be interested?",1579320310,1,0
If you chose NYU law over Columbia law: why?,,1579319417,1,0
Can I transfer as a part-time student in community college.,I currently attend community college in South Carolina. I want to transfer to NYU but so far haven’t taken a full load of classes. I’ve taken no more than 3 a semester. Do I have to take a full load to be considered?,1579315132,1,0
Basic Algo + CSO in the same semester?,Hey I’m a math/CS major and I started the class sequence a little later since I switched from economics. I was wondering how fucked I’d be if I took basic algorithms and CSO the same semester? Have any of you done it? Will it be okay or should I just try to push off one of the classes till another time?,1579283384,1,0
Which apartment style housing is closest to Penn station?,,1579272952,1,0
DS-UA 112 How is it?,"As the title says. Since I am also taking CSO and linear algebra next semester, I am not sure if 112 would add too much burden on me. I am fine with the programming part but I am sort of scared of the math involved in 112.",1579244229,1,0
Classes at NYU Superlatives!,"This is the day y'all have been waiting for! Time to grade the classes at NYU. Our Categories:

Best 3-4 credit class: best all around

Best 1-2 credit class:overall best class

Easiest A: you literally don't have to show up and you'll pass

Hardest C-: only take if you hate yourself

Worst class: avoid like the plague

Best entertainer: funniest class

Most boring class: yawn-worthy. Take if you have trouble sleeping

Life-changing class: learned a bunch of gems that will become helpful later

Must take class: class you must take before you graduate

Black hole class: must likely to lose your mind. Worthless, didn't learn anything

Most unforgettable: you wish you could tho

Most unique: or weird or surprising

Life of the semester: makes any semester fun

Y'all can add more categories but the class with the highest upvotes for each category wins.

Let the competition commence!",1579232033,1,0
Is Eating in Class permitted?,"Basically what the title says. I've got a packed schedule as a transfer student, and I'm not too sure if it's alright for me to eat in class (I used to do this in my old university). I'm not talking about a huge meal that would stink up the classroom, just a salad and apple.",1579225627,1,0
Do NYU Apartment-Style Housing have bathrooms in the room?,,1579221935,1,0
