title,selftext,created_utc,score,total_awards_received
"I go to a military academy, but I'm curious about life at Stanford. What's it like for you?","Title says it all! I'm at Annapolis. I had the opportunity to go to a Stanford or Ivy and I'll always be incredibly curious of what life is like on campus-- the atmosphere, the pressures, social scene and so on. This is just me asking out of sheer curiosity and quarantine boredom. Feel free to ask questions to me as well. I'm guessing our lives are pretty different. Lots of respect to everyone here! 

&amp;#x200B;

General questions (but feel free to answer on your own terms):

Are most kids sociable and outgoing, or is it a pretty broad spectrum of personalities?

What do you do on weekends?

Is there a nightlife during the weekdays as well?

Do academics feel top priority, or can you take a breather given you're at a top university?

Do you miss Stanford right now?

&amp;#x200B;

Thanks a lot!",1585885433,1,0
Any current bioengineering majors willing to help out a 2024 admit?,Basically title. Is there anyone I can pm about specific questions regarding Stanford’s bioengineering?,1585881620,1,0
"Dish is closed, it was my only joy of still being on campus.","I walked the dish everyday, now I have even less. 

Life is sad here on campus.",1585879748,1,0
Is it still possible to get face masks anywhere here?,"I've checked a few places nearby but it seems they've been sold out for weeks. Don't want risk spreading coronavirus (not coughing, but some people have it without the symptoms) when I go grocery shopping.",1585879665,1,0
Which selection of classes to take next quarter?,"Thinking of doing one set of these classes this quarter, and one in the fall:

Math 120 + Math 113 + CS 107

Math 171 + Math 108 + CS 109

(I don't want to take Math 171 and CS 107 in the same quarter)

The former supposedly has better professors (Persi Diaconis, K Sound, and Nick Troccoli), but if I do the latter, I could take Math 108, which is only offered in the Spring. Is there anyone who has taken these classes that can offer me some advice? Thanks, and stay safe!",1585877264,1,0
Will CS106B be recorded for spring?,[removed],1585875961,1,0
I haven't even stepped foot onto Stanford campus but I'm already experiencing duck syndrome,"Like everyone's already making friends, making tiktoks with each other, calling each other ona daily basis, and talking to each other in group chats and im just here like 👁👄👁

I feel like I should be doing more but I don't know how - all these friend groups have already been established and I feel a bit out of place",1585875435,1,0
CS161 a BCPM?,Can CS161 count as a math class for BCPM gpa?,1585874224,1,0
Skills class for IR major,"Potential IR major here looking to get skills class out of the way with S/NC this quarter. Any recommendations for which to take? I'm between STATS 60 and STATS 101. For anyone who's taken either – was it useful? Was it difficult, and what was your stats experience prior? Would you recommend one over the other in terms of practical skills being learned? Any advice is appreciated. 

Also wondering if anyone's ever petitioned for CS 106a to count (I know for polisci it can count for their skills class).",1585862184,1,0
Research Labs - Open? Remotely working?,"Hi, 

I was given the opportunity to intern in a university research lab this summer. Because of the covid-19 situation, however, I know I can no longer physically work in the lab this summer. I was wondering if any of you are in Stanford research labs that are still open or are working remotely. Do you think my PI would be open to letting me work on things like lit search remotely? If you had a high school student willing to help, what would you assign him?

I really don’t mean to sound ungrateful and definitely acknowledge the gravity of this public health crisis. I was just really fascinated by the lab’s work and wanted to participate in any way possible. If I suggested things I could do as a high schooler (tedious actions others don’t want to do, perhaps?) to my PI, do you think he would be open to letting me intern remotely? 

Thanks for your help!",1585860993,1,0
This new letter really makes me furious on so many levels,Maybe I m just tired of continuously hearing bad news and empty words from them.,1585860122,1,0
Summer Session + Programs to be Online,,1585859924,1,0
Please help!,,1585851927,1,0
MATH 109 and 110,"**TL;DR: I don't have a strong math background (but I took 51 and 52 and did well). I need to choose between Math 109 and 110. What would be the less overwhelming class between the two?**

I hope you guys are all safe well. I need to choose a math class between 109 and 110 for WIM. The only prerequisite for both classes is Math 51. 

My mathematical background is not all that strong, and it definitely lacks breadth and depth. I have a strong foundation in calculus (so Math 19 through 21), and I got As in Math 51 and 52, the only math classes I have taken at Stanford. 

I am not too sure what to take between 109 and 110.  While I understand that Math 109 and 110 cover completely different topics, I was wondering if I could get some advice on choosing a class that will not be too overwhelming for a someone taking a 100-level math class for the first time. 

Thank you in advance!",1585842122,1,0
Sophomore dorm: community vs. friend group?,"Hi, I'm a rising sophomore torn about what to do with housing. My friends are all planning on drawing into a standard sophomore-popular dorm, and while I love then and definitely want to stay around them, I like the idea of preassigning somewhere else with a more intentional sense of community.

I get easily anxious feeling left out, so a part of me thinks I should just follow my friends to avoid sophomore alienation. A part of me thinks I'll be able to hang out with them anyway and it's more important that I try to meet new people next year and get to know my neighbors. Any advice from upperclassmen?",1585836207,1,0
Is an iPad worth it?,"All the computer-related posts have me thinking about this. I currently have the 15 inch 2017 MacBook Pro. I love it, but it is physically LARGE and a little heavy. Because of the size, I was thinking about also getting an iPad Pro to carry to class and take notes on. Does anyone have any opinions on how well iPads work for note-taking? Is it even worth it if I’m going to take CS classes and will thus need my laptop anyway? I’d love to hear any thoughts on this. Thanks!!!


(For reference, I think leaning towards an MCS/Math/CS course of study- so STEM)",1588693212,1,0
"PSA: Free money for a computer if you get financial aid! (aka real-life, well-hidden Stanford easter egg)","Stanford is wealthier than some small countries, but still reduces undergrads’ financial aid dollar for dollar if a student’s outside scholarships exceed a certain amount. This is some absolute bull and I’m still salty about it even though I am now an old and cranky recent alum. However, stick it to them in the smallest of ways and get a free or reduced price laptop in the process. Find the “Computer Expense Form” on the financial aid website, follow the instructions, and soften the blow of them literally stealing your sweet sweet third-party scholarship money. And never forget that the Stanford football coach, David Shaw, makes a $4 million salary while directly contributing literally nothing to the intellectual pursuits of the school (except attracting some awesome student athletes! respect to you all). ASK STANFORD FOR MORE MONEY ALWAYS. Budget constraints my ass. 

Thank you for coming to my rant. Here is the form. Get off my lawn, Persis. 
https://financialaid.stanford.edu/pdf/computer_v2.pdf",1588667001,1,0
Transhumanism at Stanford,[removed],1588654746,1,0
Fall quarter,[removed],1588648655,1,0
Interest in BASES,"I'm really interested in joining BASES and I'd love to hear more on the club from a member perspective. What do you like/dislike about the club? How much of a commitment is it? I've heard it's competitive to get in, is that true? Is it mostly dominated by MS&amp;E majors/the like?

Thanks.",1588646387,1,0
Stanford uses Outlook instead of Gmail for School Email?,"Hello, 

&amp;#x200B;

I am an incoming undergrad freshman (class of 2024) and I just signed up for my SUNetID. After waiting the 24 hour initialization period, the email login from Stanford's web portal brought me to my new Microsoft account and email. Not going to lie, I was kind of bummed since I very much prefer google and their email services. Is there anyway I can get a g suite Stanford account? 

&amp;#x200B;

Thanks",1588628864,1,0
Any updates on when labs might open back up at Stanford?,"Looks like CA is slowly opening up, any news about when labs might open up (and the timeline)?",1588624694,1,0
Who are the most well known recent Stanford graduates / students?,"Elizabeth Holmes

Brock Turner

Chanel Miller 

are some that come to mind for me.",1588617422,1,0
Scared I’m gna get a 2 or a 1 on my ap test and get in trouble,"So I already cancelled 2 of my ap tests without telling my AOs cause legit my whole school started cancelling them, but I still take AP calc bc next wk. Ive been studying but since its legit just 2 frq im scared i might panic and end up just doing super bad on it and get rescinded from stanford. I worked so hard to this point that I’m gna be so upset if i get rescinded from one anxiety moments. Will this happen?",1588577643,1,0
CS Tracks,[removed],1588552860,1,0
New to the area,"I’m [22F] new to the Stanford area and open to meeting new like-minded people. I’m from Canada and here for an internship. I really enjoy bouldering and hiking, but it’s hard to make new friends when everything’s closed. Looking to get to know some people and make some friends",1588552845,1,0
when are research stipends released?,particularly curis. thank you!,1588548722,1,0
Looking for cool CS research,Does anyone have any recommendations of labs that are doing really cool things or have great PI/PhD students? I'm mainly interested in CS/AI and looking to do serious long-term research.,1588530554,1,0
Any CS people out there care to explain what the Stanford Network Registration Tool exposes you to?,[removed],1588523863,1,0
international student visa,"not sure if this is the wrong place to ask, let me know where to post instead if it is pls

im filling out the non immigrant visa application rn and theres a part that asks us for all social media accounts we've had in the PAST FIVE YEARS (the dropdown includes tumblr, reddit etc.) 

ok so five years ago i was 13. obviously in the past five years i have made and deleted multiple tumblr and reddit accounts, and i have no way of remembering all the usernames ive used. what do i do lol. none of them were problematic in any sense, ofc, i mean i mostly use tumblr for dog pictures and reddit for the philosophy thread but im worried if i dont mention all of them itll get me in trouble?? idek??

&amp;#x200B;

do i just mention accounts that currently exist and not worry about deleted accounts?",1588514286,1,0
Is it week for or five,yes,1588493304,1,0
Earth Systems Science PhD,"Hello! Anyone here taking up Earth Systems Science? I’d love to know more about any personal experience you have about the program (application, acceptance rate, faculty, facilities, campus, etc.). I’m an interested international applicant and I would like to have an idea about the whole process. Thank you! :)",1588489682,1,0
Classes??,"I’m a high schooler taking classes at Stanford’s Summer Session, but I was wondering how hard ENGR10 (Intro to Engineering Analysis) is. 

I want to learn something new over the summer, but I don’t want to overload myself with units (12 unit max too) and this is the only course that doesn’t offer P/NC as a grading option. Is this a class I could expect to do reasonably okay in, with the quarter being online and all? 

Thoughts/advice appreciated — thanks!!",1588484780,1,0
HAVING A ZOOM PARTY WITH DJ'S AND MUSIC! Meeting ID: 847 6342 2314,all are welcome!,1588482488,1,0
My assist-the-newly-unemployed challenge:,[removed],1588458944,1,0
Any reason to maintain A-level work this quarter?,[removed],1588458039,1,0
SLE v ITALIC what the frick is the difference?,"Hi! I sorta looked into the two however I was wondering if someone could speak on their experience in one or the other. I'm an incoming freshman and honestly, idk what housing would be right for me.",1588445014,2,0
left an eighth of oui'd in my dorm... ugh,"how fucked do you think i am scale of one to ten?  I use it primarily to sleep after suffering from PTSD but I never ended up getting my med license just because it was so easy to get w\*\*d on campus.  This whole thing has me really nervous.

edit for info:  Both the oui'd and the pipe are in a relatively smell proof bag hidden in a drawer that I brought to campus (aka not university furniture).",1588440114,1,0
CS161 (algorithms) in the summer term?,"Hi all,

Online SCPD student here, I got some good advice last time I posted a question about CS229 so I thought I'd come back for more. I was planning on taking CS161 in the Winter-2021 quarter but I see it's being offered over the summer session so I was considering taking it then instead. Does anyone have any advice on which might be better? 

In particular maybe one session has a better instructor than the other, or maybe the course content is too much to be squished into a shorter summer term? The reason I was considering the summer is that, bluntly, as an online SCPD student I feel more on even footing with IRL students while there's a lockdown and all instruction is remote, so if this continues over the summer I may as well make the most of it.

Thanks!",1588427619,1,0
Join our students' team at Univation Hub Stanford 🤟,"A local Univation Hub opens at Stanford. Join the opportunity to get into the team and operate the Hub.

&amp;#x200B;

[Univation event when events happened](https://preview.redd.it/7rh2gjgy0bw41.jpg?width=3000&amp;format=pjpg&amp;auto=webp&amp;s=5fc969c50a1a3781e6d1fb1b131e08f9be033ed6)

**Univation** is a nonprofit organization aiming to bridge the gap between University and Innovation. It started as an event, ""Tech and the City"", at a Greek University to inspire and help students to start their ideas, in 2017. Today, Univation is a full inspiring &amp; empowering program that aims at developing student startups at 100+ Universities in 2020 and empowering 1000+ teams to get ""From Student to Entrepreneur"".",1588404667,1,0
Vape Juice in Dorm,"The email sent out tonight from Susie Brubaker-Cole about belongings, specifically the quote, ""If you think you might have items that fall into \[the egregious violations\] category, we encourage you to let us know ahead of time"", got me thinking. I left some vape juice in my room (I know, I should've just taken it home/not brought it to campus in the first place). I reviewed the Residence Agreement some, which prohibits controlled substances in rooms (which nicotine is not) and the *use* of tobacco/e-cigarette in the buildings. So I'm not sure if this means that the juice is not allowed in rooms, especially since I didn't leave the vape itself. 

&amp;#x200B;

Anyone have thoughts on the legality of this/in a similar situation?",1588388751,1,0
Puerto Rican male college student,"We are looking for a Puerto Rican (or other Hispanic) sperm donor (in college or college graduate). We will pay $2,000 plus cover all expenses. Please DM us for further info.",1588386670,1,0
Residence Programs,Can any current Stanford students speak on their experience with any of the following? (Pre-frosh here who wants to do one of these but doesn’t know which),1588382917,1,0
Residence Programs,Can any current Stanford students speak on their experience with any of the following? (Pre-frosh here who wants to do one of these but doesn’t know which),1588381101,1,0
Can i get rescinded for cancelling all my ap tests?,All my aps im taking this yr is not relevant to the major im going into so its kinda useless. Im doing well in the classes tho but Im scared stanfords gna take this negatively and rescind me if i dont take em.,1588380582,1,0
Can I get rescinded from cancelling all my ap tests?,Im going into a major where it doesnt need any of the ap creds im taking. And I want to cancel all but will stanford take this negatively?,1588380511,1,0
Can I get rescinded from cancelling all my ap tests?,Im going into a major where it doesnt need any of the ap creds im taking. And I want to cancel all but will stanford take this negatively?,1588380506,1,0
Can I get rescinded from cancelling all my ap tests?,Im going into a major where it doesnt need any of the ap creds im taking. And I want to cancel all but will stanford take this negatively?,1588380502,1,0
Residence Programs,Can any current Stanford students speak on their experience with any of the following? (Pre-frosh here who wants to do one of these but doesn’t know which),1588380445,1,0
Residence Programs,Can any current Stanford students speak on their experience with any of the following? (Pre-frosh here who wants to do one of these but doesn’t know which),1588380426,1,0
ESF ITALICS SLE,Can any current Stanford students speak on their experience with any of the following? (Pre-frosh here who wants to do one of these but doesn’t know which),1588380383,1,0
ESF ITALICS SLE,Can any current Stanford students speak on their experience with any of the following? (Pre-frosh here who wants to do one of these but doesn’t know which),1588380170,1,0
ESF/ITALICS/SLE,Can any current Stanford students speak on their experience with any of the following? (Pre-frosh here who wants to do one of these but doesn’t know which),1588380129,1,0
"ESF,ITALICS,SLE",Can any current Stanford students speak on their experience with any of the following? (Pre-frosh here who wants to do one of these but doesn’t know which),1588380118,1,0
"ESF,ITALICS,SLE",Can any current Stanford students speak on their experience with any of the following? (Pre-frosh here who wants to do one of these but doesn’t know which),1588380080,1,0
What do you wish you'd have known about Stanford before going?,"Hello! I'm deciding where to apply. So I just want to know, looking back, what do you wish you were aware of before going to Stanford. It doesn't matter what parts of the university it's about, just anything that would've been helpful.

If it helps tho, I do have questions about exactly how the residential system works. It looks much different from anything I've read of other colleges. In your opinion, was that something you enjoyed?",1588379414,1,0
Stanford Masters Program (C.S),"I would love to get into  Stanford's master's program for computer science, I'm just a bit worried about my credentials lacking.  Outlined below:

Career: 1+ year of full-time Software Engineer position + other internships (if it matters)

GRE: 320

Research Experience: None

Undergrad GPA: 3.1

So I was wondering if there were ways to increase my chances of getting in despite my low GPA, which is my biggest concern. I am going to be taking courses on SCPD in order to prove I can do well in graduate-level classes and I've been working on perfecting my statement of purpose for a while. Other than what I've already listed, would you know of any other way to increase my chances of getting in when I apply ?",1588371253,1,0
Summer Residence Possibilities,"I've been offered an internship position over the summer in Santa Clara, and am wondering what the best options are for residence in the area. Does anyone who is currently (or previously has been) in this situation know of cheap housing options in the Palo Alto/San Jose/Santa Clara area? 

&amp;#x200B;

Also, if any students are still living in/around campus this summer and would consider some sort of roommate sublease agreement, please PM.

Thanks",1588369835,1,0
Even though this paraphrase is fully cited is it still plagiarism?,[removed],1588366247,1,0
Do Stanford students get a free subscription to NYTimes,Or other similar sites?,1588353217,1,0
"Stanford Student Publishes Anonymous, Unverified Allegations on Instagram",,1588353083,1,0
CS Waitlist,"How bad is the waitlist for popular CS classes for a freshman or a sophomore? (Do students have to wait a few quarters before they get what they want) Are there some classes with notoriously long waitlists and some that tend to have shorter waitlists? 

Thanks :)",1588351890,1,0
Tent classrooms?,,1588344405,1,0
Loans,"Hey y'all,

I'm a profrosh and I just have a few questions regarding financial aid / loans from Stanford. As a first-gen student I'm literally so confused about this process.

1) My financial aid award letter states that I'll have to cover a cost of the tuition which I'll most likely require a loan to pay. What's the process to request a federal loan? I submitted my FAFSA on time; however, I'm having issues finding my offered loans / if I was offered any on Axess.

2) Should I have all this loan stuff figured out already?",1588310790,1,0
Physics 61 for CS major?,"I'm up for the challenge, and I like proofs; but i want to take CS229 in the same quarter.  Bad idea?",1588297793,1,0
Can student loans pay off your parents’ contribution?,"If I get a loan, can that be used to pay off what my parents owe, or just what is listed on the student contribution like scholarships? If it can pay off my parent’s part, which loans are the best to get for this? Should i get many individual loans or one big loan?",1588288777,1,0
HELP. Urgent!!!! Be honest... worst things about Stanford?,"I’m a prospective student. I have ONE DAY to decide if I’m going to Stanford for $80k per year or UChicago for 40k per year. Not sure what I want to major in, im considering both natural sciences and humanities. Maybe pre-med. Maybe pre-law. Not CS. What are your thoughts on where I should go?",1588288601,1,0
CS221 quandry,"Is it normal to feel like I'm not quite getting a solid grasp of all the topics being taught in this class?  Im a freshman and this is my first ML/AI class and while I'm doing well on the assignments, i feel like i haven't grasped the topics well especially with how fast we jump from different subfields within AI",1588288436,1,0
Axess enrollment issue,"Hello everyone,

As a summer session visitor, I activated my SU account yesterday and try to enroll in course by Axess. After the enrollment beginning time, I choose the enroll option in Axess, but the system shows that 'you do not have access to enrollment at this time'.

Could formal Stanford University students tell me, what's the issue?",1588254015,1,0
cons of an undergrad degree in ms&amp;e?,"context: incoming freshman researching majors, just trying to get info!! am considering majoring in math+cs or MCS rn, but want to understand my other options better. unclear on whether i want to go into quant or something entirely different.

i think i have a good idea of what an ms&amp;e degree is good for, wanted some reasons NOT to major in it? anything based on personal experience/what uve seen w friends (unit requirements are too high so cant explore more academic areas, too many snAkEs, not specialized enough, eliminates tech jobs etc. idk)",1588242138,1,0
DEPOXITO | Restrict,,1588238032,1,0
entrance exams,"Students of the STEM community, did you have to give an entrance examination to get admitted?",1588233520,1,0
I can’t believe this is written by undergrads. Quality article on the history of Hoover Institution,,1588229315,1,0
CS106B for interviews?,I have a good theory background (so already concretely know CS161). But I'm looking for the class that will get me fluent those tricky leet code style phone interview problems. Is CS106B that class?,1588217792,1,0
How hard is CS229 in summer?,"This will be my first graduate class, I could ease off taking CS221 in Autumn but I dont think I want to waste time right now. 

How hard is CS229 in summer given that you go over lecture notes and videos for the course before attending them?",1588203295,1,0
SURF program,Can Stanford students apply to the SURF program??????,1588200866,1,0
Undergrad TA &amp; tuition grant,I know that coterms and masters students can get a tuition grant/most of their tuition payed for by being a TA. Is this possible for undergrads? Can undergrads ever TA courses other than the CS106s?,1588196946,1,0
MS in Computer Science,"In how many years can I complete this master program ?

Is it worth it if I don’t want to work in academia and look towards a more pre-professional direction? ( I ultimately want to work in Silicon Valley)

Am I eligible for the program if I own a BS bachelor degree that isn’t pure computer science ?",1588189891,1,0
what math classes does taking the 60dm series enable you to skip?,"does taking the math 61dm series enable you to skip any math classes (eg. 113/115 etc.) due to large overlap of content? this might be a really silly question; sorry, still getting a feel of how math classes work at stanford!!",1588187766,1,0
🚀 I made a website to help students and developers to create their own portfolio! The quarantine might be a good reason to create one for yourself!,,1588163605,1,0
