title,selftext,created_utc,score,total_awards_received
VPUE Summer Undergraduate Research Program - Applications Due April 1st,"[Research opportunity](https://devbio.stanford.edu/vpue-summer-grants) in the Stanford School of Medicine Department of Developmental Biology for those who are interested.

&amp;#x200B;

\---

 

The Department of Developmental Biology has a limited amount of funding from the VPUE Summer Undergraduate Research Program to support 10-week research projects in Summer 2020.  The funds provide a full stipend for the summer quarter.

**Eligibility and Requirements**

The program is open to current Stanford undergraduates who are enrolled in studies for both Spring 2020 and Fall 2020. Grantees may not receive any credits or other funding for the research project, may not enroll in more than 5 units of summer coursework, and may not work more 10 hours per week outside of the project. Additionally, the grant may not be used to support an honor’s thesis project.

There will be three meetings in the 1st, 4th and 10th weeks of summer quarter.  You and your mentor are expected to attend all three meetings, and will you be required to present a project update at the midterm meeting and give a final presentation at the last meeting.

**How to Apply**

Please identify and contact a Developmental Biology faculty member who would be willing to supervise a summer research project.  You are encouraged to learn more about the faculty’s research interests on their [lab pages](https://devbio.stanford.edu/labindex) before contacting them.

Once a faculty PI has agreed to sponsor your project, please have the PI (or lab mentor with the PI’s approval) submit the following information to [Dr. Alistair Boettiger](mailto:boettiger@stanford.edu) by **Wednesday, April 1, 2020**.

1. Name of student
2. Contact info
3. Year of study (e.g. Freshman, Sophomore)
4. Major
5. Student’s CV
6. Brief summary of project (may also include prior work by the student in the lab)
7. Name of lab member supervising daily activities 
8. Please confirm both a mentor and the VPUE grantee will attend the following meetings: first, fourth and tenth (last) week of summer quarter. Specific times/dates TBD.

Funding announcements will be made at the end of the first week of April. Questions about the program should be directed to [Dr. Alistair Boettiger](mailto:boettiger@stanford.edu).",1584205744,1,0
The unified numeral theory of relativity.,,1584193028,1,0
[news] 🚨Trump retaliates against UW🚨,,1584177264,1,0
Concurrent enrollment from a different university?,"Hello Stanford friends,

I'm a UCSC student moving back to my hometown of Menlo Park bc of instruction moving online. **Does anybody know if it's possible for me to take one class at Stanford?** At UCSC, many social science classes are smaller than usual or have been cancelled because of the 82 TAs fired, and I'm interested in fulfilling an upper division major requirement at Stanford. It would most likely be a 4 or 5-credit upper division course in a social science field, in Political Science, American Studies, Anthropology, Human Rights, International Relations, History,  Urban Studies, Sociology, Public Policy, Native American Studies, Latin American Studies, or Feminist, Gender and Sexuality Studies.",1584139986,1,0
"For those of you wondering what that last email was about, here is the county’s order: gatherings of 35+ people are banned",,1584133681,1,0
Curve for summer classes?,[removed],1584124449,1,0
How is SFO airport right now?,Any students fly home within the past few days from SFO? I'm flying out this weekend to go home and I'm just a bit worried because I read that SJC had 3 TSA agents test positive. Are there many people?,1584087785,1,0
Psych Summer Research,How competitive is it to get in? I’m a freshman and I applied recently.,1584053232,1,0
A list of my failures over 3 years as a MS/PhD researcher at the Stanford AI Lab,,1584041183,1,0
3 confirmed cases on campus &amp; employees still on-site,"Hi everyone,

I'm asking again that students and the greater Stanford community support this petition for enforcing mandatory telecommuting practices for employees: http://chng.it/xjqQFK8Z


Stanford University has now confirmed 3 cases on campus, with additional cases being 'presumptive'. We are not asking for the closure of the University, as we expect to be just as productive at home. By enforcement of working remotely, this will help the greater campus and community, since it greatly reduced the amount of interaction between individuals who may be carriers/silent carriers, helping everyone involved. This will be supportive to the employees who will be required to remain on campus (custodial staff, etc) while greatly reducing their workload and reducing the amount of individuals they come in contact with. 


This will also be supportive to employees who have older children in school (who do not need constant supervision) that they would like to pull out for home instruction at this time. Many parents are worried about their young children who suffer from chronic illnesses, yet are unable to offer them an alternative due to being required to come in to work daily. 


No other *company* in the bay area is reacting like this with several confirmed cases on their campus. It is too late to be proactive, since it has likely already spread on the main campus, but it is time to be reactive and pause the spread. Stanford University should be especially concerned with this, since the Stanford hospital is in danger of becoming overwhelmed due to the overload of cases in a short period of time. 

Stanford has over 30,000 community members between the University, LPCH, and the main hospital. They interact daily and there are large portions of employees on the hospital side as well who can be staggered/completely work from home during this time while sufficiently supporting the medical staff. Please help and sign/pass on the petition.",1584040170,1,0
Organic chemistry over summer,Has anyone taken chem33/35 over the summer? They're both only 4 weeks long.,1584015050,1,0
International student full ride,"Hi! 

It is known that Stanford rarely gives financial aid (especially full rides) to international students. Do you personally know any international student that received a full ride at Stanford?",1584002919,1,0
Should finals be cancelled?,,1583979986,1,0
Will you stay on campus or leave to go home?,I don't know if I should stay and take the online classes here at Stanford or go home. What are you guys doing?,1583978033,1,0
[news] Seattle HEROIC. defied orders demanding WA stop covid testing,,1583973418,1,0
Advice on taking a quarter off,Would anyone recommend taking a quarter off with this current situation? Can afford to take a couple off and graduate on time but am conflicted whether to stay and complete my year or go home :/,1583969573,1,0
Stay safe mate! Don’t let a light beer kill you.,,1583956525,1,0
Can Stanford force all students out of housing?,"With all the spring quarter stuff going on, I’m struggling to decide whether to stay on campus or go back. I decided this morning that it makes far more sense for me to stay on campus, but only if I’m guaranteed housing for all of spring quarter. Is there any situation/is it possible for Stanford to ask all students to vacate campus housing if the situation gets worse in the region?",1583951147,1,0
Help with my research paper!,[removed],1583949718,1,0
Updated Course Information,"I'm trying to figure out which courses of those I was planning on taking will be affected (i.e. perhaps cancelled or substantially modified because of the online format for next quarter).

Any ideas on where to look for updates?",1583947944,1,0
Is Physics 43 needed to take 45?,"Are these courses independent of each other and not needed to understand the next course in the sequence? My schedule won’t allow me to take 43 this spring and it’s only offered in spring. I plan to take 45 in the fall of next year if they’re independent. Is CME required to understand 45? 

Thank you all!",1583946763,1,0
PreFIX PH - The Intelligent Phonebook App for the Philippines,,1583935029,1,0
Running red light in Palo Alto,"Hello Stanford students,

I need your help. It’s almost 6am and I cannot fall asleep. I’m from San Jose and went to Palo Alto today to get boba guys. When I was coming back, right outside that plaza there was a stop light. It was red so I stopped. While waiting for it to turn green my focus shifted to the other stop light right after this one. When that turned green I started driving and got honked at cuz my actual light was still red and the cars coming from the other side stopped cuz I was in the middle of the intersection at this point. I stopped, panicked and reversed back into my original waiting spot. So technically I didn’t cross the intersection. Will I get a ticket?? My dad will seriously be so mad omg please send help. Did any of you get a ticket in the area before? Are there red light cameras active there??",1583930771,1,0
Master’s student starting this Spring :/,"So I’m supposed to start grad classes this Spring but it seems like the whole virtual class situation may last several weeks, if not the whole semester. Is anyone else in this boat? Or have any advice? 

I’m kind of considering just waiting to start in the Fall since I won’t be getting the full experience if it’s just super expensive online coursework.
Any advice would be super appreciated! Nervous wreck east-coaster here :))))",1583899195,1,0
Petition for no finals?,I think taking finals next week such a big burden on students. Everything is chaotic &amp; so uncertain. Is there any possible way we can petition to change the policies for finals? We are all stressed about our health &amp; upcoming quarter but we are expected to prepare for finals? Seriously?,1583887890,1,0
Fuck...,[removed],1583885471,1,0
Classes in spring will begin online,Rip undergrads,1583884957,1,0
Request for comments: Division by Zero is possible — A new explanation which avoids the paradox,,1583866142,1,0
Are all take-home exams open book?,[removed],1583803259,1,0
Friend: How’s life at Stanford? Me:,,1583793319,1,0
[COVID-19] Rumor is that this email was sent by Fei-Fei Li to her lab students last week. Is this true? Can anyone confirm that this is not some made-up email?,,1583788108,1,0
Research direction in Bayesian inference,What are the hot research directions in Bayesian inference especially Bayesian nonparametrics? My advisor wants me to find me a research topic that I’m interested at the intersection of Bayesian Nonparametrics and graphical model. I’m looking for hot topics that I can possibly write my phd thesis on. I’m more interested in theory rather than applications. Any topic suggestion would be truly appreciated!,1583786965,1,0
Take-home finals,"Do you think these online finals are really fair? Doesn’t seem so to me. I understand there are no other options, but still. A lot of room for error. Uneven playing fields, etc.",1583734152,1,0
Roommate Pairing Summer Position,[removed],1583696129,1,0
Should I go home?,"I know there’s so many questions being floated, but my family wants me to urgently come home. Pros and cons of leaving? What are the likely future scenarios (spring quarter delayed? Campus under quarantine soon? No domestic travel allowed? Etc)",1583690129,1,0
Stanford cancels in-person classes for rest of the quarter,,1583654229,1,0
Logistics of Smoking Weed @ FloMo,"Frosh considering FloMo for next year! Can anyone speak to the logistics of smoking weed in east/west FloMo? Do people usually smoke in their rooms (if so, how do they manage to do so) or are there any good spots around.",1583643497,1,0
Help us close SJSU's campus amid COVID-19,"Hi all, as I'm sure most of you are already aware, there are now 32 confirmed cases of COVID-19 in Santa Clara County. It disgusts me that we have to come to campus despite our fears of becoming infected as well as infecting our loved ones. The number of cases are exponentially growing, and our safety should not be placed second. We have the resources available to attend classes and learn from home. None of us want to wait until a student showing symptoms before SJSU's president actually does something about it. It's only a matter of time before it happens, so we might as well take the precautions sooner rather than later. Please help us by signing this petition and maybe our president will take it more seriously.

change.org/p/president-of-san-jose-state-university-mary-a-papazian-cancel-sjsu-classes-amid-coronavirus-outbreak-covid-19",1583636625,1,0
Doing postdoc at Stanford?,"Heyo. Given that I have full funding, how does a postdoc work at Stanford? Do you have a ""boss""? Are there any restrictions?",1583624930,1,0
Honor codee fkk,"So like most ppl are gonna cheat on takehomes right and that puts those that don't at a disadvantage?

I would lowkey cheat but I haven't gone to lectures so i don't know anyone 😂😂",1583621045,1,0
how do take-home finals work?,"wondering how early i can go home. i have three tests that were in-person, but have not received any info on what happens now. if they're take home, how does that work? do we turn them in online?",1583620056,1,0
Leaving Early,"Because of the whole classes being online and take-home exams, can we just leave campus early? Family really wants me back because of some stuff going on at home too",1583613839,1,0
What it’s like to be in Stanford’s biomedical informatics master’s program?,"Anything would be appreciated!

I’m an incoming student, but I couldn’t find any discussion about this program. Could anyone please share your experience?",1583597948,1,0
"How should I market physics tutoring to stanford students required to take it, particularly premeds and enegineers?","I’m a recent PhD grad from UF. I was able to get students through posting ads to their class_of_x FB pages and also registering with the app knack.

Since I’ve moved here I’ve thought of picking up Stanford student for physics Turoring. 

But knack hasn’t worked (perhaps it isn’t popular here) she the FB class of pages ask qualifying questions one a Stanford student would know. 

Anyone have any suggestions as to how I can effectively market as an available physics tutor?

Disclaimer: is this post an advert? Perhaps serendipitously.",1583595191,1,0
Stanford University faculty member has tested positive for coronavirus,,1583565427,1,0
Classes canceled because of COVID-19,Hell yes,1583553894,1,0
Life as a grad student,"Hi,

I've been offered a place for a master's program. In order to choose the right program, I was wondering if anything could offer some advice about what grad life is like? 

Is it easy to socialise? How is the campus like? What are the housing conditions like?

Thanks!",1583526034,1,0
Stanford GRIPS Program/Genecamp,"I was just wondering how competitive the above program was. While I can look at the acceptance rate (7%), that doesn't tell me what the profiles of people who were previously admitted were.

Also, if anyone has any experience with it, how was it? It seems like a really well-made program and I would like to get the insiders' view on it.",1583523893,1,0
Hey students of Stanford University! I have some questions about your collage for school project. Could you answer for few questions?,"Q:
How many students the university has?
When was it founded?
How students life looks?
Budget of university.
Famous graduates.
Is there any polish students?
What you have to do to get to the univeristy?

Reply in private message.
Thank you",1583523862,1,0
How does tuition work at Stanford work?,"So are summer, fall/autumn, winter, spring tuition charged seperately or all together?

Google tells that the tuition price is 50k instate and out of state and this website says it is $18,482 so I am not sure how the pricing works here.

Thanks",1583513542,1,0
How do international students finance school?,"Hello all,

A close relative of mine is on track to be an international student at Stanford from Pakistan. Since I do not reside in California, I do not know the ways things work over in this state. So if you guys can tell me about how international students can get financial aid, scholarships, grants or anything of the sort,  that would be very helpful.

Thank you",1583468770,1,0
Seeking bicycle commute wisdom,[removed],1583461529,1,0
COVID-19 Admit Weekend,[removed],1583458423,1,0
Research funding helpp,I just got rejected by curis but was really hoping to do research this summer. Are there any other opportunities for funding? I'm a stem undergrad upperclassmen.,1583458149,1,0
German Language Professors,"I'm planning on taking a German language course next week. Has anyone taken German with Isabel Meusen? How is she? The other German professors that I've had have been pretty laid back, understanding, and very willing to work with you, is she like this too?",1583457975,1,0
(Paid opportunity) Any regular listeners of podcasts at Stanford?,"Hey guys. Are any of you a big fans of a specific podcast? Do you listen to every episode religiously? Have you tried to spread the love for that show with your friends?

If this is you, we want you to talk to you!

I'm part of a company launching a new platform called Shuffle that makes it easy to create a 60s video highlight from any podcast episode. Check out a clip from one of our podcasts here:

[https://getshuffle.app/highlight/tinder-s-ex-cpo-successful-consumer-H4iuo5bEQy0](https://getshuffle.app/highlight/tinder-s-ex-cpo-successful-consumer-H4iuo5bEQy0)

All you have to do? Try out our product and give us feedback. Users who are a great fit have the potential to be chosen for a paid user interview and eventually, be a paid brand ambassador (yes, we'll pay you to listen to and talk about podcasts you already love)

If you're interested to be a part of this, reach out to [ann@getshuffle.app](mailto:ann@getshuffle.app) with the name of your favorite podcast and we'll send you more instructions to be part of our beta test. It doesn't matter if the podcast you love isn't super popular, what we care about is that you're a dedicated fan of it and that you've tried to get your friends on it somehow.

Hope to hear from you!",1583456841,1,0
Spring Quarter Coronavirus Impacts,How much do we think Coronavirus will impact Spring Quarter?,1583445644,1,0
When is payment due?,Hi! I’m an incoming freshman and sorry if this question has been asked already! I received my financial aid letter and it has a total sum of my net cost/how much I need to pay. Is all of that due by a certain date? Thank you!,1583442034,1,0
Would attending a summer session as a college sophomore/junior increase my chances of transfer submission if I kiss ass to a professor?,I'm really curious on what you think lol. I can talk for so long and am very engaged with whatever is happening in class and love asking questions during office hours. Do you think it's possible as a STEM student?,1583402925,1,0
Coronavirus,Everyone stay safe out there,1583365845,1,0
draw advice,"can upperclassmen and alumni offer honest and unbiased advice about housing? i’m a rising sophomore and i’m planning on using tier 2.  i REALLY want a strong community. i’m gonna draw by myself to have a better chance at getting my choices but i don’t really know what i’m doing. 
toyon is my #1 choice but i’m not sure if the next thing i rank should be self ops or casper quad residences. can y’all share thoughts on casper quad (kimball, castaño, lantana) and self ops? thoughts on the community, room sizes, in house draw, any wisdom you have to share. if you have stories about your personal draw experience i’d love to hear them.

love,
a cardinal weenie 

p.s. please lmk if it’s even realistic for sophomores to get into self ops. thanks!",1585481420,1,0
Traditional Stanford Transfers?,"Hi! I've applied for Stanford Transfer!

I'm a traditional student from Korea- not a veteran, haven't taken a long gap year to find my self. 

I guess my strong point would be valedictorian in high school, 4.21GPA in uni, 2320 SATs. 

Do you know if any Stanford transfers are 'ordinary' like me? I don't have a crazy life story. 

If not, please crush my dreams as swiftly as possible lol",1585477962,1,0
What are some good ideas for commencement this year?,A recent email said that Stanford admin was accepting ideas for alternative commencement ceremonies. Have you guys come up with or heard of any solid ideas?,1585475949,1,0
Passionate people at Stanford?,"Hi, just got admitted to Stanford c/o '24!!! I'm super excited and will probably commit, but I saw this post and wanted to know if this is true for majority of the community?

[https://www.reddit.com/r/ApplyingToCollege/comments/fqo68j/aos\_cant\_actually\_detect\_authenticity\_or\_passion/](https://www.reddit.com/r/ApplyingToCollege/comments/fqo68j/aos_cant_actually_detect_authenticity_or_passion/)

Of course college is expected to have a career-prep slant, and Stanford is no exception. But I'm really hoping to find inspirational people who are (at least somewhat) passionate about what they do and excited to discuss/share about it with others. (not restricted to major, interesting hobbies/side interests are great too). Does Stanford really have an intense pre-professional culture, and little concern for social impact? Are people really not excited about what they do here? Thanks in advance.",1585474212,1,0
Trouble Viewing Financial Aid,[removed],1585469145,1,0
Any successful Canadian transfer stories?,"Canadian senior here, and I regret not taking the SAT and ACT’s. Nobody in my school knows about ACT and SAT’s and nobody applied for an American institution. So I never really knew much about American institutions, but I’ve literally fallen in love with Stanford over the last couple months. 

I got into a top Canadian university, but it’s nothing like Stanford. It’s ranked in the 30-40 range worldwide, nowhere near Stanford. Also Stanford just seems so beautiful and close to where I dream of working one day, in the Silicon Valley. 

I want to transfer but I’m reading they only take 12-24 students, and favour veterans. I want to take a gap year, but then if I don’t get into Stanford it will be a big waste. 

Somebody’s advised me to just go to the Canadian university for first year, and apply as a freshman for Stanford. But then I won’t be able to get the credits from my first year at the Canadian university. I will have to pay tuition, but Canadian tuition is only 5-6k for Canadians so it’s not too bad, that’s fine I guess. 

My only concern is don’t I have to report I went to university for a year? The person I talked to said they can’t find out, but Stanford still wants to know probably.",1585464149,1,0
public policy co-term?,how much will a B+ in econ 1 affect my chances of getting into the public policy coterm? it was my first econ class ever and i was hoping to raise my grade w the final but that didn't happen.,1585459885,1,0
Transfer Students and Prospects,"Hi everyone! So I am currently a student at Rutgers University (some of you prob have never even heard of us lol), and I was looking into (applying to?) transferring here to Stanford. While Rutgers is great in terms of opportunities and stuff, I feel somewhat limited by the academics, as there is something very specific I want to pursue academically, and that's not on option there. Actually, its not really an option in any universities besides a couple, including Stanford University. I do not want to transfer just because of the name, in fact, I ended up here specifically through searching that program I was looking into. 

I know the chances are absurdly low (Basically 1%), however I have taken advantage of many opportunities while here at Rutgers, and I even intend to start doing research next semester (I am currently a Freshman). As far as LORs I have been able to connect with multiple professors, who will probably write 2 of them, but then I also have a High School teacher who was also my Mock Trial coach, and who I still keep in contact with, who would be willing to write me one as well (for the extra LOR for someone who knows you well). 

&amp;#x200B;

I know I am rambling, but I just wanted to reach out here to see what I can do to be able to get in. Are there any transfers here who came from not a CC or the military, but from a State University? I feel like I've taken advantage of many things here, and this seems like an appropriate step to take. I have been lurking here for quite a while, and have been watching videos of students who come to this school, and I feel like I would fit in so well with the culture, which I have accidentally grown to love through my active indulging of any content Stanford-related. 

I know it's a long shot, but what do you guys think?",1585458949,1,0
How difficult is CS221?,"I'm currently in high school and I'm taking the online version of Stanford CS221 (lectures on youtube, notes, hw/problemsets, just missing the section lectures), and I was wondering what the approximate workload is per week. I'm currently on lecture 6 (search), and so far it's been somewhat difficult but not insane. How long did you guys spend on homework each week approximately, and which lectures/problemsets are the most difficult? My linear algebra is kinda rusty, but this isn't my first AI course (I've done the majority of Andrew Ng's coursera and also fast.ai). My DS/algo isn't too bad either.

Thanks!",1585455716,1,0
