title,selftext,created_utc,score,total_awards_received
The sparking water in the dining halls isn’t fizzy enough,[removed],1580108793,1,0
Is this true about the Frats?,,1580107706,1,0
"This guy tries to criticize the Frats, is this true?",,1580106026,1,0
Student Leadership Opportunity: Helping Homeless Communities,"**Hearts for the Homeless International** is a student-led nonprofit organization that provides free blood-pressure screening opportunities and heart health education to homeless populations around the United States and globally. We are a team of undergraduate students, medical students, PhD students, medical doctors, and other professionals who are invested in improving the well-being of homeless communities around the world- including yours. H4H was originally founded by students at the University of Central Florida and has since grown into an international organization with over 15 chapters across the United States, Brazil, and India. With your passion, we aim to work with you to help you positively impact your homeless community. Together, we can better fulfill our goal of improving the condition of humanity! 

We are **interested in working with student leaders** who want to innovate, to serve, and to enact change. For student leaders who are interested, all we ask is for your time, leadership, and compassion. We will take care of the rest. The lives you will change, the friends you will make, and the experiences you will gain will be invaluable.

The work of our students has helped so many, and for this reason, it has been recognized by the US Congress, the Brazilian government, President Clinton, educational and medical institutions, and other non-profit institutions as well. Some of our other significant achievements include leading an effort to rescue the homeless in multiple cities from hurricanes, partnering with Shark Tank’s Bombas Socks, as well as being published by [Forbes Magazine](https://www.forbes.com/sites/forbesnonprofitcouncil/2017/11/06/how-young-leaders-are-strengthening-community-responses-to-disasters/#77391a361850). 

We want to be able to help serve the homeless community in the Stanford and San Jose areas. Just recently, it was discovered that the situation was worse than expected. According to a recent [study](https://www.security.org/resources/homeless-statistics/) by safety resource Security.org, California is the state with the highest number of people experiencing homelessness, with many of them being in the San Jose area. As the Hearts for the Homeless Stanford President, you will positively impact your community with a great international team supporting your drive to help others and implementing any great ideas you suggest.

**Are you interested in being a H4H leader that makes a difference in your community?** Use our response sheet, and let us know!  [https://goo.gl/forms/CSHqrij5XZ5XmBZ73](https://goo.gl/forms/CSHqrij5XZ5XmBZ73)

If you do not receive an email response from us within 24 hours, please check your spam folder as it may appear there.

If you have any questions, please feel free to contact us at [communityoutreach@h4hinternational.org](mailto:communityoutreach@h4hinternational.org), and we will be sure to get back to you! Below is more information about what we do!

**SERIOUS INQUIRIES ONLY!** 

For those interested in learning more about what we do, please reference the following media hyperlinks highlighting the work of our fantastic student leaders and homeless friends around the world. 

* [Link to our official website](http://h4hinternational.org/).
* [Article written by Florida Alligator](https://www.google.com/amp/s/www.alligator.org/news/student-organization-aids-homeless-with-heart-health/article_df09c910-bcf6-11e7-95ad-8ffc802feff5.amp.html) 
* [UCF article showcasing our hurricane relief efforts](https://today.ucf.edu/rather-evacuate-students-stay-behind-warn-homeless-hurricane/)
* [Dayton 24/7 Now Article featuring the work of our Cedarville Chapter](https://dayton247now.com/news/local/cedarville-university-students-work-to-serve-the-homeless-in-a-unique-way)
* [City Hall article highlighting our Brazilian chapter in Governador Valadares](http://www.valadares.mg.gov.br/detalhe-da-materia/info/estudantes-cuidam-da-saude-cardiovascular-da-populacao-em-situacao-de-rua/86692)
* [Official Nonprofit Filing](http://search.sunbiz.org/Inquiry/CorporationSearch/SearchResultDetail?inquirytype=EntityName&amp;directionType=Initial&amp;searchNameOrder=HEARTSFORHOMELESSINTERNATIONAL%20N160000083661&amp;aggregateId=domnp-n16000008366-6f484b53-ee99-4d76-8db2-b555ee3ca1d9&amp;searchTerm=hearts%20for%20the%20homeless%20international&amp;listNameOrder=HEARTSFORHOMELESSINTERNATIONAL%20N160000083661)

**Some of our chapters in the US currently in operation include:** 

● University of Central Florida (Orlando, FL) 

● University of Florida (Gainesville, FL) 

● Florida State University (Tallahassee, FL) 

● University of South Florida (Tampa, FL) 

● University of North Texas (Dallas/Denton, TX) 

● Cedarville University (Dayton, OH) 

● University of Texas (Austin, TX) 

● University of Virginia (Charlottesville, VA)

● Boston University (Boston, MA) 

● Loyola University (Chicago, IL) 

● University of North Carolina Chapel Hill (Chapel Hill, NC)

&amp;#x200B;

[H4H Gainesville member Christina taking care of one of our homeless friends.](https://preview.redd.it/wuajwz43u5d41.png?width=874&amp;format=png&amp;auto=webp&amp;s=2a051c9b4a468cdb52c67faffe06733a1cf5b443)",1580061078,1,0
Book from the library,"I need a copy of a book for my postgrad thesis to which my university library has denied its acquisition, but St Andrews library seems to offer a scan copy if requested by a student

**Evaluation of Ibn Madá's criticism of the Arab grammarians**

Call number PJ6101.I1986 R32 1985A 

[https://searchworks.stanford.edu/view/1650615](https://searchworks.stanford.edu/view/1650615) 

If it needed to be digitized manually, mere pictures taken by a smartphone cam, two pages per pic would be enough.

In exchange I can also digitize a book the fulfiller of my request needs as long as I have access to it.

Thanks in advance.",1580031873,1,0
Humbio3a,Does anyone have study guides from when they took this class? I will literally venmo you. I'm spending way too much time trying to extract info from lectures at the expense of actually memorizing. And I'm taking cs 229 and other stem classes which was fucking stupid,1580009946,1,0
How do you find out about (all campus) frat parties if you are not in a frat?,,1579930296,1,0
Is corona virus on stanford,Urgent,1579928239,1,0
Is it true and where?,Heard there’s a secret underground bathroom on campus? Is that true and if so where? Are there other hidden places in campus?,1579916639,1,0
Am I going to hate myself for taking 22 units,Only 2 classes have midterms and the rest are artsy classes I enjoy but will I hate myself help,1579910959,1,0
Math 115 required for 171?,"Prereq on ExploreCourses lists MATH 171's prereq as MATH 115. If I haven't taken the 60-series but have some experience with proof-writing and a little Real Analysis exposure (up to Epsilon-Delta proofs), will it be manageable to jump straight into 171? Thanks!",1579861265,1,0
What is the humidity of your room?,"Has anyone tested the humidity levels digitally in your room, especially now in the winter when heat is on? I'm trying to see if it's my shitty immunity or really dry room that's at fault for slow cold recovery.",1579844415,1,0
Nightlife,"Hi I am moving to palo alto in 2 weeks for internship. I still want to have that college party life, so I just want to know what is nightlife like at stanford? Where do people go for each day Mon - Sat? The company gave me $7k in housing stipend, I just want to know which part of town should I live.",1579839174,1,0
Anyone feel lonely/spend most of the time by themselves ?,"Just wonder whether it is normal to spend most of the time alone (i.e. during lunch, in class, studying in the library, at the dorm). Feel like everyone else is always in a group. I am a sophomore and most of my friends from freshman year are all over the campus. Is there a way to meet more people and get to know in them personally (apart from club) ?",1579767532,1,0
How do I stand out on an application?,I am 18 and just started my second semester of college for computer engineering. Community college right now due to my limited budget but will be transfering to a university next semester. I am looking a colleges to transfer to. Stanford has always been a dream of mine but I feel that I have not done enough to stand out. Is there anything that you know went a long way in your application? Any ideas or advice would be greatly appreciated!,1579757868,1,0
Hey guys need your help!,"Before I start would someone like to share their essays and have a look at my chances.
Major:mechanical engineering


Hi I am a junior here who is going to apply at Stanford and needs your help.
My sat score is 1420 with 800 in math.(Ik Ik going to give in may again)
I am an Indian international student.
I don’t need financial aid.
1st in my school (and when I say first I follow Indian curriculum which is way hard)
I studied for JEE for a year used to come 1st or 2nd everytime I have the test at my classes (didn’t appear for jee and chose sat over jee)
Sat subjects: Math2 800 and physics 780

Can someone guide me I don’t really know which area to work on?

*Thanks a lot for your time *",1579713301,1,0
want to rent your place for the summer?,"Hey all -

I'm a Yalie looking for summer housing around Stanford! I'm really not particularly picky as long as you're not an axe murderer (or live with one). Please message me if you're looking for a subletter!",1579650679,1,0
What's the best place/way to get Stanford merch?,[removed],1579650190,1,0
SIMR Experience and Advice,Hey all! I’m currently applying to SIMR and was wondering if any alums had any advice for me. Some questions: how much does previous research experience (at Cal for me) help with admissions? Will it hurt me if I don’t submit my SAT scores or is it better to submit a meh score from sophomore year? Can I email them an additional LOR from my PI? And any other advice would be much appreciated. Thanks in advance!,1579647765,1,0
Does it matter to do Stanford online high school only for senior year?,"I’m a junior and thinking about applying for Stanford online high school for my senior year. However, I will be late to applications and not only that but I’m only doing it my senior year. Am I less likely to make it in due to this?",1579637103,1,0
"Hi everyone! I was hoping Stanford would make 2015 Men's championship scarves, but they didn't. After 5 years I have run out of patience, so I am making my own. Before I do so, would anyone be interested in them as well? (More Info In Comments)",,1579635529,1,0
Can you get into a Handshake event if you don’t sign up for it?,Want to go but am not sure if I’ll feel like it the day of,1579623450,1,0
"Hey guys, could you provide insight from your end?",,1579598098,1,0
Graduate Pathways to STEM 2020 Conference @ UCB,"Hello students,

Do you want to find out more about graduate school? Graduate Pathways to STEM is hosting a free one-day conference at UC Berkeley on Saturday, February 22nd. The conference is open to undergraduate students pursing a STEM degree in Southern and Northern California. To learn more about the workshops and activities, visit us:

[https://engineering.berkeley.edu/academics/graduate/outreach/graduate-pathways-stem](https://engineering.berkeley.edu/academics/graduate/outreach/graduate-pathways-stem)

Apply to the Graduate Pathways to STEM 2020 conference: [https://docs.google.com/forms/d/e/1FAIpQLSfYG\_\_l\_2PyP3us6tkslsB\_RamAgORQGbpLWNswXOpyKC-3zw/viewform](https://docs.google.com/forms/d/e/1FAIpQLSfYG__l_2PyP3us6tkslsB_RamAgORQGbpLWNswXOpyKC-3zw/viewform)

Freshmen, Sophomores, Juniors and Seniors are encouraged to apply!

UPDATED: Deadline to apply is February 7th, 2020.",1579566804,1,0
easy SMA or AQR requirements for winter Q?,"either/or. preferably something that is actually helpful/practical, but any suggestions are welcome!",1579542428,1,0
Sophomore Slump,[removed],1579504495,1,0
"what is considered ""typical assets"" for fin aid?","i didn't get any financial aid last year, but our financial situation changed and now my (single) mom is unemployed. we need to get aid but i'm worried her savings will negate the automatic no cost tuition for incomes lower than 150,000. does anyone know what the fin aid office means by ""typical assets""?",1579483918,1,0
Question about financial aid process,hi guys newly admitted student here i didn’t submit my financial aid documents by the priority date just 4 days after however and they’re said they awarded my letter to me around a week ago and the financial aid office said they mailed me an official award letter and the one on the website is an unofficial award letter is there anyone who has had a significant dif between the two letters cuz ours is waaaay higher than expected,1579472893,1,0
Is there an all campus going on tonight?,[removed],1579415724,1,0
Are there any transfers willing to be DMed?,"Hey, I'm a freshman student at a state University, and I'm planning to apply as a transfer to Stanford. Are there any other transfer students I can message regarding the process and such?

Thank you!",1579395091,1,0
Anyone decline the interview offer and get in?,I am happy to do an interview but my schedule is hectic and it’s not a great time. It seems optional but is it really?,1579378640,1,0
URGENT QUESTION ABOUT HIGH SCHOOL MUSICAL IN STANFORD,"Hi everyone,

2024 profro here,

&amp;#x200B;

just wanted to know what building gabriela comes out of in this video   
[https://www.youtube.com/watch?v=6mc1jfyOLZc](https://www.youtube.com/watch?v=6mc1jfyOLZc)

&amp;#x200B;

the answer will decide whether I choose Stanford or not!!!!!

&amp;#x200B;

THank u xoxoo",1579321402,1,0
PE Classes,should i take pe 2 (cross-training) or pe 14 (functional fitness training),1579291990,1,0
BOSP selectivity?,"Hi, I want to apply for one of the fall programs offered by BOSP: Either Hong Kong or New York. Does anyone know how difficult it is to get into these programs? Or has experience applying/going to one of these two locations through Stanford? Thanks. Appreciate it:)",1579242545,1,0
What is the movie club at Stanford that gathers on Thursdays in the basement auditorium of the History Corner?,"I came a few times last year, but couldn't find anything about it online.",1579229242,1,0
"It smells like skunk in my dorm, help","Ever since the beginning of the quarter, I walk into my dorm and I immediately get the sense that a skunk has sprayed somewhere in the vicinity. I tried asking my roommate and my neighbors but they just laugh at me when I ask if they've seen any skunks around.

I don't have any friends in my dorm and my roommate regularly locks me out of my own room to ""party,"" whatever that means. Something weird I notice is that the fans are always on in our room, probably because of the skunk spray but it could be for any other reason. I think my neighbors may have a pet skunk, but I don't know how to confront them and tell them to get the skunk to stop spraying all over the dorm.",1579217760,1,0
high school research project,"hey y’all, i’m doing a research project on mental health awareness in high schools and i was wondering if anyone (like a current student/professor) from Stanford could help out. i could PM some of my questions but any information involving mental health in high school/teenagers would be great! thank you so much :)",1579215409,1,0
Brian Contreras is the best Flipside writer of the past three decades,,1579214648,1,0
How to make an impression in your 500 person CS lecture:,"Bring a water bottle--one of those 15L water cooler bottles.  Slam it on the floor as you walk in. Make sure to sit at the front. Bonus points if you can position yourself so that you get into the video recording.

Everytime you feel a little thirsty, say ""excuse me,"" lift the bottle to your mouth with both arms, making sure to spill plenty of water over yourself and the floor every time you do, also, letting out a deep, loud, exhalation of satisfaction after every sip, then finishing the routine by slamming the bottle on the ground again before loudly saying, ""pfew, I needed that, I was getting a bit THIRSTY"" yelling thirsty as loud as I could.

When lecture finishes, pick up the bottle in such a way that the remainder poured out as I left.",1579206693,1,0
Any admitted students still not receive the personalized letter from their admissions officer?,I saw others receiving it almost a week ago and I'm wondering if mine may have gotten lost in the mail :( it seems like everyone has already received theirs!,1579196524,1,0
Best dining hall,Discuss.,1579176437,1,0
Chilenos!??,[removed],1579162144,1,0
Getting from Tahoe to Stanford?,Want to stay an extra day on snow trip. What's the best option to get back (with a small group) to campus?,1579155333,1,0
Are med school buildings open to study in?,"I was studying in a med school cafe today and it was pretty nice, I am wondering are all of those med research labs and stuff like that open to study in? Or do I have to be a med student?",1579144870,1,0
Thoughts on Brazilian BBQ Espetus?,"Thinking of going there for lunch later this week. Is there a reason I should avoid it? Is the meat tasty and fresh? Is it something you would recommend? 

Many thanks 🙏",1579118849,1,0
Is it too early to be thinking about college...?,"i’m in grade 10 in canada and as of now stanford is my top choice for post-secondary. ik there’s a very low acceptance rate so i’m wondering if there’s anything i can start doing now to increase my chances of getting in

ty",1579111746,1,0
Any Rocket League Grand Champion (any gamemode) players interested in forming a Stanford CRL team?,"I can't find anything online about a Stanford CRL team, and I was hoping someone here would have more information... Is there already a team? If so, what's the avg. rank? If not, is there a solid Rocket League community at Stanford already?",1579110089,1,0
Questions about undergrad CS,"Hello, incoming frosh here! So far, I’m interested in doing undergrad CS at Stanford, and while the internet has provided me with a lot of perspectives and information, I still have some questions. Is there a CS undergrad here that is willing to answer some of my questions over pm?",1579105634,1,0
HELP: Stanford Student Service Email?,"I attended summer school at Stanford. Now I need to contact the [Stanford Service&amp;Academics](https://stanford.service-now.com/student_services) center again. However, I already deleted Dou Mobile from my phone, so I can't log in to the page. Can anyone help me?",1579097555,1,0
Has anyone done the on-campus Citadel Securities Trading Challenge?,"I am from a different school, but I am curious about what happens during the challenge part of the event. Is there a recommended way to prepare for it? The event is described here: 

[https://jumpstart.me/discover/events/citadel/university-of-illinois-champaign-citadel-and-citadel-securities-trading-competition-invite-only-please-rsvp/18d44341-ae5f-4b46-8c37-35df09e567f4](https://jumpstart.me/discover/events/citadel/university-of-illinois-champaign-citadel-and-citadel-securities-trading-competition-invite-only-please-rsvp/18d44341-ae5f-4b46-8c37-35df09e567f4)",1579082013,1,0
Financial Aid Question,"Hello!
So, to keep things short:
Im an International Student
My Household Financial Income is about 40k/year. (1 adult (father), 2 teens including me)
My other parent makes about 12k/year.
My father has about 600k Net Worth (Family Vacation House, Family living House, 2 Old Cars, 1 Motorcycle, some hard to sell lands, about 80k in savings)
My mother has less than 150k Net Worth
I have about 10k in savings.
I will be applying next year on restrictive early action

How much should I expect to pay?",1579081943,1,0
PHYSICS 63 and 65,How dependent is PHYSICS 65 on the knowledge of PHYSICS 63? I'm considering taking PHYSICS 65 in the spring but haven't taken 63 yet.,1579075009,1,0
Cosmic Pluralism Studies,,1581174440,1,0
Viennese Ball 2020,,1581104919,1,0
Is CS106B recorded in the spring?,[removed],1581101224,1,0
List of online courses for MS CS HCP,Is there any list of online courses for CS like this: [https://statistics.stanford.edu/academic-programs/graduate-programs/ms-statistics/statistics-hcp-online-course-offerings](https://statistics.stanford.edu/academic-programs/graduate-programs/ms-statistics/statistics-hcp-online-course-offerings) available somewhere?,1581099421,1,0
Grading Question,"If I have to miss one of 8 discussion sections that, in all, make up 4 percent of my grade, how badly will that screw me over? If at all? My midterms are 25 percent of grade each, final is 36, psets 10.",1581095808,1,0
What are the best clubs for people interested in international relations?,"Also, is there any group in Stanford that might be similar to something like the Oxford Union in which fellows and scholars would be invited to speak?",1581095398,1,0
Need Storage - Collegeboxes?,"I'm an undergrad at Stanford planning on going home for the summer. Has anyone used a storage service for the summer and if so, what were your takeaways? I know Collegeboxes has a big presence on this campus so if you used them, what did you like/dislike? 

Any input would be greatly appreciated!",1581093963,1,0
@CS majors (physics requirement),"Foshofro here. I am hoping to major in CS, and I saw that Stanford has two required physics courses for CS undergrads. Do you guys recommend placing out of those with AP credit? I’m currently deciding whether or not to self study E&amp;M. Thanks!",1581059725,1,0
coronavirus tracker,"hi y'all, sorry for spammyness

my HS friends and I made this project for fun &amp; hopefully to inform the public more about coronavirus: [https://www.trackcorona.live/](https://trackcorona.herokuapp.com/) 

would love any feedback! this is literally my first web dev experience (currently in 142 atm) and it was kinda rough ngl",1581042137,1,0
CS students robotics research,"Just cuurious, what kind of research can cs majors do in robotics and haptics?",1581032431,1,0
Secret hitler round 2,"See you guys on saturday 5pm roble hall in the meeting room next to faculty lounge

definitely need another board this time",1580987270,1,0
Stanford Horizon Scholar,Im applying to the Stanford Horizon scholar program rn. Are there any past admits who can tell me about the program. There's very little information on the website and on youtube and i just want to familiarize myself with the program a bit more. Is it selective? Is it worth it? will colleges care? that,1580969040,1,0
Finding housing for summer internship,"Hi everyone, I am a student from Ohio that is interning near Stanford this summer. I just wanted to ask if you all had any recommendations to go about finding cheaper than average subleases for the summer. My internship starts in early May, so I don’t think I’ll be able to get many quarter system students in the area to sublease and I don’t think the university allows subleases to non-affiliated people. TIA",1580968307,1,0
cs106a is so hard,Should I still try to major in product design help,1580944013,1,0
Any knowledge on Stanford Pre Collegiate?,[removed],1580941217,1,0
"Oscar da Silva highlights vs Oregon, this man is legit. PAC 12 player of the Week",,1580929680,1,0
I really want to apply for the Stanford University Mathematics Camp (SUMaC). Is here anyone that has participated or is some sort of organizer of this camp? I have way too many questions to list here and any sort help is highly welcomed!,,1580929140,1,0
anyone know where i can find old cs142 lectures?,"kinda been slack on going to class lately, but i know its been recorded previous quarters 

anyone know where to find?? thanks in advance &amp; good luck with all your psets/essays",1580887075,1,0
"Switching from CS to Polisci, am I crazy?",[removed],1580884441,1,0
Question bout financial aid,my efc a large part of the stanford tuition and i’m receiving almost nothing in the form of need based financial aid but i won a couple scholarships worth over $20000 will that go towards reducing the parent contribution or will it only go towards the student contribution and if so what do they do with the left over money if i’m receiving such little need based aid from stanford i’m a newly admitted freshman btw,1580870629,1,0
Secret hitler,"7pm wednesday feb 5 roble hall the last room in the corridor facing away from field

we play till we hate each other",1580852119,1,0
Anyone needs Leetcode Premium?,[removed],1580838892,1,0
Hey Stanford students - take our survey on your educational resources,[removed],1580795336,1,0
เลขเด็ด &amp;mdash; เลขเด็ดงวดนี้ เลขเด็ดที่สุดในโลก แจกฟรีไม่ต้องเข้ากลุ่ม,,1580790174,1,0
Using StanfordCardPlan to use up excess scholarships?,"So StanfordCardPlan (SCP) allows students to charge up to $1,000 per quarter at the Stanford Bookstore and other on-campus locations. The charges are added directly to the students' university bill.  

Could someone use this to buy things and be charged on their university bill if they have excess scholarships that would otherwise be taken by the school? Has anyone used StanfordCardPlan for this?",1580782500,1,0
Jonas Brothers Happiness Begins Tour – (02/02/2020),,1580771768,1,0
