title,selftext,created_utc,score,total_awards_received
how does one achieve decent rec letters for coterm,"so I've consistently heard rec letters are important when applying to coterm. My question is, how does an average student acquire these? Should I try to build a tight relationship with professors or are they chill with students who've done well in their classes kindly requesting recs? perhaps Im just overthinking it??

For context, CS coterm. applying next year but not sure any of my CS professors remember me + Zoom University inhibits personal interaction",1586818648,13,0
SLE,"I’m interested in SLE, but I’ve heard that it’s just taken by people who want a quick way to knock out requirements! Is that how it’s generally perceived, or is there a sense of community from people who are genuinely interested in the material?

Also wanted to ask what the workload is like — do people actually read all the books etc or do they just sparknote it and come to class hoping to say something relevant!

Thanks in advance :-)",1586798718,26,0
Econ BA &amp; MS&amp;E co term?,Is this possible? Would this allow someone to skip the CS heaviness of the undergrad major of MS&amp;E because the masters courses for this major are a lot more business focussed? or does one require the undergrad MS&amp;E courses to do the coterm?,1586796497,8,0
Yale vs Stanford vs Princeton- which has the most prestige?,"Currently choosing between these three schools and this matters a lot to me, especially because the fields I want to go into value prestige a lot.",1586795389,0,0
Social life,What is social life at Stanford like? What is the best sorority/fraternity? How does rushing work?,1586784984,0,0
Design classes to learn PM/UI skills?,I am a prospective CS major (frosh) interested in being a Product Manager. Any Stanford classes that would help me learn more about UI/Product/design stuff?,1586779802,5,0
MS&amp;E coterm questions,[removed],1586746351,1,0
CURIS + 10 units of summer classes?,"Thinking of taking chem 33/35.

how flexible/time-intensive is curis?",1586741009,4,0
Advice on raising pre-seed funding,It seems like many Stanford student startup can easily raise pre-seed funding (50k-200k) but I am having a hard time connecting with the investors. Any advice/pointers on where to look for pre-seed money and what are the VCs looking for in this stage ?,1586739205,4,0
"Ziaire Williams, the nation's No. 5 Basketball recruit, commits to Stanford",,1586736969,84,0
Where to enroll in summer session classes?,"Was meant to open today on Axess, but can't find it?",1586728387,3,0
discord,is there a stanford discord or a philosophy major discord?,1586725003,1,0
Math/CS classes to take after CS 103/109?,"I'm taking 103 and 109 this quarter, and I've really liked the material so far. For context, I'm really interested in biomedical/biomechanical engineering but I'm also interested in a potential CS coterm. I would love to learn about CS/AI and its applications, especially in the medical field. Any recommendations for math/statistics/CS classes that would help me with this?

Also, on a somewhat related note, I remember there being a website that listed the different CS classes at Stanford and connected them with their prerequisites. IIRC, it was displayed like a graph. Does anyone have that website? Thank you very much!",1586724641,4,0
"Me and my girlfriend created a service where engineering students help high school students with math, physics and chemistry for free online during COVID-19 school closures. In Sweden we have over 1700 volunteers and 6500 pupils using it. Let me know if you want to start it up in your country!",[removed],1586719423,11,0
Can Coterminal 4 Yrs,"Does anyone here do coterminal in 4 yrs even if it’s not for CS and how do you fit it all in your schedule?
What’s your typical class load, and could you possibly dm your schedule?
I’m on full financial aid so I want to get the most out of the four years while I have the aid for it.

Edit: it’s suppose to say CS not can for the title it autocorrected",1586694204,5,0
Economics in Stanford,Can anybody please tell me about the undergrad Economics in [Stanford. It](https://Stanford.It) seems so much like a Science and Technology kind of school so I'm kind of confused.,1586691222,9,0
Summer 2020,"Would like to preface this by saying that I hope that you all are staying safe amidst the coronavirus pandemic, and that health and wellness should be our number one priority.

That being said, I got my summer research opportunity slashed due to the project simply being infeasible in a virtual setting, and I am aware that many are in similar situations. I’m mainly interested in Math/CS, and any type of data analysis job/software internship/startup internship would do at this point. To those who got their opportunities canceled, what are you going to do this summer? What should I do? Are any internship applications still open?

Thanks so much.",1586688885,33,0
Questions from a prospective CS/SymSys major,"Hi! I'm an incoming freshman thinking of majoring in either CS or Symbolic Systems. A few questions:

1. I noticed that CS majors have a Physics 41/43 requirement. If you take AP Physics 1/2 and do well on the AP exams, are you automatically placed into those classes? Or do you still have to take a diagnostic? Basically trying to decide if I should take the tests.
2. How feasible would it be to pursue a double/secondary major with CS or SymSys? I'm looking at Management Science &amp; Engineering, Economics, or Sociology.
3. What housing option would y'all recommend? I care a lot about academics (as I'm sure most everyone at Stanford does) but I also do want to make friends. Leaning towards all-frosh or four-class currently, but not sure.

Thank you!",1586675852,5,0
What happens in Summer?,"Hi y'all!

Just committed - super excited :D

Was wondering how taking classes in Summer works :)

1. Do we pay extra tuition and room/board?
2. What's up with the ""Summer Session"" - is that the Summer ""term""? Why does everyone seem to universally diss it?
3. Is it common, realistic and/or worth it to take classes in the summer to be able to fit a co-term and a second major (both engineering subjects) into a 4 year timespan?

Thank you and stay safe !!!",1586663886,17,0
doing CS because of FOMO,[deleted],1586661514,3,0
Admitted to Stanford: Class of ’24 Reacts. Is this too insensitive to those who didn't get in? Also serves no purpose - I doubt this will inspire any future applicants.,,1586661359,0,0
Admit reaction video from Stanford YT channel - is to too over-the-top?,[deleted],1586661085,1,0
"ME Students: ENGR 209A, ME227, or AA203?","I have space for 2 of these classes this quarter, but I'm not sure which ones are the best to take in terms of long term usefulness and applicability. I'd heard good things about ME227, but since a lot of the positive things I hear were related to running controls on real hardware, I don't know if it would be worth it without the vehicle labs.

If anyone's taken any combination of these classes, please add your thoughts on them. Thanks!",1586658744,1,0
When does the decisions of the CS106a online class (April to May class free online) come out?,I applied for the class but I don’t know when the decisions come out,1586657497,2,0
Disciplinary Breadth and Education for Citizenship Requirements?,"I saw that these were general education requirements [here](https://registrar.stanford.edu/students/enrolling-courses/general-education-breadth-requirements/ger-area-requirements).

However, when I look [here](https://undergrad.stanford.edu/academic-planning/degree-requirements/general-education-requirements-undergrads), they are listed for students who entered before 2012. Are these still required? 

Sorry if this is a dumb question",1586649310,5,0
Need based financial aid for Master's students,"Hi, so I got admitted to Stanford's CEE master's program and the dept has made a decision on how much aid to give me. Although I'm very grateful for it, it is not enough. Does anyone know if there are ways to obtain need-based financial aid as a master's student at Stanford, excluding loans?",1586649075,1,0
Easy Ways AII/SI/ED to take?,Just looking for a chill class with not a lot of work that fulfilled WAYS-AI or SI or ED. Any recommendations?,1586647246,5,0
Homework help,[removed],1586645496,0,0
How's the administration at Stanford,I've been accepted into the class of 2024 and am still making my decision on what school to go to. One thing I've been hearing that can make a big difference at a school is the administration. So what would you guys say about the Stanford admin? Do they seem like they care about the students? Are they easy to deal with?,1586628133,18,0
No initial funding for Aero/Astro PhD,"AA makes all grad students apply as MS and then transfer to PhD after quals (horrible system imo). Because of that, only a handful of the 50+ incoming students get funding for the first year. Is the bay area + Stanford's rep worth the investment/risk?",1586625742,8,0
Choosing Major,"Hey everyone! I’m a prospective premed and I am conflicted about which track I should take. I was wondering if anyone could provide insight into either:

1. I was thinking of majoring in humbio with an additional major/minor in music. I am not sure about how feasible this is considering I will also need to complete premed prerequisites as well.

2. CS on the biocomputation track with premed prerequisites (with a possible major/minor in music, but I’m pretty sure that’s not possible).

Also, are CS classes generally graded on a harsher curve compared to premed prerequisites? I know I shouldn’t be worried too much about GPA, but it’s still something I would like to consider when choosing which path I should take.

Thank you!",1586621503,2,0
Easy 1 unit classes for this quarter,"Looking for some easy one unit classes to pad up units. Taking MS&amp;e 472, cs 1u right now",1586612839,1,0
How is Branner,"Hi, rising sophomore here. How’s the community like at Branner? I dont think ive exactly found my friend group yet, so I’m looking for a dorm life thats not dead :) was kind of interested in branner bc of the public service aspect. Do u have other suggestions?",1586602909,1,0
What clubs give out free gear/clothing? Where is the cheapest place to get Stanford merch?,,1586574693,1,0
stanford’s pandemic response,do you think stanford will go standardized test option for class of 2021? all of the UCs have and a lot of top colleges are following.,1586562322,1,0
Stanford vs Harvard for CS/Physics Interests?,"Hey everyone, hope you're all doing okay. I'm a cross-admit to Harvard and Stanford, and I'm finding it so hard to make a choice. I'd really like to study both physics and computer science in college, as my biggest interests atm are in the intersection of ML and physics in research. I also like the option of having CS industry work as a backup in case my interest in physics fades in the future.

So whichever school I go to, I'd likely want to do a double major (or maybe coterm in one of the two majors if I go with Stanford??). Both schools have top-notch physics programs (Harvard seems to be a tad bit better, especially with the amazing Center for Astrophysics, but prob nothing meaningfully different for undergrad). Obviously it's clear who has the better CS program.

Simply based on academics it seems like Stanford would be better since it accommodates both my interests very well, but I visited both campuses last summer, and there was something about Harvard's campus that felt cooler than Stanford's, and I really liked the urban setting in Cambridge. Their housing system seems awesome too. Maybe I'm just in over my head with the whole Harvard brand name. The social scene there seems a little wack, tho :/ I was hoping to use the admit weekends this month to validate my prior feelings, but that's not happening anymore :( 

I do like the idea of the quarter system since I'll be able to take so many more classes, and it seems that it would make things like a double major more feasible (I've tried to chart a 4 yr plan for physics and cs majors for both schools, quarter system would def space things out more, plus provide me with more electives). 

For anyone who had to make this choice, what advice could you give me?",1586550147,1,0
"Since COVID-19 is making everyone stay home, I created a Minecraft server that is only for university students. Please join!","Textbook is a nearly new Minecraft server that is solely for university students. It is meant to be a tight-knit server with a close attention to a classic Minecraft experience. Our goal is to have a fun community of people who love Minecraft and play regularly or semi-regularly. This is a Java server.

Make some new friends on this server. We already have hundreds of players!

We have just recently started (about four weeks ago or so), so check us out. This is a link to our Discord server. Now is the perfect time to join.

[https://discord.gg/N2unAV8](https://discord.gg/N2unAV8)

Stay healthy out there, practice social distancing, and make sure to take it easy once in a while!",1586524093,1,0
Graduating from CS coterm early.. how to find new grad job?,"I'm currently a CS coterm, and am thinking of graduating early due to the current COVID situation, with a job start date in late summer. I checked some resources, but it seems like most \_new grad\_ jobs have already been filled by now (I checked Handshake, the CS department jobs mailing list (Computer Forum), alumni network jobs board, LinkedIn, AngelList). Can anyone suggest any additional resources I should check?

Mostly interested in software engineering roles. My coterm is in AI. Previously have done some internships at large and small companies, and have done some minor AI research on campus.

If I'm too late for this year, I don't mind not graduating early either. Just exploring options (:",1586485573,1,0
Has anyone gotten their financial aid refund yet?,"I was expecting the $2,000 food allowance but still haven't received anything, has anyone received the financial aid yet?",1586477917,1,0
HEALTHY VOLUNTEERS NEEDED FOR ME/CFS STANFORD RESEARCH STUDY!,"Hey everyone!

We are looking for healthy controls who are between the ages of 18-60 to participate in our study for Chronic Fatigue Syndrome (CFS) at Stanford School of Medicine. This is a really wonderful opportunity to help advance ME/CFS Research!

**If you are interested in participating, please fill out the following eligibility survey:** [https://redcap.stanford.edu/surveys/index.php?s=78N8LRAMT9](https://redcap.stanford.edu/surveys/index.php?s=78N8LRAMT9)

**No in-person visits will occur until COVID-19 has resolved**, but portions of this study, including screening and consenting potential participants, can be done remotely online! Eventually, when it's safe to do so, volunteers will need to complete two study visits which will involve a blood draw, a brain MRI scan, and some questionnaires.

Volunteers will also be compensated $150 for their participation!

If you have any questions, please feel free to reach out to me, Isabelle Hack - I'm the ME/CFS Clinical Research Coordinator, and would be happy to go over any concerns you might have! My phone number is (650)-503-4668.

Thank you so much for your time!

Participant's rights questions contact 1-866-680-2906",1586472054,1,0
"Sewing face masks on campus, needle broke. Desperately looking for 80/12 sewing needles from anybody who may still be around Stanford somewhere.","Okay, I know this is a long shot, but I'm desperate. I have been sewing face masks for the past couple of weeks, and was just working on a batch that I'm already late getting sent out. Of course, the universe decided now would be a good time to have the needle on my sewing machine snap in half. Also not-so-serendipitously, I discovered that I only have needles for much heavier weighted fabric, and using them on thinner fabric can easily ruin a project. I tried seeing if I could order any online, but the soonest I could get them to arrive is 8 days from now.

Does anyone anywhere on or around campus have size 80/12 sewing needles that they would be willing to part with, even temporarily? I am really freaking out about this right now and will happily pay for them, or just return them to you if you'd prefer that. I will even pay you for them *and also* return them to you if that's what it takes.

I just really need to get these masks done. There are people counting on me, people waiting for them to arrive, some of whom work in customer-facing positions without any PPE provided. I would be happy to make you a mask as well if you have size 80/12 sewing machine needles I can borrow.

I can not possibly express how grateful I will be if anyone can help me with this. I feel like I am letting people down, people who were counting on me to get them these masks, and there's nothing I can do about it.

Please PM me if you think you might be able to help or think you know someone who might. I am on campus and can give an exact location if you reach out to me and can help, and we can figure out an equidistant location to make the exchange. 
 
Thank you for reading.",1586471836,1,0
How are students who are still on campus (during COVID) doing??,"Wondering how the students still living in dorms on campus are holding up? I know there were a couple efforts to raise money to help students out, and that the dining halls are still open, but... it's got to be challenging. What are people's experiences? What do students living on campus (because they don't have other options) need?",1586471094,1,0
Do you think the fall semester will be online?,,1586464154,3,0
Prospective CS student,"hey yall! I'm considering joining Stanford's class 2024 but i haven't committed yet.

I just have some questions for the cs requirements:

* for the physics requirement, i def dont want to do it at stanford and  i have no interest in physics. i didnt take the ap exam/class and i was wondering what the easiest way to get credit for it w/o taking the class at stanford. i was hoping to take physics at my local community college but im wondering what the requirements are for that and how easy it is to transfer.
* for the science requirement, can i take a psychology class? im kind of interested in psychology anyways and was hoping i could get my science requirement out of the way by taking a class im interested in!!
* any tips in general? 

Thanks!",1586458957,2,0
Math 51,Help what is the best way to finish psets and understand material,1586456923,2,0
Mechanical Engineering Master's Impression,"Engineering alumni of Stanford, was the experience life-changing?  

I am deciding between Stanford ME and Columbia ME, with a plan to concentrate on robotics and control and also do research with professors (control, manipulation, etc).  I'm from the NYC area and love Manhattan, and that's where I want to end up in my later years.  I know Stanford has one of the best ME programs in the world, but my question is, is there anything at Stanford that I would be missing out on if I went to a program like Columbia's in the city I love?",1586445729,3,0
Hopkins Marine Station,"Hey, y'all!

I'm a future freshman (CO'24) and I'm interested in studying bio (and maybe something else? lol), but I'm also interested in the idea of studying abroad and/or at Hopkins Marine Station for a bit, the latter especially if I end up majoring in bio. 

That being said, the information on the internet about Hopkins Marine Station (at least on the undergrad front) is kind of sparse. Does anybody have any experience taking classes/staying there? And, if so, what'd you think of it? Do you recommend it if I plan to double major?

Thanks!",1586417389,1,0
How important is the regional virtual meeting?,I have to tutor 4 kids tomorrow for 3 hours (work) but theres a regional virtual meeting during my work hours. Cant skip since I’m the only teacher and fam’s buying groceries/food w my income this month. Is it bad if i cant attend it? :( i’ll be there for the official virtual tour/meeting on april 25,1586409771,1,0
How important is the regional virtual meeting ? (Prefrosh),[deleted],1586409730,1,0
Advice with undergrad college decision (Stanford vs Notre Dame scholarship),"Hi I am an incoming freshman who is interested in Economics, International Relations, and Spanish. I am trying to decide between Notre Dame and Stanford. Notre dame offered me a full scholarship (hesburgh-yusko) which includes individual programming and help and up to $5000 per year for service projects and internships. I feel like these experience could be really valuable and being recognized as a top student at ND could also be a great experience. I guess this is a really lucky/good dilemma to be in 

I won’t qualify for financial aid at Stanford, but my family has enough money saved to afford it without debt. Overall, without the scholarship to ND, I would choose Stanford without even having to think about it, but the ND scholarship makes it very compelling and I really think I would enjoy notre dame anyways. I plan on going to graduate school as well, so I could use the saved money for that I guess. However, going to Stanford undergrad is a once in a lifetime experience and 2 people I know from previous years have turned down the scholarship I have to ND to attend Stanford at full tuition. 

What have your experiences been with Stanford economics or IR? What kind of summer opportunities does stanford help you or fund you for? Do you think the Stanford brand and the overall experience is worth the 300k? Any advice any of you undergrads, grad students, or graduates have would be REALLY REALLY helpful to me as I try to decide. Thanks!!!",1586407963,1,0
Tier 3 dorms?,"Hi, I’m a rising sophomore. I was wondering which dorms were the “tier 3” dorms. Im especially looking to stay on east campus if possible.. Also, are all pre assigns at least tier 2?? Thank you!!",1586403602,3,0
how to prep for 61dm?,"how would you recommend i prep for 61dm over the summer? im currently working through axler's *linear algebra done right* and MIT OCW's multivariable calc. my prev exp w math is just being really comfortable w AP Calc BC level math, so ik theres a chance 61dm will be way over my head but i want to still give it a shot (worst case i drop to 51)

specifically, i'd like you to fill in the sentence: if i go through X textbook/online course entirely, i won't find the (atleast initial) 61dm coursework too intimidating.

thank u!!",1586401595,4,0
Are you all geniuses? Or just really rich?,[removed],1586378471,0,0
Are dining halls independent from dorms and open for everyone?,Im a bit confused by reading a few threads about dorms and dining halls. Are students who live in a certain dorm allowed to spend meal swipes only in the dining hall for that dorm?,1586367537,1,0
New MS admit here. I have a few questions about housing and transportation,[removed],1586361758,1,0
Is this the moment for universal basic income?,,1586359420,1,0
Math for a Frosh: 50 Series or 60CM Series?,"Hi guys. I'm a pre-frosh, and I'm trying to get a sense of what my math classes could be next year.

My math background is decent: I took AP Calc BC junior year and got an A+ and a 5, and I'm taking multivariable calculus this year. According to my school, our multivariable calculus class is equivalent to a little more than half a year of college multi, so I've theoretically covered half of the math 50 sequence. Do you guys think I should go into the 60CM series? I really enjoy math, and as of right now I think I'm going to major in MCS. Any and all advice is appreciated!",1586357492,1,0
Dorm Rankings and Descriptions,"Hi, class of ‘24 here! (still a little bit in shock oops) 

I was just wondering if certain dorm styles are better than others for freshmen (all-frosh vs. four year vs. FroSoCo etc.) Can someone please elaborate on some of the pros and cons of each? (I keep hearing that FroSoCo is a bad choice but I’m unsure why)

Any recommendations on how I should rank my choices? I’m interested in Management Science and Engineering if location of departments matter... 

Thanks! See you guys next year :)",1586353468,1,0
What’s the best way to begin researching courses and planning for majors during the summer?,"Where do I find all the information about the prerequisites for certain majors and minors? Are there any great tips for me to know during May and into the summer to begin planning and in prep for NSO? 

- 🌲’24",1586326798,1,0
"The endowment is twenty times annual tuition income. What are the pros and cons for and against a partial reimbursement of the lost value of labs, practical skills in-person instruction, and social benefits like group study work and meeting events?",,1586324266,1,0
MATH 51 vs CME 100 for Premed,Which one is easier to get an A in? Which one is more relevant to biomedical research or later classes? Which one has a greater workload? Which one has more difficult concepts?,1586314276,1,0
Why move students' belongings out of the dorms?,"Why bother packing up ALL the dorms on campus? I understand that a FEW, specific dorms need to be made ready for potential hospital use, but why move students' belongings out of all dorms? What is the logic to that?",1586314020,1,0
Which chem sequence is easier?,"&amp;#x200B;

https://preview.redd.it/82qer9snvhr41.png?width=318&amp;format=png&amp;auto=webp&amp;s=265f85e2ff28a707d65bc92fa239b0ad668b3b9c",1586308390,1,0
