body,created_utc,score,total_awards_received
"Exactly, I can’t stand trying to work together when no one will talk but you",1600982459,2,0
"Proof?

&amp;#x200B;

[https://www.nj.gov/health/cd/topics/covid2019\_dashboard.shtml](https://www.nj.gov/health/cd/topics/covid2019_dashboard.shtml)",1600982427,1,0
I have a different opinion than u so I’m a dumbass. Thx.,1600982205,-9,0
You’re a dumbass lmao,1600981991,10,0
[deleted],1600981463,-14,1
if anything upperclassmen should get preference considering it’s the last semester and their classes are the most important ones that should be in person,1600981431,15,0
Mr. Rutgers should have bought us all mics from the ridiculous dough he is collecting.,1600981114,6,0
The school joins the government in spying on you with the motto of you shouldn't need to worry if you aren't doing anything wrong.,1600981001,1,0
"yes, what he said. make him president",1600980988,19,0
What happened to the bot?,1600980872,1,0
what’s this?,1600980831,3,0
check the cs discord! (link in sidebar),1600980569,1,0
If I get accepted I'll deal with it. Just let me get into my favorite college please.,1600980494,1,0
I applied in summer last year and got the scholarship money in spring next year,1600980245,1,0
U a snowflake lmao,1600979928,-17,0
Well now I’m SAD,1600979606,3,0
Why tho? Cuz I thought nobody took it yet,1600979534,1,0
"Same topics, different questions",1600979467,1,0
"when you consider that they're going to be distributing housing contracts of some form with only ~2 months to process them all (as opposed to ~5-7 months since housing process begins in the spring) i can't imagine that anyone other than extreme cases, international students and MAYBE if rutgers is generous, freshmen and seniors. 

rather than the estimated ~15,000 students that live on campus, the size of the above groups are proportionate to a 2 month processing time, whereas everyone usually takes 7.",1600979457,1,0
"Protip - if you're the type of person that just naturally jumps in and finds yourself as the default leader of a group discussion, use that position to prompt others. Take note of who has contributed and then actively ask the silent people to add their thoughts or observations by gently prompting them. It's a valuable skill to have (making sure team members are participating) and it's not easy to develop. No, you're not going to get extra credit or a better grade, but in terms of developing soft skills, it's a great opportunity to practice. Sometimes people in breakout groups don't speak up because they're afraid of being judged or they're not confident in their thoughts. Other times they don't speak up because they're unprepared and have no interest in contributing.  Show understanding to those that are timid. Show no mercy to group project slackers. Ever.",1600979402,15,0
17.66%,1600979292,0,0
"Sad, I wasn't able to try their smoothie before the quarantine and I still dream about it:-(",1600979192,1,0
Yea lmk I would like to hear how this goes!,1600978838,1,0
Racial slurs and swatstikas isn’t my definition of fun. Thats embarrassing that you consider that to be fun.,1600978834,12,0
i mean....we're not learning jackshit this semester anyways...why not have some fun?,1600978769,-26,0
I yelled at my niece while unmuted. That was nice,1600978689,1,0
We should be allowed to just drop and hibernate until we got enough energy to live again. But i guess shit dont work like that u gotta keep grinding even tho ur dead exhausted,1600978626,1,0
"Pretty sure that webex does, and webex is the official virtual platform of Rutgers University",1600978602,2,0
"Probably just that zoom doesn't wanna spend the money.

It's also possible to have the professor control who may speak and present though, so the problem probably isn't purely technical.",1600978249,2,0
"Ah, good to know. Thanks!!",1600978119,1,0
Livingston is open and gerlanda’s is also open on busch,1600977993,2,0
"Can any CS types help me understand why Zoom doesn’t have a way to individualize the links for each participant? If each invitee got a unique code for the meeting, then it would be trivial to figure out who had shared the invitation (since the Zoombombers would be using that person’s link) and they could then be disciplined appropriately.",1600977979,3,0
[deleted],1600977977,1,0
"I think you could get it after your first year, if your cumulative GPA is 3.7 or higher. It’s done by invitation, so you’ll get an email sometime after the spring semester ends (I wanna say in June) if you are eligible.",1600977763,1,0
"Mine was $1000, I think that’s the standard amount that most recipients get. The list of awards they match people to is [here](https://catalogs.rutgers.edu/generated/nb-ug_0507/pg21698.html) (possibly somewhat outdated, but the one I got is on there).",1600977619,1,0
is there like a year requirement? Like you have be at least a sophomore or something like that? This is my first semester and it sounds interesting.,1600977458,1,0
how much was it ??,1600977368,1,0
yes holy shit. I always find myself having to be the one to start talking fml,1600977359,2,0
lawl. nice self own college boi. you'll go far.,1600977285,5,0
"As of right now they haven't announced what proctor software, but Dr. G did confirm that there will be no video monitoring at all.",1600977264,2,0
Yah I'll find a way to make it work thank you 🖤,1600977119,1,0
oof,1600977067,7,0
"THANK YOU! I hate when people don't talk. Like I understand this entire thing isn't ideal, but staring at each other in silence isn't gonna help any of us. It's not that hard smh.",1600977063,1,0
"""                            """,1600977029,1,0
Yea the one that happened today was already set so that only Rutgers students could join. I’m not sure how this is happening if that was the case.,1600976946,3,0
[deleted],1600976887,-5,0
found the incel,1600976798,3,0
"Nope, that's closed. Looks like Szechuan Ichiban is the only restaurant open on Busch :(",1600976685,1,0
Every week someone has to explain this: the numbers don’t add up because not all tests have results ready,1600976596,4,0
"It’s alright, it’s gonna be okay",1600976385,1,0
"Oo, nice to know. according to the  Rutgers website, everything is closed. Is smoothie bar open in Busch, don't you know, by the way?",1600976302,1,0
Tell ur professor to make sure they have it set so only rutgers users can join. this way if someone zoom bombs theyll be able to track them down so hopefully people wont do it.,1600976239,9,0
[deleted],1600976175,-2,0
I was in a breakout room and my mom was trying to call me and I said “Mom I’m in class right now what do you want?” but I didn’t realize my mic was still on,1600976119,1,0
"Back when everyone was sent home, a bunch of the computer lab computers were being used as part of this!",1600976076,1,0
Isn’t that because those 30-ish people did the tests but haven’t gotten their results back yet? They’ll just be included in next week’s update.,1600976047,3,0
They're not trying to make your life hard. They just don't care. Get used to it.,1600976029,1,0
"It’s happened in two of my classes this week and both times it’s been incredibly frustrating and had to end the lecture. Like I am paying way too much money for online classes, I’d at least like to be able to learn at least a little something from them.",1600975891,5,0
Listen man I can’t promise I’ll be the first guy to speak but I can guarantee I’ll be the second guy,1600975889,17,0
"I assume you’re referencing the email that went out today. So you’re saying that there are more cases on campus than are being reported?

Also I don’t understand why the positive and negative number of cases don’t add up to the total number of tests",1600975771,7,0
Literally was about to post but u beat me to it,1600975727,7,0
I swear I had one professor in a summer session class completely ignore the mylab scores due to the entire class complaining how some sections would take hours to complete and he was assigning 1 to 2 chapters a week.,1600975259,1,0
"I was watching an anime and the intro music was fucking blasting and my mic wasn't muted. Outed myself as a fucking weeb.

People in the class were laughing too on the cams and I was like fuuuck.",1600975199,1,0
"I'm not getting my hopes up ever again.

Signed: someone who made the dumb assumption that by Fall we'd be back to normal.",1600975169,1,0
They started on the golf course and now they’re with their offspring scattered around from ARC to the Student Center,1600974984,1,0
Fucking hell. Just went through this where our teams were put together to offer feedback to eachother and like 70% of the people didn't respond or do anything.,1600974291,4,0
the awkward silence in a breakout room is the worst,1600973915,6,0
Someone in a recitation yesterday played music out loud while unmuted. The chat roasted her for a minute. I had a hard time finishing up because I was giggling too much lol,1600973763,1,0
cool i went like the first week and they were closed but ty for letting me know will go get some king pita,1600973671,1,0
Yeah there wasn't any announcement. They did open right after the semester started,1600973506,2,0
"Translation- ""We don't want to miss out on another semester of housing/dining fees""",1600973491,2,0
They were closed in early fall so I didn't even know they were open,1600973388,1,0
"On College Ave, King Pita, Currito's, Subway, and Panera are open. Szechuan Ichiban is open on Busch. I think the other student centers are closed.",1600973383,3,0
"As a current grad student and RU ‘19 alum with 2 W’s on their undergrad transcript, I want to say don’t lose hope in grad school! It’s a worldwide crisis that we are in, and there is a mutual sentiment across many students (myself included) about motivation to continue coursework. I feel that there will be slightly more grace in admissions this year due to this",1600973244,1,0
can we have another PSA for the guys in breakout rooms that dominate convos and dont let anyone else talk or mansplain the topics 👉👈,1600973104,11,0
"Yea its a normal feeling but its all in your head. As a board member of a few clubs trusts me we want to talk to new people. We WANT you to interrupt us and we WANT to get to know you. Just send a meme or hop in on a conversation, I feel like it's even easier to do now since most clubs have slacks or discords so you don't actually have to butt in. 

If ur into art at all (or not!) check out RAD [https://www.instagram.com/radrut/](https://www.instagram.com/radrut/)

None of us know each other and our discord is really friendly.",1600973008,1,0
Anudeep shut up,1600972951,3,0
"There's no way they'll pull this off, cases are rising again in NJ",1600972896,1,0
"[Voting is arguably the most important tentpole of our democracy. If you have not already, click this bold link to find out how to **register to vote**](https://vote.gov/) The deadline to apply is October 13, so apply now. This year you will receive a **mail in ballot** to cast your vote. You do not need to separately request one and you don’t need to go to the polls to vote. Send the ballot through the USPS or use a ballot drop box in your county.
To find out who you will be voting for in advance, visit [Ballotopedia’s Sample Ballot Lookup here](https://ballotpedia.org/Sample_Ballot_Lookup). Remember, your vote decides the future of this nation. Take pride in your decisions in continuing our democracy
For more info, see [this post](https://www.reddit.com/r/rutgers/comments/irylwg/there_is_one_month_left_for_you_to_register_to/)

*I am a bot, and this action was performed automatically. Please [contact the moderators of this subreddit](/message/compose/?to=/r/rutgers) if you have any questions or concerns.*",1600972870,1,0
[removed],1600972870,1,0
"Idk much about accounting as a major but I do know it is a demanding field career-wise and you really have to like it to deal with all that stress.

Regardless they are very different career paths and not really comparable other than they are both in the business school so it depends what you want to ultimately do.",1600972355,2,0
no but the sentiment probably applies there too,1600971910,4,0
Amen.,1600971715,5,0
oh i thought the food places were closed,1600971713,1,0
What stores in student center are open rn?,1600971458,1,0
Lol is this for gen bio recitation?,1600971211,1,0
"Almost all clubs actively seek out new members and are happy to talk with anyone interested, and if they don't they're probably not worth hanging out with. Try not to sweat it too much",1600971021,3,0
I can see how people like online classes but you're missing out on all the best parts of college. And you only get that opportunity once in your life. Let people come back if they want to come back.,1600970992,2,0
LMAO thank u so much,1600970979,1,0
Bless ur soul,1600970968,1,0
I thought my exam was October 6th which kinda messed me up. Should have been on top of things but being at home it weird. I’ll give an update on Monday,1600970962,1,0
Straight to the point I love it,1600970921,1,0
Lmaooo seems like that’s what it’s gonna be,1600970908,1,0
Thank u. I’ll provide an update on my grade after.,1600970893,1,0
"Yeah I’m not sure why it did that when I edited the video, couldn’t find a way to remove it either",1600970201,1,0
I kept waiting the last 11 seconds to see if something was gonna happen,1600970171,2,0
Oof guess i aint reddit enuff. Its called a sarcastic comment. Sarcasm meaning the intended meaning is actually the opposite. Now you know! Some ppl may want to know ab this fascinating literary device before taking expos,1600970118,1,0
"Why would you cram for a class especially like Orgo. This is a class that you can’t procrastinate on. The good news is that this is the easiest chapters in Orgo. I would recommend doing the suggested problems of all 4 chapters to make sure you understand the material. If you really don’t have the time for that, then do enough problems a chapters to where you understand the concepts",1600968555,1,0
so Dr. G and daddy Holloway are buddies ?,1600968169,1,0
And it’s only getting started,1600967107,1,0
i’ve had it for multiple psych classes,1599978456,1,0
Actually we still use a form of Sakai (Laulima) where I teach. Also many of us went through a boot camp over the summer to learn how to make our Laulima courses clearer than usual. In the college that I teach at they provided Laulima templates and online tutoring so there is a degree of standardization across the different departments in my college. But...that’s only one college at my university. Not sure what other colleges are doing.,1599978381,1,0
Every class I’ve taken. Calc 2 and 3. Matlab. Micro. Statics. Dynamics. Materials. PEE. I’ve spent at least 1000 dollars on this bs,1599978265,8,0
We are using Sakai at my university.,1599977998,2,0
That’s a bummer to hear that many professors there didn’t prepare.,1599977978,1,0
That’s a problem too. The good thing is my college at the university I’m at actually did provide a “boot camp” for instructors to quickly learn how to move online. Since we had the same person teaching us there is standardization in the way we created our Sakai courses. But....that’s only one college at my university.,1599977907,1,0
"Honestly man communication takes many forms from playing a video game to eating together. You can also straight up call. It makes sense that it harder to talk to friends because you see each other less in person but if you choose to connect with them in a way that makes sense you can still get that feeling of closeness.

Also imo notifications are a trash way of measuring friendship because the only thing that shows is how often you talk not how close you are.",1599977344,7,0
"I just dropped and added two classes yesterday. Today and tomorrow (and probably Monday too), I'm dying. 0/10 do not recommend, but as always your mileage may vary.",1599974957,1,0
"I've taken it. Really easy class, but def worth your time. Whatever you learn there you'll be able to apply to future leadership roles and career opportunities. Also a good place to meet people with similar aspirations to you. Met one of my roommates there who is also a transfer linguistic major lol

DM if you got any questions about it. Good luck!",1599974183,2,0
"TRUE actually. Livi dining hall is the best out of all the campuses. If all campus dining halls were like Livi, I’d change my grading. Livi and any time there is a special event like king Neptune, food is better than decent imo",1599974105,1,0
There's also a class in Religion that's the Hero's Journey and Harry Potter. I wish I could take that. lol,1599971877,1,0
Take Math 103 for QR. It is easy if you like math.,1599971813,1,0
Heather Pierce. She was an amazing professor. 100% do recommend.,1599971795,1,0
same here. none of my friends talk to me anymore and when they do it’s because they need something from me,1599971783,5,0
What class is DLD?,1599971672,1,0
Miles better than Canvas,1599971445,2,0
Physics 203,1599971421,5,0
Straight out facts,1599970848,1,0
"&gt;Not sure if it just me but I feel like I can go hours without looking at my phone to come back to it and find 0 notifications

Story of my entire life-- in my case, actually, things are better now for me than they usually have been. I've made socializing a priority for myself since late 2019 (coincidentally, right about when coronavirus was first detected), and things have improved quite significantly for me. But even now, I can go hours (even the whole day) away from my phone without a notification. I suppose it goes to show how asocial I used to be that this is an improvement. 

I also hope that all this can end so that we can lead nicer social lives.",1599970327,12,0
"I don't even know how to handle this class, it's been 2 weeks and we haven't really learned anything.",1599970142,1,0
"Depends on your department. My major was art history, class size was generally 30-40 for 100-300 level courses and then maybe 15 for the seminars. Classics on the other hand can go either way. Greek and Roman Mythology has 270 students. Roman Republic had maybe 30-40 again.",1599969230,1,0
Theater appreciation.,1599968952,1,0
"I actually wonder if college students will be put up in the queue. A lot of US cities and businesses rely on us so strongly, I could see it being at least considered.",1599968851,5,0
I’m not close to anyone I met at Rutgers. Keep your old friends close. It’d hard to get new ones.,1599968682,11,0
"When I took both classes neither required OOP knowledge, that would be software methodology which isn’t a pre-req to neither 112 nor 344",1599968155,1,0
Yeah facts lmao. He a big big snitch. He can post on reddit all he wants and try and be funny but doesn’t make him a good teacher. Heard he’s quite terrible as a professor,1599967541,-1,0
Same,1599967320,12,0
Invest in $TSLA stonks to mars,1599966448,4,0
Why not use Find My iPhone? https://www.apple.com/icloud/find-my/,1599966260,7,0
Wall Street wya??,1599965531,7,0
"I have. They insist that 111 is really all I need to take and succeed in the class. Heck, I've even met students who have no programming background and they're struggling just as much as me. 

But, to be frank, it does feel like a combination of 112 and 344. The section I'm taking is not theoretical or research-heavy by any means; it's mostly just programming. That being said, I'm still seeking help with reviewing OOP and other related concepts.",1599965347,3,0
"Omg shut up already. I know youre nwrvous but no one knows, and if they say they know...you really wanna base your life choices arouns a reddit rumor?",1599965186,-12,0
I honestly have a feeling we're going to be online again.,1599964940,8,0
"You gotta talk to your program director, esp if you have no experience",1599964725,1,0
"I'm a graduate student. Part of my program is to take 512, which is basically a combination of 112 and 344 and intended to be a continuation of 111 (or rather, as my program's directors say...).",1599964663,2,0
"I don't know why, but this picture makes me really melancholic. Reminds me of what things used to be like. I would study like all day at the desks in the top floor of those livi apartments. The view was magical",1599964552,4,0
Pls stop asking this question thank you ❤️,1599964169,-9,0
"If you are an undergrad I wouldn’t take 512, take 112, 205, 206, and 344",1599964141,3,0
"Are you an undergrad taking 512 in place of something else? Have you asked anyone in the Rutgesr CS Discord yet? It's linked in the stickied post at the top of this subreddit. They don't have a channel specifically for 512, but they have a general level-500 channel and channels for both 112 and 344.",1599963764,1,0
"I beg to differ. Textbooks, if you like them, stay with you for life. Why should one pay extra to do some kind of homework that has no value, other than the fact that the publishers have created more schemes to scam students and faculty are not realizing this.",1599963439,19,0
It's absurd.,1599963354,2,0
"In my opinion, it’ll be a bit more hybrid based. 

But honestly, nobody knows. Things are looking good now, but there could be a sudden spike tomorrow. I only say that because some people are saying there’ll be another lockdown because flu season is supposed to be really bad this year.",1599962785,9,0
"A problem is also getting people to take the vaccine, and inducing herd immunity. In my immediate family, I’m the only one who is gonna take the vaccine no questions asked when it comes out. On top of that, there’s the question as to who gets it first: medical staff, children, elderly, etc? In contagion they do it based on a lottery.",1599962666,9,0
"not only does there have to be a vaccine (and enough of one) it has to be mandated and without enough testing that wouldn't be ethical. if its not mandated half of people wont take it (we can't even get ppl to wear masks so, and don't forget the 100s of anti vaxers) and would put vunerable people who can;t take the vaccine for medical reasons at risk. Also rutgers is not a closed campus so aside from individual buildings there is no way of screening people coming to campus

so yeah 95% chance of it being online",1599962193,16,0
"It’s also good to keep in mind that even if we have a vaccine at the end of this year, distribution is still a huge obstacle. I’m not sure what the situation is now with having enough vials, but the last I heard a month or so back is that we might not have enough",1599961560,17,0
I agree but textbook+hw are kinda together,1599961499,-4,0
[deleted],1599960919,1,0
I have no friends at Rutgers ✌🏻✌🏻,1599960848,57,0
Its like this for calc as well as micro i believe and a lot of students take those classes,1599960752,13,0
"It’s all dependent on a vaccine 

Vaccine passes trials = inperson spring
Vaccine doesn’t pass trials = online spring

Unlike cal and penn state Rutgers has its own rapid testing infrastructure. So with a vaccine it would would be pretty easy to contain outbreaks on campus.",1599960722,13,0
"Yep, been like this all quarantine Tbh but a lot of it is on me i havent been reaching out much. Ive been real deep in my introvert bag i guess",1599960685,12,0
the upvote is much appreciated 😁,1599960518,10,0
I’m in the same boat. We’ll get through it.,1599959931,12,0
"My fav is my class where emailing questions after class is required, but getting an answer is not guaranteed lmao",1599959827,21,0
god this is so true. I have to carefully look through each canvas page (and I literally have 8 classes rip) every single day otherwise i get so paranoid I'm missing something important,1599959747,9,0
100% agree.,1599959484,6,0
[deleted],1599959220,1,0
"Art Appreciation Online, 2 hours a week and you can get an A.",1599958908,3,0
"Well, we are paying for the garbage that they are getting paid for, and had all summer to plan for. Sadly it seems many professors clearly did not prepare at all.",1599958767,4,0
"the Rutgers bio department is notoriously difficult, but the teaching quality is excellent.  the Rutgers chem dept however is notoriously inept and a disaster in terms of teaching quality and competency.   Expos is also a massive pain the ass. The physics classes are average.",1599958655,1,0
"I would suggest people take a look at this first. 

[https://rlc.rutgers.edu/student-services/peer-tutoring](https://rlc.rutgers.edu/student-services/peer-tutoring)",1599958558,6,0
If I could predict the future I wouldn't be in college,1599958434,60,0
*Angry Pearson noises*,1599958402,36,0
Yes Lmfaooooo very  crowded,1599958350,0,0
"No one on this Reddit knows. 

I would err on the side of caution and assume its online.",1599958340,23,0
This person voice is so soothing,1599958291,7,0
No one here really knows. Rutgers hasn’t announced anything and haven’t said when they might.,1599958286,10,0
"I am extremely disturbed by this idea that faculty are asking students to spend more money to do homeworks, etc. I have not seen such courses yet. Can people list down such courses at Rutgers?",1599958137,27,0
"Can confirm, have seen it",1599957913,3,0
"Only the Rutgers bus, master of all 4 campuses, could save everyone. But when the world needed it most, administration changed all the bus routes to colors that made no sense.",1599957894,10,0
PMd you,1599957713,1,0
Yeah on a clear day you can see it,1599957621,3,0
Ok thank you so much!,1599957558,1,0
is that true?,1599957498,3,0
"Once you drop it you drop it, no cancelling. If you want your old class back then just re-add it. But if the old class is closed then you just have to wait for it to reopen",1599957427,7,0
I blame the institutions for not providing adequate guidance and enforcing some sort of standardized format,1599957282,7,0
So do I add back my old class?,1599957233,1,0
