body,created_utc,score,total_awards_received
"That’s debatable, I have a 4.0 gpa in accounting with an internship under my belt and will likely start at 62k.",1603110458,1,0
Exam 2 will be on the second third of material.  The final will be 50% last third of the material and 50% first and second third.,1603110327,1,0
"As of right now we're looking at 33 percent capacity for dorms (about 5k people) and ""increased in-person instruction"", whatever that means",1603109097,1,0
"Yea we don't know...I think most courses will be remote but they will increase dorming, this is a good compromise as I mostly miss being on campus.",1603108721,1,0
"I appreciate the Mitski, nice work :)",1603106238,1,0
"I listened to it, not really my thing",1603104734,1,0
Respondus is only more secure than ProctorTrack when it’s not recording your face and audio. Any other program that does the same stuff as ProctorTrack is just as dangerous.,1603100160,1,0
Song name?,1603097193,1,0
Why there is no csgo club😂,1603096911,1,0
"This reminds me of when I fell asleep on the REXB and woke up just as we pulled away from the last stop on Cook-Doug. Class was gonna start in 5 mins. Good times (,:",1603091447,1,0
this reminded of this time when I was a freshman where I slept through an entire round trip on the H bus and woke up at the same bus stop wondering why we hadn't moved after 45 min,1603091110,1,0
[removed],1603089212,1,0
"Wow. I lived in one of the towers in my senior year, and seeing them go up in your server made me feel really nostalgic and mildly sad. Really great work!",1603088119,1,0
You Tried album out everywhere,1603088118,1,0
[removed],1603085906,1,0
"Yeah. I got to agree with the other posts here. It would be very rough trying to get into SOE (School of Engineering) or SAS (School of Arts and Sciences) with a 2.5 GPA. 

Go to community college first. Do at least your first year there. The first year of engineering (which computer engineering is a part of) isn't really major specific. You take basic courses that are taught at a lot of community colleges. Here is a link to the electrical and computer engineering (ECE) handbook, which tells you all of the courses ECE majors take:

[https://www.ece.rutgers.edu/sites/default/files/handbook/ECE-UG-Handbook-September-2019\_Class2022\_v2.pdf](https://www.ece.rutgers.edu/sites/default/files/handbook/ECE-UG-Handbook-September-2019_Class2022_v2.pdf)

Go to page 10. Look at the freshmen year courses (17 credits in the fall, 15 credits in the spring).

You just have to take these courses. Make sure that the course you take at CC can be transferred to Rutgers. Sometimes, the courses at CC might look the same as the ones at Rutgers, but Rutgers will refuse to accept the credits. You will have to reach out to SOE for more information about what classes/credits will or will not transfer.

Now I will echo the advice from other posts. A GPA of 2.5 is not good at all. This means that you need to change your approach towards academics and studying. Please take your CC education seriously. Rutgers SOE will not admit you if you get a bunch of C(s) in your CC courses. By getting good grades in CC, you can demonstrate to Rutgers and the admissions team that you have changed your mindset towards your academics and that you are ready. 

At the end of the day, your success rests in your hands. 

I wish you the best of luck!",1603085254,1,0
[removed],1603083496,1,0
"I’m a former intern and an incoming full time Dev at ADP. I went through the same process (in person ofc) last year and you usually hear back within 2-3 weeks of the on campus interview. It’s a blast email so everyone who are advancing to second round get then at once, and people who got rejected get it at once as well.

You can always contact your campus recruiter fir any information and also feel free to dm me if you wanna learn more about the GPT program and life at ADP.",1603083479,1,0
"No I mean I was being recorded. But yes, it was much more secure than PT.",1603083044,1,0
"I don't think most CC have computer engineering as a major, keep that in mind.  I wanted to do that major but had to settle for computer science because of that.",1603082834,1,0
We don’t know. November 9 is schedule release,1603081971,1,0
"eh, i’m sure most ru students are rational about this and don’t take politics too personally 

I’d love to see Trump win but if he doesn’t, i’ll live

I just don’t want Joe Biden bc I strongly dislike Harris (more left leaning than Bernie is pretty much communist)

my parents came from a socialist country, they came from dirt and built their way up here, no way in hell are they (or me) going back into that shithole system of government",1603081663,1,0
"Theres practice rooms in Mortensen, Maryott and the Music Annex but I think bc of covid they're only open to mason gross students right now. You could still try asking though if they have empty time slots.",1603081627,1,0
AMD and TSM calls for me,1603081523,1,0
[deleted],1603081334,1,0
Are u on college ave theres hella plugs there bro,1603081290,1,0
Amzm 3400 10/23 ebay 55 10/23 lol good luck man,1603080958,2,0
[deleted],1603080899,1,0
"Yeeee, they both suck, curious to see who gonna win",1603080512,1,0
"The browser screen could be recorded, it’s a modified browser, but it doesn’t want access to personal info.",1603080397,1,0
What about merit aid.  Is that even a possibility?,1603080262,1,0
How south are we talking? Below the horizontal extension of the Mason-Dixon line?,1603080070,1,0
"Considering they go into the Livingston nature preserve and kill native songbirds... I am sure they are fine. As cute as they are, outdoor cats are causing massive decline to songbird populations.",1603079938,1,0
"lol if you are from New Jersey, you are essentially accepted",1603079812,1,0
Hehe stonks,1603079767,1,0
"I was monitored using respondus, so it can happen",1603079608,1,0
[removed],1603078345,1,0
"You will probably have to go to Community College first. There is nothing wrong with CC. I know people who dropped out of HS, went to CC, came to RU and did well after graduation. If you get accepted directly then you probably will not perform well at Rutgers.

2.5 GPA is bad. My friend graduated Rutgers with a similar GPA. He had like 10-15 F’s on his transcript and he is struggling to find work.",1603078004,2,0
World edit. Only terrain and rough outlines of buildings are generated,1603077806,1,0
Online Tours in a nutshell,1603077584,3,0
[removed],1603077532,1,0
This is super cool — I can’t imagine the amount of effort put into this lmao. It looks really incredible :),1603077286,2,0
[deleted],1603077277,1,0
wait do people build these by hand?! i always thought it was semi-computer generated,1603077271,1,0
I feel your pain. I have a prof that schedules office hours by email and never answers his email.,1603077183,1,0
Gamer moment,1603077090,4,0
We’ll see about that soon enough 👀,1603077044,2,0
[removed],1603076906,1,0
[removed],1603076001,1,0
"this is the way.

current positions: TSLA 460c 10/23 and NFLX 560 10/23",1603075956,1,0
"Every time I say I regret missing out on Tesla, it goes up another 10% and I regret it again. Been saying that since it was worth $810 pre split lol.",1603075818,3,0
Project Mgmt. in treasury solutions... a lot of consulting w clients,1603075788,1,0
That would require actual effort put into proving students learned. Much easier to just force basic recall rather than actually testing mastery.,1603075637,2,0
"The blackboard/canvas is a good point. I think I know who this prof is, and they generally prefer blackboard discussion posts.",1603075593,1,0
"minecraft virgin here, could you legitimately put a design like this on your resume?",1603075497,0,0
"Lol yeah this is pretty dumb. We all know there’s only gonna be protests and riots if Trump wins. If Biden wins, conservatives honestly wouldn’t care.",1603075234,1,0
Tell me what I want to hear not what I need to,1603074993,3,0
No just yolo options that expire this week,1603074842,2,0
Drink too,1603074477,1,0
That’s amazing! What kind of job title/role is it?,1603074354,1,0
my Tesla calls are gonna print tomorrow,1603074326,2,0
I invest in option equities for stocks,1603074301,1,0
Sr. In BAIT -  offer from bank - 80k -3.45GPA,1603074119,2,0
This is some genuinely annoying shit. I hate that some professors are waiting till the last second to post things. It really makes time managing things a pain in the ass,1603073069,3,0
"Here is my advice if I were in your position, first make sure these first three steps are completed. 

1) Send your email via your school email account, not a personal one.

2) Put your section number, RUID, name, and subject matter into the subject line

3) Read the syllabus and make sure you are sending it to the correct email address and see if there are any email rules you are violating that are listed in the syllabus.

If you have done the three steps above, then here is my opinion/advice:

If I sent a professor 3 (three!!!!) emails to their listed email (on the syllabus, class website, or department directory) and I didn't even get so much as a response or an ACKNOWLEDGEMENT, I would assume that they are ignoring me or they aren't checking their emails. Either is unacceptable considering that I am paying thousands of dollars for an education.

 I understand if a professor needs a couple of days or a week (and that is very lenient) to respond to all the emails they may get in an online format. It would be fine even if a professor replies with a message stating that they are swamped with emails and they need an additional day to reply.  But, not replying at all is unprofessional at best, and laziness at worst.

My resolution would be:

1) Forward the original email to the professor and write a small message that states that you are following up on trying to get an answer to your question/request that was asked on this date (write down the date the original email was asked). CC the dean in that forwarding email. Give the professor a couple of days to reply. If he/she doesn't, then write a direct email to the deans office (that usually puts your situation on the fast-track) describing the situation.

&amp;#x200B;

P.S. Most professors are great and reply to emails very quickly. Some even reply to emails within minutes or within the hour.

&amp;#x200B;

Good luck resolving the situation!",1603071794,1,0
"Looking back though it wasn’t that bad, plus it’s extremely useful for everything else you ever do.",1603071297,2,0
Your flashbacks are my reality,1603070717,1,0
You can try applying to Rutgers-Camden and do a school to school transfer which would be the easiest way to get to New Brunswick. But either way once you get to a college just get ur gpa up and transfer because they wont be looking at anything from highschool from there on,1603070207,1,0
"Honestly, it’s super confusing at this point. For Rutgers Newark, the website got updated to say they’re gonna try to get more kids to come back,  whereas for the spring, whereas the Dean of arts and sciences sent us a mass email saying “we don’t know yet but it’s probably gonna be online.”",1603069807,1,0
"I had bus naps built into my routine every week, with the warm bus, the drone of the motor, and the swaying, it was amazing to get some rest in the middle of the day.",1603069776,2,0
It's like they want us to sue,1603069585,3,0
"again, depends on the company. My friend's company is giving them election day as a paid holiday, while other companies will go on business as usual. And even if it's the latter, you can still take the day off yourself (granted i know there are lots of jobs that don't have pto, i'm speaking from my experience with office jobs and construction related jobs alike. tho even in my latter job I had the ability to refuse work that was obviously unsafe. My point is, there are ways to make life a tiny bit easier on yourself at work. It's normal to ask for accommodations when you need it. )",1603069342,3,0
"Get your AA/AS at community college and transfer in. Use CC as a stepping stone to beef up your resume. Even if you somehow get into RU, succeeding in CE might be really difficult for you straight from HS.",1603069316,2,0
"I walked over it today, it's not blocked off anymore!",1603069136,1,0
"thank god we’re getting a break 

ill be too busy celebrating trump 2020

but seriously we are supposed to be trained to live in the real world, this is pandering to a bubble",1603069069,2,0
We have over 50 people and will be taking the exam in the auditorium we used to take tests in. Before the pandemic just about every seat was filled and definitely no space to social distance. Of course they are requiring masks which I am not looking forward to. We used to take exams on examsoft but I guess they are too worried about potential cheating.,1603068937,1,0
Poo pee. Squabb. I'm drunk.,1603068787,0,0
"I can't say for sure but there is this website that students applying to grad school for a specific major put their status and the school they are applying to and whether they are applying for masters or a phD.
It has a ton of data and most students are generous enough to provide details. They update the status when they hear back from the school. 
The website here  https://www.thegradcafe.com/ 
If you put NYU and the grad major you want, you will be able to have an idea of the status of the students being admitted. Then you can gauge your chances.",1603068603,2,0
Honestly for your best shot at getting in make sure you apply to SEBS. I didn’t get into SAS or RBS from highschool but got into SEBS then transferred out of it after my first semester. Best of luck dawg,1603068507,2,0
It’s between Hickman Hall and Mabel Smith library on Cook Doug,1603068487,1,0
"Fun fact this bridge has quite a bit of flexibility to it, if you get three people working together you can sway it side to side about a foot in either direction. Might go more but it’s super sketchy once you get that much movement in it lmao",1603068395,1,0
"But where though? unless your class has 5 people, what room would even have the space for everybody + social distancing? Can't they just make you turn your webcam on during the exam, but have a person monitoring instead of creepy software? IMO if you're that worried about cheating, your exam isn't difficult enough anyways.",1603068255,2,0
I think we have at least one exchange student in my program. Not sure how this is supposed to work.,1603068119,1,0
I already have a place but my friends are looking for the spring because they’re underclassmen and probably not getting into a dorm. I’ll let them know thabks,1603068110,1,0
I assure you that no one is moving presentations for the election. It doesn’t happen in the real world. Especially not in a year where ballots are being sent in via mail and not even a full dedicated Election Day at the polls like we typically have.,1603068092,3,0
"It’s the 2 and 3rd floor of the house. You have separate doors, separate stairs, and separate locks separating the 1st floor and your two floors. Also all the parking spots are yours. First floor doesn’t have any",1603068031,1,0
You can definitely go to cc for 1 year and a boost your gpa and just transfer to RU. I along with many of my friends did that,1603067970,2,0
I think you should go to a community college for a year or two. Make sure your GPA is high and then transfer over to Rutgers.,1603067920,6,0
"Yeah I don’t wanna dishearten you, but sugarcoating isn’t gonna work either lol, that gpa is a MonkaS. The rest of your profile is diverse and a great SAT can boost you. Apply to SAS as well for sure and then you can transfer if SAS accepts you and SoE doesn’t. Gl my dude",1603067904,5,0
"Sorry I guess I should've specified this is for the Blackwood ""campus"". So I'm not sure if the rules are different but we've been told we are following the same rules as New Brunswick so I am not sure why they are making us travel to campus to take the exam.",1603067879,1,0
"Lets say I would like to go to NYU, woukd that hinder my chances?",1603067875,1,0
"I mean, that depends on your employer and industry tbh. Like, yeah, nobody's gonna shut the whole office down for the week after election, but moving around a huge presentation or using PTO to take election day off are totally fair game.",1603067797,3,0
"I can't really say or else I'll dox myself, but it was a small college (about 5,000 people) in the Southeast.",1603067587,3,0
"Then that also depends whether you are going for a phD or a masters.
The acceptance is generally higher for masters since you are paying. So they really mostly don't care about the w or the c (unless you are applying for really selective schools). 
You are double majoring so having more credits than the average student might justify having more W's than the average student. 
Phd's, however are more selective but your research and recommendation letters matter more than grades in this case.
Don't beat up yourself over it. It will all work out at the end.",1603067470,1,0
BRUH WTF,1603067364,3,0
"yeah, exactly! 😂",1603067337,2,0
"This is ridiculous. Sorry, but once you graduate and enter the working world no one gives a shit if you’re upset over the election results. Life goes on.",1603067138,4,0
December 8,1604161684,1,0
School of engineering. That puts me at ease then. Hopefully they respond around the same time,1604161042,1,0
That was me even before quarantine started,1604160771,1,0
your pun was received,1604160624,1,0
"Social media is a highlight reel of your life. People don't display bad parts of it on their life.

What I've been doing is doing stuff alone, and being comfortable with reading, watching shows, among other things, but also running a Discord server with my college friends playing Among Us, and just chatting with them on the regular.

Discord is easy to keep in touch with people, and check in on others.",1604160604,1,0
Oh I'm not getting ANY of these,1604160412,1,0
"it is definitely easier overall but good lord make sure u pick a good professor. my public speaking class that went online in spring, the professor seriously graded us in comparison to how maybe obama speaks publicly, completely ignoring how stressful the semester had become and still is. some professors be grading way too fucking hard for some goddamn public speaking speeches 💀",1604160096,1,0
Yeeeeeeeerp,1604160087,1,0
"people like you tend to come back to read the comments you made anonymously because you live day to day hoping people feel something about you - so when you inevitably come back to see if anyone reacted to your comment, i hope you understand you're a weirdo who needs help getting over your deep rooted issues. try therapy!",1604159922,1,0
WRSU is fully active and still training people to become DJs if you live close to campus. Lmk if you're interested in joining the radio station! 😁,1604159809,1,0
"ok, hope you're right",1604159698,1,0
Omg bruh I feel you all these damn liberal indoctrination centers wanna stop us from partying 🥵😵😫/s🤑🤐😬,1604159564,1,0
I don’t think it matters if you go over the 4 page requirement. I would be surprised if they cared about that,1604159559,1,0
So title and name? I'm not sure what else you would need besides that,1604159104,1,0
"I got my reply by December, what school did u apply to in Rutgers?",1604158868,1,0
Is this a joke lol? You think drugs like bath salts should be legal?,1604158761,1,0
"Oh when I mean formatting, like include your name and stuff lmao. my b",1604158739,1,0
"Just saw this message and this is actually what i did. I ended up taking calc 136 a year after 135 because the Econ department came out with a new certificate that would require it. I ended not remembering some of calc 1, but it’s still fine. Most of it is new information anyway. I would do it if you want to take some of the Econ classes that require it.",1604158347,1,0
"Have u ever considered that maybe, just maybe, 1 &amp; 2 are in fact true",1604158047,1,0
Happy to help. Good luck!,1604157550,1,0
We def need that recipe pls.,1604157488,1,0
"I understand what you’re saying and again I really appreciate your advice! I feel more calm now knowing I can focus on school for now, and then side projects over the summer or in my last semester. Maybe even after I graduate if I don’t find a job or internship, that will be the time for me to start doing projects too. I recently got an Arduino Uno kit, so I can definitely practice with that. 

I also feel hope knowing that for your first job you didn’t have much of a portfolio. I have to realize I will develop more skills with experience. I guess my main worry until now was I wouldn’t do enough while at school. 

As time goes on, I definitely will try to think of projects to make and work on. Thank you again for your input!!",1604157463,1,0
"The fact that any drugs are illegal is fucking ridiculous. Why is the government making decisions on what i am allowed to experience. They arent my mom so they can stop acting like it. I am responsible enough to regulate my own usage, i do not need to be arrested. Thank you for taking a stand on this stupid ass issue",1604157309,1,0
Definitely a huge spike is on the way after this weekend. Just wait two weeks,1604157141,1,0
"I agree with you, but we knew summer was online before starting and still had p/nc. 

It could be argued we didn’t know we were online when registering for summer classes, but the same could be said for this semester",1604156699,1,0
Hell no. I’m pretty confident that we’ll have in person classes next fall.,1604156458,1,0
I’m so worried !!!,1604156450,1,0
"I’m in the same position...i think as long as we keep the quiz grade up (bc it practically counts for 3 exams) and do well on the rest of the exams, then it’ll be fine. Idk how big or small the curve would be tho...",1604156426,1,0
[removed],1604156206,1,0
"Yes. But I know that I’m being safe because of the pandemic. If the pandemic wasn’t a thing it’d be fine, but it is, so I’m ok with this. Let those people be sus. Almost 100,000 cases yesterday, I’d rather not be one of them",1604156145,1,0
It must have changed because the website says you can't use formatting now,1604156049,1,0
RU Psyched: The Rutgers Psychedelic Society is meeting and holding virtual events!,1604155888,1,0
"I emphasized ""parties"" meaning small friend gatherings with no more than 5 people max, not actual parties with 50 other people outside frat houses... should have made that more clear",1604155357,1,0
"I emphasized ""parties"" because I meant friends gatherings with like 5 people max, not actual parties with like 50 people outside frat houses... should have made that more clear",1604155237,1,0
"More than halfway. 6 weeks left essentially. If we don't count finals Thanksgiving week then 5. Next week will pass quickly because of current events, so really we have 4 weeks.",1604154474,1,0
"No one should be having parties right now anyway. If you’re seeing your friends at parties, feel sorry for them because they’re not supposed to.",1604154279,1,0
"Go to the convenience store on Easton, get my dollar coffee and my pick 5.",1604153296,1,0
I just want to hug a friend I haven’t seen in a long time😔,1604152912,1,0
"The title/topic for the essay portion doses not exist. So you can just put it in the essay box. The essay for Rutgers is basically like your common app. You can basically copy paste from common app. Just double check for the heading/formatting. :)

Side Note: I am a sophomore now so this was 2 years ago. It might of changed. Mostly likely no though",1604152046,1,0
You didn't get in. HAHAHAHA! SUcks to be you retard,1604151866,1,0
"Ha, a stellar date at the observatory",1604151857,1,0
I can tell you're going to cry when Trump wins.,1604151770,1,0
"Jesus, you sound like such a whiny little bitch. OMG.",1604151720,1,0
Degenerates like you should be flogged.,1604151671,1,0
Chew gum and put it on the floor and watch people step in it. It's a great way to relieve stress.,1604151534,1,0
By recorded lectures I mean the one in canvas,1604151289,1,0
"Schneider? It's too late, they're afraid to touch him because he is gay.

&amp;#x200B;

He straight up said ""I don't like black people, they make me uncomfortable.:""

""Latine women are emotional and can't control themselves in a business.""

He called a chubby girl ""Weight Watchers"" every day until she cried.

&amp;#x200B;

It was all reported. But RU loves diversity and inclusion!",1604151246,1,0
You’re a joke,1604151223,1,0
HAHAHAHHAHAHAAHAHHAHAHAH,1604151026,1,0
Stop describing your mother. I am not sure she will appreciate this post.,1604150977,1,0
"President Holloway is a joke, hands down the worst Rutgers has ever had. He has alienated his student body, allowed infringements on their privacy such as ProctorTrack, and refused to push for lower tuition.",1604150864,1,0
One thing that helps me understand the topics is by just attending his live lectures because he explains the topics more clearly than in his prerecorded videos.,1604150704,1,0
"No. Regardless of the political bullshit surrounding the vaccine we will get a vaccine or at the very least a form of treatment in due time, and that will really help to get us back to ""normal"".",1604150666,1,0
You’re such fucking trash,1604150541,1,0
Have fun watching me,1604149947,1,0
No I took it last semester!,1604148850,1,0
Keep doing practice problems with the textbook and understand the mechanisms instead of memorizing it,1604146670,1,0
Try doing practice exam and hw question week before exams and if possible just see his recorded live lectures about the topic u are weak in.,1604144991,1,0
