body,created_utc,score,total_awards_received
"I know, im trying to figure out if I’ll still be allowed to register for spring classes if I get a loan by like mid January. I can’t find the deadline for registration online",1609344276,1,0
"If you have a financial hold,  you can't register for classes",1609344110,1,0
"Soc food and eating, no major exams, short quizzes each week",1609344011,1,0
"I do that before, during and after!",1607298694,1,0
I get mad thinking about how I have to fit sleeping into my daily routine. It’s awful,1607298333,1,0
P/F,1607297706,1,0
Yeah it looks like he switched with Guna I believe. It looks like he’s reaching discrete 1 now,1607297451,2,0
"You’re absolutely right, but I mentioned in a previous comment that it’s not anything you shouldn’t already be expecting. Chem majors have an immensely larger portion of work to complete, but this is known. It’s not like anyone is being blind-sided, and as for speaking to peers, I have been able to have conversations with peers on zoom or if the conversation is going well we exchange numbers or stay on zoom to continue speaking. I’m just not seeing where the home aspect is a disadvantage besides the potential to be distracted more. If anything, the comfort of my own home makes work more bearable compared to sitting at one of those tiny ass rutgers desks that barely fit my notebook (you know exactly what I’m talking about). Really not tryna be negative toward OP and his own issues, it’s just that posts like these are really getting old at this point.",1607297308,1,0
"that makes perfect sense! thanks, this was very helpful.",1607296945,1,0
"yes, that makes sense! well, i'm sure gonna try but so glad this class is over. thanks again!",1607296930,2,0
"I can't speak to medical schools as I am not a pre-med, but having taken orgo 1 last fall I can tell you I had a 78.8 and got an A. However, my friend who had a solid 77 got a B+. So the cut-off for an A was somewhere between there, give or take. It really does depend on your class averages but I would not rely too much on a curve.",1607296656,1,0
Stop being an asshole,1607296342,9,0
"I'm a senior and I've failed two classes, I'll be honest it probably isn't the best look for grad school but to employers if you can explain your situation, what you've learned from it then it won't matter all that much. 

1. employers look for character more than skill or grades most of the time so one class will absolutely not break any chances of anything. Also it's covid time and school is online people will be understanding about that.

2. you're a freshman and it's one course, unless you're double majoring it probably won't put you back at all to graduate on time and you'll have another 3 years to boost your GPA, and since you can take a NP then it won't even effect your GPA. 

My suggestion is if you're really like SUPER behind then just take the NP, focus on your other classes and end strong in those. If you think it's even possible to get a C then work your butt off and take the P or even the C and move on from it with your head held high that you persevered. Good luck, you're not alone in this situation!",1607296211,2,0
"Yeah I got 4 years of experience of this I know the trick, shot for shot it’s never worked for me",1607296022,1,0
Ya bc they never said anything about fall,1607296003,1,0
That’s why you agree to do it with a friend at a ridiculous time like 2am,1607295970,1,0
"I mean technically yes but every time I’ve tried it someone got it before I could even load webreg, and I’ve never actually met someone in which it works... some of these classes are too popular",1607295856,1,0
Course sniper just notifies you,1607295792,1,0
"that's true, but i have an internship i want to apply to soon + i might try to transfer to a different program, so until the grade is replaced my gpas gonna suck lmao:(",1607295553,1,0
Calc is time consuming af. And if you don’t have dr g or another decent prof your going to do 2x the work,1607295387,1,0
I agree 7 is way to much. 3 or 4 is a sweet spot.,1607295361,1,0
I mean you could always retake it and have the grade replaced,1607295266,1,0
[removed],1607295176,1,0
Tbh I’m a freshman also but what I would do is do pass/ no credit so if you do fail it doesn’t effect your gpa and you choose to retake the class,1607295089,5,0
Thank you!,1607294811,1,0
"Ullman is the shit 

Hes amazing, occasional jokes, gives examples of all variations for concepts 
Highly recommend",1607294694,1,0
thank you!,1607293806,1,0
Ur gonna have auditory hallucinations if u do that buddy,1607293688,5,0
"correct, im not sure if the current housing applications are for two semesters, but i think its most likely just for spring",1607293556,1,0
"yard is definitely open for spring &amp; i heard there's still a lot of open rooms left as of rn. i think if you do get to choose from the 2 person apts in the yard, it'll basically be a single. 

&amp; there's no auto matching- you get to choose from the available spots. but just fyi that if you choose from livi apts you'll prob be moving into someone else's apt who's already been living here for the fall sem",1607293493,2,0
We haven’t started for fall yet right,1607293437,2,0
"i think for spring this doesn't apply, i've seen a few other people on here who have already selected for spring saying there's rooms available in the yard &amp; livi",1607293353,2,0
Dumbest people...yeah checks out,1607293090,1,0
Sorry to hear you haven't had much luck with your search. I would reccomend using [RippleMatch](https://ripplematch.com/index?r=nSeWTN) to look for Finance internships. There are a lot of opportunities on there for college students and it is quick and easy to sign up. Best of luck!,1607292672,1,0
Advice from a friend of mine - never make school bigger than life.,1607292513,8,0
amphetamines and methamphetamines. worked well for the army. i wish you luck,1607292304,3,0
"There's no housing at the Yard this year (or any for offcampus students on College Ave), at least in the Fall I believe",1607291931,0,0
"I'm expecting Summer 2021 to be in person as a trial run for an in-person fall semester. There's a lot of doom and gloom in this subreddit but actually we have a vaccine about to be approved and a lot of colleges have already announced in person spring semesters. If Rutgers is online in the summer, it'll be the only university to do that.",1607291682,1,0
theres a better chance of u failing if u fall asleep during ur exam. anyway i changed my sleep schedule to sleep from 5am to 1pm so once im done w the day i have the entire night to work w/o interruptions and i don't have to get up to eat or do chores etc. but i still get enough sleep to retain info and actually focus.,1607291342,1,0
"Yeah, C+ is the median and A is 80+ are the two set points on Orgo’s grading scale, same as when I took it. Thing is, the professors didn’t reveal the grading scale to us during the semester, only at the end.  The curve is pretty much going to affect all grades in between C+ and A and below C+. Use that 1.5 weeks well to study, you have a shot to pull of a B- and maybe a B depending on the curve, which I can’t predict rn",1607291271,2,0
Assuming you are looking at SEBS you have a really good chance. Your HS gpa/sat scores don't matter anymore u don't have to worry about that.,1607291130,1,0
They dont care about your high school gpa or sat anymore. You definitely have a chance of getting into SAS,1607291106,3,0
"I'm a bit above the median on all three, so I wasn't sure if I could pull of a B-? I'm not sure how far apart I would be from B-. 

I was thinking I could do a little better on the final because it is cumulative and I have a whole 1.5 weeks to study just orgo. But that sucks it's just as hard.

Also, do you know if the C+ for median is standard as the curve? I didn't know if this is just for our class or is this normally the grade for the median in this class? Thanks for this information. Appreciate!",1607290997,1,0
"generally they curve the average to be a C+ (whether the low or high end or middle they've never said) so typically in the past the range for a C has been pretty massive so people who are below average still pass. So if you've been above average, you're not failing and likely have a  C+/B depending on how they finalize the curve. They always said the final was a big deal and if you got an 80+ on the final that was an A regardless of your other grades because you eventually learned it, but i'm not sure if that's still the case. I found the finals difficult, but all of orgo was difficult for me and i had given up by the time the finals hit so i can't truly accurately judge their difficulty. I would say if you do well on it, it could help you quite a bit, but if you don't do super great it likely won't hurt you too much if that makes sense.",1607290843,2,0
Definitely Elearning. I didnt open up the gen textbook at all tbh for 161 and 162,1607290724,1,0
"- Don't count on the final bringing your grade up; it'll be the same difficulty as the exams, if not harder
- If you consistently scored the median, you will get a C+. Same as how if you scored an 80+ you will get an A. Those two thing have not changed whether you're online or in person
- Unfortunately, even if we were in person, the teaching would not be any better (speaking from experience as someone who took Orgo 1 in Fall 2019 in person and Orgo 2 half in person half online in Spring 2020)

Sorry if I was too blunt, but I don't like to sugarcoat when it comes to Orgo lol",1607290627,2,0
"Consider making an appointment with an academic coach through the learning centers, either this semester or next. It’s a free service included in your tuition and you can have 1-1 sessions to work on things like time management etc to improve for the future. You got this!",1607290580,4,0
Genetics pre med track,1607290579,1,0
"Last spring, it was due on January 14th, and it's typically due sometime around mid January.

It's typically available sometime early-mid December.  I don't remember when I got access to mine last year, but I believe I was still living on campus when I got it, so it was most likely before December 23rd.

I know my answers are fairly vague, unfortunately Rutgers doesn't exactly make it easy to find this information out.  If they have announced the due date for this upcoming Spring, or when to expect the term bills, I'm yet to find it.",1607290356,4,0
You got this you can push through and get passing grades and just do the pass no credit option if you can! This was an awful semester and it’s almost done!! Give it all you have left and then simply let it go,1607290210,5,0
"Switch up your sleep cycles. In high school I slept from 3am to 6am and again from 3pm to 7pm and always had energy. Now, to prep for 8am finals I sleep from 9pm to midnight and again from 9am to either noon or 3pm depending on classes. It’s honestly fine and works really well for me. Also, to get back into a normal schedule you need to something exhausting and a more natural sleep cycle should come up.",1607290088,2,0
Stop browsing Reddit and go study.,1607289976,-1,0
Adderall is less bioavailable in the nostril than in the stomach.,1607289692,1,0
"Pop that capsule open, put it In my mortar and pestle. Scrape out of vessel. Make a line with my Student Id. Proceed to snort out of a Benjamin and glug down a shot of espresso. Some may call it the million dollar morning. I call it just another Tuesday.",1607289398,4,0
Mood,1607289294,1,0
I hope you at least crushed the beads before snorting them lol,1607289158,2,0
Yes?,1607288943,1,0
"In my Department, the surveys get reviewed by the Chair. I also read all of them. There is almost always some useful feedback in there. There is not much an instructor can do with ""make it more interesting"" but if you bring up something that we can fix, we may fix it.",1607288828,2,0
I can do multi. Just hmu with the practice exam that they post on canvas and the topics/questions that you want to cover.,1607288735,1,0
"There's no studies that show pulling all nighters actually work. In fact, the opposite is true. Sleeping helps studying retention. You could literally study half as much and sleep, and you'll be better off.

I have no idea who keeps perpetuating the idea that staying up late to study works. It just doesn't.",1607288666,7,0
"that's great to hear, thank you!",1607288420,1,0
"creative writing with professor murray. not saying it’s an easy a, but as long as you do the 4 assignments that are given the whole semester, you’re gonna have an a. super fun and awesome class, professor is amazing and really personable and he cares",1607288395,1,0
Take the extra course unless your working alot or have alot of outside school responsibilities,1607287568,1,0
"The main thing that I didn’t see you acknowledge was OP’s major. I can understand your point of some people not trying hard enough but different majors have vastly different expectations and workloads and the chem department in particular is infamously known for being poorly run. Also one can’t mention how “it’s college it’s supposed to be hard” without also acknowledging the importance of talking to peers: a necessary component of learning, which is not offered in online learning.",1607286900,1,0
Was it easy? Was it fun? What did you do,1607286806,1,0
Snort XR addy about once a day and supplement with espresso when you start to drag a little bit. Did this once last week and didn’t sleep for 2 days.,1607286560,5,0
I hope it’ll be online. I’m thinking of taking 2 classes and I can continue working at the same time.,1607286136,2,0
Supply Chain.,1607286088,1,0
"Cocaine my friend, cocaine.",1607286040,1,0
"Managerial isn’t bad. Ethics is a joke, just say everything is bad and you’ll get an A+.",1607286018,1,0
bro cmon. ur really going to do me like this?,1607286016,1,0
"Go on the RBS server and ask, they can help you best",1607285592,1,0
"Also, I wanna add, just focus on your work now.

We got a couple weeks, you can do this. Your grades might not be as bad as your fear has convinced you they are",1607285548,2,0
either i do or fail,1607285524,1,0
I have two quizzes and three assignments due on the last day of classes!,1607285516,1,0
You should have put results option,1607285513,1,0
"Online, easy

There's no plans or light at the end of the tunnel in sight.

Any other opinion is optimistic. But then again I'm a pessimist so make your own opinion",1607285451,3,0
Taking spiegle for PM too! :)),1607284989,1,0
"If this is for non-finance majors, then he was a TA beforehand, so it might be his first time being an actual professor. I only went to one of his recitations but he seemed very knowledgeable &amp; willing to help (&amp; I found his explanation to be good). He does have a bit of an accent but he’s still easy to understand. 

I would recommend if that’s your only option, otherwise take it a dif semester.",1607284844,1,0
Agreed but I still need two more. Thus human para lab and Biochem lab,1607284844,1,0
"conversely, how to stay asleep for whole week?",1607284840,4,0
Why not just take genetics lab it’s an easy A I’m also a bio major,1607284815,1,0
"I'm currently taking public speaking with Tatiana Rodriguez, not an ""easy A"" as you have some work to do but it's definitely not super intense on the writing (something I'm not a fan of either). The writing you do is mostly outlining/creating a script for your speeches so it's not super strict and pretty free form. The class is really enjoyable and I'd recommend looking into it. I will say that the biggest downside, however, is that every week you meet for 3 hours which can be pretty draining but if you can get past that, you'll be fine.",1607284762,2,0
"Hmm, I personally haven't taken any classes with them, but I've heard good things about them as professors!",1607284677,1,0
"Okay. I’ll probably only drop a lab since I don’t have room for anything else. Hopefully everything is easier online :(

Who did you have for ecology? I have John-Alder. Also, did you take system phys open notes and remote?",1607284656,1,0
Oh that makes sense; thank you so much! Is there anything you can tell me about Prof. Abraira or Prof. Margolis?,1607284625,1,0
You don’t.,1607284593,1,0
I’m a biology Major so I need three lab electives,1607284548,1,0
What section are you in? Also how's the TA?,1607284511,1,0
[removed],1607284154,1,0
What professor? I currently have Langowski and he is great! So far midterm have been 96 92 98. Try to download his notes and watch his lectures. Also make sure to get understand how to use any equation in every single scenario. Also do a lot of the comparing questions where you have to compare different atoms or molecules and rank them in order or drop them into certain catagories. Also make sure to do the practice exam even if it is slightly easier. Try to do it without looking at the multiple choice unless the question is dependant on it.,1607284085,1,0
What’s your major,1607283878,1,0
"if you're good at math and coding then it should be doable, but 152 and 112 together were a lot to handle together from my experience",1607283818,1,0
"Cant comment on gen physics, but I am taking 152 and 112 currently, and it was manageable. Quizzes tend to be really annoying since data structures has small quizzes on sundays 6 times during the semester, while 152 had 5 quizzes on mondays 5 times during the semester with them overlapping at times.

Other than that though, I thought it was fine, just time manage well",1607283723,1,0
[removed],1607283682,1,0
Why are taking biochem lab what’s your major,1607283609,1,0
What’s the class average ?,1607283040,1,0
What’s your major I’m a bio major but the chem department sucks and they weed out a lot of premed students,1607282961,1,0
"theres a bubble tea place if youre into that (gong cha), chipotle, Starbucks.  not really study places but still my fav food place is ramen nagomi (they're only doing takeout n delivery tho)",1607282846,1,0
"It’s going to be okay. These times make it super hard to feel like anything is worth it, and it’s totally understandable to feel this way, especially when finals are here. But, your health matters the most, so be sure to take care of yourself because nothing is more important than your physical and especially mental health. Also, you’re super close to the end of the semester, and you’ve gotten through it so far! Just a little more, and it’ll be over. Sending love your way ❤️",1607282591,3,0
Jesus,1607282572,1,0
okay. thanks!,1607282497,1,0
I’m probably going to save writing for soph year and do the other requirements in the spring,1607282491,1,0
I can try to help you.. i took it organic last year.. feel free to pm me,1605207599,2,0
"Can I please get a TL,DR? the formatting has destroyed my eyes.",1605206285,1,0
DId you do early ation?,1605205860,1,0
thank you!,1605205553,1,0
"For a writing course, it’s easy and very manageable. I took Fitzpatrick and he was chill",1605205477,1,0
I did not read past the 1st sentence,1605205407,2,0
"Awesome, thank you!! Most likely gonna take it then",1605205374,1,0
"Yeah, I’d probably only recommend doing this for chemistry specifically though, because I know med/graduate schools sometimes look down on CC credits. But for chem specifically, no way I was taking it at Rutgers after hearing all the horror stories. I’d rather have one or two CC credits and a decent GPA than no CC credits and a trash GPA.",1605205034,1,0
"this is a genuinely good piece if advice. cant speak to how CC’s are handling corona, but if you actually want to learn a hard science AND get an A, a CC is a pretty solid bet",1605204878,0,0
"You have to put in the work for it (1 midterm, 1final, 1 final project, an extra credit project, and participation points here and there) but it’s definitely doable. The exams aren’t difficult as long as you go to lecture and take notes; you don’t even have to do the readings. I’m taking it this semester and it’s probably my favorite psych class that i’ve taken thus far. Both the professors are really nice and they work in the fields that they’re teaching so they can give you a good idea of what to expect (grad school and career wise). I definitely recommend!",1605204845,1,0
Yeaaaaah math and engineering professors dont have souls im pretty sure. I know not everyone is super social or anything but all the cpvid horror stories and lack of empathy always seems to come from the math or engineering profs,1605204827,1,0
"sus, don’t send this dude vids",1605204553,1,0
You can have a problem with the policies made by POLITICIANS. That is separate from those who gave their lives to protect our freedom(s). I am not happy with some of the things we have done to expand our sphere of influence but that does not stop me from being grateful to people who had nothing to do with the framing of those policies and were willing to (potentially) give the ultimate sacrifice.,1605204373,1,0
take chem at a cc like i did,1605204257,2,0
Spring is considered off season for chem 1 because most people come in and take chem 1 in the fall and chem 2 in the spring- same for any other course with 2 sequences,1605204086,1,0
Prof. Bruce Reynolds is a character. One of the few professors I've had that had everyone comfortable and laughing in the first week.,1605204037,1,0
"Honestly, no clue.

I'm a full time student, and to my knowledge I get the same course bill/aid regardless of the courses I take as long as I take a full course load. So if I'm at 18 credits and drop to 13-14, that's fine; but I can't drop below 12.

This is something to ask the financial department, probably.",1605203425,1,0
"So I don't know how it works with Sethi, but back when I took Orgo with Boikess we'd have professors rotate after each exam. Enver was lecturer for the last third of Orgo 2 and honestly the only bright spot in that course. His exam was the easiest Orgo exam I took that year, he was really the only approachable lecturer we had, and he genuinely wanted to see us do well in the course. Highly recommend.",1605203061,1,0
I took Writing for Media with Professor Leo Sacks last semester. Feel free to DM and ask me anything!,1605202743,1,0
"I didn't use any flashcards to study, but I highly recommend you do those CC/SEQ tables for every topic. When I studied for the final, I started by going from exam 1 to exam 2 and so on. So I studied the first 7-8 lectures and did the CC/SEQ tables for those until I felt comfortable. And then I moved on to the next 7-8 lectures. It is important to organize the topics so you have a clear understanding and don't feel overwhelmed with the boatload of information the bio classes here have. I also recommend verbally explaining to yourself the sequences of certain processes and the differences/similarities between them.  Also, study in groups if you can! I know it's hard virtually, but if you have any friends in the class willing to call and talk over topics, that can really help. Honestly, every day up to the final you should be reviewing the information because you need to keep it fresh in your head as well. I hope this helped in some way, good luck!",1605202606,2,0
"I feel like discrete i isn't that bad if you take the time to read the textbook and do problems. I have Guna right now, and it's rough for me mostly because he doesn't teach the material well. He's probably a good prof if you read the textbook before lecture (and watch those CUVids that he ""recommends"" you to watch + pay for).",1605201525,1,0
LOL premed,1605201445,0,0
Intro to media with Amy jordan was super super easy,1605201343,1,0
York,1605201262,1,0
"I believe Chang is new, so I don't have much to say about her. If you want to sleep during lectures, Ames has the best voice. Though he does explain things relatively well, so I can't complain about it. I had Centeno for CS112, and she's one of my favourite profs. She takes her time to explain everything really well and answers any questions you have.",1605201249,1,0
Drue is the best tbh and really helpful with any questions about the papers or anything at all.,1605201130,1,0
Pure entertainment,1605200753,1,0
bruh i work so hard in accounting i cannot,1605200600,2,0
i know this is totally not helpful but i thought you were talking about devil may cry ---,1605200598,1,0
Idk I just don't understand that. My section's exam average was an 85 and I've had no issues with her being unreasonable or having a bad format.,1605200204,1,0
pretty sure it’s like a 62,1605200102,1,0
I also don’t here very great things about her class,1605200062,1,0
I feel it.,1605200032,1,0
dont know but the exam average was low 50s I believe,1605200023,1,0
“wHy Do PrOfEsOrS cArE aBoUt ChEaTiNg?”,1605199798,-1,0
"It will depend on the type of SWE you want to do, there's web development, android development, low level software development, etc. 

In general, I would recommend Software Methodology, Systems, Internet Technology, and Databases. This should give you a good range of development and you can figure out what you like and either find classes that go deeper in that type of development or teach yourself and build cool stuff.",1605199788,1,0
^,1605199076,2,0
"Also, sorry to be a bother, but do you know anyone thats in the linguistics and cog science elective?",1605198481,1,0
"I think I prefer memorization over equations tbh, so I'm likely to go for chem then. I'll definitely look in the topics series, and try to squeeze that in though!",1605198129,1,0
Distributed systems,1605198004,1,0
I would assume the answer to that question is no,1605197722,2,0
tdlr for people who don’t want to read: Oi,1605197350,1,0
