body,created_utc,score,total_awards_received
"Yeah i mean the rate is near below 1% I'd expect a slight spike from Halloweekend but nothing major. Hopefully points to good signs in the spring semester and next yesr, hoping for at least a full senior year ya know?",1604133410,1,0
"Isn’t there a curve for gen chem? If everyone did poorly, they’re probably going to curve your final grades right?",1604133213,1,0
"And honestly it’s gotten to the point where if you know who you’re doing stuff with and they’re honest about where they’re going, it’s pretty low risk off campus at this point in time in my opinion. Even at other schools in other states where shit is back to normal the cases at schools aren’t even close to what they were this summer. I legit think in some places herd immunity occurred at the local level and/or it’s really just not being introduced into the student population like people thought it would be",1604133205,1,0
Yeah pretty crazy but at this point they're basically past it. Still glad my chapter was safe about it tho,1604133086,1,0
Almost all of the girls in their houses had it too lol. My friend in sororities are allowed to visit their houses with masks but a few of them straight up avoided them entirely because at one point 75%+ of two houses had it from what they said,1604132934,1,0
Yeah i know who you're talking about. Seems like a few chapters had herd immunity almost by the end of September,1604132828,1,0
"Idk which chapter you’re in but there’s 5-6 that come to mind that have a lot of cases, cus I have buddies in each of them. 5 of them are the top tier houses and the other is pretty up there too but not as high in clout",1604132719,1,0
"Our exec board mandates testing for those in the chapter house and ""strongly recommended"" for others. We had 1 positive a few weeks back and quarantined him and had no other positives. No parties either. Amazing the reputation 1 fraternity can give to every single one at rutgers especially in the eyes of / rutgers.",1604132567,1,0
UDel Greek Life is more traditional and the party scene revolves around Greek life,1604132471,1,0
"I mean I live off campus with guys in my chapter and we’ve gotten tested but others of us haven’t. We also have not had a legit party since March, maybe 10 people other than us over tops and it’s the same people all the time.",1604132392,1,0
They’re assholes sometimes. Literally called them because they announced all mail was being returned to sender this spring the day I had a package delivered. I had it mailed to school a few weeks before we got sent home but it was coming from the UK. They sent it back a ($1900 piece of Audio Equipment I use for my business) and didn’t declare it for customs. It got seized and either destroyed or lost in the mix cus they didn’t pay duties on it. I’m out $1900 and $200 in oversized international shipping. Might sue them in small claims but not sure if it’s even worth it,1604132311,1,0
Exactly the same as what I've seen. Obviously reddit isn't the place where jokers like the one i replied to is going to give fraternities anything other than blame and shame.,1604132266,1,0
Couldn’t have said it better myself. I’m glad there are other pagans at Rutgers. Is there a club?,1604132172,1,0
"IKR? I was supposed to meet up with some Wiccan friends who are solitary and were going to do a ritual and that’s been canceled. One of them lives on a big farm so there was lots of space to do a full ritual, calling the quarters and everything, which I haven’t done before. 😩 We night try a ritual over zoom but it’s not the same.",1604132127,1,0
"I agree, honestly I’ve seen most cops wearing something, at the very least the neck gaiter but a lot of departments have given out their own branded masks at this point",1604131912,1,0
"They are included if they use them. Almost every chapter in lettered houses is taking advantage of them, whether required to by their nationals/alumni or voluntarily doing it. However Rutgers has about 15 houses that legally qualify for lettered housing, and about 45 chapters of IFC and Panhellenic fraternities and sororities",1604131782,1,0
"FWIW I didn’t even need to meet with a nurse, just booked an appointment and went",1604131665,1,0
"I am 100% serious. Christians go to church, deal with guilt, shame, and a bunch of unspoken and spoken rules pasted down by patriarchal systems that used religion to justify torture, murder, and genocide. My religion involves honoring the earth, using magic, worshiping or working with gods, and venerating ancestors. There's no such thing as sin, the gods don't give a shit, and patriarchy has no place in a religion that has at the very least a god and a goddess as equals. We're also very LGBTQIA+ friendly, are happy to accept people of any culture or race. Sex isn't taboo, provided everyone's consenting adults. We celebrate 8 major holidays, including Samhain (pronouced Sow-en), which is the source of the word and a lot of traditions in Halloween. It's a wonderful, powerful celebration, and this year would have been even more intense because of the celestial occurrences. And thanks to COVID it's all cancelled.",1604131384,1,0
Same. This is actually a pretty good idea.,1604130528,1,0
Any 2023 grad here thinks we will be graduating online?,1604130428,1,0
And you are? 😂,1604129840,1,0
"Honestly, I don't understand the sentiment behind this whole ""I don't wanna be looked at through my screen"". Like dog, just do it and get it over with, honestly acting like babies up in here. I took 2 midterms this week using ProctorU, didn't get flagged but I also didn't cheat :). My advice, grow up and take responsibility",1604129204,1,0
dont cheat,1604129070,1,0
"Yeah I would be above the median. Don't forget that they inflate GPA numbers by using a 4.5 scale. 

https://admissions.newbrunswick.rutgers.edu/applying/admissions-profile",1604129045,1,0
"I believe in you, if my dumbass made it this far in comp sci then I have faith in other people to do amazing things

Never forget that you are the motherfucking shit",1604127059,1,0
Yea it’s against the law so of course OP has the money to get a lawyer and go through trial. Oh wait that’s not how this works oops...,1604126940,1,0
You are a very VERY good person,1604126293,1,0
Omg share that recipe tho,1604123325,1,0
Eat gyro at King Pita Palace and get my Freshman 15-Junior update,1604123033,1,0
"Go bed, and sleep hard because the only way for us to get a pass/nc semester is in our dreams.",1604122099,1,0
I literally can’t tell if you are joking or not. This comment just sounds so absurd,1604121630,1,0
I got c+ b b+ a and ended with an A we only had to write 4 papers tho,1604121441,1,0
Halloween more like Halloleen because the only treat I’m getting this year are Ls,1604120605,1,0
Su Ra Catering has very nice radish kimchi and lots of Korean goodies. It's between New Brunswick and Hmart.,1604120192,1,0
I feel like they won’t do the same pass mc policy as lest sem but I feel they could do something being like you can choose 1-2 classes to pass/bc tops if you’re full time or something like that,1604118092,1,0
Chrome extensions can turn any white website dark,1604117383,1,0
everytime i made plans to go it would be cloudy :(,1604117334,1,0
I mean ur already doing a bunch of extracurriclars so thats good. When you take ACT / SAT it will give u a better idea.,1604117034,1,0
Thank you for the advice! Are you taking it this semester?,1604116984,1,0
Thanks for the advice! I'll go back to past weeks and try doing this. Are you currently taking the class?,1604116952,1,0
"Try being a pagan. This is a full moon on Halloween (which only comes every 19 years), a Blue moon at that, and we get an extra hour for Samhain. Do you know how often all those things happen? They don't. And won't again in my life time. And we are all locked in our houses and can't get together because of politicians who can't handle jack shit and let a virus go mad. I should be dancing around a fire, drinking and celebrating and honoring the ancestors. Instead I'll be at home. This is the worst social loss of 2020 for me.",1604116301,1,0
ME.,1604116247,2,0
Why does this apply to covid/quarantine omg,1609390013,2,0
"I wanna be where the people are

I wanna see, wanna see them dancing

Walking around on those

What do you call 'em?

Oh, feet",1609389362,2,0
bro why do you think there's online classes,1609388985,6,0
Yup,1609388561,1,0
Is it a saliva test?,1609388117,1,0
"https://scarlethub.rutgers.edu/wp-content/uploads/Residency-Policy-2020.pdf

From 1E:

&gt;Any dependent student who is domiciled in the State for tuition purposes shall continue to be eligible for New Jersey Resident Tuition Status despite his or her supporting parent(s) or U.S. Court Appointed legal guardian(s) change of domicile to another state, while such student continues to reside in New Jersey during the course of each academic year and is continuously enrolled

If you're living on campus/off campus in your own apartment, you're fine most likely from that.",1609385929,3,0
"i honestly. i have no clue. i moved on to criminal justice and am much happier and will be graduating early too! i also met some more wonderful people and get to work with dogs now through club at new brunswick. 

i would check out the nursing websites of the specific campus you’ll be going to and look for information there. from what i’ve heard tho it’s easy to get a job in nursing",1609385306,1,0
"I mean it never came up but I was wondering, like when I have to refile fasfa what would happen.",1609385256,1,0
Do you have to tell them you moved states?,1609385116,3,0
"I am sorry to hear that. Glad to hear that you survived cancer though. Sadly some people are so petty and throw away long term relationships for short term gains. From what I have seen, people want to be CRNAs in the beginning, but most will never become one. With the three years out of work plus the 100k tuition and the 3-5 years of ICU experience needed, it is very tough to justify that at around 26-30 years old. 

If ped oncology is still what you want to do, screw those people. Don't throw away your dreams because of other people's words. If you have moved on already, I hope that you are enjoying your current major. 

Do you know what job placement is traditionally like at Rutgers SON (outside of the pandemic years)?",1609385010,1,0
"Yes, now you have to pay out of state, and even if you move back, they will stay make you pay out of state tuition",1609384633,-5,0
"it’s more the people within the major. like i had a good group of friends but the other people were so competitive and nasty over nothing that it was just like :// and a lot of people just seemed to want money. like so many people wanted to be a CRNA for the money. i wanted to go into ped oncology as a cancer survivor myself and so many people told me that i wouldn’t make it or that was stupid and it was just so disheartening that i could never see myself working alongside those people

edit- i was also in camden. don’t know if that makes a difference",1609384179,1,0
[deleted],1609384082,1,0
Was it because you dislike the major or was something wrong with the Nursing College itself? I have only heard good things about Rutgers Nursing College. They say that it is super competitive to even get accepted into and the job placement after college is pretty good. Is that incorrect?,1609383882,1,0
"Wait, why? I have only heard good things about Rutgers Nursing College. They say that it is super competitive to even get accepted into and the job placement after college is pretty good. Is that incorrect?",1609383848,1,0
"Is it bad that I don't know how Discord works...? I keep on hearing about it, but I have never used it. Do I simply create an account like GroupMe and join groups?",1609383584,1,0
"I think you would still receive credit. It doesn't make sense why your sister would not get AB credit. Based on my memory, the AP Calculus BC exam includes AB material in it and tests your knowledge in AB material. I am surprised the college board (who administers the AP exams) did not also give a sub score for Calc AB. 

Which school does your sister want to enter (School of Engineering, School of Business, School of Arts and Sciences)? If you know, directly contact the deans there and explain the situation. They will have the official answer. If you need help finding contact information, reply to this comment and I will try and help you out.

I will disagree with u/ReadingIsBeneficial. If you are not an engineering or math major or someone who will **genuinely** benefit from Cal 1 and 2 material, then I would simply skip over Cal 1 and 2 with the AP credits and call it a day. Rutgers' Cal 1 and 2 is known to be very difficult in nature and it is very easy to screw up and hurt your GPA (trust me, I know). To put it into perspective, I got a B in both Cal 1 and 2 at Rutgers, but then proceeded to get A(s) in Cal 3,4,and 5.",1609383434,3,0
I’m interested in this too.,1609383420,1,0
*”Under the Sea” intensifies*,1609382744,4,0
Ye,1609382264,1,0
does she record and post the lectures?,1609382161,1,0
she literally said we would get them this afternoon. i never got it tho,1609382032,1,0
"Its fine, a very diverse campus. Rutgers is not boring if you go out to any of the events happening. If you stay inside your dorm and play video games it can be very boring (not shitting on playing video games, but it doesn’t seem like a good way to meet other students). There is always something fun to do at Rutgers. Parties usually happen on the weekends at night. If you are a guy good luck getting into them though. Students here are pretty friendly if you reach out to them. Some majors/students in general are not as social as others. Since the school is so big and diverse you can find all sorts of people who are friendly and studious. Pre-covid it was really fun",1609381711,13,0
"I feel like the math major is very much like this. 

Negative judgements were cast on people who weren't doing mathematically ""rigorous"" enough majors, even things like economics or physics. 

There was a lot of insecurity among math majors regarding capability and intelligence (I even witnessed one particularly bad interaction where one student called another ""dumb"" for not understanding their explanation of a problem- he apologized after being called out for it by another student, but I think it's still symptomatic of the kinds of mentalities that pervade the major). 

My possibly unpopular opinion is that the math major is possibly the worst major for anyone who doesn't already have a solid bedrock of self-esteem. The environment seems friendly enough until you realize just how much ""pure math"" is put on a pedestal above all other disciplines and how intelligence-obsessed many folks are within the major. The environment can be so toxic and pretentious and... just useless. 

The best thing you can do is focus on the intrinsic reasons why you're studying what you're studying and avoid caring about how you ""stack up."" It really doesn't matter. I used to think that it did for graduate schools, but honestly, if you have a genuine curiosity for your subject and focus intently on pursuing that curiosity and learning as much as you can, then if you still don't get into a graduate school, it probably just wasn't meant to be. And that's okay. There's no cosmic superiority hierarchy where people with PhDs are just intrinsically better than everyone else. And in general, your worth as a person does not and should not hinge on your intelligence. 

There's no point in killing yourself trying to ""beat"" other students. That mentality is so toxic and useless. Focus on enjoying yourself and finding meaning in what you're studying. The rest can go to hell.",1609381678,1,0
[deleted],1609380703,1,0
[removed],1609380621,1,0
[removed],1609380549,2,0
[removed],1609380385,1,0
[removed],1609380255,2,0
[removed],1609380102,4,0
AP credits do count as college credits. So you would only have to take 90 credits at Rutgers to graduate.,1609378811,1,0
"Those two classes are co-requisites so you can take them together. The first few weeks of the class is practically a review of comp arch, so don't worry if you haven't taken it Rutgers yet",1609378646,2,0
Okay and who do we email for getting 21?,1609378638,1,0
"No extra cost sounds sweet. 

What if I am taking 20 credits as a student and 3 credits as a TA. It counts as 20 only right?",1609378626,1,0
"Yeah, I would probably use the P/NC on the three C+. If using a P/NC will get you to 3.0, then it is worth it. Most jobs, internships, and coops require at least a 3.0 and if your GPA is below a 3.0, it is very easy to get filtered out if you are below it. My advice is to never use a P/NC on a B or above regardless of how it affects your GPA.",1609376606,1,0
It’s a good teaching school.,1609376145,1,0
"Wrong, plain wrong. This happened last spring, I emailed them then and they fixed it, CS majors reading this do not fall for this but use P/NC at your own risk",1609376059,1,0
Thank you i appreciate it,1609375801,2,0
I will LoL. I just want to keep you informed bro. The one thing i learned in our major is that you need to stay informed. And stay connected with other ca student. 👍🏼👍🏼,1609375656,1,0
Only if you like my most recent pic on Insta,1609375004,1,0
"Amazing

Good shot!",1609373119,2,0
"B+, but only after we pressed him on why we lost points. I think he sensed a coup and boosted our grade without clarifying what led to the initial point deductions.",1609372294,1,0
CVS and rite aid should be free.,1609372156,1,0
I'm planning to take this course too! It's between this and Social Media as a filler course and I'm not too sure which one to choose.,1609371832,1,0
Call. And if you can go in (idk the rules or your situation) do that. They’re way more helpful in person.,1609371703,1,0
source?,1609371101,2,0
Math is useless outside of academia,1609369987,1,0
[deleted],1609369147,1,0
"Yeah bro. people plans next semester classes and depend of that rule, LoL. Anyway Goodluck. Add me on instagram. ahmedsalahkoura.",1609369010,1,0
"You’ll still receive credit! However I wouldn’t really recommend skipping unless you are well versed in parametric equations, sequences&amp;series, and the rest of the stuff covered at the end of the course",1609368361,2,0
Is he an easy professor?,1609367750,1,0
"It should be noted for CS majors here that the CS dept. won't allow P/NC to apply for major/minor courses with the exception of those classes taken in Spring 2020, if any CS majors happen to be reading this.",1609367361,1,0
"Here's a sneak peek of /r/stevens using the [top posts](https://np.reddit.com/r/stevens/top/?sort=top&amp;t=year) of the year!

\#1: [Why is scheduling so bad](https://i.redd.it/rsgjpg8vltw51.png) | [2 comments](https://np.reddit.com/r/stevens/comments/jmmk0n/why_is_scheduling_so_bad/)  
\#2: [Thank you stevens very cool](https://i.redd.it/bhtbtbmcuam41.jpg) | [0 comments](https://np.reddit.com/r/stevens/comments/fhmplb/thank_you_stevens_very_cool/)  
\#3: [stolen meme, honor board me](https://i.redd.it/rylm3yeqzap41.png) | [4 comments](https://np.reddit.com/r/stevens/comments/fq91qu/stolen_meme_honor_board_me/)

----
^^I'm ^^a ^^bot, ^^beep ^^boop ^^| ^^Downvote ^^to ^^remove ^^| [^^Contact ^^me](https://www.reddit.com/message/compose/?to=sneakpeekbot) ^^| [^^Info](https://np.reddit.com/r/sneakpeekbot/) ^^| [^^Opt-out](https://np.reddit.com/r/sneakpeekbot/comments/joo7mb/blacklist_viii/)",1609366753,1,0
This meme is a reference to the trolls from r/Stevens,1609366735,1,0
Tysm!,1609364434,1,0
"As mentioned by Lemon3255, the limit is pretty hard set at 20.5 for SAS. That said, if you do manage to get around it, there is not extra cost.",1609361061,1,0
"Yeah next time I see shit like this in any group-me I'm in, I'll just call them out.",1609360879,1,0
"Well guess what, they're gonna keep doing it cuz nobody says anything. Sometimes I fucking hate college students",1609360755,1,0
"I swear, the difficulty I had holding in the urge to say something snarky every time someone one in my physics or orgo groupme asked shit that could be answered in 2 minutes by reading announcements/emails or looking at the syllabus was too damn high",1609360595,1,0
Oh that’s what that is; I knew there was a reason I liked it 😋,1609360506,1,0
Just call it Busch Campus lol,1609360486,3,0
"wait I'm confused, I thought Stevens was a good school lol?",1609359975,2,0
DM me your email address and I can send you the Fall 2020 syllabus,1609358665,1,0
thank you SO much!!,1609358357,1,0
Oh jeez. do you still have the syllabus by any chance? I wanna know what to expect bc his reviews on rmp from this past semester aren’t really the best,1609358166,1,0
So you don’t need help on writing assignments?,1609357608,1,0
Thank you. Do they accept Rutgers health insurance?,1609356288,1,0
"Roth is very particular about the stuff in his lecture notes, so while leah4sci and khan academy are good supplements they can't be instead of your lectures, as awful of a lecturer he is",1609355237,1,0
"Honestly, I'd make those 3 C+ a P. You'll be at a higher gpa and next semester you can do the same for anything under a B to bring it up even more",1609354990,1,0
"Go to CVS, Rite Aid, or urgent care",1609354440,2,0
"Anytime! I'm a non-matriculating student so if you have any other questions about the process, feel free to ask :)",1609353717,1,0
Thank you so much for your help!,1609352856,2,0
It's separate and is not part of your undergrad degree because you've already graduated. Non-matriculating is good for people who need to just complete prereqs for grad school.,1609352807,1,0
"love it. i’m an alumni this wasnt there when i was, so thanks for posting",1609352378,2,0
I’m from the south and I’d always tell people how FAT the northern squirrels are after coming to Rutgers,1609350655,1,0
apply for our Spring internships - due Jan 4 [https://njacts.rbhs.rutgers.edu/education-training/workforce-development/internships/](https://njacts.rbhs.rutgers.edu/education-training/workforce-development/internships/),1609350600,1,0
president and I are putting our club inactive after the other two e board members ghosted all semester and participation peaked at 6 people on a lucky week. a little worried about if we’d even be able to revive it after missing a year,1609350229,1,0
Thanks!!,1609349919,2,0
"The class is not too easy considering the class covers a lot of content, but the tests and quizzes were very fair.  It was one of the classes I spent the most time on this semester, but that’s partially cause I was really interested.",1609349294,1,0
^,1609349049,1,0
It’s caffeine?,1609348977,1,0
"3) lol

It's the opposite",1609348415,1,0
"Thank you so much. If I do take the class, would it count towards my undergrad GPA or would it be separate?",1609348414,1,0
I’ve always wanted to take a class in the building that this is in front of it looks super cool,1609347099,1,0
"Hey I’m kind of in the same situation, I PM’d you",1609347018,1,0
"oh hey fellow soc major! I will also be taking 313 with Borosz in the spring. I just finished taking 311 (intro to social research) with Drue. It was not the easiest class, but I can say I learned a lot and even had a little bit of fun. There are a lot of projects and papers to write, but he grades your work and then lets you revise it so you can get the highest grade possible. It’s not easy and takes a lot of time, but if you actually want an interesting class out of the four (311-314), I recommend 311. I took 314 (contemp soc theory) last spring and it was very easy and gave me a good foundation in theory, but I was bored out of my mind, and for the first half of that class we were still in person. The stat-research-based 311 and 312 are probably a little more challenging but seem more interesting, and 313 and 314 are all theory and easy exams, especially online, but don’t have the most exciting lecturers.",1609346977,1,0
[deleted],1609346814,1,0
Random Indian guy on YouTube deserves a higher spot. He’s been carrying us all this semester,1609346504,1,0
TIL that thing is a caffeine molecule,1609346460,1,0
"i’m in my second year at ru (technically a junior because im graduating early) but i came with around 25 credits. if you plan your ap’s correctly you can for the most part get out of science, history, expos, and humanities cores. once you come in with about 20+ credits it only matters if they fulfill the cores smartly. other than that i have 15 credits per semester and had to take 2 summer classes after my first year to graduate early (i took 3 summer classes though). graduating early saved me a lot of money and my plan as of rn is to be a part time student my last year at ru. in terms of professional development/ internships i did feel a bit more out of place and rushed throughout the whole process but if you keep that stuff in the back of your mind while you’re at ru you’ll be fine!",1609346397,1,0
Complete a re-enrollment application for the school you want and enter as a non-matriculating student. Here's more info: [link](https://admissions.rutgers.edu/applying/more-for-part-time-non-degree-applicants),1609346330,1,0
That was caffeine? I thought it was cocaine or something,1609345961,2,0
Everyones favorite drug.,1609345473,1,0
I’d recommend reaching out to financial aid and student accounting they’ll be able to give you better advice than students,1609345385,1,0
Lol I'd take 90k than 250k and having no life. Everyone I know who worked front office quits by 30 and works something else lest they die of an aneurysm on the job.,1609345176,1,0
"The weight on canvas is wrong, he is probably updating that. And some sections still haven't gotten their final back.",1609345080,1,0
Is that a penis drawing?,1609344552,1,0
