title,selftext,created_utc,score,total_awards_received
Who to contact for class not appearing in Canvas?,"The class is still marked as not being published on Canvas. I've tried emailing the professor but I haven't received a response so far, and dropping then re-enrolling also hasn't worked.

 Would I contact EdTech support, ITS, or another department?",1602002761,1,0
Anyone else taking Orailoglu for CSE 140 and Eldon for CSE 140L (or vice versa),"and not know wtf is going on??

I wish they would co-teach it. Why would Orailoglu use 140 discussion time to do 140L stuff.",1602002578,1,0
Looking for Volunteer Tutors (Service Hours Rewarded!),"Hi everyone! I hope you guys are doing as well as you can be with quarantine and COVID.

I am VP of a relatively new tutoring organization founded about 5 months ago. So far, we have completed over 1000 sessions of tutoring, and have experienced an influx of students wanting to be tutored. Therefore, we are now looking for tutors aged 17 and up to virtually tutor these kids. This is not paid and we will provide you with community service hours if you would like. Please check out the link below to sign up or learn more about our organization! Thank you!

[https://www.quarantinetutors.org/tutors](https://www.quarantinetutors.org/tutors)",1602000904,1,0
Is asymptomatic covid testing free for students?,"I am not on the school insurance and haven't found anything confirming that the periodic asymptomatic covid testing is free.

Does anyone have helpful links or experiences relating to this?

Many thanks c:",1602000511,1,0
No Canvas for MUS 15 Class,[removed],1601995977,1,0
Advice for applying for MS in CS.,"I'm doing my bachelor's in electronics and communication (from India) but I've done projects related to CS field and wrote a paper in the same and writing one more. I am planning to apply for MS under CS for fall 2021 and UCSD is my first preference but the acceptance rate is so low. Since they've waived off GRE, I feel the competition will be a comparatively more.

I'd really appreciate if anyone has any tricks and tips for my application. Fortunately I already have 3 LoRs. I want to know about SoP and what else I can do to increase my chances of acceptance. 

Thank you :)",1601991613,1,0
Double Major: Data Science and Public Health,[removed],1601981749,1,0
has anyone ordered delivery from weedmaps to campus,i have a med card so its legal but how would it work? like do i put in my mailbox LOL,1601971353,1,0
Banned From Among Us Discord Server,"lol so I recently got kicked from my “friend”s discord server because they raged that I called out the imposter in among us... so I decided that ima make my own discord server for all kinds of games lol. I don’t know how to really build a discord server and make it epic so feel free to join and we can play among us lol. right now it is so empty though so yeah... help me build it up????

https://discord.gg/2mZXk4

there’s the discord link. let’s all be friends!",1601969839,1,0
Dining Hall Food,"I’m a freshman living on campus and I just wanted to say that I’ve been pleasantly surprised by the quality of the dining hall food. I thought I’d hate eating there and would have so many dining dollars left over but I genuinely enjoy eating there and have had a pleasant experience. I really love the canyon vista burgers and OVT pizza. Also the matcha lattes from the coffeehouses are SO good omg. I admit the Pines curry and CV noodle bowls could have more flavor and sauce but otherwise, it’s been good. Idk if anyone else feels this way or this is just me bc I’ve done summer camps at UCB and NYU and didn’t like the food this much...",1601969170,1,0
Anyone in Lab 02 for VIS 60 that can tell me what happened during yesterday’s section?,"I was a dumbass and didn’t put an alarm on my phone so I missed the section and just realized today right now that we were meeting on Monday and not until Wednesday. I know it’s mandatory, did the TA take attendance or something?",1601968621,1,0
BIBC 102 Schmelz discord?,does anyone have the discord for Schmelz’s BIBC 102??,1601966513,1,0
VTuber teaching for CSE 105,"&amp;#x200B;

https://preview.redd.it/5yqw3ua3yer51.jpg?width=1067&amp;format=pjpg&amp;auto=webp&amp;s=970c2206b48dd7deca6e0cbeca7b74d30fb5a9c3",1601963485,1,0
ucsd vpn,"Hi! I just connected to ucsd's VPN ([vpn.ucsd.edu](https://vpn.ucsd.edu)). In the client, it has a timer that says 29 days and 23 hours left. Do I only have access to ucsd's VPN for free for 30 days? Or do I get it for my whole time here. Also, can I use this on my phone? Thanks",1601962282,1,0
Totally forgot I signed up for this…the T-shirt is nice though,,1601961019,1,0
Visit Raccoon Dungeon Discord!,"https://discord.gg/QDv8KE

I have to apologize for something.

I was on a Discord called *Raccoon Dungeon* that had a few hundred users and a handful of trolls posting gore. So I said to the other mods, ""hey guys, let's clean this up and start a new Discord where /r/UCSD users can find peace and prosperity""

Well it turned out that the Discord I was looking at was NOT the same Raccoon Dungeon as what's on the sidebar. This was quickly pointed out to me by members of the REAL raccoon dungeon who run a great Discord that does NOT have gore. So let's forget about any mention of an official /r/UCSD Discord and go check out the real [Raccoon Dungeon](https://discord.gg/QDv8KE)!",1601960297,1,0
Opt out of Redshelf,Does anyone have the link to opt out of Redshelf? The initial email they sent says to access the link through canvas but i cannot find it anywhere at all :(,1601957986,1,0
Join the new &amp; official /r/UCSD Discord!,,1601956821,1,0
What exactly does this mean? There were no changes in my aid…,,1601955881,1,0
The 20 person dinner meeting next to Pines looks fun,,1601954501,1,0
Solis 107 Location,"Hello! 

Freshman here, and Im writing to ask if Solis 107 is inside the Solis Hall building or like through one of those outside doors if that makes sense? I walked around it the other day (couldn’t go inside yet) and I didn’t see 107 so I assume that means it’s inside the hall? If it is inside the hall, do i have to turn any certain way inside the hall to get to it or anything?

Thanks!",1601953720,1,0
CSE 140/140L,[removed],1601953023,1,0
When will my classes show up in canvas?,I dropped one class and enrolled CHEM 6A and waitlisted in physics lab about 24 hours ago but I still don’t see either class on my canvas. Should I wait for a little more to see if they will show up? Or is it better to email professors right away?,1601952977,1,0
Question about BIPN 102 with Vijapurkar,"Anyone who has taken her before - what’s it like? What are her exams like?

So far the lectures are *completely* monotone, and she’s just stating fact after fact. Doesn’t seem like there’s much understanding involved so far... Do we just need to memorize facts for her exams or?

Thanks :)",1601952394,1,0
What’s your opinion of the Health Ambassadors?,I’m a THA and I just want know what the general perception from other students is. What do you think when you see me walking around in my obnoxiously yellow shirt?,1601952057,1,0
Reconnecting printer,Hi! So I moved onto campus and I brought my printer with me. Today was the first day I had to use it but for some reason I can’t get my printer to reconnect to my laptop. I know both my laptop and printer have to be connected to the same WiFi but I’m just having trouble doing that. I read on the Apple help guide that I can just readd my printer but when I went to go select readd something about “select software” came up and it wouldn’t let me do auto-select. I’m just trying to print some papers y’all 😭,1601950958,1,0
Fuck HDH,"The individual workers are okay (actually, thanks for all you do including adapting to working in a pandemic). But fuck HDH.",1601950712,1,0
Cogs 109,[removed],1601950184,1,0
Hopkins closed for painting,"Y’all who are on campus and park in Hopkins, all the floors with S/SR spots are closed off for painting, should I just stay parked in a B spot in the lot by Goody’s/Lowers and risk the citation or just go try to find a spot in Pangea tomorrow?? Also have any of y’all with SR permits gotten cited for parking in B spots this quarter do u think they even care??",1601950091,1,0
Poli 104M,Has anyone taken POLI 104M with Prof. Stephens? I’m curious on people’s thoughts on the class.,1601949726,1,0
"COGS 107A - for those whove taken it, how was it?","Week 1 and it seems like theres going to be a lot of work, especially since there are labs with the class, 3 midterms and a final. Hand writing assignments is something I haven't done in ages! Hope I get used to it again haha. Overall, felt a little overwhelmed but hoping it gets better once I get in the groove of things. How difficult is the course?",1601949671,1,0
POLI 104M,[removed],1601949663,1,0
sio 30,does anyone know if the live lectures are recorded and uploaded ? I missed the first one and can’t find it on canvas. thank you !!,1601947536,1,0
SIO 30,[removed],1601947459,1,0
When is the deadline to drop class without a W?,title,1601947418,1,0
MGT 45 and MGT103,"hi, I’m thinking about picking up a business minor and so I enrolled in these two course this quarter. 
@ anyone who has taken:
MGT 45 - Pecore
MGT 103 - Ehrich

Will it be necessary for me to read the textbook to succeed in those classes? Or will attending lectures/understanding hw be enough?
thank you!!",1601947396,1,0
Join the Community!,[removed],1601946935,1,0
CSE 107 study group?,"Hi everyone!! If you're taking CSE 107 and are interested in creating a study group, please DM me! I'm going to make a discord so we can review and study for tests together",1601944299,1,0
Air Conditioned Places to Study/Read Books,Are there any on campus? Are there any in the UCSD area? I'm just looking for a place to be able to read my assigned reading and take notes on it and not bake at the same time. Anyone know of a place like that around here?,1601944210,1,0
Is Chem4 open in winter/spring as well?,"Is Chem4 open in winter and spring quarter as well? 
I need it for my GE but I don’t think I can take it in fall",1601942787,1,0
writing vs typing notes,preferences between the two? is one superior?,1601942440,1,0
BICD 100 discord,Is there a discord for BICD 100 with Professor Grossman? Or study group?,1601941001,1,0
Anybody know when the gym will open?,I heard it was going to open October 5th and require reservations... but I guess I heard wrong.,1601940996,1,0
Aerospace engineering at UCSD,"Any current UCSD engineering students, do you think UCSD offers a good aerospace program and how competitive is it usually?",1601939687,1,0
How to join clubs,"I'm having trouble finding out where a list of clubs I can find is, or how I am even supposed to join the clubs? Does anyone have any resources for this? 

Thank you.",1601939157,1,0
Stolen Bike Wheel,"This morning my rear bike wheel was stolen. I don’t really know much about bikes, but what exactly should I do now? Are there any places nearby that can replace the wheel, or preferably on campus (since I don’t have a car)?",1601939057,1,0
Graduate Family Housing - ESA Questions,"Hello - 

I currently live in GFH and want to move in my dog but have not been able to because my therapist through Kaiser is unable to provide an ESA letter. No, my dog has not been registered as an ESA in the past but has legitimately helped me with my anxiety and PTSD. Not being able to have my dog is very difficult (currently housed w/ family). I am wondering if anyone here has been able to use obtain and ESA letter through a third party like Certapet and successfully get it through GFH. It looks like certapet is legitimate and will connect me with a real doctor. 

Thank you!",1601936418,1,0
High school senior applying for pre med: best major?,"Hello, I am currently a senior applying for pre med and I am picking a major. What do you think is the best major for pre med? Is there a major that is very hard that I should avoid? Is there an easier major which you wish you would've taken? I know I can major in anything but I have decided to do a biology-related major. Thank you so much. Also, is this a school you would recommend for pre med (getting into a US medical school)?",1601934985,1,0
How to enroll courses in Canvas?,"Hi.

I have just enrolled one course last week.  But the course does not appear in my UCSD canvas.

Does anyone know how to add  courses to the canvas if I enrolled the course after school started?

&amp;#x200B;

Thank you!",1601934775,1,0
Pre- Med Spanish courses?,"Hi there, I’m a pre-med and I was wondering if anyone knows about anything regarding Spanish courses for pre-meds. I would like to learn enough to be confident in my conversational skills. Thanks I advance.",1601934279,1,0
ANTH 2 discord?,Is there any ANTH 2 discord or group chat?,1601931906,1,0
"Hello. We are certified writers in the academic industry ready to assist you with your essays, dissertations, online classes and math.", Visit our website [essaypro.com](http://freeessayssamples.com/order.html),1601928781,1,0
Anyone else in OMS driven crazy by slamming doors?,"The apartment doors here are all set to slam shut - it's incredibly loud and I can feel it anytime someone nearby lets one slam. Someone below us seems to enter and exit their place multiple times at night. I'm sure I sound insane, but it is really annoying. Am I the only one thinking this?",1601928238,1,0
Does my profile look competent for MSCS (AI major)?,"GRE 308: 161Q 147V 4.5 AWA
(I'm not reporting GRE as they made it optional)

GPA: 9.44/10 (3.77/4) (Till 6th semester)

My engineering math scores:

Sem 1 Math: 98/100

Sem 2 Math: 75/100

Sem 3 Math: 98/100

Sem 4 Math: 100/100

2 Internships. First one in Python/MySQL, Shell. 

The second was research analyst role and required Data Scraping, Cleaning, Visualization and Robotic Process Automation (RPA UiPath). **Got a full-time offer from this internship.** 

I plan to do one more Internship in December.

So that's 3 in total.

Working on an AI research project with a startup. This AI startup has a cell in my college and I'm on its core team. It was originally founded by an Indian professor at MIT. The startup will be providing certificate on successful completion of the project. We are working with doctors to get some insights into our approach. So it's not a research per se, but close maybe?

Implementing already published research papers. So I guess these could work as  projects?

Participated in an AI Hackathon.


Does my profile look competent?",1601926700,1,0
Hello Health Prolblem,[removed],1601925586,1,0
PHYS 2CL Barreiro,Anyone in Barreiro's 2CL lab that I could ask for the syllabus from? Found out late that I need to take this lab to switch academic plans and I was able to snag a spot someone dropped but I need to see if I really have time for it this qtr! Plus I want to know how he plans to tackle online lab. Thanks in advance. :),1601925025,1,0
UC Merced Shoutout on @ucsandiego IG,,1607298951,1,0
Did Nomura go over time when classes were irl?,"I mean I don’t want to make my post seem as hate since I actually think she is a good prof. But as of recently she has been going over time during the lectures by a significant amount of time.

Also again I get why she does it but sometimes it isn’t that cool when a 50 min lecture turns into 1 hour+ lecture lol.",1607296850,1,0
Math 11 &amp; 183 Megathread,[removed],1607296771,1,0
Ezzati Megathread,"Hello Tritons, we normally don't create megathreads for individual courses on r/UCSD. However given the unprecedented censorship on the class piazza we're deciding to create this megathread to provide a central place to discuss matters happening currently in Math 183/11. Best of luck with finals and we hope you guys are able to ride out the class.",1607296083,1,0
Chem 6b Work?,Hey is it me or is Crowell for 6b putting a ridiculous time crunch for learning the material and giving us a midterm literally the week before finals. Like bruh he literally just posted the lecture for one part of chapter 16 the day before the midterm which includes it. I'm so done with this school in general.,1607295293,1,0
Workload,"What’s the workload of these classes like?
CAT 2 - Nguyen
CSE 12 - Miranda
CSE 15L - Gary
MATH 20D - Vavalis",1607293985,1,0
Places to run on campus,"Any places to run on campus? Looking for fields or tracks please

Last and as always, fuck pepper canyon",1607293516,1,0
PARINAZ EZZATIS RESPONSE TO STUDENTS CONCERNS- can anyone draft an email to the department??,,1607293250,1,0
"It’s almost 2PM, why are the cafeterias still only serving breakfast??",,1607291940,1,0
Covid has reached Pines and all of the residential buildings in Muir. Stay safe!,,1607291835,1,0
BIMM 100 (Akbari) or BIPN 100 (Bloodgood)?,I'm stuck on deciding between the two. Has anyone had any experiences with these two professors before? Or just BIMM 100 and BIPN 100 in general?,1607290226,1,0
Changing majors,Hey guys so I am a 3rd year transfer studying applied Astro PHYS. When I transferred I got in for my second choice. I really want to change my major to comp sci as that was my first. Although this year has really hurt my gpa with online classes and my own struggle with mental health. I kinda feel lost. I enjoy Astro PHYS but feel too stupid to be a top student in this major. Do you guys have any advice on how to go about changing majors? Is it even possible to change if my gpa is now sub 3.5? Thanks!,1607284093,1,0
Transcrpits?,"Hey guys,

Quick question: when I turn in my UC apps do I need to send my transcript to UCSD and other UC campuses? I havent done it yet so yea",1607280514,1,0
A message to all prospective students:,,1607277563,1,0
Math18 Professors + advice. SOS,"Okay so i looked into CAPE and all to see which professor is the best for math18. These are my options: 

- Obviously, professor Xu Hang is the best and CAPE seems to agree with that. Since most people seem to like this person, his class has a waitlist already (bigger than the 10% that would hopefully get in from the WL).

- Professor Justin Roberts is an option too. I read that he’s good, but not the best. His class has a waitlist too but much smaller and I’d actually have a chance of getting into the class since i’d be #3 on the waitlist. 

- There’s also two other professors as options?? Those are professor Pooja Agarwal and professor Andrew Zucker. I couldn’t find anything on CAPE regarding them, so i’m assuming they’re visiting professors?? (or just new 🤷‍♀️). Has anyone taken a class with these professors already? Idk if they taught Fall2020, so the CAPE results aren’t in yet. 

If anyone could give my any insight or  advice on what to do next, that would be great!! 

I really wanna take Xu’s class, but obviously I don’t think that’s the safest choice since i’m not even sure i could get into the class. 

Who else do you think is the best, and if you did take math18 (or any other kind of math) online this quarter, what did you think of it and what would you say is something that seems harder/more challenging now bc classes are virtual??",1607277106,1,0
Best way to use P/NP?,"If we get P/np should I pass a bunch of classes to get a high GPA or will taking classes as a letter grade when p/np is being offered be more attractive? 

It seems there is still no consensus if pn/p will look bad, especially for major classes.  Options seem about even, what do you guys think?",1607275061,1,0
*Rant Ahead*,"*RANT AHEAD*

Is it just me or you’re having a really good day, and one thing, one small thing happens and it ruins your whole F****** mood. What makes it worse is that it’s one of your close friends and you think they’d know better. But then your overthinking takes over and now you’re thinking ukw it’s not their fault, it’s yours that you are not at all verbal about your mental health. So you decide to speak up. But before you do, you remember that you know people who are suffering through worse things, and worse problems. People who’re dealing with Anxiety and Depression and realize that even your problems aren’t worth it. Your problems are barely problems and they aint worth shit. 
People really do think that I am a really open person and I am actually very verbal about my problems just because I am an easy conversation and I state my dislikes. No matter how much awareness we spread, they really do think that people that smile the most are actually happy. Even most of my close friends think that. I cant even ask for help cs I’m worried I’m being an attention seeker/ being too selfish by asking someone else who has their own problems. So I just stay quiet. It’s messed up.....",1607275040,1,0
*RANT AHEAD*,[removed],1607274983,1,0
an absolute madlad is meme-ing on the UCSD IG tagged photos page,,1607260092,1,0
Is this too difficult of a course load for winter quarter?,"CHEM 40B (Hoeger), BILD 2 (Park), PHYS 1B (Groisman), PHYS 1BL (Tsai)",1607250142,1,0
The duality of Ezzati,,1607245560,1,0
Magic,Does anyone know someone who sells the magic shrooms on campus or near campus 👀,1607245397,1,0
The duality of ezzati,,1607245333,1,0
the duality of Ezzati,"First picture: Ezzati's ""Financial Econometrics"" slides @ University of Sydney [https://www.studocu.com/en-au/document/university-of-sydney/financial-econometrics/lecture-notes/p-lecture-1-lecture-1/8089367/view](https://www.studocu.com/en-au/document/university-of-sydney/financial-econometrics/lecture-notes/p-lecture-1-lecture-1/8089367/view)

Second picture: Her trying to silence students on Piazza.",1607244853,1,0
Im done,Shits are going wild with my courseworks and I just broke up with my boyfriend cuz I’m too stressed out lately and I regret it so much. I’m done living like this. Still hope you all can pass well this quarter. Cheers.,1607243752,1,0
Chem 6b Crowell Discord,"Hi,

is there a discord for chem 6b with crowell?  pls help. thanks :)",1607240818,1,0
Ethernet,The WiFi is making me lose my mind. For the love of god let us use Ethernet.,1607239694,1,0
"Rate my winter courseload: BILD 3, Econ 1, math 20b, vis 21b, lifr 1B/x","Total 21 units
Econ 1 and lifr 1B will mostly be review for me I think as I took IB Econ and French so ... anyone w experience w both could u lmk if the content is mostly the same?? :)
I’ve heard BILD 3 w gambel is okay?? 
Mostly worried about math 20b LMAO I took IB HL math and looked at syllabus, it’s kind of the same stuff but I hated calculus haha
Anyways if any of u r taking any of these next quarter lmk!!",1607239429,1,0
it is fall quarter 2050 and someone asks what the hell happened here in fall 2020,"covid caca emails, the legendary math 183, and the admin hell-bent on requiring letter grades.

In Arya Stark’s voice: ***The Zoomer remembers.***",1607238639,1,0
