title,selftext,created_utc,score,total_awards_received
Your venting is valid.,"Please don't tell me I have a final that can improve my grade. Don't tell me I have a few more weeks. I know. I'm still trying but everything is demotivating. I was my high school valedictorian and a competitive gymnast. I know how to study. I know how to plan my time. I know how to work hard. I worked hard to earn a scholarship to this school and I will continue to set high goals for myself and work towards them. But right now that's all I'm doing and I can feel myself crushed under the weight of my classes. 

I feel like I'm losing control of everything. I came into this quarter with high expectations for myself even so far as to taking two honors courses as a first year and I'm afraid I can't reach them. All of the clubs and organizations I'm in are remote and despite me applying and obtaining an officer position in one of them, sometimes it is just difficult to get out of bed to show up to a meeting. I even applied for research this quarter. (I was rejected.) Along with that, I have to put in extra hours to take care of my grandpa during the pandemic and most of my family income relies on our nail salon which are not a reliable business nowadays. 

Today I wanted a head start on my math homework and got one of my answers wrong and I just shut down. I couldn't even maintain a perfect grade in my homework category. It's just all so demotivating and even when I told myself there would be another quiz, another test, another homework assignment, etc. I just  can not. The week of my chemistry quiz, my dog died and as much as I tried to shift my focus away from it, I just couldn't bring myself to. 

For everyone telling me that I sound defeatist or that I should be able to stay motivated by just looking forward to the future, please... it's not that easy for me. I went to almost every office hours, arranged study groups online, organized club events, etc. I'm really trying my best here. I don't know if it's just because I'm not smart enough but I'm struggling so much here. There were times while I was driving that I was tempted to just crash into something so that I can finally get some rest. 

TLDR: I'm really trying everything I can here yet I'm barely getting by this quarter. This is one of the few spaces I can anonymously vent and I'm sure that goes the same for many other students on this sub forum as well. This was a hard quarter. I just want to feel like someone is listening to me even if they aren't so, please, validate other students on this forum whenever they are venting or just talking about how stressed they are. Be kind. We really need that, especially now.",1606181282,1,0
cse 158,I swear I was top 40% last night and now im top 89%… this sucks.,1606180070,1,0
CSE 158,[removed],1606180003,1,0
Router flashing,"my router is flashing red and green one after another every second 

what does this mean",1606177120,1,0
Anybody else really worried about what they're going to do or where they're going to go after they graduate?,I already know I won't get anything without internships/research. I'm so fucking tense about this.,1606176141,1,0
The ghost of libraries past,,1606172987,1,0
Academic plans affected by coronavirus,How has covid affected your graduation plans? Do you think you will have to take another year? Another quarter? Did you take a gap year?,1606171669,1,0
Beginner language Classes,"I’m a first year and don’t know much about what classes are offered. I want to take a beginner language class, so I can pick up a 3rd language, I’ve seen some Language classes but there for people who already know that language. So if there are any please let me know for spring or next year",1606171499,1,0
Bild 2 Jiyoung Park or Bild 3 Jessica Gambel,"Hi, so I plan to take one of these courses for the next winter quarter. I decided to second pass Bild but all the good professors are gone, I was wondering if anyone can tell me how these two professors and if I should go for or avoid these 2.
Thanks",1606171314,1,0
Professor interaction?,Anybody managing to interact sufficiently with their professors right now? Hasn't been easy for me.,1606169752,1,0
how fucked am i if i missed my enrollment period?,is there another chance to enroll?,1606168987,1,0
UC Scam Diego is true (my brother got this text message and he’s not even in college),,1606168647,1,0
Can I take the Humanities series out of order?,"As of right now, my Winter schedule is a bit crammed and I am considering dropping HUM4 if the coursework is too much for me to handle. I was wondering if I did so, if I could take HUM5 in spring quarter and then HUM4 next winter (WINTER 2022 instead of WINTER 2021).",1606168494,1,0
I got stuck with Crowell for Chem 6B...,"Due to my late appointment time, the only Chem 6B professor that I could manage to get is Crowell. He still has so many spots open because I'm guessing that nobody wants to take his course- does anybody who has him for 6A right now have any input as to how he is as a professor? I heard that he's difficult and sometimes doesn't even post lectures, because everything is online now. I'm also concerned that I'm not going to learn anything and be screwed for 6C. The other options were Stallings, Komor, Hoeger, and Schurmeier. Should I try to nab a waitlist spot for one of these professors in the second pass enrollment? My second pass enrollment is also very late so I don't even know if I can manage that. Will I be able to survive in Crowell? I'm currently in 6A with Bussey and I'm doing pretty well. 

Any input would be appreciated! Thanks!",1606164700,1,0
I got stuck with Crowell for 6B,"Due to my late appointment time, the only Chem 6B teacher that I could manage to get is Crowell. He still has so many spots open because I'm guessing that nobody wants to take his course- does anybody who has him for 6A right now have any input as to how he is as a professor? I heard that he's difficult and sometimes doesn't even post lectures, because everything is online now. I'm also concerned that I'm not going to learn anything and be screwed for 6C. The other options were Stallings, Komor, Hoeger, and Schurmeier. Should I try to nab a waitlist spot for one of these professors in the second pass enrollment? My second pass enrollment is also very late so I don't even know if I can manage that. Will I be able to survive in Crowell? I'm currently in 6A with Buseey and I'm doing pretty well. Any input would be appreciated! Thanks!",1606164458,1,0
Anyone in USP 1 ?,Need friends to share my essay with since it says on the syllabus that we have to. PM me for discord,1606164413,1,0
The duality of man,,1606164201,1,0
Randomly saw this when opening up WebReg. What's up with this?,,1606164112,1,0
CSE courses for a ME major,"Hey! So I am first year Mechanical Engineering major and have space for around 4-5 extra classes my second year and about 2-3 more classes my 3rd and 4th year (for a max of 8 spaces my undergrad years). I realize I cant minor in CS or CSE, but I was wondering if it would still be helpful to take some fundamental courses from these majors as a ME major just to expand my skillset. If so which would be some essential courses I should take? 

FYI, I dont have much programming experience, only a very basic Java background. I also realize a similar post was made regarding this, but it is getting a bit old and would like a current perspective. 

Thanks in advance!",1606163852,1,0
Bike Looted,"Nothing too valuable, but shitters stole my bike tools and my bike valve caps.",1606163316,1,0
"Perhaps a silly question but if I need a class but it requires a prerequisite I don’t need, can I petition to skip the prereq?",Like for example you need calc for chem. Can I somehow skip calc?,1606162712,1,0
math 18 w/ zucker,"so I’m trying to plan out my winter schedule and I first passed math 18 to get in devleming’s class, but now I’m considering unenrolling to get into a chem class with a better professor. zucker has a lot of open seats if I want to second pass math instead, but I can’t find any good capes reviews or anything on the reddit so I was wondering if anybody has taken him before and has any info about how good of a professor he is? any help is appreciated :)",1606162708,1,0
Is PHYS 1a/1aL too much?,"I wasn’t able to enroll in BILD 4 (again..sigh) so currently I have Hum 1, Chem 6b, and Math 10b (hopefully I get in) for classes I can take next quarter. I was thinking of adding Phys 1a/1al to have around 4 classes, but is that too much workload? I took AP physics in high school and I was pretty good at that but idk how to gage this class. (Also the lecture portion is already full with a big waitlist so idk what to do at this point omg).",1606162486,1,0
Can any Joint Math Econ major grads tell me how the job market looks like for the major?,"My parents are kinda annoyed that i didnt go into medicine or engineering and they keep asking me about the job oppurtunities and what kind of jobs i'll have. I realized that i dont really know the answer to that question.

To be more specific: Im planning on grad school, and i might minor in data science as well, but im not sure what kind of work lies ahead. Any help would be appreciated",1606161380,1,0
PHYS 1A Waitlist,"I’m waitlisted in phys 1a and there are 3 other people in front of me, do I have a chance of getting in?",1606158123,1,0
College Rankings for Prospective Microbiology/Pre Med Student?,"Hi everyone, I’m currently a HS senior and am having trouble ranking the UCSD colleges. I’m planning to major in microbiology and hope to eventually go to medical school. 

AP CREDITS: 5 AP U.S History; 5 AP Language and Composition; 5 AP Chemistry; 4 AP Biology; Planning on Taking AP Physics 1, AP Literature, AP US Government/Politics, and AP Statistics

Right now, my list is 1. Muir 2. Marshall 3. Sixth 4. Warren 5. Revelle 6. Roosevelt. What do you all think of this list so far and where do you think seventh should fit in? It seems to fit me well, except I'm not sure since it is so new.

Also, I heard that if I do submit my AP credits, I will not be able to take some of the introductory classes for that subject. For example, one of my teachers told me that because her son submitted his 4 from the AP calc test, he was not allowed to take the introductory calc classes. Has this been the experience in any of your cases? For me, I really want to take the introductory biology classes, as I do not believe I have a solid foundation from high school, so I'm debating whether I should submit my AP biology score if this is the case.

I would appreciate any insight you all could provide. Thank you!",1606157745,1,0
P/NP Petition Update :),"Thank you SO much to everyone who has signed this petition. We have gathered a ton of support and momentum — I’m hopeful we will be able to make a change. 

Someone from Change.org reached out to me and said if we can get up to 1700 by midnight tonight, we could have our campaign featured on their social media :D 

So please, message your peers, friends, family, anyone and everyone! 

Also, I am reaching out to AS and I’m hoping to get a response soon. I’ll be posting updates on the petition site, but will post here too if people would like! (I don’t want to spam, hehe.) 

If you have any ideas about who else I can contact/ways to share the petition/things to add, let me know!",1606156634,1,0
Has anyone received​ a CSE tutor offer for Winter 2021?,"Just wondering. It looks like some courses need extra time to decide tutors, but I'm curious if any student received any offers.",1606155962,1,0
CAT 1 Algaze Discord,I know it's kinda late into the quarter but does anyone have the discord link for CAT1 with Algaze Guillermo? Struggling a little with the essay and would like to see if anyone had any tips on there thank you!!,1606135740,1,0
Has anybody emailed members in school’s senate before?,"Im eager to know which stage my personal petition is at since it has been half a month but i’m not sure if that is the right thing to do...
Thx",1606135484,1,0
Anyone have experience with failing a major prereq class?,"I think i’m gonna fail a class.. don’t know if i should be more worried about my gpa or the fact that i’m gonna have to retake the class even though i know 7 weeks of the material.. and also that it’s the same professor teaching it.. and if i don’t pass this class i can’t take the other classes in my major bc this is a prereq for them... and also the whole reason why i’m failing it is because i got depression and a sleeping disorder from this pandemic and the only way to cope with it is sleeping 13 hours a day or being chronically tired and depressed... all of which doesn’t help because i have a learning disability.... 

already tried reaching out to my professor and he basically said sorry i can’t give special treatment because whatever i do for you i have to do for the rest of my students.. really hitting my breaking point guys i already dropped to 12 units and pnp the other two classes and reached out to caps...",1606126109,1,0
Does all petitions need to go through the senate?,A,1606125101,1,0
Here's a Daily Reminder to Sign and Share the Petition for Universal P/NP! [Link provided below],"
[Petition Link](http://chng.it/nRwrkB5zLq)",1606121124,1,0
Caps,What should I expect from my first CAPS session? I was feeling stressed lately and I decided  to sign up and now have an appointment today.,1606119280,1,0
AP Exams,"When applying to UC schools, I have to list the AP exams I plan to take after the application (end of senior year). If I get accepted to UCSD, am I required to report those scores, like how I have to report my official transcript?",1606119097,1,0
Falling behind and fatigued,"I don't understand why, but I'm not staying on top of things like I have in previous quarters. I've already submitted two labs late twice in a row and missed 2 other hw assignments and did poorly on a midterm. I feel like crap and I'm just so tired. I just wanted to post this cuz I'm looking for advice",1606119078,1,0
Anybody in Cooper's labs think his grading is ridiculous?,Arbitrary unclear grading just so he doesn't have all As in his class. He literally said because we're doing to well he has to grade like this smdh,1606118537,1,0
rank the 7 colleges at ucsd CS major,rank the 7 colleges at ucsd for a computer science major,1606115755,1,0
Should I wait to take chem 6b and math 10b until spring?,"Hey yall so I'm a 1st year and I took chem 6a and math 10a this quarter. I wanted to take 6b and 10b during winter quarter, but during first pass I decided to sign up for MCWP 50 and FMPH 40. Tomorrow is my second pass and only Crowell is left for chem and Ciotti is left for math. I haven't heard really great things about them. I already struggle in math and chem a lot so I was wondering if it would be better to wait until spring quarter to take these classes or should I suck it up and take crowell and ciotti. I get priority registration so I would be able to pick better professors for math 10b and chem 6b spring quarter. Of course this would mean I would take chem 6c and math 11 fall 2021. Thank you in advance for any help!",1606115155,1,0
Job Title after doing Masters in research lab?,"Does anyone know what job title you would have if you stay after your masters to continue working in the same lab. Department is biology, does anyone know what the pay range would likely be?",1606113776,1,0
Health promotion,[removed],1606113396,1,0
CS with bioinformatics specialization to pure CS transfer,"If I get in to cs with bioinformatics specialization (my application fits with bioinformatics), can I easily transfer to pure CS at UCSD.",1606111630,1,0
Is it any realistic hope for summer session to be in-person?,"I hope I'm not posting too much on this sub. If you get tired of seeing my posts, please let me know and I won't post more than once a day here.

I'm a senior who's really sad that my last year of undergrad is being spent this way. For everyone in the Class of 2022 and younger, you guys are really really lucky. You'll probably never take another ""normal"" day on campus for granted again. You'll be back when it's safe, and you'll know what it feels like not to have that option.

On a smaller scale, this is almost like having spent time in prison and counting your blessings after being released. No matter what happens, you'll never take freedom from granted again after you know what it feels like for freedom to be taken away from you.

What hurts me the most is how I never got to say goodbye. In senior year of high school, my friends and I had ""senioritis,"" we did all this stupid shit, we knew where we'd be going for college, and all we needed to do was hold onto a GPA high enough not to be rescinded. When we turned 18, we'd call ourselves in sick, and we went to the beach so many times that the attendance office told us we couldn't graduate if we kept those shenanigans up.

On one instance, my dad called at midnight asking where I was. I said ""I'm in an Airbnb with my girlfriend in Alpine."" My dad said ""I should've known.""

Senior year, you know it's your last year, and you've been sprinting for so long that you can finally take a cool down lap.

Unfortunately with the current situation, we can't do anything like that. It's not realistic for people to be back on campus by Winter or Spring.

BUT maybe there's a chance for Summer. If the vaccines are available and widespread by summer, I can save a class or two to take then, and I can get some semblance of a final quarter in summer session. It won't be the same, but at least it will be something.

But who knows? Maybe that's not possible either.

I think some of the predictions say the US can expect herd immunity by May. If that happens, could summer session be in person?

I know it's cutting it close. Maybe it's not possible.",1606110583,1,0
Math 10c struggles :’),"Exam tomorrow and looking over these practice exams (one of them is from 2005), not a single thing has been covered in her lectures :’)
Thank you for being so incompetent Ms.Um, your service is greatly appreciated",1606110509,1,0
How does the petition to drop classes after the deadline work?,"Just when I thought this year couldn't get any worse, my grandmother suddenly fell really sick. Now I'm spending time taking care of her.

The coursework might be manageable, but oh my God this is so difficult. I'm already stuck at home and now we've put a desk in my grandma's room so that I can help my grandma when she needs something. I'm not the only one helping her, but this can seriously be a problem in studying.

Is it possible for me to petition to drop my classes this quarter, take the year off, and come back in Fall? I'll be a sixth year senior then, which is fucking irritating to even think about, but it's better than being a sixth year senior with Fs on his transcript.",1606109410,1,0
Easiest Psyc Core Classes?,Any recommendations for profs or classes would be appreciated!!,1606108530,1,0
Retaking a class,I’m taking the Chem 6 series right now but my grade isn’t looking so good for 6a right now... if I were to get a D should I enroll in 6b or just retake it. I’m a human bio major in Muir.,1606108021,1,0
cse 8b with prof. alvarado,anyone know if she makes discussions mandatory?,1606107396,1,0
Math 20d,I have my second pass tomorrow and I’m not sure if Vavalis or lee for math 20d?,1606106754,1,0
TFW when you have midterms during Thanksgiving Week,,1606106455,1,0
Rev 20 Question,"How many spots exactly are there in Rev 20, because it showed that theres only 42 on WebReg, and I checked my email late today and only saw my invitation sent 18 hrs ago, but when I went to apply, theres already 21 people on the waitlist. Does this mean that I won't get into the class? or what will they do about the people they invited other than those 42.",1609386246,1,0
Tips for a student poor at math going into CSE20?,"Hey guys as the title suggests I am a first year and I'll be taking CSE20 this upcoming winter quarter, problem is I would not consider myself proficient at math, the highest math I ever did was precalculus in high school my junior year, which I passed with a B. I did stats my senior year cause I was an underachiever. Does anyone have any tips or resources to help survive the next 10 weeks? Thanks guys.",1609385496,1,0
Remote Pre-Health Leadership Opportunity Available!,"Can't find a **pre-health/leadership opportunity** amongst the pandemic? 

Apply to Homeless HEAL! We will continue to **remotely** teach health-based education to the homeless and **remotely** be involved in various projects pertaining to helping this community. 

Anyone and everyone can apply (including freshman and sophomores). 

Please check out our online application: [https://homelessucsd.wordpress.com/get-involved/](https://homelessucsd.wordpress.com/get-involved/?fbclid=IwAR0XKb8F5XLQDyiA3NnljA-YY-hDmStKbNcVJPyUlzrk4gQIf6ugW5pNBtA) 

**The Winter 2021 Application Cycle closes on January 17th, 2020.** 

&amp;#x200B;

[Apply to Homeless HEAL!](https://preview.redd.it/zoka1u0izf861.png?width=154&amp;format=png&amp;auto=webp&amp;s=5a5af36c5868167854633ddd8fa12886f55f1453)",1609385483,1,0
people moving in for winter: what now?,"are your plans changing (are you delaying, cancelling, etc) or no? curious to see what others are doing",1609385003,1,0
UC SHIP wiaver,Do we have to waive UC SHIP every quarter or do we only have to waive it once at the beginning of the year?,1609384425,1,0
Are there any expensive electronics you can buy with dining dollars?,I found [this] page where it lists every place that accepts dining dollars or tritoncash. I was wondering if I could buy like a smartwatch or something from one of the markets because all I ever go to is seventh market.,1609381329,1,0
Where are all of the CS majors applying to internships?,I think the title is sufficient.,1609379348,1,0
Free PHYS1BL Lab Manual,"Hey y'all, new quarter = new lab manual. Once again, I got it from the bookstore and converted to PDF. Just use your UCSD email to access :) 

[1BL Lab Manual](https://drive.google.com/file/d/1aKQRq9TW7klsHFpDXRgo0qsQY17NIfw3/view?usp=drivesdk)",1609379024,1,0
Do I have a chance to get off the waitlist?,"I am currently 5th on the waitlist for BILD3 for a section of 30. Should I just give up and enroll with another professor? If I should, those who took Gambel or Caffrey please lmk how they were as profs during fall quarter, please. I looked at their CAPEs but I feel like their CAPEs are very similar.",1609378131,1,0
Chem with Hoeger Online,"Hi guys 

I have hoeger for chem6b for the upcoming quarter and so I want to get an idea of what his class is like online. So far I heard that for his other classes he basically reused his old podcasts that are super long but what is it like in terms of the tests, office hours, hw load, etc.? is it possible to even get an A in his class? I've read through his ratemyprof reviews and ngl it's not looking so good for the fall quarter... I'm a first yr and i'm pretty nervous so any info will be appreciated :)

on a side note, i'm also kinda frustrated that he sent an email this morning about getting started with his lecture videos and this ruined the rest of my break now all i'm thinking is about those videos :/",1609374925,1,0
Housing credits for delaying returns to campus...,"...I think? At least, that's what it seems to say in the email I received *after* changing my return date in the HDH portal. Here's the text:

&gt;**Students that changed their date to return to campus between January 18 and January 31,** will receive a two-week housing credit applied before the end of Winter Quarter. **Students that changed their date to return to campus after February 1, 2021** will receive a four-week housing credit applied before the end of Winter Quarter. You remain financially responsible for all housing and dining charges regardless of being present on campus as you hold an active housing contract. 

If anyone can confirm this, it would be greatly appreciated.",1609374564,1,0
F for the future of spring quarter if we don’t get our sh!t together,,1609371675,1,0
How hard is math 18 if I have zero mat lab experience?,Taking it for the quarter coming up. Would an A be obtainable? Should I not worry or should I start practicing right away?,1609370876,1,0
bruh,,1609370727,1,0
