title,selftext,created_utc,score,total_awards_received
Thought this sub would appreciate the messenger of this reminder :) Stay safe out there everyone! (@kristinamicotti on ig),,1600986945,1,0
Anyone an employee of UCSD Health and a UCSD Health volunteer here?,Wonder if anyone is in the same situation as me. They let me know that they are no longer going to provide free parking for volunteering in my case.,1600982155,1,0
Bigham or bronstein for CAT1?,which teacher is fun and easy,1600980854,1,0
Question for Hikers &amp; Adventurous Walkers,"Hi!

What are some of your favorite hiking trails for solo/beginner trips? I know I could probably look it up online, but maybe some avid hikers want to share their favorite spots. Please let me know, trying not to sit inside all day (:  Thank you!!!",1600979962,1,0
Question: ucsd,[removed],1600977823,1,0
Is it OK to visit on-campus partner if they will be living in a single alone?,"My partner is living on campus and they discovered that not only do they have a single, they also will not be getting any sort of roomates for the rest of the quarter at least. So they're living completely alone. We obviously hang out outside of campus too and have consistently stayed in a ""covid pod"". 

Would it still not be OK for me, a non on campus resident, to visit my partner?",1600977004,1,0
black's beach and surfing,"hey! i'm an incoming freshman at muir who would like to get into surfing. 

is it realistic to make the walk from muir to blacks with a 6ft surfboard? also, whats the best path down?

i've also heard of people taking a bus to the beach, do they allow surfboards?

thanks",1600976456,1,0
Has COVID-19 changed anyone's housing situation drastically??,[removed],1600973522,1,0
I might have fucked up and I might need help.,"So I’m in etc and thought the orientation started at 11. That’s when I joined. Turns out it started at 9 and I missed most of it. I saw that you could get dropped from classes for not doing it, so is there anything I should do? I’ve finished all the modules a few weeks before, if that matters.",1600973521,1,0
Mini fridge,What is the best size mini fridge to bring to a dorm room?,1600973244,1,0
I-House Trash,"does anyone know where I can throw away my trash in I-House? I live in Kathmandu and I know there’s a big dumpster between Kathmandu and the institute of Americas, but I believe that is only for recycling?

Thanks!",1600972967,1,0
Anyone wanna be tennis buddies?,"I was thinking about buying a racket soon because I've always wanted to get into the sport but im a novice and I dont have anyone to play with :( 
I live in Muir so it would be ideal to play on the tennis courts nearby Tamarack, but if not the ones up in Marshall would also be fantastic",1600972934,1,0
Chem 6A Schurmeier,"Hi everyone! I am an incoming freshman taking Chem 6A online this fall quarter. If possible, can I please have some input on how professor Schurmeier is like? For example, is she a good teacher? How are her tests? Is she kind and understanding and helps you out if you’re stuck? I am learning remotely from home this quarter, and I am a bit nervous. I heard a lot of good things about Bussey and Brydges, but I haven’t seen a lot of comments regarding Schurmeier. Thank you so much!",1600972316,1,0
Trash in Keeling?,Does anyone know where we can dump trash in the Keeling Apartments?,1600969769,1,0
Registering to vote takes 5 min and you could do it on your phone while taking a shit.,"Google ""register to vote California"". Google gives you direct links.",1600967450,1,0
California COVID Notify Program app download!,,1600967389,1,0
Target Coming Soon,,1600966354,1,0
BIMM 121 in virtual format,"Has anyone taken this lab online (preferably with Katherine Petrie)? How was the workload, and was it manageable? Thanks!",1600964896,1,0
BILD 3 with Sarah Ardell ?,Anybody taken her yet? How was it ? What should I expect ?,1600964572,1,0
Coming Soon,,1600961327,1,0
10% rule for LD math classes,"I had taken the math 10 series but I just switched to a major that requires the 20 series so I need to go back into math 20b. Problem is I’m waitlisted but I am #1 on the waitlist, I feel like since a lot of majors require this class the 10% rule may not apply. What are y’all’s experiences with LD math classes?",1600959326,1,0
The highly anticipated sequel to my original raccoon waifu drawing. i encourage anyone from ucb to retaliate with a bear waifu of their own,,1600949113,1,0
raise up for help!,[removed],1600941963,1,0
Dryer Machine at Marshall,"Silly question,

but how do i use dryer machine at Marshall res halls. I can’t find how to start it nor where to insert coins/card

TIA",1600934225,1,0
I'm f**king hungry,"I feel like Drunken Noodles with extra chicken from Blue Pepper would hit way different cuz of quarantine.  


If someone on campus orders some, take a pic plz lmao",1600931202,1,0
"Does UC Ship cover visits to dermatologists? If so, which dermatologist can I make an appointment with?",Any help would be appreciated! Looking for a dermatologists that UC Ship would cover.,1600930961,1,0
"Freshmen, how is orientation this year?","Whole year’s whack and I’m guessing orientation is no different haha. Usually it takes a whole day to do, how is it for u guys? Also how are you liking it?",1600930793,1,0
LAN Ports in Marshall,Is there anyway I can call IT and get the ethernet ports in my room in Marshall Lowers activated so I can hard wire my PC for internet? The WiFi where I’m at is unstable and honestly sucks. I use to have my PC hard wired when I lived in warren and it worked great.,1600930449,1,0
How long does it take for parking permit to be delivered?,[removed],1600929832,1,0
Settlement reached in discrimination lawsuit against UC San Diego,,1600929029,1,0
Dirty bird is hella nice😭: wings/pizza/sports bar,,1600928274,1,0
Meeting new people,"I’m a new masters student living in the Mesa Nueva/Nuevo East area for about a week, and haven’t really met anyone. Is there any way to meet new people? Like is there a general consensus that knocking on people’s doors to introduce yourself is ok, or should I not do that (and are there any other ways to meet new people)? Please don’t give me “uc socially dead hahaha” :(",1600927070,1,0
COGS118A-D coding understanding and experience,"Hey humans, 

I’m thinking of taking COGS118A-D during my junior and senior year at ucsd. 

I just wanted to know how much understanding of a computer language i needed as well as class experience. I’m asking bc coding isn’t my strongest suit but I’m really interested in taking these classes (especially COGS118A and B) and don’t want to be discouraged by the coding part of it. 

Could someone whose taken these classes before please shed some insight on this? I’d really appreciate it! Thanks in advance! 😊",1600923657,1,0
Take INTL 101 and 102 Together?,"Okay so I'm wondering if I should take INTL 101 and 102 together and if it'll be too much work just writing and reading wise. Mainly because I'm taking an online screenwriting course at a community college and I'm applying to Graduate Film school this fall as well. So based on that, is the workload for both INTL 101 and 102 going to be too much?

My course load: MGT 181, INTL 101, INTL 102, POLI 120G (+ Screenwriting at CC + Grad school apps)",1600921286,1,0
Any outdoor places to workout on campus?,Hey everyone! I'm moving on campus tmr and was wondering if there were any outdoor areas to workout as rimac is currently closed (maybe where they have pullup bars or dip stations). Would anyone have any recommendations? Thanks!,1600919733,1,0
fire trucks?,anyone here like fire trucks?,1600917656,1,0
IF ANYONE IS STRUGGLING WITH MATHS RIGHT NOW,[removed],1600915944,1,0
What does R32 mean? (Classroom location?),Which building is that in ? I also have R137 and R176.,1600915451,1,0
Asynchronous Classes,Does anyone know if any comm classes/poli sci classes that are for sure going to be asynchronous?,1600915102,1,0
MATHS HELPER :),[removed],1600914744,1,0
Fall Scheduling Help for an incoming freshman,[removed],1600913453,1,0
How does the wifi work,[removed],1600905997,1,0
How does the wifi work,[removed],1600905980,1,0
"Congrats on getting accepted to UCSD! Klesis Christian Fellowship is having a Fall Connect this Thursday u/8pm over Zoom. Come get to know other UCSD students and alumni, play a fun games and the chance to win a $25 Amazon gift card! Signup: bit.ly/kfc-signup Zoom: bit.ly/kfc-zoom",,1600903581,1,0
Klesis Fall Connect for Incoming UCSD Students,,1600903486,1,0
Explore?,"What’s up everyone so I’m looking to explore the campus (a little more) and was wondering if anyone might be down to do so? Of course, face mask required and only if you tested negative. Let’s be friends lol I’m a first year transfer out of ERC coming from Los Angeles so I’m not nowhere near familiar with San Diego.",1600900238,1,0
Get some coffee,,1600899978,1,0
"Busses/signs on campus saying to add ""CA COVID Notify"" to your phone","Does anyone know what this is? I looked it up and didn't find any articles on ucsd pages or any news outlets saying that it's an app for us to download. I know UCSD sent out the email saying that the UC system is working on an app for this, could this be it and UCSD is premature in putting up their signs?",1600899910,1,0
Question from a UCR student applying to Scripps PhD Program,"For the course checklist in the marine bio application do we just print out the checklist and scan in a written version of what we've taken? Also, were not expected to have taken everything in there right? I'd say I fulfilled most of the requirements but its a lot of classes...",1600895517,1,0
Transfers at the Rita,"I need to socialize. I know we arent supposed to be getting together rn, but I'm hella lonely and my roommate hasnt shown up. So I was wondering of there was any group chat set up so we can meet people in the building.",1600894238,1,0
To everyone in the common area next to ocean view rn,"You weren’t wearing a mask, nor were you social distancing. School hasn’t even started yet and you’re already fucking up. Well done",1600893374,1,0
What does credit balance mean?,"Sorry if this question is dumb, on my Billing and Payment and the top says Alert: You have a credit balance of $x. Can someone explain what the number means, is it how much I owe?",1600892777,1,0
Any of you hear from your classes instructors yet?,Only heard from 1 so far... curious about everyone else.,1600892555,1,0
Feeling limited by my crappy technology in this screens-only world,"Just wanted to rant here. I have a crappy phone and crappy computer that love to overheat, freeze and run out of storage space constantly. As a financially unstable engineering student I would usually use UCSD's library computers but with the obvious happening, I currently can't. I'm not sure how I'm going to explain to my professors how I can't run Zoom and take tests at the same time or else my laptop will want to freeze up. 

For now I've just been deleting bloatware, cleaning up the disk, not sure what else to do.


I heard something about loaner laptops but are they still doing it/is it too late? Im not sure.",1600892206,1,0
UCSD Ridesharing?,[removed],1600891558,1,0
Can't log in to mystudentchart ?,"I was trying to schedule my asymptomatic covid test appointment and at the end of the scheduling, they ask you to log in to your mystudentchart. Somehow, I am unable to log in to it. I can log in using the ucsd app but the appointment doesnt show up there for me to confirm it. Besides, I just wanna know why i cant log in.   


This is what I see.   


https://preview.redd.it/kk4192xtcyo51.png?width=3360&amp;format=png&amp;auto=webp&amp;s=a8e93e719b67e027bd7d5586beeb5450e9b23d5f

And when I click that red button to log me out, This is what I see

https://preview.redd.it/ghcehrnwcyo51.png?width=3360&amp;format=png&amp;auto=webp&amp;s=fa62d41ec6ed38b755d7f817d193475c55c68380

And when i go back to my student chart. It shows that i haven't really logged out and shows the same thing you see in the first pic.  


I have cleared my cache and everything.   


Was wondering if anyone had the same issue.",1600890942,1,0
Financial Aid,Anyone know how and when we’re supposed to receive our financial aid?,1600890765,1,0
Returning textbooks,"Hi yall

It looks like the library is not automatically renewing textbooks anymore, and I am hesitant to send a email to renew my book. I've had these books for almost a year now since they kept automatically getting renewed because of covid. These book are for a core class, and I think it might be beneficial for people who are taking the class this quarter if I decided to return it. However, I am residing outside campus, and I would rather not visit campus if I happen to be asymptomatic. Campus seems like a closed environment with the constant testing happening, and I think its unethical for me to step foot in campus right now.

Even if I got tested for covid the day before visiting campus, I feel like there's a chance of me getting it on my way to campus.

Maybe I'm overreacting, but I want to take the highest precaution possible to insure we don't end up like sdsu.",1600890558,1,0
Does anyone have the PSYC 7 (Developmental Foundations) Syllabus???,Pls,1600890206,1,0
"UCSD ranked #6 public university in U.S., #4 in UC system by the Wall Street Journal","Campus|UC Rank|Public Rank|National Rank|
:---|:--:|---:|---:|
UCLA|1|2|26|
UCB|2|4|34|
UCD|3|5|38|
UCSD|4|6|39|
UCSB|5|16|74|
UCI|6|18|80|
UCR|7|48|192|
UCSC|8|68|255|
UCSC|9|uranked|uranked|

(Paywall) Source:

https://www.wsj.com/articles/best-colleges-2021-explore-the-full-wsj-the-college-ranking-list-11600383830",1600888218,1,0
Too Late Or Not To Switch?,"I've really been seriously considering community college in the last few weeks, but am stuck on whether to jump ship to CC or not. For context, I was admitted to UCSD as a undeclared freshman (first choice Computer Science) and picked the school because it had a better name than the other UC's/CSU's that I was admitted to. However, since classes are online anyways with tuition+fees still remaining at $15,400 (whereas CC costs $1,500), and since it seems unlikely that I will get CS because UCSD CSE is tightening admissions to only 55 students, would it be reasonable to start at CC? The only thing holding me back is the fear that I won't get in anywhere good for CS/I might lose credits in transferring if I stay at my local CC. And if I do choose to start at UCSD, what paths should I take if I don't succeed in the CSE lottery?",1600886467,1,0
What happens if you miss orientation?,I accidentally missed the first two days of zoom meetings for Warren orientation. Is that fine?,1600886420,1,0
Health Data and Covid Study Recruitment - get $20!,,1600885047,1,0
Got too much homework? We're here to help you deal with whatever assignment you're struggling to start., Kindly visit our website [essayassist.com](https://essayassist.com/?aid=688),1600884542,1,0
Ok so does anybody know the current rules on students with housing leaving campus or their college?,[removed],1600884219,1,0
"Anyone here transferred from another UC campus into UCSD, specifically Revelle college?","Hey yall! Im a davis sophomore looking into transferring into UCSD, and I've chosen revelle college as my number 1 pick. But looking through Revelle's website, it says that for community college transfers the IGETC waives them from 4 GE requirements. Does anyone know if the UC letter of reciprocity (LOR) does the same thing (waives transfers from the 4 GE requirements)? I called Revelle college directly about this but they told me to meet with an admissions officer; and then when I spoke with an admissions officer, they told me to call Revelle college. So neither knew the answer. So is there anyone here who transferred from another UC with the UC LOR and got into revelle college?? Did your GE's get waived with the LOR???",1600879675,1,0
Pepper Canyon East Apartments: Oven?,"Hello! I'm an incoming transfer student starting in Fall of 2020. I will be moving into Pepper Canyon East, Building 1800.

Does anyone know if the kitchen has an oven? The HDH website just says ""kitchen,"" but I'm not sure what it has specifically.

I couldn't find a floor plan when I looked at the HDH website, but maybe I missed it. If anyone has any helpful links, it'd be greatly appreciated!

Thank you! :D",1600874754,1,0
Does Albizati use sapling for chem 40a?,"I don't see anything about sapling on his syllabus, but would u still recommend to get it for ppl that had him for 40a?",1600847350,1,0
Meeting David Dobrik!!! :D,So my friend is meeting David Dobrik over Zoom after winning the contest on the TritonFest account!! What would you guys ask or say to him lol? Just curious :) Appreciate y’all!!,1600843959,1,0
Does my profile look competitive for MSCS (AI Major)?,"GRE 308: 161Q 147V 4.5 AWA **(I will not be reporting GRE as they made it optional)** 

GPA: 9.44/10 (3.77/4) (Till 6th semester)

My engineering math scores:

Sem 1 Math: 98/100

Sem 2 Math: 75/100

Sem 3 Math: 98/100

Sem 4 Math: 100/100

2 Internships. First one in Python/MySQL, Shell. The second was research analyst role and required Data Scraping, Cleaning, Visualization and Robotic Process Automation (RPA UiPath). **Got a full-time offer from this internship.** 

I plan to do one more Internship in December.

So that's 3 in total.

Working on an AI project with a startup. This AI startup has a cell in my college and I'm on its core team. It was originally founded by an Indian professor at MIT. The startup will be providing certificate on successful completion of the project. We are working with doctors to get some insights into our approach. So it's not a research per se, but close maybe?

Implementing already published research papers. So I guess these could work as research projects?

Participated in an AI Hackathon.

Regarding bad GRE score, the night before I had a panic attack followed by only 5 hours of sleep. I knew I could do well on Quants but I was sleep-deprived.

Cant retake GRE due to financial predicaments.

Does my profile look competent?",1600841649,1,0
State Auditor: UC Wrongly Admitted Well-Connected Students,,1600840407,1,0
Orientations..,Tomorrow there’s gonna be an orientation for freshmen (I think for everyone or idk if it’s just my college Muir) and it’s from 9-2:30pm. Is it mandatory to go? Like what happens if I don’t go.,1600837962,1,0
RCLAS?,[removed],1600836934,1,0
Housing contract cancellation,"Ok so I just cancelled my housing contract and it says it has been processed. That means that everything that was part of housing would be taken off my bill right, including the dining money? I don’t want it to end up in my account and then having to pay for it even though I’m not living on campus anymore.",1600833333,1,0
missing ucsd grant,"so i was checking my financial aid and it turn out they removed my ucsd grant. i had emailed financial aid to make sure i would still receive it because i’d be staying at home and they said yes. so i decided to not take any loans and pay the rest. now, i have to come up with 1,500 dollars by friday. i tried emailing them twice to see if i could take out loans and they never replied. i don’t know what to do!!!",1600832522,1,0
Anyone at Muir? Also what should I eat?,"Hey I'm an incoming freshman and I just moved in today. First, wanted to ask if any other Muir freshman or even sophomore, etc, want to talk. Not Meetup just, I guess talk here then maybe we can exchange social media. Also everything is closed right now and I don't know what to eat help!!",1600830810,1,0
Does Chem 6a General Chem 1 come with a lab? Or is it a separate class? Sorry new student here!,Does Chem 6a General Chem 1 come with a lab? Or is it a separate class? Sorry new student here!,1600830046,1,0
"UC admitted 64 well-connected or rich students over more qualified ones, audit says",,1600827633,1,0
Direct Loans,"Hey guys, I'm so worried right now about my billing statement. I accepted my subsidized loans but it hasn't applied to my billing statement. The due date is this Friday and I'm not sure if I should stay worried. Are loans applied on a different day than grants? I've tried calling the financial aid office via zoom however they kicked me off for no reason and I can't go on anymore. I've already done the counseling and MPN.  Anyone having the same problem?",1600823407,1,0
Access to classes?,"I'm an incoming freshman so I do not know how classes work, so I was curious as to when we got access to our classes. Seeing how they start next week, I was wondering when/where we would get the zoom links and would know more about how the classes work (like whether or not we have to attend at the scheduled time or if it's a lecture-type thing where we can watch whenever). 

Will the classes just appear on canvas eventually, or is there somewhere else I should be looking for my classes?",1600821376,1,0
Register to vote and sign our petition to protect our elections!,"Hi everyone!  I’m working to help turn out the vote this fall and protect our elections \[Register at [CAstudentvote.org](https://CAstudentvote.org)\] - I’d love if you all could sign our petition to fund the Postal Service so we can make sure everyone can vote safely by mail! Feel free to tag friends/share/etc! And if you want to volunteer on other youth voting work at UCSD or take on an internship in organizing, check off the volunteer boxes :) Thank you!!

[https://actionnetwork.org/petitions/protect-our-elections-save-the-postal-service-9](https://actionnetwork.org/petitions/protect-our-elections-save-the-postal-service-9?fbclid=IwAR2RL0k0VKyE8QI6kU1Zn-CHwooZkSFhFNsm8QjtKM-3Lq9-T62QBM_n2O8)",1600816780,1,0
"Thoughts on Engineering World Health, Engineers for a Sustainable World, Engineers without Borders?","I am interested in these clubs and thinking of checking them out this school year. If anyone has experience of is a part of it, I would like to know if you'd recommend them.",1600816429,1,0
Mailing Help,"I recently ordered a kitchen item from Walmart and it said it was delivered today. I asked around and they sent me to Price Center. I walked there and somebody working for the UCSD bookstore said they only receive Amazon parcels there (the amazon center is next to the UCSD bookstore). How, where, and when do I get my package?",1600815184,1,0
Why was the flag flying at half mast today?,"Why was our American, California and the UCSD flag half mast at the three flag poles on the Gilman Drive right next to the intersection with La Jolla Village? You know, where there is construction going on? This was around 1 O'Clock.",1600814683,1,0
Transfer courses from OOS community college?,"I was thinking about taking summer classes at my local community college (in illinois) instead of at UCSD this summer, it’s way cheaper and likely that UCSD’s courses will be remote anyway, but I can’t really find any information about whether UCSD accepts transfer credit from out of state community colleges. I’ve looked at transferology and it was also pretty unclear.

Does anyone have experience/advice with out of state community colleges and know if its possible to transfer credits to UCSD??",1600812964,1,0
Can I ask CAPS or SHS for a letter of EAS?,"Basically as the title says. I live in LA but my PCP doesn’t have any appointments till November and I recently got a dog and my landlord is threatening to remove me if I don’t get rid of my recently acquired dog (despite there being no contract signed and the landlord claiming it “violates the lease” which is practically nonexistent, basically fuck landlords). 

Is there a shot I can get a letter of Emotional Animal Support from UCSD’s SHS or CAPS? It would be of great benefit and a relief. I don’t wanna lose this dog he’s like my son.",1600812147,1,0
Ethernet for Gaming,"Is anyone moving onto campus Fall 2020 and taken aback by the fact that they have [phased out Ethernet connection in all residence halls](https://resnet.ucsd.edu/get-connected/computer.html)? One of my friends is moving to Seventh College East and he is big into Smash Ultimate. He's been playing a lot online due to locals being cancelled (pandemic and all), so it's kind of become a big part of his social life. Does anyone know if there is anyway around this? Are there enough people to perhaps start a petition? If not, is there anywhere nearby that has working ethernet ports? This decision seems a big strange to me, as gaming is only growing in popularity.",1600811121,1,0
Do I need to buy a webcam?,Wasn’t sure if anything would be provided,1600810428,1,0
Course Offerings List Release,"So this might be a dumb question, but I’m a dumb freshman :) :

On average, how many weeks/days before the enrollment period for the upcoming quarter do colleges release their “Course Offering to Satisfy GE Requirements” PDF List on the VAC? 
(for example, the title of Marshall colleges’ for this quarter is “Fall Course Offerings to Satisfy TMC General Education Requirements PDF)


Will I receive a notification by email when my college releases it? Or must I check for it manually and daily in the weeks/days before the enrollment period begins?",1600809660,1,0
Should I ask TA to revert my grades back?,"I was checking my grade for a course for summer II,  and realized some of the assignments were not graded; after I wrote an email to the TA and he input the grades,  I am down a letter grade on canvas, not yet reflected on academic history. 

I am tempting to ask him to revert the changes that he made, should I? Can I?",1600809479,1,0
