title,selftext,created_utc,score,total_awards_received
Pass/No Pass for Fall 2020?,"I am sure this question has been asked a lot with COVID-19, so I am sorry if I am repeating someone else's question. During Spring 2020 I was aware that many of the UC's temporarily allowed students to take major prerequisite classes with a P/NP:  


*""UC has temporarily suspended the letter grade requirement for A-G courses completed in winter, spring, and summer 2020 for all students""*

With that being said, I have not seen much information regarding the Fall 2020 semester. Should I take that the letter grade requirement is now fully required for major prerequisite courses in Fall 2020? The only bit of information that I know is that UC schools increased the maximum amount of P/NP units you can take in the fall.",1599764441,1,0
Fall Parking Permits,"I just received this email regarding Parking Permits for Fall Quarter:

""Thank you for contacting us, for the Fall Quarter we are moving onto virtual permits so you do not need to worry about mail time, furthermore please be advised D permits will upgrade to B and S spots for the Fall Quarter""

Virtual Permits it is..........",1599761641,1,0
When/where to buy books?,"Hey everyone this fall is going to be my first quarter at UCSD as i’m transferring from a community college. 
In community college i would always order my books for the class after the first day of school. 

At UCSD should I purchase the book before class starts or after the teacher gives us a syllabus? Also where can I find the book that the teacher requires for the class? 

Thank you!",1599761581,1,0
BIMM 110 (mol basis/disease) with Day or BIPN 120 (endocrinology) with Cooke?,"I am enrolled in both classes for fall and will have to drop one. I have taken both professors before and like both of their teaching styles. My only concern is, I’ll be taking one of these with a lab as well as metabolic biochem. I just want to make sure the course loads are manageable. 

In addition, is BIMM 110 anything like genetics? I know genetics is a prereq so I wanted to see if there were any parallels between the two courses.",1599761526,1,0
"A conversation with UC San Diego alum, futurist, physicist, author Dr. David Brin: where are we going?",,1599758370,1,0
6 New Restaurants to Come to UCSD in 2021,,1599751329,1,0
Petition to ERC,"Please forward and sign

http://chng.it/fDg2Zr85",1599750779,1,0
Please forward and sign.,[removed],1599750630,1,0
Textbook pdf sharing page?,"I can’t find the facebook page for the textbook pdf sharing. Does anyone know if it was taken down?

If so, what are some alternatives to getting my textbooks for free?",1599750627,1,0
Nuevo East,I have received an offer for Nuevo East 2 Bed/1 bath. I was looking at the virtual tour and the bedrooms seem very small. If anyone living there could share the measurements for a 2 bed/1 bath apartment?,1599746656,1,0
Question about University Loan,"I’m currently trying to take out the University Loan to cover the remaining balance that I need for the year, but since I’m 17 it won’t let me sign the actual contract even though I already accepted it through my TritonLink. I called the FINAID office and they said to contact ESCI and that I’d need a co-signer but i still haven’t found one, so does anyone know how soon I’d have to get it done before I get screwed??",1599724024,1,0
UCSD CSE BS/MS notified date,Does anyone know when exactly will BS/MS CSE decision be released? Just like the calendar said by the end of September?,1599720996,1,0
Online courses to get extra units during gap quarter?,I’m starting at UCSD this Jan and deferring a quarter. I was wondering if there were any specific online courses that I could take that could transfer as units/give me an advance towards my degree :),1599718755,1,0
Sad pandemic noises.,,1599718434,1,0
MMW is the worst class at UCSD imo,"Im obviously hella biased and im sure there are people in erc who like it. but in the last summer session i took 15 with chang and it was ridiculous. weekly lectures with insane amounts of reading and completely unguided writing assignments that are completely overseen by a TA who has never met me. I tried going to office hours and working with her, but she was a brutal grader and graded my final exam and final essay hella harshly with zero feedback. I want to email her but I know I will she will snap at me. It is pointless to email the professor, as he has overseen NONE of the writing assignments of process. This class is so disconnected and I learned nothing despite all the work I did. At least in person you get something out of it, but this class was a waste of everyones time and hurt my GPA in the process. This doesn't help anyone and theres nothing I can really do, im just venting because if this was any other class, I could deal with this systematically but due to the horrible administration and running of MMW, it is truly one of the worst at UCSD.",1599715931,1,0
I haven't completed my Gen Ed requirements yet but will before transferring.,"In my transfer application, it asks me if i have completed the UC General Education requirements yet. I have not, but I've only been in college for 1 year and I'm going into my 2nd year at my current school. I am however, planning to complete them this school year, so would I put ""yes"" where it asks me if I've completed them yet?",1599712706,1,0
Is it possible to double major as a transfer?,I’m applying as a transfer student for next fall as a Cognitive Science major (specifically the machine learning and neural computation track). I would also like to double major in Applied Mathematics. Is this possible to do and still graduate within the next 2 years? Also I heard the the math department is capped so would they even accept double majors?,1599711975,1,0
How do I know if my courses at one UC will transfer to another?,I’m currently a student at UC Davis and I’m looking to transfer to UCSD next fall. How do I know if the courses i’m taking here at UCD will transfer to UCSD? I really don’t want to have to repeat a lot of courses and stay longer than I have to,1599711828,1,0
"New PhD student here, what do you recommend I do to familiarize myself with La Jolla/UCSD and make it my home?","I lived on the other side of the country and just moved to grad housing last week and have been quarantining most of the time. Occasionally, I will take a walk to campus around 6am when I know I won’t bump into anyone. I don’t have a roommate, most of my cohort isn’t planning to be in SD and I know no one in the west coast - so it is a little lonely. 

I am well aware most of my time will be spent on studying, TA-ing and researching but I believe mental health is important. I feel very out of place in SD and want to make this place my home because I will be here for five years! Tips and tricks? Thank you! :)",1599708810,1,0
Revelle positives,"After all the disdain college students are getting for spreading COVID, it appears that the positive waste water result was due to staff according to Khosla’s email. Of 368 students and 279 employees tested, 2 employees were the only positives.",1599704713,1,0
Update on the Revelle wastewater: 2 positive cases out of 547 tests!,,1599704612,1,0
Transfer to other colleges,"If a student wants to transfer to other 4-year colleges outside california., some of those colleges need Professor reco letters,  registrar reports etc., Does UCSD help students to accommodate those needs? Any prior experience ?",1599704505,1,0
Is it manageable to work 25 hours a week,[removed],1599703817,1,0
Parent Plus Loan?!,so i just realized that we have to accept aid by today and the first payment for fall is due later this month on the 25th. will a parent plus loan come in on time for that payment? i’d hate to have late fees :(,1599699594,1,0
Is there any way I can get a job on campus?,"I'm transfer who worked part time in my community college and want to do so again for UCSD. I checked the Handshake website, but all I found was a bunch of full-time jobs and internships, which I don't think I can do. Do you guys know where I can ask for a position in the school as a student worker?",1599699316,1,0
Bimm 100,Who should I take? Amy Pasquinelli or Heidi-Cook Anderson?,1599698542,1,0
desgn 119,[removed],1599697935,1,0
Professional Certifications - Engineering,"Professional Certifications - Engineering

EIT/FE - ME/ARO/CE

Review/Crash Course .pdf’s per subject. 
Practice Exams
Practice Problems
Sample Exam

———

PE - Civil Engineering Breadth Course

Review per topic
Practice Problem

———
GD&amp;T

Actual videos from Training Facility (Not YouTube!)
Books
Practice Problem
Word document with a ton of useful links

——-

Six Sigma

5 big courses included from training facilities. All on six sigma.

Includes all DMAIC principles

Project Management

Statistical Analysis

Quality Engineering

Principles of Lean Manufacturing

——

Project Management

Introduction to PM via PowerPoints

Comprehensive Books on different aspects of PM

Flip card book for practicing exam

Practice exams

———

In conclusion these resources are not a Statics book or Statics notes. These are great skills to add to your resume. 

These skills distinguish you from a green/fresh engineer to an engineering graduate with some sense of what goes on in industry...

You can put that you took Statics, Dynamics, strength of materials, hydraulics etc...but in reality having PM or Six Sigma on your resume makes you a stronger candidate...

Same goes with having Solidworks, inventor and drawing creating on your resume. Knowing how to extrude on a program is the simple part. Understanding the technical language of GD&amp;T makes you an asset. You can communicate with a fabrication shop/machinist and bring revenue to the company.

I welcome anyone to challenge what I am saying...a jack of all trades engineer is more of an asset then an engineer that just does Statics problems from a book.

Take all drives for a small donation. Keeping it real with all of you.",1599697872,1,0
DSGN 119,[removed],1599697868,1,0
BIMM 100,[removed],1599697256,1,0
Academic Integrity Violation,[removed],1599695753,1,0
"600 UC San Diego students, faculty ask university to drop plans to reopen campus",,1599691506,1,0
Grading scale,"Hi everyone,  I was wondering if professors have to follow the university's grading scale when inputting grades on tritonlink? I just took a class this ss2 and got a 92 which is an A according to the syllabus (A: 90-100). But the grade I received on tritonlink is an A-. Should I contact the professor or just leave it? Any advice is appreciated!",1599690980,1,0
CHEM 126A,[removed],1599685438,1,0
How long to get results from campus?,"Does anyone know how long it takes to get Covid test results from campus? I’m going to visit family and want to make sure I don’t have covid but I’m not sure how fast I will get results since the one from campus is free. 

Does anybody know?",1599681818,1,0
"For those of you on campus, what has your WiFi connection been like?","For me, it’s been extremely frustrating. My phone disconnects *constantly* and I need to log in with my SSO multiple times a day (and I don’t have private addresses turned on or anything). The connection on my laptop gets extremely slow during the day to the point where I have a hard time understanding what’s being said during zoom meetings because people keep cutting out. I’m in Argo, and since the building is made of concrete, the phone and WiFi is bad everywhere. It’s impossible to hold a FaceTime call for more than 10 minutes at a time without it dropping. Dear lord, I would give anything for the Ethernet in my room to work.

How has it been for everyone else? Are my devices just cursed, or is it just as bad for everyone else?

/rant",1605207528,1,0
inspiring daily words,i love how one of my profs tells us in almost every lecture that if we stopped being lazy and used our brains we wouldn't need him to lecture bc the material should be common sense \^0\^ &lt;33333,1605206982,1,0
Hammock or Tesler for Math 20C?,"I’m pretty neutral on both, but who’s easier?",1605206296,1,0
Health Ambassadors,"Will UCSD be hiring any new yellow shirt health ambassadors for winter quarter? They aren’t currently hiring, correct?",1605206023,1,0
UCSD Virtual Student Org Fair going on now! (Must use student login),,1605205981,1,0
Question for UCSD hiring,"Question regarding UCSD hiring process for any faculty or someone who’s been through the process: I applied for a position (several, actually) and saw that my application status was marked as “Application Processed” which was different from all the others that were marked as “Application Received”. I interpreted that as my application having been at least scored and considered by HR..is that right? I also noticed that as of today, my application was updated once again to “Application received” and the deadline for applications was extended. Does this mean I’m no longer being considered (if I ever even was) or is this common? The job first became available over a month ago and I know UCSD is notorious for long application periods. Insight would be appreciated.",1605203226,1,0
Seniors what's your enrollment appointment date?,Just curious.,1605202962,1,0
experience with new ECE 45 prof Nick Antipa?,I was thinking if I should take ECE 45 with ZEGER (I heard not so good things about him) or I should wait for next quarter with Nick Antipa. I heard he was an assistant prof.,1605202504,1,0
Best prof for PHYS 2D and/or experience with Sharma Vivek?,\^,1605202337,1,0
Am i the only one chilling?,"im reading all these posts about u guys dying from stress and all that and i just cant relate...im a freshman off campus, taking 4 classes, and im doing 100% fine. i actually like the online format because i can be as comfortable as i want during lectures...slurping down cup noodles while the professor explains why racism is bad. easy work . I admit i was a sloppy student in high school, i only got into UCSD off the waitlist and because of all the internationals leaving due to corona, but i've been working to improve my study skills and thats got me cruising through the quarter. 


Although I am annoyed at how much busywork there is, I'd rather study with my own methods. 


who else chillin?",1605201195,1,0
Winter quarter move in,"Hey I am a freshman and I haven't actually moved to campus yet, I think all my classes (except 1 hybrid class) is remote. Do you guys think it is worth it to move into campus? (ps I am an international student)",1605199669,1,0
Labs online,"Hey, for the people who took labs online - specifically a Biology Lab, which one did you take, how was it, was it too much work? I’m figuring out my schedule and I’m wondering if I should fill it up with a Lab or save it if in person ever happens lol.",1605198335,1,0
Looking for a Non-STEM Course Recommendation,"I used to be one of those people who thought STEM was the only thing worth studying- but after taking a gender studies course at UCSD my entire view of the world changed. I know that sounds cliche or whatever, but it really did make me see the world as more than just a binary of stem vs non-stem disciplines. And as ""weird"" as taking a gender studies course sounded to me before, it really made me realize how things like gender/race affect literally everything/everyone.

Humanities majors out here, do you have any other course recommendations for me? I just want to expand my mindset as much as possible and try to become a better person.",1605197296,1,0
Tips after not sleeping?,"I didn't sleep last night, not for any particular reason, just couldn't sleep so I figured I might as well do some homework.

It's currently 6 am, and I'm starting to feel tired, but I'm worried I'm going to fall asleep during the day and screw up my sleep schedule (not that I really had one anyway). 

What should I do? Try to get through today without sleeping to go to bed early tonight? Or just go to bed now?",1605189174,1,0
MAE 170 in Spring?,Does anybody know if MAE 170 is offered in Spring or only Fall? I am taking PHYS 2CL right now which is a prereq for MAE 170. I need to take MAE 170 at some point but I know it isn't offered in Winter.,1605181234,1,0
How's CSE 11 (with Cao / in general)?,"Not like there's a choice for profs anyway lmao but I'm just kinda curious. I've heard that CSE 11 is either decent or the worst weeder CS course you'll ever take, so I'd love to hear some more stories/perspectives :D

(Ik similar questions have been asked before but the responses are usually from 2+ yrs ago so I was hoping for some newer answers)",1605179329,1,0
I really feel bad for the people who are just starting college in the current climate,"Dawg I’ve been in this bitch for about 4 years and “adjusted to the quarter system”. But I’m really having a hard time staying motivated and whatnot. 

So I can’t imagine how it is for people who are just settling in (but if you are doing just fine then keep it up lol).",1605172002,1,0
Dental Services On Campus?,"Are there dental services provided on campus? If so, that I can use non-UCSHIP insurance at? Need to get my teeth checked out and want to know what’s available! 

If not the case, any recommendations for a good place to go to for a simple check-up near campus?",1605171688,1,0
Remote upper div chem lab?,What upper div chem lab would you guys say has transitioned the best to remote learning?,1605171107,1,0
What is BILD 4 like remote?,"Is it mandatory to attend the entire lab time? Lo, Mel, and Reuther are teaching next quarter so any insight appreciated. Thank you.",1605168329,1,0
Math 10B Professors,Can anyone recommend what professor to take for Math 10B during winter quarter? Everyone seems to have bad reviews. :(,1605164789,1,0
International Business or Business Psych?,I’m currently a second year Human Bio major and I really wanna switch! I’m looking to start my own business but I don’t know which major to declare. Which major would be more beneficial for what I want to do?? I’m kinda bad at math btw!,1605164188,1,0
"Eds 23, Ltwr 8A, Lten 140",Has anyone taken these classes online? Or just in general lol what are they like ?,1605164054,1,0
Summer Session,How does/will summer session work? Do you just enroll in classes like any other quarter or is there a special applying process? Does financial aid work differently? If you sign up for one session do you have to sign up for the other one? What's the general amount of classes you should take? And finally do y'all think it'll still be online this summer? Thanks in advance!,1605163799,1,0
What happens to mail delivered on a holiday?,"Had a package that says it was delivered today, but the mail center was closed due to Veteran's day. Does anyone know what happened to my package? Hope they didn't just leave it on the floor outside of the mail center. I'm in Nuevo east grad housing, and it was sent via DHL if that matters.",1605163700,1,0
Best MGT 172 Prof?,Between Zimmerman and Hedges,1605159212,1,0
"EDS 23, LTWR 8A, LTEU 140",[removed],1605158757,1,0
Is a registration appointment time on Nov 20th at 7:20pm late??,"Just wanna know what other people have or am I rlly screwed?

thanks",1605158691,1,0
Is there any repercussions for not taking a full class load?,"I took 17 units this quarter and it’s so draining, I’m seriously considering taking 10 units next quarter I was just wondering if there are really any repercussions for doing that? 

Sincerely,
A freshman that took a bigger bite then they could chew",1605157981,1,0
Has anybody taken CAT 125R?,How was the class? And who did you take? Just need some opinions,1605157341,1,0
pls don’t let me be the only one who relates to this,,1605153734,1,0
ERC Easiest Quantitative &amp; Formal Skills Course?,"I was wondering what the easiest and/or most interesting Quantitative &amp; Formal Skills courses that fulfilled ERC's GE requirements were. I am not a STEM major and am rather horrible at STEM, so I was wondering if anyone had recommendations for classes that fulfilled this req that were not too big brain.

Essentially, I am wondering what would classes would be the best option for someone completely dumb and horrible at math. 

*Sidenote: I have taken PHIL 10 and found it to be relatively okay, so I just need to get through one more but do not know which*.",1605152912,1,0
Can professors please stop giving useless busy work,It takes away from time I could spend learning in a more productive way.,1605152466,1,0
WINTER QUARTER SCHEDULING QUESTIONS MEGATHREAD,"Howdy yall!

Winter Quarter Schedule of Classes along with appointment times are out! Please keep any questions about class scheduling in this sibreddit.

Thanks!",1605152328,1,0
MGT 103 and MGT 121a,"I have the option to choose between these classes, does anyone have any insight on either one?",1605152226,1,0
Difficulty of MATH 20D/CSE 20,"Hi, I'm a first year student intending to transfer to ECE - Computer Engineering. I'm planning to take 4 classes in winter. I have already decided to take:

1. CSE 11
2. ECE 35
3. HILD 2B (P/NP probably)

I need one more class right now, and I'm considering between MATH 20D/CSE 20. Which one is easier between these two? Considering I'm taking ECE 35 (notorious for its difficulty),  is it wise to take another STEM class?",1605151970,1,0
"ETHN 125 w/ Sasaki, HIEA 155 w/ Muscolino, or HIEA 144 w/ Henry?","Unless anyone else has a different non-social science upper div GE they'd like to recommend?

Based on the course titles, these seem like classes I'd be interested in. The ratings for the professors are around the same score, but I'm not sure what the workload for these classes is like.",1605151905,1,0
Planning for COGS 9 and DSC 20 Winter 2021,Does anyone know if either COGS 9 with Voytek or DSC 20 with Langlois is asynchronous next quarter? I'm trying to take both classes in one quarter but it's showing up as conflicting on webreg and they only have the same single timeslots for both classes. Thanks!,1605151873,1,0
Guy Bertrand or Jerry Yang for CHEM 40A?,Would you please tell me which professor I should take and why? Which is easier?,1605151825,1,0
Are you ok?,,1605151742,1,0
PSYC 2 w/ Dickenson or COGS 17 w/ Kiyonaga?,"I'm planning on taking both either way to fulfill my natural science courses requirement, but I wanted to know how these professors have been teaching their courses.",1605151104,1,0
PSYC 70 w/ Steiner or Geller?,"Both have good reviews on ratemyprofessors and have similar CAPE results as well.

Does one of them make the class easier or teach better?",1605150942,1,0
BILD 2 professors,"Su, chip-ying vs Schroeder, Julian, Vs park ji young
Which professor do you recommend for BILD 2 next quarter? How’s the workloads and study tips?",1605150212,1,0
MATH 180A with Benson Au,Hi! Can someone tell me what the structure of Au's class is? Does he do weekly quizzes? Midterms? A final? Thank you in advance!,1605150120,1,0
Math 10B,[removed],1605148651,1,0
Winter course help!,i NEED to take math 20c and dsc 10 next quarter but im a first year in revelle so I want to take hum 1 as well. I get that hum1 fills up quick but I need good teachers for 20c and dsc 10 because i need good grades in those to switch majors. The other class i wanna take is dsc 96 but im not too worried abt second passing that. Does anyone have any advice on which to first and second pass?,1605148044,1,0
Survey for my Design class (please help),"Hey everyone! For class I need to gather preliminary data for a mobile app design and have made a survey here: 

[https://forms.gle/iGzGqjANnybnsnUm7](https://forms.gle/iGzGqjANnybnsnUm7)

I need at least 50 responses and would greatly appreciate if you all would take it!",1605147635,1,0
Social Media &amp; Poverty Awareness Survey,"If you all have a few minutes, can you please fill out a quick 14-question survey regarding social media &amp; poverty awareness. The survey is anonymous. It would help out tons for our class research paper. Thank you!

[https://s.surveyplanet.com/hEJDCoQWG](https://s.surveyplanet.com/hEJDCoQWG)",1605147318,1,0
Activism in your Community - Survey for my design class,[removed],1605147313,1,0
Take math 20D or 20E first and which prof for each,"The options for 20 d and e are below. Basically which one I should take first and which prof

For math 20D the professors that are teaching are 
Brandon Alberts, Natalie Tammam, Kisun Lee, Emmanuel Vavalis

For 20E, its Jiri Lebl, Justin Roberts and Mohandas Phillai.",1605146812,1,0
WCWP 10B Online,"For those who took 10B remotely how was the experience? I took 10A in person, but I've been putting off taking 10B because I didn't want to take it online.",1605146176,1,0
How big are the Triton Togo containers compared to previous containers?,Should I order multiple containers if I order many items or is it big enough to fit a lot of food?,1605146127,1,0
Any Marshall Cell and MOlecular Bio majors here?,"Per the title, if you don't mind me hitting up your DMs cuz I have couple questions I want answered.",1605145653,1,0
